"id","name","name@es","code","account_type","reconcile"
"account_common_4309","Trade receivables, pending invoices","Clientes, facturas pendientes de recibir o de formalizar","4309","asset_receivable","True"
"account_common_4310","Trade bills in portfolio","Efectos comerciales en cartera","4310","asset_receivable","True"
"account_common_4311","Discounted trade bills","Efectos comerciales descontados","4311","asset_receivable","True"
"account_common_4312","Trade bills in debt collection management","Efectos comerciales en gestión de cobro","4312","asset_current","True"
"account_common_4315","Past due trade bills","Efectos comerciales impagados","4315","asset_receivable","True"
"account_common_432","Trade receivables, factoring","Clientes, operaciones de factoring","432","asset_receivable","True"
"account_common_4330","Trade receivables, group companies (euros)","Clientes empresas del grupo (euros)","4330","asset_receivable","True"
"account_common_4331","Trade bills receivable, group companies","Efectos comerciales a cobrar, empresas del grupo","4331","asset_receivable","True"
"account_common_4332","Trade receivables, group companies, factoring","Clientes empresas del grupo, operaciones de factoring","4332","asset_receivable","True"
"account_common_4334","Trade receivables, group companies (foreign currency)","Clientes empresas del grupo (moneda extranjera)","4334","asset_receivable","True"
"account_common_4336","Doubtful trade receivables, group companies","Clientes empresas del grupo de dudoso cobro","4336","asset_receivable","True"
"account_common_4337","Containers and packaging returnable to customers, group companies","Envases y embalajes a devolver a clientes, empresas del grupo","4337","asset_receivable","True"
"account_common_4339","Trade receivables, group companies, pending invoices","Clientes empresas del grupo, facturas pendientes de formalizar","4339","asset_receivable","True"
"account_common_434","Trade receivables, associates","Clientes, empresas asociadas","434","asset_receivable","True"
"account_common_435","Trade receivables, other related parties","Clientes, otras partes vinculadas","435","asset_receivable","True"
"account_common_436","Doubtful trade receivables","Clientes de dudoso cobro","436","asset_receivable","True"
"account_common_437","Containers and packaging returnable by customers","Envases y embalajes a devolver por clientes","437","asset_receivable","True"
"account_common_438","Advance from customers","Anticipos de clientes","438","liability_current","True"
"account_common_4400","Receivables (euros)","Deudores (euros)","4400","asset_receivable","True"
"account_common_4404","Receivables (foreign currency)","Deudores (moneda extranjera)","4404","asset_receivable","True"
"account_common_4409","Receivables, pending invoices","Deudores, facturas pendientes de formalizar","4409","asset_receivable","True"
"account_common_4410","Receivables, trade bills in portfolio","Deudores, efectos comerciales en cartera","4410","asset_receivable","True"
"account_common_4411","Receivables, discounted trade bills","Deudores, efectos comerciales descontados","4411","asset_receivable","True"
"account_common_4412","Receivables, trade bills in debt collection management","Deudores, efectos comerciales en gestión de cobro","4412","asset_receivable","True"
"account_common_4415","Receivables, past due trade bills","Deudores, efectos comerciales impagados","4415","asset_receivable","True"
"account_common_446","Doubtful receivables","Deudores de dudoso cobro","446","asset_receivable","True"
"account_common_449","Receivables for profit-sharing agreements","Deudores por operaciones en común","449","asset_receivable","True"
"account_common_460","Salary advances","Anticipos de remuneraciones","460","asset_receivable","True"
"account_common_465","Salaries payable","Remuneraciones pendientes de pago","465","liability_payable","True"
"account_common_4700","VAT recoverable","Hacienda Pública, deudora por IVA","4700","asset_current","True"
"account_common_4708","Grants receivable","Hacienda Pública, deudora por subvenciones concedidas","4708","asset_current","True"
"account_common_4709","Recoverable taxes","Hacienda Pública, deudora por devolución de impuestos","4709","asset_current","True"
"account_common_471","Social Security, receivables","Organismos de la Seguridad Social, deudores","471","asset_current","False"
"account_common_472","Input VAT","Hacienda Pública. IVA soportado","472","asset_current","False"
"account_common_473","Withholdings and payments on account","Hacienda Pública, retenciones y pagos a cuenta","473","asset_current","True"
"account_common_4740","Assets arising from deductible temporary differences","Activos por diferencias temporarias deducibles","4740","asset_non_current","False"
"account_common_4742","Rights to tax deductions and credits pending application","Derechos por deducciones y bonificaciones pendientes de aplicar","4742","asset_non_current","False"
"account_common_4745","Tax loss carryforwards","Crédito por pérdidas a compensar del ejercicio","4745","asset_non_current","False"
"account_common_4750","Taxation authorities, taxes payable","Hacienda Pública, acreedora por IVA","4750","liability_current","True"
"account_common_4751","Taxation authorities, withholding tax","Hacienda Pública, acreedora por retenciones practicadas","4751","liability_current","True"
"account_common_4752","Taxation authorities, income tax payable","Hacienda Pública, acreedora por impuesto sobre sociedades","4752","liability_current","True"
"account_common_4758","Taxation authorities, repayable grants","Hacienda Pública, acreedora por subvenciones a reintegrar","4758","liability_current","True"
"account_common_4759","Taxation authorities, credit for other concepts","Hacienda Pública, acreedora por otros conceptos","4759","liability_current","False"
"account_common_476","Social security, payables","Organismos de la Seguridad Social, acreedores","476","liability_current","False"
"account_common_477","Taxation authorities, output VAT","Hacienda Pública. IVA repercutido","477","liability_current","False"
"account_common_479","Liabilities arising from taxable temporary differences","Pasivos por diferencias temporarias imponibles","479","liability_non_current","False"
"account_common_480","Prepaid expenses","Gastos anticipados","480","asset_current","False"
"account_common_485","Deferred income","Ingresos anticipados","485","liability_current","False"
"account_common_4933","Impairment of trade receivables from group companies","Deterioro de valor de créditos por operaciones comerciales con empresas del grupo","4933","liability_current","True"
"account_common_4934","Impairment of trade receivables from associates","Deterioro de valor de créditos por operaciones comerciales con empresas asociadas","4934","liability_current","True"
"account_common_4935","Impairment of trade receivables from other related parties","Deterioro de valor de créditos por operaciones comerciales con otras partes vinculadas","4935","liability_current","True"
"account_common_4994","Provision for onerous contracts","Provisión por contratos onerosos","4994","liability_current","True"
"account_common_4999","Provision for other trade operations","Provisión para otras operaciones comerciales","4999","liability_current","True"
"account_common_500","Current bonds and obligations","Obligaciones y bonos a corto plazo","500","liability_current","False"
"account_common_502","Current liability-classified shares or equity holdings","Acciones o participaciones a corto plazo consideradas como pasivos financieros","502","liability_current","False"
"account_common_505","Other current marketable securities","Deudas representadas en otros valores negociables a corto plazo","505","liability_current","False"
"account_common_506","Current interest on debentures and similar issues","Intereses a corto plazo de empréstitos y otras emisiones análogas","506","liability_current","False"
"account_common_507","Dividends payable on liability-classified instruments","Dividendos de acciones o participaciones consideradas como pasivos financieros","507","liability_current","False"
"account_common_5090","Redeemed bonds and obligations","Obligaciones y bonos amortizados","5090","liability_current","True"
"account_common_5095","Other redeemed marketable securities","Otros valores negociables amortizados","5095","liability_current","True"
"account_common_5103","Current debt with financial institutions, group companies","Deudas a corto plazo con entidades de crédito, empresas del grupo","5103","liability_current","False"
"account_common_5104","Current debt with financial institutions, associates","Deudas a corto plazo con entidades de crédito, empresas asociadas","5104","liability_current","False"
"account_common_5105","Current debt with other related financial institutions","Deudas a corto plazo con otras entidades de crédito vinculadas","5105","liability_current","False"
"account_common_5113","Current payables to suppliers of fixed assets, group companies","Proveedores de inmovilizado a corto plazo, empresas del grupo","5113","liability_current","False"
"account_common_5114","Current payables to suppliers of fixed assets, associates","Proveedores de inmovilizado a corto plazo, empresas asociadas","5114","liability_current","False"
"account_common_5115","Current payables to suppliers of fixed assets, other related parties","Proveedores de inmovilizado a corto plazo, otras partes vinculadas","5115","liability_current","False"
"account_common_5123","Current finance lease payables, group companies","Acreedores por arrendamiento financiero a corto plazo, empresas del grupo","5123","liability_current","False"
"account_common_5124","Current finance lease payables, associates","Acreedores por arrendamiento financiero a corto plazo, empresas asociadas","5124","liability_current","False"
"account_common_5125","Current finance lease payables, other related parties","Acreedores por arrendamiento financiero a corto plazo, otras partes vinculadas","5125","liability_current","False"
"account_common_5133","Other current payables, group companies","Otras deudas a corto plazo con empresas del grupo","5133","liability_current","False"
"account_common_5134","Other current payables, associates","Otras deudas a corto plazo con empresas asociadas","5134","liability_current","False"
"account_common_5135","Other current payables, other related parties","Otras deudas a corto plazo con otras partes vinculadas","5135","liability_current","False"
"account_common_5143","Current interest on payables, group companies","Intereses a corto plazo de deudas con empresas del grupo","5143","liability_current","False"
"account_common_5144","Current interest on payables, associates","Intereses a corto plazo de deudas con empresas asociadas","5144","liability_current","False"
"account_common_5145","Current interest on payables, other related parties","Intereses a corto plazo de deudas con otras partes vinculadas","5145","liability_current","False"
"account_common_5200","Current loans from financial institutions","Préstamos a corto plazo de entidades de crédito","5200","liability_current","True"
"account_common_5201","Current payables for drawdowns on credit facilities","Deudas a corto plazo por crédito dispuesto","5201","liability_current","True"
"account_common_5208","Payables, discounted trade bills","Deudas por efectos descontados","5208","liability_current","True"
"account_common_5209","Payables, factoring","Deudas por operaciones de “factoring”","5209","liability_current","True"
"account_common_521","Current payables","Deudas a corto plazo","521","liability_current","False"
"account_common_522","Current payables convertible into grants, donations and bequests","Deudas a corto plazo transformables en subvenciones, donaciones y legados","522","liability_current","False"
"account_common_523","Current payables to suppliers of fixed assets","Proveedores de inmovilizado a corto plazo","523","liability_payable","True"
"account_common_524","Current finance lease payables","Acreedores por arrendamiento financiero a corto plazo","524","liability_current","False"
"account_common_525","Current bills payable","Efectos a pagar a corto plazo","525","liability_current","False"
"account_common_526","Dividend payable","Dividendo activo a pagar","526","liability_payable","True"
"account_common_527","Current interest on debt with financial institutions","Intereses a corto plazo de deudas con entidades de crédito","527","liability_current","False"
"account_common_528","Current interest on payables","Intereses a corto plazo de deudas","528","liability_current","False"
"account_common_5290","Current provisions for employee benefits","Provisión a corto plazo por retribuciones al personal","5290","liability_current","True"
"account_common_5291","Current provisions for taxes","Provisión a corto plazo para impuestos","5291","liability_current","True"
"account_common_5292","Current provisions for other liabilities","Provisión a corto plazo para otras responsabilidades","5292","liability_current","True"
"account_common_5293","Current provisions for dismantlement, removal or restoration of fixed assets","Provisión a corto plazo por desmantelamiento, retiro o rehabilitación del inmovilizado","5293","liability_current","True"
"account_common_5295","Current provisions for environmental actions","Provisión a corto plazo para actuaciones medioambientales","5295","liability_current","True"
"account_common_5303","Current investments in group companies","Participaciones a corto plazo en empresas del grupo","5303","asset_current","False"
"account_common_5304","Current investments in associates","Participaciones a corto plazo en empresas asociadas","5304","asset_current","False"
"account_common_5305","Current investments in other related parties","Participaciones a corto plazo en otras partes vinculadas","5305","asset_current","False"
"account_common_5313","Current debt securities of group companies","Valores representativos de deuda a corto plazo de empresas del grupo","5313","asset_current","False"
"account_common_5314","Current debt securities of associates","Valores representativos de deuda a corto plazo de empresas asociadas","5314","asset_current","False"
"account_common_5315","Current debt securities of other related parties","Valores representativos de deuda a corto plazo de otras partes vinculadas","5315","asset_current","False"
"account_common_5323","Current loans to group companies","Créditos a corto plazo a empresas del grupo","5323","asset_current","False"
"account_common_5324","Current loans to associates","Créditos a corto plazo a empresas asociadas","5324","asset_current","False"
"account_common_5325","Current loans to other related parties","Créditos a corto plazo a otras partes vinculadas","5325","asset_current","False"
"account_common_5333","Current interest on debt securities of group companies","Intereses a corto plazo de valores representativos de deuda de empresas del grupo","5333","asset_current","False"
"account_common_5334","Current interest on debt securities of associates","Intereses a corto plazo de valores representativos de deuda de empresas asociadas","5334","asset_current","False"
"account_common_5335","Current interest on debt securities of other related parties","Intereses a corto plazo de valores representativos de deuda de otras partes vinculadas","5335","asset_current","False"
"account_common_5343","Current interest on loans to group companies","Intereses a corto plazo de créditos a empresas del grupo","5343","asset_current","False"
"account_common_5344","Current interest on loans to associates","Intereses a corto plazo de créditos a empresas asociadas","5344","asset_current","False"
"account_common_5345","Current interest on loans to other related parties","Intereses a corto plazo de créditos a otras partes vinculadas","5345","asset_current","False"
"account_common_5353","Dividend receivable from group companies","Dividendo a cobrar de inversiones financieras en empresas del grupo","5353","asset_current","False"
"account_common_5354","Dividend receivable from associates","Dividendo a cobrar de inversiones financieras en empresas asociadas","5354","asset_current","False"
"account_common_5355","Dividend receivable from other related parties","Dividendo a cobrar de inversiones financieras en otras partes vinculadas","5355","asset_current","False"
"account_common_5393","Current uncalled equity holdings in group companies","Desembolsos pendientes sobre participaciones a corto plazo en empresas del grupo","5393","asset_current","False"
"account_common_5394","Current uncalled equity holdings in associates","Desembolsos pendientes sobre participaciones a corto plazo en empresas asociadas","5394","asset_current","False"
"account_common_5395","Current uncalled equity holdings in other related parties","Desembolsos pendientes sobre participaciones a corto plazo en otras partes vinculadas","5395","asset_current","False"
"account_common_540","Current investments in equity instruments","Inversiones financieras a corto plazo en instrumentos de patrimonio","540","asset_current","False"
"account_common_541","Current debt securities","Valores representativos de deuda a corto plazo","541","asset_current","False"
"account_common_542","Current loans","Créditos a corto plazo","542","asset_current","False"
"account_common_543","Current loans for disposal of fixed assets","Créditos a corto plazo por enajenación de inmovilizado","543","asset_current","False"
"account_common_544","Current loans to personnel","Créditos a corto plazo al personal","544","asset_current","False"
"account_common_545","Dividend receivable","Dividendo a cobrar","545","asset_current","False"
"account_common_546","Current interest on debt securities","Intereses a corto plazo de valores representativos de deudas","546","asset_current","False"
"account_common_547","Current interest on loans","Intereses a corto plazo de créditos","547","asset_current","False"
"account_common_548","Current deposits","Imposiciones a corto plazo","548","asset_current","False"
"account_common_549","Current uncalled equity holdings","Desembolsos pendientes sobre participaciones en el patrimonio neto a corto plazo","549","asset_current","False"
"account_common_550","Current account with owner","Titular de la explotación","550","asset_current","False"
"account_common_5523","Current account with group companies","Cuenta corriente con empresas del grupo","5523","asset_current","False"
"account_common_5524","Current account with associates","Cuenta corriente con empresas asociadas","5524","asset_current","False"
"account_common_5525","Current account with other related parties","Cuenta corriente con otras partes vinculadas","5525","asset_current","False"
"account_common_554","Current account with temporary joint ventures and co-ownerships","Cuenta corriente con uniones temporales de empresas y comunidades de bienes","554","asset_current","False"
"account_common_555","Items pending application","Partidas pendientes de aplicación","555","liability_current","False"
"account_common_5563","Called-up equity holdings, group companies","Desembolsos exigidos sobre participaciones, empresas del grupo","5563","liability_current","False"
"account_common_5564","Called-up equity holdings, associates","Desembolsos exigidos sobre participaciones, empresas asociadas","5564","liability_current","False"
"account_common_5565","Called-up equity holdings, other related parties","Desembolsos exigidos sobre participaciones, otras partes vinculadas","5565","liability_current","False"
"account_common_5566","Called-up equity holdings of other companies","Desembolsos exigidos sobre participaciones de otras empresas","5566","liability_current","False"
"account_common_557","Interim dividend","Dividendo activo a cuenta","557","asset_current","False"
"account_common_5580","Receivable on called-up ordinary shares or equity holdings","Socios por desembolsos exigidos sobre acciones o participaciones ordinarias","5580","asset_current","False"
"account_common_5585","Receivable on called-up liability-classified shares or equity holdings","Socios por desembolsos exigidos sobre acciones o participaciones consideradas como pasivos financieros","5585","liability_current","False"
"account_common_5590","Current assets arising from derivative financial instruments, trading portfolio","Activos por derivados financieros a corto plazo, cartera de negociación","5590","asset_current","False"
"account_common_5595","Current liabilities arising from derivative financial instruments, trading portfolio","Pasivos por derivados financieros a corto plazo, cartera de negociación","5595","liability_current","False"
"account_common_560","Current guarantees received","Fianzas recibidas a corto plazo","560","liability_current","False"
"account_common_561","Current deposits received","Depósitos recibidos a corto plazo","561","liability_current","False"
"account_common_565","Current guarantees extended","Fianzas constituidas a corto plazo","565","asset_current","False"
"account_common_566","Current deposits extended","Depósitos constituidos a corto plazo","566","asset_current","False"
"account_common_567","Prepaid interest","Intereses pagados por anticipado","567","asset_current","False"
"account_common_568","Unearned interest received","Intereses cobrados por anticipado","568","liability_current","False"
"account_common_570","Cash, euros","Caja, euros","570","asset_cash","False"
"account_common_571","Cash, foreign currencies","Caja, moneda extranjera","571","asset_cash","False"
"pgc_572_child","Banks and financial institutions, demand current accounts, euros","Bancos e instituciones de crédito c/c vista, euros","572","asset_cash","False"
"account_common_572998","Transitory account","Cuenta transitoria","572998","asset_current","False"
"account_common_573","Banks and financial institutions, demand current accounts, foreign currency","Bancos e instituciones de crédito c/c vista, moneda extranjera","573","asset_cash","False"
"account_common_574","Banks and financial institutions, saving accounts, euros","Bancos e instituciones de crédito, cuentas de ahorro, euros","574","asset_cash","False"
"account_common_575","Banks and financial institutions, saving accounts, foreign currency","Bancos e instituciones de crédito, cuentas de ahorro, moneda extranjera","575","asset_cash","False"
"account_common_576","Short-term highly-liquid investments","Inversiones a corto plazo de gran liquidez","576","asset_current","False"
"account_common_5933","Impairment of current investments in group companies","Deterioro de valor de participaciones a corto plazo en empresas del grupo","5933","asset_current","False"
"account_common_5934","Impairment of current investments in associates","Deterioro de valor de participaciones a corto plazo en empresas asociadas","5934","asset_current","False"
"account_common_5943","Impairment of current debt securities of group companies","Deterioro de valor de valores representativos de deuda a corto plazo de empresas del grupo","5943","asset_current","False"
"account_common_5944","Impairment of current debt securities of associates","Deterioro de valor de valores representativos de deuda a corto plazo de empresas asociadas","5944","asset_current","False"
"account_common_5945","Impairment of current debt securities of other related parties","Deterioro de valor de valores representativos de deuda a corto plazo de otras partes vinculadas","5945","asset_current","False"
"account_common_5953","Impairment of current loans to group companies","Deterioro de valor de créditos a corto plazo a empresas del grupo","5953","asset_current","False"
"account_common_5954","Impairment of current loans to associates","Deterioro de valor de créditos a corto plazo a empresas asociadas","5954","asset_current","False"
"account_common_5955","Impairment of current loans to other related parties","Deterioro de valor de créditos a corto plazo a otras partes vinculadas","5955","asset_current","False"
"account_common_597","Impairment of current debt securities","Deterioro de valor de valores representativos de deuda a corto plazo","597","asset_current","False"
"account_common_598","Impairment of current loans","Deterioro de valor de créditos a corto plazo","598","asset_current","False"
"account_common_600","Merchandise purchased","Compras de mercaderías","600","expense","False"
"account_common_601","Raw materials purchased","Compras de materias primas","601","expense","False"
"account_common_602","Other supplies purchased","Compras de otros aprovisionamientos","602","expense","False"
"account_common_6060","Prompt payment discounts on merchandise purchased","Descuentos sobre compras por pronto pago de mercaderías","6060","expense","False"
"account_common_6061","Prompt payment discounts on raw materials purchased","Descuentos sobre compras por pronto pago de materias primas","6061","expense","False"
"account_common_6062","Prompt payment discounts on other supplies purchased","Descuentos sobre compras por pronto pago de otros aprovisionamientos","6062","expense","False"
"account_common_607","Subcontracted work","Trabajos realizados por otras empresas","607","expense","False"
"account_common_6080","Returns of merchandise purchased","Devoluciones de compras de mercaderías","6080","expense","False"
"account_common_6081","Returns of raw materials purchased","Devoluciones de compras de materias primas","6081","expense","False"
"account_common_6082","Returns of other supplies purchased","Devoluciones de compras de otros aprovisionamientos","6082","expense","False"
"account_common_6090","""Rappels"" of merchandise purchased","""Rappels"" por compras de mercaderías","6090","expense","False"
