"id","name","name@es","code","account_type","reconcile"
"account_common_101","Assigned capital","Fondo social","101","liability_non_current","False"
"account_common_102","Capital","Capital","102","liability_non_current","False"
"account_common_108","Own shares or equity holdings in special situations","Acciones o participaciones propias en situaciones especiales","108","liability_non_current","False"
"account_common_109","Own shares or equity holdings for reduction of capital","Acciones o participaciones propias para reducción de capital","109","liability_non_current","False"
"account_common_110","Share premium or additional paid-in capital","Prima de emisión o asunción","110","liability_non_current","False"
"account_common_112","Legal reserve","Reserva legal","112","liability_non_current","False"
"account_common_113","Voluntary reserves","Reservas voluntarias","113","liability_non_current","False"
"account_common_1140","Reserves for parent company shares or equity holdings","Reservas para acciones o participaciones de la sociedad dominante","1140","liability_non_current","False"
"account_common_1141","Statutory reserves","Reservas estatutarias","1141","liability_non_current","False"
"account_common_1142","Redeemed capital reserve","Reserva por capital amortizado","1142","liability_non_current","False"
"account_common_1144","Reserves for own shares accepted as collateral","Reservas por acciones propias aceptadas en garantía","1144","liability_non_current","False"
"account_common_118","Contributions from equity holders or owners","Aportaciones de socios o propietarios","118","liability_non_current","False"
"account_common_119","Differences on translation of capital to euros","Diferencias por ajuste del capital a euros","119","liability_non_current","False"
"account_common_131","Capital donations and bequests","Donaciones y legados de capital","131","liability_non_current","False"
"account_common_1370","Deferred tax income on permanent differences","Ingresos fiscales por diferencias permanentes a distribuir en varios ejercicios","1370","liability_non_current","False"
"account_common_1371","Deferred tax income for tax deductions and tax credits","Ingresos fiscales por deducciones y bonificaciones a distribuir en varios ejercicios","1371","liability_non_current","False"
"account_common_141","Provisions for taxes","Provisión para impuestos","141","liability_non_current","True"
"account_common_142","Provisions for other liabilities","Provisión para otras responsabilidades","142","liability_non_current","True"
"account_common_143","Provision for dismantlement, removal or restoration of fixed assets","Provisión por desmantelamiento, retiro o rehabilitación del inmovilizado","143","liability_non_current","True"
"account_common_145","Provision for environmental actions","Provisión para actuaciones medioambientales","145","liability_non_current","True"
"account_common_150","Non-current liability-classified shares or equity holdings","Acciones o participaciones consideradas como pasivos financieros","150","liability_non_current","False"
"account_common_1533","Uncalled share capital or equity holdings, group companies","Desembolsos no exigidos, empresas del grupo","1533","liability_non_current","False"
"account_common_1534","Uncalled share capital or equity holdings, associates","Desembolsos no exigidos, empresas asociadas","1534","liability_non_current","False"
"account_common_1535","Uncalled share capital or equity holdings, other related parties","Desembolsos no exigidos, otras partes vinculadas","1535","liability_non_current","False"
"account_common_1536","Other uncalled share capital or equity holdings","Otros desembolsos no exigidos","1536","liability_non_current","False"
"account_common_1543","Uncalled non-monetary contributions, group companies","Aportaciones no dinerarias pendientes, empresas del grupo","1543","liability_non_current","False"
"account_common_1544","Uncalled non-monetary contributions, associates","Aportaciones no dinerarias pendientes, empresas asociadas","1544","liability_non_current","False"
"account_common_1545","Uncalled non-monetary contributions, other related parties","Aportaciones no dinerarias pendientes, otras partes vinculadas","1545","liability_non_current","False"
"account_common_1546","Other uncalled non-monetary contributions","Otras aportaciones no dinerarias pendientes","1546","liability_non_current","False"
"account_common_1603","Non-current debt with financial institutions, group companies","Deudas con entidades de crédito vinculadas, empresas del grupo","1603","liability_non_current","False"
"account_common_1604","Non-current debt with financial institutions, associates","Deudas con entidades de crédito vinculadas, empresas asociadas","1604","liability_non_current","False"
"account_common_1605","Non-current debt with other related financial institutions","Deudas con otras entidades de crédito vinculadas","1605","liability_non_current","False"
"account_common_1613","Non-current payables to suppliers of fixed assets, group companies","Proveedores de inmovilizado, empresas del grupo","1613","liability_non_current","False"
"account_common_1614","Non-current payables to suppliers of fixed assets, associates","Proveedores de inmovilizado, empresas asociadas","1614","liability_non_current","False"
"account_common_1615","Non-current payables to suppliers of fixed assets, other related parties","Proveedores de inmovilizado, otras partes vinculadas","1615","liability_non_current","False"
"account_common_1623","Non-current finance lease payables, group companies","Acreedores por arrendamiento financiero, empresas de grupo","1623","liability_non_current","False"
"account_common_1624","Non-current finance lease payables, associates","Acreedores por arrendamiento financiero, empresas asociadas","1624","liability_non_current","False"
"account_common_1625","Non-current finance lease payables, other related parties","Acreedores por arrendamiento financiero, otras partes vinculadas","1625","liability_non_current","False"
"account_common_1633","Other non-current payables, group companies","Otras deudas, empresas del grupo","1633","liability_non_current","False"
"account_common_1634","Other non-current payables, associates","Otras deudas, empresas asociadas","1634","liability_non_current","False"
"account_common_1635","Other non-current payables, other related parties","Otras deudas, con otras partes vinculadas","1635","liability_non_current","False"
"account_common_170","Non-current debt with financial institutions","Deudas con entidades de crédito","170","liability_non_current","False"
"account_common_171","Non-current payables","Deudas","171","liability_non_current","False"
"account_common_172","Non-current payables convertible into grants, donations and bequests","Deudas transformables en subvenciones, donaciones y legados","172","liability_non_current","False"
"account_common_173","Non-current payables to suppliers of fixed assets","Proveedores de inmovilizado","173","liability_non_current","False"
"account_common_174","Non-current finance lease payables","Acreedores por arrendamiento financiero","174","liability_non_current","False"
"account_common_175","Non-current bills payable","Efectos a pagar","175","liability_non_current","False"
"account_common_176","Non-current liabilities arising from derivative financial instruments","Pasivos por derivados financieros","176","liability_non_current","False"
"account_common_177","Bonds and obligations","Obligaciones y bonos","177","liability_non_current","False"
"account_common_179","Other marketable securities","Deudas representadas en otros valores negociables","179","liability_non_current","False"
"account_common_180","Non-current guarantees received","Fianzas recibidas","180","liability_non_current","False"
"account_common_181","Advances of long-term sales","Anticipos recibidos por ventas o prestaciones de servicios","181","liability_non_current","False"
"account_common_185","Non-current deposits received","Depósitos recibidos","185","liability_non_current","False"
"account_common_190","Shares or equity holdings issued","Acciones o participaciones emitidas","190","liability_non_current","False"
"account_common_192","Subscribed shares","Suscriptores de acciones","192","liability_non_current","False"
"account_common_194","Issued capital pending registration","Capital emitido pendiente de inscripción","194","liability_non_current","False"
"account_common_195","Liability-classified shares or equity holdings issued","Acciones o participaciones emitidas consideradas como pasivos financieros","195","liability_non_current","False"
"account_common_197","Liability-classified subscribed shares","Suscriptores de acciones consideradas como pasivos financieros","197","liability_non_current","False"
"account_common_199","Liability-classified shares or equity holdings issued pending registration","Acciones o participaciones emitidas consideradas como pasivos financieros pendientes de inscripción","199","liability_non_current","False"
"account_common_200","Research","Investigación","200","asset_fixed","False"
"account_common_201","Development","Desarrollo","201","asset_fixed","False"
"account_common_202","Administrative concessions","Concesiones administrativas","202","asset_fixed","False"
"account_common_203","Industrial property","Propiedad industrial","203","asset_fixed","False"
"account_common_205","Leaseholds","Derechos de traspaso","205","asset_fixed","False"
"account_common_206","Computer software","Aplicaciones informáticas","206","asset_fixed","False"
"account_common_209","Advances for intangible assets","Anticipos para inmovilizaciones intangibles","209","asset_fixed","False"
"account_common_210","Land and natural resources","Terrenos y bienes naturales","210","asset_fixed","False"
"account_common_211","Buildings","Construcciones","211","asset_fixed","False"
"account_common_212","Technical installations","Instalaciones técnicas","212","asset_fixed","False"
"account_common_213","Machinery","Maquinaria","213","asset_fixed","False"
"account_common_214","Equipment","Utillaje","214","asset_fixed","False"
"account_common_215","Other installations","Otras instalaciones","215","asset_fixed","False"
"account_common_216","Furniture","Mobiliario","216","asset_fixed","False"
"account_common_217","Information technology equipment","Equipos para proceso de información","217","asset_fixed","False"
"account_common_218","Motor vehicles","Elementos de transporte","218","asset_fixed","False"
"account_common_219","Other property, plant and equipment","Otro inmovilizado material","219","asset_fixed","False"
"account_common_220","Investment in land and natural resources","Inversiones en terrenos y bienes naturales","220","asset_fixed","False"
"account_common_221","Investments in buildings","Inversiones en construcciones","221","asset_fixed","False"
"account_common_230","Preparation of land and natural resources","Adaptación de terrenos y bienes naturales","230","asset_fixed","False"
"account_common_231","Buildings under construction","Construcciones en curso","231","asset_fixed","False"
"account_common_232","Technical installations under assembly","Instalaciones técnicas en montaje","232","asset_fixed","False"
"account_common_233","Machinery under assembly","Maquinaria en montaje","233","asset_fixed","False"
"account_common_237","Information technology equipment under assembly","Equipos para procesos de información en montaje","237","asset_fixed","False"
"account_common_239","Advances for property, plant and equipment","Anticipos para inmovilizaciones materiales","239","asset_fixed","False"
"account_common_2413","Non-current debt securities of group companies","Valores representativos de deuda de empresas del grupo","2413","asset_fixed","False"
"account_common_2414","Non-current debt securities of associates","Valores representativos de deuda de empresas asociadas","2414","asset_fixed","False"
"account_common_2415","Non-current debt securities of related parties","Valores representativos de deuda de otras partes vinculadas","2415","asset_fixed","False"
"account_common_2423","Non-current loans to group companies","Créditos a empresas del grupo","2423","asset_fixed","False"
"account_common_2424","Non-current loans to associates","Créditos a empresas asociadas","2424","asset_fixed","False"
"account_common_2425","Non-current loans to other related parties","Créditos a otras partes vinculadas","2425","asset_fixed","False"
"account_common_250","Non-current investments in equity instruments","Inversiones financieras en instrumentos de patrimonio","250","asset_fixed","False"
"account_common_251","Non-current debt securities","Valores representativos de deuda","251","asset_fixed","False"
"account_common_252","Non-current loans","Créditos","252","asset_fixed","False"
"account_common_253","Non-current loans for disposal of fixed assets","Créditos por enajenación de inmovilizado","253","asset_fixed","False"
"account_common_254","Non-current loans to personnel","Créditos al personal","254","asset_fixed","False"
"account_common_258","Non-current deposits","Imposiciones","258","asset_fixed","False"
"account_common_259","Non-current uncalled equity holdings","Desembolsos pendientes sobre participaciones en el patrimonio neto","259","asset_fixed","False"
"account_common_260","Non-current guarantees extended","Fianzas constituidas","260","asset_fixed","False"
"account_common_265","Non-current deposits extended","Depósitos constituidos","265","asset_fixed","False"
"account_common_2800","Accumulated amortisation of research","Amortización acumulada de investigación","2800","asset_fixed","False"
"account_common_2801","Accumulated amortisation of development","Amortización acumulada de desarrollo","2801","asset_fixed","False"
"account_common_2802","Accumulated amortisation of administrative concessions","Amortización acumulada de concesiones administrativas","2802","asset_fixed","False"
"account_common_2803","Accumulated amortisation of industrial property","Amortización acumulada de propiedad industrial","2803","asset_fixed","False"
"account_common_2805","Accumulated amortisation of leaseholds","Amortización acumulada de derechos de traspaso","2805","asset_fixed","False"
"account_common_2806","Accumulated amortisation of computer software","Amortización acumulada de aplicaciones informáticas","2806","asset_fixed","False"
"account_common_2811","Accumulated depreciation of buildings","Amortización acumulada de construcciones","2811","asset_fixed","False"
"account_common_2812","Accumulated depreciation of technical installations","Amortización acumulada de instalaciones técnicas","2812","asset_fixed","False"
"account_common_2813","Accumulated depreciation of machinery","Amortización acumulada de maquinaria","2813","asset_fixed","False"
"account_common_2814","Accumulated depreciation of equipment","Amortización acumulada de utillaje","2814","asset_fixed","False"
"account_common_2815","Accumulated depreciation of other installations","Amortización acumulada de otras instalaciones","2815","asset_fixed","False"
"account_common_2816","Accumulated depreciation of furniture","Amortización acumulada de mobiliario","2816","asset_fixed","False"
"account_common_2817","Accumulated depreciation of information technology equipment","Amortización acumulada de equipos para proceso de información","2817","asset_fixed","False"
"account_common_2818","Accumulated depreciation of motor vehicles","Amortización acumulada de elementos de transporte","2818","asset_fixed","False"
"account_common_2819","Accumulated depreciation of other property, plant and equipment","Amortización acumulada de otro inmovilizado material","2819","asset_fixed","False"
"account_common_282","Accumulated depreciation of investment property","Amortización acumulada de las inversiones inmobiliarias","282","asset_fixed","False"
"account_common_2900","Impairment of research","Deterioro del valor de investigación","2900","asset_fixed","False"
"account_common_2901","Impairment of development","Deterioro del valor de desarrollo","2901","asset_fixed","False"
"account_common_2902","Impairment of administrative concessions","Deterioro del valor de concesiones administrativas","2902","asset_fixed","False"
"account_common_2903","Impairment of industrial property","Deterioro del valor de propiedad industrial","2903","asset_fixed","False"
"account_common_2905","Impairment of leaseholds","Deterioro del valor de derechos de traspaso","2905","asset_fixed","False"
"account_common_2906","Impairment of computer software","Deterioro del valor de aplicaciones informáticas","2906","asset_fixed","False"
"account_common_2910","Impairment of land and natural resources","Deterioro de valor de terrenos y bienes naturales","2910","asset_fixed","False"
"account_common_2911","Impairment of buildings","Deterioro de valor de construcciones","2911","asset_fixed","False"
"account_common_2912","Impairment of technical installations","Deterioro de valor de instalaciones técnicas","2912","asset_fixed","False"
"account_common_2913","Impairment of machinery","Deterioro de valor de maquinaria","2913","asset_fixed","False"
"account_common_2914","Impairment of equipments","Deterioro de valor de utillaje","2914","asset_fixed","False"
"account_common_2915","Impairment of other installations","Deterioro de valor de otras instalaciones","2915","asset_fixed","False"
"account_common_2916","Impairment of furniture","Deterioro de valor de mobiliario","2916","asset_fixed","False"
"account_common_2917","Impairment of information technology equipments","Deterioro de valor de equipos para proceso de información","2917","asset_fixed","False"
"account_common_2918","Impairment of motor vehicles","Deterioro de valor de elementos de transporte","2918","asset_fixed","False"
"account_common_2919","Impairment of other property, plant and equipment","Deterioro de valor de otro inmovilizado material","2919","asset_fixed","False"
"account_common_2920","Impairment of land and natural resources","Deterioro de valor de los terrenos y bienes naturales","2920","asset_fixed","False"
"account_common_2921","Impairment of buildings","Deterioro de valor de construcciones","2921","asset_fixed","False"
"account_common_2933","Impairment of non-current investments in group companies","Deterioro de valor de participaciones en empresas del grupo","2933","asset_fixed","False"
"account_common_2934","Impairment of non-current investments in associates","Deterioro de valor de participaciones en empresas asociadas","2934","asset_fixed","False"
"account_common_2943","Impairment of non-current debt securities of group companies","Deterioro de valor de valores representativos de deuda de empresas del grupo","2943","asset_fixed","False"
"account_common_2944","Impairment of non-current debt securities of associates","Deterioro de valor de valores representativos de deuda de empresas asociadas","2944","asset_fixed","False"
"account_common_2945","Impairment of non-current debt securities of other related parties","Deterioro de valor de valores representativos de deuda de otras partes vinculadas","2945","asset_fixed","False"
"account_common_2953","Impairment of non-current loans to group companies","Deterioro de valor de créditos a empresas del grupo","2953","asset_fixed","False"
"account_common_2954","Impairment of non-current loans to associates","Deterioro de valor de créditos a empresas asociadas","2954","asset_fixed","False"
"account_common_2955","Impairment of non-current loans to other related parties","Deterioro de valor de créditos a otras partes vinculadas","2955","asset_fixed","False"
"account_common_297","Impairment of non-current debt securities","Deterioro de valor de valores representativos de deuda","297","asset_fixed","False"
"account_common_298","Impairment of non-current loans","Deterioro de valor de créditos","298","asset_fixed","False"
"account_common_300","Merchandise A","Mercaderías A","300","asset_current","False"
"account_common_301","Merchandise B","Mercaderías B","301","asset_current","False"
"account_common_310","Raw materials A","Materias primas A","310","asset_current","False"
"account_common_311","Raw materials B","Materias primas B","311","asset_current","False"
"account_common_320","Components","Elementos y conjuntos incorporables","320","asset_current","False"
"account_common_321","Fuel","Combustibles","321","asset_current","False"
"account_common_322","Spare parts","Repuestos","322","asset_current","False"
"account_common_325","Sundry materials","Materiales diversos","325","asset_current","False"
"account_common_326","Packaging","Embalajes","326","asset_current","False"
"account_common_327","Containers","Envases","327","asset_current","False"
"account_common_328","Office supplies","Material de oficina","328","asset_current","False"
"account_common_330","Work in progress A","Productos en curso A","330","asset_current","False"
"account_common_331","Work in progress B","Productos en curso B","331","asset_current","False"
"account_common_340","Semi-finished goods A","Productos semiterminados A","340","asset_current","False"
"account_common_341","Semi-finished goods B","Productos semiterminados B","341","asset_current","False"
"account_common_350","Finished goods A","Productos terminados A","350","asset_current","False"
"account_common_351","Finished goods B","Productos terminados B","351","asset_current","False"
"account_common_360","By-products A","Subproductos A","360","asset_current","False"
"account_common_361","By-products B","Subproductos B","361","asset_current","False"
"account_common_365","Waste A","Residuos A","365","asset_current","False"
"account_common_366","Waste B","Residuos B","366","asset_current","False"
"account_common_368","Recovered materials A","Materiales recuperados A","368","asset_current","False"
"account_common_369","Recovered materials B","Materiales recuperados B","369","asset_current","False"
"account_common_390","Impairment of merchandise","Deterioro de valor de las mercaderías","390","asset_current","False"
"account_common_391","Impairment of raw material","Deterioro de valor de las materias primas","391","asset_current","False"
"account_common_392","Impairment of other supplies","Deterioro de valor de otros aprovisionamientos","392","asset_current","False"
"account_common_393","Impairment of work in progress","Deterioro de valor de los productos en curso","393","asset_current","False"
"account_common_394","Impairment of semi-finished goods","Deterioro de valor de los productos semiterminados","394","asset_current","False"
"account_common_395","Impairment of finished goods","Deterioro de valor de los productos terminados","395","asset_current","False"
"account_common_396","Impairment of by-products, waste and recovered materials","Deterioro de valor de los subproductos, residuos y materiales recuperados","396","asset_current","False"
"account_common_4000","Suppliers (euros)","Proveedores (euros)","4000","liability_payable","True"
"account_common_4004","Suppliers (foreign currency)","Proveedores (moneda extranjera)","4004","liability_payable","True"
"account_common_4009","Suppliers, pending invoices","Proveedores, facturas pendientes de recibir o de formalizar","4009","liability_current","True"
"account_common_401","Suppliers, trade bills payable","Proveedores, efectos comerciales a pagar","401","liability_payable","True"
"account_common_4030","Suppliers, group companies (euros)","Proveedores, empresas del grupo (euros)","4030","liability_payable","True"
"account_common_4031","Trade bills payable, group companies","Efectos comerciales a pagar, empresas del grupo","4031","liability_payable","True"
"account_common_4034","Suppliers, group companies (foreign currency)","Proveedores, empresas del grupo (moneda extranjera)","4034","liability_payable","True"
"account_common_4036","Containers and packaging returnable to suppliers, group companies","Envases y embalajes a devolver a proveedores, empresas del grupo","4036","liability_payable","True"
"account_common_4039","Suppliers, group companies, pending invoices","Proveedores, empresas del grupo, facturas pendientes de recibir o de formalizar","4039","liability_payable","True"
"account_common_404","Suppliers, associates","Proveedores, empresas asociadas","404","liability_payable","True"
"account_common_405","Suppliers, other related parties","Proveedores, otras partes vinculadas","405","liability_payable","True"
"account_common_406","Containers and packaging returnable to suppliers","Envases y embalajes a devolver a proveedores","406","liability_payable","True"
"account_common_407","Advances to suppliers","Anticipos a proveedores","407","liability_payable","True"
"account_common_4100","Payables for the rendering of services (euros)","Acreedores por prestaciones de servicios (euros)","4100","liability_payable","True"
"account_common_4104","Payables for the rendering of services (foreign currency)","Acreedores por prestaciones de servicios (moneda extranjera)","4104","liability_payable","True"
"account_common_4109","Payables for the rendering of services, pending invoices","Acreedores por prestaciones de servicios, facturas pendientes de recibir o de formalizar","4109","liability_payable","True"
"account_common_411","Trade bills payable","Acreedores, efectos comerciales a pagar","411","asset_current","True"
"account_common_419","Payables for profit-sharing agreements","Acreedores por operaciones en común","419","liability_payable","True"
"account_common_4300","Trade receivables (euros)","Clientes (euros)","4300","asset_receivable","True"
"account_common_4301","Trade receivables (euros) (PoS)","Clientes (euros) (PoS)","4301","asset_receivable","True"
"account_common_4304","Trade receivables (foreign currency)","Clientes (moneda extranjera)","4304","asset_receivable","True"
