"id","name","name@es","name@ca","code","account_type","reconcile"
"account_assoc_1301","Other public administration grants","Subvenciones de otras Administraciones Públicas","Subvencions d’altres Administracions Públiques","1301","equity","False"
"account_common_mainland_132","Other grants","Otras subvenciones","Altres subvencions","","",""
"account_assoc_1321","Other donations and bequests","Otras donaciones y legados","Altres donacions i llegats","1321","equity","False"
"account_assoc_207","Rights over transferred assets in use","Derechos sobre activos cedidos en uso","Drets sobre actius cedits en ús","207","asset_fixed","False"
"account_assoc_2400","Monuments","Monumentos","Monuments","2400","asset_fixed","False"
"account_assoc_2401","Historical gardens","Jardines históricos","Jardins històrics","2401","asset_fixed","False"
"account_assoc_2402","Historical areas","Conjuntos históricos","Conjunts històrics","2402","asset_fixed","False"
"account_common_mainland_2403","Historical sites","Sitios históricos","Participacions a llarg termini en empreses del grup","","",""
"account_common_mainland_2404","Archaeological areas","Zonas arqueológicas","Participacions a llarg termini en empreses associades","","",""
"account_assoc_2490","Advances on fixed assets of historic patrimony","Anticipos sobre bienes inmuebles del Patrimonio Histórico","Avançaments sobre béns immobles del Patrimoni Històric","2490","asset_fixed","False"
"account_assoc_2491","Advances on archives of historic patrimony","Anticipos sobre archivos del Patrimonio Histórico","Avançaments sobre arxius del Patrimoni Històric","2491","asset_fixed","False"
"account_assoc_2492","Advances on libraries of historic patrimony","Anticipos sobre bibliotecas del Patrimonio Histórico","Avançaments sobre biblioteques del Patrimoni Històric","2492","asset_fixed","False"
"account_common_mainland_2493","Advances on museums of historic patrimony","Anticipos sobre museos del Patrimonio Histórico","Desemborsaments pendents sobre participacions a llarg termini en empreses del grup","","",""
"account_common_mainland_2494","Advances on current assets of historic patrimony","Anticipos sobre bienes muebles del Patrimonio Histórico","Desemborsaments pendents sobre participacions a llarg termini en empreses associades","","",""
"account_assoc_2807","Accumulated amortization of rights on transferred assets in use","Amortización acumulada de derechos sobre activos cedidos en uso","Amortització acumulada de drets sobre actius cedits en ús","2807","asset_fixed","False"
"account_assoc_2830","Cessions of use of immobilized intangible assets","Cesiones de uso del inmovilizado intangible","Cessions d’ús de l’immobilitzat intangible","2830","asset_fixed","False"
"account_assoc_2831","Cessions of use of immobilized material","Cesiones de uso del inmovilizado material","Cessions d’ús de l’immobilitzat material","2831","asset_fixed","False"
"account_assoc_2907","Loss of value of transferred assets in use","Deterioro del valor sobre activos cedidos en uso","Deteriorament de valor sobre actius cedits en ús","2907","asset_fixed","False"
"account_assoc_2935","Loss of value of long-term interests in other related parties","Deterioro de valor de participaciones a largo plazo en otras partes vinculadas","Deteriorament de valor de participacions a llarg termini en altres parts vinculades","2935","asset_fixed","False"
"account_assoc_296","Loss of value of long-term in equity interests","Deterioro de  valor de participaciones en el patrimonio neto a largo plazo","Deteriorament de valor de participacions en el patrimoni net a llarg termini","296","asset_fixed","False"
"account_assoc_2990","Loss of value of historical heritage assets","Deterioro de valor de bienes del Patrimonio Histórico","Deteriorament de valor de béns del Patrimoni Històric","2990","asset_fixed","False"
"account_assoc_2991","Loss of value of archives","Deterioro de valor de archivos","Deteriorament de valor d’arxius","2991","asset_fixed","False"
"account_assoc_2992","Loss of value of libraries","Deterioro de valor de bibliotecas","Deteriorament de valor de biblioteques","2992","asset_fixed","False"
"account_assoc_2993","Loss of value of museums","Deterioro de valor de Museos","Deteriorament de valor de museus","2993","asset_fixed","False"
"account_assoc_2994","Loss of values of assets","Deterioro de valor de bienes muebles","Deteriorament de valor de béns mobles","2994","asset_fixed","False"
"account_assoc_412","Beneficiaries, creditors","Beneficiarios, acreedores","Beneficiaris, creditors","412","liability_payable","True"
"account_assoc_447","Borrowers, debtors","Usuarios, deudores","Usuaris, deutors","447","asset_receivable","True"
"account_assoc_4480","Sponsors","Patrocinadores","Patrocinadors","4480","asset_receivable","True"
"account_assoc_4482","Affiliates","Afiliados","Afiliats","4482","asset_receivable","True"
"account_assoc_4489","Other debtors","Otros deudores","Altres deutors","4489","asset_receivable","True"
"account_assoc_464","Deliveries for expenses to be justified","Entregas para gastos a justificar","Lliuraments per a despeses a justificar","464","asset_receivable","True"
"account_assoc_4707","Public Treasury, debt for subsidies received as collaborating entity (art. 12 Subsidies law)","Hacienda Pública, deudora por colaboración en la entrega y distribución de subvenciones (art.12 Ley de Subvenciones)","Hisenda pública, deutora per col·laboració  en el lliurament i distribució de subvencions (art.12 Llei de subvencions)","4707","asset_receivable","True"
"account_assoc_4757","Public Treasury, credit for subsidies received as collaborating entity (art. 12 Subsidies law)","Hacienda Pública, acreedora por subvenciones recibidas en concepto de entidad colaboradora (art.12 Ley de Subvencioens)","Hisenda pública, creditora per subvencions rebudes en concepte d’entitat col·laboradora (art.12 Llei de subvencions)","4757","asset_receivable","True"
"account_common_mainland_490","Loss of value of credit for activity operations","Deterioro de valor de créditos por operaciones de la actividad","Deteriorament de valor de crèdits per operacions comercials","","",""
"account_common_mainland_551","Current account with employers and others","Cuenta corriente con patronos y otros","Compte corrent amb socis i administradors","","",""
"account_assoc_5935","Loss of value of short-term interests in other related parties","Deterioro de valor de participaciones a corto plazo en otras partes vinculadas","Deteriorament de valor de participacions a curt termini en altres parts vinculades","5935","asset_current","False"
"account_assoc_596","Loss of value of short-term shares","Deterioro de valor de participaciones a corto plazo","Deteriorament de valor de participacions a curt termini","596","asset_current","False"
"account_assoc_6501","Individual financial aid","Ayudas monetarias individuales","Ajudes monetàries individuals","6501","expense","False"
"account_assoc_6502","Entities financial aid","Ayudas monetarias a entidades","Ajudes monetàries a entitats","6502","expense","False"
"account_assoc_6503","Other entities or center financial aid","Ayudas monetarias realizadas a través de otras entidades o centros","Ajudes monetàries realitzades a través d’altres entitats o centres","6503","expense","False"
"account_assoc_6504","International cooperation financial aid","Ayudas monetarias de cooperación internacional","Ajudes monetàries de cooperació internacional","6504","expense","False"
"account_common_mainland_6511","Individual non-monetary aid","Ayudas no monetarias individuales","Pèrdua suportada (partícip o associat no gestor)","","",""
"account_assoc_6512","Entities financial aid","Ayudas no monetarias a entidades","Ajudes no monetàries a entitats","6512","expense","False"
"account_assoc_6513","Other entities or center financial aid","Ayudas no monetarias realizadas a través de otras entidades o centros","Ajudes no monetàries realitzades a través d’altres entitats o centres","6513","expense","False"
"account_assoc_6514","International cooperation financial aid","Ayudas no monetarias de cooperación internacional","Ajudes no monetàries de cooperació internacional","6514","expense","False"
"account_assoc_653","Compensation of expenses for collaboration benefits","Compensación de gastos por prestaciones de colaboración","Compensació de despeses per prestacions de col·laboració","653","expense","False"
"account_assoc_654","Reimbursement of expenses to the government","Reembolsos de gastos al órgano de gobierno","Reemborsaments de despeses a l’òrgan de govern","654","expense","False"
"account_assoc_655","Credit loss from uncollectible activity","Pérdidas de créditos derivados de la actividad incobrables","Pèrdues de crèdits incobrables derivats de l’activitat","655","expense","False"
"account_assoc_6560","Transferred profit","Beneficio transferido (gestor)","Benefici transferit (gestor)","6560","expense","False"
"account_assoc_6561","Supported loss","Pérdida soportada(partícipe o asociado no gestor)","Pèrdues suportades (partícip o associat no gestor)","6561","expense","False"
"account_assoc_658","Reimbursement of subsidies, donations and legacies received, related to the entity's own activity","Reintegro de subvenciones, donaciones y legados recibidos, afectos a la actividad propia de la entidad","Reintegrament de subvencions, donacions i llegats rebut, afectes a l’activitat pròpia de l’entitat","658","expense","False"
"account_assoc_6711","Losses on historical heritage assets","Pérdidas procedentes de bienes del Patrimonio Histórico","Pèrdues procedents de béns del Patrimoni Històric","6711","expense","False"
"account_assoc_6911","Impairment losses on historical heritage assets","Pérdidas por deterioro de bienes del Patrimonio Histórico","Pèrdues per deteriorament de béns del Patrimoni Històric","6911","expense","False"
"account_assoc_720","Associate and affiliates dues","Cuotas de asociados y afiliados","Quotes d’associats i afiliats","720","income","False"
"account_assoc_721","Users quotas","Cuotas de usuarios","Quotes d’usuaris","721","income","False"
"account_assoc_722","Fundraising promotions","Promociones de captación de recursos","Promocions per a captació de recursos","722","income","False"
"account_assoc_7230","Sponsorship","Patrocinio","Patrocini","7230","income","False"
"account_assoc_7231","Advertising sponsorship","Patrocinio publicitario","Patrocini publicitari","7231","income","False"
"account_assoc_7233","Business collaborations","Colaboraciones empresariales","Col·laboracions empresarials","7233","income","False"
"account_assoc_728","Income from reimbursement of aid and allowances","Ingresos por reintegro de ayudas y asignaciones","Ingressos per reintegrament d’ajudes i assignacions","728","income","False"
"account_assoc_7962","Reversal of impairment of non-current investments, other related parties","Reversión del deterioro de participaciones en instrumentos de patrimonio neto a largo plazo, otras partes vinculadas","Reversió del deteriorament de participacions en instruments de patrimoni net a llarg termini, altres parts vinculades","7962","income","False"
"account_assoc_7963","Reversal of impairment of non-current investments, other other companies","Reversión del deterioro de participaciones en instrumentos de patrimonio neto a largo plazo, otras empresas","Reversió del deteriorament de participacions en instruments de patrimoni net a llarg termini, altres empreses","7963","income","False"
