"id","note","code","name","reconcile","user_type_id:id","chart_template_id:id"
"ru_acc_60","    Счет 60 ""Расчеты с поставщиками и подрядчиками"" предназначен для обобщения информации о расчетах с поставщиками и подрядчиками за:     полученные товарно-материальные ценности, принятые выполненные работы и потребленные услуги, включая предоставление электроэнергии, газа, пара, воды и т.п., а также по доставке или переработке материальных ценностей, расчетные документы на которые акцептованы и подлежат оплате через банк;     товарно-материальные ценности, работы и услуги, на которые расчетные документы от поставщиков или подрядчиков не поступили (так называемые неотфактурованные поставки);     излишки товарно-материальных ценностей, выявленные при их приемке;     полученные услуги по перевозкам, в том числе расчеты по недоборам и переборам тарифа (фрахта), а также за все виды услуг связи и др.     Организации, осуществляющие при выполнении договора строительного подряда, договора на выполнение научно-исследовательских, опытно-конструкторских и технологических работ и иного договора, функции генерального подрядчика,  расчеты со своими субподрядчиками также отражают на счете 60 ""Расчеты с поставщиками и подрядчиками"".     Аналитический учет по счету ведется по поставщикам и подрядчикам (субконто ""Контрагенты""), основанию расчетов (субконто ""Договоры""), а также по документам расчетов (субконто ""Документы расчетов с контрагентом""). Каждый поставщик и подрядчик - элемент справочника ""Контрагенты"". Каждое основание расчетов - элемент справочника ""Договоры контрагентов"".     Для ведения аналитического учета по субконто ""Документы расчетов с контрагентом"" следует выполнить соответствующие настройки параметров учета (меню ""Предприятие"" - ""Настройка параметров учета"" - ""Аналитический учет расчетов с контрагентами ""). ","60","Расчеты с поставщиками и подрядчиками","True","account.data_account_type_payable","l10n_ru_account_chart_template"
"ru_acc_60_01","    Субсчет 60.01 ""Расчеты с поставщиками и подрядчиками"" предназначен  для обобщения информации о задолженности за полученные товарно-материальные ценности (работы, услуги), цена которых указана в рублях.     Аналитический учет ведется по поставщикам и подрядчикам (субконто ""Контрагенты""), основанию расчетов (субконто ""Договоры""), а также по документам расчетов (субконто ""Документы расчетов с контрагентом""). Каждый поставщик и подрядчик - элемент справочника ""Контрагенты"". Каждое основание расчетов - элемент справочника ""Договоры контрагентов"".     Для ведения аналитического учета по субконто ""Документы расчетов с контрагентом"" следует выполнить соответствующие настройки параметров учета (меню ""Предприятие"" - ""Настройка параметров учета"" - ""Аналитический учет расчетов с контрагентами ""). ","60.01","Расчеты с поставщиками и подрядчиками","True","account.data_account_type_payable","l10n_ru_account_chart_template"
"ru_acc_60_02","    Субсчет 60.02 ""Расчеты по авансам выданным"" предназначен для обобщения информации об авансах, выданных поставщикам и подрядчикам в валюте Российской Федерации.     Аналитический учет ведется по поставщикам и подрядчикам (субконто ""Контрагенты""), основанию расчетов (субконто ""Договоры""), а также по документам расчетов (субконто ""Документы расчетов с контрагентом""). Каждый поставщик и подрядчик - элемент справочника ""Контрагенты"". Каждое основание расчетов - элемент справочника ""Договоры контрагентов"".     Для ведения аналитического учета по субконто ""Документы расчетов с контрагентом"" следует выполнить соответствующие настройки параметров учета (меню ""Предприятие"" - ""Настройка параметров учета"" - ""Аналитический учет расчетов с контрагентами ""). ","60.02","Расчеты по авансам выданным","True","account.data_account_type_payable","l10n_ru_account_chart_template"
"ru_acc_60_03","    Субсчет 60.03 ""Векселя выданные"" предназначен для обобщения информации о векселях, выданных поставщикам и подрядчикам.     Аналитический учет ведется по поставщикам и подрядчикам (субконто ""Контрагенты""), основанию расчетов (субконто ""Договоры"") и ценным бумагам (субконто ""Ценные бумаги""). Каждый поставщик и подрядчик - элемент справочника ""Контрагенты"". Каждое основание расчетов - элемент справочника ""Договоры контрагентов"". Каждая ценная бумага - элемент справочника ""Ценные бумаги"".","60.03","Векселя выданные","True","account.data_account_type_payable","l10n_ru_account_chart_template"
"ru_acc_60_21","    Субсчет 60.21 ""Расчеты с поставщиками и подрядчиками (в валюте)"" предназначен  для обобщения информации о задолженности за полученные товарно-материальные ценности (работы, услуги), цена которых указана в иностранной валюте.     Аналитический учет ведется по поставщикам и подрядчикам (субконто ""Контрагенты""), основанию расчетов (субконто ""Договоры""), а также по документам расчетов (субконто ""Документы расчетов с контрагентом""). Каждый поставщик и подрядчик - элемент справочника ""Контрагенты"". Каждое основание расчетов - элемент справочника ""Договоры контрагентов"".     Для ведения аналитического учета по субконто ""Документы расчетов с контрагентом"" следует выполнить соответствующие настройки параметров учета (меню ""Предприятие"" - ""Настройка параметров учета"" - ""Аналитический учет расчетов с контрагентами "").","60.21","Расчеты с поставщиками и подрядчиками (в валюте)","True","account.data_account_type_payable","l10n_ru_account_chart_template"
"ru_acc_60_22","    Субсчет 60.22 ""Расчеты по авансам выданным (в валюте)"" предназначен для обобщения информации об авансах, выданных поставщикам и подрядчикам в иностранной валюте.     Аналитический учет ведется по поставщикам и подрядчикам (субконто ""Контрагенты""), основанию расчетов (субконто ""Договоры""), а также по документам расчетов (субконто ""Документы расчетов с контрагентом""). Каждый поставщик и подрядчик - элемент справочника ""Контрагенты"". Каждое основание расчетов - элемент справочника ""Договоры контрагентов"".     Для ведения аналитического учета по субконто ""Документы расчетов с контрагентом"" следует выполнить соответствующие настройки параметров учета (меню ""Предприятие"" - ""Настройка параметров учета"" - ""Аналитический учет расчетов с контрагентами "").","60.22","Расчеты по авансам выданным (в валюте)","True","account.data_account_type_payable","l10n_ru_account_chart_template"
"ru_acc_60_31","    Субсчет 60.31 ""Расчеты с поставщиками и подрядчиками (в у.е.)"" предназначен  для обобщения информации о задолженности за полученные товарно-материальные ценности (работы, услуги), если их цена указана в условных единицах, а оплата поставщику производится в рублях.     Сальдо и обороты по счету формируются одновременно в условных единицах и в рублях. В качестве условной единицы может использоваться любая валюта из справочника ""Валюты"".     Аналитический учет ведется по поставщикам и подрядчикам (субконто ""Контрагенты""), основанию расчетов (субконто ""Договоры""), а также по документам расчетов (субконто ""Документы расчетов с контрагентом""). Каждый поставщик и подрядчик - элемент справочника ""Контрагенты"". Каждое основание расчетов - элемент справочника ""Договоры контрагентов"".","60.31","Расчеты с поставщиками и подрядчиками (в у.е.)","True","account.data_account_type_payable","l10n_ru_account_chart_template"
"ru_acc_60_32","    Субсчет 60.32 ""Расчеты по авансам выданным (в у.е.)"" предназначен для обобщения информации об авансах, выданных в счет предстоящих поставок товарно-материальных ценностей (работ, услуг), если аванс выдан в рублях, а цена товарно-материальных ценностей указана в условных единицах.     Сальдо и обороты по счету формируются одновременно в условных единицах и в рублях. В качестве условной единицы может использоваться любая валюта из справочника ""Валюты"".     Аналитический учет ведется по поставщикам и подрядчикам (субконто ""Контрагенты""), основанию расчетов (субконто ""Договоры""), а также по документам расчетов (субконто ""Документы расчетов с контрагентом""). Каждый поставщик и подрядчик - элемент справочника ""Контрагенты"". Каждое основание расчетов - элемент справочника ""Договоры контрагентов"".","60.32","Расчеты по авансам выданным (в у.е.)","True","account.data_account_type_payable","l10n_ru_account_chart_template"
"ru_acc_62","    Счет 62 ""Расчеты с покупателями и заказчиками"" предназначен для обобщения информации о расчетах с покупателями и заказчиками.     Аналитический учет по счету в целом ведется по покупателям и заказчикам (субконто ""Контрагенты""), основанию расчетов (субконто ""Договоры""), а также по документам расчетов (субконто ""Документы расчетов с контрагентами""). Каждый покупатель (заказчик) - элемент справочника ""Контрагенты"". Каждое основание расчетов - элемент справочника ""Договоры контрагентов"".     Для ведения аналитического учета по субконто ""Документы расчетов с контрагентом"" следует выполнить соответствующие настройки параметров учета (меню ""Предприятие"" - ""Настройка параметров учета"" - ""Аналитический учет расчетов с контрагентами "").","62","Расчеты с покупателями и заказчиками","True","account.data_account_type_receivable","l10n_ru_account_chart_template"
"ru_acc_62_01","    На субсчете 62.01 ""Расчеты с покупателями и заказчиками"" учитывается задолженность по расчетам в валюте Российской Федерации с покупателями и заказчиками за продукцию, работы и услуги, а также товары, приобретенные с целью перепродажи.     Аналитический учет ведется по покупателям и заказчикам (субконто ""Контрагенты""), основанию расчетов (субконто ""Договоры""), а также по документам расчетов (субконто ""Документы расчетов с контрагентами""). Каждый покупатель (заказчик) - элемент справочника ""Контрагенты"". Каждое основание расчетов - элемент справочника ""Договоры контрагентов"".     Для ведения аналитического учета по субконто ""Документы расчетов с контрагентом"" следует выполнить соответствующие настройки параметров учета (меню ""Предприятие"" - ""Настройка параметров учета"" - ""Аналитический учет расчетов с контрагентами "").","62.01","Расчеты с покупателями и заказчиками","True","account.data_account_type_receivable","l10n_ru_account_chart_template"
"ru_acc_62_02","    На субсчете 62.02 ""Расчеты по авансам полученным"" учитывается авансы, полученные в валюте Российской Федерации от покупателей и заказчиков за продукцию, работы и услуги, а также товары, приобретенные с целью перепродажи.     Аналитический учет ведется по покупателям и заказчикам (субконто ""Контрагенты""), основанию расчетов (субконто ""Договоры""), а также по документам расчетов (субконто ""Документы расчетов с контрагентами""). Каждый покупатель (заказчик) - элемент справочника ""Контрагенты"". Каждое основание расчетов - элемент справочника ""Договоры контрагентов"".     Для ведения аналитического учета по субконто ""Документы расчетов с контрагентом"" следует выполнить соответствующие настройки параметров учета (меню ""Предприятие"" - ""Настройка параметров учета"" - ""Аналитический учет расчетов с контрагентами "").","62.02","Расчеты по авансам полученным","True","account.data_account_type_receivable","l10n_ru_account_chart_template"
"ru_acc_62_03","    На субсчете 62.03 ""Векселя полученные"" учитывается задолженность по расчетам с покупателями и заказчиками, обеспеченная полученными векселями.     Аналитический учет ведется по покупателям и заказчикам (субконто ""Контрагенты""), основанию расчетов (субконто ""Договоры"") и ценным бумагам (субконто ""Ценные бумаги""). Каждый покупатель (заказчик) - элемент справочника ""Контрагенты"". Каждое основание расчетов - элемент справочника ""Договоры контрагентов"". Каждая ценная бумага - элемент справочника ""Ценные бумаги"".","62.03","Векселя полученные","True","account.data_account_type_receivable","l10n_ru_account_chart_template"
"ru_acc_62_21","    На субсчете 62.21 ""Расчеты с покупателями и заказчиками (в валюте)"" учитывается задолженность по расчетам в иностранных валютах с покупателями и заказчиками за продукцию, работы и услуги, а также товары, приобретенные с целью перепродажи.     Аналитический учет ведется по покупателям и заказчикам (субконто ""Контрагенты""), основанию расчетов (субконто ""Договоры""), а также по документам расчетов (субконто ""Документы расчетов с контрагентами""). Каждый покупатель (заказчик) - элемент справочника ""Контрагенты"". Каждое основание расчетов - элемент справочника ""Договоры контрагентов"".     Для ведения аналитического учета по субконто ""Документы расчетов с контрагентом"" следует выполнить соответствующие настройки параметров учета (меню ""Предприятие"" - ""Настройка параметров учета"" - ""Аналитический учет расчетов с контрагентами "").","62.21","Расчеты с покупателями и заказчиками (в валюте)","True","account.data_account_type_receivable","l10n_ru_account_chart_template"
"ru_acc_62_22","    На субсчете 62.22 ""Расчеты по аванса полученным (в валюте)"" учитывается авансы, полученные в иностранных валютах от покупателей и заказчиков за продукцию, работы и услуги, а также товары, приобретенные с целью перепродажи.     Аналитический учет ведется по покупателям и заказчикам (субконто ""Контрагенты""), основанию расчетов (субконто ""Договоры""), а также по документам расчетов (субконто ""Документы расчетов с контрагентами""). Каждый покупатель (заказчик) - элемент справочника ""Контрагенты"". Каждое основание расчетов - элемент справочника ""Договоры контрагентов"".     Для ведения аналитического учета по субконто ""Документы расчетов с контрагентом"" следует выполнить соответствующие настройки параметров учета (меню ""Предприятие"" - ""Настройка параметров учета"" - ""Аналитический учет расчетов с контрагентами "").","62.22","Расчеты по авансам полученным (в валюте)","True","account.data_account_type_receivable","l10n_ru_account_chart_template"
"ru_acc_62_31","    На субсчете 62.31 ""Расчеты с покупателями и заказчиками (в условных единицах)"" учитывается задолженность покупателей и заказчиков по расчетам за товары, продукцию, работы и услуги, если цена реализации указана в условных единицах, а оплата поступает в рублях.     Сальдо и обороты по счету формируются одновременно в условных единицах и в рублях. В качестве условной единицы может использоваться любая валюта из справочника ""Валюты"".     Аналитический учет ведется по покупателям и заказчикам (субконто ""Контрагенты""), основанию расчетов (субконто ""Договоры""), а также по документам расчетов (субконто ""Документы расчетов с контрагентами""). Каждый покупатель (заказчик) - элемент справочника ""Контрагенты"". Каждое основание расчетов - элемент справочника ""Договоры контрагентов"".","62.31","Расчеты с покупателями и заказчиками (в у.е.)","True","account.data_account_type_receivable","l10n_ru_account_chart_template"
