"id","note","code","name","reconcile","user_type_id:id","chart_template_id:id"
"ru_acc_69_13_2","    На субсчете 69.13.2 ""Расчеты по средствам ФСС для страхователей, применяющих УСН"" учитываются расчеты по средствам ФСС для страхователей, применяющих УСН.     Аналитический учет ведется по видам расчетов по средствам в ФСС (субконто ""Виды расчетов по средствам в ФСС"", только обороты).","69.13.2","Расчеты по средствам ФСС для страхователей, применяющих УСН","True","account.data_account_type_expenses","l10n_ru_account_chart_template"
"ru_acc_70","    Счет 70 ""Расчеты с персоналом по оплате труда"" предназначен для обобщения информации о расчетах с работниками организации, по оплате труда (по всем видам оплаты труда, премиям, пособиям, пенсиям работающих пенсионеров и другим выплатам), а также по выплате доходов по акциям и другим ценным бумагам данной организации.     Аналитический учет по счету ведется по каждому работнику (субконто ""Работники организаций""). Каждый работник - элемент справочника ""Физические лица"". ","70","Расчеты с персоналом по оплате труда","True","account.data_account_type_expenses","l10n_ru_account_chart_template"
"ru_acc_71","    Счет 71 ""Расчеты с подотчетными лицами"" предназначен для обобщения информации о расчетах с работниками по суммам, выданным им под отчет на административно-хозяйственные и операционные расходы.     Аналитический учет по счету ведется по каждой авансовой выдаче подотчетному лицу (субконто ""Работники организаций""). Каждое подотчетное лицо - элемент справочника ""Физические лица"".","71","Расчеты с подотчетными лицами","True","account.data_account_type_expenses","l10n_ru_account_chart_template"
"ru_acc_71_01","    Субсчет 71.01 ""Расчеты с подотчетными лицами"" предназначен для обобщения информации о расчетах с работниками по суммам, выданным им под отчет на административно-хозяйственные и операционные расходы в валюте Российской Федерации.     Аналитический учет ведется по каждой авансовой выдаче подотчетному лицу (субконто ""Работники организаций""). Каждое подотчетное лицо - элемент справочника ""Физические лица"".","71.01","Расчеты с подотчетными лицами","True","account.data_account_type_expenses","l10n_ru_account_chart_template"
"ru_acc_71_21","    Субсчет 71.21 ""Расчеты с подотчетными лицами (в валюте)"" предназначен для обобщения информации о расчетах с работниками по суммам, выданным им под отчет на административно-хозяйственные и операционные расходы в иностранных валютах.     Аналитический учет ведется по каждой авансовой выдаче подотчетному лицу (субконто ""Работники организаций"".). Каждое подотчетное лицо - элемент справочника ""Физические лица"".","71.21","Расчеты с подотчетными лицами (в валюте)","True","account.data_account_type_expenses","l10n_ru_account_chart_template"
"ru_acc_73","    Счет 73 ""Расчеты с персоналом по прочим операциям"" предназначен для обобщения информации обо всех видах расчетов с работниками организации, кроме расчетов по оплате труда и расчетов с подотчетными лицами.     Аналитический учет по счету ведется по работникам организации (субконто ""Работники организаций"".). Каждый работник - элемент справочника ""Физические лица"".","73","Расчеты с персоналом по прочим операциям","True","account.data_account_type_expenses","l10n_ru_account_chart_template"
"ru_acc_73_01","    На субсчете 73.01 ""Расчеты по предоставленным  займам"" отражаются расчеты с работниками организации по предоставленным им займам.     Аналитический учет ведется по работникам организации (субконто ""Работники организаций"".). Каждый работник - элемент справочника ""Физические лица"".","73.01","Расчеты по предоставленным займам","True","account.data_account_type_expenses","l10n_ru_account_chart_template"
"ru_acc_73_02","    На субсчете 73.02 ""Расчеты  по возмещению материального ущерба"" учитываются  расчеты по возмещению материального ущерба, причиненного работником организации в результате недостач и хищений денежных и товарно-материальных ценностей, брака, а также по возмещению других видов ущерба.     Аналитический учет ведется по работникам организации (субконто ""Работники организаций""). Каждый работник - элемент справочника ""Физические лица"".","73.02","Расчеты по возмещению материального ущерба","True","account.data_account_type_expenses","l10n_ru_account_chart_template"
"ru_acc_73_03","    На субсчете 73.03 ""Расчеты  по прочим операциям"" учитываются  расчеты с персоналом организации по прочим операциям.     Аналитический учет ведется по работникам организации (субконто ""Работники организаций""). Каждый работник - элемент справочника ""Физические лица"".","73.03","Расчеты по прочим операциям","True","account.data_account_type_expenses","l10n_ru_account_chart_template"
"ru_acc_75","    Счет 75 ""Расчеты с учредителями"" предназначен для обобщения информации о всех видах расчетов с учредителями (участниками) организации (акционерами акционерного общества, участниками полного товарищества, членами кооператива и т.п.): по вкладам в уставный (складочный) капитал организации, по выплате доходов (дивидендов) и др. Государственные и муниципальные унитарные предприятия применяют этот счет для учета всех видов расчетов с уполномоченными на их создание государственными органами и органами местного самоуправления.","75","Расчеты с учредителями","True","account.data_account_type_expenses","l10n_ru_account_chart_template"
"ru_acc_75_01","    На субсчете 75.01 ""Расчеты по вкладам в уставный (складочный) капитал"" учитываются расчеты с учредителями организации (акционерами акционерного общества, участниками полного товарищества, членами кооператива и т.п.) по вкладам в уставный (складочный) капитал организации.     Аналитический учет ведется по каждому учредителю (участнику) (субконто ""Контрагенты""). Каждый учредитель (участник) - элемент справочника ""Контрагенты"".","75.01","Расчеты по вкладам в уставный (складочный) капитал","True","account.data_account_type_expenses","l10n_ru_account_chart_template"
"ru_acc_75_02","    На субсчете 75.02 ""Расчеты по выплате доходов"" обобщается информация по выплате доходов учредителям (участникам) организации (акционерам акционерного общества, участникам полного товарищества, членам кооператива и т.п.).     Аналитический учет ведется по каждому учредителю (участнику) (субконто ""Контрагенты""). Каждый учредитель (участник) - элемент справочника ""Контрагенты"".","75.02","Расчеты по выплате доходов","True","account.data_account_type_expenses","l10n_ru_account_chart_template"
"ru_acc_76","    Счет 76 ""Расчеты с разными дебиторами и кредиторами"" предназначен для обобщения информации о расчетах по операциям с дебиторами и кредиторами, не упомянутыми в пояснениях к счетам 60-75: по имущественному и личному страхованию; по претензиям; по суммам, удержанным из оплаты труда работников организации в пользу других организаций и отдельных лиц на основании исполнительных документов или постановлений судов, и др.     Аналитический учет по счету в целом ведется по каждому дебитору (кредитору) (субконто ""Контрагенты"") и договорам (субконто ""Договоры""). Каждый дебитор (кредитор) - элемент справочника ""Контрагенты"". Каждый договор - элемент справочника ""Договоры контрагентов"".","76","Расчеты с разными дебиторами и кредиторами","True","account.data_account_type_expenses","l10n_ru_account_chart_template"
"ru_acc_76_01","    На субсчете 76.01 ""Расчеты по имущественному, личному и добровольному страхованию"" отражаются расчеты в валюте Российской Федерации по страхованию имущества и персонала (кроме расчетов по социальному страхованию и обязательному медицинскому страхованию) организации, а также расчеты по добровольному страхованию работников, в которых организация выступает страхователем.","76.01","Расчеты по имущественному, личному и добровольному страхованию","True","account.data_account_type_expenses","l10n_ru_account_chart_template"
"ru_acc_76_01_1","    На субсчете 76.01.1 ""Расчеты по имущественному и личному страхованию"" отражаются расчеты в валюте Российской Федерации по страхованию имущества и персонала, в которых организация выступает страхователем.     Аналитический учет ведется по страховщикам (субконто ""Контрагенты"") и отдельным договорам страхования (субконто ""Договоры""). Каждый страховщик - элемент справочника ""Контрагенты"". Каждый договор страхования - элемент справочника ""Договоры контрагентов"".","76.01.1","Расчеты по имущественному и личному страхованию","True","account.data_account_type_expenses","l10n_ru_account_chart_template"
"ru_acc_76_01_2","На субсчете 76.01.2 ""Платежи (взносы) по добровольному страхованию на случай смерти и  причинения вреда здоровью "" отражаются расчеты в валюте Российской Федерации по договорам добровольного личного страхования на случай смерти и  причинения вреда здоровью, в которых организация выступает страхователем. Аналитический учет ведется по страховщикам (субконто ""Контрагенты""), договорам добровольного страхования (субконто ""Расходы будущих периодов""), застрахованным работникам (субконто ""Работники организаций""). Каждый страховщик - элемент справочника ""Контрагенты"". Каждый договор страхования - элемент справочника ""Расходы будущих периодов"". Каждый работник - элемент справочника ""Физические лица"".","76.01.2","Платежи (взносы) по добровольному страхованию на случай смерти и причинения вреда здоровью","True","account.data_account_type_expenses","l10n_ru_account_chart_template"
"ru_acc_76_01_9","На субсчете 76.01.9 "" Платежи (взносы) по прочим видам страхования"" отражаются расчеты в валюте Российской Федерации по страхованию имущества и персонала, в которых организация выступает страхователем, кроме добровольного страхования на случай смерти и причинения вреда здоровью. Аналитический учет ведется по страховщикам (субконто ""Контрагенты""), договорам добровольного страхования (субконто ""Расходы будущих периодов""). Каждый страховщик - элемент справочника ""Контрагенты"". Каждый договор страхования - элемент справочника ""Расходы будущих периодов"".","76.01.9","Платежи (взносы) по прочим видам страхования","True","account.data_account_type_expenses","l10n_ru_account_chart_template"
"ru_acc_76_02","    На субсчете 76.02 ""Расчеты по претензиям"" отражаются расчеты в валюте Российской Федерации по претензиям, предъявленным поставщикам, подрядчикам, транспортным и другим организациям, а также по предъявленным и признанным (или присужденным) штрафам, пеням и неустойкам.     Аналитический учет ведется по каждому дебитору (субконто ""Контрагенты"") и отдельным претензиям (субконто ""Договоры""). Каждый дебитор - элемент справочника ""Контрагенты"". Каждая претензия - элемент справочника ""Договоры контрагентов"".","76.02","Расчеты по претензиям","True","account.data_account_type_expenses","l10n_ru_account_chart_template"
"ru_acc_76_03","    На субсчете 76.03 ""Расчеты по причитающимся дивидендам и другим доходам"" учитываются расчеты по причитающимся организации дивидендам и другим доходам, в том числе по прибыли, убыткам и другим результатам по договору простого товарищества.     Аналитический учет ведется по каждому дебитору (субконто ""Контрагенты"") и отдельным договорам (субконто ""Договоры""). Каждый дебитор - элемент справочника ""Контрагенты"". Каждый договор - элемент справочника ""Договоры контрагентов"".","76.03","Расчеты по причитающимся дивидендам и другим доходам","True","account.data_account_type_expenses","l10n_ru_account_chart_template"
"ru_acc_76_04","    На субсчете 76.04 ""Расчеты по депонированным суммам"" учитываются расчеты с работниками организации по суммам, начисленным, но не выплаченным в установленный срок (из-за неявки получателей).     Аналитический учет ведется по каждому кредитору (субконто ""Работники организаций""). Каждый кредитор - элемент справочника ""Физические лица"".","76.04","Расчеты по депонированным суммам","True","account.data_account_type_expenses","l10n_ru_account_chart_template"
"ru_acc_76_05","    Субсчет 76.05 ""Расчеты с прочими поставщиками и подрядчиками"" предназначен для обобщения информации о расчетах с прочими поставщиками и подрядчиками в валюте Российской Федерации.     Аналитический учет ведется по каждому поставщику и подрядчику (субконто ""Контрагенты""), основанию расчетов (субконто ""Договоры"") и документам расчетов (субконто ""Документы расчетов с контрагентом""). Каждый поставщик и подрядчик - элемент справочника ""Контрагенты"". Каждое основание расчетов - элемент справочника ""Договоры контрагентов"".     Для ведения аналитического учета по субконто ""Документы расчетов с контрагентом"" следует выполнить соответствующие настройки параметров учета (меню ""Предприятие"" - ""Настройка параметров учета"" - ""Аналитический учет расчетов с контрагентами "").","76.05","Расчеты с прочими поставщиками и подрядчиками","True","account.data_account_type_expenses","l10n_ru_account_chart_template"
"ru_acc_76_06","   Субсчет 76.06 ""Расчеты с прочими покупателями и заказчиками"" предназначен для обобщения информации о расчетах с прочими покупателями и заказчиками в валюте Российской Федерации.     Аналитический учет ведется по каждому покупателю и заказчику (субконто ""Контрагенты""), основанию расчетов (субконто ""Договоры"") и документам расчетов (субконто ""Документы расчетов с контрагентом""). Каждый покупатель и заказчик - элемент справочника ""Контрагенты"". Каждое основание расчетов - элемент справочника ""Договоры контрагентов"".     Для ведения аналитического учета по субконто ""Документы расчетов с контрагентом"" следует выполнить соответствующие настройки параметров учета (меню ""Предприятие"" - ""Настройка параметров учета"" - ""Аналитический учет расчетов с контрагентами "").","76.06","Расчеты с прочими покупателями и заказчиками","True","account.data_account_type_expenses","l10n_ru_account_chart_template"
"ru_acc_76_09","    Субсчет 76.09 ""Прочие расчеты с разными дебиторами и кредиторами"" предназначен для обобщения информации о прочих расчетах в валюте Российской Федерации, не выделенных на отдельные субсчета счета 76 ""Расчеты с разными дебиторами и кредиторами"".     Аналитический учет ведется по каждому дебитору и кредитору (субконто ""Контрагенты""), основанию расчетов (субконто ""Договоры"") и документам расчетов (субконто ""Документы расчетов с контрагентом""). Каждый дебитор и кредитор - элемент справочника ""Контрагенты"". Каждое основание расчетов - элемент справочника ""Договоры контрагентов"".     Для ведения аналитического учета по субконто ""Документы расчетов с контрагентом"" следует выполнить соответствующие настройки параметров учета (меню ""Предприятие"" - ""Настройка параметров учета"" - ""Аналитический учет расчетов с контрагентами "").","76.09","Прочие расчеты с разными дебиторами и кредиторами","True","account.data_account_type_expenses","l10n_ru_account_chart_template"
"ru_acc_76_21","    На субсчете 76.21 ""Расчеты по имущественному и личному страхованию (в валюте)"" отражаются расчеты в иностранных валютах по страхованию имущества и персонала (кроме расчетов по социальному страхованию и обязательному медицинскому страхованию) организации, в котором организация выступает страхователем.     Аналитический учет ведется по страховщикам (субконто ""Контрагенты"") и отдельным договорам страхования (субконто ""Договоры""). Каждый страховщик - элемент справочника ""Контрагенты"". Каждый договор страхования - элемент справочника ""Договоры контрагентов"".","76.21","Расчеты по имущественному и личному страхованию (в валюте)","True","account.data_account_type_expenses","l10n_ru_account_chart_template"
