id,bic,name,country
bank_1,BCENECEQ,Banco Central Del Ecuador,Ecuador
bank_2,PICHECEQ,Banco Pichincha C.A.,Ecuador
bank_3,GUAYECEG,Banco De Guayaquil S.A,Ecuador
bank_4,,Banco City Bank,Ecuador
bank_5,BMACECEG,Banco Machala,Ecuador
bank_6,LOJBECEL,Banco De Loja,Ecuador
bank_7,PACIECEG,Banco Del Pacifico,Ecuador
bank_8,BINTECEQ,Banco Internacional,Ecuador
bank_9,BASAECEG,Banco Amazonas,Ecuador
bank_10,AUSTECEQ,Banco Del Austro,Ecuador
bank_11,PRODECEQ,Produbanco / Promerica,Ecuador
bank_12,BBOLECEG,Banco Bolivariano,Ecuador
bank_13,,Banco Comercial De Manabi,Ecuador
bank_14,BGRMECEQ,Banco General Ruminahui S.A.,Ecuador
bank_15,LITBECEF,Banco Del Litoral S.A.,Ecuador
bank_16,BNSLECEQ,Banco Solidario,Ecuador
bank_17,PRCBECEQ,Banco Procredit S.A.,Ecuador
bank_18,,Banco Capital,Ecuador
bank_19,CODSECEQ,Banco Desarrollo De Los Pueblos S.A.,Ecuador
bank_20,,Banecuador B.P.,Ecuador
bank_21,CJEPECEQ,COOPERATIVA DE AHORRO Y CREDITO JUVENTUD ECUATORIANA PROGRESISTA LTDA.,Ecuador
bank_22,,Coop. Jardin Azuayo,Ecuador
bank_23,,Coop.De Ahorro Y Credito Policia Nacional,Ecuador
bank_24,,Financoop,Ecuador
bank_25,,Banco Delbank S.A.,Ecuador
bank_26,,Banco Ecuatoriano De La Vivienda,Ecuador
bank_27,,Cacpeco Ltda,Ecuador
bank_28,DICDECEQ,DINERS CLUB DEL ECUADOR S.A.,Ecuador
bank_29,MUPIECEQ,ASOCIACION MUTUALISTA DE AHORRO Y CREDITO PARA LA VIVIENDA PICHINCHA,Ecuador
bank_30,,Coop. Ahorro Y Credito 29 De Octubre,Ecuador
bank_31,,Coop. Ahorro Y Credito Andalucia,Ecuador
bank_32,,Coop. Ahorro Y Credito Cotocollao,Ecuador
bank_33,,Coop. Ahorro Y Credito El Sagrario,Ecuador
bank_34,,Coop. Ahorro Y Credito Guaranda Ltda,Ecuador
bank_35,,Coop. Juventud Ecuatoriana Progresista Ltda.,Ecuador
bank_36,,Coop. Ahorro Y Credito Manuel,Ecuador
bank_37,,Coop. Ahorro Y Credito Oscus,Ecuador
bank_38,,Coop. Ahorro Y Credito Pablo Munoz Vega,Ecuador
bank_39,,Coop. Ahorro Y Credito Progreso,Ecuador
bank_40,,Coop. Ahorro Y Credito Riobamba,Ecuador
bank_41,,Coop. Ahorro Y Credito San Francisco,Ecuador
bank_42,,Coop. Ahorro Y Credito Tulcan,Ecuador
bank_43,,Coop. De Ahorro Y Credito Atuntaqui Ltda.,Ecuador
bank_44,,Coop. De Ahorro Y Credito Comercio Ltda Portoviejo,Ecuador
bank_45,,Coop. De Ahorro Y Credito La Dolorosa Ltda,Ecuador
bank_46,,Coop. Prevision Ahorro Y Desarrollo,Ecuador
bank_47,,Coop.Ahorro Y Credito Alianza Del Valle Ltda,Ecuador
bank_48,,Coop Ahorro Y Credito Constrc Comercio Y Produc,Ecuador
bank_49,,Coop.Ahorro Y Credito Chone Ltda,Ecuador
bank_50,,Cooperativa De Ahorro Y Credito Santa Ana Ltda,Ecuador
bank_51,,Financiera - Diners Club Del Ecuador,Ecuador
bank_52,,Mutualista Ambato,Ecuador
bank_53,,Mutualista Azuay,Ecuador
bank_54,,Mutualista Imbabura,Ecuador
bank_55,,Mutualista Pichincha,Ecuador
bank_56,,Coop De A. Y C. Corporacion Centro Ltda.,Ecuador
bank_57,,Coop. De A. Y C. Cordillera De Los Andes Ltda.,Ecuador
bank_58,,Coop. De A. Y C. Puerto Francisco De Orellana,Ecuador
bank_59,,Coop. De A Y C. Luz Del Valle,Ecuador
bank_60,,Coop. De A Y C. Esperanza Y Progreso Del Valle,Ecuador
bank_61,,Coop. De A. Y C. Choco Tungurahua Runa Ltda,Ecuador
bank_62,,Coop. De A. Y C. Coopartamos Ltda,Ecuador
bank_63,,Coop. De A. Y C. Emprendedores Coopemprender Ltda.,Ecuador
bank_64,,Coop. De A. Y C. Nueva Loja Ltda.,Ecuador
bank_65,,Coop. De A. Y C. Pichncha Ltda.,Ecuador
bank_66,,Coop. Credito Y Ahorro San Francisco De Asis,Ecuador
bank_67,,Coop.De Ahorro Y Credito Cacec Ltda. (Cotopaxi),Ecuador
bank_68,,Coop.De A. Y C. Vencedores De Pichincha Ltda.,Ecuador
bank_69,,Cooperativa De Ahorro Y Credito San Bartolo Ltda,Ecuador
bank_70,,Coop. De A. Y C. Del Emigrante Ecuatoriano Y Su Fa,Ecuador
bank_71,,Coop. Ahorro Y Credito La Libertad Ltda,Ecuador
bank_72,,Coac Cuna De La Nacionalidad Ltda.,Ecuador
bank_73,,Cooperativa De Ahorro Y Credito Macodes Ltda,Ecuador
bank_74,,Cooperativa De Ahorro Y Credito Santa Isabel Ltda.,Ecuador
bank_75,,Cooperativa De Ahorro Y Credito Ganansol Ltda,Ecuador
bank_76,,Cooperativa De Ahorro Y Credito Del Azuay,Ecuador
bank_77,,Cooperativa De Ahorro Y Credito Del Colegio De Arq,Ecuador
bank_78,,Cooperativa De Ahorro Y Credito Nukanchik,Ecuador
bank_79,,Coop De Ahorro Y Credito Santa Ana Cuenca,Ecuador
bank_80,,Cooperativa De Ahorro Y Credito Multiempresarial L,Ecuador
bank_81,,Coac Del Sindicato De Choferes Profesionales Del A,Ecuador
bank_82,,Coop. Ahorro Y Credito Juan De Salinas Ltda.,Ecuador
bank_83,,Coop. Ahorro Y Credito Puellaro Ltda,Ecuador
bank_84,,Coop. Ahorro Y Credito Nueva Jerusalen,Ecuador
bank_85,,Coop. Ahorro Y Credito Malchingui Ltda.,Ecuador
bank_86,,Coop. De Ahorro Y Credito Chola Cuencana Ltda.,Ecuador
bank_87,,Coop. Ahorro Y Credito Tena Ltda.,Ecuador
bank_88,,Coop. Ahorro Y Credito De La Pequena Empresa Guala,Ecuador
bank_89,,Coop. Ahorro Y Credito Alianza Minas Ltda.,Ecuador
bank_90,,Coop. De Ahorro Y Credito Pedro Moncayo Ltda.,Ecuador
bank_91,,Cooperativa De Ahorro Y Credito Provida,Ecuador
bank_92,,Cooperativa De Ahorro Y Credito San Jose S.J.,Ecuador
bank_93,,Coop. Ahorro Y Credito Senor De Giron,Ecuador
bank_94,,Coop. De Ahorro Y Credito Educ.Del Tungurahua Ltda,Ecuador
bank_95,,Cooperativa 15 De Agosto Pilacoto,Ecuador
bank_96,,Coop. De Ahorro Y Credito Cristo Rey,Ecuador
bank_97,,Coop. De Ahorro Y Credito Educadores De Chimborazo,Ecuador
bank_98,,Cooperativa De Ahorro Y Credito Minga Ltda.,Ecuador
bank_99,,Coop. De Ahorro Y Credito 4 De Octubre Ltda.,Ecuador
bank_100,,Coop. De Ahorro Y Credito Credi Facil Ltda.,Ecuador
bank_101,,Coop. De Ahorro Y Credito Alfonso Jaramillo C.C.C.,Ecuador
bank_102,,Coop. De A. Y C. Indigena Sac Pelileo,Ecuador
bank_103,,Coop. De A. Y C. Intercultural Tawantinsuyu Ltda.,Ecuador
bank_104,,Coop. De A. Y C. Ocipsa,Ecuador
bank_105,,Coop. De A. Y C. 21 De Noviembre Ltda.,Ecuador
bank_106,,Coop. De A. Y C. La Floresta Ltda.,Ecuador
bank_107,,Coop. De A. Y C. Corp. Org. Campesinas De Quisapin,Ecuador
bank_108,,Coop. De A. Y C. Multicultural Banco Indigena Ltda,Ecuador
bank_109,,Coop De A. Y C. Crecer Winari Ltda.,Ecuador
bank_110,,Coop. De A. Y C. Banos De Agua Santa Ltda.,Ecuador
bank_111,,Coop. De Ahorro Y Credito 1 De Julio,Ecuador
bank_112,,Coop. De A. Y C. Sumak Nan Ltda.,Ecuador
bank_113,,Cooperativa De Ahorro Y Credito Canar Ltda.,Ecuador
bank_114,,Cooperativa De Ahorro Y Credito San Antonio Ltda.,Ecuador
bank_115,,Coop. De Ahorro Y Credito Fundar,Ecuador
bank_116,,Coop. Ahorro Y Credito Metropolis Ltda.,Ecuador
bank_117,,Coop. De Ahorro Y Credito El Cafetal,Ecuador
bank_118,,Coop.De Ahorro Y Credito Microempresarial Sucre,Ecuador
bank_119,,Coop. De A. Y C. Afroecuatoriana De La Peq. Emp. L,Ecuador
bank_120,,Cooperativa De Ahorro Y Credito Joyocoto Ltda.,Ecuador
bank_121,,Coop. Ahorro Y Credito San Antonio Ltda.,Ecuador
bank_122,,Coop. De A. Y C. Uniotavalo Ltda.,Ecuador
bank_123,,Coop. De A. Y C. Union El Ejido,Ecuador
bank_124,,Coop. De A. Y C. Genesis Ltda.,Ecuador
bank_125,,Coop. De A Y C. Maria Auxiliadora De Quiroga Ltda,Ecuador
bank_126,,Coop. De A. Y C. Fortaleza,Ecuador
bank_127,,Banco Para La Asistencia Comunitaria Finca S.A.,Ecuador
bank_128,,Coop. Calceta Ltda,Ecuador
bank_129,,Coop. Ahorro Y Credito 9 De Octubre Ltda,Ecuador
bank_130,,Coop. Ahorro Y Credito D La Peq Empr Cacpe Biblian,Ecuador
bank_131,,Coop. Ahorro Y Credito San Gabriel Ltda.,Ecuador
bank_132,,Coop. Ahorro Y Credito San Jose Ltda,Ecuador
bank_133,,Coop. Ahorro Y Credito San Miguel De Los Bancos,Ecuador
bank_134,,Coop. Ahorro Y Credito Semilla Del Progreso Ltda,Ecuador
bank_135,,Coop. Ahorro. Y Credi. Mujeres Unidas Tantanakushk,Ecuador
bank_136,,Coop. De Ahorro Y Cred. Santa Rosa Ltda,Ecuador
bank_137,,Coop. De Ahorro Y Credito Once De Junio,Ecuador
bank_138,,Coop. De A. Y C. Pujili Ltda,Ecuador
bank_139,,Coop. De A. Y C. Credil Ltda.,Ecuador
bank_140,,Coop. De A. Y C. Mushuk Pakari Ltda.,Ecuador
bank_141,,Coop. De A. Y C. Uniblock Y Servicios Ltda.,Ecuador
bank_142,,Coop. De A. Y C. San Fernando Limitada,Ecuador
bank_143,,Coop. De A. Y C. Futuro Lamanense,Ecuador
bank_144,,Coop. De A. Y C. Saquisili Ltda.,Ecuador
bank_145,,Coop. De A. Y C. Innovacion Andina Ltda.,Ecuador
bank_146,,Coop.De A.Y C. El Comerciante Ltda (Mies),Ecuador
bank_147,,Coop. De A. Y C. Mushuk Wasi Ltda ( Mies ),Ecuador
bank_148,,Cooperativa De Ahorro Y Credito Solidaria Ltda,Ecuador
bank_149,,Cooperativa De Ahorro Y Credito Llanganates,Ecuador
bank_150,,Interdin S.A.,Ecuador
bank_151,,Coop.Aho Y Credito De La Peq. Emp. De Loja Cacpe,Ecuador
bank_152,,Cooperativa De Ahorro Y Credito Economia Del Sur C,Ecuador
bank_153,,Cooperativa De Ahorro Y Credito Migrantes Y Empren,Ecuador
bank_154,,Cooperativa De Ahorro Y Credito San Sebastian,Ecuador
bank_155,,Coop. De A. Y C. Del Sindicato De Choferes Profesi,Ecuador
bank_156,,Coop.De Ahorro Y Credito 29 De Enero,Ecuador
bank_157,,Coop. Ahorro Y Credito Agraria Mushuk Kawsay Ltda.,Ecuador
bank_158,,Cooperativa De Ahorro Y Credito Runa Shungo Ltda.,Ecuador
bank_159,,Coop. De A. Y C. San Marcos,Ecuador
bank_160,,Coop. De A. Y C. Antorcha Ltda.,Ecuador
bank_161,,Cooperativa De Ahorro Y Credito Socio Amigo,Ecuador
bank_162,,Coop. De A. Y C. Indigenas Galapagos Ltda.,Ecuador
bank_163,,Coop. Ahorro Y Credito Camara De Comercio Del Cant,Ecuador
bank_164,,Cooperativa De Ahorro Y Credito La Benefica Ltda.,Ecuador
bank_165,,Coop.De Ahorro Y Credito Abdon Calderon Ltda.,Ecuador
bank_166,,Coop. A Y C Camara De Comercio Canton -El Carmen L,Ecuador
bank_167,,Coop.De Ahorro Y Credito Agroproductiva Manabi Ltd,Ecuador
bank_168,,Coop. De Ahorro Y Cred. La Inmaculada De San Placi,Ecuador
bank_169,,Coop. Ahorro Y Credito Cacpe Manabi,Ecuador
bank_170,,Coop.Ahorro Y Credito Magisterio Manabita Limitada,Ecuador
bank_171,,Coac Tienda De Dinero Ltda.,Ecuador
bank_172,,Coop.A.Y C. Santa Maria De La Manga Del Cura Ltda.,Ecuador
bank_173,,Coop. Ahorro Y Credito Camara De Comercio Indigena,Ecuador
bank_174,,Coop. De A. Y C. Guamote Ltda.,Ecuador
bank_175,,Coop. De A.Y C. Produc. Ahorro Invers. Servicio P.,Ecuador
bank_176,,Coop. De A. Y C. Frandesc Ltda.,Ecuador
bank_177,,Coop. De A. Y C. Nuka Llakta Ltda.,Ecuador
bank_178,,Coop. De A Y C. Camara De Comercio Riobamba,Ecuador
bank_179,,Coop. De A. Y C. Bashalan Ltda.,Ecuador
bank_180,,Coop. De A. Y C. Camara De Comercio Santo Domingo,Ecuador
bank_181,,Coop. De A. Y C. Educadores Tulcan Ltda.,Ecuador
bank_182,,Coop. Warmikunapak Rikchari,Ecuador
bank_183,,Coop Ahorro Y Credito Mi Tierra,Ecuador
bank_184,,Coop Ahorro Y Credito De La Peq Emp Cacpe Yanzatza,Ecuador
bank_185,,Coop Ahorro Y Credito Fundesarrollo,Ecuador
bank_186,,Caja Ecuaespana,Ecuador
bank_187,,Coop De Ahorro Y Credito Nueva Huancavilca,Ecuador
bank_188,,Coop De Ahorro Y Credito Erco Ltda,Ecuador
bank_189,,Coop Ahorro Y Credito Camara Comercio De Ambato,Ecuador
bank_190,,Coop Ahorro Y Credito Mushuc Runa Ltda,Ecuador
bank_191,,Coop De Ahorro Y Credito Ambato Ltda,Ecuador
bank_192,,Coop De Ahorro Y Credito Dorado Ltda,Ecuador
bank_193,,Coop De Ahorro Y Credito Nuestros Abuelos Ltda,Ecuador
bank_194,,Coop De Ahorro Y Credito Artesanos Ltda,Ecuador
bank_195,,Coop De Ahorro Y Credito Santa Anita Ltda,Ecuador
bank_196,,Coop De Ahorro Y Credito Huayco Pungo Ltda,Ecuador
bank_197,,Coop Manuel Esteban Godoy Ortega Ltda Coopmego,Ecuador
bank_198,,Coop Ahorro Y Credito Padre Julian Lorente Ltda,Ecuador
bank_199,,Coop Ahorro Y Credito Cariamanga Ltda,Ecuador
bank_200,,Coop De Ahorro Y Credito Marcabeli Ltda,Ecuador
bank_201,,Coop De Ahorro Y Credito Agricola Junin Ltda,Ecuador
bank_202,,Coop De Ahorro Y Credito Puerto Lopez Ltda,Ecuador
bank_203,,Coop De Ahorro Y Credito Nueva Esperanza,Ecuador
bank_204,,Coop De Ahorro Y Credito San Jorge Ltda,Ecuador
bank_205,,Coop De Ahorro Y Credito Fernando Daquilema,Ecuador
bank_206,,Coop De A Y C Educadores De Pastaza Ltda,Ecuador
bank_207,,Coop. A. Y C. De La Peq. Emp. Cacpe Zamora Ltda,Ecuador
bank_208,,Coop. De A. Y C. Desarrollo Integral Ltda,Ecuador
bank_209,,Coop. De Ahorro Y Credito El Calvario Ltda,Ecuador
bank_210,,Coop. De A. Y C. Juan Pio De Mora Ltda,Ecuador
bank_211,,Coop. De Ahorro Y Credito Pilahuin,Ecuador
bank_212,,Coop. De Ahorro Y Credito Pucara Ltda,Ecuador
bank_213,,Coop. A. Y C. Camara De Comercio De Pindal Cadecop,Ecuador
bank_214,,Banco Del Instituto Ecuatoriano De Seguridad Social,Ecuador
bank_215,,Coop De A Y C De Serv Publ Del Min Educacion Y Cul,Ecuador
bank_216,,Coop De A Y C 23 De Mayo Ltda,Ecuador
bank_217,,Coop De A Y C Coca Ltda,Ecuador
bank_218,,Coop De Ahorro Y Credito Pilahuin Tio Ltda,Ecuador
bank_219,,Coop De Ahorro Y Credito Huaicana Ltda,Ecuador
bank_220,,Coop De A Y C Credisur Ltda,Ecuador
bank_221,,Fondo De Cesantia Del Magisterio Ecuat Fcme-Fcpc,Ecuador
bank_222,,Coop De Ahorro Y Credito Huaquillas Ltda,Ecuador
bank_223,,Coop De A Y C Banos Ltda,Ecuador
bank_224,,Coop De Ahorro Y Credito Cac-Cica Mies,Ecuador
bank_225,,Coop De A Y C Vencedores De Tungurahua,Ecuador
bank_226,,Coop A Y C Ecuafuturo Ltda,Ecuador
bank_227,,Coop De A Y C Maquita Cushun Ltda,Ecuador
bank_228,,Coop De A Y C Valles Del Lirio,Ecuador
bank_229,,Coop Esfuerzo Unido Para El Desarr Del Chilco,Ecuador
bank_230,,Coop A Y C Carroceros De Tungurahua,Ecuador
bank_231,,Coop De Ahorro Y Credito Simiatug Ltda,Ecuador
bank_232,,Coop De A Y C Sinchi Runa Ltda,Ecuador
bank_233,,Coop De A Y C Santa Rosa De Pautan Ltda,Ecuador
bank_234,,Coop De Ahorro Y Credito San Miguel De Sigchos,Ecuador
bank_235,,Coop De A Y C Sierra Centro Ltda,Ecuador
bank_236,,Coop De A Y C Gonzanama Mies,Ecuador
bank_237,,Coop De Ahorro Y Credito Quilanga Ltda,Ecuador
bank_238,,Coop De Ahorro Y Credito 27 De Abril Loja,Ecuador
bank_239,,Coop De A Y C Crediamigo Ltda Loja Mies,Ecuador
bank_240,,Coop De Ahorro Y Credito Fortuna Mies,Ecuador
bank_241,,Coop A Y C Profesionales Del Volante Union Ltda,Ecuador
bank_242,,Coop De Ahorro Y Credito Cacpe Celica,Ecuador
bank_243,,Coop De A Y C Futuro Y Progreso De Galapagos Ltda,Ecuador
bank_244,,Coop De A Y C Sumac Llacta Ltda,Ecuador
bank_245,,Coop De A Y C Lucha Campesina Ltda,Ecuador
bank_246,,Coop De A Y C Maquita Cushunchic Ltda,Ecuador
bank_247,,Coop A Y C Focla,Ecuador
bank_248,,Coop De A Y C Casag Ltda,Ecuador
bank_249,,Banco D Miro Sa,Ecuador
bank_250,,Coop De A Y C General Ruminahui,Ecuador
bank_251,,Coop De A Y C Financiera Indigena Ltda,Ecuador
bank_252,,Coop A Y C 20 Febrero Ltda,Ecuador
bank_253,,Coop De A Y C Del Col. Fisc. Vicente Rocafuerte,Ecuador
bank_254,,Coop De A Y C Jadan Ltda (Mies),Ecuador
bank_255,,Coop De A Y C Inka Kipu Ltda,Ecuador
bank_256,,Coop De A Y C Accion Tungurahua Ltda,Ecuador
bank_257,,Coop De A Y C Pijal,Ecuador
bank_258,,Coop De A Y C Escencia Indigena Ltda,Ecuador
bank_259,,Coop De A Y C Union Mercedaria Ltda,Ecuador
bank_260,,Coop De A Y C Catamayo Ltda,Ecuador
bank_261,,Coop De A Y C De La Peq Empresa Cacpe Macara,Ecuador
bank_262,,Coop A Y C Nuevos Horizontes El Oro Ltda,Ecuador
bank_263,,Banco Coopnacional Sa,Ecuador
bank_264,,Coop De A Y C 16 De Junio,Ecuador
bank_265,,Coop A Y C Esc Sup Politec Agrop De Manabi Manuel,Ecuador
bank_266,,Coop De Ahorro Y Credito Fasaynan Ltda,Ecuador
bank_267,,Coop Cacique Guritave,Ecuador
bank_268,,Coop Solidaridad Y Progreso Oriental,Ecuador
bank_269,,Coop. De Aho Y Cred Los Andes Latinos Ltda.,Ecuador
bank_270,,C. De A. Y C Coopac Austro Ltda (Miess),Ecuador
bank_271,,Coop. De A. Y C. Salasaca,Ecuador
bank_272,,Coop. De A. Y C. Sumak Samy Ltda.,Ecuador
bank_273,,C. A. Y C. Intercult. Tarpuk Runa Ltda.,Ecuador
bank_274,,Coop. De A. Y C. Virgen Del Cisne,Ecuador
bank_275,,C. De A Y C Educad. De Zamora Chinchipe,Ecuador
bank_276,,C. De Ah. Y Credito Las Lagunas (Miess),Ecuador
bank_277,,C. De A Y C. Educadores De El Oro Ltd,Ecuador
bank_278,,C De A Y C Emplead Bancar Del Oro Ltda,Ecuador
bank_279,,Cooperativa De Ah. Y Credito Riochico,Ecuador
bank_280,,C. De A. Y C. San Martin De Tisaleo Ltda.,Ecuador
bank_281,,Coop. De A. Y C. Alli Tarpuc Ltda.,Ecuador
bank_282,,C. De A Y C. San Miguel De Pallatanga,Ecuador
bank_283,,Coop De A Y C Fenix,Ecuador
bank_284,,Coop.De Ahorro Y Credito Camara De Comercio De Loj,Ecuador
bank_285,,Coop.De A. Y C. De Crecimiento Economico Rentable,Ecuador
bank_286,,Cooperativa De Ahorro Y Credito Santiago Ltda,Ecuador
bank_287,,Coop.De A. Y C. Popular Y Solidaria,Ecuador
bank_288,,Coop.De Ahorro Y Credito San Placido Ltda.,Ecuador
bank_289,,Coop.De Ahorro Y Credito Ciudad De Zamora,Ecuador
bank_290,,Coop. De A Y C De La Pequena Empresa De Palora,Ecuador
bank_291,,Coop. De A. Y C. Indigena Alfa Y Omega Ltda,Ecuador
bank_292,,Cooperativa De Ahorro Y Credito Crea Ltda ( Mies),Ecuador
bank_293,,Coop. De A. Y C. Chibuleo Ltda.,Ecuador
bank_294,,Coop. De A. Y C. El Tesoro Pillareno,Ecuador
bank_295,,Coop. De A. Y C. Kisapincha Ltda.,Ecuador
bank_296,,Coop. De A. Y C. Juventud Unida Ltda.,Ecuador
bank_297,,Coop. De A. Y C. Union Quisapincha Ltda.,Ecuador
bank_298,,Coop. De A. Y C. 13 De Abril Ltda,Ecuador
bank_299,,Coop. De A. Y C. Salinas Ltda.,Ecuador
bank_300,,Coop. De A. Y C. San Pedro Ltda.,Ecuador
bank_301,,Coop. De A. Y C. Los Chasquis Pastocalle Ltda.,Ecuador
bank_302,,Coop. De A. Y C. Coopindigena Ltda.,Ecuador
bank_303,,Coop. De A. Y C. La Union Ltda.,Ecuador
bank_304,,Coop. De A. Y C. Padre Vicente Ponce Rubio,Ecuador
bank_305,,Coop. De A. Y C. Mushug Causay Ltda.,Ecuador
bank_306,,Coop. De A. Y C. 29 De Agosto,Ecuador
bank_307,,Coop. De A. Y C. Credisocio,Ecuador
bank_308,,Coop. De A. Y C. Fondo Para El Desarrollo Y La Vid,Ecuador
bank_309,,Cooperativa De A Y C Nueva Vision,Ecuador
bank_310,,Coop. De Ahorro Y Credito Focash Ltda.,Ecuador
bank_311,,Coop. De A. Y C. San Vicente Del Sur Ltda.,Ecuador
bank_312,,Coop. De A. Y C. Para La Vivienda Orden Y Segurida,Ecuador
bank_313,,Coop De A. Y C. Camara De Comercio Joya De Los Sac,Ecuador
bank_314,,Coop. De A. Y C. Focap,Ecuador
bank_315,,Coop. De A. Y C. 18 De Noviembre,Ecuador
bank_316,,Cooperativa De Ahorro Y Credito Dr. Cornelio Saenz,Ecuador
bank_317,,Coop De A. Y C. Educadores Del Azuay,Ecuador
bank_318,,Coop. De A. Y C. Indigena Sac Ltda,Ecuador
bank_319,,Coop. De A. Y C. Credi Ya Ltda,Ecuador
bank_320,,Coop. De A. Y C. San Bartolome Ltda,Ecuador
bank_321,,Coop. De Ahorro Y Credito Mushuk Yuyay,Ecuador
bank_322,,Coop De A. Y C. Sisay Kanari,Ecuador
bank_323,,Cooperativa De A Y C Accion Imbaburapak Ltda.,Ecuador
bank_324,,Coop De A. Y C. Hermes Gaibor Verdesoto,Ecuador
bank_325,,Coop. De A. Y C. Semillas De Pangua,Ecuador
bank_326,,Cooperativa De A Y C Mushuk Solidaria,Ecuador
bank_327,,Coop De A. Y C. Panamericana Ltda,Ecuador
bank_328,,Coop. De A. Y C. Vilcabamba Cacvil,Ecuador
bank_329,,Coop. De A. Y C. Familia Solidaria,Ecuador
bank_330,,Cooperativa De Ahorro Y Credito El Paraiso Manga D,Ecuador
bank_331,,Coac De Los Profesores Empleados Y Trabajadores De,Ecuador
bank_332,,Coac. Santa Rosa De San Carlos Ltda.,Ecuador
bank_333,,Coop. De A. Y C. Constructor Del Desarrollo Solida,Ecuador
bank_334,,Coop De A. Y C. Mushuk Yuyay Ltda,Ecuador
bank_335,,Corporacion Financiera,Ecuador
bank_336,,Coop. De A. Y C. Alianza Social Ecu. Alsec,Ecuador
bank_337,,Coop. De A. Y C. Renovadora Ecu,Ecuador
bank_338,,Coop. De A. Y C. Mushuk Yuyay - Napo,Ecuador
bank_339,,Coop. De A. Y C. Santa Ana De Nayon,Ecuador
bank_340,,Coop. De A. Y C. Educadores Del Napo,Ecuador
bank_341,,Cooperativa De A. Y C. Textil 14 De Marzo,Ecuador
bank_342,,Coop. De A Y C San Carlos Ltda.,Ecuador
bank_343,,Coac A Y C Esperanza De Valle De La Virgen Ltda.,Ecuador
bank_344,,Coac A Y C Zona De Capital Corcimol,Ecuador
bank_345,,Coop.De A. Y C. Artesanal Del Azuay,Ecuador
bank_346,,Cooperativa De Ahorro Y Credito Sumak Sisa,Ecuador
bank_347,,Coop. De A. Y C. Rey David Ltda,Ecuador
bank_348,,Coop. De A. Y C. Kullki Wasi Ltda.,Ecuador
bank_349,,Coop De A. Y C. Sinchi Codefis,Ecuador
bank_350,,Coop. De A. Y C. Fuerza De Los Andes,Ecuador
bank_351,,Coop De A. Y C. Camino De Luz Ltda.,Ecuador
bank_352,,Coac A Y C Educadores De Bolivar,Ecuador
bank_353,,Coac San Miguel Ltda.,Ecuador
bank_354,,Coop. De A. Y C. Salinerita,Ecuador
bank_355,,Coop. De A. Y C. Bola Amarilla,Ecuador
bank_356,,Coop A Y C Vision De Los Andes Visandes,Ecuador
bank_357,,Coop. De A. Y C. Senor Del Arbol,Ecuador
bank_358,,Coop. De A. Y C. Camara De Comercio De La Mana,Ecuador
bank_359,,Coop De A. Y C. Educadores De Loja,Ecuador
bank_360,,Coop De A. Y C. Indigena Sac Latacunga Ltda,Ecuador
bank_361,,Coop De A.Y C. Cadecog Gonzanama,Ecuador
bank_362,,Coac Coopymec Macara,Ecuador
bank_363,,Coac Cadecom Macara,Ecuador
bank_364,,Coop De A. Y C. 22 De Junio-Orianga,Ecuador
bank_365,,Coop. A.Yc.Sagrada Familia Solidaridad,Ecuador
bank_366,,Coop. De A. Y C. Naupa Kausay,Ecuador
bank_367,,Ccop A Y C De Apecap Cac Apecap,Ecuador
bank_368,,Coop De A. Y C. San Juan De Cotogchoa,Ecuador
bank_369,,Coop De Ahorro Y Credito La Merced,Ecuador
bank_370,,Coop. De A. Y C. Cooptopaxi Ltda.,Ecuador
bank_371,,Coop. De A. Y C. Grameen Amazonas,Ecuador
bank_372,,Coop. De A. Y C. El Transportista Cacet,Ecuador
bank_373,,Coop. De A Y C. Servidores Municipales De Cuenca,Ecuador
bank_374,,Coop. De Ahorro Y Credito Profuturo Ltda.,Ecuador
bank_375,,Coop. De A. Y C. Iliniza Ltda.,Ecuador
bank_376,,Coop. De Ahorro Y Credito Saraguros,Ecuador
bank_377,,Cooperativa De Ahorro Y Credito Inti Wasi Ltda.,Ecuador
bank_378,,Cooperativa De Ahorro Y Credito San Isidro Ltda.,Ecuador
bank_379,,Coop. De A. Y C. Empresas Comunitarias Coocredito,Ecuador
bank_380,,Silvercross S.A Casa De Valores Sccv,Ecuador
bank_381,,Real Casa De Valores De Guayaquil S.A.,Ecuador
bank_382,,Cooperativa De Ahorro Y Credito Etapa,Ecuador
bank_383,,Coop. Ahorro Y Credito Mascoop,Ecuador
bank_384,,Coop. De A. Y C. Saint Michel Ltda.,Ecuador
bank_385,,Coop. Ahorro Y Credito Manantial De Oro Ltda.,Ecuador
bank_386,,Coop. De Ahorro Y Credito Andina Ltda.,Ecuador
bank_387,,Coop. De Ahorro Y Credito Accion Y Desarrollo Ltda,Ecuador
bank_388,,Coop. De A. Y C. Union Y Desarrollo,Ecuador
bank_389,,Coop. De A. Y C. Esperanza Del Futuro Ltda.,Ecuador
bank_390,,Coop. De A. Y C. 17 De Marzo Ltda,Ecuador
bank_391,,Coop. De A. Y C. Catar Ltda,Ecuador
bank_392,,Coop. De A. Y C. De Accion Popular,Ecuador
bank_393,,Coop. De A. Y C. Alli Tarpuk Ltda,Ecuador
bank_394,,Coop. De A. Y C. 16 De Julio Ltda,Ecuador
bank_395,,Coop. De A. Y C. Suboficiales De La Policia Nacion,Ecuador
bank_396,,Coop. De A. Y C. Politecnica Ltda.,Ecuador
bank_397,,Coop. De A. Y C. Nacional Llano Grande Ltda.,Ecuador
bank_398,,Coop. De A. Y C. San Valentin,Ecuador
bank_399,,Coop. De A. Y C. Totalife Ltda,Ecuador
bank_400,,Acciones Valores Casa De Valores S.A. Accival,Ecuador
bank_401,,Santa Fe Casa De Valores S.A. Santafevalores,Ecuador
bank_402,,Picaval Casa De Valores S.A,Ecuador
bank_403,,Analytica Securties C.A. Casa De Valores,Ecuador
bank_404,,Orion Casa De Valores S.A,Ecuador
bank_405,,Stratega Casa De Valores S.A.,Ecuador
bank_406,,Ecofsa Casa De Valores S.A.,Ecuador
bank_407,,Merchantvalores Casa De Valores S.A.,Ecuador
bank_408,,Casa De Valores Value S.A.,Ecuador
bank_409,,Inmovalor Casa De Valores S.A.,Ecuador
bank_410,,Ecuabursatil Casa De Valores S.A.,Ecuador
bank_411,,Plus Valores Casa De Valores S.A.,Ecuador
bank_412,,Mercapital Casa De Valores S.A.,Ecuador
bank_413,,Portafolio Casa De Valores S.A. Portavalor,Ecuador
bank_414,,Metrovalores Casa De Valores S.A.,Ecuador
bank_415,,Vectorglobal Wmg Casa De Valores S.A.,Ecuador
bank_416,,Holdunpartners Casa De Valores S.A.,Ecuador
bank_417,,Coop. De Ahorro Y Credito Base De Taura,Ecuador
bank_418,,Casa De Valores Banrio S.A.,Ecuador
bank_419,,Albion Casa De Valores S.A.,Ecuador
bank_420,,Masvalores Casa De Valores S.A Cavamasa,Ecuador
bank_421,,Casa De Valores Del Pacifico (Valpacifico) S.A.,Ecuador
bank_422,,Casa De Valores Advfin S.A.,Ecuador
bank_423,,Kapital One Casa De Valores S.A. Kaovalsa,Ecuador
bank_424,,Plusbursatil Casa De Valores S.A,Ecuador
bank_425,,Activa Ases.E Intermed.Valores Activalores Casa De,Ecuador
bank_426,,Citadel Casa De Valores S.A.,Ecuador
bank_427,,Decevale S.A.,Ecuador
bank_428,,Coop. De A. Y C. Santa Lucia Ltda,Ecuador
bank_429,,Coop. De A. Y C. Produactiva Ltda,Ecuador
bank_430,,Coop. De A. Y C. Tamboloma Ltda.,Ecuador
bank_431,,Coop De A. Y C. Pushak Runa Hombre Lider,Ecuador
bank_432,,Coop. De A. Y C. 15 De Agosto Ltda.,Ecuador
bank_433,,Coop. De A. Y C. Migrantes Del Ecuador Ltda,Ecuador
bank_434,,Cooperativa De Ahorro Y Credito Wuamanloma Ltda.,Ecuador
bank_435,,Coop. De A. Y C. Salate Ltda.,Ecuador
bank_436,,Coop. De A. Y C. Union Popular Ltda.,Ecuador
bank_437,,Coac Achik Inti Ltda,Ecuador
bank_438,,Coac El Migrante Solidario,Ecuador
bank_439,,Coop Ac Las Naves,Ecuador
bank_440,,Coop. De A. Y C. De Imbabura Amazonas,Ecuador
bank_441,,Coop. A. Y C. De Indigenas Chuchuqui Ltda,Ecuador
bank_442,,Coop. Ahorro Y Credito Focazsum Ltda.,Ecuador
bank_443,,Coop. De A. Y C. Solidaria Ltda.- Cotopaxi,Ecuador
bank_444,,Coop. De A. Y C. Unidad Y Progreso,Ecuador
bank_445,,Coac Loja Internacional Ltda.,Ecuador
bank_446,,Coac 23 De Enero,Ecuador
bank_447,,Coac Obras Publicas Fiscales De Loja Y Zamora,Ecuador
bank_448,,Coac Del Sind Chof Prof Virgen Del Cisne,Ecuador
bank_449,,Coac San Miguel De Chirijos Ltda,Ecuador
bank_450,,Coop. Ahorro Y Credito Quevedo Ltda.,Ecuador
bank_451,,Coop. De A. Y C. El Altar Ltda.,Ecuador
bank_452,,Coop. De A. Y C. Nueva Alianza De Chimborazo Ltda,Ecuador
bank_453,,Coop. De A. Y C. Luis Felipe Duchicela Xxvii,Ecuador
bank_454,,Coop. De A. Y C. Nizag Ltda.,Ecuador
bank_455,,Coop. De A. Y C. Makita Kunchik,Ecuador
bank_456,,Coop. De A. Y C. Cerrada Manuela Leon,Ecuador
bank_457,,Coop. De A. Y C. El Buen Sembrador Ltda.,Ecuador
bank_458,,Coac Sindicato De Choferes Profesionales De Yantza,Ecuador
bank_459,,Coop. De A. Y C. 5 De Mayo De Santa Martha De Cuba,Ecuador
