"id","code","name","tag_ids","account_type","description","reconcile","non_trade","active","parent_id","depreciation_model_id","name@zh_HK","description@zh_HK"
"l10n_hk_110000","110000","Cash and cash equivalents","","asset_cash","Parent account for all cash equivalents","False","False","False","","","現金及現金等價物","所有現金等價物的母賬戶"
"l10n_hk_110100","110100","Bank","","asset_cash","Main operating bank accounts","True","False","True","l10n_hk_110000","","銀行","營業主要往來銀行賬戶"
"l10n_hk_110200","110200","Cash","","asset_cash","Petty cash and cash on hand","True","False","True","l10n_hk_110000","","現金","零用現金及手頭現金"
"l10n_hk_110300","110300","Stripe Issuing","","asset_current","Card issuing clearing account","True","False","True","l10n_hk_110000","","Stripe Issuing","發卡功能結算賬戶"
"l10n_hk_110400","110400","Bank Suspense Account","","asset_current","Temporary holding for unidentified bank lines","True","False","True","l10n_hk_110000","","銀行暫記賬","未識別銀行款項的臨時記賬賬戶"
"account_journal_payment_debit_account_id","110500","Outstanding Receipts","","asset_current","Incoming payments pending reconciliation","True","False","True","l10n_hk_110000","","未結清收款","有待對賬的收款"
"account_journal_payment_credit_account_id","110600","Outstanding Payments","","asset_current","Outgoing payments pending reconciliation","True","False","True","l10n_hk_110000","","未結清付款","有待對賬的對外付款"
"l10n_hk_110700","110700","Funds in Transit","","asset_current","Funds transferring between accounts or gateways","False","False","True","l10n_hk_110000","","在途資金","正於賬戶間或網關之間轉賬途中的資金"
"l10n_hk_120000","120000","Trade and other receivables","","asset_current","Parent account for receivables","False","False","False","","","貿易及其他應收款項","應收款項的母賬戶"
"l10n_hk_120100","120100","Account Receivable","account.account_tag_operating","asset_receivable","Trade receivables from customers","True","False","True","l10n_hk_120000","","應收款項","客戶未付的貿易應收款項"
"l10n_hk_120200","120200","Account Receivable (PoS)","account.account_tag_operating","asset_receivable","Receivables from Point of Sale systems","True","False","True","l10n_hk_120000","","應收款項 (POS)","來自銷售點 (POS) 系統的應收款項"
"l10n_hk_120300","120300","Other Receivable","account.account_tag_operating","asset_receivable","Non-trade related receivables","True","True","True","l10n_hk_120000","","其他應收款項","非貿易相關的應收款項"
"l10n_hk_120400","120400","Amount Due from Directors","account.account_tag_operating","asset_current","Advances or loans to directors","False","False","True","l10n_hk_120000","","應收董事款項","預支或借貸給董事的款項"
"l10n_hk_125100","125100","Utility & Rental Deposit","account.account_tag_operating","asset_current","Deposits paid for office rent and utilities","False","False","True","l10n_hk_120000","","水電煤或租金按金","已付的辦公室租賃或公用事業按金"
"l10n_hk_125200","125200","Sundry Deposits","account.account_tag_operating","asset_current","Miscellaneous deposits paid","False","False","True","l10n_hk_120000","","雜項按金","已付的雜項按金"
"l10n_hk_125300","125300","Supplier Prepayments","account.account_tag_operating","asset_prepayments","Advances paid to suppliers","False","False","True","l10n_hk_120000","","預繳供應商款項","預繳給供應商的款項"
"l10n_hk_125400","125400","Prepaid Expenses","account.account_tag_operating","asset_prepayments","Expenses paid in advance (e.g. annual insurance)","False","False","True","l10n_hk_120000","","預繳開支","預繳開支費用 (例如保險全年保費)"
"l10n_hk_126000","126000","Assets for current tax","","asset_current","Parent account for current tax assets","False","False","False","","","當期稅項資產","當期稅項資產的母賬戶"
"l10n_hk_126100","126100","Prepaid Tax","","asset_current","Tax paid in advance","False","False","True","l10n_hk_126000","","預繳稅款","預先繳付的稅款"
"l10n_hk_130000","130000","Inventories","","asset_current","Parent account for inventories","False","False","False","","","存貨","存貨的母賬戶"
"l10n_hk_130100","130100","Stock Valuation Account","account.account_tag_operating","asset_current","Inventory on hand","False","False","True","l10n_hk_130000","","存貨估值賬戶","手上現有存貨"
"l10n_hk_140000","140000","Financial assets","","asset_non_current","Parent account for financial assets","False","False","False","","","金融資產","金融資產的母賬戶"
"l10n_hk_140100","140100","Unlisted Equity Investments","account.account_tag_investing","asset_non_current","Investments in unlisted shares (not subsidiaries or JVs)","False","False","True","l10n_hk_140000","","非上市股本投資","非上市股份的投資 (不包括附屬公司或合資聯營企業)"
"l10n_hk_140200","140200","Long-Term Debt Securities","","asset_non_current","Investments in bonds or debentures","False","False","True","l10n_hk_140000","","長期債務證券","債券或債權證投資"
"l10n_hk_150000","150000","Property Plant and Equipment","","asset_fixed","Parent account for PPE","False","False","False","","","物業、廠房及設備","物業、廠房及設備的母賬戶"
"l10n_hk_150100","150100","Buildings","account.account_tag_investing","asset_fixed","Owned commercial or residential buildings","False","False","True","l10n_hk_150000","asset_50_year_linear","樓宇","名下擁有的商業或住宅樓宇"
"l10n_hk_150110","150110","Accumulated Depreciation - Buildings","account.account_tag_investing","asset_fixed","Contra-account for Buildings","False","False","True","l10n_hk_150000","","累計折舊 - 樓宇","樓宇資產的對銷賬戶"
"l10n_hk_150200","150200","Leasehold Improvements","account.account_tag_investing","asset_fixed","Office fit-outs and leasehold improvements","False","False","True","l10n_hk_150000","asset_3_year_linear","租賃物業修繕","辦公室或租賃物業裝修及改善"
"l10n_hk_150210","150210","Accumulated Depreciation - Leasehold Improvements","account.account_tag_investing","asset_fixed","Contra-account for Installations","False","False","True","l10n_hk_150000","","累計折舊 - 租賃物業修繕","租賃物業裝修及改善的對銷賬戶"
"l10n_hk_150300","150300","Plant and Machinery","account.account_tag_investing","asset_fixed","Heavy machinery and specialized tools","False","False","True","l10n_hk_150000","asset_10_year_linear","廠房及機器","重型機器及專用工具"
"l10n_hk_150310","150310","Accumulated Depreciation - Plant and Machinery","account.account_tag_investing","asset_fixed","Contra-account for Machines","False","False","True","l10n_hk_150000","","累計折舊 - 廠房及機器","重型機器的對銷賬戶"
"l10n_hk_150400","150400","Furniture and Fixtures","account.account_tag_investing","asset_fixed","Office furniture and material","False","False","True","l10n_hk_150000","asset_5_year_linear","傢俬及裝置","辦公室傢俬及裝置物料"
"l10n_hk_150410","150410","Accumulated Depreciation - Furniture and Fixtures","account.account_tag_investing","asset_fixed","Contra-account for Furniture","False","False","True","l10n_hk_150000","","累計折舊 - 傢俬及裝置","辦公室傢俬的對銷賬戶"
"l10n_hk_150500","150500","Office & Computer Equipment","account.account_tag_investing","asset_fixed","IT equipment and servers","False","False","True","l10n_hk_150000","asset_3_year_linear","辦公室及電腦設備","資訊科技設備及伺服器"
"l10n_hk_150510","150510","Accumulated Depreciation - Office & Computer Equipment","account.account_tag_investing","asset_fixed","Contra-account for Technology","False","False","True","l10n_hk_150000","","累計折舊 - 辦公室及電腦設備","資訊科技設備的對銷賬戶"
"l10n_hk_150600","150600","Motor Vehicles","account.account_tag_investing","asset_fixed","Company fleet and accessories","False","False","True","l10n_hk_150000","asset_4_year_linear","車輛","公司車隊及車輛配件"
"l10n_hk_150610","150610","Accumulated Depreciation - Motor Vehicles","account.account_tag_investing","asset_fixed","Contra-account for Vehicles","False","False","True","l10n_hk_150000","","累計折舊 - 車輛","車輛資產的對銷賬戶"
"l10n_hk_155000","155000","Right-of-Use Assets (Leases)","","asset_fixed","Parent account for Capitalized Leases","False","False","False","","","使用權資產 (出租租賃)","資本化出租物業的母賬戶"
"l10n_hk_155100","155100","ROU Assets - Premises","account.account_tag_investing","asset_fixed","Capitalized office/warehouse leases","False","False","True","l10n_hk_155000","asset_3_year_linear","使用權資產 - 物業","資本化的辦公室/倉庫出租租賃"
"l10n_hk_155110","155110","Accumulated Depreciation - ROU Premises","account.account_tag_investing","asset_fixed","Contra-account for ROU Premises","False","False","True","l10n_hk_155000","","累計折舊 - 使用權物業","使用權物業的對銷賬戶"
"l10n_hk_155200","155200","ROU Assets - Equipment","account.account_tag_investing","asset_fixed","Capitalized equipment leases","False","False","True","l10n_hk_155000","asset_5_year_linear","使用權資產 - 設備","資本化設備出租租賃"
"l10n_hk_155210","155210","Accumulated Depreciation - ROU Equipment","account.account_tag_investing","asset_fixed","Contra-account for ROU Equipment","False","False","True","l10n_hk_155000","","累計折舊 - 使用權設備","使用權設備的對銷賬戶"
"l10n_hk_155300","155300","ROU Assets - Vehicles","account.account_tag_investing","asset_fixed","Capitalized vehicle leases","False","False","True","l10n_hk_155000","asset_4_year_linear","使用權資產 - 車輛","資本化車輛出租租賃"
"l10n_hk_155310","155310","Accumulated Depreciation - ROU Vehicles","account.account_tag_investing","asset_fixed","Contra-account for ROU Vehicles","False","False","True","l10n_hk_155000","","累計折舊 - 使用權車輛","使用權車輛的對銷賬戶"
"l10n_hk_158000","158000","Investment property carried at cost","","asset_fixed","Investment property at cost","False","False","False","","","投資物業 - 按成本列賬","以成本列賬的投資物業"
"l10n_hk_158100","158100","Investment Property - Commercial","account.account_tag_investing","asset_fixed","Properties held for rental/capital yield","False","False","True","l10n_hk_158000","asset_no_depreciation","投資物業 - 商業","為收租/資本增值而持有的物業"
"l10n_hk_159000","159000","Investment property carried at fair value","","asset_fixed","Parent account for fair value investment properties","False","False","False","","","投資物業 - 按公允價值列賬","以公允價值列賬的投資物業的母賬戶"
"l10n_hk_159100","159100","Investment Property (Fair Value)","","asset_fixed","Investment properties measured at fair value","False","False","True","l10n_hk_159000","","投資物業 (公允價值)","以公允價值計量的投資物業"
"l10n_hk_160000","160000","Intangible Assets","","asset_non_current","Parent account for intangible assets","False","False","False","","","無形資產","無形資產的母賬戶"
"l10n_hk_160100","160100","Computer Software","account.account_tag_investing","asset_non_current","Standalone software or IP","False","False","True","l10n_hk_160000","asset_3_year_linear","電腦軟件","獨立軟件或知識產權資產"
"l10n_hk_160110","160110","Accumulated Amortization - Computer Software","account.account_tag_investing","asset_non_current","Contra-account for Software","False","False","True","l10n_hk_160000","","累計攤銷 - 電腦軟件","電腦軟件的對銷賬戶"
"l10n_hk_160200","160200","Patents & Copyrights","account.account_tag_investing","asset_non_current","Registered IP rights","False","False","True","l10n_hk_160000","asset_10_year_linear","專利及版權","已註冊的知識產權"
"l10n_hk_160210","160210","Accumulated Amortization - Patents & Copyrights","account.account_tag_investing","asset_non_current","Contra-account for Patents","False","False","True","l10n_hk_160000","","累計攤銷 - 專利及版權","專利及版權的對銷賬戶"
"l10n_hk_160300","160300","Trademarks & Brand Names","account.account_tag_investing","asset_non_current","Registered trademarks","False","False","True","l10n_hk_160000","asset_10_year_linear","商標及品牌名稱","註冊商標"
"l10n_hk_160310","160310","Accumulated Amortization - Trademarks & Brand Names","account.account_tag_investing","asset_non_current","Contra-account for Trademarks","False","False","True","l10n_hk_160000","","累計攤銷 - 商標及品牌名稱","商標的對銷賬戶"
"l10n_hk_160400","160400","Franchise Rights & Licenses","account.account_tag_investing","asset_non_current","Operating licenses","False","False","True","l10n_hk_160000","asset_10_year_linear","特許經營權及牌照","營運業務的牌照及許可"
"l10n_hk_160410","160410","Accumulated Amortization - Franchise Rights & Licenses","account.account_tag_investing","asset_non_current","Contra-account for Franchises","False","False","True","l10n_hk_160000","","累計攤銷 - 特許經營權及牌照","特許經營權的對銷賬戶"
"l10n_hk_165000","165000","Other Non-Current Assets","","asset_non_current","Parent account for other non-current assets","False","False","False","","","其他非流動資產","其他非流動資產的母賬戶"
"l10n_hk_165100","165100","Other Non-Current Assets","","asset_non_current","Miscellaneous long-term assets","False","False","True","l10n_hk_165000","","其他非流動資產","雜項長期資產"
"l10n_hk_166000","166000","Investments in associates","","asset_non_current","Parent account for associate investments","False","False","False","","","關聯公司投資","關聯公司投資的母賬戶"
"l10n_hk_166100","166100","Investment in Associates","account.account_tag_investing","asset_non_current","Investments in associates","False","False","True","l10n_hk_166000","","關聯公司投資","關聯公司投資"
"l10n_hk_167000","167000","Investments in jointly controlled entities","","asset_non_current","Parent account for JV investments","False","False","False","","","共同控制實體投資","合資聯營企業/共同控制實體投資的母賬戶"
"l10n_hk_167100","167100","Investment in Joint Ventures","account.account_tag_investing","asset_non_current","Investments in Joint Ventures","False","False","True","l10n_hk_167000","","合資企業投資","合資企業投資"
"l10n_hk_168000","168000","Biological assets","","asset_non_current","Parent account for biological assets","False","False","False","","","生物資產","生物資產的母賬戶"
"l10n_hk_168100","168100","Biological Assets","","asset_non_current","Living animals or plants","False","False","True","l10n_hk_168000","","生物資產","活體動物或植物"
"l10n_hk_169000","169000","Deferred tax assets","","asset_non_current","Parent account for deferred tax assets","False","False","False","","","遞延稅項資產","遞延稅項資產的母賬戶"
"l10n_hk_169100","169100","Deferred Tax Assets","account.account_tag_operating","asset_non_current","Deferred tax assets","False","False","True","l10n_hk_169000","","遞延稅項資產","遞延稅項資產"
"l10n_hk_210000","210000","Financial liabilities (Non-current)","","liability_non_current","Parent account for non-current financial liabilities","False","False","False","","","非流動金融負債","非流動金融負債的母賬戶"
"l10n_hk_210100","210100","Long-Term Bank Loans","account.account_tag_financing","liability_non_current","Bank loans due after 12 months","False","False","True","l10n_hk_210000","","長期銀行貸款","不在 12 個月內到期的銀行貸款"
"l10n_hk_210200","210200","Unearned Income from System","account.account_tag_operating","liability_non_current","Long-term deferred revenue","False","False","True","l10n_hk_210000","","未賺取的系統性預期收入","長期遞延收入"
"l10n_hk_213000","213000","Deferred tax liabilities","","liability_non_current","Parent account for deferred tax liabilities","False","False","False","","","遞延稅項負債","遞延稅項負債的母賬戶"
"l10n_hk_213100","213100","Deferred Tax Liabilities","account.account_tag_operating","liability_non_current","Deferred tax liabilities","False","False","True","l10n_hk_213000","","遞延稅項負債","遞延稅項負債"
"l10n_hk_214000","214000","Provisions (Non-current)","","liability_non_current","Parent account for non-current provisions","False","False","False","","","撥備 (非流動)","非流動撥備的母賬戶"
"l10n_hk_214100","214100","Long-Term Provisions","","liability_non_current","Long-term provisions","False","False","True","l10n_hk_214000","","長期撥備","長期撥備"
"l10n_hk_220000","220000","Trade and other payables","","liability_current","Parent account for payables","False","False","False","","","貿易及其他應付款項","應付款項的母賬戶"
"l10n_hk_220100","220100","Account Payable","account.account_tag_operating","liability_payable","Trade payables to suppliers","True","False","True","l10n_hk_220000","","應付款項","應付供應商的貿易賬款"
"l10n_hk_220200","220200","Other Payable","account.account_tag_operating","liability_payable","Non-trade payables","True","True","True","l10n_hk_220000","","其他應付款項","非貿易應付款項"
"l10n_hk_220300","220300","Receipt in Advance (Customer Prepayments)","account.account_tag_operating","liability_current","Deposits received from customers","False","False","True","l10n_hk_220000","","預收款項 (客戶預繳款項)","客戶預繳的訂金"
"l10n_hk_220400","220400","Amount Due to Directors","account.account_tag_operating","liability_current","Advances or loans from directors","False","False","True","l10n_hk_220000","","應付董事款項","董事墊支款項或貸款"
"l10n_hk_221100","221100","Accruals","account.account_tag_operating","liability_current","Accrued expenses","False","False","True","l10n_hk_220000","","應計費用","應計的未付開支或費用"
"l10n_hk_221200","221200","Salaries and Wages Payable","account.account_tag_operating","liability_current","Salaries and wages owed to employees","False","False","True","l10n_hk_220000","","應付薪金及工資","未付給員工的薪金及工資"
"l10n_hk_221300","221300","MPF Accrued (Employer)","account.account_tag_operating","liability_current","Employer MPF contributions payable","False","False","True","l10n_hk_220000","","應付強積金供款 (僱主)","應付的僱主強積金供款"
"l10n_hk_221400","221400","MPF Withheld (Employee)","account.account_tag_operating","liability_current","Employee MPF withheld to be paid to provider","True","False","True","l10n_hk_220000","","代扣強積金供款 (僱員)","代扣以支付給受託人的僱員強積金供款"
"l10n_hk_221500","221500","Tax Withheld","account.account_tag_operating","liability_current","Taxes withheld payable to IRD","False","False","True","l10n_hk_220000","","代扣稅款","應付稅務局的代扣稅項"
"l10n_hk_221600","221600","Staff Housing Accrued","account.account_tag_operating","liability_current","Accrued expenses for staff housing allowance","True","False","True","l10n_hk_220000","","應計員工房屋津貼","員工房屋津貼的應計費用"
"l10n_hk_221800","221800","Proposed Dividend","account.account_tag_financing","liability_current","Dividends declared but not yet paid","False","False","True","l10n_hk_220000","","擬派股息","已宣派但尚未支付的股息"
"l10n_hk_224000","224000","Financial liabilities (Current)","","liability_current","Parent account for current financial liabilities","False","False","False","","","流動金融負債","流動金融負債的母賬戶"
"l10n_hk_224100","224100","Short-term Borrowing","account.account_tag_financing","liability_current","Short-term borrowing","False","False","True","l10n_hk_224000","","短期借貸","短期借貸款項"
"l10n_hk_225000","225000","Liabilities for current tax","","liability_current","Parent account for current tax liabilities","False","False","False","","","當期稅項負債","當期稅項負債的母賬戶"
"l10n_hk_225100","225100","Provision for Taxation","account.account_tag_operating","liability_current","Provision for current tax","False","False","True","l10n_hk_225000","","稅務撥備","為當期稅項作出的撥備"
"l10n_hk_230000","230000","Provisions","","liability_current","Parent account for Provisions","False","False","False","","","撥備","撥備的母賬戶"
"l10n_hk_230100","230100","General Provisions","account.account_tag_operating","liability_current","Provisions for warranties, legal claims, etc.","True","False","True","l10n_hk_230000","","一般撥備","為保用保證、法律索償等作出的撥備"
"l10n_hk_310000","310000","Share Capital & Premium","","equity","Parent account for share capital and premium","False","False","False","","","股本及股份溢價","股本及股份溢價的母賬戶"
"l10n_hk_310100","310100","Issued Capital","account.account_tag_financing","equity","Ordinary shares issued to shareholders","False","False","True","l10n_hk_310000","","已發行股本","已向股東發行的普通股股份"
"l10n_hk_310200","310200","Share Premium","account.account_tag_financing","equity","Amount received for shares in excess of their par value","False","False","True","l10n_hk_310000","","股份溢價","發行股份時所收取高於股份面值的金額"
"l10n_hk_320000","320000","Retained Earnings","","equity","Accumulated net income retained in the corporation","False","False","False","","","保留收益","公司保留的累計淨收入"
"l10n_hk_320100","320100","Retained Earnings","account.account_tag_financing","equity","Accumulated net income retained in the corporation","False","False","True","l10n_hk_320000","","保留收益","公司保留的累計淨收入"
"l10n_hk_320200","320200","Dividends","account.account_tag_financing","equity","Dividends paid to shareholders","False","False","True","l10n_hk_320000","","股息","支付給股東的股息"
"l10n_hk_330000","330000","Revaluation Surplus on Property, Plant and Equipment","","equity","Surplus arising from the revaluation of PPE","False","False","False","","","物業、廠房及設備重估盈餘","因物業、廠房或設備重新估值而產生的盈餘"
"l10n_hk_330100","330100","Revaluation Surplus on Property, Plant and Equipment","l10n_hk.account_tag_other_comprehensive_income","equity","Surplus arising from the revaluation of PPE","False","False","True","l10n_hk_330000","","物業、廠房及設備重估盈餘","因物業、廠房或設備重新估值而產生的盈餘"
"l10n_hk_340000","340000","Hedging Reserve","","equity","Effective portion of changes in fair value of cash flow hedges","False","False","False","","","對沖儲備","現金流對沖的公允價值變動之有效部分"
"l10n_hk_340100","340100","Hedging Reserve","l10n_hk.account_tag_other_comprehensive_income","equity","Effective portion of changes in fair value of cash flow hedges","False","False","True","l10n_hk_340000","","對沖儲備","現金流對沖的公允價值變動之有效部分"
"l10n_hk_350000","350000","Actuarial Gains/Losses Reserve","","equity","Cumulative actuarial gains and losses on defined benefit plans","False","False","False","","","精算收益/損失儲備","指定福利計劃的累計精算收益及損失"
"l10n_hk_350100","350100","Actuarial Gains/Losses Reserve","l10n_hk.account_tag_other_comprehensive_income","equity","Cumulative actuarial gains and losses on defined benefit plans","False","False","True","l10n_hk_350000","","精算收益/損失儲備","指定福利計劃的累計精算收益及損失"
"l10n_hk_390000","390000","Non-Controlling Interests","","equity","Portion of equity not attributable to the parent company","False","False","False","","","非控股權益","不屬於母公司的股權/權益部份"
"l10n_hk_390100","390100","Non-Controlling Interests (NCI)","account.account_tag_financing","equity","Portion of equity not attributable to the parent company","False","False","True","l10n_hk_390000","","非控股權益 (NCI)","不屬於母公司的股權/權益部份"
"l10n_hk_410100","410100","Trade Income","account.account_tag_operating","income","Primary revenue from operations","False","False","True","","","營業收入","營運的主要收入"
"l10n_hk_420100","420100","Sundry Income","account.account_tag_operating","income_other","Miscellaneous income","False","False","True","","","雜項收入","雜項收入"
"l10n_hk_420200","420200","Bank Interest Income","account.account_tag_operating","income_other","Interest earned on bank deposits","False","False","True","","","銀行利息收入","銀行存款賺取的利息"
"l10n_hk_420300","420300","Foreign Exchange Gain","account.account_tag_operating","income_other","Realized/Unrealized FX Gains","False","False","True","","","匯兌收益","已實現/未實現的外幣匯兌收益"
"l10n_hk_420400","420400","Cash Discount Gain","account.account_tag_operating","income_other","Discounts received from suppliers","False","False","True","","","現金折扣收益","獲供應商提供的折扣"
"l10n_hk_510100","510100","Trade Costs","account.account_tag_operating","expense_direct_cost","Direct cost of goods or services sold","False","False","True","","","營業成本","已售出商品或服務的直接成本 (銷貨成本)"
"l10n_hk_510200","510200","Raw materials","account.account_tag_operating","expense_direct_cost","Raw materials consumed","False","False","True","","","原材料","消耗的原材料"
