"id","code","name","account_type","reconcile","name@es"
"l10n_do_61021500","61021500","Hotel Accommodations","expense","False","Alojamiento en Hoteles"
"l10n_do_61030101","61030101","Legal (Individual)","expense","False","Legales (P. Física)"
"l10n_do_61030102","61030102","Accounting and Auditing (Individual)","expense","False","Contabilidad y Auditoría (P. Física)"
"l10n_do_61030103","61030103","Technology (Individual)","expense","False","Tecnología (P. Física)"
"l10n_do_61030104","61030104","Plant Maintenance (Individual)","expense","False","Mantenimientos de Planta (P. Física)"
"l10n_do_61030105","61030105","Premises Maintenance (Personal)","expense","False","Mantenimientos de Local (P. Física)"
"l10n_do_61030106","61030106","Furniture and Equipment Maintenance (Personal)","expense","False","Mantenimientos Mobiliarios y Equipos (P. Física)"
"l10n_do_61030107","61030107","Counseling (Individual)","expense","False","Asesorías (P. Física)"
"l10n_do_61030108","61030108","Fumigation (Individal)","expense","False","Fumigaciones (P. Física)"
"l10n_do_61030109","61030109","Copies and Scans (Individual)","expense","False","Copias y Escaneos (P. Física)"
"l10n_do_61030110","61030110","Surveillance Services (Individual)","expense","False","Servicios de Vigilancia (P. Física)"
"l10n_do_61030111","61030111","Other Professional Services (Individual)","expense","False","Otros Servicios Profesionales (P. Física)"
"l10n_do_61030201","61030201","Legal (Legal)","expense","False","Legales (P. Jurídica)"
"l10n_do_61030202","61030202","Accounting and Auditing (Legal)","expense","False","Contabilidad y Auditoría (P. Jurídica)"
"l10n_do_61030203","61030203","Technology (Legal)","expense","False","Tecnología (P. Jurídica)"
"l10n_do_61030204","61030204","Plant Maintenance (Legal)","expense","False","Mantenimiento de Planta (P. Jurídica)"
"l10n_do_61030205","61030205","Maintenance of Premises (Legal","expense","False","Mantenimiento del Local (P. Jurídica)"
"l10n_do_61030206","61030206","Furniture and Equipment Maintenance (Legal)","expense","False","Mantenimiento Mobiliario y Equipos (P. Jurídica)"
"l10n_do_61030207","61030207","Counseling (Legal)","expense","False","Asesorías (P. Jurídica)"
"l10n_do_61030208","61030208","Fumigation (Legal)","expense","False","Fumigaciones (P. Jurídica)"
"l10n_do_61030209","61030209","Copies and Scans (Legal)","expense","False","Copias y Escaneos (P. Jurídica)"
"l10n_do_61030210","61030210","Surveillance Services (Legal)","expense","False","Servicios de Vigilancia (P. Jurídica)"
"l10n_do_61030211","61030211","Other Professional Services (Legal)","expense","False","Otros Servicios Profesionales  (P. Jurídica)"
"l10n_do_61030301","61030301","Foreign Service Fees - Related","expense","False","Honorarios por Servicios del Exterior - Relacionadas"
"l10n_do_61030302","61030302","Foreign Services Fees - Third Parties","expense","False","Honorarios por Servicios del Exterior - Terceros"
"l10n_do_61040100","61040100","Building Depreciation Expense","expense_depreciation","False","Gastos por Depreciación de Edificios"
"l10n_do_61040200","61040200","Transportation Equipment Depreciation Expense","expense_depreciation","False","Gastos por Depreciación de Equipo de Transporte"
"l10n_do_61040300","61040300","Depreciation and amortization expense","expense_depreciation","False","Gastos por Depreciación de Mobiliario y Equipos"
"l10n_do_61040400","61040400","Machinery Depreciation Expense","expense_depreciation","False","Gastos por Depreciación de Maquinaria"
"l10n_do_61040500","61040500","Tools Depreciation Expense","expense_depreciation","False","Gastos por Depreciación de Herramientas"
"l10n_do_61040600","61040600","Depreciation and amortization expense","expense_depreciation","False","Gastos por Depreciación de Mobiliario y Equipos"
"l10n_do_61050100","61050100","Building Repair Expenses","expense","False","Gastos por Reparación de Edificios"
"l10n_do_61050200","61050200","Transportation Equipment Repair Expenses","expense","False","Gastos por Reparación de Equipo de Transporte"
"l10n_do_61050300","61050300","Furniture and Equipment Repair Expenses","expense","False","Gastos por Reparación de Mobiliario y Equipos"
"l10n_do_61050400","61050400","Machinery Repair Expenses","expense","False","Gastos por Reparación de Maquinaria"
"l10n_do_61050500","61050500","Tool Repair Expenses","expense","False","Gastos por Reparación de Herramientas"
"l10n_do_61050600","61050600","Expenses for Repair of Facilities","expense","False","Gastos por Reparación de Instalaciones"
"l10n_do_61060100","61060100","Public Relations","expense","False","Relaciones Públicas"
"l10n_do_61060200","61060200","Advertising","expense","False","Publicidad"
"l10n_do_61060300","61060300","Travel and Representation Expenses","expense","False","Gastos de Viajes y Representación"
"l10n_do_61060400","61060400","Donations","expense","False","Donaciones"
"l10n_do_61060500","61060500","Donations to ProIndustria (Law 392-07)","expense","False","Donaciones a ProIndustria (Ley 392-07)"
"l10n_do_61060600","61060600","Promotions","expense","False","Promociones"
"l10n_do_61060700","61060700","Restaurant Expenses","expense","False","Gastos en Restaurantes"
"l10n_do_61070100","61070100","Financial Loan Expenses","expense","False",""
"l10n_do_61070200","61070200","Withholding for Checks or Wire Transfers (0.15%)","expense","False","Retención por Cheques o Transferencias Electrónicas (0.15%)"
"l10n_do_61070300","61070300","Bank Interest","expense","False","Intereses Bancarios"
"l10n_do_61070400","61070400","Banking Commissions","expense","False","Comisiones Bancarias"
"l10n_do_61070500","61070500","Credit Card Fees","expense","False","Comisiones de Tarjeta de Crédito"
"l10n_do_61070600","61070600","Bank Charges","expense","False","Cargos Bancarios"
"l10n_do_61070700","61070700","Bank Loan Insurance","expense","False","Seguro sobre Préstamos Bancarios"
"l10n_do_61070800","61070800","Foreign exchange losses","expense","False","Pérdidas por Diferencia Cambiaria"
"l10n_do_61070900","61070900","Other Financial Expenses","expense","False","Otro Gastos Financieros"
"l10n_do_61080100","61080100","Cash Shortage Losses","expense","False","Pérdidas por Faltante en Caja"
"l10n_do_61080200","61080200","Losses on Sales of Fixed Assets","expense","False","Pérdidas por Ventas de Activos Fijos"
"l10n_do_61080300","61080300","Losses on uncollectible accounts","expense","False","Pérdidas por Cuentas Incobrables"
"l10n_do_61080500","61080500","Asset Taxes","expense","False","Impuestos a los Activos"
"l10n_do_61080600","61080600","Penalty Expenses/DGII Charges","expense","False","Gastos por Penalidades/Recargos de DGII"
"l10n_do_61080700","61080700","TSS Penalty Charges/Penalty Expenses","expense","False","Gastos por Penalidades/Recargos de TSS"
"l10n_do_61080800","61080800","Expenses without Vouchers","expense","False","Gastos sin Comprobantes"
"l10n_do_61080900","61080900","Non-Deductible Expenses","expense","False","Gastos No Deducibles"
"l10n_do_61081000","61081000","Cash Discount Loss","expense","False","Pérdida por descuento"
"l10n_do_71010100","71010100","Profit or Loss","equity_unaffected","False","Ganancias o Pérdidas"
"l10n_do_71020100","71020100","Tax Expenses","expense","False","Gastos por Impuestos"
"l10n_do_71020200","71020200","Income tax expense","expense","False","Gastos por ISR"
