id,code,name,internal_type,parent_id:id
service_type_1717,17.17,Análise de Organização e Métodos.,normal,service_type_17
service_type_1718,17.18,Atuária e cálculos técnicos de qualquer natureza.,normal,service_type_17
service_type_1719,17.19,"Contabilidade, inclusive serviços técnicos e auxiliares.",normal,service_type_17
service_type_1720,17.20,Consultoria e assessoria econômica ou financeira.,normal,service_type_17
service_type_1721,17.21,Estatística.,normal,service_type_17
service_type_1722,17.22,Cobrança em geral.,normal,service_type_17
service_type_1723,17.23,"Assessoria, análise, avaliação, atendimento, consulta, cadastro, seleção, gerenciamento de informações, administração de contas a receber ou a pagar e em geral, relacionados a operações de faturização (factoring).",normal,service_type_17
service_type_1724,17.24,"Apresentação de palestras, conferências, seminários e congêneres.",normal,service_type_17
service_type_18,18,Serviços de regulação de sinistros vinculados a contratos de seguros; inspeção e avaliação de riscos para cobertura de contratos de seguros; prevenção e gerência de riscos seguráveis e congêneres.,view,
service_type_1801,18.01,Serviços de regulação de sinistros vinculados a contratos de seguros; inspeção e avaliação de riscos para cobertura de contratos de seguros; prevenção e gerência de riscos seguráveis e congêneres.,normal,service_type_18
service_type_19,19,"Serviços de distribuição e venda de bilhetes e demais produtos de loteria, bingos, cartões, pules ou cupons de apostas, sorteios, prêmios, inclusive os decorrentes de títulos de capitalização e congêneres.",view,
service_type_1901,19.01,"Serviços de distribuição e venda de bilhetes e demais produtos de loteria, bingos, cartões, pules ou cupons de apostas, sorteios, prêmios, inclusive os decorrentes de títulos de capitalização e congêneres.",normal,service_type_19
service_type_20,20,"Serviços portuários, aeroportuários, ferroportuários, de terminais rodoviários, ferroviários e metroviários.",view,
service_type_2001,20.01,"Serviços portuários, ferroportuários, utilização de porto, movimentação de passageiros, reboque de embarcações, rebocador escoteiro, atracação, desatracação, serviços de praticagem, capatazia, armazenagem de qualquer natureza, serviços acessórios, movimentação de mercadorias, serviços de apoio marítimo, de movimentação ao largo, serviços de armadores, estiva, conferência, logística e congêneres.",normal,service_type_20
service_type_2002,20.02,"Serviços aeroportuários, utilização de aeroporto, movimentação de passageiros, armazenagem de qualquer natureza, capatazia, movimentação de aeronaves, serviços de apoio aeroportuários, serviços acessórios, movimentação de mercadorias, logística e congêneres.",normal,service_type_20
service_type_2003,20.03,"Serviços de terminais rodoviários, ferroviários, metroviários, movimentação de passageiros, mercadorias, inclusive     suas operações, logística e congêneres.",normal,service_type_20
service_type_21,21,"Serviços de registros públicos, cartorários e notariais.",view,
service_type_2101,21.01,"Serviços de registros públicos, cartorários e notariais.",normal,service_type_21
service_type_22,22,Serviços de exploração de rodovia.,view,
service_type_2201,22.01,"Serviços de exploração de rodovia mediante cobrança de preço ou pedágio dos usuários, envolvendo execução de serviços de conservação, manutenção, melhoramentos para adequação de capacidade e segurança de trânsito, operação, monitoração, assistência aos usuários e outros serviços definidos em contratos, atos de concessão ou de permissão ou em normas oficiais.",normal,service_type_22
service_type_23,23,"Serviços de programação e comunicação visual, desenho industrial e congêneres.",view,
service_type_2301,23.01,"Serviços de programação e comunicação visual, desenho industrial e congêneres.",normal,service_type_23
service_type_24,24,"Serviços de chaveiros, confecção de carimbos, placas, sinalização visual, banners, adesivos e congêneres.",view,
service_type_2401,24.01,"Serviços de chaveiros, confecção de carimbos, placas, sinalização visual, banners, adesivos e congêneres.",normal,service_type_24
service_type_25,25,Serviços funerários.,view,
service_type_2501,25.01,"Funerais, inclusive fornecimento de caixão, urna ou esquifes; aluguel de capela; transporte do corpo cadavérico; fornecimento de flores, coroas e outros paramentos; desembaraço de certidão de óbito; fornecimento de véu, essa e outros adornos; embalsamento, embelezamento, conservação ou restauração de cadáveres.",normal,service_type_25
service_type_2502,25.02,Cremação de corpos e partes de corpos cadavéricos.,normal,service_type_25
service_type_2503,25.03,Planos ou convênio funerários.,normal,service_type_25
service_type_2504,25.04,Manutenção e conservação de jazigos e cemitérios.,normal,service_type_25
service_type_26,26,"Serviços de coleta, remessa ou entrega de correspondências, documentos, objetos, bens ou valores, inclusive pelos correios e suas agências franqueadas; courrier e congêneres.",view,
service_type_2601,26.01,"Serviços de coleta, remessa ou entrega de correspondências, documentos, objetos, bens ou valores, inclusive pelos correios e suas agências franqueadas; courrier e congêneres.",normal,service_type_26
service_type_27,27,Serviços de assistência social.,view,
service_type_2701,27.01,Serviços de assistência social.,normal,service_type_27
service_type_28,28,Serviços de avaliação de bens e serviços de qualquer natureza.,view,
service_type_2801,28.01,Serviços de avaliação de bens e serviços de qualquer natureza.,normal,service_type_28
service_type_29,29,Serviços de biblioteconomia.,view,
service_type_2901,29.01,Serviços de biblioteconomia.,normal,service_type_29
service_type_30,30,"Serviços de biologia, biotecnologia e química.",view,
service_type_3001,30.01,"Serviços de biologia, biotecnologia e química.",normal,service_type_30
service_type_31,31,"Serviços técnicos em edificações, eletrônica, eletrotécnica, mecânica, telecomunicações e congêneres.",view,
service_type_3101,31.01,"Serviços técnicos em edificações, eletrônica, eletrotécnica, mecânica, telecomunicações e congêneres.",normal,service_type_31
service_type_32,32,Serviços de desenhos técnicos.,view,
service_type_3201,32.01,Serviços de desenhos técnicos.,normal,service_type_32
service_type_33,33,"Serviços de desembaraço aduaneiro, comissários, despachantes e congêneres.",view,
service_type_3301,33.01,"Serviços de desembaraço aduaneiro, comissários, despachantes e congêneres.",normal,service_type_33
service_type_34,34,"Serviços de investigações particulares, detetives e congêneres.",view,
service_type_3401,34.01,"Serviços de investigações particulares, detetives e congêneres.",normal,service_type_34
service_type_35,35,"Serviços de reportagem, assessoria de imprensa, jornalismo e relações públicas.",view,
service_type_3501,35.01,"Serviços de reportagem, assessoria de imprensa, jornalismo e relações públicas.",normal,service_type_35
service_type_36,36,Serviços de meteorologia.,view,
service_type_3601,36.01,Serviços de meteorologia.,normal,service_type_36
service_type_37,37,"Serviços de artistas, atletas, modelos e manequins.",view,
service_type_3701,37.01,"Serviços de artistas, atletas, modelos e manequins.",normal,service_type_37
service_type_38,38,Serviços de museologia.,view,
service_type_3801,38.01,Serviços de museologia.,normal,service_type_38
service_type_39,39,Serviços de ourivesaria e lapidação.,view,
service_type_3901,39.01,Serviços de ourivesaria e lapidação (quando o material for fornecido pelo tomador do serviço).,normal,service_type_39
service_type_40,40,Serviços relativos a obras de arte sob encomenda.,view,
service_type_4001,40.01,Obras de arte sob encomenda.,normal,service_type_40
