id,code,name,internal_type,parent_id:id
service_type_1,1,Serviços de informática e congêneres.,view,
service_type_101,1.01,Análise e desenvolvimento de sistemas.,normal,service_type_1
service_type_102,1.02,Programação.,normal,service_type_1
service_type_103,1.03,Processamento de dados e congêneres.,normal,service_type_1
service_type_104,1.04,"Elaboração de programas de computadores, inclusive de jogos eletrônicos.",normal,service_type_1
service_type_105,1.05,Licenciamento ou cessão de direito de uso de programas de computação.,normal,service_type_1
service_type_106,1.06,Assessoria e consultoria em informática.,normal,service_type_1
service_type_107,1.07,"Suporte técnico em informática, inclusive instalação, configuração e manutenção de programas de computação e bancos de dados.",normal,service_type_1
service_type_108,1.08,"Planejamento, confecção, manutenção e atualização de páginas eletrônicas.",normal,service_type_1
service_type_2,2,Serviços de pesquisas e desenvolvimento de qualquer natureza.,view,
service_type_201,2.01,Serviços de pesquisas e desenvolvimento de qualquer natureza.,normal,service_type_2
service_type_3,3,"Serviços prestados mediante locação, cessão de direito de uso e congêneres.",view,
service_type_302,3.02,Cessão de direito de uso de marcas e de sinais de propaganda.,normal,service_type_3
service_type_303,3.03,"Exploração de salões de festas, centro de convenções, escritórios virtuais, stands, quadras esportivas, estádios, ginásios,
auditórios, casas de espetáculos, parques de diversões, canchas e congêneres, para realização de eventos ou negócios de qualquer natureza.",normal,service_type_3
service_type_304,3.04,"Locação, sublocação, arrendamento, direito de passagem ou permissão de uso, compartilhado ou não, de ferrovia, rodovia, postes, cabos, dutos e condutos de qualquer natureza.",normal,service_type_3
service_type_305,3.05,"Cessão de andaimes, palcos, coberturas e outras estruturas de uso temporário.",normal,service_type_3
service_type_4,4,"Serviços de saúde, assistência médica e congêneres.",view,
service_type_401,4.01,Medicina e biomedicina.,normal,service_type_4
service_type_402,4.02,"Análises clínicas, patologia, eletricidade médica, radioterapia, quimioterapia, ultra-sonografia, ressonância magnética, radiologia, tomografia e congêneres.",normal,service_type_4
service_type_403,4.03,"Hospitais, clínicas, laboratórios, sanatórios, manicômios, casas de saúde, prontos-socorros, ambulatórios e congêneres.",normal,service_type_4
service_type_404,4.04,Instrumentação cirúrgica.,normal,service_type_4
service_type_405,4.05,Acupuntura.,normal,service_type_4
service_type_406,4.06,"Enfermagem, inclusive serviços auxiliares.",normal,service_type_4
service_type_407,4.07,Serviços farmacêuticos.,normal,service_type_4
service_type_408,4.08,"Terapia ocupacional, fisioterapia e fonoaudiologia.",normal,service_type_4
service_type_409,4.09,"Terapias de qualquer espécie destinadas ao tratamento físico, orgânico e mental.",normal,service_type_4
service_type_410,4.10,Nutrição.,normal,service_type_4
service_type_411,4.11,Obstetrícia.,normal,service_type_4
service_type_412,4.12,Odontologia.,normal,service_type_4
service_type_413,4.13,Ortóptica.,normal,service_type_4
service_type_414,4.14,Próteses sob encomenda.,normal,service_type_4
service_type_415,4.15,Psicanálise.,normal,service_type_4
service_type_416,4.16,Psicologia.,normal,service_type_4
service_type_417,4.17,"Casas de repouso e de recuperação, creches, asilos e congêneres.",normal,service_type_4
service_type_418,4.18,"Inseminação artificial, fertilização in vitro e congêneres.",normal,service_type_4
service_type_419,4.19,"Bancos de sangue, leite, pele, olhos, óvulos, sêmen e congêneres.",normal,service_type_4
service_type_420,4.20,"Coleta de sangue, leite, tecidos, sêmen, órgãos e materiais biológicos de qualquer espécie.",normal,service_type_4
service_type_421,4.21,"Unidade de atendimento, assistência ou tratamento móvel e congêneres.",normal,service_type_4
service_type_422,4.22,"Planos de medicina de grupo ou individual e convênios para prestação de assistência médica, hospitalar, odontológica e congêneres.",normal,service_type_4
service_type_423,4.23,"Outros planos de saúde que se cumpram através de serviços de terceiros contratados, credenciados, cooperados ou apenas pagos pelo operador do plano mediante indicação do beneficiário.",normal,service_type_4
service_type_5,5,Serviços de medicina e assistência veterinária e congêneres.,view,
service_type_501,5.01,Medicina veterinária e zootecnia.,normal,service_type_5
service_type_502,5.02,"Hospitais, clínicas, ambulatórios, prontos-socorros e congêneres, na área veterinária.",normal,service_type_5
service_type_503,5.03,Laboratórios de análise na área veterinária.,normal,service_type_5
service_type_504,5.04,"Inseminação artificial, fertilização in vitro e congêneres.",normal,service_type_5
service_type_505,5.05,Bancos de sangue e de órgãos e congêneres.,normal,service_type_5
service_type_506,5.06,"Coleta de sangue, leite, tecidos, sêmen, órgãos e materiais biológicos de qualquer espécie.",normal,service_type_5
service_type_507,5.07,"Unidade de atendimento, assistência ou tratamento móvel e congêneres.",normal,service_type_5
service_type_508,5.08,"Guarda, tratamento, amestramento, embelezamento, alojamento e congêneres.",normal,service_type_5
service_type_509,5.09,Planos de atendimento e assistência médico-veterinária.,normal,service_type_5
service_type_6,6,"Serviços de cuidados pessoais, estética, atividades físicas e congêneres.",view,
service_type_601,6.01,"Barbearia, cabeleireiros, manicuros, pedicuros e congêneres.",normal,service_type_6
service_type_602,6.02,"Esteticistas, tratamento de pele, depilação e congêneres.",normal,service_type_6
service_type_603,6.03,"Banhos, duchas, sauna, massagens e congêneres.",normal,service_type_6
service_type_604,6.04,"Ginástica, dança, esportes, natação, artes marciais e demais atividades físicas.",normal,service_type_6
service_type_605,6.05,"Centros de emagrecimento, spa e congêneres.",normal,service_type_6
service_type_7,7,"Serviços relativos a engenharia, arquitetura, geologia, urbanismo, construção civil, manutenção, limpeza, meio ambiente, saneamento e congêneres.",view,
service_type_701,7.01,"Engenharia, agronomia, agrimensura, arquitetura, geologia, urbanismo, paisagismo e congêneres.",normal,service_type_7
service_type_702,7.02,"Execução, por administração, empreitada ou subempreitada, de obras de construção civil, hidráulica ou elétrica e de outras obras semelhantes, inclusive sondagem, perfuração de poços, escavação, drenagem e irrigação, terraplanagem, pavimentação, concretagem e a instalação e montagem de produtos, peças e equipamentos (exceto o fornecimento de mercadorias produzidas pelo prestador de serviços fora do local da prestação dos serviços, que fica sujeito ao ICMS).",normal,service_type_7
service_type_703,7.03,"Elaboração de planos diretores, estudos de viabilidade, estudos organizacionais e outros, relacionados com obras e serviços de engenharia; elaboração de anteprojetos, projetos básicos e projetos executivos para trabalhos de engenharia.",normal,service_type_7
service_type_704,7.04,Demolição.,normal,service_type_7
service_type_705,7.05,"Reparação, conservação e reforma de edifícios, estradas, pontes, portos e congêneres (exceto o fornecimento de mercadorias produzidas pelo prestador dos serviços, fora do local da prestação dos serviços, que fica sujeito ao ICMS).",normal,service_type_7
service_type_706,7.06,"Colocação e instalação de tapetes, carpetes, assoalhos, cortinas, revestimentos de parede, vidros, divisórias, placas de gesso e congêneres, com material fornecido pelo tomador do serviço.",normal,service_type_7
service_type_707,7.07,"Recuperação, raspagem, polimento e lustração de pisos e congêneres.",normal,service_type_7
service_type_708,7.08,Calafetação.,normal,service_type_7
service_type_709,7.09,"Varrição, coleta, remoção, incineração, tratamento, reciclagem, separação e destinação final de lixo, rejeitos e outros resíduos quaisquer.",normal,service_type_7
service_type_710,7.10,"Limpeza, manutenção e conservação de vias e logradouros públicos, imóveis, chaminés, piscinas, parques, jardins e congêneres.",normal,service_type_7
service_type_711,7.11,"Decoração e jardinagem, inclusive corte e poda de árvores.",normal,service_type_7
service_type_712,7.12,"Controle e tratamento de efluentes de qualquer natureza e de agentes físicos, químicos e biológicos.",normal,service_type_7
service_type_713,7.13,"Dedetização, desinfecção, desinsetização, imunização, higienização, desratização, pulverização e congêneres.",normal,service_type_7
service_type_716,7.16,"Florestamento, reflorestamento, semeadura, adubação e congêneres.",normal,service_type_7
service_type_717,7.17,"Escoramento, contenção de encostas e serviços congêneres.",normal,service_type_7
service_type_718,7.18,"Limpeza e dragagem de rios, portos, canais, baías, lagos, lagoas, represas, açudes e congêneres.",normal,service_type_7
service_type_719,7.19,"Acompanhamento e fiscalização da execução de obras de engenharia, arquitetura e urbanismo.",normal,service_type_7
service_type_720,7.20,"Aerofotogrametria (inclusive interpretação), cartografia, mapeamento, levantamentos topográficos, batimétricos, geográficos, geodésicos, geológicos, geofísicos e congêneres.",normal,service_type_7
service_type_721,7.21,"Pesquisa, perfuração, cimentação, mergulho, perfilagem, concretação, testemunhagem, pescaria, estimulação e outros serviços relacionados com a exploração e explotação de petróleo, gás natural e de outros recursos minerais.",normal,service_type_7
service_type_722,7.22,Nucleação e bombardeamento de nuvens e congêneres.,normal,service_type_7
service_type_8,8,"Serviços de educação, ensino, orientação pedagógica e educacional, instrução, treinamento e avaliação pessoal de qualquer grau ou natureza.",view,
service_type_801,8.01,"Ensino regular pré-escolar, fundamental, médio e superior.",normal,service_type_8
service_type_802,8.02,"Instrução, treinamento, orientação pedagógica e educacional, avaliação de conhecimentos de qualquer natureza.",normal,service_type_8
service_type_9,9,"Serviços relativos a hospedagem, turismo, viagens e congêneres.",view,
service_type_901,9.01,"Hospedagem de qualquer natureza em hotéis, apart-service condominiais, flat, apart-hotéis, hotéis residência, residence-service, suite service, hotelaria marítima, motéis, pensões e congêneres; ocupação por temporada com fornecimento de serviço (o valor da alimentação e gorjeta, quando incluído no preço da diária, fica sujeito ao Imposto Sobre Serviços).",normal,service_type_9
service_type_902,9.02,"Agenciamento, organização, promoção, intermediação e execução de programas de turismo, passeios, viagens, excursões, hospedagens e congêneres.",normal,service_type_9
service_type_903,9.03,Guias de turismo.,normal,service_type_9
service_type_10,10,Serviços de intermediação e congêneres.,view,
service_type_1001,10.01,"Agenciamento, corretagem ou intermediação de câmbio, de seguros, de cartões de crédito, de planos de saúde e de planos de previdência privada.",normal,service_type_10
service_type_1002,10.02,"Agenciamento, corretagem ou intermediação de títulos em geral, valores mobiliários e contratos quaisquer.",normal,service_type_10
service_type_1003,10.03,"Agenciamento, corretagem ou intermediação de direitos de propriedade industrial, artística ou literária.",normal,service_type_10
service_type_1004,10.04,"Agenciamento, corretagem ou intermediação de contratos de arrendamento mercantil (leasing), de franquia (franchising) e de faturização (factoring).",normal,service_type_10
service_type_1005,10.05,"Agenciamento, corretagem ou intermediação de bens móveis ou imóveis, não abrangidos em outros itens ou subitens, inclusive aqueles realizados no âmbito de Bolsas de Mercadorias e Futuros, por quaisquer meios.",normal,service_type_10
service_type_1006,10.06,Agenciamento marítimo.,normal,service_type_10
service_type_1007,10.07,Agenciamento de notícias.,normal,service_type_10
service_type_1008,10.08,"Agenciamento de publicidade e propaganda, inclusive o agenciamento de veiculação por quaisquer meios.",normal,service_type_10
service_type_1009,10.09,"Representação de qualquer natureza, inclusive comercial.",normal,service_type_10
service_type_1010,10.10,Distribuição de bens de terceiros.,normal,service_type_10
service_type_11,11,"Serviços de guarda, estacionamento, armazenamento, vigilância e congêneres.",view,
service_type_1101,11.01,"Guarda e estacionamento de veículos terrestres automotores, de aeronaves e de embarcações.",normal,service_type_11
service_type_1102,11.02,"Vigilância, segurança ou monitoramento de bens e pessoas.",normal,service_type_11
service_type_1103,11.03,"Escolta, inclusive de veículos e cargas.",normal,service_type_11
service_type_1104,11.04,"Armazenamento, depósito, carga, descarga, arrumação e guarda de bens de qualquer espécie.",normal,service_type_11
service_type_12,12,"Serviços de diversões, lazer, entretenimento e congêneres.",view,
service_type_1201,12.01,Espetáculos teatrais.,normal,service_type_12
service_type_1202,12.02,Exibições cinematográficas.,normal,service_type_12
service_type_1203,12.03,Espetáculos circenses.,normal,service_type_12
service_type_1204,12.04,Programas de auditório.,normal,service_type_12
service_type_1205,12.05,"Parques de diversões, centros de lazer e congêneres.",normal,service_type_12
service_type_1206,12.06,"Boates, taxi-dancing e congêneres.",normal,service_type_12
service_type_1207,12.07,"Shows, ballet, danças, desfiles, bailes, óperas, concertos, recitais, festivais e congêneres.",normal,service_type_12
service_type_1208,12.08,"Feiras, exposições, congressos e congêneres.",normal,service_type_12
service_type_1209,12.09,"Bilhares, boliches e diversões eletrônicas ou não.",normal,service_type_12
service_type_1210,12.10,Corridas e competições de animais.,normal,service_type_12
service_type_1211,12.11,"Competições esportivas ou de destreza física ou intelectual, com ou sem a participação do espectador.",normal,service_type_12
service_type_1212,12.12,Execução de música.,normal,service_type_12
service_type_1213,12.13,"Produção, mediante ou sem encomenda prévia, de eventos, espetáculos, entrevistas, shows, ballet, danças, desfiles, bailes, teatros, óperas, concertos, recitais, festivais e congêneres.",normal,service_type_12
service_type_1214,12.14,"Fornecimento de música para ambientes fechados ou não, mediante transmissão por qualquer processo.",normal,service_type_12
service_type_1215,12.15,"Desfiles de blocos carnavalescos ou folclóricos, trios elétricos e congêneres.",normal,service_type_12
service_type_1216,12.16,"Exibição de filmes, entrevistas, musicais, espetáculos, shows, concertos, desfiles, óperas, competições esportivas, de destreza intelectual ou congêneres.",normal,service_type_12
service_type_1217,12.17,"Recreação e animação, inclusive em festas e eventos de qualquer natureza.",normal,service_type_12
service_type_13,13,"Serviços relativos a fonografia, fotografia, cinematografia e reprografia.",view,
service_type_1302,13.02,"Fonografia ou gravação de sons, inclusive trucagem, dublagem, mixagem e congêneres.",normal,service_type_13
service_type_1303,13.03,"Fotografia e cinematografia, inclusive revelação, ampliação, cópia, reprodução, trucagem e congêneres.",normal,service_type_13
service_type_1304,13.04,"Reprografia, microfilmagem e digitalização.",normal,service_type_13
service_type_1305,13.05,"Composição gráfica, fotocomposição, clicheria, zincografia, litografia, fotolitografia.",normal,service_type_13
service_type_14,14,Serviços relativos a bens de terceiros.,view,
service_type_1401,14.01,"Lubrificação, limpeza, lustração, revisão, carga e recarga, conserto, restauração, blindagem, manutenção e conservação de máquinas, veículos, aparelhos, equipamentos, motores, elevadores ou de qualquer objeto (exceto peças e partes empregadas, que ficam sujeitas ao ICMS).",normal,service_type_14
service_type_1402,14.02,Assistência técnica.,normal,service_type_14
service_type_1403,14.03,"Recondicionamento de motores (exceto peças e partes empregadas, que ficam sujeitas ao ICMS).",normal,service_type_14
service_type_1404,14.04,Recauchutagem ou regeneração de pneus.,normal,service_type_14
service_type_1405,14.05,"Restauração, recondicionamento, acondicionamento, pintura, beneficiamento, lavagem, secagem, tingimento, galvanoplastia, anodização, corte, recorte, polimento, plastificação e congêneres, de objetos quaisquer.",normal,service_type_14
service_type_1406,14.06,"Instalação e montagem de aparelhos, máquinas e equipamentos, inclusive montagem industrial, prestados ao usuário final, exclusivamente com material por ele fornecido.",normal,service_type_14
service_type_1407,14.07,Colocação de molduras e congêneres.,normal,service_type_14
service_type_1408,14.08,"Encadernação, gravação e douração de livros, revistas e congêneres.",normal,service_type_14
service_type_1409,14.09,"Alfaiataria e costura, quando o material for fornecido pelo usuário final, exceto aviamento.",normal,service_type_14
service_type_1410,14.10,Tinturaria e lavanderia.,normal,service_type_14
service_type_1411,14.11,Tapeçaria e reforma de estofamentos em geral.,normal,service_type_14
service_type_1412,14.12,Funilaria e lanternagem.,normal,service_type_14
service_type_1413,14.13,Carpintaria e serralheria.,normal,service_type_14
service_type_15,15,"Serviços relacionados ao setor bancário ou financeiro, inclusive aqueles prestados por instituições financeiras autorizadas a funcionar pela União ou por quem de direito.",view,
service_type_1501,15.01,"Administração de fundos quaisquer, de consórcio, de cartão de crédito ou débito e congêneres, de carteira de clientes, de cheques pré-datados e congêneres.",normal,service_type_15
service_type_1502,15.02,"Abertura de contas em geral, inclusive conta-corrente, conta de investimentos e aplicação e caderneta de poupança, no País e no exterior, bem como a manutenção das referidas contas ativas e inativas.",normal,service_type_15
service_type_1503,15.03,"Locação e manutenção de cofres particulares, de terminais eletrônicos, de terminais de atendimento e de bens e equipamentos em geral.",normal,service_type_15
service_type_1504,15.04,"Fornecimento ou emissão de atestados em geral, inclusive atestado de idoneidade, atestado de capacidade financeira e congêneres.",normal,service_type_15
service_type_1505,15.05,"Cadastro, elaboração de ficha cadastral, renovação cadastral e congêneres, inclusão ou exclusão no Cadastro de Emitentes de Cheques sem Fundos–CCF ou em quaisquer outros bancos cadastrais.",normal,service_type_15
service_type_1506,15.06,"Emissão, reemissão e fornecimento de avisos, comprovantes e documentos em geral; abono de firmas; coleta e entrega de documentos, bens e valores; comunicação com outra agência ou com a administração central; licenciamento eletrônico de veículos; transferência de veículos; agenciamento fiduciário ou depositário; devolução de bens em custódia.",normal,service_type_15
service_type_1507,15.07,"Acesso, movimentação, atendimento e consulta a contas em geral, por qualquer meio ou processo, inclusive por telefone, fac-símile, internet e telex, acesso a terminais de atendimento, inclusive vinte e quatro horas; acesso a outro banco e a rede compartilhada; fornecimento de saldo, extrato e demais informações relativas a contas em geral, por qualquer meio ou processo.",normal,service_type_15
service_type_1508,15.08,"Emissão, reemissão, alteração, cessão, substituição, cancelamento e registro de contrato de crédito; estudo, análise e avaliação de operações de crédito; emissão, concessão, alteração ou contratação de aval, fiança, anuência e congêneres; serviços relativos a abertura de crédito, para quaisquer fins.",normal,service_type_15
service_type_1509,15.09,"Arrendamento mercantil (leasing) de quaisquer bens, inclusive cessão de direitos e obrigações, substituição de garantia, alteração, cancelamento e registro de contrato, e demais serviços relacionados ao arrendamento mercantil (leasing).",normal,service_type_15
service_type_1510,15.10,"Serviços relacionados a cobranças, recebimentos ou pagamentos em geral, de títulos quaisquer, de contas ou carnês, de câmbio, de tributos e por conta de terceiros, inclusive os efetuados por meio eletrônico, automático ou por máquinas de atendimento; fornecimento de posição de cobrança, recebimento ou pagamento; emissão de carnês, fichas de compensação, impressos e documentos em geral.",normal,service_type_15
service_type_1511,15.11,"Devolução de títulos, protesto de títulos, sustação de protesto, manutenção de títulos, reapresentação de títulos, e demais serviços a eles relacionados.",normal,service_type_15
service_type_1512,15.12,"Custódia em geral, inclusive de títulos e valores mobiliários.",normal,service_type_15
service_type_1513,15.13,"Serviços relacionados a operações de câmbio em geral, edição, alteração, prorrogação, cancelamento e baixa de contrato de câmbio; emissão de registro de exportação ou de crédito; cobrança ou depósito no exterior; emissão, fornecimento e cancelamento de cheques de viagem; fornecimento, transferência, cancelamento e demais serviços relativos a carta de crédito de importação, exportação e garantias recebidas; envio e recebimento de mensagens em geral relacionadas a operações de câmbio.",normal,service_type_15
service_type_1514,15.14,"Fornecimento, emissão, reemissão, renovação e manutenção de cartão magnético, cartão de crédito, cartão de débito, cartão salário e congêneres.",normal,service_type_15
service_type_1515,15.15,"Compensação de cheques e títulos quaisquer; serviços relacionados a depósito, inclusive depósito identificado, a saque de contas quaisquer, por qualquer meio ou processo, inclusive em terminais eletrônicos e de atendimento.",normal,service_type_15
service_type_1516,15.16,"Emissão, reemissão, liquidação, alteração, cancelamento e baixa de ordens de pagamento, ordens de crédito e similares, por qualquer meio ou processo; serviços relacionados à transferência de valores, dados, fundos, pagamentos e similares, inclusive entre contas em geral.",normal,service_type_15
service_type_1517,15.17,"Emissão, fornecimento, devolução, sustação, cancelamento e oposição de cheques quaisquer, avulso ou por talão.",normal,service_type_15
service_type_1518,15.18,"Serviços relacionados a crédito imobiliário, avaliação e vistoria de imóvel ou obra, análise técnica e jurídica, emissão, reemissão, alteração, transferência e renegociação de contrato, emissão e reemissão do termo de quitação e demais serviços relacionados a crédito imobiliário.",normal,service_type_15
service_type_16,16,Serviços de transporte de natureza municipal.,view,
service_type_1601,16.01,Serviços de transporte de natureza municipal.,normal,service_type_16
service_type_17,17,"Serviços de apoio técnico, administrativo, jurídico, contábil, comercial e congêneres.",view,
service_type_1701,17.01,"Assessoria ou consultoria de qualquer natureza, não contida em outros itens desta lista; análise, exame, pesquisa, coleta, compilação e fornecimento de dados e informações de qualquer natureza, inclusive cadastro e similares.",normal,service_type_17
service_type_1702,17.02,"Datilografia, digitação, estenografia, expediente, secretaria em geral, resposta audível, redação, edição, interpretação, revisão, tradução, apoio e infra-estrutura administrativa e congêneres.",normal,service_type_17
service_type_1703,17.03,"Planejamento, coordenação, programação ou organização técnica, financeira ou administrativa.",normal,service_type_17
service_type_1704,17.04,"Recrutamento, agenciamento, seleção e colocação de mão-de-obra.",normal,service_type_17
service_type_1705,17.05,"Fornecimento de mão-de-obra, mesmo em caráter temporário, inclusive de empregados ou trabalhadores, avulsos ou temporários, contratados pelo prestador de serviço.",normal,service_type_17
service_type_1706,17.06,"Propaganda e publicidade, inclusive promoção de vendas, planejamento de campanhas ou sistemas de publicidade, elaboração de desenhos, textos e demais materiais publicitários.",normal,service_type_17
service_type_1708,17.08,Franquia (franchising).,normal,service_type_17
service_type_1709,17.09,"Perícias, laudos, exames técnicos e análises técnicas.",normal,service_type_17
service_type_1710,17.10,"Planejamento, organização e administração de feiras, exposições, congressos e congêneres.",normal,service_type_17
service_type_1711,17.11,"Organização de festas e recepções; bufê (exceto o fornecimento de alimentação e bebidas, que fica sujeito ao ICMS).",normal,service_type_17
service_type_1712,17.12,"Administração em geral, inclusive de bens e negócios de terceiros.",normal,service_type_17
service_type_1713,17.13,Leilão e congêneres.,normal,service_type_17
service_type_1714,17.14,Advocacia.,normal,service_type_17
service_type_1715,17.15,"Arbitragem de qualquer espécie, inclusive jurídica.",normal,service_type_17
service_type_1716,17.16,Auditoria.,normal,service_type_17
