id,code,name
activity_281700,281700,"Fabricación de maquinaria y equipo de oficina, excepto equipo informático"
activity_281900,281900,"Fabricación de  maquinaria y equipo de uso general n.c.p."
activity_282110,282110,"Fabricación de tractores"
activity_282120,282120,"Fabricación de maquinaria y equipo de uso agropecuario y forestal"
activity_282130,282130,"Fabricación de implementos de uso agropecuario"
activity_282200,282200,"Fabricación de máquinas herramienta"
activity_282300,282300,"Fabricación de maquinaria metalúrgica"
activity_282400,282400,"Fabricación de maquinaria para la explotación de minas y canteras y para obras de construcción"
activity_282500,282500,"Fabricación de maquinaria para la elaboración de alimentos, bebidas y tabaco"
activity_282600,282600,"Fabricación de maquinaria para la elaboración de productos textiles, prendas de vestir y cueros"
activity_282901,282901,"Fabricación de maquinaria para la industria del papel y las artes gráficas"
activity_282909,282909,"Fabricación de maquinaria y equipo de uso especial n.c.p."
activity_291000,291000,"Fabricación de vehículos automotores"
activity_292000,292000,"Fabricación de carrocerías para vehículos automotores, fabricación de remolques y semirremolques"
activity_293011,293011,"Rectificación de motores"
activity_293090,293090,"Fabricación de partes, piezas y accesorios para vehículos automotores y sus motores n.c.p."
activity_301100,301100,"Construcción y reparación de buques"
activity_301200,301200,"Construcción y reparación de embarcaciones de recreo y deporte"
activity_302000,302000,"Fabricación y reparación de locomotoras y de material rodante para transporte ferroviario"
activity_303000,303000,"Fabricación y reparación de aeronaves"
activity_309100,309100,"Fabricación de motocicletas"
activity_309200,309200,"Fabricación de bicicletas y de sillones de ruedas ortopédicos"
activity_309900,309900,"Fabricación de equipo de transporte n.c.p."
activity_310010,310010,"Fabricación de muebles y partes de muebles, principalmente de madera"
activity_310020,310020,"Fabricación de muebles y partes de muebles, excepto los que son principalmente de madera (metal, plástico, etc.)"
activity_310030,310030,"Fabricación de somieres y colchones"
activity_321011,321011,"Fabricación de joyas finas y artículos conexos"
activity_321012,321012,"Fabricación de objetos de platería"
activity_321020,321020,"Fabricación de bijouterie"
activity_322001,322001,"Fabricación de instrumentos de música"
activity_323001,323001,"Fabricación de artículos de deporte"
activity_324000,324000,"Fabricación de juegos y juguetes"
activity_329010,329010,"Fabricación de lápices, lapiceras,  bolígrafos, sellos y artículos similares para oficinas y artistas"
activity_329020,329020,"Fabricación de escobas, cepillos y pinceles"
activity_329030,329030,"Fabricación de carteles, señales e indicadores  -eléctricos o no-"
activity_329040,329040,"Fabricación de equipo de protección y seguridad, excepto calzado"
activity_329090,329090,"Industrias manufactureras n.c.p."
activity_331101,331101,"Reparación y mantenimiento de productos de metal, excepto maquinaria y equipo"
activity_331210,331210,"Reparación y mantenimiento de maquinaria de uso general"
activity_331220,331220,"Reparación y mantenimiento de maquinaria y equipo de uso agropecuario y forestal"
activity_331290,331290,"Reparación y mantenimiento de maquinaria de uso especial n.c.p."
activity_331400,331400,"Reparación y mantenimiento de maquinaria y aparatos eléctricos"
activity_331900,331900,"Reparación y mantenimiento de máquinas y equipo n.c.p."
activity_332000,332000,"Instalación de maquinaria y equipos industriales"
activity_351110,351110,"Generación de energía térmica convencional"
activity_351120,351120,"Generación de energía térmica nuclear"
activity_351130,351130,"Generación de energía hidráulica"
activity_351190,351190,"Generación de energía n.c.p."
activity_351201,351201,"Transporte de energía eléctrica"
activity_351310,351310,"Comercio mayorista de energía eléctrica"
activity_351320,351320,"Distribución de energía eléctrica"
activity_352010,352010,"Fabricación de gas y procesamiento de gas natural"
activity_352020,352020,"Distribución de combustibles gaseosos por tuberías"
activity_353001,353001,"Suministro de vapor y aire acondicionado"
activity_360010,360010,"Captación, depuración y distribución de agua de fuentes subterráneas"
activity_360020,360020,"Captación, depuración y distribución de agua de fuentes superficiales"
activity_370000,370000,"Servicios de depuración de aguas residuales, alcantarillado y cloacas"
activity_381100,381100,"Recolección, transporte, tratamiento y disposición final de residuos no peligrosos"
activity_381200,381200,"Recolección, transporte, tratamiento y disposición final de residuos peligrosos"
activity_382010,382010,"Recuperación de materiales y desechos metálicos"
activity_382020,382020,"Recuperación de materiales y desechos no metálicos"
activity_390000,390000,"Descontaminación y otros servicios de gestión de residuos"
activity_410011,410011,"Construcción, reforma y reparación de edificios residenciales"
activity_410021,410021,"Construcción, reforma y reparación de edificios no residenciales"
activity_421000,421000,"Construcción, reforma y reparación de obras de infraestructura para el transporte"
activity_422100,422100,"Perforación de pozos de agua"
activity_422200,422200,"Construcción, reforma y reparación de redes distribución de electricidad, gas, agua, telecomunicaciones y de otros servicios públicos"
activity_429010,429010,"Construcción, reforma y reparación de obras hidráulicas"
activity_429090,429090,"Construcción de obras de ingeniería civil n.c.p."
activity_431100,431100,"Demolición y voladura de edificios y de sus partes"
activity_431210,431210,"Movimiento de suelos y preparación de terrenos para obras"
activity_432110,432110,"Instalación de sistemas de iluminación, control y señalización eléctrica para el transporte"
activity_432190,432190,"Instalación, ejecución y mantenimiento de instalaciones eléctricas, electromecánicas y electrónicas n.c.p."
activity_432200,432200,"Instalaciones de gas, agua, sanitarios y de climatización, con sus artefactos conexos"
activity_432910,432910,"Instalaciones de ascensores, montacargas y  escaleras mecánicas"
activity_432920,432920,"Aislamiento térmico, acústico, hídrico y antivibratorio"
activity_432990,432990,"Instalaciones para edificios y obras de ingeniería civil n.c.p."
activity_433010,433010,"Instalaciones de carpintería, herrería de obra y artística"
activity_433020,433020,"Terminación y revestimiento de paredes y pisos"
activity_433030,433030,"Colocación de cristales en obra"
activity_433040,433040,"Pintura y trabajos de decoración"
activity_433090,433090,"Terminación de edificios n.c.p."
activity_439100,439100,"Alquiler de equipo de construcción o demolición dotado de operarios"
activity_439910,439910,"Hincado de pilotes, cimentación y otros trabajos de hormigón armado"
activity_439990,439990,"Actividades especializadas de construcción n.c.p."
activity_451110,451110,"Venta de autos, camionetas y utilitarios nuevos"
activity_451190,451190,"Venta de vehículos automotores nuevos n.c.p."
activity_451210,451210,"Venta de autos, camionetas y utilitarios, usados"
activity_451290,451290,"Venta de vehículos automotores usados n.c.p."
activity_452101,452101,"Lavado automático y manual de vehículos automotores"
activity_452210,452210,"Reparación de cámaras y cubiertas"
activity_452220,452220,"Reparación de amortiguadores,  alineación de dirección y balanceo de ruedas"
activity_452300,452300,"Instalación y reparación de parabrisas, lunetas y ventanillas, cerraduras no eléctricas y grabado de cristales"
activity_452401,452401,"Reparaciones eléctricas del tablero e instrumental, reparación y recarga de baterías, instalación de alarmas, radios, sistemas de climatización"
activity_452500,452500,"Tapizado y retapizado de automotores"
activity_452600,452600,"Reparación y pintura de carrocerías, colocación y reparación de guardabarros y protecciones exteriores"
activity_452700,452700,"Instalación y reparación de caños de escape y radiadores"
activity_452800,452800,"Mantenimiento y reparación de frenos y embragues"
activity_452910,452910,"Instalación y reparación de equipos de GNC"
activity_452990,452990,"Mantenimiento y reparación del motor n.c.p., mecánica integral"
activity_453100,453100,"Venta al por mayor de partes, piezas y accesorios de vehículos automotores"
activity_453210,453210,"Venta al por menor de cámaras y cubiertas"
activity_453220,453220,"Venta al por menor de baterías"
activity_453291,453291,"Venta al por menor de partes, piezas y accesorios nuevos n.c.p."
activity_453292,453292,"Venta al por menor de partes, piezas y accesorios usados n.c.p."
activity_454010,454010,"Venta de motocicletas y de sus partes, piezas y accesorios"
activity_454020,454020,"Mantenimiento y reparación de motocicletas"
activity_461011,461011,"Venta al por mayor en comisión o consignación de cereales (incluye arroz), oleaginosas y forrajeras excepto semillas"
activity_461012,461012,"Venta al por mayor en comisión o consignación de semillas"
activity_461013,461013,"Venta al por mayor en comisión o consignación de frutas"
activity_461014,461014,"Acopio y acondicionamiento en comisión o consignación de cereales (incluye arroz), oleaginosas y forrajeras excepto semillas"
activity_461019,461019,"Venta al por mayor en comisión o consignación de productos agrícolas n.c.p."
activity_461021,461021,"Venta al por mayor en comisión o consignación de ganado bovino en pie"
activity_461022,461022,"Venta al por mayor en comisión o consignación de ganado en pie excepto bovino"
activity_461029,461029,"Venta al por mayor en comisión o consignación de productos pecuarios n.c.p."
activity_461031,461031,"Operaciones de intermediación de carne - consignatario directo -"
activity_461032,461032,"Operaciones de intermediación de carne excepto consignatario directo"
activity_461039,461039,"Venta al por mayor en comisión o consignación de alimentos, bebidas y tabaco n.c.p."
activity_461040,461040,"Venta al por mayor en comisión o consignación de combustibles"
activity_461092,461092,"Venta al por mayor en comisión o consignación de  madera y materiales para la construcción"
activity_461093,461093,"Venta al por mayor en comisión o consignación de minerales, metales y productos químicos industriales"
activity_461094,461094,"Venta al por mayor en comisión o consignación de  maquinaria, equipo profesional industrial y comercial, embarcaciones y aeronaves"
activity_461095,461095,"Venta al por mayor en comisión o consignación de papel, cartón, libros, revistas, diarios, materiales de embalaje y artículos de librería"
activity_461099,461099,"Venta al por mayor en comisión o consignación de  mercaderías n.c.p."
activity_462110,462110,"Acopio de algodón"
activity_462120,462120,"Venta al por mayor de semillas y granos para forrajes"
activity_462131,462131,"Venta al por mayor de cereales (incluye arroz), oleaginosas y forrajeras excepto semillas"
activity_462132,462132,"Acopio y acondicionamiento de cereales y semillas, excepto de algodón y semillas y granos para forrajes"
activity_462190,462190,"Venta al por mayor de materias primas agrícolas y de la silvicultura n.c.p."
activity_462201,462201,"Venta al por mayor de lanas, cueros en bruto y productos afines"
activity_462209,462209,"Venta al por mayor de materias primas pecuarias n.c.p. incluso animales vivos"
activity_463111,463111,"Venta al por mayor de productos lácteos"
activity_463112,463112,"Venta al por mayor de fiambres y quesos"
activity_463121,463121,"Venta al por mayor de carnes rojas y derivados"
activity_463129,463129,"Venta al por mayor de aves, huevos y productos de granja y de la caza n.c.p."
activity_463130,463130,"Venta al por mayor de pescado"
activity_463140,463140,"Venta al por mayor y empaque de frutas, de legumbres y hortalizas frescas"
activity_463151,463151,"Venta al por mayor de pan, productos de confitería y pastas frescas"
activity_463152,463152,"Venta al por mayor de azúcar"
activity_463153,463153,"Venta al por mayor de aceites y grasas"
activity_463154,463154,"Venta al por mayor de café, té, yerba mate y otras infusiones y especias y condimentos"
activity_463159,463159,"Venta al por mayor de productos y subproductos de molinería n.c.p."
activity_463160,463160,"Venta al por mayor de chocolates, golosinas y productos para kioscos y polirrubros n.c.p., excepto cigarrillos"
activity_463170,463170,"Venta al por mayor de alimentos balanceados para animales"
activity_463180,463180,"Venta al por mayor en supermercados mayoristas de alimentos"
activity_463191,463191,"Venta al por mayor de frutas, legumbres y cereales secos y en conserva"
activity_463199,463199,"Venta al por mayor de productos alimenticios n.c.p."
activity_463211,463211,"Venta al por mayor de vino"
activity_463212,463212,"Venta al por mayor de bebidas espiritosas"
activity_463219,463219,"Venta al por mayor de bebidas alcohólicas n.c.p."
activity_463220,463220,"Venta al por mayor de bebidas no alcohólicas"
activity_463300,463300,"Venta al por mayor de cigarrillos y productos de tabaco"
activity_464111,464111,"Venta al por mayor de tejidos (telas)"
activity_464112,464112,"Venta al por mayor de artículos de mercería"
activity_464113,464113,"Venta al por mayor de mantelería, ropa de cama y artículos textiles para el hogar"
activity_464114,464114,"Venta al por mayor de tapices y alfombras de materiales textiles"
activity_464119,464119,"Venta al por mayor de productos textiles n.c.p."
activity_464121,464121,"Venta al por mayor de prendas de vestir de cuero"
activity_464122,464122,"Venta al por mayor de medias y prendas de punto"
activity_464129,464129,"Venta al por mayor de prendas y accesorios de vestir n.c.p., excepto uniformes y ropa de trabajo"
activity_464130,464130,"Venta al por mayor de calzado excepto el ortopédico"
activity_464141,464141,"Venta al por mayor de pieles y cueros curtidos y salados"
activity_464142,464142,"Venta al por mayor de suelas y afines"
activity_464149,464149,"Venta al por mayor de artículos de marroquinería,  paraguas y productos similares n.c.p."
activity_464150,464150,"Venta al por mayor de uniformes y ropa de trabajo"
activity_464211,464211,"Venta al por mayor de libros y publicaciones"
activity_464212,464212,"Venta al por mayor de diarios y revistas"
activity_464221,464221,"Venta al por mayor de papel y productos de papel y cartón excepto envases"
activity_464222,464222,"Venta al por mayor de envases de papel y cartón"
activity_464223,464223,"Venta al por mayor de artículos de librería y papelería"
activity_464310,464310,"Venta al por mayor de productos farmacéuticos"
activity_464320,464320,"Venta al por mayor de productos cosméticos, de tocador y de perfumería"
activity_464330,464330,"Venta al por mayor de instrumental médico y odontológico y artículos ortopédicos"
activity_464340,464340,"Venta al por mayor de productos veterinarios"
activity_464410,464410,"Venta al por mayor de artículos de óptica y de fotografía"
activity_464420,464420,"Venta al por mayor de artículos de relojería, joyería y fantasías"
activity_464501,464501,"Venta al por mayor de electrodomésticos y artefactos para el hogar excepto equipos de audio y video"
activity_464502,464502,"Venta al por mayor de equipos de audio, video y televisión"
activity_464610,464610,"Venta al por mayor de muebles excepto de oficina, artículos de mimbre y corcho, colchones y somieres"
activity_464620,464620,"Venta al por mayor de artículos de iluminación"
activity_464631,464631,"Venta al por mayor de artículos de vidrio"
activity_464632,464632,"Venta al por mayor de artículos de bazar y menaje excepto de vidrio"
activity_464920,464920,"Venta al por mayor de materiales y productos de limpieza"
activity_464930,464930,"Venta al por mayor de juguetes"
activity_464940,464940,"Venta al por mayor de bicicletas y rodados similares"
activity_464950,464950,"Venta al por mayor de artículos de esparcimiento y deportes"
activity_464991,464991,"Venta al por mayor de flores y plantas naturales y artificiales"
activity_464999,464999,"Venta al por mayor de artículos de uso doméstico o personal n.c.p"
activity_465100,465100,"Venta al por mayor de equipos, periféricos, accesorios y programas informáticos"
activity_465210,465210,"Venta al por mayor de equipos de telefonía y comunicaciones"
activity_465220,465220,"Venta al por mayor de componentes electrónicos"
activity_465310,465310,"Venta al por mayor de máquinas, equipos e implementos de uso en los sectores agropecuario, jardinería, silvicultura, pesca y caza"
activity_465320,465320,"Venta al por mayor de máquinas, equipos e implementos de uso en la elaboración de alimentos, bebidas y tabaco"
activity_465330,465330,"Venta al por mayor de máquinas, equipos e implementos de uso en la fabricación de textiles, prendas y accesorios de vestir, calzado, artículos de cuero y marroquinería"
activity_465340,465340,"Venta al por mayor de máquinas, equipos e implementos de uso en imprentas, artes gráficas y actividades conexas"
activity_465350,465350,"Venta al por mayor de máquinas, equipos e implementos de uso médico y paramédico"
activity_465360,465360,"Venta al por mayor de máquinas, equipos e implementos de uso en la industria del plástico y del caucho"
activity_465390,465390,"Venta al por mayor de máquinas, equipos e implementos de uso especial n.c.p."
activity_465400,465400,"Venta al por mayor de máquinas - herramienta de uso general"
activity_465500,465500,"Venta  al  por  mayor  de  vehículos,  equipos  y  máquinas  para  el transporte ferroviario, aéreo y de navegación"
activity_465610,465610,"Venta al por mayor de muebles e instalaciones para oficinas"
activity_465690,465690,"Venta al por mayor de muebles e instalaciones para la industria, el comercio y los servicios n.c.p."
activity_465910,465910,"Venta al por mayor de máquinas y equipo de control y seguridad"
activity_465920,465920,"Venta al por mayor de maquinaria y equipo de oficina, excepto equipo informático"
activity_465930,465930,"Venta al por mayor de equipo profesional y científico e instrumentos de medida y de control n.c.p."
activity_465990,465990,"Venta al por mayor de máquinas, equipo y materiales conexos n.c.p."
activity_466110,466110,"Venta al por mayor de combustibles y lubricantes para automotores"
activity_466121,466121,"Fraccionamiento y distribución de gas licuado"
activity_466129,466129,"Venta al por mayor de combustibles, lubricantes, leña y carbón, excepto gas licuado y combustibles y lubricantes para automotores"
activity_466200,466200,"Venta al por mayor de metales y minerales metalíferos"
activity_466310,466310,"Venta al por mayor de aberturas"
activity_466320,466320,"Venta al por mayor de productos de madera excepto muebles"
activity_466330,466330,"Venta al por mayor de artículos de ferretería y materiales eléctricos"
activity_466340,466340,"Venta al por mayor de pinturas y productos conexos"
activity_466350,466350,"Venta al por mayor de cristales y espejos"
activity_466360,466360,"Venta al por mayor de artículos para plomería, instalación de gas y calefacción"
activity_466370,466370,"Venta al por mayor de papeles para pared, revestimiento para pisos de goma, plástico y textiles,  y artículos similares para la decoración"
activity_466391,466391,"Venta al por mayor de artículos de loza, cerámica y porcelana de uso en construcción"
activity_466399,466399,"Venta al por mayor de artículos para la construcción n.c.p."
activity_466910,466910,"Venta al por mayor de productos intermedios n.c.p., desperdicios y desechos textiles"
activity_466920,466920,"Venta al por mayor de productos intermedios n.c.p., desperdicios y desechos de papel y cartón"
activity_466931,466931,"Venta al por mayor de artículos de plástico"
activity_466932,466932,"Venta al por mayor de abonos, fertilizantes y plaguicidas"
activity_466939,466939,"Venta al por mayor de productos intermedios, desperdicios y desechos de vidrio, caucho, goma y químicos n.c.p."
activity_466940,466940,"Venta al por mayor de productos intermedios n.c.p., desperdicios y desechos metálicos"
activity_466990,466990,"Venta al por mayor de productos intermedios, desperdicios y desechos n.c.p."
activity_469010,469010,"Venta al por mayor de insumos agropecuarios diversos"
activity_469090,469090,"Venta al por mayor de mercancías n.c.p."
activity_471110,471110,"Venta al por menor en hipermercados"
activity_471120,471120,"Venta al por menor en supermercados"
activity_471130,471130,"Venta al por menor en minimercados"
activity_471190,471190,"Venta al por menor en kioscos, polirrubros y comercios no especializados n.c.p."
activity_471900,471900,"Venta al por menor en comercios no especializados, sin predominio de productos alimenticios y bebidas"
activity_472111,472111,"Venta al por menor de productos lácteos"
activity_472112,472112,"Venta al por menor de fiambres y embutidos"
activity_472120,472120,"Venta al por menor de productos de almacén y dietética"
activity_472130,472130,"Venta al por menor de carnes rojas, menudencias y chacinados frescos"
activity_472140,472140,"Venta al por menor de huevos, carne de aves y  productos de granja y de la caza"
activity_472150,472150,"Venta al por menor de pescados y  productos de la pesca"
activity_472160,472160,"Venta al por menor de frutas, legumbres y hortalizas frescas"
activity_472171,472171,"Venta al por menor de pan y productos de panadería"
activity_472172,472172,"Venta al por menor de bombones, golosinas y demás productos de confitería"
activity_472190,472190,"Venta al por menor de productos alimenticios n.c.p., en comercios especializados"
activity_472200,472200,"Venta al por menor de bebidas en comercios especializados"
activity_472300,472300,"Venta al por menor de tabaco en comercios especializados"
activity_473000,473000,"Venta al por menor de combustible para vehículos automotores y motocicletas"
activity_474010,474010,"Venta al por menor de equipos, periféricos,  accesorios y programas informáticos"
activity_474020,474020,"Venta al por menor de aparatos de telefonía y comunicación"
activity_475110,475110,"Venta al por menor de hilados, tejidos y artículos de mercería"
activity_475120,475120,"Venta al por menor de confecciones para el hogar"
activity_475190,475190,"Venta al por menor de artículos textiles n.c.p. excepto prendas de vestir"
activity_475210,475210,"Venta al por menor de aberturas"
activity_475220,475220,"Venta al por menor de maderas y artículos de madera  y corcho, excepto muebles"
activity_475230,475230,"Venta al por menor de artículos de ferretería y materiales eléctricos"
activity_475240,475240,"Venta al por menor de pinturas y productos conexos"
activity_475250,475250,"Venta al por menor de artículos para plomería e instalación de gas"
activity_475260,475260,"Venta al por menor de cristales, espejos, mamparas y cerramientos"
activity_475270,475270,"Venta al por menor de papeles para pared, revestimientos para pisos y artículos similares para la decoración"
activity_475290,475290,"Venta al por menor de materiales de construcción n.c.p."
activity_475300,475300,"Venta al por menor  de electrodomésticos, artefactos para el hogar y equipos de audio y video"
activity_475410,475410,"Venta al por menor de muebles para el hogar, artículos de mimbre y corcho"
activity_475420,475420,"Venta al por menor de colchones y somieres"
activity_475430,475430,"Venta al por menor de artículos de iluminación"
activity_475440,475440,"Venta al por menor de artículos de bazar y menaje"
activity_475490,475490,"Venta al por menor de artículos para el hogar n.c.p."
activity_476110,476110,"Venta al por menor de libros"
activity_476120,476120,"Venta al por menor de diarios y revistas"
activity_476130,476130,"Venta al por menor de papel, cartón, materiales de embalaje y artículos de librería"
activity_476310,476310,"Venta al por menor de equipos  y artículos deportivos"
activity_476320,476320,"Venta al por menor de armas, artículos para la caza y pesca"
activity_476400,476400,"Venta al por menor de juguetes, artículos de cotillón y juegos de mesa"
activity_477110,477110,"Venta al por menor de ropa interior, medias, prendas para dormir y para la playa"
activity_477120,477120,"Venta al por menor de uniformes escolares y guardapolvos"
activity_477130,477130,"Venta al por menor de indumentaria para bebés y niños"
activity_477140,477140,"Venta al por menor de indumentaria deportiva"
activity_477150,477150,"Venta al por menor de prendas de cuero"
activity_477190,477190,"Venta al por menor de prendas y accesorios de vestir n.c.p."
activity_477210,477210,"Venta al por menor de artículos de talabartería y artículos regionales"
activity_477220,477220,"Venta al por menor de calzado, excepto el ortopédico y el deportivo"
activity_477230,477230,"Venta al por menor de calzado deportivo"
activity_477290,477290,"Venta al por menor de artículos de marroquinería, paraguas y similares n.c.p."
activity_477310,477310,"Venta al por menor de productos farmacéuticos y de herboristería"
activity_477320,477320,"Venta al por menor de productos cosméticos, de tocador y de perfumería"
activity_477330,477330,"Venta al por menor de instrumental médico y odontológico y artículos ortopédicos"
activity_477410,477410,"Venta al por menor de artículos de óptica y fotografía"
activity_477420,477420,"Venta al por menor de artículos de relojería y joyería"
activity_477430,477430,"Venta al por menor de bijouterie y fantasía"
activity_477440,477440,"Venta al por menor de flores, plantas, semillas, abonos, fertilizantes y otros productos de vivero"
