id,code,name
activity_477450,477450,"Venta al por menor de materiales y productos de limpieza"
activity_477460,477460,"Venta al por menor de fuel oil, gas en garrafas, carbón y leña"
activity_477470,477470,"Venta al por menor de productos veterinarios, animales domésticos y alimento balanceado para mascotas"
activity_477480,477480,"Venta al por menor de obras de arte"
activity_477490,477490,"Venta al por menor de artículos nuevos n.c.p."
activity_477810,477810,"Venta al por menor de muebles usados"
activity_477820,477820,"Venta al por menor de libros, revistas y similares usados"
activity_477830,477830,"Venta al por menor de antigüedades"
activity_477840,477840,"Venta al por menor de oro, monedas, sellos y similares"
activity_477890,477890,"Venta al por menor de artículos usados n.c.p. excepto+E1155 automotores y motocicletas"
activity_478010,478010,"Venta al por menor de alimentos, bebidas y tabaco en puestos móviles y mercados"
activity_478090,478090,"Venta al por menor de productos n.c.p. en puestos móviles y mercados"
activity_479101,479101,"Venta al por menor por internet"
activity_479109,479109,"Venta al por menor por correo, televisión y otros medios de comunicación n.c.p."
activity_479900,479900,"Venta al por menor no realizada en establecimientos  n.c.p."
activity_491110,491110,"Servicio de transporte ferroviario urbano y suburbano de pasajeros"
activity_491120,491120,"Servicio de transporte ferroviario interurbano de pasajeros"
activity_491200,491200,"Servicio de transporte ferroviario de cargas"
activity_492110,492110,"Servicio de transporte automotor urbano y suburbano regular de pasajeros"
activity_492120,492120,"Servicios de transporte automotor de pasajeros mediante taxis y remises, alquiler de autos con chofer"
activity_492130,492130,"Servicio de transporte escolar"
activity_492140,492140,"Servicio de transporte automotor urbano y suburbano no regular de pasajeros de oferta libre,  excepto mediante taxis y remises, alquiler de autos con chofer y transporte escolar"
activity_492150,492150,"Servicio de transporte automotor interurbano regular de pasajeros, E1203excepto transporte internacional"
activity_492160,492160,"Servicio de transporte automotor interurbano no regular de pasajeros"
activity_492170,492170,"Servicio de transporte automotor internacional de pasajeros"
activity_492180,492180,"Servicio de transporte automotor turístico de pasajeros"
activity_492190,492190,"Servicio de transporte automotor de pasajeros n.c.p."
activity_492210,492210,"Servicios de mudanza"
activity_492221,492221,"Servicio de transporte automotor de cereales"
activity_492229,492229,"Servicio de transporte automotor de mercaderías a granel n.c.p."
activity_492230,492230,"Servicio de transporte automotor de animales"
activity_492240,492240,"Servicio de transporte por camión cisterna"
activity_492250,492250,"Servicio de transporte automotor de mercaderías y sustancias peligrosas"
activity_492280,492280,"Servicio de transporte automotor urbano de carga n.c.p."
activity_492290,492290,"Servicio de transporte automotor de cargas n.c.p."
activity_493110,493110,"Servicio de transporte por oleoductos"
activity_493120,493120,"Servicio de transporte por poliductos y fueloductos"
activity_493200,493200,"Servicio de transporte por gasoductos"
activity_501100,501100,"Servicio de transporte marítimo de pasajeros"
activity_501200,501200,"Servicio de transporte marítimo de carga"
activity_502101,502101,"Servicio de transporte fluvial y lacustre de pasajeros"
activity_502200,502200,"Servicio de transporte fluvial y lacustre de carga"
activity_511000,511000,"Servicio de transporte aéreo de pasajeros"
activity_512000,512000,"Servicio de transporte aéreo de cargas"
activity_521010,521010,"Servicios de manipulación de carga en el ámbito terrestre"
activity_521020,521020,"Servicios de manipulación de carga en el ámbito portuario"
activity_521030,521030,"Servicios de manipulación de carga en el ámbito aéreo"
activity_522010,522010,"Servicios de almacenamiento y depósito en silos"
activity_522020,522020,"Servicios de almacenamiento y depósito en cámaras frigoríficas"
activity_522091,522091,"Servicios de usuarios directos de zona franca"
activity_522092,522092,"Servicios de gestión de depósitos fiscales"
activity_522099,522099,"Servicios de almacenamiento y depósito n.c.p."
activity_523011,523011,"Servicios de gestión aduanera realizados por despachantes de aduana"
activity_523019,523019,"Servicios de gestión aduanera para el transporte de mercaderías n.c.p."
activity_523020,523020,"Servicios de agencias marítimas para el transporte de mercaderías"
activity_523031,523031,"Servicios de gestión de agentes de transporte aduanero excepto agencias marítimas"
activity_523032,523032,"Servicios de operadores logísticos seguros (OLS) en el ámbito aduanero"
activity_523039,523039,"Servicios de operadores logísticos n.c.p."
activity_523090,523090,"Servicios de gestión y logística para el transporte de mercaderías n.c.p."
activity_524110,524110,"Servicios de explotación de infraestructura para el transporte terrestre, peajes y otros derechos"
activity_524120,524120,"Servicios  de playas de estacionamiento y garajes"
activity_524130,524130,"Servicios de estaciones terminales de ómnibus y ferroviárias"
activity_524190,524190,"Servicios complementarios para el transporte terrestre n.c.p."
activity_524210,524210,"Servicios de explotación de infraestructura para el transporte marítimo, derechos de puerto"
activity_524220,524220,"Servicios de guarderías náuticas"
activity_524230,524230,"Servicios para la navegación"
activity_524290,524290,"Servicios complementarios para el transporte marítimo n.c.p."
activity_524310,524310,"Servicios de explotación de infraestructura para el transporte aéreo, derechos de aeropuerto"
activity_524320,524320,"Servicios de hangares y estacionamiento de aeronaves"
activity_524330,524330,"Servicios para la aeronavegación"
activity_524390,524390,"Servicios complementarios para el transporte aéreo n.c.p."
activity_530010,530010,"Servicio de correo postal"
activity_530090,530090,"Servicios de mensajerías."
activity_551010,551010,"Servicios de alojamiento por hora"
activity_551021,551021,"Servicios de alojamiento en pensiones"
activity_551022,551022,"Servicios de alojamiento en hoteles, hosterías y residenciales similares, excepto por hora, que incluyen servicio de restaurante al público"
activity_551023,551023,"Servicios de alojamiento en hoteles, hosterías y residenciales similares, excepto por hora, que no incluyen servicio de restaurante al público"
activity_551090,551090,"Servicios de hospedaje temporal n.c.p."
activity_552000,552000,"Servicios de alojamiento en campings"
activity_561011,561011,"Servicios de restaurantes y cantinas sin espectáculo"
activity_561012,561012,"Servicios de restaurantes y cantinas con espectáculo"
activity_561013,561013,"Servicios de ""fast food"" y locales de venta de comidas y bebidas al paso"
activity_561014,561014,"Servicios de expendio de bebidas en bares"
activity_561019,561019,"Servicios de expendio de comidas y bebidas en establecimientos con servicio de mesa y/o en mostrador n.c.p."
activity_561020,561020,"Servicios de preparación de comidas para llevar"
activity_561030,561030,"Servicio de expendio de helados"
activity_561040,561040,"Servicios de preparación de comidas realizadas por/para vendedores ambulantes."
activity_562010,562010,"Servicios de preparación de comidas para empresas y eventos"
activity_562091,562091,"Servicios de cantinas con atención exclusiva  a los empleados o estudiantes dentro de empresas o establecimientos educativos."
activity_562099,562099,"Servicios de comidas n.c.p."
activity_581100,581100,"Edición de libros, folletos, y otras publicaciones"
activity_581200,581200,"Edición de directorios y listas de correos"
activity_581300,581300,"Edición de periódicos, revistas y publicaciones periódicas"
activity_581900,581900,"Edición n.c.p."
activity_591110,591110,"Producción de filmes y videocintas"
activity_591120,591120,"Postproducción de filmes y videocintas"
activity_591200,591200,"Distribución de filmes y videocintas"
activity_591300,591300,"Exhibición de filmes y videocintas"
activity_592000,592000,"Servicios de grabación de sonido y edición de música"
activity_601000,601000,"Emisión y retransmisión de radio"
activity_602100,602100,"Emisión y retransmisión  de televisión abierta"
activity_602200,602200,"Operadores de televisión por suscripción."
activity_602310,602310,"Emisión de señales de televisión por suscripción"
activity_602320,602320,"Producción de programas de televisión"
activity_602900,602900,"Servicios de televisión n.c.p"
activity_611010,611010,"Servicios de locutorios"
activity_611090,611090,"Servicios de telefonía fija, excepto locutorios"
activity_612000,612000,"Servicios de telefonía móvil"
activity_613000,613000,"Servicios de telecomunicaciones vía satélite, excepto servicios de transmisión de televisión"
activity_614010,614010,"Servicios de proveedores de acceso a internet"
activity_614090,614090,"Servicios de telecomunicación vía internet n.c.p."
activity_619000,619000,"Servicios de telecomunicaciones n.c.p."
activity_620100,620100,"Servicios de consultores en informática y suministros de programas de informática"
activity_620200,620200,"Servicios de consultores en equipo de informática"
activity_620300,620300,"Servicios de consultores en tecnología de la información"
activity_620900,620900,"Servicios de informática n.c.p."
activity_631110,631110,"Procesamiento de datos"
activity_631120,631120,"Hospedaje de datos"
activity_631190,631190,"Actividades conexas al procesamiento y hospedaje de datos n.c.p."
activity_631200,631200,"Portales web"
activity_639100,639100,"Agencias de noticias"
activity_639900,639900,"Servicios de información n.c.p."
activity_641100,641100,"Servicios de la banca central"
activity_641910,641910,"Servicios de la banca mayorista"
activity_641920,641920,"Servicios de la banca de inversión"
activity_641930,641930,"Servicios de la banca minorista"
activity_641941,641941,"Servicios de intermediación financiera realizada por las compañías financieras"
activity_641942,641942,"Servicios de intermediación financiera realizada por sociedades de ahorro y préstamo para la vivienda y otros inmuebles"
activity_641943,641943,"Servicios de intermediación financiera realizada por cajas de crédito"
activity_642000,642000,"Servicios de sociedades de cartera"
activity_643001,643001,"Servicios de fideicomisos"
activity_643009,643009,"Fondos y sociedades de inversión y entidades financieras similares n.c.p."
activity_649100,649100,"Arrendamiento financiero, leasing"
activity_649210,649210,"Actividades de crédito para financiar otras actividades económicas"
activity_649220,649220,"Servicios de entidades de tarjeta de compra y/o crédito"
activity_649290,649290,"Servicios de crédito n.c.p."
activity_649910,649910,"Servicios de agentes de mercado abierto ""puros"""
activity_649991,649991,"Servicios de socios inversores en sociedades regulares según Ley 19.550 - S.R.L., S.C.A, etc, excepto socios inversores en sociedades anónimas incluidos en 649999 -"
activity_649999,649999,"Servicios de financiación y actividades financieras n.c.p."
activity_651110,651110,"Servicios de seguros de salud"
activity_651120,651120,"Servicios de seguros de vida"
activity_651130,651130,"Servicios de seguros personales excepto  los de salud y de vida"
activity_651210,651210,"Servicios de aseguradoras de riesgo de trabajo (ART)"
activity_651220,651220,"Servicios de seguros patrimoniales excepto los de las aseguradoras de riesgo de trabajo (ART)"
activity_651310,651310,"Obras Sociales"
activity_651320,651320,"Servicios de cajas de previsión social pertenecientes a asociaciones profesionales"
activity_652000,652000,"Reaseguros"
activity_653000,653000,"Administración de fondos de pensiones, excepto la seguridad social obligatoria"
activity_661111,661111,"Servicios de mercados y cajas de valores"
activity_661121,661121,"Servicios de mercados a término"
activity_661131,661131,"Servicios de bolsas de comercio"
activity_661910,661910,"Servicios bursátiles de mediación o por cuenta de terceros"
activity_661920,661920,"Servicios de casas y agencias de cambio"
activity_661930,661930,"Servicios de sociedades calificadoras de riesgos financieros"
activity_661991,661991,"Servicios de envio y recepción de fondos desde y hacia el exterior"
activity_661992,661992,"Servicios de administradoras de vales y tickets"
activity_661999,661999,"Servicios auxiliares a la intermediación financiera n.c.p."
activity_662010,662010,"Servicios de evaluación de riesgos y daños"
activity_662020,662020,"Servicios de productores  y asesores de seguros"
activity_662090,662090,"Servicios auxiliares a los servicios de seguros n.c.p."
activity_663000,663000,"Servicios de gestión de fondos a cambio de una retribución o por contrata"
activity_681010,681010,"Servicios de alquiler y explotación de inmuebles para fiestas, convenciones y otros eventos similares"
activity_681020,681020,"Servicios de alquiler  de consultorios médicos"
activity_681098,681098,"Servicios inmobiliarios realizados por cuenta propia, con bienes urbanos propios o arrendados n.c.p."
activity_681099,681099,"Servicios inmobiliarios realizados por cuenta propia, con bienes rurales propios o arrendados n.c.p."
activity_682010,682010,"Servicios de administración de consorcios de edificios"
activity_682091,682091,"Servicios prestados por inmobiliarias"
activity_682099,682099,"Servicios inmobiliarios realizados a cambio de una retribución o por contrata n.c.p."
activity_691001,691001,"Servicios jurídicos"
activity_691002,691002,"Servicios  notariales"
activity_692000,692000,"Servicios de contabilidad, auditoría y asesoría fiscal"
activity_702010,702010,"Servicios de gerenciamiento de empresas e instituciones de salud, servicios de auditoria y medicina legal, servicio de asesoramiento farmacéutico"
activity_702091,702091,"Servicios de asesoramiento, dirección y gestión empresarial realizados por integrantes de los órganos de administración y/o fiscalización en sociedades anónimas"
activity_702092,702092,"Servicios de asesoramiento, dirección y gestión empresarial realizados por integrantes de cuerpos de dirección en sociedades excepto las anónimas"
activity_702099,702099,"Servicios de asesoramiento, dirección y gestión empresarial n.c.p."
activity_711001,711001,"Servicios relacionados con la construcción."
activity_711002,711002,"Servicios geológicos y de prospección"
activity_711003,711003,"Servicios relacionados con la electrónica y las comunicaciones"
activity_711009,711009,"Servicios de arquitectura e ingeniería y servicios conexos de asesoramiento técnico n.c.p."
activity_712000,712000,"Ensayos y análisis técnicos"
activity_721010,721010,"Investigación  y desarrollo experimental en el campo de la ingeniería y la tecnología"
activity_721020,721020,"Investigación  y desarrollo experimental en el campo de las ciencias médicas"
activity_721030,721030,"Investigación  y desarrollo experimental en el campo de las ciencias agropecuarias"
activity_721090,721090,"Investigación y desarrollo experimental en el campo de las ciencias exactas y naturales n.c.p."
activity_722010,722010,"Investigación  y desarrollo experimental en el campo de las ciencias sociales"
activity_722020,722020,"Investigación  y desarrollo experimental en el campo de las ciencias humanas"
activity_731001,731001,"Servicios de comercialización de tiempo y espacio publicitario"
activity_731009,731009,"Servicios de publicidad n.c.p."
activity_732000,732000,"Estudio de mercado, realización de encuestas de opinión pública"
activity_741000,741000,"Servicios de diseño especializado"
activity_742000,742000,"Servicios de fotografía"
activity_749001,749001,"Servicios de traducción e interpretación"
activity_749002,749002,"Servicios de representación e intermediación de artistas y modelos"
activity_749003,749003,"Servicios de representación e intermediación de deportistas profesionales"
activity_749009,749009,"Actividades profesionales, científicas y técnicas n.c.p."
activity_750000,750000,"Servicios veterinarios"
activity_771110,771110,"Alquiler de automóviles sin conductor"
activity_771190,771190,"Alquiler de vehículos automotores n.c.p., sin conductor ni operarios"
activity_771210,771210,"Alquiler de equipo de transporte para vía acuática, sin operarios ni tripulación"
activity_771220,771220,"Alquiler de equipo de transporte para vía aérea, sin operarios ni tripulación"
activity_771290,771290,"Alquiler de equipo de transporte n.c.p. sin conductor ni operarios"
activity_772010,772010,"Alquiler de videos y video juegos"
activity_772091,772091,"Alquiler de prendas de vestir"
activity_772099,772099,"Alquiler de efectos personales y enseres domésticos n.c.p."
activity_773010,773010,"Alquiler de maquinaria y equipo agropecuario y forestal, sin operarios"
activity_773020,773020,"Alquiler de maquinaria y equipo para la minería, sin operarios"
activity_773030,773030,"Alquiler de maquinaria y equipo de construcción e ingeniería civil, sin operarios"
activity_773040,773040,"Alquiler de maquinaria y equipo de oficina, incluso computadoras"
activity_773090,773090,"Alquiler de maquinaria y equipo n.c.p., sin personal"
activity_774000,774000,"Arrendamiento y gestión de bienes intangibles no financieros"
activity_780000,780000,"Obtención y dotación de personal"
activity_791100,791100,"Servicios minoristas de agencias de viajes"
activity_791200,791200,"Servicios mayoristas de agencias de viajes"
activity_791901,791901,"Servicios de turismo aventura"
activity_791909,791909,"Servicios complementarios de apoyo turístico n.c.p."
activity_801010,801010,"Servicios de transporte de caudales y objetos de valor"
activity_801020,801020,"Servicios de sistemas de seguridad"
activity_801090,801090,"Servicios de seguridad e investigación n.c.p."
activity_811000,811000,"Servicio combinado de apoyo a edificios"
activity_812010,812010,"Servicios de limpieza general de edificios"
activity_812020,812020,"Servicios de desinfección y exterminio de plagas en el ámbito urbano"
activity_812090,812090,"Servicios de limpieza n.c.p."
activity_813000,813000,"Servicios de jardinería y mantenimiento de espacios verdes"
activity_821100,821100,"Servicios combinados de gestión administrativa de oficinas"
activity_821900,821900,"Servicios de fotocopiado, preparación de documentos y otros servicios de apoyo de oficina"
activity_822000,822000,"Servicios de call center"
activity_823000,823000,"Servicios de organización de convenciones y exposiciones comerciales, excepto culturales y deportivos"
activity_829100,829100,"Servicios de agencias de cobro y calificación crediticia"
activity_829200,829200,"Servicios de envase y empaque"
activity_829900,829900,"Servicios empresariales n.c.p."
activity_841100,841100,"Servicios generales de la Administración Pública"
activity_841200,841200,"Servicios para la regulación de las actividades sanitarias, educativas, culturales, y restantes servicios sociales, excepto seguridad social obligatoria"
activity_841300,841300,"Servicios para la regulación de la actividad económica"
activity_841900,841900,"Servicios auxiliares para los servicios generales de la Administración Pública"
activity_842100,842100,"Servicios de asuntos exteriores"
activity_842200,842200,"Servicios de defensa"
activity_842300,842300,"Servicios para el orden público y la seguridad"
activity_842400,842400,"Servicios de justicia"
activity_842500,842500,"Servicios de protección civil"
activity_843000,843000,"Servicios de la seguridad social obligatoria, excepto obras sociales"
activity_851010,851010,"Guarderías y jardines maternales"
activity_851020,851020,"Enseñanza inicial, jardín de infantes y primaria"
activity_852100,852100,"Enseñanza secundaria de formación general"
activity_852200,852200,"Enseñanza secundaria de formación técnica y profesional"
activity_853100,853100,"Enseñanza  terciaria"
activity_853201,853201,"Enseñanza universitaria excepto formación de posgrado"
activity_853300,853300,"Formación de posgrado"
activity_854910,854910,"Enseñanza de idiomas"
activity_854920,854920,"Enseñanza de cursos relacionados con informática"
activity_854930,854930,"Enseñanza para adultos, excepto discapacitados"
activity_854940,854940,"Enseñanza especial y para discapacitados"
activity_854950,854950,"Enseñanza de gimnasia, deportes y actividades físicas"
activity_854960,854960,"Enseñanza artística"
activity_854990,854990,"Servicios de enseñanza n.c.p."
activity_855000,855000,"Servicios de apoyo a la educación"
activity_861010,861010,"Servicios de internación excepto instituciones relacionadas con la salud mental"
activity_861020,861020,"Servicios de internación en instituciones relacionadas con la salud mental"
activity_862110,862110,"Servicios de  consulta médica"
activity_862120,862120,"Servicios de proveedores de atención médica domiciliaria"
activity_862130,862130,"Servicios de atención médica en dispensarios, salitas, vacunatorios y otros locales de atención primaria de la salud"
activity_862200,862200,"Servicios odontológicos"
activity_863110,863110,"Servicios de prácticas de diagnóstico en laboratorios"
activity_863120,863120,"Servicios de prácticas de diagnóstico por imágenes"
activity_863190,863190,"Servicios de prácticas de diagnóstico n.c.p."
activity_863200,863200,"Servicios de tratamiento"
activity_863300,863300,"Servicio médico integrado de consulta, diagnóstico y tratamiento"
activity_864000,864000,"Servicios de emergencias y traslados"
activity_869010,869010,"Servicios de rehabilitación física"
activity_869090,869090,"Servicios relacionados con la salud humana n.c.p."
activity_870100,870100,"Servicios de atención a personas con problemas de salud mental o de adicciones, con alojamiento"
activity_870210,870210,"Servicios de atención a ancianos con alojamiento"
activity_870220,870220,"Servicios de atención a personas minusválidas con alojamiento"
activity_870910,870910,"Servicios de atención a niños y adolescentes carenciados con alojamiento"
activity_870920,870920,"Servicios de atención a mujeres con alojamiento"
activity_870990,870990,"Servicios sociales con alojamiento n.c.p."
activity_880000,880000,"Servicios sociales sin alojamiento"
activity_900011,900011,"Producción de espectáculos teatrales y musicales"
activity_900021,900021,"Composición y representación de obras teatrales, musicales y artísticas"
activity_900030,900030,"Servicios conexos a la producción de espectáculos teatrales y musicales"
activity_900040,900040,"Servicios de agencias de ventas de entradas"
activity_900091,900091,"Servicios de espectáculos artísticos n.c.p."
activity_910100,910100,"Servicios de bibliotecas y archivos"
activity_910200,910200,"Servicios de museos y preservación de lugares y edificios históricos"
activity_910300,910300,"Servicios de jardines botánicos, zoológicos y de parques nacionales"
activity_910900,910900,"Servicios culturales n.c.p."
activity_920001,920001,"Servicios de recepción de apuestas de quiniela, lotería y similares"
activity_920009,920009,"Servicios relacionados con juegos de azar y apuestas n.c.p."
activity_931010,931010,"Servicios de organización, dirección y gestión de prácticas deportivas en clubes"
activity_931020,931020,"Explotación de instalaciones deportivas, excepto clubes"
activity_931030,931030,"Promoción y producción de espectáculos deportivos"
activity_931041,931041,"Servicios prestados por deportistas y atletas para la realización de prácticas deportivas"
activity_931042,931042,"Servicios prestados por profesionales y técnicos para la realización de prácticas deportivas"
activity_931050,931050,"Servicios de acondicionamiento físico"
activity_931090,931090,"Servicios para la práctica deportiva n.c.p."
activity_939010,939010,"Servicios de parques de diversiones y parques temáticos"
activity_939020,939020,"Servicios de salones de juegos"
activity_939030,939030,"Servicios de salones de baile, discotecas y similares"
activity_939090,939090,"Servicios de entretenimiento n.c.p."
activity_941100,941100,"Servicios de organizaciones empresariales y de empleadores"
activity_941200,941200,"Servicios de organizaciones profesionales"
activity_942000,942000,"Servicios de sindicatos"
activity_949100,949100,"Servicios de organizaciones religiosas"
activity_949200,949200,"Servicios de organizaciones políticas"
activity_949910,949910,"Servicios de mutuales, excepto mutuales de salud y financieras"
activity_949920,949920,"Servicios de consorcios de edificios"
activity_949930,949930,"Servicios de cooperativas cuando realizan varias actividades"
activity_949990,949990,"Servicios de asociaciones n.c.p."
activity_951100,951100,"Reparación y mantenimiento de equipos informáticos"
activity_951200,951200,"Reparación y mantenimiento de equipos de telefonía y de comunicación"
activity_952200,952200,"Reparación de calzado y artículos de marroquinería"
activity_952300,952300,"Reparación de tapizados y muebles"
activity_952910,952910,"Reforma y reparación de cerraduras, duplicación de llaves. Cerrajerías"
activity_952920,952920,"Reparación de relojes y joyas. Relojerías"
activity_952990,952990,"Reparación de efectos personales y enseres domésticos n.c.p."
activity_960101,960101,"Servicios de limpieza de prendas prestado por tintorerías rápidas"
activity_960102,960102,"Lavado y limpieza de artículos de tela, cuero y/o de piel, incluso la limpieza en seco"
activity_960201,960201,"Servicios de peluquería"
activity_960202,960202,"Servicios de tratamiento de belleza, excepto los de peluquería"
activity_960300,960300,"Pompas fúnebres y servicios conexos"
activity_960910,960910,"Servicios de centros de estética, spa y similares"
