id,code,name
activity_11111,11111,"Cultivo de arroz"
activity_11112,11112,"Cultivo de trigo"
activity_11119,11119,"Cultivo de cereales n.c.p., excepto los de uso forrajero"
activity_11121,11121,"Cultivo de maíz"
activity_11129,11129,"Cultivo de cereales de uso forrajero n.c.p."
activity_11130,11130,"Cultivo de pastos de uso forrajero"
activity_11211,11211,"Cultivo de soja"
activity_11291,11291,"Cultivo de girasol"
activity_11299,11299,"Cultivo de oleaginosas n.c.p. excepto soja y girasol"
activity_11310,11310,"Cultivo de papa, batata y mandioca"
activity_11321,11321,"Cultivo de tomate"
activity_11329,11329,"Cultivo de bulbos, brotes, raíces y hortalizas de fruto n.c.p."
activity_11331,11331,"Cultivo de hortalizas de hoja y de otras hortalizas frescas"
activity_11341,11341,"Cultivo de legumbres frescas"
activity_11342,11342,"Cultivo de legumbres secas"
activity_11400,11400,"Cultivo de tabaco"
activity_11501,11501,"Cultivo de algodón"
activity_11509,11509,"Cultivo de plantas para la obtención de fibras n.c.p."
activity_11911,11911,"Cultivo de flores"
activity_11912,11912,"Cultivo de plantas ornamentales"
activity_11990,11990,"Cultivos temporales n.c.p."
activity_12110,12110,"Cultivo de vid para vinificar"
activity_12121,12121,"Cultivo de uva de mesa"
activity_12200,12200,"Cultivo de frutas cítricas"
activity_12311,12311,"Cultivo de manzana y pera"
activity_12319,12319,"Cultivo de frutas de pepita n.c.p."
activity_12320,12320,"Cultivo de frutas de carozo"
activity_12410,12410,"Cultivo de frutas tropicales y subtropicales"
activity_12420,12420,"Cultivo de frutas secas"
activity_12490,12490,"Cultivo de frutas n.c.p."
activity_12510,12510,"Cultivo de caña de azúcar"
activity_12590,12590,"Cultivo de plantas sacaríferas n.c.p."
activity_12600,12600,"Cultivo de frutos oleaginosos"
activity_12701,12701,"Cultivo de yerba mate"
activity_12709,12709,"Cultivo de té y otras plantas cuyas hojas se utilizan para preparar infusiones"
activity_12800,12800,"Cultivo de especias y de plantas aromáticas y medicinales"
activity_12900,12900,"Cultivos perennes n.c.p."
activity_13011,13011,"Producción de semillas híbridas de cereales y oleaginosas"
activity_13012,13012,"Producción de semillas varietales o autofecundadas de cereales, oleaginosas, y forrajeras"
activity_13013,13013,"Producción de semillas de hortalizas y legumbres, flores y plantas ornamentales y árboles frutales"
activity_13019,13019,"Producción de semillas de cultivos agrícolas n.c.p."
activity_13020,13020,"Producción de otras formas de propagación de cultivos agrícolas"
activity_14113,14113,"Cría de ganado bovino, excepto la realizada en cabañas y para la producción de leche"
activity_14114,14114,"Invernada  de ganado bovino excepto el engorde en corrales (Feed-Lot)"
activity_14115,14115,"Engorde en corrales (Feed-Lot)"
activity_14121,14121,"Cría de ganado bovino realizada en cabañas"
activity_14211,14211,"Cría de ganado equino, excepto la realizada en haras"
activity_14300,14300,"Cría de camélidos"
activity_14410,14410,"Cría de ganado ovino -excepto en cabañas y para la  producción de lana y leche"
activity_14420,14420,"Cría de ganado ovino realizada en cabañas"
activity_14430,14430,"Cría de ganado caprino -excepto la realizada en cabañas y para producción de pelos y de leche"
activity_14440,14440,"Cría de ganado caprino realizada en cabañas"
activity_14510,14510,"Cría de ganado porcino, excepto la realizada en cabañas"
activity_14520,14520,"Cría de ganado porcino realizado en cabañas"
activity_14610,14610,"Producción de leche bovina"
activity_14620,14620,"Producción de leche de oveja y de cabra"
activity_14710,14710,"Producción de lana y pelo de oveja y cabra (cruda)"
activity_14720,14720,"Producción de pelos de ganado n.c.p."
activity_14810,14810,"Cría de aves de corral, excepto para la producción de huevos"
activity_14820,14820,"Producción de huevos"
activity_14910,14910,"Apicultura"
activity_14920,14920,"Cunicultura"
activity_14930,14930,"Cría de animales pelíferos, pilíferos y plumíferos, excepto de las especies ganaderas"
activity_14990,14990,"Cría de animales y obtención de productos de origen animal, n.c.p."
activity_16111,16111,"Servicios de labranza, siembra, transplante  y  cuidados culturales"
activity_16112,16112,"Servicios de pulverización, desinfección y fumigación terrestre"
activity_16113,16113,"Servicios de pulverización, desinfección y fumigación aérea"
activity_16119,16119,"Servicios de maquinaria agrícola n.c.p., excepto los de cosecha mecánica"
activity_16120,16120,"Servicios de cosecha mecánica"
activity_16130,16130,"Servicios de contratistas de mano de obra agrícola"
activity_16140,16140,"Servicios de post cosecha"
activity_16150,16150,"Servicios de procesamiento de semillas para su siembra"
activity_16190,16190,"Servicios de apoyo agrícolas n.c.p"
activity_16210,16210,"Inseminación artificial y servicios n.c.p. para mejorar la reproducción de los animales y el rendimiento de sus productos"
activity_16220,16220,"Servicios de contratistas de mano de obra pecuaria"
activity_16230,16230,"Servicios de esquila de animales"
activity_16291,16291,"Servicios para el control de plagas, baños parasiticidas, etc."
activity_16292,16292,"Albergue y cuidado de  animales de terceros"
activity_16299,16299,"Servicios de apoyo pecuarios n.c.p."
activity_17010,17010,"Caza y repoblación  de animales de caza"
activity_17020,17020,"Servicios de apoyo para la caza"
activity_21010,21010,"Plantación de bosques"
activity_21020,21020,"Repoblación y conservación de bosques nativos y zonas forestadas"
activity_21030,21030,"Explotación de viveros forestales"
activity_22010,22010,"Extracción de productos forestales de bosques cultivados"
activity_22020,22020,"Extracción de productos forestales de bosques nativos"
activity_24010,24010,"Servicios forestales para la extracción de madera"
activity_24020,24020,"Servicios forestales excepto los servicios para la extracción de madera"
activity_31110,31110,"Pesca de organismos marinos, excepto cuando es realizada en buques procesadores"
activity_31120,31120,"Pesca y elaboración de productos marinos realizada a bordo de buques procesadores"
activity_31130,31130,"Recolección de organismos marinos excepto peces, crustáceos y moluscos"
activity_31200,31200,"Pesca continental: fluvial y lacustre"
activity_31300,31300,"Servicios de apoyo para la pesca"
activity_32000,32000,"Explotación de criaderos de peces, granjas piscícolas y otros frutos acuáticos  (acuicultura)"
activity_51000,51000,"Extracción y aglomeración de carbón"
activity_52000,52000,"Extracción y aglomeración de lignito"
activity_61000,61000,"Extracción de petróleo crudo"
activity_62000,62000,"Extracción de gas natural"
activity_71000,71000,"Extracción de minerales de hierro"
activity_72100,72100,"Extracción de minerales y concentrados de uranio y torio"
activity_72910,72910,"Extracción de metales preciosos"
activity_72990,72990,"Extracción de minerales metalíferos no ferrosos n.c.p., excepto minerales de uranio y torio"
activity_81100,81100,"Extracción de rocas ornamentales"
activity_81200,81200,"Extracción de piedra caliza y yeso"
activity_81300,81300,"Extracción de arenas, canto rodado y triturados pétreos"
activity_81400,81400,"Extracción de arcilla y caolín"
activity_89110,89110,"Extracción de minerales para la fabricación de abonos excepto turba"
activity_89120,89120,"Extracción de minerales para la fabricación de productos químicos"
activity_89200,89200,"Extracción y aglomeración de turba"
activity_89300,89300,"Extracción de sal"
activity_89900,89900,"Explotación de minas y canteras n.c.p."
activity_91000,91000,"Servicios de apoyo para la extracción de petróleo y gas natural"
activity_99000,99000,"Servicios de apoyo para la minería, excepto para la extracción de petróleo y gas natual"
activity_101011,101011,"Matanza de ganado bovino"
activity_101012,101012,"Procesamiento de carne de ganado bovino"
activity_101013,101013,"Saladero y peladero de cueros de ganado bovino"
activity_101020,101020,"Producción y procesamiento de carne de aves"
activity_101030,101030,"Elaboración de fiambres y embutidos"
activity_101040,101040,"Matanza de ganado excepto el bovino y procesamiento de su carne"
activity_101091,101091,"Fabricación de aceites y grasas de origen animal"
activity_101099,101099,"Matanza de animales n.c.p. y procesamiento de su carne, elaboración de subproductos cárnicos n.c.p."
activity_102001,102001,"Elaboración de pescados de mar, crustáceos y  productos marinos"
activity_102002,102002,"Elaboración de pescados de ríos y lagunas y otros productos fluviales y lacustres"
activity_102003,102003,"Fabricación de aceites, grasas, harinas y productos a base de pescados"
activity_103011,103011,"Preparación de conservas de frutas, hortalizas y legumbres"
activity_103012,103012,"Elaboración y envasado de dulces, mermeladas y jaleas"
activity_103020,103020,"Elaboración de jugos naturales y sus concentrados, de frutas, hortalizas y legumbres"
activity_103030,103030,"Elaboración de frutas, hortalizas y legumbres congeladas"
activity_103091,103091,"Elaboración de hortalizas y legumbres deshidratadas o desecadas, preparación n.c.p. de hortalizas y legumbres"
activity_103099,103099,"Elaboración de frutas deshidratadas o desecadas, preparación n.c.p. de frutas"
activity_104011,104011,"Elaboración de aceites y grasas vegetales  sin refinar"
activity_104012,104012,"Elaboración de aceite de oliva"
activity_104013,104013,"Elaboración de aceites y grasas vegetales refinados"
activity_104020,104020,"Elaboración de margarinas y grasas vegetales comestibles similares"
activity_105010,105010,"Elaboración de leches y productos lácteos deshidratados"
activity_105020,105020,"Elaboración de quesos"
activity_105030,105030,"Elaboración industrial de helados"
activity_105090,105090,"Elaboración de productos lácteos n.c.p."
activity_106110,106110,"Molienda de trigo"
activity_106120,106120,"Preparación de arroz"
activity_106131,106131,"Elaboración de alimentos a base de cereales"
activity_106139,106139,"Preparación y molienda de legumbres y cereales n.c.p., excepto trigo y arroz y molienda húmeda de maíz"
activity_106200,106200,"Elaboración de almidones y productos derivados del almidón, molienda húmeda de maíz"
activity_107110,107110,"Elaboración de galletitas y bizcochos"
activity_107121,107121,"Elaboración industrial de productos de panadería, excepto galletitas y bizcochos"
activity_107129,107129,"Elaboración de productos de panadería n.c.p."
activity_107200,107200,"Elaboración de azúcar"
activity_107301,107301,"Elaboración de cacao y chocolate"
activity_107309,107309,"Elaboración de productos de confitería n.c.p."
activity_107410,107410,"Elaboración de pastas alimentarias frescas"
activity_107420,107420,"Elaboración de pastas alimentarias secas"
activity_107500,107500,"Elaboración de comidas preparadas para reventa"
activity_107911,107911,"Tostado, torrado y molienda de café"
activity_107912,107912,"Elaboración y molienda de hierbas aromáticas y  especias"
activity_107920,107920,"Preparación de hojas de té"
activity_107930,107930,"Elaboración de yerba mate"
activity_107991,107991,"Elaboración de extractos, jarabes y concentrados"
activity_107992,107992,"Elaboración de vinagres"
activity_107999,107999,"Elaboración de productos alimenticios n.c.p."
activity_108000,108000,"Elaboración de alimentos preparados para animales"
activity_109000,109000,"Servicios industriales para la elaboración de alimentos y bebidas"
activity_110100,110100,"Destilación, rectificación y mezcla de bebidas espiritosas"
activity_110211,110211,"Elaboración de mosto"
activity_110212,110212,"Elaboración de vinos"
activity_110290,110290,"Elaboración de sidra y otras bebidas alcohólicas fermentadas"
activity_110300,110300,"Elaboración de cerveza, bebidas malteadas y malta"
activity_110411,110411,"Embotellado de aguas naturales y minerales"
activity_110412,110412,"Fabricación de sodas"
activity_110420,110420,"Elaboración de bebidas gaseosas, excepto soda"
activity_110491,110491,"Elaboración de hielo"
activity_110492,110492,"Elaboración de bebidas no alcohólicas n.c.p."
activity_120010,120010,"Preparación de hojas de tabaco"
activity_120091,120091,"Elaboración de cigarrillos"
activity_120099,120099,"Elaboración de productos de tabaco n.c.p."
activity_131110,131110,"Preparación de fibras textiles vegetales, desmotado de algodón"
activity_131120,131120,"Preparación de fibras animales de uso textil"
activity_131131,131131,"Fabricación de hilados textiles de lana, pelos y sus mezclas"
activity_131132,131132,"Fabricación de hilados textiles de algodón y sus mezclas"
activity_131139,131139,"Fabricación de hilados textiles n.c.p., excepto de lana  y de algodón"
activity_131201,131201,"Fabricación de tejidos (telas) planos de lana y sus mezclas, incluye hilanderías y tejedurías integradas"
activity_131202,131202,"Fabricación de tejidos (telas) planos de algodón y sus mezclas, incluye hilanderías y tejedurías integradas"
activity_131209,131209,"Fabricación de tejidos (telas) planos de fibras textiles n.c.p., incluye hilanderías y tejedurías integradas"
activity_131300,131300,"Acabado de productos textiles"
activity_139100,139100,"Fabricación de tejidos de punto"
activity_139201,139201,"Fabricación de frazadas, mantas, ponchos, colchas, cobertores, etc."
activity_139202,139202,"Fabricación de ropa de cama y mantelería"
activity_139203,139203,"Fabricación de artículos de lona y sucedáneos de lona"
activity_139204,139204,"Fabricación de bolsas de materiales textiles para productos a granel"
activity_139209,139209,"Fabricación de artículos confeccionados de materiales textiles n.c.p., excepto prendas de vestir"
activity_139300,139300,"Fabricación de tapices y alfombras"
activity_139400,139400,"Fabricación de cuerdas, cordeles, bramantes y redes"
activity_139900,139900,"Fabricación de productos textiles n.c.p."
activity_141110,141110,"Confección de ropa interior, prendas para dormir y para la playa"
activity_141120,141120,"Confección de ropa de trabajo, uniformes y guardapolvos"
activity_141130,141130,"Confección de prendas de vestir para bebés y niños"
activity_141140,141140,"Confección de prendas deportivas"
activity_141191,141191,"Fabricación de accesorios de vestir excepto de cuero"
activity_141199,141199,"Confección de prendas de vestir n.c.p., excepto prendas de piel, cuero y de punto"
activity_141201,141201,"Fabricación de accesorios de vestir de cuero"
activity_141202,141202,"Confección de prendas de vestir de cuero"
activity_142000,142000,"Terminación y teñido de pieles, fabricación de artículos de piel"
activity_143010,143010,"Fabricación de medias"
activity_143020,143020,"Fabricación de prendas de vestir y artículos similares de punto"
activity_149000,149000,"Servicios industriales para la industria confeccionista"
activity_151100,151100,"Curtido y terminación de cueros"
activity_151200,151200,"Fabricación de maletas, bolsos de mano y similares, artículos de talabartería y artículos de cuero n.c.p."
activity_152011,152011,"Fabricación de calzado de cuero, excepto calzado deportivo y ortopédico"
activity_152021,152021,"Fabricación de calzado de materiales n.c.p., excepto calzado deportivo y ortopédico"
activity_152031,152031,"Fabricación de calzado deportivo"
activity_152040,152040,"Fabricación de partes de calzado"
activity_161001,161001,"Aserrado y cepillado de madera  nativa"
activity_161002,161002,"Aserrado y cepillado de madera implantada"
activity_162100,162100,"Fabricación de hojas de madera para enchapado, fabricación de tableros contrachapados, tableros laminados, tableros de partículas y tableros y paneles n.c.p."
activity_162201,162201,"Fabricación de aberturas y estructuras de madera para la construcción"
activity_162202,162202,"Fabricación de viviendas prefabricadas de madera"
activity_162300,162300,"Fabricación de recipientes de madera"
activity_162901,162901,"Fabricación de ataúdes"
activity_162902,162902,"Fabricación de artículos de madera en tornerías"
activity_162903,162903,"Fabricación de productos de corcho"
activity_162909,162909,"Fabricación de productos de madera n.c.p, fabricación de artículos de paja y materiales trenzables"
activity_170101,170101,"Fabricación de pasta de madera"
activity_170102,170102,"Fabricación de papel y cartón excepto envases"
activity_170201,170201,"Fabricación de papel ondulado y envases de papel"
activity_170202,170202,"Fabricación de cartón ondulado y envases de cartón"
activity_170910,170910,"Fabricación de artículos de papel y cartón de uso doméstico e higiénico sanitario"
activity_170990,170990,"Fabricación de artículos de papel y cartón n.c.p."
activity_181101,181101,"Impresión de diarios y revistas"
activity_181109,181109,"Impresión n.c.p., excepto de diarios y revistas"
activity_181200,181200,"Servicios relacionados con la impresión"
activity_182000,182000,"Reproducción de grabaciones"
activity_191000,191000,"Fabricación de productos de hornos de coque"
activity_192000,192000,"Fabricación de productos de la refinación del petróleo"
activity_201110,201110,"Fabricación de gases industriales y medicinales comprimidos o licuados"
activity_201120,201120,"Fabricación de curtientes naturales y sintéticos"
activity_201130,201130,"Fabricación de materias colorantes básicas, excepto pigmentos preparados"
activity_201140,201140,"Fabricación de combustible nuclear, sustancias y materiales radiactivos"
activity_201180,201180,"Fabricación de materias químicas inorgánicas básicas n.c.p."
activity_201190,201190,"Fabricación de materias químicas orgánicas básicas n.c.p."
activity_201210,201210,"Fabricación de alcohol"
activity_201220,201220,"Fabricación de biocombustibles excepto alcohol"
activity_201300,201300,"Fabricación de abonos y compuestos de nitrógeno"
activity_201401,201401,"Fabricación de resinas y cauchos sintéticos"
activity_201409,201409,"Fabricación de materias plásticas en formas primarias n.c.p."
activity_202101,202101,"Fabricación de insecticidas, plaguicidas y  productos químicos de uso agropecuario"
activity_202200,202200,"Fabricación de pinturas, barnices y productos de revestimiento similares, tintas de imprenta y masillas"
activity_202311,202311,"Fabricación de preparados para limpieza, pulido y saneamiento"
activity_202312,202312,"Fabricación de jabones y detergentes"
activity_202320,202320,"Fabricación de cosméticos, perfumes y  productos de higiene y tocador"
activity_202906,202906,"Fabricación de explosivos y productos de pirotecnia"
activity_202907,202907,"Fabricación de colas, adhesivos, aprestos y cementos excepto los odontológicos obtenidos de sustancias minerales y vegetales"
activity_202908,202908,"Fabricación de productos químicos n.c.p."
activity_203000,203000,"Fabricación de fibras manufacturadas"
activity_204000,204000,"Servicios industriales para la fabricación de sustancias y productos químicos"
activity_210010,210010,"Fabricación de medicamentos de uso humano y productos farmacéuticos"
activity_210020,210020,"Fabricación de medicamentos de uso veterinario"
activity_210030,210030,"Fabricación de sustancias químicas para la elaboración de medicamentos"
activity_210090,210090,"Fabricación de productos de laboratorio y productos botánicos de uso farmaceútico n.c.p."
activity_221110,221110,"Fabricación de cubiertas y cámaras"
activity_221120,221120,"Recauchutado y renovación de cubiertas"
activity_221901,221901,"Fabricación de  autopartes de caucho excepto cámaras y cubiertas"
activity_221909,221909,"Fabricación  de productos de caucho n.c.p."
activity_222010,222010,"Fabricación de envases plásticos"
activity_222090,222090,"Fabricación de productos plásticos en formas básicas y artículos de plástico n.c.p., excepto muebles"
activity_231010,231010,"Fabricación de envases de vidrio"
activity_231020,231020,"Fabricación y elaboración de vidrio plano"
activity_231090,231090,"Fabricación de productos de vidrio n.c.p."
activity_239100,239100,"Fabricación de productos de cerámica refractaria"
activity_239201,239201,"Fabricación de ladrillos"
activity_239202,239202,"Fabricación de revestimientos cerámicos"
activity_239209,239209,"Fabricación de productos de arcilla y cerámica no refractaria para uso estructural n.c.p."
activity_239310,239310,"Fabricación de artículos sanitarios de cerámica"
activity_239391,239391,"Fabricación de objetos cerámicos para uso doméstico excepto artefactos sanitarios"
activity_239399,239399,"Fabricación de artículos de cerámica no refractaria para uso no estructural n.c.p."
activity_239410,239410,"Elaboración de cemento"
activity_239421,239421,"Elaboración de  yeso"
activity_239422,239422,"Elaboración de cal"
activity_239510,239510,"Fabricación de mosaicos"
activity_239591,239591,"Elaboración de hormigón"
activity_239592,239592,"Fabricación de premoldeadas para la construcción"
activity_239593,239593,"Fabricación de artículos de cemento, fibrocemento y yeso excepto hormigón y mosaicos"
activity_239600,239600,"Corte, tallado y acabado de la piedra"
activity_239900,239900,"Fabricación de productos minerales no metálicos n.c.p."
activity_241001,241001,"Laminación y estirado. Producción de lingotes, planchas o barras fabricadas por operadores independientes"
activity_241009,241009,"Fabricación en industrias básicas de productos de hierro y acero n.c.p."
activity_242010,242010,"Elaboración de aluminio primario y semielaborados de aluminio"
activity_242090,242090,"Fabricación de productos primarios de metales preciosos y metales no ferrosos n.c.p. y sus semielaborados"
activity_243100,243100,"Fundición de hierro y acero"
activity_243200,243200,"Fundición de metales no ferrosos"
activity_251101,251101,"Fabricación de carpintería metálica"
activity_251102,251102,"Fabricación de productos metálicos para uso estructural"
activity_251200,251200,"Fabricación de tanques, depósitos y recipientes de metal"
activity_251300,251300,"Fabricación de generadores de vapor"
activity_252000,252000,"Fabricación de armas y municiones"
activity_259100,259100,"Forjado, prensado, estampado y laminado de metales, pulvimetalurgia"
activity_259200,259200,"Tratamiento y revestimiento de metales y trabajos de metales en general"
activity_259301,259301,"Fabricación de herramientas manuales y sus accesorios"
activity_259302,259302,"Fabricación de artículos de cuchillería y utensillos de mesa y de cocina"
activity_259309,259309,"Fabricación de cerraduras, herrajes y artículos de ferretería n.c.p."
activity_259910,259910,"Fabricación de envases metálicos"
activity_259991,259991,"Fabricación de tejidos de alambre"
activity_259992,259992,"Fabricación de cajas de seguridad"
activity_259993,259993,"Fabricación de productos metálicos de tornería y/o matricería"
activity_259999,259999,"Fabricación de productos elaborados de metal n.c.p."
activity_261000,261000,"Fabricación de componentes electrónicos"
activity_262000,262000,"Fabricación de equipos y productos informáticos"
activity_263000,263000,"Fabricación  de equipos de comunicaciones y transmisores de radio y televisión"
activity_264000,264000,"Fabricación de receptores de radio y televisión, aparatos de grabación y reproducción de sonido y video, y productos conexos"
activity_265101,265101,"Fabricación de instrumentos y aparatos para medir, verificar, ensayar, navegar y otros fines, excepto el equipo de control de procesos industriales"
activity_265102,265102,"Fabricación de equipo de control de procesos industriales"
activity_265200,265200,"Fabricación de relojes"
activity_266010,266010,"Fabricación de equipo médico y quirúrgico y de aparatos ortopédicos principalmente electrónicos y/o eléctricos"
activity_266090,266090,"Fabricación de equipo médico y quirúrgico y de aparatos ortopédicos n.c.p."
activity_267001,267001,"Fabricación de equipamiento e instrumentos ópticos y sus accesorios"
activity_267002,267002,"Fabricación de aparatos y accesorios para fotografía excepto películas, placas y papeles sensibles"
activity_268000,268000,"Fabricación de soportes ópticos y magnéticos"
activity_271010,271010,"Fabricación de motores, generadores y transformadores eléctricos"
activity_271020,271020,"Fabricación de aparatos de distribución y control de la energía eléctrica"
activity_272000,272000,"Fabricación de acumuladores, pilas y baterías primarias"
activity_273110,273110,"Fabricación de cables de fibra óptica"
activity_273190,273190,"Fabricación de hilos y cables aislados n.c.p."
activity_274000,274000,"Fabricación de lámparas eléctricas y equipo de iluminación"
activity_275010,275010,"Fabricación de cocinas, calefones, estufas y calefactores no eléctricos"
activity_275020,275020,"Fabricación de heladeras, ""freezers"", lavarropas y secarropas"
activity_275091,275091,"Fabricación de ventiladores, extractores de aire, aspiradoras y similares"
activity_275092,275092,"Fabricación de planchas, calefactores, hornos eléctricos, tostadoras y otros aparatos generadores de calor"
activity_275099,275099,"Fabricación de aparatos de uso doméstico n.c.p."
activity_279000,279000,"Fabricación  de equipo eléctrico n.c.p."
activity_281100,281100,"Fabricación  de  motores  y  turbinas,  excepto  motores  para aeronaves, vehículos automotores   y motocicletas"
activity_281201,281201,"Fabricación de bombas"
activity_281301,281301,"Fabricación de compresores, grifos y válvulas"
activity_281400,281400,"Fabricación de cojinetes, engranajes, trenes de engranaje y piezas de transmisión"
activity_281500,281500,"Fabricación de hornos, hogares y quemadores"
activity_281600,281600,"Fabricación de maquinaria y equipo de elevación y manipulación"
