"id","name","code","user_type_id/id","chart_template_id/id","tag_ids/id","reconcile"
"a000","Company creditors, beneficiaries of third party guarantees","000","account.data_account_off_sheet","l10n_be.l10nbe_chart_template","","False"
"a001","Third party guarantees on behalf of the company","001","account.data_account_off_sheet","l10n_be.l10nbe_chart_template","","False"
"a010","Accounts receivable for commitments on bills in circulation","010","account.data_account_off_sheet","l10n_be.l10nbe_chart_template","","False"
"a0110","Creditors of commitments on bills in circulation - Bids ceded by the company under its backing","0110","account.data_account_off_sheet","l10n_be.l10nbe_chart_template","","False"
"a0111","Creditors of commitments on notes in circulation - Other commitments on notes in circulation","0111","account.data_account_off_sheet","l10n_be.l10nbe_chart_template","","False"
"a012","Accounts receivable for other personal guarantees","012","account.data_account_off_sheet","l10n_be.l10nbe_chart_template","","False"
"a013","Creditors of other personal guarantees","013","account.data_account_off_sheet","l10n_be.l10nbe_chart_template","","False"
"a020","Company creditors, beneficiaries of real guarantees","020","account.data_account_off_sheet","l10n_be.l10nbe_chart_template","","False"
"a021","Actual guarantees established for own account","021","account.data_account_off_sheet","l10n_be.l10nbe_chart_template","","False"
"a022","Creditors of third parties, beneficiaries of real guarantees","022","account.data_account_off_sheet","l10n_be.l10nbe_chart_template","","False"
"a023","Real guarantees provided on behalf of third parties","023","account.data_account_off_sheet","l10n_be.l10nbe_chart_template","","False"
"a030","Statutory deposits","030","account.data_account_off_sheet","l10n_be.l10nbe_chart_template","","False"
"a031","Statutory applicants","031","account.data_account_off_sheet","l10n_be.l10nbe_chart_template","","False"
"a032","Guarantees received","032","account.data_account_off_sheet","l10n_be.l10nbe_chart_template","","False"
"a033","Constituents of guarantees","033","account.data_account_off_sheet","l10n_be.l10nbe_chart_template","","False"
"a040","Third parties, holders in their name but at the risks and profits of the business of goods and values","040","account.data_account_off_sheet","l10n_be.l10nbe_chart_template","","False"
"a041","Goods and securities held by third parties on their behalf but at the risk and profit of the company","041","account.data_account_off_sheet","l10n_be.l10nbe_chart_template","","False"
"a050","Acquisition commitments","050","account.data_account_off_sheet","l10n_be.l10nbe_chart_template","","False"
"a051","Creditors of acquisition commitments","051","account.data_account_off_sheet","l10n_be.l10nbe_chart_template","","False"
"a052","Accounts receivable for assignment commitments","052","account.data_account_off_sheet","l10n_be.l10nbe_chart_template","","False"
"a053","Sale commitment","053","account.data_account_off_sheet","l10n_be.l10nbe_chart_template","","False"
"a060","Forward transactions - Goods purchased (to be received)","060","account.data_account_off_sheet","l10n_be.l10nbe_chart_template","","False"
"a061","Creditors for goods purchased at term","061","account.data_account_off_sheet","l10n_be.l10nbe_chart_template","","False"
"a062","Accounts receivable for goods sold forward","062","account.data_account_off_sheet","l10n_be.l10nbe_chart_template","","False"
"a063","Forward transactions - Goods sold (to be delivered)","063","account.data_account_off_sheet","l10n_be.l10nbe_chart_template","","False"
"a064","Forward transactions - Currencies purchased (to be received)","064","account.data_account_off_sheet","l10n_be.l10nbe_chart_template","","False"
"a065","Creditors for forward currency purchases","065","account.data_account_off_sheet","l10n_be.l10nbe_chart_template","","False"
"a066","Accounts receivable for currencies sold forward","066","account.data_account_off_sheet","l10n_be.l10nbe_chart_template","","False"
"a067","Forward transactions - Currencies sold (to be delivered)","067","account.data_account_off_sheet","l10n_be.l10nbe_chart_template","","False"
"a0700","Long-term usage rights - On land and buildings","0700","account.data_account_off_sheet","l10n_be.l10nbe_chart_template","","False"
"a0701","Long-term usage rights - On installations, machines and tools","0701","account.data_account_off_sheet","l10n_be.l10nbe_chart_template","","False"
"a0702","Long-term usage rights - On furniture and rolling stock","0702","account.data_account_off_sheet","l10n_be.l10nbe_chart_template","","False"
"a071","Rent and royalty creditors","071","account.data_account_off_sheet","l10n_be.l10nbe_chart_template","","False"
"a072","Goods and values ​​from third parties received on deposit, consignment or custom","072","account.data_account_off_sheet","l10n_be.l10nbe_chart_template","","False"
"a073","Principals and depositors of goods and securities","073","account.data_account_off_sheet","l10n_be.l10nbe_chart_template","","False"
"a074","Goods and securities held for accounts or at the risk and profit of third parties","074","account.data_account_off_sheet","l10n_be.l10nbe_chart_template","","False"
"a075","Creditors of property and securities held on behalf of third parties or at their risk and profit","075","account.data_account_off_sheet","l10n_be.l10nbe_chart_template","","False"
"a090","Concordat resolution commitments","090","account.data_account_off_sheet","l10n_be.l10nbe_chart_template","","False"
"a091","Concordat resolution claims","091","account.data_account_off_sheet","l10n_be.l10nbe_chart_template","","False"
"a092","Creditors under debt restructuring conditions","092","account.data_account_off_sheet","l10n_be.l10nbe_chart_template","","False"
"a093","Duties on loan conditions","093","account.data_account_off_sheet","l10n_be.l10nbe_chart_template","","False"
"a094","Ongoing litigation","094","account.data_account_off_sheet","l10n_be.l10nbe_chart_template","","False"
"a095","Creditors of pending litigation","095","account.data_account_off_sheet","l10n_be.l10nbe_chart_template","","False"
"a096","Debtors on technical guarantees","096","account.data_account_off_sheet","l10n_be.l10nbe_chart_template","","False"
"a097","Rights on technical guarantees","097","account.data_account_off_sheet","l10n_be.l10nbe_chart_template","","False"
"a098","Holders of options (buying or selling securities)","098","account.data_account_off_sheet","l10n_be.l10nbe_chart_template","","False"
"a099","Options (buy or sell) on securities issued.","099","account.data_account_off_sheet","l10n_be.l10nbe_chart_template","","False"
"a100","Issued capital","100","account.data_account_type_equity","l10n_be.l10nbe_chart_template","","False"
"a101","Uncalled capital","101","account.data_account_type_equity","l10n_be.l10nbe_chart_template","","False"
"a11","Share premium account","11","account.data_account_type_equity","l10n_be.l10nbe_chart_template","","False"
"a120","Revaluation surpluses on intangible fixed assets","120","account.data_account_type_equity","l10n_be.l10nbe_chart_template","","False"
"a121","Revaluation surpluses on tangible fixed assets","121","account.data_account_type_equity","l10n_be.l10nbe_chart_template","","False"
"a122","Revaluation surpluses on financial fixed assets","122","account.data_account_type_equity","l10n_be.l10nbe_chart_template","","False"
"a123","Revaluation surpluses on stocks","123","account.data_account_type_equity","l10n_be.l10nbe_chart_template","","False"
"a124","Decrease in amounts written down current investments","124","account.data_account_type_equity","l10n_be.l10nbe_chart_template","","False"
"a130","Legal reserve","130","account.data_account_type_equity","l10n_be.l10nbe_chart_template","","False"
"a1310","Reserves not available in respect of own shares held","1310","account.data_account_type_equity","l10n_be.l10nbe_chart_template","","False"
"a1311","Other reserves not available","1311","account.data_account_type_equity","l10n_be.l10nbe_chart_template","","False"
"a132","Untaxed reserves","132","account.data_account_type_equity","l10n_be.l10nbe_chart_template","","False"
"a133","Available reserves","133","account.data_account_type_equity","l10n_be.l10nbe_chart_template","","False"
"a15","Investment grants","15","account.data_account_type_equity","l10n_be.l10nbe_chart_template","","False"
"a151","Investment grants received in cash","151","account.data_account_type_equity","l10n_be.l10nbe_chart_template","","False"
"a152","Investment grants received in kind","152","account.data_account_type_equity","l10n_be.l10nbe_chart_template","","False"
"a160","Provisions for pensions and similar obligations","160","account.data_account_type_non_current_liabilities","l10n_be.l10nbe_chart_template","","False"
"a161","Provisions for taxation","161","account.data_account_type_non_current_liabilities","l10n_be.l10nbe_chart_template","","False"
"a162","Provisions for major repairs and maintenance","162","account.data_account_type_non_current_liabilities","l10n_be.l10nbe_chart_template","","False"
"a163","Provisions for environmental obligations","163","account.data_account_type_non_current_liabilities","l10n_be.l10nbe_chart_template","","False"
"a1680","Deferred taxes on investment grants","1680","account.data_account_type_non_current_liabilities","l10n_be.l10nbe_chart_template","","False"
"a1681","Deferred taxes on gain on disposal of intangible fixed assets","1681","account.data_account_type_non_current_liabilities","l10n_be.l10nbe_chart_template","","False"
"a1682","Deferred taxes on gain on disposal of tangible fixed assets","1682","account.data_account_type_non_current_liabilities","l10n_be.l10nbe_chart_template","","False"
"a1687","Deferred taxes on gain on disposal of securities issued by Belgian public authorities","1687","account.data_account_type_non_current_liabilities","l10n_be.l10nbe_chart_template","","False"
"a1688","Foreign deferred taxes","1688","account.data_account_type_non_current_liabilities","l10n_be.l10nbe_chart_template","","False"
"a1700","Subordinated loans with a remaining term of more than one year - Convertible bonds","1700","account.data_account_type_non_current_liabilities","l10n_be.l10nbe_chart_template","","False"
"a1701","Subordinated loans with a remaining term of more than one year - Non convertible bonds","1701","account.data_account_type_non_current_liabilities","l10n_be.l10nbe_chart_template","","False"
"a1710","Unsubordinated debentures with a remaining term of more than one year - Convertible bonds","1710","account.data_account_type_non_current_liabilities","l10n_be.l10nbe_chart_template","","False"
"a1711","Unsubordinated debentures with a remaining term of more than one year - Non convertible bonds","1711","account.data_account_type_non_current_liabilities","l10n_be.l10nbe_chart_template","","False"
"a1730","Amounts payable to credit institutions with a remaining term of more than one year - Current account payable","1730","account.data_account_type_non_current_liabilities","l10n_be.l10nbe_chart_template","","False"
"a1731","Amounts payable to credit institutions with a remaining term of more than one year - Promissory notes","1731","account.data_account_type_non_current_liabilities","l10n_be.l10nbe_chart_template","","False"
"a1732","Amounts payable to credit institutions with a remaining term of more than one year - Bank acceptances","1732","account.data_account_type_non_current_liabilities","l10n_be.l10nbe_chart_template","","False"
"a174","Other loans with a remaining term of more than one year","174","account.data_account_type_non_current_liabilities","l10n_be.l10nbe_chart_template","","False"
"a1750","Suppliers (more than one year)","1750","account.data_account_type_non_current_liabilities","l10n_be.l10nbe_chart_template","","False"
"a1751","Bills of exchange payable after more than one year","1751","account.data_account_type_non_current_liabilities","l10n_be.l10nbe_chart_template","","False"
"a176","Advances received on contracts in progress (more than one year)","176","account.data_account_type_non_current_liabilities","l10n_be.l10nbe_chart_template","","False"
"a178","Amounts payable with a remaining term of more than one year - Guarantees received in cash","178","account.data_account_type_non_current_liabilities","l10n_be.l10nbe_chart_template","","False"
"a1790","Miscellaneous amounts payable with a remaining term of more than one year - Interest-bearing","1790","account.data_account_type_non_current_liabilities","l10n_be.l10nbe_chart_template","","False"
"a1791","Miscellaneous amounts payable with a remaining term of more than one year - Non interest-bearing or with an abnormally low interest rate","1791","account.data_account_type_non_current_liabilities","l10n_be.l10nbe_chart_template","","False"
"a1792","Miscellaneous amounts payable with a remaining term of more than one year - Cash Deposit","1792","account.data_account_type_non_current_liabilities","l10n_be.l10nbe_chart_template","","False"
"a19","Advance to associates on the sharing out of the assets","19","account.data_account_type_non_current_liabilities","l10n_be.l10nbe_chart_template","","False"
"a200","Formation or capital increase expenses","200","account.data_account_type_non_current_assets","l10n_be.l10nbe_chart_template","","False"
"a201","Loan issue expenses","201","account.data_account_type_non_current_assets","l10n_be.l10nbe_chart_template","","False"
"a202","Other formation expenses","202","account.data_account_type_non_current_assets","l10n_be.l10nbe_chart_template","","False"
"a204","Restructuring costs","204","account.data_account_type_non_current_assets","l10n_be.l10nbe_chart_template","","False"
"a210","Research and development costs","210","account.data_account_type_non_current_assets","l10n_be.l10nbe_chart_template","","False"
"a211","Concessions, patents, licences, know-how, brands and similar rights","211","account.data_account_type_non_current_assets","l10n_be.l10nbe_chart_template","","False"
"a212","Goodwill","212","account.data_account_type_non_current_assets","l10n_be.l10nbe_chart_template","","False"
"a213","Intangible fixed assets - Advance payments","213","account.data_account_type_non_current_assets","l10n_be.l10nbe_chart_template","","False"
"a220","Land","220","account.data_account_type_non_current_assets","l10n_be.l10nbe_chart_template","","False"
"a2201","Land owned by the association or the foundation in full property","2201","account.data_account_type_non_current_assets","l10n_be.l10nbe_chart_template","","False"
"a2202","Other land","2202","account.data_account_type_non_current_assets","l10n_be.l10nbe_chart_template","","False"
"a221","Buildings","221","account.data_account_type_non_current_assets","l10n_be.l10nbe_chart_template","","False"
"a2211","Building owned by the association or the foundation in full property","2211","account.data_account_type_non_current_assets","l10n_be.l10nbe_chart_template","","False"
"a2212","Other building","2212","account.data_account_type_non_current_assets","l10n_be.l10nbe_chart_template","","False"
"a222","Developed land","222","account.data_account_type_non_current_assets","l10n_be.l10nbe_chart_template","","False"
"a2221","Built-up lands owned by the association or the foundation in full property","2221","account.data_account_type_non_current_assets","l10n_be.l10nbe_chart_template","","False"
"a2222","Other built-up lands","2222","account.data_account_type_non_current_assets","l10n_be.l10nbe_chart_template","","False"
"a223","Other rights to immovable property","223","account.data_account_type_non_current_assets","l10n_be.l10nbe_chart_template","","False"
"a2231","Other rights to immovable property belonging to the association or the foundation in full property","2231","account.data_account_type_non_current_assets","l10n_be.l10nbe_chart_template","","False"
"a2232","Other rights to immovable property - Other","2232","account.data_account_type_non_current_assets","l10n_be.l10nbe_chart_template","","False"
"a23","Plant, machinery and equipment","23","account.data_account_type_non_current_assets","l10n_be.l10nbe_chart_template","","False"
"a231","Plant, machinery and equipment owned by the association or the foundation in full property","231","account.data_account_type_non_current_assets","l10n_be.l10nbe_chart_template","","False"
"a232","Other plant, machinery and equipment","232","account.data_account_type_non_current_assets","l10n_be.l10nbe_chart_template","","False"
"a24","Furniture and vehicles","24","account.data_account_type_non_current_assets","l10n_be.l10nbe_chart_template","","False"
"a241","Furniture and vehicles owned by the association or the foundation in full property","241","account.data_account_type_non_current_assets","l10n_be.l10nbe_chart_template","","False"
"a242","Other furniture and vehicles","242","account.data_account_type_non_current_assets","l10n_be.l10nbe_chart_template","","False"
"a250","Leasing and similar rights - Land and buildings","250","account.data_account_type_non_current_assets","l10n_be.l10nbe_chart_template","","False"
"a251","Leasing and similar rights - Plant, machinery and equipment","251","account.data_account_type_non_current_assets","l10n_be.l10nbe_chart_template","","False"
"a252","Leasing and similar rights - Furniture and vehicles","252","account.data_account_type_non_current_assets","l10n_be.l10nbe_chart_template","","False"
"a26","Other tangible fixed assets","26","account.data_account_type_non_current_assets","l10n_be.l10nbe_chart_template","","False"
"a261","Other tangible fixed assets owned by the association or the foundation in full property","261","account.data_account_type_non_current_assets","l10n_be.l10nbe_chart_template","","False"
"a262","Other tangible fixed assets - Other","262","account.data_account_type_non_current_assets","l10n_be.l10nbe_chart_template","","False"
"a27","Tangible fixed assets under construction and advance payments","27","account.data_account_type_non_current_assets","l10n_be.l10nbe_chart_template","","False"
"a2800","Participating interests and shares in associated enterprises - Acquisition value","2800","account.data_account_type_fixed_assets","l10n_be.l10nbe_chart_template","","False"
"a2801","Participating interests and shares in associated enterprises - Uncalled amounts","2801","account.data_account_type_fixed_assets","l10n_be.l10nbe_chart_template","","False"
"a2808","Participating interests and shares in associated enterprises - Revaluation surpluses","2808","account.data_account_type_fixed_assets","l10n_be.l10nbe_chart_template","","False"
"a2809","Participating interests and shares in associated enterprises - Amounts written down","2809","account.data_account_type_fixed_assets","l10n_be.l10nbe_chart_template","","False"
"a2810","Amounts receivable from affiliated enterprises - Current account","2810","account.data_account_type_fixed_assets","l10n_be.l10nbe_chart_template","","False"
"a2811","Amounts receivable from affiliated enterprises - Bills receivable","2811","account.data_account_type_fixed_assets","l10n_be.l10nbe_chart_template","","False"
"a2812","Amounts receivable from affiliated enterprises - Fixed income securities","2812","account.data_account_type_fixed_assets","l10n_be.l10nbe_chart_template","","False"
"a2817","Other amounts receivable from affiliated enterprises - Doubtful amounts","2817","account.data_account_type_fixed_assets","l10n_be.l10nbe_chart_template","","False"
"a2819","Amounts receivable from affiliated enterprises - Amounts written down","2819","account.data_account_type_fixed_assets","l10n_be.l10nbe_chart_template","","False"
"a2820","Participating interests and shares in enterprises linked by a participating interest - Acquisition value","2820","account.data_account_type_fixed_assets","l10n_be.l10nbe_chart_template","","False"
"a2821","Participating interests and shares in enterprises linked by a participating interest - Uncalled amounts","2821","account.data_account_type_fixed_assets","l10n_be.l10nbe_chart_template","","False"
"a2828","Participating interests and shares in enterprises linked by a participating interest - Revaluation surpluses","2828","account.data_account_type_fixed_assets","l10n_be.l10nbe_chart_template","","False"
"a2829","Participating interests and shares in enterprises linked by a participating interest - Amounts written down","2829","account.data_account_type_fixed_assets","l10n_be.l10nbe_chart_template","","False"
"a2830","Amounts receivable from other enterprises linked by participating interests - Current account","2830","account.data_account_type_fixed_assets","l10n_be.l10nbe_chart_template","","False"
"a2831","Amounts receivable from other enterprises linked by participating interests - Bills receivable","2831","account.data_account_type_fixed_assets","l10n_be.l10nbe_chart_template","","False"
"a2832","Amounts receivable from other enterprises linked by participating interests - Fixed income securities","2832","account.data_account_type_fixed_assets","l10n_be.l10nbe_chart_template","","False"
"a2837","Amounts receivable from other enterprises linked by participating interests - Doubtful amounts","2837","account.data_account_type_fixed_assets","l10n_be.l10nbe_chart_template","","False"
"a2839","Amounts receivable from other enterprises linked by participating interests - Amounts written down","2839","account.data_account_type_fixed_assets","l10n_be.l10nbe_chart_template","","False"
"a2840","Other participating interests and shares - Acquisition value","2840","account.data_account_type_fixed_assets","l10n_be.l10nbe_chart_template","","False"
"a2841","Other participating interests and shares - Uncalled amounts","2841","account.data_account_type_fixed_assets","l10n_be.l10nbe_chart_template","","False"
"a2848","Other participating interests and shares - Revaluation surpluses","2848","account.data_account_type_fixed_assets","l10n_be.l10nbe_chart_template","","False"
"a2849","Other participating interests and shares - Amounts written down","2849","account.data_account_type_fixed_assets","l10n_be.l10nbe_chart_template","","False"
"a2850","Other financial assets - Current account","2850","account.data_account_type_fixed_assets","l10n_be.l10nbe_chart_template","","False"
"a2851","Other financial assets - Bills receivable","2851","account.data_account_type_fixed_assets","l10n_be.l10nbe_chart_template","","False"
"a2852","Other financial assets - Fixed income securities","2852","account.data_account_type_fixed_assets","l10n_be.l10nbe_chart_template","","False"
"a2857","Other financial assets - Doubtful amounts","2857","account.data_account_type_fixed_assets","l10n_be.l10nbe_chart_template","","False"
"a2859","Other financial assets - Amounts written down","2859","account.data_account_type_fixed_assets","l10n_be.l10nbe_chart_template","","False"
"a288","Other financial assets - Cash Guarantees","288","account.data_account_type_fixed_assets","l10n_be.l10nbe_chart_template","","False"
"a2900","Trade debtors after more than one year - Customer","2900","account.data_account_type_fixed_assets","l10n_be.l10nbe_chart_template","","False"
"a2901","Trade debtors after more than one year - Bills receivable","2901","account.data_account_type_fixed_assets","l10n_be.l10nbe_chart_template","","False"
"a2906","Trade debtors after more than one year - Advance payments","2906","account.data_account_type_fixed_assets","l10n_be.l10nbe_chart_template","","False"
"a2907","Trade debtors after more than one year - Doubtful amounts","2907","account.data_account_type_fixed_assets","l10n_be.l10nbe_chart_template","","False"
"a2909","Trade debtors after more than one year - Amounts written down","2909","account.data_account_type_fixed_assets","l10n_be.l10nbe_chart_template","","False"
"a2910","Other amounts receivable after more than one year - Current account","2910","account.data_account_type_fixed_assets","l10n_be.l10nbe_chart_template","","False"
"a2911","Other amounts receivable after more than one year - Bills receivable","2911","account.data_account_type_fixed_assets","l10n_be.l10nbe_chart_template","","False"
"a2915","Non interest-bearing amounts receivable after more than one year or with an abnormally low interest rate","2915","account.data_account_type_fixed_assets","l10n_be.l10nbe_chart_template","","False"
"a2917","Other amounts receivable after more than one year - Doubtful amounts","2917","account.data_account_type_fixed_assets","l10n_be.l10nbe_chart_template","","False"
"a2919","Other amounts receivable after more than one year - Amounts written down","2919","account.data_account_type_fixed_assets","l10n_be.l10nbe_chart_template","","False"
"a300","Raw materials - Acquisition value","300","account.data_account_type_current_assets","l10n_be.l10nbe_chart_template","","False"
"a309","Raw materials - amounts written down","309","account.data_account_type_current_assets","l10n_be.l10nbe_chart_template","","False"
"a310","Consumables - Acquisition value","310","account.data_account_type_current_assets","l10n_be.l10nbe_chart_template","","False"
"a319","Consumables - amounts written down","319","account.data_account_type_current_assets","l10n_be.l10nbe_chart_template","","False"
"a320","Work in progress - Acquisition value","320","account.data_account_type_current_assets","l10n_be.l10nbe_chart_template","","False"
"a329","Work in progress - amounts written down","329","account.data_account_type_current_assets","l10n_be.l10nbe_chart_template","","False"
"a330","Finished goods - Acquisition value","330","account.data_account_type_current_assets","l10n_be.l10nbe_chart_template","","False"
"a339","Finished goods - amounts written down","339","account.data_account_type_current_assets","l10n_be.l10nbe_chart_template","","False"
"a340","Goods purchased for resale - Acquisition value","340","account.data_account_type_current_assets","l10n_be.l10nbe_chart_template","","False"
