"id","code","name","tag_ids","account_type","description","reconcile","active","depreciation_model_id","non_trade","parent_id","name@ko_KR","description@ko_KR"
"l10n_kr_960000","960000","Impairment Loss on Long-term Inv","account.account_tag_investing","expense_other","Impairment losses recorded when non-current investment values permanently drop.","False","True","","False","","장기투자증권손상차손","시장가치 급락 등으로 인해 장기투자증권의 회수가능액이 장부금액에 미달할 때 인식하는 장기투자증권손상차손입니다."
"l10n_kr_961000","961000","Loss on Disp of Tangible Assets","account.account_tag_investing","expense_other","Losses sustained upon disposing of fixed assets below net book values.","False","True","","False","","유형자산처분손실","토지, 건물, 차량 등 유형자산을 장부금액보다 낮은 가액으로 처분하여 발생한 유형자산처분손실입니다."
"l10n_kr_962000","962000","Loss on Redemption of Bonds","account.account_tag_financing","expense_other","Losses incurred by redeeming issued corporate bonds early.","False","True","","False","","사채상환손실","회사가 발행한 사채를 만기 전에 장부금액보다 높은 상환 할증금액을 주고 조기 상환하여 발생한 사채상환손실입니다."
"l10n_kr_963000","963000","Loss on Prior Period Error Corrections","account.account_tag_operating","expense_other","Losses resulting from correcting accounting errors from prior fiscal years.","False","True","","False","","전기오류수정손실","전기 이전의 회계적 오류를 당기에 발견하여 수정할 때 발생하는 중대하지 않은 전기오류수정손실입니다."
"l10n_kr_964000","964000","Miscellaneous Expense","account.account_tag_operating","expense_other","Miscellaneous minor expenses not classified elsewhere.","False","True","","False","","잡손실","금액이 중요하지 않고 영업활동과 무관하게 발생하는 기타 영업외비용(잡손실)입니다."
"l10n_kr_965000","965000","Cash Difference Loss","account.account_tag_operating","expense_other","Losses established when physical cash on hand falls below recorded ledger balances.","False","True","","False","","현금과부족손실","실제 현금 잔액이 장부금액보다 부족하나 그 원인을 알 수 없어 결산 시 비용으로 대체하는 현금과부족손실입니다."
"l10n_kr_998000","998000","Income Tax Expense","l10n_kr.l10n_kr_account_tag_income_tax_expense","expense_other","Corporate income tax and local income tax expenses recognized for the period.","False","True","","False","","법인세비용","당기 사업연도 과세소득에 대해 부담해야 할 법인세 및 지방소득세 등을 반영한 법인세비용입니다."
