"id","code","name","tag_ids","account_type","description","reconcile","active","depreciation_model_id","non_trade","parent_id","name@ko_KR","description@ko_KR"
"l10n_kr_405000","405000","Sales of Scrap","account.account_tag_operating","income","Revenue from selling scrap or physical production waste.","False","True","","False","","작업폐물매출액","생산 공정에서 발생하는 작업폐물 및 스크랩을 판매하여 발생한 매출액입니다."
"l10n_kr_406000","406000","Export Sales","account.account_tag_operating","income","Revenue realized through foreign export transactions.","False","True","","False","","수출액","국외 거래처로 재화를 직접 수출하여 발생한 매출액입니다."
"l10n_kr_407000","407000","Long-term Installment Sales","account.account_tag_operating","income","Revenue recognized via long-term installment commercial contracts.","False","True","","False","","장기할부매출액","대금을 1년 이상에 걸쳐 분할 회수하는 장기할부 조건으로 판매한 매출액입니다."
"l10n_kr_411000","411000","Service Revenue","account.account_tag_operating","income","Revenue derived from providing contract services, technical labor, or consulting.","False","True","","False","","서비스매출","용역 제공, 기술 자문 등 서비스를 제공하여 발생한 서비스 매출액입니다."
"l10n_kr_451000","451000","Cost of Merchandise Sold","account.account_tag_operating","expense_direct_cost","Cost value of trading merchandise units sold.","False","True","","False","","상품매출원가","당기 중 판매된 상품의 매입원가(기초상품재고액 + 당기상품매입액 - 기말상품재고액)입니다."
"l10n_kr_452000","452000","Cost of Finished Goods Sold","account.account_tag_operating","expense_direct_cost","Cost value of manufactured finished products sold.","False","True","","False","","제품매출원가","당기 중 판매된 자가 제조 제품의 제조원가(기초제품재고액 + 당기제품제조원가 - 기말제품재고액)입니다."
"l10n_kr_453000","453000","Cost of Semi-finished Goods Sold","account.account_tag_operating","expense_direct_cost","Cost value of semi-finished goods sold.","False","True","","False","","반제품매출원가","당기 중 외부로 직접 판매된 반제품의 가공 원가입니다."
"l10n_kr_501000","501000","Raw Material Purchases","account.account_tag_operating","expense_direct_cost","Purchase costs of raw materials consumed in production.","False","True","","False","","원재료비","당기 제품 생산을 위해 공정에 투입되어 소비된 원재료비입니다."
"l10n_kr_502000","502000","Direct Labor (Wages)","account.account_tag_operating","expense_direct_cost","Wages and salaries paid to direct factory production workers.","False","True","","False","","임금","공장 생산직 근로자에게 지급되는 임금 및 제수당 등 직접 노무비입니다."
"l10n_kr_503000","503000","Severance Pay (Mfg)","account.account_tag_operating","expense_direct_cost","Severance and retirement benefits accrued for factory personnel.","False","True","","False","","퇴직급여(제조)","공장 생산직 근로자에게 지급하는 퇴직금 또는 퇴직급여충당부채 전입액입니다."
"l10n_kr_504000","504000","Employee Benefits (Mfg)","account.account_tag_operating","expense_direct_cost","Welfare, health insurance, and meals expenses for factory workers.","False","True","","False","","복리후생비(제조)","공장 직원들의 식대, 4대보험 회사부담금 등 복리후생비(제조원가)입니다."
"l10n_kr_505000","505000","Utilities (Mfg)","account.account_tag_operating","expense_direct_cost","Electricity, gas, and water supply expenses consumed by the factory.","False","True","","False","","수도광열비(제조)","공장 가동을 위해 소비된 산업용 전력, 가스, 수도 요금(제조원가)입니다."
"l10n_kr_506000","506000","Taxes and Dues (Mfg)","account.account_tag_operating","expense_direct_cost","Property taxes, vehicle taxes, and association dues related to the factory.","False","True","","False","","세금과공과(제조)","공장 부지 재산세, 생산용 차량 자동차세 등 공장과 관련된 세금과공과(제조원가)입니다."
"l10n_kr_507000","507000","Rent (Mfg)","account.account_tag_operating","expense_direct_cost","Rental and lease expenses for factory buildings or production machinery.","False","True","","False","","임차료(제조)","공장 건물, 부지 또는 생산 기계장치 임차에 따른 임차료(제조원가)입니다."
"l10n_kr_508000","508000","Maintenance (Mfg)","account.account_tag_operating","expense_direct_cost","Maintenance and repair costs for factory machinery and buildings.","False","True","","False","","수선비(제조)","공장 건물이나 생산용 기계장치 등의 유지 보수를 위해 지출한 수선비(제조원가)입니다."
"l10n_kr_509000","509000","Consumables (Mfg)","account.account_tag_operating","expense_direct_cost","Consumable tools and supplies used during factory operations.","False","True","","False","","소모품비(제조)","공장 생산 라인에서 소비되는 소모성 기구, 부품 및 소모품비(제조원가)입니다."
"l10n_kr_510000","510000","Outsourced Processing Costs","account.account_tag_operating","expense_direct_cost","Processing fees paid to external subcontractors for manufacturing.","False","True","","False","","외주가공비","제품 가공 및 제조의 일부 공정을 외부 업체에 위탁하여 발생하는 외주가공비(제조원가)입니다."
"l10n_kr_515000","515000","Manufacturing Cost Absorption","account.account_tag_operating","expense_direct_cost","Contra account used to absorb direct and overhead manufacturing costs into work in process.","False","True","","False","","제조원가배부차감","결산 시 당기 발생 제조원가를 재공품 계정으로 대체(흡수)하기 위한 상계용 차감 계정입니다."
"l10n_kr_520000","520000","Depreciation Exp - Buildings (Mfg)","account.account_tag_operating","expense_direct_cost","Depreciation expenses allocated to factory buildings.","False","True","","False","","감가상각비-건물(제조)","제품 생산에 사용되는 공장 건물의 당기 감가상각비(제조원가)입니다."
"l10n_kr_521000","521000","Depreciation Exp - Structures (Mfg)","account.account_tag_operating","expense_direct_cost","Depreciation expenses allocated to factory structures.","False","True","","False","","감가상각비-구축물(제조)","공장 부지 내 구축물의 당기 감가상각비(제조원가)입니다."
"l10n_kr_522000","522000","Depreciation Exp - Machinery (Mfg)","account.account_tag_operating","expense_direct_cost","Depreciation expenses allocated to production machinery.","False","True","","False","","감가상각비-기계장치(제조)","생산용 기계장치 및 자동화 설비의 당기 감가상각비(제조원가)입니다."
"l10n_kr_523000","523000","Depreciation Exp - Vehicles (Mfg)","account.account_tag_operating","expense_direct_cost","Depreciation expenses allocated to factory logistics vehicles.","False","True","","False","","감가상각비-차량운반구(제조)","공장 내 화물차, 지게차 등 차량운반구의 당기 감가상각비(제조원가)입니다."
"l10n_kr_524000","524000","Depreciation Exp - Fixtures (Mfg)","account.account_tag_operating","expense_direct_cost","Depreciation expenses allocated to factory-level fixtures.","False","True","","False","","감가상각비-비품(제조)","공장 작업실에서 사용하는 집기비품의 당기 감가상각비(제조원가)입니다."
"l10n_kr_525000","525000","Depreciation Exp - Equipment (Mfg)","account.account_tag_operating","expense_direct_cost","Depreciation expenses allocated to factory utility equipment.","False","True","","False","","감가상각비-설비자산(제조)","공장 동력 설비 등 기타 설비자산의 당기 감가상각비(제조원가)입니다."
"l10n_kr_801000","801000","Salaries","account.account_tag_operating","expense","Salaries, bonuses, and allowances paid to office and administrative staff.","False","True","","False","","급여","본사 임직원 및 일반 관리·영업 직원에게 지급하는 급여, 상여금 및 제수당입니다."
"l10n_kr_802000","802000","Severance Pay","account.account_tag_operating","expense","Severance and retirement expenses accrued for office staff.","False","True","","False","","퇴직급여","본사 임직원에게 지급하는 퇴직금 또는 당기 퇴직급여충당부채 전입액입니다."
"l10n_kr_803000","803000","Employee Benefits","account.account_tag_operating","expense","Welfare, health insurance, and meals for office employees.","False","True","","False","","복리후생비","본사 직원의 식대, 경조사비, 4대보험 회사부담금 등 판매비와관리비에 속하는 복리후생비입니다."
"l10n_kr_804000","804000","Rent","account.account_tag_operating","expense","Rental payments for corporate offices and sales facilities.","False","True","","False","","임차료","본사 사무실, 영업 지점 매장 등의 부동산 임차에 따른 임차료입니다."
"l10n_kr_805000","805000","Entertainment","account.account_tag_operating","expense","Expenses incurred for client relationships and business entertainment.","False","True","","False","","접대비","거래처와의 영업 관계 유지를 위해 지출한 교제비, 식사비, 선물 구입비 등 접대비입니다."
"l10n_kr_806000","806000","Taxes and Dues","account.account_tag_operating","expense","Corporate dues, vehicle taxes, and municipal taxes for office operations.","False","True","","False","","세금과공과","본사 사무실 및 영업과 관련하여 발생하는 재산세, 자동차세, 상공회의소 회비 등 세금과공과입니다."
"l10n_kr_807000","807000","Advertising Expenses","account.account_tag_operating","expense","Marketing, media advertising, and promotional campaign expenses.","False","True","","False","","광고선전비","제품 홍보 및 판촉을 위해 지출한 미디어 광고, 판촉물 제작 등 광고선전비입니다."
"l10n_kr_808000","808000","Research Expenses","account.account_tag_operating","expense","Expenses incurred during the initial research phase for new products.","False","True","","False","","연구비","신제품 및 신기술 개발 이전의 탐색 및 연구 단계에서 발생한 연구비(비용)입니다."
"l10n_kr_809000","809000","Ordinary Development Expenses","account.account_tag_operating","expense","Routine development costs that do not meet capitalization criteria.","False","True","","False","","경상개발비","제품 개선 등 개발 활동에서 발생했으나 무형자산(개발비) 인식 요건을 충족하지 못한 경상개발비입니다."
"l10n_kr_810000","810000","Bad Debt Expense","account.account_tag_operating","expense","Expenses recognized for uncollectible trade accounts or notes receivable.","False","True","","False","","대손상각비","주된 영업활동에서 발생한 매출채권 중 회수가 불가능해진 금액을 비용 처리하는 대손상각비입니다."
"l10n_kr_811000","811000","Travel Expenses","account.account_tag_operating","expense","Business travel accommodations, transport fares, and local commuting costs.","False","True","","False","","여비교통비","임직원의 국내외 출장 여비, 숙박비, 항공료 및 시내 교통비 등 여비교통비입니다."
"l10n_kr_812000","812000","Communication Expenses","account.account_tag_operating","expense","Corporate phone bills, internet networks, and postal delivery fees.","False","True","","False","","통신비","본사 전화요금, 인터넷 회선료, 우편 및 택배 발송 비용 등 통신비입니다."
"l10n_kr_813000","813000","Utilities","account.account_tag_operating","expense","Electricity, gas, and water supply expenses for corporate offices.","False","True","","False","","수도광열비","본사 및 영업 사무실 운영에 소요되는 전력, 가스, 수도 및 냉난방 요금인 수도광열비입니다."
"l10n_kr_814000","814000","Insurance","account.account_tag_operating","expense","Insurance premiums covering corporate assets, fire risks, and liabilities.","False","True","","False","","보험료","본사 건물 화재보험, 업무용 차량 자동차보험 및 책임보험 등 보험료입니다."
"l10n_kr_815000","815000","Vehicle Maintenance","account.account_tag_operating","expense","Fuel costs, repairs, tolls, and maintenance fees for corporate cars.","False","True","","False","","차량유지비","업무용 승용차의 유류비, 수리비, 주차료 및 통행료 등 차량유지비입니다."
"l10n_kr_816000","816000","Books and Printing","account.account_tag_operating","expense","Books, newspaper subscriptions, and office printing supplies.","False","True","","False","","도서인쇄비","도서 구입, 신문 구독, 각종 인쇄 대금 및 복사기 관련 비용 등 도서인쇄비입니다."
"l10n_kr_817000","817000","Education and Training","account.account_tag_operating","expense","External training seminars, educational materials, and tuition support.","False","True","","False","","교육훈련비","임직원의 직무 능력 향상을 위한 사내외 위탁 교육비, 세미나 참가비 등 교육훈련비입니다."
"l10n_kr_818000","818000","Consumables","account.account_tag_operating","expense","General office stationery, ink cartridges, and small low-value supplies.","False","True","","False","","소모품비","사무용 문구류, 잉크 카트리지 및 취득가액이 낮은 소모품 구입 비용입니다."
"l10n_kr_819000","819000","Commissions","account.account_tag_operating","expense","Fees paid for outsourced professional services like accounting and legal counsel.","False","True","","False","","지급수수료","세무대리, 법률 자문, 경영 컨설팅 등 외부 전문가에게 지급하는 지급수수료입니다."
"l10n_kr_820000","820000","Depreciation Exp - Buildings","account.account_tag_operating","expense_depreciation","Depreciation expenses allocated to office buildings.","False","True","","False","","감가상각비-건물","본사 및 영업용으로 사용하는 건물의 당기 감가상각비입니다."
"l10n_kr_821000","821000","Depreciation Exp - Structures","account.account_tag_operating","expense_depreciation","Depreciation expenses allocated to non-factory physical structures.","False","True","","False","","감가상각비-구축물","본사 부지 내 주차장 설비, 담장 등 영업용 구축물의 당기 감가상각비입니다."
"l10n_kr_822000","822000","Depreciation Exp - Machinery","account.account_tag_operating","expense_depreciation","Depreciation expenses allocated to office or non-production machinery.","False","True","","False","","감가상각비-기계장치","비생산 영업용 기계장치의 당기 감가상각비입니다."
"l10n_kr_823000","823000","Depreciation Exp - Vehicles","account.account_tag_operating","expense_depreciation","Depreciation expenses allocated to executive and sales staff cars.","False","True","","False","","감가상각비-차량운반구","본사 업무용 승용차 및 영업용 차량운반구의 당기 감가상각비입니다."
"l10n_kr_824000","824000","Depreciation Exp - Fixtures","account.account_tag_operating","expense_depreciation","Depreciation expenses allocated to office furniture and computers.","False","True","","False","","감가상각비-비품","본사 사무실용 책상, 의자, 컴퓨터 등 영업용 비품의 당기 감가상각비입니다."
"l10n_kr_825000","825000","Depreciation Exp - Equipment","account.account_tag_operating","expense_depreciation","Depreciation expenses allocated to general corporate operations equipment.","False","True","","False","","감가상각비-설비자산","본사 및 영업 지원 목적의 기타 설비자산 당기 감가상각비입니다."
"l10n_kr_826000","826000","Amortization of Goodwill","account.account_tag_operating","expense_depreciation","Amortization expense recognized for capitalized goodwill.","False","True","","False","","영업권상각비","영업권에 대하여 당기에 인식한 무형자산상각비입니다."
"l10n_kr_826100","826100","Amortization of Patents","account.account_tag_operating","expense_depreciation","Amortization expense recognized for capitalized patents.","False","True","","False","","산업재산권상각비","특허권 등 산업재산권에 대하여 당기에 인식한 무형자산상각비입니다."
"l10n_kr_826200","826200","Amortization of Development Costs","account.account_tag_operating","expense_depreciation","Amortization expense recognized for capitalized development costs.","False","True","","False","","개발비상각비","자본화된 개발비에 대하여 당기에 인식한 무형자산상각비입니다."
"l10n_kr_826300","826300","Amortization of Software","account.account_tag_operating","expense_depreciation","Amortization expense recognized for capitalized software.","False","True","","False","","소프트웨어상각비","자본화된 소프트웨어에 대하여 당기에 인식한 무형자산상각비입니다."
"l10n_kr_901000","901000","Interest Income","account.account_tag_operating","income_other","Interest earned from bank deposits, loans, or debt instruments.","False","True","","False","","이자수익","보통예금, 단기금융상품, 대여금 등으로부터 발생한 이자수익입니다."
"l10n_kr_902000","902000","Dividend Income","account.account_tag_operating","income_other","Dividends received from stock investments in other entities.","False","True","","False","","배당금수익","타 회사의 주식 등 지분증권에 투자하여 수취한 배당금수익입니다."
"l10n_kr_903000","903000","Rental Income","account.account_tag_operating","income_other","Rental revenues collected from leasing out unused properties.","False","True","","False","","임대료","영업활동 외의 목적으로 보유 중인 부동산 등을 타인에게 임대하여 수취한 임대료 수익입니다."
"l10n_kr_904000","904000","Gain on Disp of Short-term Investments","account.account_tag_investing","income_other","Profits realized upon disposing of short-term financial instruments.","False","True","","False","","단기투자자산처분이익","단기매매증권 등 단기투자자산을 장부금액보다 높은 가액으로 처분하여 발생한 단기투자자산처분이익입니다."
"l10n_kr_905000","905000","Gain on Val of Short-term Investments","account.account_tag_investing","income_other","Unrealized evaluation gains on short-term marketable securities.","False","True","","False","","단기투자자산평가이익","기말에 단기매매증권 등 단기투자자산을 공정가치로 평가하여 발생한 미실현 단기투자자산평가이익입니다."
"l10n_kr_906000","906000","Gain on Foreign Exchange","account.account_tag_operating","income_other","Realized gains arising from the settlement of foreign currency transactions.","False","True","","False","","외환차익","외화 채권 회수나 채무 상환 시 결제 환율의 차이로 인해 실제로 발생한 외환차익입니다."
"l10n_kr_907000","907000","Gain on Foreign Currency Translation","account.account_tag_operating","income_other","Unrealized translation gains computed over foreign currency items at closing.","False","True","","False","","외화환산이익","기말 결산 시 환율 변동에 따라 외화 자산 및 부채를 원화로 환산할 때 발생하는 외화환산이익입니다."
"l10n_kr_908000","908000","Equity in Earnings of Affiliates","account.account_tag_investing","income_other","Net income share attributed from equity-method investee companies.","False","True","","False","","지분법이익","지분법을 적용하는 피투자회사가 당기순이익을 기록함에 따라 회사의 지분율만큼 인식하는 지분법이익입니다."
"l10n_kr_909000","909000","Reversal of Impairment on Long-term Inv","account.account_tag_investing","income_other","Reversals of historical impairment losses recorded on non-current investments.","False","True","","False","","장기투자증권손상차손환입","과거 손상차손을 인식했던 장기투자증권의 회수가능액이 회복되어 당기 수익으로 환입하는 금액입니다."
"l10n_kr_910000","910000","Gain on Disp of Tangible Assets","account.account_tag_investing","income_other","Profits captured upon selling tangible fixed assets.","False","True","","False","","유형자산처분이익","토지, 건물, 기계 등 유형자산을 장부금액보다 높은 가액으로 처분하여 발생한 유형자산처분이익입니다."
"l10n_kr_911000","911000","Gain on Redemption of Bonds","account.account_tag_financing","income_other","Gains achieved by redeeming corporate bonds prior to maturity.","False","True","","False","","사채상환이익","회사가 발행한 사채를 만기 전에 장부금액보다 낮은 가액으로 조기 상환하여 발생한 사채상환이익입니다."
"l10n_kr_912000","912000","Gain on Prior Period Error Corrections","account.account_tag_operating","income_other","Gains resulting from correcting accounting errors from prior fiscal years.","False","True","","False","","전기오류수정이익","전기 이전의 회계적 오류를 당기에 발견하여 수정할 때 발생하는 중대하지 않은 전기오류수정이익입니다."
"l10n_kr_913000","913000","Miscellaneous Income","account.account_tag_operating","income_other","Miscellaneous minor revenues not classified elsewhere.","False","True","","False","","잡이익","금액이 중요하지 않고 다른 계정으로 분류하기 어려운 영업외수익(잡이익)입니다."
"l10n_kr_914000","914000","Cash Difference Gain","account.account_tag_operating","income_other","Gains established when physical cash on hand exceeds recorded ledger balances.","False","True","","False","","현금과부족이익","실제 현금 잔액이 장부금액보다 많으나 그 원인을 알 수 없어 결산 시 수익으로 대체하는 현금과부족이익입니다."
"l10n_kr_951000","951000","Interest Expense","account.account_tag_operating","expense_other","Interest expenses disbursed for bank loans or corporate bonds.","False","True","","False","","이자비용","금융기관 차입금, 사채 발행 등 타인 자본을 사용한 대가로 지급하는 이자비용입니다."
"l10n_kr_952000","952000","Other Bad Debt Expense","account.account_tag_operating","expense_other","Bad debt expenses recognized on non-trade items like non-trade receivables.","False","True","","False","","기타의대손상각비","미수금, 대여금 등 영업활동 외에서 발생한 채권 중 회수 불가능한 금액을 비용 처리하는 기타의대손상각비입니다."
"l10n_kr_953000","953000","Loss on Disp of Short-term Investments","account.account_tag_investing","expense_other","Losses sustained upon disposing of short-term financial instruments.","False","True","","False","","단기투자자산처분손실","단기매매증권 등 단기투자자산을 장부금액보다 낮은 가액으로 처분하여 발생한 단기투자자산처분손실입니다."
"l10n_kr_954000","954000","Loss on Val of Short-term Investments","account.account_tag_investing","expense_other","Unrealized evaluation losses on short-term marketable securities.","False","True","","False","","단기투자자산평가손실","기말에 단기매매증권 등 단기투자자산을 공정가치로 평가하여 하락한 미실현 단기투자자산평가손실입니다."
"l10n_kr_955000","955000","Inventory Obsolescence Loss","account.account_tag_operating","expense_other","Losses recognized for missing, damaged, or obsolete inventory.","False","True","","False","","재고자산감모손실","파손, 부패, 도난 등으로 인해 재고자산의 실제 수량이 장부 수량보다 부족할 때 인식하는 재고자산감모손실입니다."
"l10n_kr_956000","956000","Loss on Foreign Exchange","account.account_tag_operating","expense_other","Realized losses incurred due to unfavorable rates during foreign currency settlements.","False","True","","False","","외환차손","외화 채무 상환이나 채권 회수 시 결제 환율의 차이로 인해 실제로 발생한 외환차손입니다."
"l10n_kr_957000","957000","Loss on Foreign Currency Translation","account.account_tag_operating","expense_other","Unrealized translation losses computed over foreign currency items at closing.","False","True","","False","","외화환산손실","기말 결산 시 환율 변동에 따라 외화 자산 및 부채를 원화로 환산할 때 발생하는 외화환산손실입니다."
"l10n_kr_958000","958000","Donations","account.account_tag_operating","expense_other","Charitable donations or free asset transfers to external causes.","False","True","","False","","기부금","기업의 영업활동과 무관하게 반대급부 없이 무상으로 국가, 기부단체 등에 기증하는 기부금입니다."
"l10n_kr_959000","959000","Equity in Losses of Affiliates","account.account_tag_investing","expense_other","Net loss share attributed from equity-method investee entities.","False","True","","False","","지분법손실","지분법을 적용하는 피투자회사가 당기순손실을 기록함에 따라 회사의 지분율만큼 인식하는 지분법손실입니다."
