"id","code","name","tag_ids","account_type","description","reconcile","active","depreciation_model_id","non_trade","parent_id","name@ko_KR","description@ko_KR"
"l10n_kr_101000","101000","Quick Assets","","asset_current","Parent account for highly liquid current assets.","False","False","","False","","당좌자산","유동성이 매우 높은 당좌자산의 통합 집계 계정입니다."
"l10n_kr_101100","101100","Cash and Cash Equivalents","","asset_cash","Parent account for cash on hand and highly liquid short-term deposits.","False","False","","False","l10n_kr_101000","현금및현금성자산","보유 중인 현금 및 유동성이 매우 높은 단기 예금 등의 통합 집계 계정입니다."
"l10n_kr_101110","101110","Cash","account.account_tag_operating","asset_cash","Cash on hand, including banknotes, coins, and foreign currencies.","True","True","","False","l10n_kr_101100","현금","사내 보유 중인 지폐, 주화 및 외화 등 통화 자산입니다."
"l10n_kr_101120","101120","Petty Cash","account.account_tag_operating","asset_cash","Small amount of cash kept on hand for minor daily expenses.","True","True","","False","l10n_kr_101100","소액현금","일상적인 소액 지출을 위해 부서별로 보유하는 전도금(소액현금)입니다."
"l10n_kr_101130","101130","Current Deposit","account.account_tag_operating","asset_cash","Bank accounts used for settling issued checks and bills.","True","True","","False","l10n_kr_101100","당좌예금","당좌수표 및 어음 발행 결제를 목적으로 개설한 예금입니다."
"l10n_kr_101140","101140","Ordinary Deposit","account.account_tag_operating","asset_cash","Standard bank savings accounts used for daily operational transactions.","True","True","","False","l10n_kr_101100","보통예금","일상적인 영업 대금 회수 및 자금 지출에 사용하는 예금입니다."
"account_journal_payment_debit_account_id","101150","Outstanding Receipts","account.account_tag_operating","asset_current","Temporary clearing account for incoming bank transfers awaiting reconciliation.","True","True","","False","l10n_kr_101100","미결제수취금","은행에 수금되었으나 매출 전표 등과 정산되기 전 대기 중인 임시 계정입니다."
"account_journal_payment_credit_account_id","101160","Outstanding Payments","account.account_tag_operating","asset_current","Temporary clearing account for outgoing bank payments awaiting reconciliation.","True","True","","False","l10n_kr_101100","미결제지급금","은행에서 대금이 출금되었으나 매입 전표 등과 정산되기 전 대기 중인 임시 계정입니다."
"l10n_kr_101170","101170","Bank Suspense Account","account.account_tag_operating","asset_current","Temporary holding account for imported bank statement lines.","True","True","","False","l10n_kr_101100","은행가계정","은행 거래 내역을 가져왔으나 아직 분개 처리 및 정산되지 않은 임시 보관 계정입니다."
"l10n_kr_101180","101180","Liquidity Transfer","account.account_tag_operating","asset_current","Clearing account used for internal money transfers between bank accounts.","True","True","","False","l10n_kr_101100","현금내부대체","은행 계좌 간 자금 이체 시 일시적으로 사용하는 대체 계정입니다."
"l10n_kr_102000","102000","Short-term Investments","","asset_current","Parent account for short-term financial instruments maturing within one year.","False","False","","False","l10n_kr_101000","단기투자자산","만기가 1년 이내에 도래하는 단기 금융상품 및 유가증권의 통합 집계 계정입니다."
"l10n_kr_102100","102100","Short-term Trading Securities","account.account_tag_investing","asset_current","Marketable securities held for short-term trading profits.","False","True","","False","l10n_kr_102000","단기매매증권","단기 매매 차익을 목적으로 보유하는 시장성 있는 유가증권입니다."
"l10n_kr_102200","102200","Short-term Financial Instruments","account.account_tag_investing","asset_current","Time deposits and installment savings maturing within one year.","False","True","","False","l10n_kr_102000","단기금융상품","만기가 1년 이내에 도래하는 정기예금, 정기적금 등의 단기 금융상품입니다."
"l10n_kr_103000","103000","Trade Receivables","","asset_receivable","Parent account for core outstanding trade receivables.","True","False","","False","l10n_kr_101000","매출채권","주된 영업활동에서 발생한 매출채권(외상매출금 및 받을어음)의 통합 집계 계정입니다."
"l10n_kr_103100","103100","Trade Accounts Receivable","account.account_tag_operating","asset_receivable","Receivables arising from the sale of inventory or core services.","True","True","","False","l10n_kr_103000","외상매출금","상품, 제품 매출 또는 용역 제공 등 주된 영업활동으로 발생한 외상 채권입니다."
"l10n_kr_103110","103110","Trade Accounts Receivable (PoS)","account.account_tag_operating","asset_receivable","Receivables originating from Point of Sale transactions.","True","True","","False","l10n_kr_103000","외상매출금 (PoS)","POS(판매시점정보관리) 시스템 거래를 통해 발생한 외상매출금입니다."
"l10n_kr_103200","103200","Notes Receivable","account.account_tag_operating","asset_receivable","Promissory notes received from buyers to settle core commercial transactions.","True","True","","False","l10n_kr_103000","받을어음","주된 상거래 대금 결제를 위해 거래처로부터 수취한 약속어음 및 전자어음입니다."
"l10n_kr_103900","103900","Allowance for Doubtful Accounts (Trade)","account.account_tag_operating","asset_receivable","Contra-asset account representing the estimated uncollectible portion of trade receivables.","True","True","","False","l10n_kr_103000","대손충당금(매출채권)","매출채권 중 회수 불가능할 것으로 추정되는 금액을 자산에서 차감 표시하는 평가 계정입니다."
"l10n_kr_104100","104100","Prepaid Expenses","","asset_prepayments","Parent account for prepaid operational expenses.","False","False","","False","l10n_kr_101000","선급비용","차기 이후의 기간에 속하는 선지급 비용의 통합 집계 계정입니다."
"l10n_kr_104110","104110","Prepaid Expenses","account.account_tag_operating","asset_prepayments","Prepaid operational expenses whose benefits extend into future periods.","False","True","","False","l10n_kr_104100","선급비용","당기에 지급된 비용 중 차기 이후의 기간에 귀속되는 선급비용입니다."
"l10n_kr_104200","104200","Deferred Tax Assets (Current)","","asset_current","Parent account for short-term deferred tax assets.","False","False","","False","l10n_kr_101000","이연법인세자산(유동)","1년 이내에 실현될 것으로 예상되는 유동 이연법인세자산의 통합 집계 계정입니다."
"l10n_kr_104210","104210","Deferred Tax Assets (Current)","account.account_tag_operating","asset_current","Deferred tax assets expected to reverse within one year.","False","True","","False","l10n_kr_104200","이연법인세자산(유동)","일시적 차이로 인해 1년 이내에 실현되어 법인세 부담을 줄여줄 유동 이연법인세자산입니다."
"l10n_kr_104900","104900","Other Quick Assets","","asset_current","Parent account for miscellaneous quick assets.","False","False","","False","l10n_kr_101000","기타당좌자산","기타 당좌자산의 통합 집계 계정입니다."
"l10n_kr_104910","104910","Non-trade Receivables","account.account_tag_operating","asset_receivable","Receivables arising from non-operating transactions like disposal of fixed assets.","True","True","","True","l10n_kr_104900","미수금","유형자산 매각 등 주된 영업활동 외의 거래에서 발생한 미수 채권입니다."
"l10n_kr_104920","104920","Accrued Income","account.account_tag_operating","asset_current","Accrued revenues earned during the current period but not yet received.","False","True","","False","l10n_kr_104900","미수수익","당기에 발생한 수익 중 결산일 현재 아직 수취하지 못한 미수수익입니다."
"l10n_kr_104930","104930","Advance Payments","account.account_tag_operating","asset_current","Advance payments made to vendors before delivery of goods or services.","False","True","","False","l10n_kr_104900","선급금","상품 인도 또는 용역 제공 전에 계약금 명목으로 미리 지급한 선급금입니다."
"l10n_kr_104940","104940","Prepaid Income Taxes","account.account_tag_operating","asset_current","Income taxes paid in advance via withholding or preliminary installments.","False","True","","False","l10n_kr_104900","선납세금","원천징수 세액이나 중간예납 등 최종 법인세 확정 전 미리 납부한 선납세금입니다."
"l10n_kr_104950","104950","VAT Receivable","account.account_tag_operating","asset_current","Input VAT paid on purchases, to be offset against output VAT.","True","True","","False","l10n_kr_104900","부가세대급금","재화나 용역 매입 시 부담하여 부가가치세 신고 시 공제받을 매입세액(부가세대급금)입니다."
"l10n_kr_104960","104960","VAT Settlement Receivable","account.account_tag_operating","asset_receivable","VAT refund receivable established when input VAT exceeds output VAT.","True","True","","True","l10n_kr_104900","미수환급금","부가가치세 정산 결과 매입세액이 매출세액을 초과하여 환급받을 미수환급금입니다."
"l10n_kr_104970","104970","Prepaid VAT Assessment","account.account_tag_operating","asset_current","Prepaid VAT amounts assessed during preliminary reporting periods.","True","True","","True","l10n_kr_104900","예정고지세액(또는 예정신고납부세액)","부가가치세 예정신고 기간에 고지되거나 납부하여 확정 신고 시 차감할 예정고지세액입니다."
"l10n_kr_115000","115000","Inventories","","asset_current","Parent account for all subcategories of inventories.","False","False","","False","","재고자산","판매를 위해 보유하거나 생산 과정에 있는 재고자산의 통합 집계 계정입니다."
"l10n_kr_115100","115100","Merchandise","","asset_current","Parent account for trading merchandise.","False","False","","False","l10n_kr_115000","상품","외부에서 매입한 상품의 통합 집계 계정입니다."
"l10n_kr_115110","115110","Merchandise","account.account_tag_operating","asset_current","Merchandise goods purchased from vendors for direct resale.","False","True","","False","l10n_kr_115100","상품","추가 가공 없이 판매할 목적으로 외부에서 매입한 상품입니다."
"l10n_kr_115200","115200","Finished Goods","","asset_current","Parent account for manufactured finished goods.","False","False","","False","l10n_kr_115000","제품","자가 제조한 제품의 통합 집계 계정입니다."
"l10n_kr_115210","115210","Finished Goods","account.account_tag_operating","asset_current","Finished products manufactured in-house ready for sale.","False","True","","False","l10n_kr_115200","제품","회사에서 제조 과정을 완료하여 판매 대기 중인 제품입니다."
"l10n_kr_115300","115300","Semi-finished Goods","","asset_current","Parent account for semi-finished goods.","False","False","","False","l10n_kr_115000","반제품","제조 과정 중인 반제품의 통합 집계 계정입니다."
"l10n_kr_115310","115310","Semi-finished Goods","account.account_tag_operating","asset_current","Semi-finished manufactured items that can be sold or processed further.","False","True","","False","l10n_kr_115300","반제품","일부 가공이 완료되어 그대로 판매하거나 추가 가공할 수 있는 반제품입니다."
"l10n_kr_115400","115400","Work in Process","","asset_current","Parent account for work in process items.","False","False","","False","l10n_kr_115000","재공품","제조 공정 중에 있는 재공품의 통합 집계 계정입니다."
"l10n_kr_115410","115410","Work in Process","account.account_tag_operating","asset_current","Work in process items currently on production lines.","False","True","","False","l10n_kr_115400","재공품","제품 제조를 위해 공정 중에 투입되어 가공 중인 미완성품(재공품)입니다."
"l10n_kr_115500","115500","Raw Materials","","asset_current","Parent account for raw materials.","False","False","","False","l10n_kr_115000","원재료","제품 제조를 위해 투입할 원재료의 통합 집계 계정입니다."
"l10n_kr_115510","115510","Raw Materials","account.account_tag_operating","asset_current","Raw materials purchased to be consumed directly in the production process.","False","True","","False","l10n_kr_115500","원재료","제품 생산을 위해 소비할 목적으로 매입한 원재료입니다."
"l10n_kr_115600","115600","Supplies (Inventory)","","asset_current","Parent account for inventory supplies.","False","False","","False","l10n_kr_115000","저장품","소모성 자재 및 저장품의 통합 집계 계정입니다."
"l10n_kr_115610","115610","Supplies (Inventory)","account.account_tag_operating","asset_current","Factory tools, maintenance supplies, and office stationery stored in warehouses.","False","True","","False","l10n_kr_115600","저장품","공장 소모품, 수선용 부품 및 기말 재고로 남아 있는 저장품입니다."
"l10n_kr_115900","115900","Other Inventories","","asset_current","Parent account for miscellaneous inventories.","False","False","","False","l10n_kr_115000","기타재고자산","기타 재고자산의 통합 집계 계정입니다."
"l10n_kr_115910","115910","Other Inventories","account.account_tag_operating","asset_current","Miscellaneous inventory items not classified elsewhere.","False","True","","False","l10n_kr_115900","기타재고자산","미착품, 적송품 등 다른 항목으로 분류되지 않는 기타 재고자산입니다."
"l10n_kr_121000","121000","Investments","","asset_non_current","Parent account for long-term investments held for control or returns.","False","False","","False","","투자자산","장기 투자수익이나 타사 지배 목적으로 보유하는 투자자산의 통합 집계 계정입니다."
"l10n_kr_121100","121100","Investment Property","","asset_non_current","Parent account for investment properties.","False","False","","False","l10n_kr_121000","투자부동산","투자부동산의 통합 집계 계정입니다."
"l10n_kr_121110","121110","Investment Property","account.account_tag_investing","asset_non_current","Properties held to earn rentals or for capital appreciation.","False","True","","False","l10n_kr_121100","투자부동산","시세 차익이나 임대 수익을 얻을 목적으로 보유하는 투자부동산입니다."
"l10n_kr_121200","121200","Long-term Investment Securities","","asset_non_current","Parent account for long-term marketable and debt securities.","False","False","","False","l10n_kr_121000","장기투자증권","장기 투자 목적의 유가증권(장기투자증권) 통합 집계 계정입니다."
"l10n_kr_121210","121210","Available-for-Sale Securities","account.account_tag_investing","asset_non_current","Long-term marketable securities classified as available-for-sale.","False","True","","False","l10n_kr_121200","매도가능증권","장기 투자 목적으로 보유하며 매도가능증권으로 분류되는 지분증권 및 채무증권입니다."
"l10n_kr_121220","121220","Held-to-Maturity Securities","account.account_tag_investing","asset_non_current","Long-term debt securities held until their maturity date.","False","True","","False","l10n_kr_121200","만기보유증권","만기까지 보유할 적극적인 의도와 능력이 있는 채무증권(만기보유증권)입니다."
"l10n_kr_121300","121300","Equity Method Investments","","asset_non_current","Parent account for equity method investments.","False","False","","False","l10n_kr_121000","지분법적용투자주식","지분법적용투자주식의 통합 집계 계정입니다."
"l10n_kr_121310","121310","Equity Method Investments","account.account_tag_investing","asset_non_current","Strategic investments in associates where significant operational influence is held.","False","True","","False","l10n_kr_121300","지분법적용투자주식","피투자회사에 유의적인 영향력을 행사할 수 있는 지분법적용투자주식입니다."
"l10n_kr_121400","121400","Long-term Loans","","asset_non_current","Parent account for long-term loans.","False","False","","False","l10n_kr_121000","장기대여금","장기대여금의 통합 집계 계정입니다."
"l10n_kr_121410","121410","Long-term Loans","account.account_tag_investing","asset_non_current","Loans provided to third parties with maturities exceeding one year.","False","True","","False","l10n_kr_121400","장기대여금","회수 기한이 보고기간종료일로부터 1년을 초과하여 도래하는 장기대여금입니다."
"l10n_kr_121900","121900","Other Investments","","asset_non_current","Parent account for miscellaneous long-term investments.","False","False","","False","l10n_kr_121000","기타투자자산","기타 투자자산의 통합 집계 계정입니다."
"l10n_kr_121910","121910","Other Investments","account.account_tag_investing","asset_non_current","Miscellaneous long-term investments.","False","True","","False","l10n_kr_121900","기타투자자산","다른 항목으로 분류되지 않는 기타 투자자산입니다."
"l10n_kr_122000","122000","Tangible Assets","","asset_fixed","Parent account for physical fixed assets used in operations.","False","False","","False","","유형자산","영업활동에 사용할 목적으로 보유하는 물리적 형체가 있는 유형자산의 통합 집계 계정입니다."
"l10n_kr_122100","122100","Land","","asset_fixed","Parent account for land assets.","False","False","","False","l10n_kr_122000","토지","토지의 통합 집계 계정입니다."
"l10n_kr_122110","122110","Land","account.account_tag_investing","asset_fixed","Land held for business operations, not subject to depreciation.","False","True","l10n_kr_asset_no_depreciation","False","l10n_kr_122100","토지","영업활동에 사용되며 감가상각 대상이 아닌 토지입니다."
"l10n_kr_122200","122200","Equipment Assets","","asset_fixed","Parent account for building and equipment fixed assets.","False","False","","False","l10n_kr_122000","설비자산","건물, 구축물, 기계장치 등 설비자산의 통합 집계 계정입니다."
"l10n_kr_122210","122210","Buildings","account.account_tag_investing","asset_fixed","Buildings used for office or manufacturing operations.","False","True","l10n_kr_asset_40_year_linear","False","l10n_kr_122200","건물","영업 및 생산활동에 사용되는 건물입니다."
"l10n_kr_122211","122211","Accumulated Depreciation - Buildings","account.account_tag_investing","asset_fixed","Contra-asset capturing historical cumulative depreciation for buildings.","False","True","","False","l10n_kr_122200","감가상각누계액(건물)","건물의 취득원가에서 차감하는 역사적 누적 감가상각액입니다."
"l10n_kr_122220","122220","Structures","account.account_tag_investing","asset_fixed","Physical structures like roads, parking lots, and bridges.","False","True","l10n_kr_asset_20_year_linear","False","l10n_kr_122200","구축물","교량, 궤도, 포장도로, 주차장 등 영업활동에 사용되는 구축물입니다."
"l10n_kr_122221","122221","Accumulated Depreciation - Structures","account.account_tag_investing","asset_fixed","Contra-asset capturing historical cumulative depreciation for structures.","False","True","","False","l10n_kr_122200","감가상각누계액(구축물)","구축물의 취득원가에서 차감하는 역사적 누적 감가상각액입니다."
"l10n_kr_122230","122230","Machinery","account.account_tag_investing","asset_fixed","Production machinery and automated lines.","False","True","l10n_kr_asset_5_year_linear","False","l10n_kr_122200","기계장치","제품 생산활동에 사용되는 기계장치 및 부속 설비입니다."
"l10n_kr_122231","122231","Accumulated Depreciation - Machinery","account.account_tag_investing","asset_fixed","Contra-asset capturing historical cumulative depreciation for machinery.","False","True","","False","l10n_kr_122200","감가상각누계액(기계장치)","기계장치의 취득원가에서 차감하는 역사적 누적 감가상각액입니다."
"l10n_kr_122240","122240","Vehicles","account.account_tag_investing","asset_fixed","Operational logistics vehicles and corporate cars.","False","True","l10n_kr_asset_5_year_linear","False","l10n_kr_122200","차량운반구","영업활동에 사용되는 승용차, 화물차, 지게차 등 차량운반구입니다."
"l10n_kr_122241","122241","Accumulated Depreciation - Vehicles","account.account_tag_investing","asset_fixed","Contra-asset capturing historical cumulative depreciation for vehicles.","False","True","","False","l10n_kr_122200","감가상각누계액(차량운반구)","차량운반구의 취득원가에서 차감하는 역사적 누적 감가상각액입니다."
"l10n_kr_122250","122250","Fixtures","account.account_tag_investing","asset_fixed","Office furniture, computers, and general fixtures.","False","True","l10n_kr_asset_5_year_linear","False","l10n_kr_122200","비품","영업활동에 사용되는 사무용 가구, 컴퓨터, 복사기 등 비품입니다."
"l10n_kr_122251","122251","Accumulated Depreciation - Fixtures","account.account_tag_investing","asset_fixed","Contra-asset capturing historical cumulative depreciation for fixtures.","False","True","","False","l10n_kr_122200","감가상각누계액(비품)","비품의 취득원가에서 차감하는 역사적 누적 감가상각액입니다."
"l10n_kr_122260","122260","Other Equipment","account.account_tag_investing","asset_fixed","Miscellaneous equipment and utility assets.","False","True","l10n_kr_asset_5_year_linear","False","l10n_kr_122200","기타설비자산","다른 항목으로 분류되지 않는 기타 설비자산입니다."
"l10n_kr_122261","122261","Accumulated Depreciation - Equipment","account.account_tag_investing","asset_fixed","Contra-asset capturing historical cumulative depreciation for other equipment.","False","True","","False","l10n_kr_122200","감가상각누계액(기타설비자산)","기타 설비자산의 취득원가에서 차감하는 역사적 누적 감가상각액입니다."
"l10n_kr_122300","122300","Construction in Progress","","asset_fixed","Parent account for construction in progress.","False","False","","False","l10n_kr_122000","건설중인자산","건설중인자산의 통합 집계 계정입니다."
"l10n_kr_122310","122310","Construction in Progress","account.account_tag_investing","asset_fixed","Accumulated costs for ongoing construction or asset development before completion.","False","True","l10n_kr_asset_no_depreciation","False","l10n_kr_122300","건설중인자산","유형자산의 건설 또는 제작을 위해 투입된 미완성 상태의 지출액(건설중인자산)입니다."
"l10n_kr_122900","122900","Other Tangible Assets","","asset_fixed","Parent account for miscellaneous tangible assets.","False","False","","False","l10n_kr_122000","기타유형자산","기타 유형자산의 통합 집계 계정입니다."
"l10n_kr_122910","122910","Other Tangible Assets","account.account_tag_investing","asset_fixed","Miscellaneous tangible assets not classified elsewhere.","False","True","","False","l10n_kr_122900","기타유형자산","다른 항목으로 분류되지 않는 기타 유형자산입니다."
"l10n_kr_124000","124000","Intangible Assets","","asset_non_current","Parent account for non-physical assets like intellectual property and software.","False","False","","False","","무형자산","물리적 형체는 없으나 식별 가능한 비화폐성자산인 무형자산의 통합 집계 계정입니다."
"l10n_kr_124100","124100","Goodwill","","asset_non_current","Parent account for goodwill.","False","False","","False","l10n_kr_124000","영업권","영업권의 통합 집계 계정입니다."
"l10n_kr_124110","124110","Goodwill","account.account_tag_investing","asset_non_current","Premium paid over the fair value of net assets during an acquisition.","False","True","","False","l10n_kr_124100","영업권","사업결합 시 취득자가 피취득자의 순자산 공정가치를 초과하여 지급한 프리미엄(영업권)입니다."
"l10n_kr_124111","124111","Accumulated Amortization - Goodwill","account.account_tag_investing","asset_non_current","Contra-asset capturing cumulative amortization for goodwill.","False","True","","False","l10n_kr_124100","영업권상각누계액","영업권의 취득원가에서 차감하는 역사적 누적 무형자산상각액입니다."
"l10n_kr_124200","124200","Patents","","asset_non_current","Parent account for patents.","False","False","","False","l10n_kr_124000","산업재산권","산업재산권의 통합 집계 계정입니다."
"l10n_kr_124210","124210","Patents","account.account_tag_investing","asset_non_current","Capitalized costs for acquired or internally developed patents.","False","True","","False","l10n_kr_124200","산업재산권","특허권, 실용신안권 등 일정 기간 독점적 권리를 갖는 산업재산권입니다."
"l10n_kr_124211","124211","Accumulated Amortization - Patents","account.account_tag_investing","asset_non_current","Contra-asset capturing cumulative amortization for patents.","False","True","","False","l10n_kr_124200","산업재산권상각누계액","산업재산권의 취득원가에서 차감하는 역사적 누적 무형자산상각액입니다."
