"id","code","name","tag_ids","account_type","description","reconcile","active","depreciation_model_id","non_trade","parent_id","name@ko_KR","description@ko_KR"
"l10n_kr_124300","124300","Development Costs","","asset_non_current","Parent account for development costs.","False","False","","False","l10n_kr_124000","개발비","개발비의 통합 집계 계정입니다."
"l10n_kr_124310","124310","Development Costs","account.account_tag_investing","asset_non_current","Capitalized development phase costs that meet specific recognition criteria.","False","True","","False","l10n_kr_124300","개발비","신제품 개발 단계에서 발생한 지출 중 자산 인식 요건을 충족하여 자본화된 개발비입니다."
"l10n_kr_124311","124311","Accumulated Amortization - Development Costs","account.account_tag_investing","asset_non_current","Contra-asset capturing cumulative amortization for development costs.","False","True","","False","l10n_kr_124300","개발비상각누계액","개발비의 취득원가에서 차감하는 역사적 누적 무형자산상각액입니다."
"l10n_kr_124900","124900","Other Intangible Assets","","asset_non_current","Parent account for miscellaneous intangible assets.","False","False","","False","l10n_kr_124000","기타무형자산","소프트웨어 등 기타 무형자산의 통합 집계 계정입니다."
"l10n_kr_124910","124910","Software","account.account_tag_investing","asset_non_current","Capitalized software licenses and development costs.","False","True","l10n_kr_asset_5_year_linear","False","l10n_kr_124900","소프트웨어","외부에서 구입하거나 내부적으로 개발하여 자본화한 소프트웨어입니다."
"l10n_kr_124911","124911","Accumulated Amortization - Software","account.account_tag_investing","asset_non_current","Contra-asset capturing cumulative amortization for software.","False","True","","False","l10n_kr_124900","소프트웨어상각누계액","소프트웨어의 취득원가에서 차감하는 역사적 누적 무형자산상각액입니다."
"l10n_kr_125000","125000","Other Non-current Assets","","asset_non_current","Parent account for long-term assets not classified as investments, tangible, or intangible.","False","False","","False","","기타비유동자산","투자자산, 유형자산, 무형자산에 속하지 않는 기타비유동자산의 통합 집계 계정입니다."
"l10n_kr_125100","125100","Deferred Tax Assets (Non-current)","","asset_non_current","Parent account for long-term deferred tax assets.","False","False","","False","l10n_kr_125000","이연법인세자산","비유동 이연법인세자산의 통합 집계 계정입니다."
"l10n_kr_125110","125110","Deferred Tax Assets (Non-current)","account.account_tag_operating","asset_non_current","Long-term deferred tax assets.","False","True","","False","l10n_kr_125100","이연법인세자산","차감할 일시적차이 등으로 인하여 미래(1년 초과)에 경감될 법인세 부담액인 비유동 이연법인세자산입니다."
"l10n_kr_125900","125900","Other Non-current Assets (Others)","","asset_non_current","Parent account for miscellaneous long-term prepayments and deposits.","False","False","","False","l10n_kr_125000","기타비유동자산(기타)","임차보증금 등 기타비유동자산(기타)의 통합 집계 계정입니다."
"l10n_kr_125910","125910","Long-term Guarantee Deposits","account.account_tag_investing","asset_non_current","Long-term deposits paid for leasing office or factory spaces.","False","True","","False","l10n_kr_125900","임차보증금","사무실, 공장 등을 임차하며 지급한 반환 대상 임차보증금입니다."
"l10n_kr_125920","125920","Long-term Prepaid Expenses","account.account_tag_operating","asset_non_current","Prepaid expenses whose benefits extend beyond one year.","False","True","","False","l10n_kr_125900","장기선급비용","선지급된 비용 중 1년을 초과하여 효익이 귀속되는 장기선급비용입니다."
"l10n_kr_210000","210000","Current Liabilities","","liability_current","Parent account for corporate liabilities maturing within one fiscal year.","False","False","","False","","유동부채","보고기간종료일로부터 1년 이내에 상환되어야 하는 유동부채의 통합 집계 계정입니다."
"l10n_kr_210100","210100","Short-term Borrowings","","liability_current","Parent account for short-term borrowings.","False","False","","False","l10n_kr_210000","단기차입금","단기차입금의 통합 집계 계정입니다."
"l10n_kr_210110","210110","Short-term Borrowings","account.account_tag_financing","liability_current","Short-term bank borrowings with maturities within one year.","True","True","","False","l10n_kr_210100","단기차입금","금융기관 등으로부터 차입한 자금 중 1년 이내에 상환 기일이 도래하는 단기차입금입니다."
"l10n_kr_210200","210200","Trade Payables","","liability_payable","Parent account for core trade payables.","True","False","","False","l10n_kr_210000","매입채무","주된 영업활동에서 발생한 매입채무(외상매입금 및 지급어음)의 통합 집계 계정입니다."
"l10n_kr_210210","210210","Trade Accounts Payable","account.account_tag_operating","liability_payable","Payables arising from purchases of raw materials or merchandise.","True","True","","False","l10n_kr_210200","외상매입금","원재료나 상품의 매입 등 주된 상거래에서 발생한 외상 채무(외상매입금)입니다."
"l10n_kr_210220","210220","Notes Payable","account.account_tag_operating","liability_payable","Promissory notes issued to vendors to settle trade transactions.","True","True","","False","l10n_kr_210200","지급어음","주된 상거래 대금 결제를 위해 거래처에 발행한 약속어음 및 전자어음(지급어음)입니다."
"l10n_kr_210300","210300","Income Taxes Payable","","liability_current","Parent account for income taxes payable.","False","False","","False","l10n_kr_210000","당기법인세부채","당기법인세부채의 통합 집계 계정입니다."
"l10n_kr_210310","210310","Income Taxes Payable","account.account_tag_operating","liability_current","Estimated corporate income taxes payable for the current fiscal year.","False","True","","False","l10n_kr_210300","당기법인세부채","당기 과세소득에 대하여 기말에 납부해야 할 예상 법인세 부담액(당기법인세부채)입니다."
"l10n_kr_210400","210400","Accrued Expenses","","liability_payable","Parent account for accrued expenses.","True","False","","False","l10n_kr_210000","미지급비용","미지급비용의 통합 집계 계정입니다."
"l10n_kr_210410","210410","Accrued Expenses","account.account_tag_operating","liability_payable","Accrued operational expenses incurred during the period but not yet paid.","True","True","","True","l10n_kr_210400","미지급비용","당기에 발생한 비용이나 아직 지급 기일이 도래하지 않아 미지급된 비용입니다."
"l10n_kr_210500","210500","Deferred Tax Liabilities (Current)","","liability_current","Parent account for short-term deferred tax liabilities.","False","False","","False","l10n_kr_210000","이연법인세부채(유동)","1년 이내에 실현될 유동 이연법인세부채의 통합 집계 계정입니다."
"l10n_kr_210510","210510","Deferred Tax Liabilities (Current)","account.account_tag_operating","liability_current","Deferred tax liabilities expected to settle within one year.","False","True","","False","l10n_kr_210500","이연법인세부채(유동)","가산할 일시적차이로 인하여 1년 이내에 추가로 부담하게 될 법인세액(유동 이연법인세부채)입니다."
"l10n_kr_210900","210900","Other Current Liabilities","","liability_current","Parent account for miscellaneous current liabilities.","False","False","","False","l10n_kr_210000","기타유동부채","기타 유동부채의 통합 집계 계정입니다."
"l10n_kr_210910","210910","Non-trade Payables","account.account_tag_operating","liability_payable","Payables arising from non-operating transactions.","True","True","","True","l10n_kr_210900","미지급금","유형자산 구입 등 주된 영업활동 외의 거래에서 발생한 미지급금입니다."
"l10n_kr_210920","210920","Corporate Credit Card Payable","account.account_tag_operating","liability_credit_card","Payables for corporate credit card usage awaiting settlement.","True","True","","True","l10n_kr_210900","미지급금(신용카드)","법인카드 결제 및 사용에 따라 결제일에 출금될 예정인 미지급금(신용카드)입니다."
"l10n_kr_210930","210930","Advances from Customers","account.account_tag_operating","liability_current","Advance deposits received from customers before delivery of goods.","False","True","","False","l10n_kr_210900","선수금","상품 인도 또는 용역 제공 전에 계약금 명목으로 거래처로부터 수취한 선수금입니다."
"l10n_kr_210940","210940","Withholdings (Payroll, Taxes)","account.account_tag_operating","liability_current","Payroll withholdings including income taxes and insurance contributions.","False","True","","False","l10n_kr_210900","예수금","임직원 급여 지급 시 원천징수한 소득세 및 4대보험 본인 부담금 등의 예수금입니다."
"l10n_kr_210950","210950","VAT Payable","account.account_tag_operating","liability_current","Output VAT collected from clients during sales transactions.","True","True","","False","l10n_kr_210900","부가세예수금","매출 시 고객으로부터 거래징수하여 향후 세무서에 납부해야 할 부가세예수금입니다."
"l10n_kr_210960","210960","Unearned Revenue","account.account_tag_operating","liability_current","Revenue received in advance, deferred to future periods.","False","True","","False","l10n_kr_210900","선수수익","당기에 수취한 수익 중 차기 이후의 기간에 속하는 이연 수익(선수수익)입니다."
"l10n_kr_210970","210970","Unpaid Taxes (VAT Settlement)","account.account_tag_operating","liability_payable","Finalized VAT payable computed at tax closing.","True","True","","True","l10n_kr_210900","미지급세금","부가가치세 정산 결과 매출세액이 매입세액을 초과하여 확정된 납부 대상 미지급세금입니다."
"l10n_kr_220000","220000","Non-current Liabilities","","liability_non_current","Parent account for corporate liabilities maturing beyond one fiscal year.","False","False","","False","","비유동부채","보고기간종료일로부터 1년을 초과하여 상환 기일이 도래하는 비유동부채의 통합 집계 계정입니다."
"l10n_kr_220100","220100","Bonds Payable","","liability_non_current","Parent account for bonds payable.","False","False","","False","l10n_kr_220000","사채","사채의 통합 집계 계정입니다."
"l10n_kr_220110","220110","Bonds Payable","account.account_tag_financing","liability_non_current","Corporate bonds issued to financial market investors.","False","True","","False","l10n_kr_220100","사채","장기 자금 조달을 목적으로 일반 투자자에게 발행한 회사채(사채)입니다."
"l10n_kr_220200","220200","Convertible Bonds","","liability_non_current","Parent account for convertible bonds.","False","False","","False","l10n_kr_220000","전환사채","전환사채의 통합 집계 계정입니다."
"l10n_kr_220210","220210","Convertible Bonds","account.account_tag_financing","liability_non_current","Corporate bonds that can be converted into common stock.","False","True","","False","l10n_kr_220200","전환사채","일정 조건에 따라 발행회사의 보통주로 전환할 수 있는 권리가 부여된 전환사채입니다."
"l10n_kr_220300","220300","Bonds with Warrants","","liability_non_current","Parent account for bonds with warrants.","False","False","","False","l10n_kr_220000","신주인수권부사채","신주인수권부사채의 통합 집계 계정입니다."
"l10n_kr_220310","220310","Bonds with Warrants","account.account_tag_financing","liability_non_current","Corporate bonds issued with detached warrants to buy stock.","False","True","","False","l10n_kr_220300","신주인수권부사채","신주를 인수할 수 있는 권리가 부여된 신주인수권부사채입니다."
"l10n_kr_220400","220400","Long-term Borrowings","","liability_non_current","Parent account for long-term borrowings.","False","False","","False","l10n_kr_220000","장기차입금","장기차입금의 통합 집계 계정입니다."
"l10n_kr_220410","220410","Long-term Borrowings","account.account_tag_financing","liability_non_current","Long-term bank loans with maturities exceeding one year.","True","True","","False","l10n_kr_220400","장기차입금","금융기관 등으로부터 차입한 자금 중 상환 기일이 1년을 초과하는 장기차입금입니다."
"l10n_kr_220500","220500","Provision for Severance Benefits","","liability_non_current","Parent account for provision for severance benefits.","False","False","","False","l10n_kr_220000","퇴직급여충당부채","퇴직급여충당부채의 통합 집계 계정입니다."
"l10n_kr_220510","220510","Provision for Severance Benefits","account.account_tag_operating","liability_non_current","Estimated provision reserves for future employee severance payouts.","False","True","","False","l10n_kr_220500","퇴직급여충당부채","임직원이 기말 현재 전원 퇴직할 경우 지급해야 할 퇴직급여 추산액(퇴직급여충당부채)입니다."
"l10n_kr_220600","220600","Provision for Product Warranties","","liability_non_current","Parent account for provision for product warranties.","False","False","","False","l10n_kr_220000","장기제품보증충당부채","장기제품보증충당부채의 통합 집계 계정입니다."
"l10n_kr_220610","220610","Provision for Product Warranties","account.account_tag_operating","liability_non_current","Estimated provision reserves for future product warranty and repair obligations.","False","True","","False","l10n_kr_220600","장기제품보증충당부채","매출 이후 발생할 제품의 무상 수리 및 보증 의무를 대비하여 설정한 장기제품보증충당부채입니다."
"l10n_kr_220700","220700","Deferred Tax Liabilities","","liability_non_current","Parent account for long-term deferred tax liabilities.","False","False","","False","l10n_kr_220000","이연법인세부채","비유동 이연법인세부채의 통합 집계 계정입니다."
"l10n_kr_220710","220710","Deferred Tax Liabilities","account.account_tag_operating","liability_non_current","Long-term deferred tax liabilities.","False","True","","False","l10n_kr_220700","이연법인세부채","가산할 일시적차이로 인하여 미래(1년 초과)에 추가로 부담하게 될 법인세액(비유동 이연법인세부채)입니다."
"l10n_kr_220900","220900","Other Non-current Liabilities","","liability_non_current","Parent account for miscellaneous non-current liabilities.","False","False","","False","l10n_kr_220000","기타비유동부채","기타비유동부채의 통합 집계 계정입니다."
"l10n_kr_220910","220910","Other Non-current Liabilities","account.account_tag_operating","liability_non_current","Miscellaneous long-term liabilities.","False","True","","False","l10n_kr_220900","기타비유동부채","다른 항목으로 분류되지 않는 기타비유동부채입니다."
"l10n_kr_310000","310000","Capital Stock","","equity","Parent account for core par value share capital.","False","False","","False","","자본금","법정자본금의 통합 집계 계정입니다."
"l10n_kr_310100","310100","Common Stock","","equity","Parent account for common stock.","False","False","","False","l10n_kr_310000","보통주자본금","보통주자본금의 통합 집계 계정입니다."
"l10n_kr_310110","310110","Common Stock","account.account_tag_financing","equity","Core common stock issued at par value.","False","True","","False","l10n_kr_310100","보통주자본금","기본 의결권이 부여된 보통주를 발행하여 조달한 법정자본금입니다."
"l10n_kr_310200","310200","Preferred Stock","","equity","Parent account for preferred stock.","False","False","","False","l10n_kr_310000","우선주자본금","우선주자본금의 통합 집계 계정입니다."
"l10n_kr_310210","310210","Preferred Stock","account.account_tag_financing","equity","Preferred stock issued with dividend or liquidation preferences.","False","True","","False","l10n_kr_310200","우선주자본금","이익 배당이나 잔여재산 분배에 우선적 지위를 가지는 우선주를 발행하여 조달한 법정자본금입니다."
"l10n_kr_320000","320000","Capital Surplus","","equity","Parent account for capital surplus reserves.","False","False","","False","","자본잉여금","주주와의 자본거래에서 발생하여 자본을 증가시키는 자본잉여금 통합 집계 계정입니다."
"l10n_kr_320100","320100","Paid-in Capital in Excess of Par Value","","equity","Parent account for paid-in capital in excess of par value.","False","False","","False","l10n_kr_320000","주식발행초과금","주식발행초과금의 통합 집계 계정입니다."
"l10n_kr_320110","320110","Paid-in Capital in Excess of Par Value","account.account_tag_financing","equity","Premium received over the par value when new shares are issued.","False","True","","False","l10n_kr_320100","주식발행초과금","주식 발행 시 액면금액을 초과하여 납입된 프리미엄 금액(주식발행초과금)입니다."
"l10n_kr_320200","320200","Other Capital Surplus","","equity","Parent account for other capital surplus.","False","False","","False","l10n_kr_320000","기타자본잉여금","기타자본잉여금의 통합 집계 계정입니다."
"l10n_kr_320210","320210","Other Capital Surplus","account.account_tag_financing","equity","Miscellaneous capital surplus items like gains on capital reduction.","False","True","","False","l10n_kr_320200","기타자본잉여금","감자차익 및 자기주식처분이익 등 주식발행초과금 외의 기타자본잉여금입니다."
"l10n_kr_330000","330000","Capital Adjustments","","equity","Parent account for temporary capital adjustment items.","False","False","","False","","자본조정","자본거래에 해당하나 최종 자본으로 볼 수 없거나 자본의 가감 성격인 자본조정 통합 집계 계정입니다."
"l10n_kr_330100","330100","Treasury Stock","","equity","Parent account for treasury stock.","False","False","","False","l10n_kr_330000","자기주식","자기주식의 통합 집계 계정입니다."
"l10n_kr_330110","330110","Treasury Stock","account.account_tag_financing","equity","Issued shares bought back and held by the company.","False","True","","False","l10n_kr_330100","자기주식","회사가 기발행한 주식을 매입하여 처분하거나 소각하기 전까지 임시로 보유하는 자기주식(자본차감)입니다."
"l10n_kr_330900","330900","Other Capital Adjustments","","equity","Parent account for miscellaneous capital adjustments.","False","False","","False","l10n_kr_330000","기타자본조정","기타 자본조정 항목의 통합 집계 계정입니다."
"l10n_kr_330910","330910","Discount on Stock Issuance","account.account_tag_financing","equity","Deduction entry created when new stock is issued below par value.","False","True","","False","l10n_kr_330900","주식할인발행차금","주식 발행 시 액면금액에 미달하여 납입된 금액(주식할인발행차금)입니다."
"l10n_kr_330920","330920","Stock Options","account.account_tag_financing","equity","Capital additions representing stock options granted to employees.","False","True","","False","l10n_kr_330900","주식선택권","임직원에게 부여한 주식선택권(스톡옵션)의 공정가치를 인식한 자본 가산 항목입니다."
"l10n_kr_340000","340000","Accumulated Other Comprehensive Income","","equity","Parent account for unrealized gains or losses bypassing the income statement.","False","False","","False","","기타포괄손익누계액","당기순손익에 포함되지 않는 미실현 손익의 잔액인 기타포괄손익누계액 통합 집계 계정입니다."
"l10n_kr_340100","340100","Gain/Loss on Valuation of AFS Securities","","equity","Parent account for AFS securities valuation.","False","False","","False","l10n_kr_340000","매도가능증권평가손익","매도가능증권평가손익의 통합 집계 계정입니다."
"l10n_kr_340110","340110","Gain/Loss on Valuation of AFS Securities","l10n_kr.l10n_kr_account_tag_other_comprehensive_income","equity","Unrealized valuation differences on available-for-sale securities.","False","True","","False","l10n_kr_340100","매도가능증권평가손익","매도가능증권의 공정가치 변동에 따른 미실현 평가손익입니다."
"l10n_kr_340200","340200","Cumulative Translation Adjustments","","equity","Parent account for cumulative translation adjustments.","False","False","","False","l10n_kr_340000","해외사업환산손익","해외사업환산손익의 통합 집계 계정입니다."
"l10n_kr_340210","340210","Cumulative Translation Adjustments","l10n_kr.l10n_kr_account_tag_other_comprehensive_income","equity","Translation adjustments from converting foreign operations.","False","True","","False","l10n_kr_340200","해외사업환산손익","해외사업장의 재무제표를 원화로 환산할 때 발생하는 환산손익입니다."
"l10n_kr_340300","340300","Valuation of Cash Flow Hedges","","equity","Parent account for cash flow hedge valuation.","False","False","","False","l10n_kr_340000","현금흐름위험회피파생상품평가손익","현금흐름위험회피 파생상품평가손익의 통합 집계 계정입니다."
"l10n_kr_340310","340310","Valuation of Cash Flow Hedges","l10n_kr.l10n_kr_account_tag_other_comprehensive_income","equity","Unrealized gains or losses on cash flow hedge derivative positions.","False","True","","False","l10n_kr_340300","현금흐름위험회피파생상품평가손익","현금흐름 위험회피 목적의 파생상품 평가에 따른 미실현 손익입니다."
"l10n_kr_350000","350000","Retained Earnings","","equity","Parent account for accumulated operational profits.","False","False","","False","","이익잉여금","영업활동의 결과 창출된 이익 중 사외로 유출되지 않고 사내에 유보된 이익잉여금 통합 집계 계정입니다."
"l10n_kr_350100","350100","Legal Reserve","","equity","Parent account for legal reserves.","False","False","","False","l10n_kr_350000","법정적립금","법정적립금의 통합 집계 계정입니다."
"l10n_kr_350110","350110","Legal Reserve","","equity","Statutory reserves mandated under corporate law.","False","True","","False","l10n_kr_350100","법정적립금","상법 등 관련 법령에 따라 의무적으로 이익잉여금에서 유보해야 하는 이익준비금 등 법정적립금입니다."
"l10n_kr_350200","350200","Voluntary Reserve","","equity","Parent account for voluntary reserves.","False","False","","False","l10n_kr_350000","임의적립금","임의적립금의 통합 집계 계정입니다."
"l10n_kr_350210","350210","Voluntary Reserve","","equity","Voluntary reserves established via board or shareholder decisions.","False","True","","False","l10n_kr_350200","임의적립금","정관이나 주주총회의 결의에 따라 회사가 임의의 목적으로 유보한 임의적립금입니다."
"l10n_kr_350300","350300","Unappropriated Retained Earnings","","equity","Parent account for unappropriated retained earnings.","False","False","","False","l10n_kr_350000","미처분이익잉여금","미처분이익잉여금의 통합 집계 계정입니다."
"l10n_kr_350310","350310","Unappropriated Retained Earnings","","equity","Retained earnings available for dividend distribution.","False","True","","False","l10n_kr_350300","미처분이익잉여금","당기말 현재 배당이나 다른 목적의 적립금으로 아직 처분되지 않은 미처분이익잉여금입니다."
"l10n_kr_350900","350900","Undistributed Profits/Losses","","equity_unaffected","Parent account for current period profits or losses.","False","False","","False","l10n_kr_350000","당기순이익","당기순이익의 통합 집계 계정입니다."
"l10n_kr_350999","350999","Undistributed Profits/Losses","","equity_unaffected","System account capturing current period net income or loss.","False","True","","False","l10n_kr_350900","당기순이익(미처리결손금)","결산 시 시스템에서 당기의 순손익을 집계하여 일시적으로 보관하는 미처리결손금(당기순이익) 계정입니다."
"l10n_kr_401000","401000","Sales of Merchandise","account.account_tag_operating","income","Revenue generated from selling purchased trading merchandise.","False","True","","False","","상품매출","외부에서 매입한 상품을 판매하여 발생한 매출액입니다."
"l10n_kr_402000","402000","Sales of Finished Goods","account.account_tag_operating","income","Revenue generated from selling in-house manufactured finished products.","False","True","","False","","제품매출","자가 제조한 제품을 판매하여 발생한 매출액입니다."
"l10n_kr_403000","403000","Sales of Semi-finished Goods","account.account_tag_operating","income","Revenue from selling partially manufactured semi-finished goods.","False","True","","False","","반제품매출액","제조 과정 중에 있는 반제품을 그대로 외부로 판매하여 발생한 매출액입니다."
"l10n_kr_404000","404000","Sales of By-products","account.account_tag_operating","income","Revenue from selling by-products generated during manufacturing.","False","True","","False","","부산물매출액","주산물의 제조 과정에서 부수적으로 발생하는 부산물을 판매하여 발생한 매출액입니다."
