"id","name","code","account_type","tag_ids","reconcile","non_trade","name@fr"
"pca_1021","Initial net position established","102100","equity","","False","","Première situation nette établie"
"pca_1022","Statutory funds (to be subdivided according to statutes)","102200","equity","","False","","Fonds statutaires (à subdiviser en fonction des statuts)"
"pca_10231","Initial non-consumable endowments","102310","equity","","False","","Dotations non consomptibles initiales"
"pca_10232","Additional non-consumable endowments","102320","equity","","False","","Dotations non consomptibles complémentaires"
"pca_1024","Other equity without right of return","102400","equity","","False","","Autres fonds propres sans droit de reprise"
"pca_1032","Statutory funds (to be subdivided according to statutes)","103200","equity","","False","","Fonds statutaires (à subdiviser en fonction des statuts)"
"pca_1034","Other equity with right of return","103400","equity","","False","","Autres fonds propres avec droit de reprise"
"pca_1051","Revaluation differences on assets without right of return","105100","equity","","False","","Ecarts de réévaluation sur des biens sans droit de reprise"
"pca_1052","Revaluation differences on assets with right of return","105200","equity","","False","","Ecarts de réévaluation sur des biens avec droit de reprise"
"pca_1053","Revaluation reserve","105300","equity","","False","","Réserve de réévaluation"
"pca_1055","Revaluation differences (other legal transactions)","105500","equity","","False","","Écarts de réévaluation (autres opérations légales)"
"pca_1057","Other revaluation differences in France","105700","equity","","False","","Autres écarts de réévaluation en France"
"pca_1058","Other revaluation differences outside France","105800","equity","","False","","Autres écarts de réévaluation à l'étranger"
"pca_10611","Basic legal reserve","106110","equity","","False","","Réserve légale proprement dite"
"pca_10612","Net long-term capital gains","106120","equity","","False","","Plus-values nettes à long terme"
"pca_10641","Net long-term capital gains","106410","equity","","False","","Plus-values nettes à long terme"
"pca_10643","Reserves consequent on award of investment grants","106430","equity","","False","","Réserves consécutives à l'octroi de subventions d'investissement"
"pca_10648","Other tax-regulated reserves","106480","equity","","False","","Autres réserves réglementées"
"pca_10681","Self-insurance reserve","106810","equity","","False","","Réserve de propre assureur"
"pca_10688","Sundry reserves","106880","equity","","False","","Réserves diverses"
"pca_1081","Consumable endowments","108100","equity","","False","","Dotations consomptibles"
"pca_1089","Consumable endowments recorded in income statement","108900","equity","","False","","Dotations consomptibles inscrites au compte de résultat"
"pca_1311","Equipment grants - State","131100","equity","","False","","Subventions d'équipement - État"
"pca_1312","Equipment grants - Regions","131200","equity","","False","","Subventions d'équipement - Régions"
"pca_1313","Equipment grants - Departments","131300","equity","","False","","Subventions d'équipement - Départements"
"pca_1314","Equipment grants - Municipalities","131400","equity","","False","","Subventions d'équipement - Communes"
"pca_1315","Equipment grants - Public authorities","131500","equity","","False","","Subventions d'équipement - Collectivités publiques"
"pca_1316","Equipment grants - Public enterprises","131600","equity","","False","","Subventions d'équipement - Entreprises publiques"
"pca_1317","Equipment grants - Enterprises and private bodies","131700","equity","","False","","Subventions d'équipement - Entreprises et organismes privés"
"pca_1318","Equipment grants - Other","131800","equity","","False","","Subventions d'équipement - Autres"
"pca_138","Other investment grants (same allocation as for Account 131)","138000","equity","","False","","Autres subventions d'investissement (même ventilation que celle du compte 131)"
"pca_13911","Investment grants credited to the profit and loss account - State","139110","equity","","False","","Subventions d'équipement inscrites au compte de résultat - État"
"pca_13912","Investment grants credited to the profit and loss account - Regions","139120","equity","","False","","Subventions d'équipement inscrites au compte de résultat - Régions"
"pca_13913","Investment grants credited to the profit and loss account - Departments","139130","equity","","False","","Subventions d'équipement inscrites au compte de résultat - Départements"
"pca_13914","Investment grants credited to the profit and loss account - Municipalities","139140","equity","","False","","Subventions d'équipement inscrites au compte de résultat - Communes"
"pca_13915","Investment grants credited to the profit and loss account - Public authorities","139150","equity","","False","","Subventions d'équipement inscrites au compte de résultat - Collectivités publiques"
"pca_13916","Investment grants credited to the profit and loss account - Public enterprises","139160","equity","","False","","Subventions d'équipement inscrites au compte de résultat - Entreprises publiques"
"pca_13917","Investment grants credited to the profit and loss account - Enterprises and private bodies","139170","equity","","False","","Subventions d'équipement inscrites au compte de résultat - Entreprises et organismes privés"
"pca_13918","Investment grants credited to the profit and loss account - Other","139180","equity","","False","","Subventions d'équipement inscrites au compte de résultat - Autres"
"pca_1398","Other investment grants (same location as for Account 1391)","139800","equity","","False","","Autres subventions d'investissement (même ventilation que celle du compte 1391)"
"pca_1423","Provisions for reconstitution of mining and petroleum deposits","142300","liability_non_current","","False","","Provisions reconstitution des gisements miniers et pétroliers"
"pca_1424","Provisions for investment (employee profit share)","142400","liability_non_current","","False","","Provisions pour investissement (participation des salariés)"
"pca_1431","Regulated provisions for inventories - Price increase","143100","liability_non_current","","False","","Provisions réglementées relatives aux stocks - Hausse de prix"
"pca_1432","Regulated provisions for inventories - Exchange rate fluctuations","143200","liability_non_current","","False","","Provisions réglementées relatives aux stocks - Fluctuation des cours"
"pca_144","Tax-regulated provisions relating to other asset components","144000","liability_non_current","","False","","Provisions réglementées relatives aux autres éléments de l'actif"
"pca_146","Special revaluation provision","146000","liability_non_current","","False","","Provision spéciale de réévaluation"
"pca_147","Capital gains reinvested","147000","liability_non_current","","False","","Plus-values réinvesties"
"pca_1513","Provisions for losses on futures","151300","liability_non_current","","False","","Provisions pour pertes sur marchés à terme"
"pca_152","Provisions for expenses on legacies or donations","152000","equity","","False","","Provisions pour charges sur legs ou donations"
"pca_153","Provisions for pensions and similar obligations","153000","liability_non_current","","False","","Provisions pour pensions et obligations similaires"
"pca_154","Provisions for restructuring","154000","liability_non_current","","False","","Provisions pour restructurations"
"pca_155","Provisions for taxation","155000","liability_non_current","","False","","Provisions pour impôts"
"pca_156","Provisions for fixed asset renewal (concession entities)","156000","liability_non_current","","False","","Provisions pour renouvellement des immobilisations (entreprises concessionnaires)"
"pca_157","Provisions for deferred charges","157000","liability_non_current","","False","","Provisions pour charges à répartir sur plusieurs exercices"
"pca_1572","Provisions for expenses to be spread over several years - Major maintenance or overhauls","157200","liability_non_current","","False","","Provisions pour charges à répartir sur plusieurs exercices - Gros entretien ou grandes révisions"
"pca_1581","Provisions for remediation","158100","liability_non_current","","False","","Provisions pour remises en état"
"pca_1631","Associate securities and similar","163100","equity","","False","","Titres associatifs et assimilés"
"pca_16881","Accrued interest on convertible debenture loans","168810","liability_non_current","","False","","Intérêts courus sur emprunts obligataires convertibles"
"pca_16883","Accrued interest on other debenture loans","168830","liability_non_current","","False","","Intérêts courus sur autres emprunts obligataires"
"pca_16884","Accrued interest on loans from credit institutions","168840","liability_non_current","","False","","Intérêts courus sur emprunts auprès des établissements de crédit"
"pca_16885","Accrued interest on deposits and sureties received","168850","liability_non_current","","False","","Intérêts courus sur dépôts et cautionnements reçus"
"pca_16886","Accrued interest on employee profit share","168860","liability_non_current","","False","","Intérêts courus sur participation des salariés aux résultats"
"pca_16887","Accrued interest on loans and debts payable subject to particular conditions","168870","liability_non_current","","False","","Intérêts courus sur emprunts et dettes assortis de conditions particulières"
"pca_16888","Accrued interest on other loans and similar debts payable","168880","liability_non_current","","False","","Intérêts courus sur autres emprunts et dettes assimilées"
"pca_1781","Debts payable related to joint ventures - Principal","178100","liability_non_current","","False","","Dettes rattachées à des sociétés en participation - Principal"
"pca_1788","Debts payable related to joint ventures - Accrued interest","178800","liability_non_current","","False","","Dettes rattachées à des sociétés en participation - Intérêts courus"
"pca_1911","Legacies or donations","191100","equity","","False","","Legs ou donations"
"pca_1912","Temporary usufruct donations","191200","equity","","False","","Donations temporaires d'usufruit"
"pca_194","Dedicated funds from operating grants","194000","equity","","False","","Fonds dédiés sur subventions d'exploitation"
"pca_195","Dedicated funds from financial contributions from other organizations","195000","equity","","False","","Fonds dédiés sur contributions financières d'autres organismes"
"pca_196","Dedicated funds from public generosity resources","196000","equity","","False","","Fonds dédiés sur ressources liées à la générosité du public"
"pca_203","R&D Costs","203000","asset_fixed","","False","","Coûts de R&D"
"pca_204","Temporary usufruct donations","204000","equity","","False","","Donations temporaires d'usufruit"
"pca_205","Intangible Rights","205000","asset_fixed","","False","","Droits intangibles"
"pca_206","Lease Premium","206000","asset_fixed","","False","","Droit au bail"
"pca_207","Goodwill","207000","asset_fixed","","False","","Fonds commercial"
"pca_208","Other intangible fixed assets","208000","asset_fixed","","False","","Autres immobilisations incorporelles"
"pca_21151","Property, plant and equipment - Built-up land - Industrial property complexes (A, B...)","211510","asset_fixed","","False","","Immobilisations corporelles - Terrains bâtis - Ensembles immobiliers industriels"
"pca_21155","Property, plant and equipment - Built-up land - Administrative and commercial property complexes (A, B...)","211550","asset_fixed","","False","","Immobilisations corporelles - Terrains bâtis - Ensembles immobiliers administratifs et commerciaux"
"pca_21158","Other property complexes","211580","asset_fixed","","False","","Autres ensembles immobiliers"
"pca_211581","Intangible fixed assets - Property assigned to normal entity operations (A, B...)","211581","asset_fixed","","False","","Immobilisations corporelles - Terrains bâtis affectés aux opérations professionnelles"
"pca_211588","Intangible fixed assets - Property assigned to other than normal entity operations (A, B...)","211588","asset_fixed","","False","","Immobilisations corporelles - Terrains bâtis affectés aux opérations non professionnelles"
"pca_2116","Intangible fixed assets - Suspense account for nondepreciable fixed assets","211600","asset_fixed","","False","","Immobilisations corporelles - Compte d'ordre sur immobilisations"
"pca_212","Site Development","212000","asset_fixed","","False","","Développement du site"
"pca_21311","Intangible fixed assets - Buildings - Industrial property complexes","213110","asset_fixed","","False","","Immobilisations corporelles - Bâtiments - Ensembles immobiliers industriels"
"pca_21315","Intangible fixed assets - Buildings - Administrative and commercial property complexes","213150","asset_fixed","","False","","Immobilisations corporelles - Bâtiments - Ensembles immobiliers administratifs et commerciaux"
"pca_213181","Intangible fixed assets - Property assigned to normal entity operations","213181","asset_fixed","","False","","Immobilisations corporelles - Bâtiments affectés aux opérations professionnelles"
"pca_213188","Intangible fixed assets - Property assigned to other than normal entity operations","213188","asset_fixed","","False","","Immobilisations corporelles - Bâtiments affectés aux opérations non professionnelles"
"pca_21351","Industrial properties (A, B)","213510","asset_fixed","","False","","Ensembles immobiliers industriels (A, B)"
"pca_21355","Administrative and commercial real estate complexes (A, B)","213550","asset_fixed","","False","","Ensembles immobiliers administratifs et commerciaux (A, B)"
"pca_213581","Administrative and commercial buildings (A, B)","213581","asset_fixed","","False","","Affectés aux opérations professionnelles (A, B)"
"pca_213588","Allocated to non-business operations (A, B)","213588","asset_fixed","","False","","Affectés aux opérations non professionnelles (A, B)"
"pca_21381","Intangible fixed assets - Infrastructure development - Roadways","213810","asset_fixed","","False","","Immobilisations corporelles - Ouvrages d'infrastructure - Voies de terre"
"pca_21382","Intangible fixed assets - Infrastructure development - Railways","213820","asset_fixed","","False","","Immobilisations corporelles - Ouvrages d'infrastructure - Voies de fer"
"pca_21383","Intangible fixed assets - Infrastructure development - Water channels","213830","asset_fixed","","False","","Immobilisations corporelles - Ouvrages d'infrastructure - Voies d'eau"
"pca_21384","Intangible fixed assets - Infrastructure development - Dams","213840","asset_fixed","","False","","Immobilisations corporelles - Ouvrages d'infrastructure - Barrages"
"pca_21385","Intangible fixed assets - Infrastructure development - Airfields","213850","asset_fixed","","False","","Immobilisations corporelles - Ouvrages d'infrastructure - Pistes d'aérodromes"
"pca_214","3rd Party Constructions","214000","asset_fixed","","False","","Constructions tierces"
"pca_2312","Fixed assets in progress - Land","231200","asset_fixed","","False","","Immobilisations corporelles en cours - Terrains"
"pca_2313","Fixed assets in progress - Constructions","231300","asset_fixed","","False","","Immobilisations corporelles en cours - Constructions"
"pca_2315","Fixed assets in progress - Technical installations, plant and machinery, equipment and fixtures","231500","asset_fixed","","False","","Immobilisations corporelles en cours - Installations techniques matériel et outillage industriels"
"pca_2318","Other tangible fixed assets","231800","asset_fixed","","False","","Autres immobilisations corporelles"
"pca_2382","Payments on account on orders for tangible fixed assets - Land","238200","asset_fixed","","False","","Avances et acomptes versés sur commandes d'immobilisations corporelles - Terrains"
"pca_2383","Payments on account on orders for tangible fixed assets - Constructions","238300","asset_fixed","","False","","Avances et acomptes versés sur commandes d'immobilisations corporelles - Constructions"
"pca_2385","Payments on account on orders for tangible fixed assets - Technical installations, plant and machinery, equipment and fixtures","238500","asset_fixed","","False","","Avances et acomptes versés sur commandes d'immobilisations corporelles - Installations techniques matériel et outillage industriels"
"pca_2388","Payments on account on orders for tangible fixed assets - Other tangible fixed assets","238800","asset_fixed","","False","","Avances et acomptes versés sur commandes d'immobilisations corporelles - Autres immobilisations corporelles"
"pca_24","Assets received through legacies or donations intended for sale","240000","equity","","False","","Biens reçus par legs ou donations destinés à être cédés"
"pca_25","Shares in and receivables due from affiliated entities","250000","asset_fixed","","False","","Parts dans des entreprises liées et créances sur des entreprises liées"
"pca_2804","Temporary usufruct donations","280400","equity","","False","","Donations temporaires d'usufruit"
"pca_294","Impairment of assets received through legacies or donations intended for sale","294000","equity","","False","","Dépréciationsdes biens reçus par legs ou donations destinés à être cédés"
"pca_311","Materials (or group) A","311000","asset_current","","False","","Matières premières (ou groupe) A"
"pca_312","Materials (or group) B","312000","asset_current","","False","","Matières premières (ou groupe) B"
"pca_317","Supplies A, B, C, ...","317000","asset_current","","False","","Fournitures A, B, C, ..."
"pca_3211","Materials (or group) C","321100","asset_current","","False","","Matières consommables (ou groupe) C"
"pca_3212","Materials (or group) D","321200","asset_current","","False","","Matières consommables (ou groupe) D"
"pca_3311","Products in progress P 1","331100","asset_current","","False","","Produit en cours P 1"
"pca_3312","Products in progress P 2","331200","asset_current","","False","","Produit en cours P 2"
"pca_3351","Works in progress T 1","335100","asset_current","","False","","Travaux en cours T 1"
"pca_3352","Works in progress T 2","335200","asset_current","","False","","Travaux en cours T 2"
"pca_3411","Project studies in progress E 1","341100","asset_current","","False","","Études en cours E 1"
"pca_3412","Project studies in progress E 2","341200","asset_current","","False","","Études en cours E 2"
"pca_3451","Supply of services in progress S 1","345100","asset_current","","False","","Prestations de services en cours S 1"
"pca_3452","Supply of services in progress S 2","345200","asset_current","","False","","Prestations de services en cours S 2"
"pca_3511","Semi-finished products (or group) A","351100","asset_current","","False","","Stocks produits intermédiaires (ou groupe) A"
"pca_3512","Semi-finished products (or group) B","351200","asset_current","","False","","Stocks produits intermédiaires (ou groupe) B"
"pca_3551","Finished products (or group) A","355100","asset_current","","False","","Ventes de produits finis (ou groupe) A"
"pca_3552","Finished products (or group) B","355200","asset_current","","False","","Ventes de produits finis (ou groupe) B"
"pca_371","Stocks of goods (or group) A","371000","asset_current","","False","","Stocks de marchandises (ou groupe) A"
"pca_372","Stocks of goods (or group) B","372000","asset_current","","False","","Stocks de marchandises (ou groupe) B"
"pca_3911","Provisions for depreciation of materials (or group) A","391100","asset_current","","False","","Provisions pour dépréciation des matières premières (ou groupe) A"
"pca_3912","Provisions for depreciation of materials (or group) B","391200","asset_current","","False","","Provisions pour dépréciation des matières premières (ou groupe) B"
"pca_3917","Provisions for depreciation of supplies A, B, C, ...","391700","asset_current","","False","","Provisions pour dépréciation des fournitures A, B, C, ..."
"pca_3921","Provisions for depreciation of consumable materials (same allocation as for Account 321)","392100","asset_current","","False","","Provisions pour dépréciation des matières consommables (même ventilation que celle du compte 321)"
"pca_3922","Provisions for depreciation of consumable supplies (same allocation as for Account 322)","392200","asset_current","","False","","Provisions pour dépréciation des fournitures consommables (même ventilation que celle du compte 322)"
"pca_3926","Provisions for depreciation of packaging (same allocation as for Account 326)","392600","asset_current","","False","","Provisions pour dépréciation des emballages (même ventilation que celle du compte 326)"
"pca_3931","Provisions for depreciation of products in progress (same allocation as for Account 331)","393100","asset_current","","False","","Provisions pour dépréciation des produits en cours (même ventilation que celle du compte 331)"
"pca_3935","Provisions for depreciation of works in progress (same allocation as for Account 335)","393500","asset_current","","False","","Provisions pour dépréciation des travaux en cours (même ventilation que celle du compte 335)"
"pca_3941","Provisions for depreciation of project studies in progress (same allocation as for Account 341)","394100","asset_current","","False","","Provisions pour dépréciation des études en cours (même ventilation que celle du compte 341)"
"pca_3945","Provisions for depreciation of supply of services in progress (same allocation as for Account 345)","394500","asset_current","","False","","Provisions pour dépréciation des prestations de services en cours (même ventilation que celle du compte 345)"
"pca_3951","Provisions for depreciation of semi-finished products (same allocation as for Account 351)","395100","asset_current","","False","","Provisions pour dépréciation des produits intermédiaires (même ventilation que celle du compte 351)"
"pca_3955","Provisions for depreciation of finished products (same allocation as for Account 355)","395500","asset_current","","False","","Provisions pour dépréciation des produits finis (même ventilation que celle du compte 355)"
"pca_3971","Provisions for depreciation of goods for resale (or group) A","397100","asset_current","","False","","Provisions pour dépréciation des stocks de marchandises (ou groupe) A"
"pca_3972","Provisions for depreciation of goods for resale (or group) B","397200","asset_current","","False","","Provisions pour dépréciation des stocks de marchandises (ou groupe) B"
"pca_4287","Personnel - Accrued income receivable","428700","asset_current","","True","","Personnel - Produits à recevoir"
"pca_4387","Accrued income receivable","438700","asset_current","","True","","Produits à recevoir"
"pca_4411","State - Grants receivable - Investment grants","441100","asset_current","","True","","État - Subventions à recevoir - Subventions d'investissement"
"pca_4417","State - Grants receivable - Operating grants","441700","asset_current","","True","","État - Subventions à recevoir - Subventions d'exploitation"
"pca_4418","State - Grants receivable - Deficit grants","441800","asset_current","","True","","État - Subventions à recevoir - Subventions d'équilibre"
"pca_4419","State - Grants receivable - Grant advances","441900","asset_current","","True","","État - Subventions à recevoir - Avances sur subventions"
"pca_4424","State - Taxes and levies recoverable from third parties - Bondholders","442400","liability_current","","True","","État - Impôts et taxes recouvrables sur des tiers - Obligataires"
"pca_4425","State - Taxes and levies recoverable from third parties - Partners/associates","442500","liability_current","","True","","État - Impôts et taxes recouvrables sur des tiers - Associés"
"pca_4431","Debts receivable from the state resulting from abolition of the rule relating to delay of one month in value added tax","443100","asset_current","","True","","Créances sur l'État résultant de la suppression de la règle du décalage d'un mois en matière de TVA"
"pca_4438","State - Accrued interest on debts receivable recorded in Account 4431","443800","asset_current","","True","","État - Intérêts courus sur créances figurant au compte 4431"
"pca_44582","Advance payments - Flat rate system","445820","asset_current","","True","","Acomptes - Régime du forfait"
"pca_4486","State - Accrued charges payable","448600","liability_current","","True","","État - Charges à payer"
"pca_4487","State - Accrued income receivable","448700","asset_current","","True","","État - Produits à recevoir"
"pca_461","Receivables from legacies or donations","461000","equity","","False","","Créances reçues par legs ou donations"
"pca_466","Debts from legacies or donations","466000","equity","","False","","Dettes des legs ou donations"
"pca_4681","Volunteer expenses","468100","equity","","False","","Frais des bénévoles"
"pca_4686","Accrued charges payable","468600","liability_current","","True","","Charges à payer"
"pca_4687","Accrued income receivable","468700","asset_current","","True","","Produits à recevoir"
"pca_474","Suspense accounts","474000","asset_current","","True","","Compte d'attente"
"pca_475","Suspense accounts","475000","asset_current","","True","","Compte d'attente"
"pca_4816","Deferred charges - Loan issue costs","481600","asset_current","","True","","Charges à répartir sur plusieurs exercices - Frais d'émission des emprunts"
"pca_501","Marketable securities - Shares in affiliated companies","501000","asset_cash","","False","","Valeurs mobilières de placement - Parts dans entreprises liées"
"pca_515","Treasury and public agency accounts","515000","asset_cash","","False","","Caisses du Trésor et des établissements publics"
