"id","name","code","account_type","tag_ids","reconcile","name@fr"
"pca_2185","Intangible fixed assets - Livestock","218500","asset_fixed","","False","Immobilisations corporelles - Cheptel"
"pca_2186","Intangible fixed assets - Recoverable packaging","218600","asset_fixed","","False","Immobilisations corporelles - Emballages récupérables"
"pca_2187","Merger malpractice on tangible assets","218700","asset_fixed","","False","Mali de fusions sur actifs corporels"
"pca_22","Fixed assets in concession","220000","asset_fixed","","False","Immobilisations mises en concession"
"pca_2312","Fixed assets in progress - Land","231200","asset_fixed","","False","Immobilisations corporelles en cours - Terrains"
"pca_2313","Fixed assets in progress - Constructions","231300","asset_fixed","","False","Immobilisations corporelles en cours - Constructions"
"pca_2315","Fixed assets in progress - Technical installations, plant and machinery, equipment and fixtures","231500","asset_fixed","","False","Immobilisations corporelles en cours - Installations techniques matériel et outillage industriels"
"pca_2318","Other tangible fixed assets","231800","asset_fixed","","False","Autres immobilisations corporelles"
"pca_232","Intangible fixed assets in progress","232000","asset_fixed","","False","Dépréciations des immobilisations incorporelles en cours"
"pca_237","Payments on account on intangible fixed assets","237000","asset_fixed","","False","Avances et acomptes versés sur commandes d'immobilisations incorporelles"
"pca_2382","Payments on account on orders for tangible fixed assets - Land","238200","asset_fixed","","False","Avances et acomptes versés sur commandes d'immobilisations corporelles - Terrains"
"pca_2383","Payments on account on orders for tangible fixed assets - Constructions","238300","asset_fixed","","False","Avances et acomptes versés sur commandes d'immobilisations corporelles - Constructions"
"pca_2385","Payments on account on orders for tangible fixed assets - Technical installations, plant and machinery, equipment and fixtures","238500","asset_fixed","","False","Avances et acomptes versés sur commandes d'immobilisations corporelles - Installations techniques matériel et outillage industriels"
"pca_2388","Payments on account on orders for tangible fixed assets - Other tangible fixed assets","238800","asset_fixed","","False","Avances et acomptes versés sur commandes d'immobilisations corporelles - Autres immobilisations corporelles"
"pca_24","Assets received through legacies or donations intended for sale","240000","equity","","False","Biens reçus par legs ou donations destinés à être cédés"
"pca_25","Shares in and receivables due from affiliated entities","250000","asset_fixed","","False","Parts dans des entreprises liées et créances sur des entreprises liées"
"pca_2611","Long-term equity interests - Shares","261100","asset_fixed","","False","Titres de participation - Actions"
"pca_2618","Other securities","261800","asset_fixed","","False","Autres valeurs mobilières de placement"
"pca_266","Other categories of participating interest","266000","asset_fixed","","False","Autres formes de participation"
"pca_2661","Rights to net assets placed in trust","266100","asset_fixed","","False","Droits représentatifs d’actifs nets remis en fiducie"
"pca_2671","Debts receivable related to participating interests (group)","267100","asset_fixed","","False","Créances rattachées à des participations (groupe)"
"pca_2674","Debts receivable related to participating interests (apart from group)","267400","asset_fixed","","False","Créances rattachées à des participations (hors groupe)"
"pca_2675","Payments representing non-capitalised contributions (call for funds)","267500","asset_fixed","","False","Versements représentatifs d'apports non capitalisés (appel de fonds)"
"pca_2676","Long-term capital advances","267600","asset_fixed","","False","Avances consolidables"
"pca_2677","Other debts receivable related to participating interests","267700","asset_fixed","","False","Autres créances rattachées à des participations"
"pca_2678","Accrued interest","267800","asset_fixed","","False","Intérêts courus"
"pca_2681","Debts receivable related to joint ventures - Principal","268100","asset_fixed","","False","Créances rattachées à des sociétés en participation - Principal"
"pca_2688","Debts receivable related to joint ventures - Accrued interest","268800","asset_fixed","","False","Créances rattachées à des sociétés en participation - Intérêts courus"
"pca_269","Unpaid instalments on unpaid long-term equity interests","269000","asset_fixed","","False","Versements restant à effectuer sur titres de participation non libérés"
"pca_2711","Long-term investment equity securities other than portfolio long-term investment equity securities - Shares","271100","asset_fixed","","False","Titres immobilisés autres que les titres immobilisés de l'activité de portefeuille - Actions"
"pca_2718","Long-term investment equity securities other than portfolio long-term investment equity securities - Other securities","271800","asset_fixed","","False","Titres immobilisés autres que les titres immobilisés de l'activité de portefeuille - Autres titres"
"pca_2721","Long-term investment debt securities - Bonds","272100","asset_fixed","","False","Titres immobilisés - Obligations"
"pca_2722","Long-term investment debt securities - Warrants","272200","asset_fixed","","False","Titres immobilisés - Bons"
"pca_273","Portfolio long-term investment securities","273000","asset_fixed","","False","Titres immobilisés de l'activité de portefeuille"
"pca_2741","Participating loans","274100","asset_fixed","","True","Prêts participatifs"
"pca_2742","Loans to partners","274200","asset_fixed","","True","Prêts aux partenaires"
"pca_2743","Loans to personnel","274300","asset_fixed","","True","Prêts au personnel"
"pca_2748","Other loans","274800","asset_fixed","","True","Autres prêts"
"pca_2751","Deposits","275100","asset_fixed","","True","Dépôts"
"pca_2755","Sureties","275500","asset_fixed","","True","Cautionnements"
"pca_2761","Other capitalised debts receivable - Sundry debts receivable","276100","asset_fixed","","False","Autres créances immobilisées - Créances diverses"
"pca_27682","Other capitalised debts receivable - Accrued interest on long-term investment debt securities","276820","asset_fixed","","False","Autres créances immobilisées - Intérêts courus sur titres immobilisés (droits de créance)"
"pca_27684","Other capitalised debts receivable - Accrued interest on loans","276840","asset_fixed","","False","Autres créances immobilisées - Intérêts courus sur prêts"
"pca_27685","Other capitalised debts receivable - Accrued interest on deposits and sureties","276850","asset_fixed","","False","Autres créances immobilisées - Intérêts courus sur dépôts et cautionnements"
"pca_27688","Other capitalised debts receivable - Accrued interest on sundry debts receivable","276880","asset_fixed","","False","Autres créances immobilisées - Intérêts courus sur créances diverses"
"pca_2771","Own shares","277100","asset_fixed","","False","Actions propres ou parts propres"
"pca_2772","Own shares in process of cancellation","277200","asset_fixed","","False","Actions propres ou parts propres en voie d'annulation"
"pca_278","Merger loss on financial assets","278000","asset_fixed","","False","Mali de fusion sur actifs financiers"
"pca_279","Unpaid instalments on unpaid long-term investment securities","279000","asset_fixed","","False","Versements restant à effectuer sur titres immobilisés non libérés"
"pca_2801","Depreciation on intangible fixed assets - Establishment costs (same allocation as for Account 201)","280100","asset_fixed","","False","Amortissements des immobilisations incorporelles - Frais d'établissement (même ventilation que celle du compte 201)"
"pca_2803","Depreciation on intangible fixed assets - Research and development costs","280300","asset_fixed","","False","Amortissements des immobilisations incorporelles - Frais de recherche et de développement"
"pca_2804","Temporary usufruct donations","280400","equity","","False","Donations temporaires d’usufruit"
"pca_2805","Depreciation on intangible fixed assets - Concessions and similar rights, patents, licences, software, rights and similar assets","280500","asset_fixed","","False","Amortissements des immobilisations incorporelles - Concessions et droits similaires, brevets, licences, logiciels, droits et valeurs similaires"
"pca_2807","Depreciation on intangible fixed assets - Goodwill","280700","asset_fixed","","False","Amortissements des immobilisations incorporelles - Fonds commercial"
"pca_2808","Other intangible fixed assets","280800","asset_fixed","","False","Dépréciations des autres immobilisations incorporelles"
"pca_28081","Amortisation of merger loss on intangible assets","280810","asset_fixed","","False","Amortissements du mali de fusion sur actifs incorporels"
"pca_2812","Depreciation on tangible fixed assets - Site development (same allocation as for Account 212)","281200","asset_fixed","","False","Amortissements des immobilisations corporelles - Agencements aménagements de terrains (même ventilation que celle du compte 212)"
"pca_2813","Depreciation on tangible fixed assets - Constructions (same allocation as for Account 213)","281300","asset_fixed","","False","Amortissements des immobilisations corporelles - Constructions (même ventilation que celle du compte 213)"
"pca_2814","Depreciation on tangible fixed assets - Constructions on third-party site (same allocation as for Account 214)","281400","asset_fixed","","False","Amortissements des immobilisations corporelles - Constructions sur sol d'autrui (même ventilation que celle du compte 214)"
"pca_2815","Depreciation on tangible fixed assets - Installations matériel et outillage industriels (même ventilation que celle du compte 215)","281500","asset_fixed","","False","Amortissements des immobilisations corporelles - Installations matériel et outillage industriels (même ventilation que celle du compte 215)"
"pca_2818","Other tangible fixed assets (same allocation as for Account 218)","281800","asset_fixed","","False","Amortissements des autres immobilisations corporelles (même ventilation que celle du compte 218)"
"pca_28187","Amortization of merger loss on tangible assets","281870","asset_fixed","","False","Amortissement du mali de fusion sur actifs corporels"
"pca_282","Depreciation on fixed assets in concession","282000","asset_fixed","","False","Amortissements des immobilisations mises en concession"
"pca_2905","Depreciation on tangible fixed assets - Trade marks, processes, rights and similar assets","290500","asset_fixed","","False","Dépréciations des immobilisations incorporelles - Marques, procédés, droits et valeurs similaires"
"pca_2906","Depreciation on tangible fixed assets - Lease premium","290600","asset_fixed","","False","Dépréciations des immobilisations incorporelles - Droit au bail"
"pca_2907","Depreciation on tangible fixed assets - Goodwill","290700","asset_fixed","","False","Dépréciations des immobilisations incorporelles - Fonds commercial"
"pca_2908","Other intangible fixed assets","290800","asset_fixed","","False","Dépréciations des autres immobilisations incorporelles"
"pca_29081","Impairment of merger loss on intangible assets","290810","asset_fixed","","False","Dépréciation du mali de fusion sur actifs incorporels"
"pca_29187","Impairment of merger loss on tangible assets","291870","asset_fixed","","False","Dépréciation du mali de fusion sur actifs corporels"
"pca_292","Provisions for diminution in value of fixed assets in concession","292000","asset_fixed","","False","Dépréciations des immobilisations mises en concession"
"pca_2931","Tangible fixed assets in progress","293100","asset_fixed","","False","Immobilisations corporelles en cours"
"pca_2932","Intangible fixed assets in progress","293200","asset_fixed","","False","Dépréciations des immobilisations incorporelles en cours"
"pca_294","Impairment of assets received through legacies or donations intended for sale","294000","equity","","False","Dépréciationsdes biens reçus par legs ou donations destinés à être cédés"
"pca_2961","Provisions for depreciation of long-term equity interests","296100","asset_fixed","","False","Provisions pour dépréciation des titres de participation"
"pca_2966","Provisions for depreciation of other forms of participation","296600","asset_fixed","","False","Provisions pour dépréciation des autres formes de participation"
"pca_2967","Provisions for depreciation of debts receivable related to participating interests (same allocation as for Account 267)","296700","asset_fixed","","False","Provisions pour dépréciation des créances rattachées à des participations (même ventilation que celle du compte 267)"
"pca_2968","Provisions for depreciation of debts receivable related to joint ventures (same allocation as for Account 268)","296800","asset_fixed","","False","Provisions pour dépréciation des créances rattachées à des sociétés en participation (même ventilation que celle du compte 268)"
"pca_2971","Provisions for depreciation of long-term investment equity securities other than portfolio long-term equity investment securities (same allocation as for Account 271)","297100","asset_fixed","","False","Provisions pour dépréciation des titres immobilisés autres que les titres immobilisés de l'activité de portefeuille - droit de propriété (ventilation : 271)"
"pca_2972","Provisions for depreciation of long-term investment debt securities (same allocation as for Account 272)","297200","asset_fixed","","False","Provisions pour dépréciation des titres immobilisés - droit de créance (même ventilation que celle du compte 272)"
"pca_2973","Provisions for depreciation of portfolio long-term investment securities","297300","asset_fixed","","False","Provisions pour dépréciation des titres immobilisés de l'activité de portefeuille"
"pca_2974","Provisions for depreciation of loans (same allocation as for Account 274)","297400","asset_fixed","","False","Provisions pour dépréciation des prêts (même ventilation que celle du compte 274)"
"pca_2975","Provisions for depreciation of deposits and sureties advanced (same allocation as for Account 275)","297500","asset_fixed","","False","Provisions pour dépréciation des dépôts et cautionnements versés (même ventilation que celle du compte 275)"
"pca_2976","Provisions for depreciation of Other debts receivable (same allocation as for Account 276)","297600","asset_fixed","","False","Provisions pour dépréciation des autres créances immobilisées (même ventilation que celle du compte 276)"
"pca_29787","Impairment of merger loss on financial assets","297870","asset_fixed","","False","Dépréciation du mali de fusion sur actifs financiers"
"pca_311","Materials (or group) A","311000","asset_current","","False","Matières premières (ou groupe) A"
"pca_312","Materials (or group) B","312000","asset_current","","False","Matières premières (ou groupe) B"
"pca_317","Supplies A, B, C, ...","317000","asset_current","","False","Fournitures A, B, C, ..."
"pca_3211","Materials (or group) C","321100","asset_current","","False","Matières consommables (ou groupe) C"
"pca_3212","Materials (or group) D","321200","asset_current","","False","Matières consommables (ou groupe) D"
"pca_3221","Fuels","322100","asset_current","","False","Combustibles"
"pca_3222","Cleaning products","322200","asset_current","","False","Produits d'entretien"
"pca_3223","Workshop and factory supplies","322300","asset_current","","False","Fournitures d'atelier et d'usine"
"pca_3224","Store supplies","322400","asset_current","","False","Fournitures de magasin"
"pca_3225","Office supplies","322500","asset_current","","False","Fournitures de bureau"
"pca_3261","Non-returnable packaging","326100","asset_current","","False","Emballages perdus"
"pca_3265","Unidentifiable recoverable packaging","326500","asset_current","","False","Emballages récupérables non identifiables"
"pca_3267","Mixed usage packaging","326700","asset_current","","False","Emballages à usage mixte"
"pca_3311","Products in progress P 1","331100","asset_current","","False","Produit en cours P 1"
"pca_3312","Products in progress P 2","331200","asset_current","","False","Produit en cours P 2"
"pca_3351","Works in progress T 1","335100","asset_current","","False","Travaux en cours T 1"
"pca_3352","Works in progress T 2","335200","asset_current","","False","Travaux en cours T 2"
"pca_3411","Project studies in progress E 1","341100","asset_current","","False","Études en cours E 1"
"pca_3412","Project studies in progress E 2","341200","asset_current","","False","Études en cours E 2"
"pca_3451","Supply of services in progress S 1","345100","asset_current","","False","Prestations de services en cours S 1"
"pca_3452","Supply of services in progress S 2","345200","asset_current","","False","Prestations de services en cours S 2"
"pca_3511","Semi-finished products (or group) A","351100","asset_current","","False","Stocks produits intermédiaires (ou groupe) A"
"pca_3512","Semi-finished products (or group) B","351200","asset_current","","False","Stocks produits intermédiaires (ou groupe) B"
"pca_3551","Finished products (or group) A","355100","asset_current","","False","Ventes de produits finis (ou groupe) A"
"pca_3552","Finished products (or group) B","355200","asset_current","","False","Ventes de produits finis (ou groupe) B"
"pca_3581","Residual products - Waste","358100","asset_current","","False","Stocks produits résiduels - Déchets"
"pca_3585","Residual products - Refuse","358500","asset_current","","False","Stocks produits résiduels - Rebuts"
"pca_3586","Residual products - Recoverable materials","358600","asset_current","","False","Stocks produits résiduels - Matières de récupération"
"pca_36","Stocks from fixed assets","360000","asset_current","","False","Stocks provenant d'immobilisations"
"pca_371","Stocks of goods (or group) A","371000","asset_current","","False","Stocks de marchandises (ou groupe) A"
"pca_372","Stocks of goods (or group) B","372000","asset_current","","False","Stocks de marchandises (ou groupe) B"
"pca_38","Stocks in transit","380000","asset_current","","False","Stocks en voie d'acheminement"
"pca_3911","Provisions for depreciation of materials (or group) A","391100","asset_current","","False","Provisions pour dépréciation des matières premières (ou groupe) A"
"pca_3912","Provisions for depreciation of materials (or group) B","391200","asset_current","","False","Provisions pour dépréciation des matières premières (ou groupe) B"
"pca_3917","Provisions for depreciation of supplies A, B, C, ...","391700","asset_current","","False","Provisions pour dépréciation des fournitures A, B, C, ..."
"pca_3921","Provisions for depreciation of consumable materials (same allocation as for Account 321)","392100","asset_current","","False","Provisions pour dépréciation des matières consommables (même ventilation que celle du compte 321)"
"pca_3922","Provisions for depreciation of consumable supplies (same allocation as for Account 322)","392200","asset_current","","False","Provisions pour dépréciation des fournitures consommables (même ventilation que celle du compte 322)"
"pca_3926","Provisions for depreciation of packaging (same allocation as for Account 326)","392600","asset_current","","False","Provisions pour dépréciation des emballages (même ventilation que celle du compte 326)"
"pca_3931","Provisions for depreciation of products in progress (same allocation as for Account 331)","393100","asset_current","","False","Provisions pour dépréciation des produits en cours (même ventilation que celle du compte 331)"
"pca_3935","Provisions for depreciation of works in progress (same allocation as for Account 335)","393500","asset_current","","False","Provisions pour dépréciation des travaux en cours (même ventilation que celle du compte 335)"
"pca_3941","Provisions for depreciation of project studies in progress (same allocation as for Account 341)","394100","asset_current","","False","Provisions pour dépréciation des études en cours (même ventilation que celle du compte 341)"
"pca_3945","Provisions for depreciation of supply of services in progress (same allocation as for Account 345)","394500","asset_current","","False","Provisions pour dépréciation des prestations de services en cours (même ventilation que celle du compte 345)"
"pca_3951","Provisions for depreciation of semi-finished products (same allocation as for Account 351)","395100","asset_current","","False","Provisions pour dépréciation des produits intermédiaires (même ventilation que celle du compte 351)"
"pca_3955","Provisions for depreciation of finished products (same allocation as for Account 355)","395500","asset_current","","False","Provisions pour dépréciation des produits finis (même ventilation que celle du compte 355)"
"pca_3971","Provisions for depreciation of goods for resale (or group) A","397100","asset_current","","False","Provisions pour dépréciation des stocks de marchandises (ou groupe) A"
"pca_3972","Provisions for depreciation of goods for resale (or group) B","397200","asset_current","","False","Provisions pour dépréciation des stocks de marchandises (ou groupe) B"
"pca_400","Suppliers and related accounts","400000","liability_payable","","True","Fournisseurs et comptes rattachés"
"fr_pca_pcg_pay","Suppliers - Purchase of goods and services","401100","liability_payable","","True","Fournisseurs - Achats de biens et prestations de services"
"pca_4017","Suppliers - Contract performance holdbacks","401700","liability_payable","","True","Fournisseurs - Retenues de garantie"
"pca_403","Suppliers - Bills payable","403000","liability_payable","","True","Fournisseurs - Effets à payer"
"pca_4041","Suppliers - Fixed asset purchases","404100","liability_payable","","True","Fournisseurs - Achats d'immobilisations"
"pca_4047","Fixed asset suppliers - Contract performance holdbacks","404700","liability_payable","","True","Fournisseurs d'immobilisations - Retenues de garantie"
"pca_405","Fixed asset suppliers - Bills payable","405000","liability_payable","","True","Fournisseurs d'immobilisations - Effets à payer"
"pca_4081","Suppliers - Invoices outstanding - Suppliers","408100","liability_current","","True","Factures non parvenues - Fournisseurs"
"pca_4084","Suppliers - Invoices outstanding - Fixed asset suppliers","408400","liability_current","","True","Factures non parvenues - Fournisseurs d'immobilisations"
"pca_4088","Suppliers - Invoices outstanding - Suppliers - Accrued interest","408800","liability_current","","True","Factures non parvenues - Fournisseurs - Intérêts courus"
"pca_4091","Suppliers in debit - Payments on account on orders","409100","liability_current","","False","Fournisseurs avance et acomptes versés sur commandes"
"pca_4096","Suppliers in debit - Debts receivable for returnable packaging andequipment","409600","asset_current","","True","Fournisseurs débiteurs - Créances pour emballages et matériel à rendre"
"pca_40971","Suppliers in debit - Other debits","409710","asset_current","","True","Fournisseurs débiteurs - Autres avoirs des fournisseurs d'exploitation"
"pca_40974","Suppliers in debit - Other debits of fixed asset suppliers","409740","asset_current","","True","Fournisseurs débiteurs - Autres avoirs des fournisseurs d'immobilisations"
"pca_4098","Suppliers in debit - Purchase rebates, discounts, allowances and other outstanding debits","409800","asset_current","","True","Fournisseurs débiteurs - Rabais, remises, ristournes à obtenir et autres avoirs non encore reçus"
"pca_410","Customers and related accounts","410000","asset_receivable","","True","Clients et comptes rattachés"
"fr_pca_pcg_recv","Customers - Sales of goods or services","411100","asset_receivable","","True","Clients - Ventes de biens ou de prestations de services"
"fr_pca_pcg_recv_pos","Customers - Sales of goods or services (PoS)","411101","asset_receivable","","True","Clients - Ventes de biens ou de prestations de services (PoS)"
"pca_4117","Customers - Contract performance holdbacks","411700","asset_receivable","","True","Clients - Retenues de garantie"
"pca_413","Customers - Bills receivable","413000","asset_receivable","","True","Clients - Effets à recevoir"
"pca_416","Doubtful or contested customer accounts","416000","asset_current","","True","Clients douteux ou litigieux"
"pca_4181","Customers - Invoices to be made out","418100","asset_current","","True","Clients - Factures à établir"
"pca_4188","Customers - Accrued interest","418800","asset_current","","True","Clients - Intérêts courus non encore facturés"
"pca_4191","Customers - Payments on account received on orders","419100","liability_current","","True","Clients créditeurs - Avances et acomptes reçus sur commandes"
"pca_4196","Customers - Debts payable for returnable packaging and equipment","419600","liability_current","","True","Clients créditeurs - Dettes pour emballages et matériels consignés"
"pca_4197","Customers - Other credits","419700","liability_current","","True","Clients créditeurs - Autres avoirs"
"pca_4198","Sales rebates, discounts, allowances and other credits not yet issued","419800","liability_current","","True","Clients créditeurs - Rabais, remises, ristournes à accorder et autres avoirs à établir"
"pca_421","Personnel - Remuneration payable","421000","liability_current","","True","Personnel - Rémunérations dues"
"pca_422","Enterprise/establishment consultative committees","422000","liability_current","","True","Comités d'entreprise, d'établissement"
"pca_4246","Employee profit share - Special reserve","424600","liability_current","","True","Participation des salariés aux résultats - Réserve spéciale"
