code,id,chart_template_id/id,user_type_id/id,reconcile,name,note
4687,kp_rrif4687,l10n_hr_chart_template_rrif,account.data_account_type_expenses,,Nadoknade stečajnim upraviteljima,Nadoknade stečajnim upraviteljima
4688,kp_rrif4688,l10n_hr_chart_template_rrif,account.data_account_type_expenses,,Nadoknade prokuristima, članovima skupštine društva i dr.,Nadoknade prokuristima, članovima skupštine društva i dr.
4689,kp_rrif4689,l10n_hr_chart_template_rrif,account.data_account_type_expenses,,Ostale nadoknade članovima uprave,Ostale nadoknade članovima uprave
4690,kp_rrif4690,l10n_hr_chart_template_rrif,account.data_account_type_expenses,,Troškovi obrazovanja i izobrazbe zaposlenika (stručno obrazovanje, seminari, simpoziji, stručni ispiti, stručno usavršavanje, prekvalifikacije, stručni i specijalistički studij, doktorati, učenje jezika i sl.),Troškovi obrazovanja i izobrazbe zaposlenika (stručno obrazovanje, seminari, simpoziji, stručni ispiti, stručno usavršavanje, prekvalifikacije, stručni i specijalistički studij, doktorati, učenje jezika i sl.)
46900,kp_rrif46900,l10n_hr_chart_template_rrif,account.data_account_type_expenses,,Opće obrazovanje,Opće obrazovanje
46901,kp_rrif46901,l10n_hr_chart_template_rrif,account.data_account_type_expenses,,Posebno obrazovanje,Posebno obrazovanje
4691,kp_rrif4691,l10n_hr_chart_template_rrif,account.data_account_type_expenses,,Troškovi za priručnike, časopise i stručnu literaturu,Troškovi za priručnike, časopise i stručnu literaturu
4692,kp_rrif4692,l10n_hr_chart_template_rrif,account.data_account_type_expenses,,Troškovi službenih glasila,Troškovi službenih glasila
4693,kp_rrif4693,l10n_hr_chart_template_rrif,account.data_account_type_expenses,,Sudski troškovi i pristojbe (biljezi i sl.),Sudski troškovi i pristojbe (biljezi i sl.)
4694,kp_rrif4694,l10n_hr_chart_template_rrif,account.data_account_type_expenses,,Troškovi zdravstvenog nadzora i kontrola proizvoda, robe, usluge i sl.,Troškovi zdravstvenog nadzora i kontrola proizvoda, robe, usluge i sl.
4695,kp_rrif4695,l10n_hr_chart_template_rrif,account.data_account_type_expenses,,Troškovi obveznih liječničkih pregleda,Troškovi obveznih liječničkih pregleda
4696,kp_rrif4696,l10n_hr_chart_template_rrif,account.data_account_type_expenses,,Troškovi sistematskih kontrolnih liječničkih pregleda zaposlenika,Troškovi sistematskih kontrolnih liječničkih pregleda zaposlenika
4697,kp_rrif4697,l10n_hr_chart_template_rrif,account.data_account_type_expenses,,Troškovi osnivanja (bilježnik, sud, oglasi, odvjetnik),Troškovi osnivanja (bilježnik, sud, oglasi, odvjetnik)
4698,kp_rrif4698,l10n_hr_chart_template_rrif,account.data_account_type_expenses,,Troškovi ZAMP-a, opomena i dr.,Troškovi ZAMP-a, opomena i dr.
4699,kp_rrif4699,l10n_hr_chart_template_rrif,account.data_account_type_expenses,,Ostali nespomenuti nematerijalni troškovi (ulaznice za sajmove i dr.),Ostali nespomenuti nematerijalni troškovi (ulaznice za sajmove i dr.)
4700,kp_rrif4700,l10n_hr_chart_template_rrif,account.data_account_type_expenses,,Ugovorene kamate unutar grupe,Ugovorene kamate unutar grupe
4701,kp_rrif4701,l10n_hr_chart_template_rrif,account.data_account_type_expenses,,Zatezne kamate unutar grupe,Zatezne kamate unutar grupe
4702,kp_rrif4702,l10n_hr_chart_template_rrif,account.data_account_type_expenses,,Kamate - porezno nepriznate unutar grupe,Kamate - porezno nepriznate unutar grupe
4703,kp_rrif4703,l10n_hr_chart_template_rrif,account.data_account_type_expenses,,Kamate koje se uračunavaju u zalihe unutar grupe (MRS 23, t.11. i HSFI 10, t. 10.22.),Kamate koje se uračunavaju u zalihe unutar grupe (MRS 23, t.11. i HSFI 10, t. 10.22.)
4710,kp_rrif4710,l10n_hr_chart_template_rrif,account.data_account_type_expenses,,Tečajne razlike iz odnosa s poduzetnicima unutar grupe,Tečajne razlike iz odnosa s poduzetnicima unutar grupe
4711,kp_rrif4711,l10n_hr_chart_template_rrif,account.data_account_type_expenses,,Rashodi financiranja, troškovi popusta i naknadnih odobrenja s poduzetnicima unutar grupe,Rashodi financiranja, troškovi popusta i naknadnih odobrenja s poduzetnicima unutar grupe
4712,kp_rrif4712,l10n_hr_chart_template_rrif,account.data_account_type_expenses,,Rashodi od valutne klauzule s poduzetnicima unutar grupe,Rashodi od valutne klauzule s poduzetnicima unutar grupe
4720,kp_rrif4720,l10n_hr_chart_template_rrif,account.data_account_type_expenses,,Troškovi popusta i naknadnih odobrenja s poduzetnicima unutar grupe,Troškovi popusta i naknadnih odobrenja s poduzetnicima unutar grupe
4721,kp_rrif4721,l10n_hr_chart_template_rrif,account.data_account_type_expenses,,Ostali troškovi s poduzetnicima unutar grupe,Ostali troškovi s poduzetnicima unutar grupe
4730,kp_rrif4730,l10n_hr_chart_template_rrif,account.data_account_type_expenses,,Kamate na kredite banaka,Kamate na kredite banaka
4731,kp_rrif4731,l10n_hr_chart_template_rrif,account.data_account_type_expenses,,Kamate iz lizinških poslova,Kamate iz lizinških poslova
4732,kp_rrif4732,l10n_hr_chart_template_rrif,account.data_account_type_expenses,,Kamate na zajmove pravnih osoba,Kamate na zajmove pravnih osoba
4733,kp_rrif4733,l10n_hr_chart_template_rrif,account.data_account_type_expenses,,Kamata na pozajmice članova društva i dioničara,Kamata na pozajmice članova društva i dioničara
4734,kp_rrif4734,l10n_hr_chart_template_rrif,account.data_account_type_expenses,,Kamate na zajmove od fizičkih osoba,Kamate na zajmove od fizičkih osoba
4735,kp_rrif4735,l10n_hr_chart_template_rrif,account.data_account_type_expenses,,Diskontne kamate po mjenicama i dr. vrijednosnim papirima,Diskontne kamate po mjenicama i dr. vrijednosnim papirima
4740,kp_rrif4740,l10n_hr_chart_template_rrif,account.data_account_type_expenses,,Zatezne kamate iz trgovačkih ugovora,Zatezne kamate iz trgovačkih ugovora
4741,kp_rrif4741,l10n_hr_chart_template_rrif,account.data_account_type_expenses,,Zatezne kamate na poreze, doprinose i dr. davanja,Zatezne kamate na poreze, doprinose i dr. davanja
4742,kp_rrif4742,l10n_hr_chart_template_rrif,account.data_account_type_expenses,,Zatezne kamate između povezanih osoba (por. neprizn.),Zatezne kamate između povezanih osoba (por. neprizn.)
4743,kp_rrif4743,l10n_hr_chart_template_rrif,account.data_account_type_expenses,,Zatezne kamate po sudskim presudama,Zatezne kamate po sudskim presudama
4744,kp_rrif4744,l10n_hr_chart_template_rrif,account.data_account_type_expenses,,Ostale zatezne kamate,Ostale zatezne kamate
4750,kp_rrif4750,l10n_hr_chart_template_rrif,account.data_account_type_expenses,,Negativne tečajne razlike iz obveza za nabave u inozemstvu,Negativne tečajne razlike iz obveza za nabave u inozemstvu
4751,kp_rrif4751,l10n_hr_chart_template_rrif,account.data_account_type_expenses,,Negativne tečajne razlike iz kreditnih obveza,Negativne tečajne razlike iz kreditnih obveza
4752,kp_rrif4752,l10n_hr_chart_template_rrif,account.data_account_type_expenses,,Negativne tečajne razlike iz potraživanja u inozemstvu,Negativne tečajne razlike iz potraživanja u inozemstvu
4753,kp_rrif4753,l10n_hr_chart_template_rrif,account.data_account_type_expenses,,Negativne tečajne razlike za ostalo (npr. iz blagajničkog poslovanja, razlika između kupovnog i srednjeg tečaja banke i dr.),Negativne tečajne razlike za ostalo (npr. iz blagajničkog poslovanja, razlika između kupovnog i srednjeg tečaja banke i dr.)
4754,kp_rrif4754,l10n_hr_chart_template_rrif,account.data_account_type_expenses,,Negativne tečajne razlike nastale na stanjima deviznog računa i devizne blagajne,Negativne tečajne razlike nastale na stanjima deviznog računa i devizne blagajne
4760,kp_rrif4760,l10n_hr_chart_template_rrif,account.data_account_type_expenses,,Gubitci iz ulaganja u dionice, udjele, obveznice i dr. vrijednosne papire (koji su prodani ispod troška nabave - čl. 10. ZoPD),Gubitci iz ulaganja u dionice, udjele, obveznice i dr. vrijednosne papire (koji su prodani ispod troška nabave - čl. 10. ZoPD)
4770,kp_rrif4770,l10n_hr_chart_template_rrif,account.data_account_type_expenses,,Troškovi diskonta pri prodaji potraživanja (faktoring),Troškovi diskonta pri prodaji potraživanja (faktoring)
4771,kp_rrif4771,l10n_hr_chart_template_rrif,account.data_account_type_expenses,,Troškovi iz financijskih nagodbi,Troškovi iz financijskih nagodbi
4772,kp_rrif4772,l10n_hr_chart_template_rrif,account.data_account_type_expenses,,Ostali troškovi,Ostali troškovi
4780,kp_rrif4780,l10n_hr_chart_template_rrif,account.data_account_type_expenses,,Nerealizirani gubitci (rashodi) od financijske imovine,Nerealizirani gubitci (rashodi) od financijske imovine
4781,kp_rrif4781,l10n_hr_chart_template_rrif,account.data_account_type_expenses,,Troškovi smanjenja fin. imovine zbog ugovora o poteškoćama,Troškovi smanjenja fin. imovine zbog ugovora o poteškoćama
4782,kp_rrif4782,l10n_hr_chart_template_rrif,account.data_account_type_expenses,,Vrijednosna usklađenja financijske imovine,Vrijednosna usklađenja financijske imovine
4783,kp_rrif4783,l10n_hr_chart_template_rrif,account.data_account_type_expenses,,Nerealizirane tečajne razlike,Nerealizirane tečajne razlike
4790,kp_rrif4790,l10n_hr_chart_template_rrif,account.data_account_type_expenses,,Rashodi s osnove valutne klauzule po obvezama i kreditima,Rashodi s osnove valutne klauzule po obvezama i kreditima
4791,kp_rrif4791,l10n_hr_chart_template_rrif,account.data_account_type_expenses,,Rashodi s osnove usklađenja obveza temeljem valutne i sl. klauzule (prema dobavljačima, za predujmove i sl.),Rashodi s osnove usklađenja obveza temeljem valutne i sl. klauzule (prema dobavljačima, za predujmove i sl.)
4792,kp_rrif4792,l10n_hr_chart_template_rrif,account.data_account_type_expenses,,Troškovi valutne klauzule iz tražbina ili obveza,Troškovi valutne klauzule iz tražbina ili obveza
4793,kp_rrif4793,l10n_hr_chart_template_rrif,account.data_account_type_expenses,,Troškovi burzovnih usluga, emisije vrijednosnih papira i sl.,Troškovi burzovnih usluga, emisije vrijednosnih papira i sl.
4794,kp_rrif4794,l10n_hr_chart_template_rrif,account.data_account_type_expenses,,Troškovi carine inozemnog financijskog i operativnog lizinga,Troškovi carine inozemnog financijskog i operativnog lizinga
4795,kp_rrif4795,l10n_hr_chart_template_rrif,account.data_account_type_expenses,,Trošak paušalne naknade zbog neplaćanja (300,00 kn - čl. 13. ZoFPiPN),Trošak paušalne naknade zbog neplaćanja (300,00 kn - čl. 13. ZoFPiPN)
4796,kp_rrif4796,l10n_hr_chart_template_rrif,account.data_account_type_expenses,,Trošak članarine za kreditne i sl. kartice,Trošak članarine za kreditne i sl. kartice
4797,kp_rrif4797,l10n_hr_chart_template_rrif,account.data_account_type_expenses,,Troškovi ovršnog postupka,Troškovi ovršnog postupka
4799,kp_rrif4799,l10n_hr_chart_template_rrif,account.data_account_type_expenses,,Ostali nespomenuti financijski troškovi,Ostali nespomenuti financijski troškovi
4800,kp_rrif4800,l10n_hr_chart_template_rrif,account.data_account_type_expenses,,Naknadno odobreni popusti i odobrenja,Naknadno odobreni popusti i odobrenja
4801,kp_rrif4801,l10n_hr_chart_template_rrif,account.data_account_type_expenses,,Troškovi nagodbe (razlike iz sniženja),Troškovi nagodbe (razlike iz sniženja)
4802,kp_rrif4802,l10n_hr_chart_template_rrif,account.data_account_type_expenses,,Troškovi nenadoknađenih jamstava za prodana dobra,Troškovi nenadoknađenih jamstava za prodana dobra
4803,kp_rrif4803,l10n_hr_chart_template_rrif,account.data_account_type_expenses,,Troškovi naknadnih reklamacija,Troškovi naknadnih reklamacija
4804,kp_rrif4804,l10n_hr_chart_template_rrif,account.data_account_type_expenses,,Troškovi uzoraka zbog kontrole i pregleda, izlaganje radi prodaje i sl.,Troškovi uzoraka zbog kontrole i pregleda, izlaganje radi prodaje i sl.
4810,kp_rrif4810,l10n_hr_chart_template_rrif,account.data_account_type_expenses,,Otpisi nenaplaćenih jamstava i drugih osiguranja,Otpisi nenaplaćenih jamstava i drugih osiguranja
4811,kp_rrif4811,l10n_hr_chart_template_rrif,account.data_account_type_expenses,,Izravni otpisi nenaplaćenih potraživanja od kupaca i drugih koja nisu vrijednosno usklađena,Izravni otpisi nenaplaćenih potraživanja od kupaca i drugih koja nisu vrijednosno usklađena
48110,kp_rrif48110,l10n_hr_chart_template_rrif,account.data_account_type_expenses,,Porezno priznat otpis,Porezno priznat otpis
48111,kp_rrif48111,l10n_hr_chart_template_rrif,account.data_account_type_expenses,,Porezno nepriznat otpis,Porezno nepriznat otpis
4812,kp_rrif4812,l10n_hr_chart_template_rrif,account.data_account_type_expenses,,Troškovi ostalih otpisa,Troškovi ostalih otpisa
4813,kp_rrif4813,l10n_hr_chart_template_rrif,account.data_account_type_expenses,,Troškovi otpisa dugova fizičkim osobama prema Zakonu o otpisu dugova fizičkim osobama (Nar. nov., br. 62/18.),Troškovi otpisa dugova fizičkim osobama prema Zakonu o otpisu dugova fizičkim osobama (Nar. nov., br. 62/18.)
4820,kp_rrif4820,l10n_hr_chart_template_rrif,account.data_account_type_expenses,,Neamortizirana vrijednost rashodovane, uništene ili otuđene dugotrajne imovine,Neamortizirana vrijednost rashodovane, uništene ili otuđene dugotrajne imovine
4821,kp_rrif4821,l10n_hr_chart_template_rrif,account.data_account_type_expenses,,Otpisi imovine izvan uporabe - rashod,Otpisi imovine izvan uporabe - rashod
4822,kp_rrif4822,l10n_hr_chart_template_rrif,account.data_account_type_expenses,,Gubitak od prodane dug. imov. koja se ne amortizira,Gubitak od prodane dug. imov. koja se ne amortizira
4823,kp_rrif4823,l10n_hr_chart_template_rrif,account.data_account_type_expenses,,Gubitak od prodaje ost. dug. mat. i nemat. imovine,Gubitak od prodaje ost. dug. mat. i nemat. imovine
4824,kp_rrif4824,l10n_hr_chart_template_rrif,account.data_account_type_expenses,,Otpisi materijala i robe - rashod,Otpisi materijala i robe - rashod
4830,kp_rrif4830,l10n_hr_chart_template_rrif,account.data_account_type_expenses,,Manjkovi uslijed više sile (provalna krađa, elementarna nepogoda),Manjkovi uslijed više sile (provalna krađa, elementarna nepogoda)
4831,kp_rrif4831,l10n_hr_chart_template_rrif,account.data_account_type_expenses,,Dopušteni manjkovi - kalo, rastep, kvar i lom na zalihama prema odlukama HGK, HOK ili internim aktima,Dopušteni manjkovi - kalo, rastep, kvar i lom na zalihama prema odlukama HGK, HOK ili internim aktima
4832,kp_rrif4832,l10n_hr_chart_template_rrif,account.data_account_type_expenses,,Prekomjerni manjkovi na zalihama (kalo, rastep, kvar i lom) iznad normativa + PDV, prema odlukama HGK, HOK ili interno - skrivene isplate (čl. 7. st. 5. ZoPD-a),Prekomjerni manjkovi na zalihama (kalo, rastep, kvar i lom) iznad normativa + PDV, prema odlukama HGK, HOK ili interno - skrivene isplate (čl. 7. st. 5. ZoPD-a)
4833,kp_rrif4833,l10n_hr_chart_template_rrif,account.data_account_type_expenses,,Manjkovi novca i vrijednosnih papira,Manjkovi novca i vrijednosnih papira
4834,kp_rrif4834,l10n_hr_chart_template_rrif,account.data_account_type_expenses,,Manjkovi na teret odgovorne osobe,Manjkovi na teret odgovorne osobe
4834,kp_rrif4834,l10n_hr_chart_template_rrif,account.data_account_type_expenses,,Manjkovi dugotrajne imovine,Manjkovi dugotrajne imovine
4839,kp_rrif4839,l10n_hr_chart_template_rrif,account.data_account_type_expenses,,Ostali manjkovi iz imovine,Ostali manjkovi iz imovine
4840,kp_rrif4840,l10n_hr_chart_template_rrif,account.data_account_type_expenses,,Troškovi kazni za prijestupe i prekršaje i sl. (čl. 7. st. 1. t. 7. ZoPD-a),Troškovi kazni za prijestupe i prekršaje i sl. (čl. 7. st. 1. t. 7. ZoPD-a)
4841,kp_rrif4841,l10n_hr_chart_template_rrif,account.data_account_type_expenses,,Troškovi prisilne naplate poreza i dr. davanja (čl. 7. st. 1. t. 6. ZoPD-a),Troškovi prisilne naplate poreza i dr. davanja (čl. 7. st. 1. t. 6. ZoPD-a)
4842,kp_rrif4842,l10n_hr_chart_template_rrif,account.data_account_type_expenses,,Penali, ležarine, dangubnine,Penali, ležarine, dangubnine
4843,kp_rrif4843,l10n_hr_chart_template_rrif,account.data_account_type_expenses,,Nadoknade šteta iz radnog odnosa (npr. za neiskorišteni godišnji odmor, zbog ozljede na radu, odštetne rente i sl.),Nadoknade šteta iz radnog odnosa (npr. za neiskorišteni godišnji odmor, zbog ozljede na radu, odštetne rente i sl.)
4844,kp_rrif4844,l10n_hr_chart_template_rrif,account.data_account_type_expenses,,Nadoknade štete - troškovi po nagodbama i sudskim presudama - tužbama,Nadoknade štete - troškovi po nagodbama i sudskim presudama - tužbama
4845,kp_rrif4845,l10n_hr_chart_template_rrif,account.data_account_type_expenses,,Ugovorene kazne i penali zbog neizvršenja, propusta i sl.,Ugovorene kazne i penali zbog neizvršenja, propusta i sl.
4846,kp_rrif4846,l10n_hr_chart_template_rrif,account.data_account_type_expenses,,Troškovi preuzetih obveza iz ugovora,Troškovi preuzetih obveza iz ugovora
4847,kp_rrif4847,l10n_hr_chart_template_rrif,account.data_account_type_expenses,,Kazne za parkiranje,Kazne za parkiranje
4848,kp_rrif4848,l10n_hr_chart_template_rrif,account.data_account_type_expenses,,Naknade (kazne) zbog nezapošljavanja osoba s invaliditetom,Naknade (kazne) zbog nezapošljavanja osoba s invaliditetom
4849,kp_rrif4849,l10n_hr_chart_template_rrif,account.data_account_type_expenses,,Ostali izdatci za štete,Ostali izdatci za štete
4850,kp_rrif4850,l10n_hr_chart_template_rrif,account.data_account_type_expenses,,Naknadno utvrđeni troškovi - računi iz prethodnih godina,Naknadno utvrđeni troškovi - računi iz prethodnih godina
4851,kp_rrif4851,l10n_hr_chart_template_rrif,account.data_account_type_expenses,,Troškovi naknadnih razlika iz nabava,Troškovi naknadnih razlika iz nabava
4852,kp_rrif4852,l10n_hr_chart_template_rrif,account.data_account_type_expenses,,Ispravak pogrešaka prethodnih razdoblja,Ispravak pogrešaka prethodnih razdoblja
4860,kp_rrif4860,l10n_hr_chart_template_rrif,account.data_account_type_expenses,,Darovanje za općekorisne namjene (Darovi u novcu ili naravi do 2% od ukupnog prihoda prethodne godine za kulturu, znanost, odgoj i obrazovanje, zdravstvo, humanitarne, športske, vjerske, ekološke i dr. svrhe - npr. samostalnim umjetnicima, domaćim udrugama i dr. osobama - čl. 7. st. 7. ZoPD-a),Darovanje za općekorisne namjene (Darovi u novcu ili naravi do 2% od ukupnog prihoda prethodne godine za kulturu, znanost, odgoj i obrazovanje, zdravstvo, humanitarne, športske, vjerske, ekološke i dr. svrhe - npr. samostalnim umjetnicima, domaćim udrugama i dr. osobama - čl. 7. st. 7. ZoPD-a)
4861,kp_rrif4861,l10n_hr_chart_template_rrif,account.data_account_type_expenses,,Darovanje za zdravstvene potrebe (darovanje vanjskih osoba do 2% od UP prethodne godine za operativne zahvate, liječenja, nabavu lijekova, ortopedskih pomagala i dr. što nije pokriveno osiguranjem - čl. 7. st. 8. ZoPD-a),Darovanje za zdravstvene potrebe (darovanje vanjskih osoba do 2% od UP prethodne godine za operativne zahvate, liječenja, nabavu lijekova, ortopedskih pomagala i dr. što nije pokriveno osiguranjem - čl. 7. st. 8. ZoPD-a)
4862,kp_rrif4862,l10n_hr_chart_template_rrif,account.data_account_type_expenses,,Doniranje hrane od strane proizvođača i trgovaca hrane bez PDV-a (do visine 2 % UP prethodne godine) koje se unosi u obrazac DONH,Doniranje hrane od strane proizvođača i trgovaca hrane bez PDV-a (do visine 2 % UP prethodne godine) koje se unosi u obrazac DONH
4870,kp_rrif4870,l10n_hr_chart_template_rrif,account.data_account_type_expenses,,Porezno nepriznata darovanja iznad 2% UP (za svrhe iznad dopuštenih s računa 486) i darovanja inozemnih udruga, ustanova i sl. (čl. 7. st. 1. t. 10. ZoPD-a),Porezno nepriznata darovanja iznad 2% UP (za svrhe iznad dopuštenih s računa 486) i darovanja inozemnih udruga, ustanova i sl. (čl. 7. st. 1. t. 10. ZoPD-a)
4871,kp_rrif4871,l10n_hr_chart_template_rrif,account.data_account_type_expenses,,Darovi (milodari), potpore i dotacije bez protučinidbe primatelja, te dr. izdatci koji nisu u svezi s ostvarivanjem dobitka (+PDV, osim na novac - čl. 7. st. 1. t. 13. ZoPD-a),Darovi (milodari), potpore i dotacije bez protučinidbe primatelja, te dr. izdatci koji nisu u svezi s ostvarivanjem dobitka (+PDV, osim na novac - čl. 7. st. 1. t. 13. ZoPD-a)
4872,kp_rrif4872,l10n_hr_chart_template_rrif,account.data_account_type_expenses,,Darovanje političkih stranaka i nezavisnih kandidata,Darovanje političkih stranaka i nezavisnih kandidata
4880,kp_rrif4880,l10n_hr_chart_template_rrif,account.data_account_type_expenses,,Troškovi iz ortačkog ugovora,Troškovi iz ortačkog ugovora
4881,kp_rrif4881,l10n_hr_chart_template_rrif,account.data_account_type_expenses,,Troškovi iz posredovanja,Troškovi iz posredovanja
4890,kp_rrif4890,l10n_hr_chart_template_rrif,account.data_account_type_expenses,,Rashodi utvrđeni u postupku nadzora (čl. 7. st. 1. t. 11. ZoPD-a) kao: - skrivene isplate dobitka - izuzimanje dioničara članova društva i fizičkih osoba (obrtnika) i s njima povez. osobama,Rashodi utvrđeni u postupku nadzora (čl. 7. st. 1. t. 11. ZoPD-a) kao: - skrivene isplate dobitka - izuzimanje dioničara članova društva i fizičkih osoba (obrtnika) i s njima povez. osobama
4891,kp_rrif4891,l10n_hr_chart_template_rrif,account.data_account_type_expenses,,Troškovi koji nisu izravno u svezi s ostvarivanjem dobitka (čl. 7. st. 1. t. 13. ZoPD-a - red. br. 24 PD, npr. amortiz. imov. koja ne služi obavljanju djelatnosti, dodjela vlastitih dionica - udjela i dr.) - porezno nepriznati,Troškovi koji nisu izravno u svezi s ostvarivanjem dobitka (čl. 7. st. 1. t. 13. ZoPD-a - red. br. 24 PD, npr. amortiz. imov. koja ne služi obavljanju djelatnosti, dodjela vlastitih dionica - udjela i dr.) - porezno nepriznati
4892,kp_rrif4892,l10n_hr_chart_template_rrif,account.data_account_type_expenses,,Troškovi povlastica i dr. oblici imovinskih koristi (čl. 7. st.1. t.9. ZoPD-a) - porezno nepriznati,Troškovi povlastica i dr. oblici imovinskih koristi (čl. 7. st.1. t.9. ZoPD-a) - porezno nepriznati
4893,kp_rrif4893,l10n_hr_chart_template_rrif,account.data_account_type_expenses,,Izuzimanja dioničara i članova društva na koja se obračunava 36% poreza na dohodak i prirez - porezno priznata,Izuzimanja dioničara i članova društva na koja se obračunava 36% poreza na dohodak i prirez - porezno priznata
4899,kp_rrif4899,l10n_hr_chart_template_rrif,account.data_account_type_expenses,,Ostali nespomenuti poslovni rashodi,Ostali nespomenuti poslovni rashodi
4900,kp_rrif4900,l10n_hr_chart_template_rrif,account.data_account_type_expenses,,Raspored troškova za obračun proizvoda i usluga (prema HSFI 10 i MRS-u 2 i MRS-u 11) - uskladištivi troškovi (na račune 60, 62 i 63),Raspored troškova za obračun proizvoda i usluga (prema HSFI 10 i MRS-u 2 i MRS-u 11) - uskladištivi troškovi (na račune 60, 62 i 63)
4910,kp_rrif4910,l10n_hr_chart_template_rrif,account.data_account_type_expenses,,Raspored troškova za pokriće upravnih, administrativnih, prodajnih i drugih troškova (na račune 70 i 71),Raspored troškova za pokriće upravnih, administrativnih, prodajnih i drugih troškova (na račune 70 i 71)
6000,kp_rrif6000,l10n_hr_chart_template_rrif,account.data_account_type_current_assets,,Proizvodnja u tijeku (razrada po serijama, nositeljima troškova, mjestima, pogonima, gradilištima, objektima, radnim nalozima i sl.),Proizvodnja u tijeku (razrada po serijama, nositeljima troškova, mjestima, pogonima, gradilištima, objektima, radnim nalozima i sl.)
6010,kp_rrif6010,l10n_hr_chart_template_rrif,account.data_account_type_current_assets,,Vrijednost usluga (u tijeku ili nedovršenih na datum bilance - MRS 2, t. 16.),Vrijednost usluga (u tijeku ili nedovršenih na datum bilance - MRS 2, t. 16.)
6020,kp_rrif6020,l10n_hr_chart_template_rrif,account.data_account_type_current_assets,,Vanjska proizvodnja (kooperacija i dr.),Vanjska proizvodnja (kooperacija i dr.)
6050,kp_rrif6050,l10n_hr_chart_template_rrif,account.data_account_type_current_assets,,Proizvodnja u slobodnoj zoni,Proizvodnja u slobodnoj zoni
6060,kp_rrif6060,l10n_hr_chart_template_rrif,account.data_account_type_current_assets,,Proizvodnja u doradi i manipulaciji,Proizvodnja u doradi i manipulaciji
6070,kp_rrif6070,l10n_hr_chart_template_rrif,account.data_account_type_current_assets,,Obustavljena proizvodnja,Obustavljena proizvodnja
6080,kp_rrif6080,l10n_hr_chart_template_rrif,account.data_account_type_current_assets,,Proizvodnja u tijeku iz ortačkog ugovora,Proizvodnja u tijeku iz ortačkog ugovora
6090,kp_rrif6090,l10n_hr_chart_template_rrif,account.data_account_type_current_assets,,Vrijednosno usklađivanje proizvodnje - usluga,Vrijednosno usklađivanje proizvodnje - usluga
6100,kp_rrif6100,l10n_hr_chart_template_rrif,account.data_account_type_current_assets,,Zalihe poluproizvoda (analitika prema osnovnim skupinama ili po stupnju dovršenosti),Zalihe poluproizvoda (analitika prema osnovnim skupinama ili po stupnju dovršenosti)
6110,kp_rrif6110,l10n_hr_chart_template_rrif,account.data_account_type_current_assets,,Nedovršeni proizvodi i poluproizvodi (analitika po vrstama proizvoda),Nedovršeni proizvodi i poluproizvodi (analitika po vrstama proizvoda)
6190,kp_rrif6190,l10n_hr_chart_template_rrif,account.data_account_type_current_assets,,Vrijednosno usklađivanje nedovršenih proizvoda i poluproizvoda,Vrijednosno usklađivanje nedovršenih proizvoda i poluproizvoda
6200,kp_rrif6200,l10n_hr_chart_template_rrif,account.data_account_type_current_assets,,Poljoprivredna biljna proizvodnja,Poljoprivredna biljna proizvodnja
6201,kp_rrif6201,l10n_hr_chart_template_rrif,account.data_account_type_current_assets,,Uzgoj (tov) životinja,Uzgoj (tov) životinja
6210,kp_rrif6210,l10n_hr_chart_template_rrif,account.data_account_type_current_assets,,Zaliha biološke imovine za prodaju,Zaliha biološke imovine za prodaju
