code,id,chart_template_id/id,user_type_id/id,reconcile,name,note
2854,kp_rrif2854,l10n_hr_chart_template_rrif,account.data_account_type_current_liabilities,,Ostala dugoročna rezerviranja za rizike i dr. očekivane troškove,Ostala dugoročna rezerviranja za rizike i dr. očekivane troškove
2900,kp_rrif2900,l10n_hr_chart_template_rrif,account.data_account_type_current_liabilities,,Obračunani troškovi za koje nije primljena faktura (telefon, grijanje, el. energija, plin, voda i sl.),Obračunani troškovi za koje nije primljena faktura (telefon, grijanje, el. energija, plin, voda i sl.)
2901,kp_rrif2901,l10n_hr_chart_template_rrif,account.data_account_type_current_liabilities,,Obračunana najamnina iz operativnog (poslovnog) najma,Obračunana najamnina iz operativnog (poslovnog) najma
2902,kp_rrif2902,l10n_hr_chart_template_rrif,account.data_account_type_current_liabilities,,Obračunani troškovi tekućeg održavanja,Obračunani troškovi tekućeg održavanja
2903,kp_rrif2903,l10n_hr_chart_template_rrif,account.data_account_type_current_liabilities,,Obračunani troškovi reklame, propagande i sajmova,Obračunani troškovi reklame, propagande i sajmova
2904,kp_rrif2904,l10n_hr_chart_template_rrif,account.data_account_type_current_liabilities,,Obračunane a neplaćene usluge korištene u obračunskom razdoblju,Obračunane a neplaćene usluge korištene u obračunskom razdoblju
2905,kp_rrif2905,l10n_hr_chart_template_rrif,account.data_account_type_current_liabilities,,Obračunani rad po ugovoru o djelu, autor. hon.,Obračunani rad po ugovoru o djelu, autor. hon.
2906,kp_rrif2906,l10n_hr_chart_template_rrif,account.data_account_type_current_liabilities,,Obračunani kalo, rastep, kvar i lom,Obračunani kalo, rastep, kvar i lom
2907,kp_rrif2907,l10n_hr_chart_template_rrif,account.data_account_type_current_liabilities,,Obračunani troškovi premije osiguranja,Obračunani troškovi premije osiguranja
2908,kp_rrif2908,l10n_hr_chart_template_rrif,account.data_account_type_current_liabilities,,Uračunani troškovi službenih glasila i stručnih časopisa,Uračunani troškovi službenih glasila i stručnih časopisa
2909,kp_rrif2909,l10n_hr_chart_template_rrif,account.data_account_type_current_liabilities,,Obračunani ostali troškovi poslovanja (troškovi prijevoza, bankovne usluge i platni promet, reprezentacija i dr.),Obračunani ostali troškovi poslovanja (troškovi prijevoza, bankovne usluge i platni promet, reprezentacija i dr.)
2910,kp_rrif2910,l10n_hr_chart_template_rrif,account.data_account_type_current_liabilities,,Obračunani troškovi franšiza, korištenih trgovačkih znakova, prava i sl.,Obračunani troškovi franšiza, korištenih trgovačkih znakova, prava i sl.
2911,kp_rrif2911,l10n_hr_chart_template_rrif,account.data_account_type_current_liabilities,,Obračunani troškovi licencija,Obračunani troškovi licencija
2912,kp_rrif2912,l10n_hr_chart_template_rrif,account.data_account_type_current_liabilities,,Obračunani troškovi autorskih prava,Obračunani troškovi autorskih prava
2913,kp_rrif2913,l10n_hr_chart_template_rrif,account.data_account_type_current_liabilities,,Odgođeno plaćanje troškova za ostala prava,Odgođeno plaćanje troškova za ostala prava
2920,kp_rrif2920,l10n_hr_chart_template_rrif,account.data_account_type_current_liabilities,,Obračunani ovisni troškovi nabave (za koje nisu primljeni računi) - prijevoz, osiguranje, špedicija i dr. vanjski troškovi,Obračunani ovisni troškovi nabave (za koje nisu primljeni računi) - prijevoz, osiguranje, špedicija i dr. vanjski troškovi
2930,kp_rrif2930,l10n_hr_chart_template_rrif,account.data_account_type_current_liabilities,,Odgođeni prihodi radi neizvjesnih troškova,Odgođeni prihodi radi neizvjesnih troškova
2931,kp_rrif2931,l10n_hr_chart_template_rrif,account.data_account_type_current_liabilities,,Obračunani prihodi budućeg razdoblja koji su rezultat primjene računovodstvene politike,Obračunani prihodi budućeg razdoblja koji su rezultat primjene računovodstvene politike
2932,kp_rrif2932,l10n_hr_chart_template_rrif,account.data_account_type_current_liabilities,,Odgođeno priznavanje prihoda kad se predviđa povrat robe,Odgođeno priznavanje prihoda kad se predviđa povrat robe
2933,kp_rrif2933,l10n_hr_chart_template_rrif,account.data_account_type_current_liabilities,,Odgođeni prihodi iz otkupa tražbine (faktoring koji nije zarađen),Odgođeni prihodi iz otkupa tražbine (faktoring koji nije zarađen)
2934,kp_rrif2934,l10n_hr_chart_template_rrif,account.data_account_type_current_liabilities,,Odgođeni prihodi od kamata iz financijskog lizinga,Odgođeni prihodi od kamata iz financijskog lizinga
2935,kp_rrif2935,l10n_hr_chart_template_rrif,account.data_account_type_current_liabilities,,Odgođeni prihodi iz operativnog lizinga,Odgođeni prihodi iz operativnog lizinga
2936,kp_rrif2936,l10n_hr_chart_template_rrif,account.data_account_type_current_liabilities,,Obračunane (anticipativne) kamate na dane zajmove i zatezne kamate (za buduće razdoblje),Obračunane (anticipativne) kamate na dane zajmove i zatezne kamate (za buduće razdoblje)
2937,kp_rrif2937,l10n_hr_chart_template_rrif,account.data_account_type_current_liabilities,,Unaprijed obračunane ili naplaćene školarine,Unaprijed obračunane ili naplaćene školarine
2938,kp_rrif2938,l10n_hr_chart_template_rrif,account.data_account_type_current_liabilities,,Odgođeni prihodi iz ortaštva,Odgođeni prihodi iz ortaštva
2939,kp_rrif2939,l10n_hr_chart_template_rrif,account.data_account_type_current_liabilities,,Ostali odgođeni prihodi budućeg razdoblja (npr. ugovorna obveza),Ostali odgođeni prihodi budućeg razdoblja (npr. ugovorna obveza)
2940,kp_rrif2940,l10n_hr_chart_template_rrif,account.data_account_type_current_liabilities,,Odgođeni prihodi iz državnih i lokalnih potpora za dugotrajnu nematerijalnu i materijalnu imovinu (analitike po namjenskim primitcima iz proračuna - po investicijama),Odgođeni prihodi iz državnih i lokalnih potpora za dugotrajnu nematerijalnu i materijalnu imovinu (analitike po namjenskim primitcima iz proračuna - po investicijama)
2941,kp_rrif2941,l10n_hr_chart_template_rrif,account.data_account_type_current_liabilities,,Odgođeni prihodi za D. I. iz fondova EU,Odgođeni prihodi za D. I. iz fondova EU
2942,kp_rrif2942,l10n_hr_chart_template_rrif,account.data_account_type_current_liabilities,,Odgođeni prihodi iz potpora za zapošljavanje,Odgođeni prihodi iz potpora za zapošljavanje
2943,kp_rrif2943,l10n_hr_chart_template_rrif,account.data_account_type_current_liabilities,,Odgođeno priznavanje prihoda za unaprijed naplaćene subvencije i potpore,Odgođeno priznavanje prihoda za unaprijed naplaćene subvencije i potpore
2944,kp_rrif2944,l10n_hr_chart_template_rrif,account.data_account_type_current_liabilities,,Odgođeni prihodi ostalih potpora,Odgođeni prihodi ostalih potpora
2950,kp_rrif2950,l10n_hr_chart_template_rrif,account.data_account_type_current_liabilities,,Razgraničeni višak prihoda od prodaje i povratnog financijskog najma,Razgraničeni višak prihoda od prodaje i povratnog financijskog najma
2951,kp_rrif2951,l10n_hr_chart_template_rrif,account.data_account_type_current_liabilities,,Odgođeni prihodi od neiskorištenih popusta (MSFI 15, t. 73. - 80.),Odgođeni prihodi od neiskorištenih popusta (MSFI 15, t. 73. - 80.)
2960,kp_rrif2960,l10n_hr_chart_template_rrif,account.data_account_type_current_liabilities,,Odgođeni prihod s osnove nefakturiranih isporuka dobara i usluga,Odgođeni prihod s osnove nefakturiranih isporuka dobara i usluga
2970,kp_rrif2970,l10n_hr_chart_template_rrif,account.data_account_type_current_liabilities,,Nerealizirani dobitci iz financijske imovine (HSFI 9 i MSFI 9),Nerealizirani dobitci iz financijske imovine (HSFI 9 i MSFI 9)
2980,kp_rrif2980,l10n_hr_chart_template_rrif,account.data_account_type_current_liabilities,,Odgođeni fakturirani prihod za koji nije nastala isporuka,Odgođeni fakturirani prihod za koji nije nastala isporuka
2990,kp_rrif2990,l10n_hr_chart_template_rrif,account.data_account_type_current_liabilities,,Ostala pasivna vremenska razgraničenja troškova,Ostala pasivna vremenska razgraničenja troškova
3000,kp_rrif3000,l10n_hr_chart_template_rrif,account.data_account_type_current_assets,,Fakturna cijena sirovina i materijala na putu,Fakturna cijena sirovina i materijala na putu
3001,kp_rrif3001,l10n_hr_chart_template_rrif,account.data_account_type_current_assets,,Fakturna cijena sirovina i materijala,Fakturna cijena sirovina i materijala
3002,kp_rrif3002,l10n_hr_chart_template_rrif,account.data_account_type_current_assets,,Fakturna cijena rezervnih dijelova,Fakturna cijena rezervnih dijelova
3003,kp_rrif3003,l10n_hr_chart_template_rrif,account.data_account_type_current_assets,,Fakturna cijena sitnog inventara, autoguma, rez. dijelova i ambalaže,Fakturna cijena sitnog inventara, autoguma, rez. dijelova i ambalaže
3005,kp_rrif3005,l10n_hr_chart_template_rrif,account.data_account_type_current_assets,,Materijal i dijelovi u preuzimanju (nema dokumentacije),Materijal i dijelovi u preuzimanju (nema dokumentacije)
3010,kp_rrif3010,l10n_hr_chart_template_rrif,account.data_account_type_current_assets,,Troškovi transporta,Troškovi transporta
3011,kp_rrif3011,l10n_hr_chart_template_rrif,account.data_account_type_current_assets,,Troškovi ukrcaja i iskrcaja (fakturirani),Troškovi ukrcaja i iskrcaja (fakturirani)
3012,kp_rrif3012,l10n_hr_chart_template_rrif,account.data_account_type_current_assets,,Transportno osiguranje i čuvanje,Transportno osiguranje i čuvanje
3013,kp_rrif3013,l10n_hr_chart_template_rrif,account.data_account_type_current_assets,,Posebni troškovi pakiranja - ambalaže,Posebni troškovi pakiranja - ambalaže
3014,kp_rrif3014,l10n_hr_chart_template_rrif,account.data_account_type_current_assets,,Troškovi vlastitog transporta,Troškovi vlastitog transporta
3015,kp_rrif3015,l10n_hr_chart_template_rrif,account.data_account_type_current_assets,,Troškovi vlastitog ukrcaja i iskrcaja,Troškovi vlastitog ukrcaja i iskrcaja
3016,kp_rrif3016,l10n_hr_chart_template_rrif,account.data_account_type_current_assets,,Troškovi špeditera,Troškovi špeditera
3017,kp_rrif3017,l10n_hr_chart_template_rrif,account.data_account_type_current_assets,,Troškovi atesta i kontrole,Troškovi atesta i kontrole
3018,kp_rrif3018,l10n_hr_chart_template_rrif,account.data_account_type_current_assets,,Troškovi dorade i oplemenjivanja za vrijeme dovođenja na zalihu,Troškovi dorade i oplemenjivanja za vrijeme dovođenja na zalihu
3019,kp_rrif3019,l10n_hr_chart_template_rrif,account.data_account_type_current_assets,,Ostali ovisni troškovi nabave,Ostali ovisni troškovi nabave
3020,kp_rrif3020,l10n_hr_chart_template_rrif,account.data_account_type_current_assets,,Carina i druge uvozne pristojbe,Carina i druge uvozne pristojbe
3030,kp_rrif3030,l10n_hr_chart_template_rrif,account.data_account_type_current_assets,,Posebni porezi (trošarine) koji se ne mogu odbiti,Posebni porezi (trošarine) koji se ne mogu odbiti
3090,kp_rrif3090,l10n_hr_chart_template_rrif,account.data_account_type_current_assets,,Obračun nabave sirovina i materijala, dijelova i sitnog inventara koji se skladišti,Obračun nabave sirovina i materijala, dijelova i sitnog inventara koji se skladišti
3091,kp_rrif3091,l10n_hr_chart_template_rrif,account.data_account_type_current_assets,,Obračun nabave sirovina i materijala i dijelova koji izravno terete troškove,Obračun nabave sirovina i materijala i dijelova koji izravno terete troškove
3100,kp_rrif3100,l10n_hr_chart_template_rrif,account.data_account_type_current_assets,,Zalihe sirovina i materijala,Zalihe sirovina i materijala
3101,kp_rrif3101,l10n_hr_chart_template_rrif,account.data_account_type_current_assets,,Zalihe goriva i maziva,Zalihe goriva i maziva
3102,kp_rrif3102,l10n_hr_chart_template_rrif,account.data_account_type_current_assets,,Poluproizvodi za ugradnju ili proizvodnju,Poluproizvodi za ugradnju ili proizvodnju
3103,kp_rrif3103,l10n_hr_chart_template_rrif,account.data_account_type_current_assets,,Uredski materijal i pribor,Uredski materijal i pribor
3104,kp_rrif3104,l10n_hr_chart_template_rrif,account.data_account_type_current_assets,,Zalihe materijala s temelja povezane proizvodnje,Zalihe materijala s temelja povezane proizvodnje
3105,kp_rrif3105,l10n_hr_chart_template_rrif,account.data_account_type_current_assets,,Zalihe ambalažnog materijala,Zalihe ambalažnog materijala
3106,kp_rrif3106,l10n_hr_chart_template_rrif,account.data_account_type_current_assets,,Zalihe materijala kod kooperanata,Zalihe materijala kod kooperanata
3107,kp_rrif3107,l10n_hr_chart_template_rrif,account.data_account_type_current_assets,,Materijal na zalihi u javnom ili drugom skladištu,Materijal na zalihi u javnom ili drugom skladištu
3108,kp_rrif3108,l10n_hr_chart_template_rrif,account.data_account_type_current_assets,,Zalihe pića, hrane i dr. u ugostiteljstvu i hotelijerstvu,Zalihe pića, hrane i dr. u ugostiteljstvu i hotelijerstvu
3109,kp_rrif3109,l10n_hr_chart_template_rrif,account.data_account_type_current_assets,,Zalihe otpadnog i rashodovanog materijala,Zalihe otpadnog i rashodovanog materijala
3110,kp_rrif3110,l10n_hr_chart_template_rrif,account.data_account_type_current_assets,,Materijal u doradi, obradi i oplemenjivanju,Materijal u doradi, obradi i oplemenjivanju
3111,kp_rrif3111,l10n_hr_chart_template_rrif,account.data_account_type_current_assets,,Materijal u manipulaciji i na putu,Materijal u manipulaciji i na putu
3112,kp_rrif3112,l10n_hr_chart_template_rrif,account.data_account_type_current_assets,,Troškovi dorade, obrade i oplemenjivanja,Troškovi dorade, obrade i oplemenjivanja
3120,kp_rrif3120,l10n_hr_chart_template_rrif,account.data_account_type_current_assets,,Materijal na doradi kod ortaka,Materijal na doradi kod ortaka
3130,kp_rrif3130,l10n_hr_chart_template_rrif,account.data_account_type_current_assets,,Zalihe sjemena i sadnog materijala,Zalihe sjemena i sadnog materijala
3131,kp_rrif3131,l10n_hr_chart_template_rrif,account.data_account_type_current_assets,,Zalihe komponenti za proizvodnju,Zalihe komponenti za proizvodnju
3180,kp_rrif3180,l10n_hr_chart_template_rrif,account.data_account_type_current_assets,,Odstupanje od cijene zaliha,Odstupanje od cijene zaliha
3190,kp_rrif3190,l10n_hr_chart_template_rrif,account.data_account_type_current_assets,,Vrijednosno usklađenje zaliha sirovina i materijala,Vrijednosno usklađenje zaliha sirovina i materijala
3200,kp_rrif3200,l10n_hr_chart_template_rrif,account.data_account_type_current_assets,,Rezervni dijelovi za servisne usluge,Rezervni dijelovi za servisne usluge
3201,kp_rrif3201,l10n_hr_chart_template_rrif,account.data_account_type_current_assets,,Dijelovi i sklopovi za ugradnju (u proizvode),Dijelovi i sklopovi za ugradnju (u proizvode)
3202,kp_rrif3202,l10n_hr_chart_template_rrif,account.data_account_type_current_assets,,Rezervni dijelovi za tekuće i investicijsko održavanje,Rezervni dijelovi za tekuće i investicijsko održavanje
3203,kp_rrif3203,l10n_hr_chart_template_rrif,account.data_account_type_current_assets,,Zalihe polovnih rezervnih dijelova,Zalihe polovnih rezervnih dijelova
3204,kp_rrif3204,l10n_hr_chart_template_rrif,account.data_account_type_current_assets,,Zalihe otpadaka rezervnih dijelova,Zalihe otpadaka rezervnih dijelova
3280,kp_rrif3280,l10n_hr_chart_template_rrif,account.data_account_type_current_assets,,Odstupanje od cijene rez. dijelova na zalihi,Odstupanje od cijene rez. dijelova na zalihi
3290,kp_rrif3290,l10n_hr_chart_template_rrif,account.data_account_type_current_assets,,Vrijednosno usklađenje zaliha rezervnih dijelova,Vrijednosno usklađenje zaliha rezervnih dijelova
3500,kp_rrif3500,l10n_hr_chart_template_rrif,account.data_account_type_current_assets,,Sitan inventar na zalihi (analitika prema vrstama: alati, mjerni instrumenti, pribori, ostala sredstva rada male vrijednosti, radna i zaštitna odjeća, protupožarna i sanitetska sredstva, i dr.),Sitan inventar na zalihi (analitika prema vrstama: alati, mjerni instrumenti, pribori, ostala sredstva rada male vrijednosti, radna i zaštitna odjeća, protupožarna i sanitetska sredstva, i dr.)
3510,kp_rrif3510,l10n_hr_chart_template_rrif,account.data_account_type_current_assets,,Ambalaža na zalihi (samo vlastita i višekratna, analitika prema vrstama),Ambalaža na zalihi (samo vlastita i višekratna, analitika prema vrstama)
3520,kp_rrif3520,l10n_hr_chart_template_rrif,account.data_account_type_current_assets,,Autogume na zalihi,Autogume na zalihi
3580,kp_rrif3580,l10n_hr_chart_template_rrif,account.data_account_type_current_assets,,Odstupanje od cijene,Odstupanje od cijene
3590,kp_rrif3590,l10n_hr_chart_template_rrif,account.data_account_type_current_assets,,Vrijednosno usklađenje zaliha,Vrijednosno usklađenje zaliha
3600,kp_rrif3600,l10n_hr_chart_template_rrif,account.data_account_type_current_assets,,Sitan inventar u uporabi,Sitan inventar u uporabi
3610,kp_rrif3610,l10n_hr_chart_template_rrif,account.data_account_type_current_assets,,Ambalaža u uporabi,Ambalaža u uporabi
3620,kp_rrif3620,l10n_hr_chart_template_rrif,account.data_account_type_current_assets,,Autogume u uporabi,Autogume u uporabi
3630,kp_rrif3630,l10n_hr_chart_template_rrif,account.data_account_type_current_assets,,Otpis sitnog inventara,Otpis sitnog inventara
3640,kp_rrif3640,l10n_hr_chart_template_rrif,account.data_account_type_current_assets,,Otpis ambalaže,Otpis ambalaže
3650,kp_rrif3650,l10n_hr_chart_template_rrif,account.data_account_type_current_assets,,Otpis autoguma,Otpis autoguma
3690,kp_rrif3690,l10n_hr_chart_template_rrif,account.data_account_type_current_assets,,Vrijednosno usklađenje sitnog inventara, ambalaže i autoguma,Vrijednosno usklađenje sitnog inventara, ambalaže i autoguma
3700,kp_rrif3700,l10n_hr_chart_template_rrif,account.data_account_type_current_assets,,Predujmovi dobavljačima materijala,Predujmovi dobavljačima materijala
3710,kp_rrif3710,l10n_hr_chart_template_rrif,account.data_account_type_current_assets,,Predujmovi dobavljačima rezervnih dijelova,Predujmovi dobavljačima rezervnih dijelova
3720,kp_rrif3720,l10n_hr_chart_template_rrif,account.data_account_type_current_assets,,Predujmovi dobavljačima sitnog inventara,Predujmovi dobavljačima sitnog inventara
3730,kp_rrif3730,l10n_hr_chart_template_rrif,account.data_account_type_current_assets,,Predujmovi dani uvozniku za nabavu sirovina i materijala, dijelova i inventara,Predujmovi dani uvozniku za nabavu sirovina i materijala, dijelova i inventara
3740,kp_rrif3740,l10n_hr_chart_template_rrif,account.data_account_type_current_assets,,Predujmovi inozemnim dobavljačima,Predujmovi inozemnim dobavljačima
3790,kp_rrif3790,l10n_hr_chart_template_rrif,account.data_account_type_current_assets,,Vrijednosno usklađenje danih predujmova,Vrijednosno usklađenje danih predujmova
4000,kp_rrif4000,l10n_hr_chart_template_rrif,account.data_account_type_expenses,,Osnovni materijali i sirovine,Osnovni materijali i sirovine
4001,kp_rrif4001,l10n_hr_chart_template_rrif,account.data_account_type_expenses,,Dijelovi i sklopovi,Dijelovi i sklopovi
4002,kp_rrif4002,l10n_hr_chart_template_rrif,account.data_account_type_expenses,,Poluproizvodi za ugradnju,Poluproizvodi za ugradnju
4003,kp_rrif4003,l10n_hr_chart_template_rrif,account.data_account_type_expenses,,Pomoćni materijali (mazivo, ljepila, svrdla, pile, noževi, brusne ploče i dr.),Pomoćni materijali (mazivo, ljepila, svrdla, pile, noževi, brusne ploče i dr.)
4004,kp_rrif4004,l10n_hr_chart_template_rrif,account.data_account_type_expenses,,Potrošni materijal za čišćenje i održavanje,Potrošni materijal za čišćenje i održavanje
4005,kp_rrif4005,l10n_hr_chart_template_rrif,account.data_account_type_expenses,,Materijal za HTZ zaštitu, radna i zaštitna odjeća i obuća,Materijal za HTZ zaštitu, radna i zaštitna odjeća i obuća
4006,kp_rrif4006,l10n_hr_chart_template_rrif,account.data_account_type_expenses,,Materijal pogonske administracije i menadžmenta (uredski potrošni i sl.),Materijal pogonske administracije i menadžmenta (uredski potrošni i sl.)
4007,kp_rrif4007,l10n_hr_chart_template_rrif,account.data_account_type_expenses,,Troškovi oblikovanja proizvoda za posebne kupce,Troškovi oblikovanja proizvoda za posebne kupce
4008,kp_rrif4008,l10n_hr_chart_template_rrif,account.data_account_type_expenses,,Materijali u pomoćnoj djelatnosti (za restoran i dr.),Materijali u pomoćnoj djelatnosti (za restoran i dr.)
4009,kp_rrif4009,l10n_hr_chart_template_rrif,account.data_account_type_expenses,,Ostali izravni i opći troškovi pogona - uslužne jedinice (HSFI t. 10.17 i MRS 2, t. 10. do 19.),Ostali izravni i opći troškovi pogona - uslužne jedinice (HSFI t. 10.17 i MRS 2, t. 10. do 19.)
4010,kp_rrif4010,l10n_hr_chart_template_rrif,account.data_account_type_expenses,,Uredski materijal (papir, registratori, olovke, tiskanice, toneri, USB stickovi, ulošci, kalendari, rokovnici, kuverte i sl.),Uredski materijal (papir, registratori, olovke, tiskanice, toneri, USB stickovi, ulošci, kalendari, rokovnici, kuverte i sl.)
4011,kp_rrif4011,l10n_hr_chart_template_rrif,account.data_account_type_expenses,,Materijal i sredstva za čišćenje i održavanje,Materijal i sredstva za čišćenje i održavanje
4012,kp_rrif4012,l10n_hr_chart_template_rrif,account.data_account_type_expenses,,Troškovi otpisa sitnog inventara,Troškovi otpisa sitnog inventara
4013,kp_rrif4013,l10n_hr_chart_template_rrif,account.data_account_type_expenses,,Ambalažni materijal, vrpce za blagajne, blokovi papira, pisači, naljepnice, etikete i dr.,Ambalažni materijal, vrpce za blagajne, blokovi papira, pisači, naljepnice, etikete i dr.
4014,kp_rrif4014,l10n_hr_chart_template_rrif,account.data_account_type_expenses,,Voda (izvorska) za piće,Voda (izvorska) za piće
4015,kp_rrif4015,l10n_hr_chart_template_rrif,account.data_account_type_expenses,,Ostali napitci (sokovi, kava, čaj) za potrebe zaposlenika s PDV-om,Ostali napitci (sokovi, kava, čaj) za potrebe zaposlenika s PDV-om
4016,kp_rrif4016,l10n_hr_chart_template_rrif,account.data_account_type_expenses,,Uniformirana radna odjeća i obuća,Uniformirana radna odjeća i obuća
4017,kp_rrif4017,l10n_hr_chart_template_rrif,account.data_account_type_expenses,,Troškovi ukrasnog bilja i ukrasa (za blagdane),Troškovi ukrasnog bilja i ukrasa (za blagdane)
4018,kp_rrif4018,l10n_hr_chart_template_rrif,account.data_account_type_expenses,,Ostali materijalni troškovi trgovine,Ostali materijalni troškovi trgovine
4020,kp_rrif4020,l10n_hr_chart_template_rrif,account.data_account_type_expenses,,Troškovi projekta za temeljna istraživanja proizvoda,Troškovi projekta za temeljna istraživanja proizvoda
4021,kp_rrif4021,l10n_hr_chart_template_rrif,account.data_account_type_expenses,,Troškovi razvoja prototipova,Troškovi razvoja prototipova
4022,kp_rrif4022,l10n_hr_chart_template_rrif,account.data_account_type_expenses,,Troškovi ostalih aktivnosti,Troškovi ostalih aktivnosti
4030,kp_rrif4030,l10n_hr_chart_template_rrif,account.data_account_type_expenses,,Troškovi neodvojive ambalaže u proizvodnji (boce, limenke, kutije i dr.),Troškovi neodvojive ambalaže u proizvodnji (boce, limenke, kutije i dr.)
4031,kp_rrif4031,l10n_hr_chart_template_rrif,account.data_account_type_expenses,,Troškovi paleta, gajbi i sl.,Troškovi paleta, gajbi i sl.
4040,kp_rrif4040,l10n_hr_chart_template_rrif,account.data_account_type_expenses,,Troškovi sitnog inventara,,Troškovi sitnog inventara,
4041,kp_rrif4041,l10n_hr_chart_template_rrif,account.data_account_type_expenses,,Troškovi ambalaže (povratne, posebne) - otpis,Troškovi ambalaže (povratne, posebne) - otpis
4042,kp_rrif4042,l10n_hr_chart_template_rrif,account.data_account_type_expenses,,Troškovi autoguma (za kamione, autobuse, teretna vozila i strojeve),Troškovi autoguma (za kamione, autobuse, teretna vozila i strojeve)
4043,kp_rrif4043,l10n_hr_chart_template_rrif,account.data_account_type_expenses,,Troškovi autoguma (neto + PDV - 50%) za slučaj plaće u naravi,Troškovi autoguma (neto + PDV - 50%) za slučaj plaće u naravi
4044,kp_rrif4044,l10n_hr_chart_template_rrif,account.data_account_type_expenses,,50% troška autoguma za osobne automobile i dr. sredstva za osobni prijevoz,50% troška autoguma za osobne automobile i dr. sredstva za osobni prijevoz
4045,kp_rrif4045,l10n_hr_chart_template_rrif,account.data_account_type_expenses,,50% troška autoguma za osobne automobile i dr. sred. za osob. prijevoz (s PDV-om),50% troška autoguma za osobne automobile i dr. sred. za osob. prijevoz (s PDV-om)
4050,kp_rrif4050,l10n_hr_chart_template_rrif,account.data_account_type_expenses,,Potrošeni rezervni dijelovi za popravak vlastite opreme,Potrošeni rezervni dijelovi za popravak vlastite opreme
4051,kp_rrif4051,l10n_hr_chart_template_rrif,account.data_account_type_expenses,,Materijal za održavanje opreme i objekata,Materijal za održavanje opreme i objekata
4052,kp_rrif4052,l10n_hr_chart_template_rrif,account.data_account_type_expenses,,Trošak rez. dijelova za slučaj plaće,Trošak rez. dijelova za slučaj plaće
4055,kp_rrif4055,l10n_hr_chart_template_rrif,account.data_account_type_expenses,,50% troškova rezervnih dijelova i materijala za popravak automob., plovila i zrakopl. za osobni prijevoz,50% troškova rezervnih dijelova i materijala za popravak automob., plovila i zrakopl. za osobni prijevoz
4056,kp_rrif4056,l10n_hr_chart_template_rrif,account.data_account_type_expenses,,50% troška rezervnih dijelova i materijala za održavanje automobila i dr. za osobni prijevoz - s 50% PDV-a,50% troška rezervnih dijelova i materijala za održavanje automobila i dr. za osobni prijevoz - s 50% PDV-a
4057,kp_rrif4057,l10n_hr_chart_template_rrif,account.data_account_type_expenses,,Troškovi zamjene u jamstvenom roku,Troškovi zamjene u jamstvenom roku
