code,id,chart_template_id/id,user_type_id/id,reconcile,name,note
0000,kp_rrif0000,l10n_hr_chart_template_rrif,account.data_account_type_current_assets,,Potraživanja za upisani a neuplaćeni dionički kapital (analitika po upisnicima),Potraživanja za upisani a neuplaćeni dionički kapital (analitika po upisnicima)
0010,kp_rrif0010,l10n_hr_chart_template_rrif,account.data_account_type_current_assets,,Potraživanja iz ponovljene emisije dionica za upisane a neuplaćene svote kapitala (razrada po emisijama dionica),Potraživanja iz ponovljene emisije dionica za upisane a neuplaćene svote kapitala (razrada po emisijama dionica)
0020,kp_rrif0020,l10n_hr_chart_template_rrif,account.data_account_type_current_assets,,Potraživanja za upisani a neuplaćeni kapital u d.o.o. (analitika po članovima društva),Potraživanja za upisani a neuplaćeni kapital u d.o.o. (analitika po članovima društva)
0030,kp_rrif0030,l10n_hr_chart_template_rrif,account.data_account_type_current_assets,,Potraživanja za temeljni ulog komanditora,Potraživanja za temeljni ulog komanditora
0040,kp_rrif0040,l10n_hr_chart_template_rrif,account.data_account_type_current_assets,,Potraživanje za ostale uloge u kapital,Potraživanje za ostale uloge u kapital
0100,kp_rrif0100,l10n_hr_chart_template_rrif,account.data_account_type_non_current_assets,,Izdatci za razvoj projekta (konstruiranje i testiranje prototipova i modela, dizajn alata, naprava i kalupa i sl.,Izdatci za razvoj projekta (konstruiranje i testiranje prototipova i modela, dizajn alata, naprava i kalupa i sl.
0101,kp_rrif0101,l10n_hr_chart_template_rrif,account.data_account_type_non_current_assets,,Izdatci za razvoj proizvoda (uzorci, recepture, troškovi pronalazaka i sl.).,Izdatci za razvoj proizvoda (uzorci, recepture, troškovi pronalazaka i sl.).
0102,kp_rrif0102,l10n_hr_chart_template_rrif,account.data_account_type_non_current_assets,,Izdatci za istraživanje mineralnih blaga (MSFI 6),Izdatci za istraživanje mineralnih blaga (MSFI 6)
0110,kp_rrif0110,l10n_hr_chart_template_rrif,account.data_account_type_non_current_assets,,Ulaganje u koncesije i dozvole (za resurse, ceste, ribarenje, linije, sirovine, itd.),Ulaganje u koncesije i dozvole (za resurse, ceste, ribarenje, linije, sirovine, itd.)
0111,kp_rrif0111,l10n_hr_chart_template_rrif,account.data_account_type_non_current_assets,,Ulaganje u patente, žigove i tehnologiju, inovacije, tehničku i tehnološku dokumentaciju za proizvodnju proizvoda ili pružanje usluga,Ulaganje u patente, žigove i tehnologiju, inovacije, tehničku i tehnološku dokumentaciju za proizvodnju proizvoda ili pružanje usluga
0112,kp_rrif0112,l10n_hr_chart_template_rrif,account.data_account_type_non_current_assets,,Ulaganje u licenciju i franšizu,Ulaganje u licenciju i franšizu
0113,kp_rrif0113,l10n_hr_chart_template_rrif,account.data_account_type_non_current_assets,,Robne marke (trgovačko ime, lista kupaca, industrijska prava, marketinška prava, uslužne marke i sl. prava),Robne marke (trgovačko ime, lista kupaca, industrijska prava, marketinška prava, uslužne marke i sl. prava)
0114,kp_rrif0114,l10n_hr_chart_template_rrif,account.data_account_type_non_current_assets,,Ulaganje u tržišni udio (otkup prava distribucije za neko područje),Ulaganje u tržišni udio (otkup prava distribucije za neko područje)
0120,kp_rrif0120,l10n_hr_chart_template_rrif,account.data_account_type_non_current_assets,,Softver,Softver
01200,kp_rrif01200,l10n_hr_chart_template_rrif,account.data_account_type_non_current_assets,,Ulaganje u računalni softver,Ulaganje u računalni softver
01201,kp_rrif01201,l10n_hr_chart_template_rrif,account.data_account_type_non_current_assets,,Ulaganje u internetske stranice,Ulaganje u internetske stranice
0121,kp_rrif0121,l10n_hr_chart_template_rrif,account.data_account_type_non_current_assets,,Nematerijalna dugotrajna prava,Nematerijalna dugotrajna prava
01210,kp_rrif01210,l10n_hr_chart_template_rrif,account.data_account_type_non_current_assets,,Ulaganje u autorska i dr. prava korištenja,Ulaganje u autorska i dr. prava korištenja
01211,kp_rrif01211,l10n_hr_chart_template_rrif,account.data_account_type_non_current_assets,,Ulaganje u znanje (know-how), dizajn,Ulaganje u znanje (know-how), dizajn
01212,kp_rrif01212,l10n_hr_chart_template_rrif,account.data_account_type_non_current_assets,,Ulaganje u pravo reproduciranja (npr. filmova, pravo objave u izdavaštvu i sl.),Ulaganje u pravo reproduciranja (npr. filmova, pravo objave u izdavaštvu i sl.)
01213,kp_rrif01213,l10n_hr_chart_template_rrif,account.data_account_type_non_current_assets,,Ulaganja na tuđoj imovini radi poboljšanja (nekretnina, opreme i sl.),Ulaganja na tuđoj imovini radi poboljšanja (nekretnina, opreme i sl.)
01214,kp_rrif01214,l10n_hr_chart_template_rrif,account.data_account_type_non_current_assets,,Ulaganje u dugogodišnje pravo uporabe (prema ugovoru) - npr. višegod. plaćeni zakup,Ulaganje u dugogodišnje pravo uporabe (prema ugovoru) - npr. višegod. plaćeni zakup
01215,kp_rrif01215,l10n_hr_chart_template_rrif,account.data_account_type_non_current_assets,,Ulaganje u pravo suvlasništva opreme,Ulaganje u pravo suvlasništva opreme
0122,kp_rrif0122,l10n_hr_chart_template_rrif,account.data_account_type_non_current_assets,,Ostala prava,Ostala prava
01220,kp_rrif01220,l10n_hr_chart_template_rrif,account.data_account_type_non_current_assets,,Založno pravo i hipoteke (realizirane),Založno pravo i hipoteke (realizirane)
01221,kp_rrif01221,l10n_hr_chart_template_rrif,account.data_account_type_non_current_assets,,Pravo angažiranja povećane snage električne energije,Pravo angažiranja povećane snage električne energije
01222,kp_rrif01222,l10n_hr_chart_template_rrif,account.data_account_type_non_current_assets,,Ostala dugogodišnja prava,Ostala dugogodišnja prava
01223,kp_rrif01223,l10n_hr_chart_template_rrif,account.data_account_type_non_current_assets,,Imovina u operativnom najmu (analitika prema vrsti),Imovina u operativnom najmu (analitika prema vrsti)
0130,kp_rrif0130,l10n_hr_chart_template_rrif,account.data_account_type_non_current_assets,,Goodwill,Goodwill
0140,kp_rrif0140,l10n_hr_chart_template_rrif,account.data_account_type_non_current_assets,,Pravo građenja, pravo prolaza i sl.,Pravo građenja, pravo prolaza i sl.
0141,kp_rrif0141,l10n_hr_chart_template_rrif,account.data_account_type_non_current_assets,,Filmovi, glazbeni zapisi,Filmovi, glazbeni zapisi
0142,kp_rrif0142,l10n_hr_chart_template_rrif,account.data_account_type_non_current_assets,,Ostala nematerijalna prava,Ostala nematerijalna prava
0150,kp_rrif0150,l10n_hr_chart_template_rrif,account.data_account_type_non_current_assets,,Predujmovi za razvoj,Predujmovi za razvoj
0151,kp_rrif0151,l10n_hr_chart_template_rrif,account.data_account_type_non_current_assets,,Predujmovi za koncesije,Predujmovi za koncesije
0152,kp_rrif0152,l10n_hr_chart_template_rrif,account.data_account_type_non_current_assets,,Predujmovi za patente, licencije i dr.,Predujmovi za patente, licencije i dr.
0153,kp_rrif0153,l10n_hr_chart_template_rrif,account.data_account_type_non_current_assets,,Predujmovi za robne ili uslužne marke,Predujmovi za robne ili uslužne marke
0154,kp_rrif0154,l10n_hr_chart_template_rrif,account.data_account_type_non_current_assets,,Predujmovi za nabavu softvera,Predujmovi za nabavu softvera
0155,kp_rrif0155,l10n_hr_chart_template_rrif,account.data_account_type_non_current_assets,,Predujmovi za nabavu ostalih prava uporabe,Predujmovi za nabavu ostalih prava uporabe
0156,kp_rrif0156,l10n_hr_chart_template_rrif,account.data_account_type_non_current_assets,,Predujmovi za ostala nematerijalna prava,Predujmovi za ostala nematerijalna prava
0160,kp_rrif0160,l10n_hr_chart_template_rrif,account.data_account_type_non_current_assets,,Bitcoin,Bitcoin
0161,kp_rrif0161,l10n_hr_chart_template_rrif,account.data_account_type_non_current_assets,,Ethereum,Ethereum
0162,kp_rrif0162,l10n_hr_chart_template_rrif,account.data_account_type_non_current_assets,,Ostale kriptovalute,Ostale kriptovalute
0170,kp_rrif0170,l10n_hr_chart_template_rrif,account.data_account_type_non_current_assets,,Nematerijalna imovina u pripremi (analitika prema vrsti računa skupine 01),Nematerijalna imovina u pripremi (analitika prema vrsti računa skupine 01)
0180,kp_rrif0180,l10n_hr_chart_template_rrif,account.data_account_type_non_current_assets,,Vrijednosno usklađenje nematerijalne imovine (analitika prema vrsti računa skupine 01),Vrijednosno usklađenje nematerijalne imovine (analitika prema vrsti računa skupine 01)
0190,kp_rrif0190,l10n_hr_chart_template_rrif,account.data_account_type_non_current_assets,,Akumulirana amortizacija izdataka za razvoj,Akumulirana amortizacija izdataka za razvoj
0191,kp_rrif0191,l10n_hr_chart_template_rrif,account.data_account_type_non_current_assets,,Akumulirana amortizacija koncesija, patenata, licencija i sl.,Akumulirana amortizacija koncesija, patenata, licencija i sl.
0192,kp_rrif0192,l10n_hr_chart_template_rrif,account.data_account_type_non_current_assets,,Akumulirana amortizacija robne i uslužne marke,Akumulirana amortizacija robne i uslužne marke
0193,kp_rrif0193,l10n_hr_chart_template_rrif,account.data_account_type_non_current_assets,,Akumulirana amortizacija softvera,Akumulirana amortizacija softvera
0194,kp_rrif0194,l10n_hr_chart_template_rrif,account.data_account_type_non_current_assets,,Akumulirana amortizacija goodwilla (v. napom. 3.),Akumulirana amortizacija goodwilla (v. napom. 3.)
0195,kp_rrif0195,l10n_hr_chart_template_rrif,account.data_account_type_non_current_assets,,Akumulirana amortizacija ulaganja na tuđoj imovini,Akumulirana amortizacija ulaganja na tuđoj imovini
0196,kp_rrif0196,l10n_hr_chart_template_rrif,account.data_account_type_non_current_assets,,Akumulirana amortizacija imovine u operativnom najmu (MSFI 16),Akumulirana amortizacija imovine u operativnom najmu (MSFI 16)
0199,kp_rrif0199,l10n_hr_chart_template_rrif,account.data_account_type_non_current_assets,,Akumulirana amortizacija ostale nematerijalne imovine,Akumulirana amortizacija ostale nematerijalne imovine
0200,kp_rrif0200,l10n_hr_chart_template_rrif,account.data_account_type_non_current_assets,,Građevinsko zemljište (bez zgrada),Građevinsko zemljište (bez zgrada)
0201,kp_rrif0201,l10n_hr_chart_template_rrif,account.data_account_type_non_current_assets,,Poljoprivredno zemljište,Poljoprivredno zemljište
0202,kp_rrif0202,l10n_hr_chart_template_rrif,account.data_account_type_non_current_assets,,Zemljište za eksploataciju kamena, gline, šljunka i pijeska,Zemljište za eksploataciju kamena, gline, šljunka i pijeska
0203,kp_rrif0203,l10n_hr_chart_template_rrif,account.data_account_type_non_current_assets,,Zemljište sa supstancijalnom potrošnjom ili odlagališta,Zemljište sa supstancijalnom potrošnjom ili odlagališta
0204,kp_rrif0204,l10n_hr_chart_template_rrif,account.data_account_type_non_current_assets,,Zemljište pod prometnicama, dvorištima, parkiralištima i sl.,Zemljište pod prometnicama, dvorištima, parkiralištima i sl.
0205,kp_rrif0205,l10n_hr_chart_template_rrif,account.data_account_type_non_current_assets,,Zemljišta pod dugogodišnjim nasadima, parkovima, vrtovima, šumama i sl.,Zemljišta pod dugogodišnjim nasadima, parkovima, vrtovima, šumama i sl.
0206,kp_rrif0206,l10n_hr_chart_template_rrif,account.data_account_type_non_current_assets,,Čista neobrađena i nezasađena zemljišta i kamenjari,Čista neobrađena i nezasađena zemljišta i kamenjari
0207,kp_rrif0207,l10n_hr_chart_template_rrif,account.data_account_type_non_current_assets,,Zemljišta ispod građevina,Zemljišta ispod građevina
0208,kp_rrif0208,l10n_hr_chart_template_rrif,account.data_account_type_non_current_assets,,Zemljište za deponije smeća i otpada,Zemljište za deponije smeća i otpada
0209,kp_rrif0209,l10n_hr_chart_template_rrif,account.data_account_type_non_current_assets,,Zemljišta - ostalo,Zemljišta - ostalo
0210,kp_rrif0210,l10n_hr_chart_template_rrif,account.data_account_type_non_current_assets,,Zemljište s upisanim pravom građenja (plaćena za više godina),Zemljište s upisanim pravom građenja (plaćena za više godina)
0211,kp_rrif0211,l10n_hr_chart_template_rrif,account.data_account_type_non_current_assets,,Pravo služnosti na zemljištu (plaćena za više godina),Pravo služnosti na zemljištu (plaćena za više godina)
0212,kp_rrif0212,l10n_hr_chart_template_rrif,account.data_account_type_non_current_assets,,Zemljišta u zakupu (plaćena za više godina),Zemljišta u zakupu (plaćena za više godina)
0230,kp_rrif0230,l10n_hr_chart_template_rrif,account.data_account_type_non_current_assets,,Poslovne zgrade, uredi i lokali,Poslovne zgrade, uredi i lokali
0231,kp_rrif0231,l10n_hr_chart_template_rrif,account.data_account_type_non_current_assets,,Tvorničke zgrade, hale i radionice,Tvorničke zgrade, hale i radionice
0232,kp_rrif0232,l10n_hr_chart_template_rrif,account.data_account_type_non_current_assets,,Zgrade trgovine, hotela, motela, restorana,Zgrade trgovine, hotela, motela, restorana
0233,kp_rrif0233,l10n_hr_chart_template_rrif,account.data_account_type_non_current_assets,,Skladišta, silosi, nadstrešnice i garaže, staklenici, sušionice, hladnjače,Skladišta, silosi, nadstrešnice i garaže, staklenici, sušionice, hladnjače
0234,kp_rrif0234,l10n_hr_chart_template_rrif,account.data_account_type_non_current_assets,,Zgrade montažne, barake, mostovi, drvene konstrukcije i sl.,Zgrade montažne, barake, mostovi, drvene konstrukcije i sl.
0235,kp_rrif0235,l10n_hr_chart_template_rrif,account.data_account_type_non_current_assets,,Ograde (betonske, kamene, metalne i sl.), izlozi, potporni zidovi - brane, športski tereni, šatori, žičare i sl.,Ograde (betonske, kamene, metalne i sl.), izlozi, potporni zidovi - brane, športski tereni, šatori, žičare i sl.
0236,kp_rrif0236,l10n_hr_chart_template_rrif,account.data_account_type_non_current_assets,,Putovi, parkirališta, staze i dr. građevine (rampe i sl.), nadvožnjaci i dr. betonske ili metalne konstrukcije,Putovi, parkirališta, staze i dr. građevine (rampe i sl.), nadvožnjaci i dr. betonske ili metalne konstrukcije
0237,kp_rrif0237,l10n_hr_chart_template_rrif,account.data_account_type_non_current_assets,,Cjevovodi, vodospremnici, utvrđene obale, kanali, kanalizacija, dalekovodi,Cjevovodi, vodospremnici, utvrđene obale, kanali, kanalizacija, dalekovodi
0238,kp_rrif0238,l10n_hr_chart_template_rrif,account.data_account_type_non_current_assets,,Objekti poljoprivrede i ribarstva,Objekti poljoprivrede i ribarstva
0239,kp_rrif0239,l10n_hr_chart_template_rrif,account.data_account_type_non_current_assets,,Ostali građevinski objekti (rudnici, brane) i objekti izvan uporabe,Ostali građevinski objekti (rudnici, brane) i objekti izvan uporabe
0240,kp_rrif0240,l10n_hr_chart_template_rrif,account.data_account_type_non_current_assets,,Stanovi za vlastite zaposlenike,Stanovi za vlastite zaposlenike
0260,kp_rrif0260,l10n_hr_chart_template_rrif,account.data_account_type_non_current_assets,,Predujmovi za nabavu zemljišta,Predujmovi za nabavu zemljišta
0261,kp_rrif0261,l10n_hr_chart_template_rrif,account.data_account_type_non_current_assets,,Predujmovi za građevine u nabavi,Predujmovi za građevine u nabavi
0270,kp_rrif0270,l10n_hr_chart_template_rrif,account.data_account_type_non_current_assets,,Zemljišta u pripremi,Zemljišta u pripremi
0271,kp_rrif0271,l10n_hr_chart_template_rrif,account.data_account_type_non_current_assets,,Građevine u pripremi,Građevine u pripremi
0280,kp_rrif0280,l10n_hr_chart_template_rrif,account.data_account_type_non_current_assets,,Vrijednosno usklađenje zemljišta,Vrijednosno usklađenje zemljišta
0290,kp_rrif0290,l10n_hr_chart_template_rrif,account.data_account_type_non_current_assets,,Akumulirana amortizacija građevina (analitika prema pojedinim građevinama),Akumulirana amortizacija građevina (analitika prema pojedinim građevinama)
0291,kp_rrif0291,l10n_hr_chart_template_rrif,account.data_account_type_non_current_assets,,Akumulirana amortizacija odlagališta otpada, kamenoloma i sl. (MRS 16., t. 58.),Akumulirana amortizacija odlagališta otpada, kamenoloma i sl. (MRS 16., t. 58.)
0300,kp_rrif0300,l10n_hr_chart_template_rrif,account.data_account_type_non_current_assets,,Tehnička postrojenja, uređaji, spremnici, pogonski motori, platforme i dr.,Tehnička postrojenja, uređaji, spremnici, pogonski motori, platforme i dr.
0301,kp_rrif0301,l10n_hr_chart_template_rrif,account.data_account_type_non_current_assets,,Strojevi i alati u svezi sa strojevima u pogonima i radionicama za obradu i preradu,Strojevi i alati u svezi sa strojevima u pogonima i radionicama za obradu i preradu
0302,kp_rrif0302,l10n_hr_chart_template_rrif,account.data_account_type_non_current_assets,,Energetska postrojenja (kotlovnice, generatori, naponske i solarne ćelije, vjetro-elektrane, toplinske crpke i dr.),Energetska postrojenja (kotlovnice, generatori, naponske i solarne ćelije, vjetro-elektrane, toplinske crpke i dr.)
0303,kp_rrif0303,l10n_hr_chart_template_rrif,account.data_account_type_non_current_assets,,Rashladna postrojenja,Rashladna postrojenja
0304,kp_rrif0304,l10n_hr_chart_template_rrif,account.data_account_type_non_current_assets,,Pokretna postrojenja (dizala, pokretne stepenice, elevatori, pokretne trake i sl.),Pokretna postrojenja (dizala, pokretne stepenice, elevatori, pokretne trake i sl.)
0305,kp_rrif0305,l10n_hr_chart_template_rrif,account.data_account_type_non_current_assets,,Automatske autopraonice i sl. oprema,Automatske autopraonice i sl. oprema
0306,kp_rrif0306,l10n_hr_chart_template_rrif,account.data_account_type_non_current_assets,,Mlinska i separatorska postrojenja,Mlinska i separatorska postrojenja
0307,kp_rrif0307,l10n_hr_chart_template_rrif,account.data_account_type_non_current_assets,,Postrojenje za pakiranje, ambalažu i sl.,Postrojenje za pakiranje, ambalažu i sl.
0308,kp_rrif0308,l10n_hr_chart_template_rrif,account.data_account_type_non_current_assets,,Brodska postrojenja (dizalice, motori),Brodska postrojenja (dizalice, motori)
0309,kp_rrif0309,l10n_hr_chart_template_rrif,account.data_account_type_non_current_assets,,Ostala postrojenja i postrojenja izvan uporabe,Ostala postrojenja i postrojenja izvan uporabe
0310,kp_rrif0310,l10n_hr_chart_template_rrif,account.data_account_type_non_current_assets,,Uredska oprema (fotokopirni aparati, telefaksi, blagajne, alarmi, klimatizacijski uređaji, hladnjaci, televizori, i dr.),Uredska oprema (fotokopirni aparati, telefaksi, blagajne, alarmi, klimatizacijski uređaji, hladnjaci, televizori, i dr.)
0311,kp_rrif0311,l10n_hr_chart_template_rrif,account.data_account_type_non_current_assets,,Računalna oprema,Računalna oprema
0312,kp_rrif0312,l10n_hr_chart_template_rrif,account.data_account_type_non_current_assets,,Telekomunikacijska oprema (mobiteli, tel. centrale, antene i sl.),Telekomunikacijska oprema (mobiteli, tel. centrale, antene i sl.)
0313,kp_rrif0313,l10n_hr_chart_template_rrif,account.data_account_type_non_current_assets,,Oprema trgovine (blagajne, hladnjaci, i dr.),Oprema trgovine (blagajne, hladnjaci, i dr.)
0314,kp_rrif0314,l10n_hr_chart_template_rrif,account.data_account_type_non_current_assets,,Oprema ugostiteljstva, hotela i sl. (aparati, štednjaci, hladnjaci, pokućstvo i sl.),Oprema ugostiteljstva, hotela i sl. (aparati, štednjaci, hladnjaci, pokućstvo i sl.)
0315,kp_rrif0315,l10n_hr_chart_template_rrif,account.data_account_type_non_current_assets,,Oprema servisa (dizalice, ispitni uređaji, aparati i dr.),Oprema servisa (dizalice, ispitni uređaji, aparati i dr.)
0316,kp_rrif0316,l10n_hr_chart_template_rrif,account.data_account_type_non_current_assets,,Oprema za graditeljstvo i montažu (kranovi, bageri, skele, oplate, miješalice, dizalice, valjci i sl.),Oprema za graditeljstvo i montažu (kranovi, bageri, skele, oplate, miješalice, dizalice, valjci i sl.)
0317,kp_rrif0317,l10n_hr_chart_template_rrif,account.data_account_type_non_current_assets,,Oprema (aparati) grijanja/hlađenja,Oprema (aparati) grijanja/hlađenja
0318,kp_rrif0318,l10n_hr_chart_template_rrif,account.data_account_type_non_current_assets,,Oprema zaštite na radu i protupožarne zaštite,Oprema zaštite na radu i protupožarne zaštite
0319,kp_rrif0319,l10n_hr_chart_template_rrif,account.data_account_type_non_current_assets,,Ostala oprema i oprema izvan uporabe,Ostala oprema i oprema izvan uporabe
0320,kp_rrif0320,l10n_hr_chart_template_rrif,account.data_account_type_non_current_assets,,Transportna imovina,Transportna imovina
03200,kp_rrif03200,l10n_hr_chart_template_rrif,account.data_account_type_non_current_assets,,Putnička vozila (osobna i putnički kombi) i motor kotači,Putnička vozila (osobna i putnički kombi) i motor kotači
032000,kp_rrif032000,l10n_hr_chart_template_rrif,account.data_account_type_non_current_assets,,Osobni automobili za osobni prijevoz,Osobni automobili za osobni prijevoz
032001,kp_rrif032001,l10n_hr_chart_template_rrif,account.data_account_type_non_current_assets,,Osobni automobili za obavljanje djelatnosti (iznajmljivanje, servisna služba itd.),Osobni automobili za obavljanje djelatnosti (iznajmljivanje, servisna služba itd.)
03201,kp_rrif03201,l10n_hr_chart_template_rrif,account.data_account_type_non_current_assets,,Teretna i vučna vozila, tegljači i kamioni, cisterne i hladnjače,Teretna i vučna vozila, tegljači i kamioni, cisterne i hladnjače
03202,kp_rrif03202,l10n_hr_chart_template_rrif,account.data_account_type_non_current_assets,,Priključna transportna sredstva (prikolice),Priključna transportna sredstva (prikolice)
03203,kp_rrif03203,l10n_hr_chart_template_rrif,account.data_account_type_non_current_assets,,Teretna dostavna i kombi vozila,Teretna dostavna i kombi vozila
03204,kp_rrif03204,l10n_hr_chart_template_rrif,account.data_account_type_non_current_assets,,Auto miješalice, auto crpke za beton, auto dizalice i sl.,Auto miješalice, auto crpke za beton, auto dizalice i sl.
03205,kp_rrif03205,l10n_hr_chart_template_rrif,account.data_account_type_non_current_assets,,Autobusi,Autobusi
03206,kp_rrif03206,l10n_hr_chart_template_rrif,account.data_account_type_non_current_assets,,Zrakoplovi,Zrakoplovi
03207,kp_rrif03207,l10n_hr_chart_template_rrif,account.data_account_type_non_current_assets,,Brodovi (veći od 1000 BRT),Brodovi (veći od 1000 BRT)
03208,kp_rrif03208,l10n_hr_chart_template_rrif,account.data_account_type_non_current_assets,,Brodice, jahte i ost. plovila,Brodice, jahte i ost. plovila
03209,kp_rrif03209,l10n_hr_chart_template_rrif,account.data_account_type_non_current_assets,,Ostala transportna sredstva i uređaji (gusjeničari, el. vozila, viljuškari, vagoni, traktori za vuču, bicikli i dr.),Ostala transportna sredstva i uređaji (gusjeničari, el. vozila, viljuškari, vagoni, traktori za vuču, bicikli i dr.)
0321,kp_rrif0321,l10n_hr_chart_template_rrif,account.data_account_type_non_current_assets,,Pokućstvo - inventar,Pokućstvo - inventar
03210,kp_rrif03210,l10n_hr_chart_template_rrif,account.data_account_type_non_current_assets,,Uredsko pokućstvo, sagovi, zavjese i sl.,Uredsko pokućstvo, sagovi, zavjese i sl.
03211,kp_rrif03211,l10n_hr_chart_template_rrif,account.data_account_type_non_current_assets,,Inventar trgovine (police, pregrade, pultovi),Inventar trgovine (police, pregrade, pultovi)
03212,kp_rrif03212,l10n_hr_chart_template_rrif,account.data_account_type_non_current_assets,,Ugostiteljsko i hotelsko pokućstvo i inventar,Ugostiteljsko i hotelsko pokućstvo i inventar
03213,kp_rrif03213,l10n_hr_chart_template_rrif,account.data_account_type_non_current_assets,,Ostalo pokućstvo i inventar,Ostalo pokućstvo i inventar
0322,kp_rrif0322,l10n_hr_chart_template_rrif,account.data_account_type_non_current_assets,,Pogonski i skladišni inventar (stalaže, zatvoreni ormari, skele, oplate, protupožarni aparati, zaštitna sredstva i sl.),Pogonski i skladišni inventar (stalaže, zatvoreni ormari, skele, oplate, protupožarni aparati, zaštitna sredstva i sl.)
0323,kp_rrif0323,l10n_hr_chart_template_rrif,account.data_account_type_non_current_assets,,Alati, mjerni i kontrolni instrumenti i pomoćna oprema,Alati, mjerni i kontrolni instrumenti i pomoćna oprema
0324,kp_rrif0324,l10n_hr_chart_template_rrif,account.data_account_type_non_current_assets,,Audio i video aparati, kamere, parkir. rampe i sl.,Audio i video aparati, kamere, parkir. rampe i sl.
0325,kp_rrif0325,l10n_hr_chart_template_rrif,account.data_account_type_non_current_assets,,Reklame (svjetleće), stupovi i sl.,Reklame (svjetleće), stupovi i sl.
0326,kp_rrif0326,l10n_hr_chart_template_rrif,account.data_account_type_non_current_assets,,Inventar ustanova (aparati, kreveti, ormari, stolovi i sl.),Inventar ustanova (aparati, kreveti, ormari, stolovi i sl.)
0327,kp_rrif0327,l10n_hr_chart_template_rrif,account.data_account_type_non_current_assets,,Ostali inventar (spremnici i dr.),Ostali inventar (spremnici i dr.)
0328,kp_rrif0328,l10n_hr_chart_template_rrif,account.data_account_type_non_current_assets,,Višegodišnja ambalaža,Višegodišnja ambalaža
0329,kp_rrif0329,l10n_hr_chart_template_rrif,account.data_account_type_non_current_assets,,Alati, inventar i vozila izvan uporabe,Alati, inventar i vozila izvan uporabe
0330,kp_rrif0330,l10n_hr_chart_template_rrif,account.data_account_type_non_current_assets,,50% pretporeza od osobnih automobila,50% pretporeza od osobnih automobila
0331,kp_rrif0331,l10n_hr_chart_template_rrif,account.data_account_type_non_current_assets,,50% i 100% pretporeza od osobnih automobila (n. v. veće od 400.000,00 kn koji su nabavljeni do 31.12.2018.),50% i 100% pretporeza od osobnih automobila (n. v. veće od 400.000,00 kn koji su nabavljeni do 31.12.2018.)
0332,kp_rrif0332,l10n_hr_chart_template_rrif,account.data_account_type_non_current_assets,,50% pretporeza od brodova, jahti i dr.,50% pretporeza od brodova, jahti i dr.
