code,id,chart_template_id/id,user_type_id/id,reconcile,name,note
1444,kp_rrif1444,l10n_hr_chart_template_rrif,account.data_account_type_current_assets,,Potraživanja za trošarinu na električnu energiju i energente,Potraživanja za trošarinu na električnu energiju i energente
1445,kp_rrif1445,l10n_hr_chart_template_rrif,account.data_account_type_current_assets,,Potraživanja za trošarinu na duhanske proizvode duhanske prerađevine,Potraživanja za trošarinu na duhanske proizvode duhanske prerađevine
1446,kp_rrif1446,l10n_hr_chart_template_rrif,account.data_account_type_current_assets,,Potraživanja za trošarinu na energente - naftni derivati i naknade za ceste,Potraživanja za trošarinu na energente - naftni derivati i naknade za ceste
1447,kp_rrif1447,l10n_hr_chart_template_rrif,account.data_account_type_current_assets,,Potraživanja za 3% poreza na promet nekretnina,Potraživanja za 3% poreza na promet nekretnina
1448,kp_rrif1448,l10n_hr_chart_template_rrif,account.data_account_type_current_assets,,Potraživanja za upravnu pristojbu,Potraživanja za upravnu pristojbu
1450,kp_rrif1450,l10n_hr_chart_template_rrif,account.data_account_type_current_assets,,Potraživanja za plaćenu ili više plaćenu članarinu TZ,Potraživanja za plaćenu ili više plaćenu članarinu TZ
1460,kp_rrif1460,l10n_hr_chart_template_rrif,account.data_account_type_current_assets,,Potraživanja za članarine komori (HGK ili HOK i dr.),Potraživanja za članarine komori (HGK ili HOK i dr.)
1470,kp_rrif1470,l10n_hr_chart_template_rrif,account.data_account_type_current_assets,,Potraživanja za carinu i više plaćene carinske pristojbe,Potraživanja za carinu i više plaćene carinske pristojbe
1480,kp_rrif1480,l10n_hr_chart_template_rrif,account.data_account_type_current_assets,,Potraživanja za više plaćeni porez na cestovna motorna vozila i plovne objekte,Potraživanja za više plaćeni porez na cestovna motorna vozila i plovne objekte
1481,kp_rrif1481,l10n_hr_chart_template_rrif,account.data_account_type_current_assets,,Potraživanja za porez na kuće za odmor i korištenje javnih površina,Potraživanja za porez na kuće za odmor i korištenje javnih površina
1482,kp_rrif1482,l10n_hr_chart_template_rrif,account.data_account_type_current_assets,,Potraživanja za porez na reklamu,Potraživanja za porez na reklamu
1483,kp_rrif1483,l10n_hr_chart_template_rrif,account.data_account_type_current_assets,,Potraživanja za porez na potrošnju u ugostiteljstvu,Potraživanja za porez na potrošnju u ugostiteljstvu
1484,kp_rrif1484,l10n_hr_chart_template_rrif,account.data_account_type_current_assets,,Potraživanja za plaćeni porez na priređivanje zabavnih i športskih priredbi,Potraživanja za plaćeni porez na priređivanje zabavnih i športskih priredbi
1485,kp_rrif1485,l10n_hr_chart_template_rrif,account.data_account_type_current_assets,,Potraživanja za plaćeni porez na nasljedstva i darove,Potraživanja za plaćeni porez na nasljedstva i darove
1486,kp_rrif1486,l10n_hr_chart_template_rrif,account.data_account_type_current_assets,,Potraživanja za više plaćeni porez na imovinu,Potraživanja za više plaćeni porez na imovinu
1487,kp_rrif1487,l10n_hr_chart_template_rrif,account.data_account_type_current_assets,,Potraživanja za ostale poreze županije (grada), općine,Potraživanja za ostale poreze županije (grada), općine
1490,kp_rrif1490,l10n_hr_chart_template_rrif,account.data_account_type_current_assets,,Potraživanja za više plaćenu nadoknadu za šume,Potraživanja za više plaćenu nadoknadu za šume
1491,kp_rrif1491,l10n_hr_chart_template_rrif,account.data_account_type_current_assets,,Potraživanje za sred. za komunalnu izgradnju,Potraživanje za sred. za komunalnu izgradnju
1492,kp_rrif1492,l10n_hr_chart_template_rrif,account.data_account_type_current_assets,,Potraživanja za više plaćene kazne i sl.,Potraživanja za više plaćene kazne i sl.
1493,kp_rrif1493,l10n_hr_chart_template_rrif,account.data_account_type_current_assets,,Potraživanja za turističku pristojbu,Potraživanja za turističku pristojbu
1494,kp_rrif1494,l10n_hr_chart_template_rrif,account.data_account_type_current_assets,,Potraživanja za više uplaćene naknade za iskorištavanje mineralnih sirovina,Potraživanja za više uplaćene naknade za iskorištavanje mineralnih sirovina
1495,kp_rrif1495,l10n_hr_chart_template_rrif,account.data_account_type_current_assets,,Potraživanja za više plaćene poreze na koncesije,Potraživanja za više plaćene poreze na koncesije
1496,kp_rrif1496,l10n_hr_chart_template_rrif,account.data_account_type_current_assets,,Potraživanja za spomeničku rentu,Potraživanja za spomeničku rentu
1497,kp_rrif1497,l10n_hr_chart_template_rrif,account.data_account_type_current_assets,,Potraživanje od Fonda za zaštitu okoliša (ambalažu),Potraživanje od Fonda za zaštitu okoliša (ambalažu)
1499,kp_rrif1499,l10n_hr_chart_template_rrif,account.data_account_type_current_assets,,Potraživanja za ostala više plaćena davanja,Potraživanja za ostala više plaćena davanja
1500,kp_rrif1500,l10n_hr_chart_template_rrif,account.data_account_type_current_assets,,Potraživanje za nadoknade bolovanja od HZZO,Potraživanje za nadoknade bolovanja od HZZO
1510,kp_rrif1510,l10n_hr_chart_template_rrif,account.data_account_type_current_assets,,Potraživanja od mirovinskog osiguranja,Potraživanja od mirovinskog osiguranja
1520,kp_rrif1520,l10n_hr_chart_template_rrif,account.data_account_type_current_assets,,Potraživanja od lokalne samouprave,Potraživanja od lokalne samouprave
1530,kp_rrif1530,l10n_hr_chart_template_rrif,account.data_account_type_current_assets,,Potraživanje za regrese, premije, stimulac. i držav. potpore,Potraživanje za regrese, premije, stimulac. i držav. potpore
1540,kp_rrif1540,l10n_hr_chart_template_rrif,account.data_account_type_current_assets,,Potraživanje od Fonda za otkupljenu ambalažu,Potraživanje od Fonda za otkupljenu ambalažu
1550,kp_rrif1550,l10n_hr_chart_template_rrif,account.data_account_type_current_assets,,Ostala potraživanja od državnih institucija,Ostala potraživanja od državnih institucija
1560,kp_rrif1560,l10n_hr_chart_template_rrif,account.data_account_type_current_assets,,Potraživanja za više plaćenu naknadu s temelja invaliditeta,Potraživanja za više plaćenu naknadu s temelja invaliditeta
1590,kp_rrif1590,l10n_hr_chart_template_rrif,account.data_account_type_current_assets,,Vrijednosno usklađenje potraživanja od države i drugih institucija,Vrijednosno usklađenje potraživanja od države i drugih institucija
1900,kp_rrif1900,l10n_hr_chart_template_rrif,account.data_account_type_current_assets,,Unaprijed plaćeni troškovi održavanja, opreme, postrojenja i građevina,Unaprijed plaćeni troškovi održavanja, opreme, postrojenja i građevina
1901,kp_rrif1901,l10n_hr_chart_template_rrif,account.data_account_type_current_assets,,Unaprijed plaćena zakupnina iz operativnog - poslovnog najma,Unaprijed plaćena zakupnina iz operativnog - poslovnog najma
19010,kp_rrif19010,l10n_hr_chart_template_rrif,account.data_account_type_current_assets,,Unaprijed plaćena zakupnina,Unaprijed plaćena zakupnina
19011,kp_rrif19011,l10n_hr_chart_template_rrif,account.data_account_type_current_assets,,Unaprijed plaćeni a nepriznati PDV na zakupninu (osob. automobila),Unaprijed plaćeni a nepriznati PDV na zakupninu (osob. automobila)
1902,kp_rrif1902,l10n_hr_chart_template_rrif,account.data_account_type_current_assets,,Unaprijed plaćeni troškovi reklame, propagande i sajmova,Unaprijed plaćeni troškovi reklame, propagande i sajmova
1903,kp_rrif1903,l10n_hr_chart_template_rrif,account.data_account_type_current_assets,,Unaprijed plaćeni troškovi energije za sljedeće razdoblje,Unaprijed plaćeni troškovi energije za sljedeće razdoblje
1904,kp_rrif1904,l10n_hr_chart_template_rrif,account.data_account_type_current_assets,,Unaprijed plaćeni troškovi osiguranja imovine i osoba koje rade na opasnim poslovima ili putnika u prometu i sl.,Unaprijed plaćeni troškovi osiguranja imovine i osoba koje rade na opasnim poslovima ili putnika u prometu i sl.
1905,kp_rrif1905,l10n_hr_chart_template_rrif,account.data_account_type_current_assets,,Unaprijed plaćene kamate na bankovna jamstava i sl.,Unaprijed plaćene kamate na bankovna jamstava i sl.
1906,kp_rrif1906,l10n_hr_chart_template_rrif,account.data_account_type_current_assets,,Unaprijed plaćeni troškovi reprezentacije,Unaprijed plaćeni troškovi reprezentacije
1907,kp_rrif1907,l10n_hr_chart_template_rrif,account.data_account_type_current_assets,,Unaprijed plaćene pretplate na službena glasila i stručne časopise,Unaprijed plaćene pretplate na službena glasila i stručne časopise
1908,kp_rrif1908,l10n_hr_chart_template_rrif,account.data_account_type_current_assets,,Unaprijed isplaćene plaće za buduće razdoblje,Unaprijed isplaćene plaće za buduće razdoblje
1909,kp_rrif1909,l10n_hr_chart_template_rrif,account.data_account_type_current_assets,,Unaprijed plaćeni ostali troškovi poslovanja (troškovi prijevoza, bankovne usluge, zdravstvena zaštita, autorski honorari, rad po ugovoru i sl.),Unaprijed plaćeni ostali troškovi poslovanja (troškovi prijevoza, bankovne usluge, zdravstvena zaštita, autorski honorari, rad po ugovoru i sl.)
1910,kp_rrif1910,l10n_hr_chart_template_rrif,account.data_account_type_current_assets,,Obračunani prihodi (budućeg razdoblja),Obračunani prihodi (budućeg razdoblja)
1920,kp_rrif1920,l10n_hr_chart_template_rrif,account.data_account_type_current_assets,,Unaprijed plaćeni ovisni troškovi nabave (koji nisu na 651),Unaprijed plaćeni ovisni troškovi nabave (koji nisu na 651)
1930,kp_rrif1930,l10n_hr_chart_template_rrif,account.data_account_type_current_assets,,Troškovi kamata iz budućeg razdoblja,Troškovi kamata iz budućeg razdoblja
1940,kp_rrif1940,l10n_hr_chart_template_rrif,account.data_account_type_current_assets,,Unaprijed plaćeni troškovi koncesija (za razdoblje do 12 mj.),Unaprijed plaćeni troškovi koncesija (za razdoblje do 12 mj.)
1950,kp_rrif1950,l10n_hr_chart_template_rrif,account.data_account_type_current_assets,,Unaprijed plaćene franšize, trgovačko znakovlje, prava i sl. (do 12 mj.),Unaprijed plaćene franšize, trgovačko znakovlje, prava i sl. (do 12 mj.)
1960,kp_rrif1960,l10n_hr_chart_template_rrif,account.data_account_type_current_assets,,Unaprijed plaćene licencije i patenti (do 12 mj.),Unaprijed plaćene licencije i patenti (do 12 mj.)
1970,kp_rrif1970,l10n_hr_chart_template_rrif,account.data_account_type_current_assets,,Derivativ - instrument zaštite,Derivativ - instrument zaštite
1990,kp_rrif1990,l10n_hr_chart_template_rrif,account.data_account_type_current_assets,,Unaprijed plaćene provizije,Unaprijed plaćene provizije
1999,kp_rrif1999,l10n_hr_chart_template_rrif,account.data_account_type_current_assets,,Ostala aktivna vremenska razgraničenja,Ostala aktivna vremenska razgraničenja
2000,kp_rrif2000,l10n_hr_chart_template_rrif,account.data_account_type_current_liabilities,,Obveze prema poduzetnicima unutar grupe,Obveze prema poduzetnicima unutar grupe
20000,kp_rrif20000,l10n_hr_chart_template_rrif,account.data_account_type_current_liabilities,,Obveze prema poduzetnicima unutar grupe za primljene robe i usluge,Obveze prema poduzetnicima unutar grupe za primljene robe i usluge
20001,kp_rrif20001,l10n_hr_chart_template_rrif,account.data_account_type_current_liabilities,,Obveze za raspoređeni dobitak prema poduzetnicima unutar grupe,Obveze za raspoređeni dobitak prema poduzetnicima unutar grupe
20002,kp_rrif20002,l10n_hr_chart_template_rrif,account.data_account_type_current_liabilities,,Obveze za kamatu prema poduzetnicima unutar grupe,Obveze za kamatu prema poduzetnicima unutar grupe
20003,kp_rrif20003,l10n_hr_chart_template_rrif,account.data_account_type_current_liabilities,,Obveze za predujmove prema poduzetnicima unutar grupe,Obveze za predujmove prema poduzetnicima unutar grupe
20004,kp_rrif20004,l10n_hr_chart_template_rrif,account.data_account_type_current_liabilities,,Ostale obveze prema poduzetnicima unutar grupe,Ostale obveze prema poduzetnicima unutar grupe
20005,kp_rrif20005,l10n_hr_chart_template_rrif,account.data_account_type_current_liabilities,,Obveze po realiziranim jamstvima unutar grupe,Obveze po realiziranim jamstvima unutar grupe
2001,kp_rrif2001,l10n_hr_chart_template_rrif,account.data_account_type_current_liabilities,,Obveze za zajmove, depozite i slično poduzetnika unutar grupe,Obveze za zajmove, depozite i slično poduzetnika unutar grupe
20010,kp_rrif20010,l10n_hr_chart_template_rrif,account.data_account_type_current_liabilities,,Obveze za zajmove poduzetnika unutar grupe,Obveze za zajmove poduzetnika unutar grupe
20011,kp_rrif20011,l10n_hr_chart_template_rrif,account.data_account_type_current_liabilities,,Obveze za depozite poduzetnika unutar grupe,Obveze za depozite poduzetnika unutar grupe
20012,kp_rrif20012,l10n_hr_chart_template_rrif,account.data_account_type_current_liabilities,,Obveze za kaucije, kapare i slično poduzetnika unutar grupe,Obveze za kaucije, kapare i slično poduzetnika unutar grupe
2010,kp_rrif2010,l10n_hr_chart_template_rrif,account.data_account_type_current_liabilities,,Obveze s osnove udjela u dobitku (analitika prema članovima),Obveze s osnove udjela u dobitku (analitika prema članovima)
2011,kp_rrif2011,l10n_hr_chart_template_rrif,account.data_account_type_current_liabilities,,Obveze za dividende dioničarima,Obveze za dividende dioničarima
2012,kp_rrif2012,l10n_hr_chart_template_rrif,account.data_account_type_current_liabilities,,Obveze za sudjelujuće dobitke u rezultatu iz zajedničkog pothvata (ortaštva),Obveze za sudjelujuće dobitke u rezultatu iz zajedničkog pothvata (ortaštva)
2013,kp_rrif2013,l10n_hr_chart_template_rrif,account.data_account_type_current_liabilities,,Obveze prema zadrugarima iz rezultata,Obveze prema zadrugarima iz rezultata
2014,kp_rrif2014,l10n_hr_chart_template_rrif,account.data_account_type_current_liabilities,,Obveze iz dobitka prema tajnim članovima,Obveze iz dobitka prema tajnim članovima
2015,kp_rrif2015,l10n_hr_chart_template_rrif,account.data_account_type_current_liabilities,,Obveze za dobitak obrtnika dobitaša,Obveze za dobitak obrtnika dobitaša
2016,kp_rrif2016,l10n_hr_chart_template_rrif,account.data_account_type_current_liabilities,,Ostale obveze s osnove udjela u dobitku,Ostale obveze s osnove udjela u dobitku
2100,kp_rrif2100,l10n_hr_chart_template_rrif,account.data_account_type_current_liabilities,,Obveze za izdane čekove,Obveze za izdane čekove
2110,kp_rrif2110,l10n_hr_chart_template_rrif,account.data_account_type_current_liabilities,,Obveze za izdane mjenice,Obveze za izdane mjenice
2111,kp_rrif2111,l10n_hr_chart_template_rrif,account.data_account_type_current_liabilities,,Obveze za izdane mjenične akcepte,Obveze za izdane mjenične akcepte
2115,kp_rrif2115,l10n_hr_chart_template_rrif,account.data_account_type_current_liabilities,,Obveze po mjeničnom regresu,Obveze po mjeničnom regresu
2120,kp_rrif2120,l10n_hr_chart_template_rrif,account.data_account_type_current_liabilities,,Obveze po izdanim komercijalnim zapisima,Obveze po izdanim komercijalnim zapisima
2121,kp_rrif2121,l10n_hr_chart_template_rrif,account.data_account_type_current_liabilities,,Obveze po izdanim obveznicama,Obveze po izdanim obveznicama
2122,kp_rrif2122,l10n_hr_chart_template_rrif,account.data_account_type_current_liabilities,,Obveze po izdanim zadužnicama,Obveze po izdanim zadužnicama
2123,kp_rrif2123,l10n_hr_chart_template_rrif,account.data_account_type_current_liabilities,,Obveze po ostalim kratkoročnim vrijednosnim papirima,Obveze po ostalim kratkoročnim vrijednosnim papirima
2124,kp_rrif2124,l10n_hr_chart_template_rrif,account.data_account_type_current_liabilities,,Obveze po realiziranim jamstvima,Obveze po realiziranim jamstvima
2128,kp_rrif2128,l10n_hr_chart_template_rrif,account.data_account_type_current_liabilities,,Obveze za kamate sadržane u vrijed. papirima,Obveze za kamate sadržane u vrijed. papirima
2130,kp_rrif2130,l10n_hr_chart_template_rrif,account.data_account_type_current_liabilities,,Obveze prema društvima povezanim sudjelujućim interesom,Obveze prema društvima povezanim sudjelujućim interesom
21300,kp_rrif21300,l10n_hr_chart_template_rrif,account.data_account_type_current_liabilities,,Obveze prema društvima povezanim sudjelujućim interesom za primljene robe i usluge,Obveze prema društvima povezanim sudjelujućim interesom za primljene robe i usluge
21301,kp_rrif21301,l10n_hr_chart_template_rrif,account.data_account_type_current_liabilities,,Obveze za raspoređeni dobitak prema društvima povezanim sudjelujućim interesom,Obveze za raspoređeni dobitak prema društvima povezanim sudjelujućim interesom
21302,kp_rrif21302,l10n_hr_chart_template_rrif,account.data_account_type_current_liabilities,,Obveze za kamatu prema društvima povezanim sudjelujućim interesom,Obveze za kamatu prema društvima povezanim sudjelujućim interesom
21303,kp_rrif21303,l10n_hr_chart_template_rrif,account.data_account_type_current_liabilities,,Obveze za predujmove prema društvima povezanim sudjelujućim interesom,Obveze za predujmove prema društvima povezanim sudjelujućim interesom
21304,kp_rrif21304,l10n_hr_chart_template_rrif,account.data_account_type_current_liabilities,,Ostale obveze prema društvima povezanim sudjelujućim interesom,Ostale obveze prema društvima povezanim sudjelujućim interesom
2131,kp_rrif2131,l10n_hr_chart_template_rrif,account.data_account_type_current_liabilities,,Obveze za zajmove, depozite i slično društava povezanih sudjelujućim interesom,Obveze za zajmove, depozite i slično društava povezanih sudjelujućim interesom
21310,kp_rrif21310,l10n_hr_chart_template_rrif,account.data_account_type_current_liabilities,,Obveze za zajmove društava povezanih sudjelujućim interesom,Obveze za zajmove društava povezanih sudjelujućim interesom
21311,kp_rrif21311,l10n_hr_chart_template_rrif,account.data_account_type_current_liabilities,,Obveze za depozite društava povezanih sudjelujućim interesom,Obveze za depozite društava povezanih sudjelujućim interesom
21312,kp_rrif21312,l10n_hr_chart_template_rrif,account.data_account_type_current_liabilities,,Obveze za kaucije, kapare i slično društava povezanih sudjelujućim interesom,Obveze za kaucije, kapare i slično društava povezanih sudjelujućim interesom
21313,kp_rrif21313,l10n_hr_chart_template_rrif,account.data_account_type_current_liabilities,,Obveze po realiziranim jamstvima iz sudj. interesa,Obveze po realiziranim jamstvima iz sudj. interesa
2140,kp_rrif2140,l10n_hr_chart_template_rrif,account.data_account_type_current_liabilities,,Obveze za financijske zajmove od društava,Obveze za financijske zajmove od društava
2141,kp_rrif2141,l10n_hr_chart_template_rrif,account.data_account_type_current_liabilities,,Obveze za zajmove od ustanova, zadruga i sl.,Obveze za zajmove od ustanova, zadruga i sl.
2142,kp_rrif2142,l10n_hr_chart_template_rrif,account.data_account_type_current_liabilities,,Obveze za kratkoročne zajmove iz inozemstva,Obveze za kratkoročne zajmove iz inozemstva
2143,kp_rrif2143,l10n_hr_chart_template_rrif,account.data_account_type_current_liabilities,,Obveze za dio dospjelih dugoročnih zajmova koji se trebaju platiti u roku 12 mj.,Obveze za dio dospjelih dugoročnih zajmova koji se trebaju platiti u roku 12 mj.
2144,kp_rrif2144,l10n_hr_chart_template_rrif,account.data_account_type_current_liabilities,,Obveze za zajmove prema građanima,Obveze za zajmove prema građanima
2145,kp_rrif2145,l10n_hr_chart_template_rrif,account.data_account_type_current_liabilities,,Obveze za zajmove članova društva,Obveze za zajmove članova društva
2146,kp_rrif2146,l10n_hr_chart_template_rrif,account.data_account_type_current_liabilities,,Obveze po kontokorentnom računu,Obveze po kontokorentnom računu
2147,kp_rrif2147,l10n_hr_chart_template_rrif,account.data_account_type_current_liabilities,,Obveze za depozite, jamčevine, kapare i kaucije,Obveze za depozite, jamčevine, kapare i kaucije
2148,kp_rrif2148,l10n_hr_chart_template_rrif,account.data_account_type_current_liabilities,,Obveze za zajmove prema povezanim osobama koje nisu ni grupa ni društva povezana sudjelujućim interesom,Obveze za zajmove prema povezanim osobama koje nisu ni grupa ni društva povezana sudjelujućim interesom
2149,kp_rrif2149,l10n_hr_chart_template_rrif,account.data_account_type_current_liabilities,,Ostali kratkoročni zajmovi i sl.,Ostali kratkoročni zajmovi i sl.
2150,kp_rrif2150,l10n_hr_chart_template_rrif,account.data_account_type_current_liabilities,,Obveze za kratkoročne kredite u banci (analitika po bankama a unutar banke po ugovorima o kreditu),Obveze za kratkoročne kredite u banci (analitika po bankama a unutar banke po ugovorima o kreditu)
2151,kp_rrif2151,l10n_hr_chart_template_rrif,account.data_account_type_current_liabilities,,Obveze za kratkoročne kredite u osiguravajućim društvima (analitika po društvima i kreditima),Obveze za kratkoročne kredite u osiguravajućim društvima (analitika po društvima i kreditima)
2152,kp_rrif2152,l10n_hr_chart_template_rrif,account.data_account_type_current_liabilities,,Obveze prema ostalim kreditnim institucijama (štedionicama, mirovinskom fondu i dr.),Obveze prema ostalim kreditnim institucijama (štedionicama, mirovinskom fondu i dr.)
2153,kp_rrif2153,l10n_hr_chart_template_rrif,account.data_account_type_current_liabilities,,Kratkoročne obveze za operativne najmove,Kratkoročne obveze za operativne najmove
2154,kp_rrif2154,l10n_hr_chart_template_rrif,account.data_account_type_current_liabilities,,Obveze prema kreditnim institucijama i bankama u inozemstvu,Obveze prema kreditnim institucijama i bankama u inozemstvu
2155,kp_rrif2155,l10n_hr_chart_template_rrif,account.data_account_type_current_liabilities,,Obveze prema bankama po naplaćenim garancijama,Obveze prema bankama po naplaćenim garancijama
2156,kp_rrif2156,l10n_hr_chart_template_rrif,account.data_account_type_current_liabilities,,Obveze po isplaćenom akreditivu,Obveze po isplaćenom akreditivu
2157,kp_rrif2157,l10n_hr_chart_template_rrif,account.data_account_type_current_liabilities,,Obveze za prekoračenje na računu (okvirni kredit),Obveze za prekoračenje na računu (okvirni kredit)
2158,kp_rrif2158,l10n_hr_chart_template_rrif,account.data_account_type_current_liabilities,,Obveze za kamate prema bankama i fin. inst.,Obveze za kamate prema bankama i fin. inst.
2159,kp_rrif2159,l10n_hr_chart_template_rrif,account.data_account_type_current_liabilities,,Ostale obveze prema kreditnim institucijama,Ostale obveze prema kreditnim institucijama
2160,kp_rrif2160,l10n_hr_chart_template_rrif,account.data_account_type_current_liabilities,,Obveze prema izdavateljima kreditnih kartica (analitika prema kartičarima),Obveze prema izdavateljima kreditnih kartica (analitika prema kartičarima)
2170,kp_rrif2170,l10n_hr_chart_template_rrif,account.data_account_type_current_liabilities,,Obveze s temelja eskontiranih mjenica,Obveze s temelja eskontiranih mjenica
2171,kp_rrif2171,l10n_hr_chart_template_rrif,account.data_account_type_current_liabilities,,Ostale obveze iz eskonta vrijednosnih papira,Ostale obveze iz eskonta vrijednosnih papira
2172,kp_rrif2172,l10n_hr_chart_template_rrif,account.data_account_type_current_liabilities,,Obveze iz otkupa tražbina - faktoringa,Obveze iz otkupa tražbina - faktoringa
2180,kp_rrif2180,l10n_hr_chart_template_rrif,account.data_account_type_current_liabilities,,Obveze s osnove dugotrajne imovine namijenjene prodaji (analitika prema izvorima),Obveze s osnove dugotrajne imovine namijenjene prodaji (analitika prema izvorima)
2200,kp_rrif2200,l10n_hr_chart_template_rrif,account.data_account_type_payable,True,Dobavljači dobara,Dobavljači dobara
2201,kp_rrif2201,l10n_hr_chart_template_rrif,account.data_account_type_payable,True,Dobavljači usluga,Dobavljači usluga
2202,kp_rrif2202,l10n_hr_chart_template_rrif,account.data_account_type_payable,True,Dobavljači opreme, postrojenja i nekretnina,Dobavljači opreme, postrojenja i nekretnina
2203,kp_rrif2203,l10n_hr_chart_template_rrif,account.data_account_type_payable,True,Dobavljači nematerijalne imovine,Dobavljači nematerijalne imovine
2204,kp_rrif2204,l10n_hr_chart_template_rrif,account.data_account_type_payable,True,Dobavljači za najmove,Dobavljači za najmove
2205,kp_rrif2205,l10n_hr_chart_template_rrif,account.data_account_type_payable,True,Dobavljači iz ortačkog ugovora,Dobavljači iz ortačkog ugovora
2206,kp_rrif2206,l10n_hr_chart_template_rrif,account.data_account_type_payable,True,Dobavljači zadruge, ustanove i dr.,Dobavljači zadruge, ustanove i dr.
2208,kp_rrif2208,l10n_hr_chart_template_rrif,account.data_account_type_payable,True,Dobavljači povezane osobe koje nisu grupa ni društva povezana sudjelujućim interesom,Dobavljači povezane osobe koje nisu grupa ni društva povezana sudjelujućim interesom
2210,kp_rrif2210,l10n_hr_chart_template_rrif,account.data_account_type_payable,True,Dobavljači dobara iz EU,Dobavljači dobara iz EU
2211,kp_rrif2211,l10n_hr_chart_template_rrif,account.data_account_type_payable,True,Dobavljači dobara iz trećih zemalja,Dobavljači dobara iz trećih zemalja
2212,kp_rrif2212,l10n_hr_chart_template_rrif,account.data_account_type_payable,True,Dobavljači usluga iz EU,Dobavljači usluga iz EU
2213,kp_rrif2213,l10n_hr_chart_template_rrif,account.data_account_type_payable,True,Dobavljači usluga iz trećih zemalja,Dobavljači usluga iz trećih zemalja
2214,kp_rrif2214,l10n_hr_chart_template_rrif,account.data_account_type_payable,True,Dobavljači prava intelektualnog vlasništva, istraživanja tržišta i dr.,Dobavljači prava intelektualnog vlasništva, istraživanja tržišta i dr.
2215,kp_rrif2215,l10n_hr_chart_template_rrif,account.data_account_type_payable,True,Dobavljači prava na franšizu, uporabu imena i sl.,Dobavljači prava na franšizu, uporabu imena i sl.
