"id","name","code","account_type","reconcile","name@fr"
"syscebnl_101","Non-consumable endowment with no right of reversal",101,"equity","False","Dotation non consomptible sans droit de reprise"
"syscebnl_102","Non-consumable endowment with right of reversal",102,"equity","False","Dotation non consomptible avec droit de reprise"
"syscebnl_103","Entrance fee",103,"equity","False","Droit d'entrée"
"syscebnl_104","Expendable endowment",104,"equity","False","Dotation consomptible"
"syscebnl_106","Revaluation differences",106,"equity","False","Écarts de réévaluation"
"syscebnl_112","Statutory or contractual reserves",112,"equity","False","Réserves statutaires ou contractuelles"
"syscebnl_118","Other reserves",118,"equity","False","Autres réserves"
"syscebnl_121","Retained earnings",121,"equity","False","Report à nouveau des excédents"
"syscebnl_128","Net income pending appropriation",128,"equity_unaffected","False","Résultat net en instance d'affectation"
"syscebnl_129","Retained earnings carried forward",129,"equity","False","Report à nouveau des déficits"
"syscebnl_131","Surplus for the year",131,"equity","False","Excédent de l'exercice"
"syscebnl_139","Deficit for the year",139,"equity","False","Déficit de l'exercice"
"syscebnl_141","Equipment grants",141,"equity","False","Subventions d'équipment"
"syscebnl_148","Other investment grants",148,"equity","False","Autres subventions d'investissement"
"syscebnl_154","Special revaluation provisions",154,"equity","False","Provisions spéciales de réevaluation"
"syscebnl_158","Other regulated provisions and similar funds",158,"equity","False","Autres provisions réglementées et fonds assimilés"
"syscebnl_161","Development project fund - accountable cash advances",161,"equity","False","Fonds projet de développement - avances de fonds à justifier"
"syscebnl_162","Funds earmarked for development project investments – donors",162,"equity","False","Fonds affectés aus investissements du projet de développement - bailleurs de fonds"
"syscebnl_163","Funds allocated to development project investments - the State",163,"equity","False","Fonds affectés aux investissements du projet de développement - l'État"
"syscebnl_164","Funds allocated to investments by other similar financing organizations",164,"equity","False","Fonds affectés aux investissements des autres organismes de financement assimilés"
"syscebnl_165","Funds earmarked for a specific project",165,"equity","False","Fonds affectés à un projet spécifique"
"syscebnl_167","Funds from gifts and bequests of fixed assets",167,"equity","False","Fonds provenant de dons et legs d'immobilisations"
"syscebnl_168","Other restricted funds",168,"equity","False","Autres fonds affectés"
"syscebnl_169","Restricted funds receivable",169,"equity","False","Fonds affectés à recevoir"
"syscebnl_171","Temporary donation of usufruct",171,"equity","False","Donation temporaire d'usufruit"
"syscebnl_172","Donations and bequests not yet received from fixed assets held for sale",172,"equity","False","Donations et legs non encore reçus d'immobilisations destinées à la vente"
"syscebnl_178","Other deferred funds",178,"equity","False","Autres fonds reportés"
"syscebnl_181","Bond issues",181,"liability_non_current","False","Emprunts obligataires"
"syscebnl_182","Borrowings from credit institutions",182,"liability_non_current","False","Emprunts et dettes auprès des ètablissements de crédit"
"syscebnl_183","Advances received from the State",183,"liability_non_current","False","Avances reçues de l'État"
"syscebnl_185","Deposits and surety bonds",185,"liability_non_current","False","Dépôts et cautionnements reçus"
"syscebnl_186","Accrued interest",186,"liability_non_current","False","Intérêts courus"
"syscebnl_187","Capital lease liabilities",187,"liability_non_current","False","Dettes de location-acquisition"
"syscebnl_188","Other borrowings and debts",188,"liability_non_current","False","Autres emprunts et dettes"
"syscebnl_191","Provisions for litigation",191,"liability_non_current","False","Provisions pour litiges"
"syscebnl_192","Provisions for charges on gifts and bequests",192,"liability_non_current","False","Provisions pour charges sur donations et legs"
"syscebnl_194","Provisions for exchange losses",194,"liability_non_current","False","Provisions pour pertes de change"
"syscebnl_196","Provisions for pensions and similar obligations",196,"liability_non_current","False","Provisions pour pensions et obligations similaires"
"syscebnl_198","Other provisions for contingencies and charges",198,"liability_non_current","False","Autres provisions pour risques et charges"
"syscebnl_201","Intangible assets",201,"asset_non_current","False","Immobilisations incorporelles"
"syscebnl_202","Land",202,"asset_non_current","False","Terrains"
"syscebnl_203","Buildings",203,"asset_non_current","False","Bâtiments"
"syscebnl_204","Equipment",204,"asset_non_current","False","Matériels"
"syscebnl_205","Shareholdings",205,"asset_non_current","False","Titre de participations"
"syscebnl_212","Patents, licenses, concessions et similar rights",212,"asset_non_current","False","Brevets, licences, concessions et droits similaires"
"syscebnl_213","Software and websites",213,"asset_non_current","False","Logiciels et sites internet"
"syscebnl_214","Brands",214,"asset_non_current","False","Marques"
"syscebnl_218","Other intangible rights and assets",218,"asset_non_current","False","Autres droits et valeurs incorporels"
"syscebnl_2193","Software and websites",2193,"asset_non_current","False","Logiciels et sites internet"
"syscebnl_2198","Other intangible assets and rights",2198,"asset_non_current","False","Autres droits et valeurs incorporels"
"syscebnl_221","Agricultural and forest land",221,"asset_fixed","False","Terrains agricole et forestiers"
"syscebnl_222","Bare land",222,"asset_fixed","False","Terrains nus"
"syscebnl_223","Built-up land",223,"asset_fixed","False","Terrains bâtis"
"syscebnl_224","Land development work",224,"asset_fixed","False","Travaux de mise en valeur de terrains"
"syscebnl_226","Developed land",226,"asset_fixed","False","Terrains aménagés"
"syscebnl_228","Other lands",228,"asset_fixed","False","Autres terrains"
"syscebnl_229","Land development in progress",229,"asset_fixed","False","Aménagements de terrains en cours"
"syscebnl_231","Industrial, agricultural, administrative, commercial, religious and other buildings on own land",231,"asset_fixed","False","Bâtiments industriels, agricoles, administratifs, commerciaux, religieux et autres sur sol propre"
"syscebnl_232","Industrial, agricultural, administrative, commercial, religious and other buildings on third-party land",232,"asset_fixed","False","Bâtiments industriels, agricoles, administratifs, commerciaux, religieux et autres sur sol d'autrui"
"syscebnl_233","Infrastructure works",233,"asset_fixed","False","Ouvrages d'infrastructure"
"syscebnl_234","Fixtures, fittings and technical installations",234,"asset_fixed","False","Aménagements, agencements et installations techniques"
"syscebnl_235","Office and similar facilities",235,"asset_fixed","False","Aménagements de bureaux et assimilés"
"syscebnl_238","Other fixtures and fittings",238,"asset_fixed","False","Autres installations et agencements"
"syscebnl_2391","Buildings on own land in progress",2391,"asset_fixed","False","Bâtiments sur sol propre en cours"
"syscebnl_2392","Buildings in progress on third-party land",2392,"asset_fixed","False","Bâtiments sur sol d'autrui en cours"
"syscebnl_2393","Infrastructure works in progress",2393,"asset_fixed","False","Ouvrages d'infrastructure en cours"
"syscebnl_2394","Fittings, fixtures and technical installations in progress",2394,"asset_fixed","False","Aménagements, agencements et installations techniques en cours"
"syscebnl_2395","Office developments in progress",2395,"asset_fixed","False","Aménagements de bureaux en cours"
"syscebnl_2396","Buildings in progress-investment property",2396,"asset_fixed","False","Bâtiments en cours-immeubles de placement"
"syscebnl_2398","Other fixtures and fittings in progress",2398,"asset_fixed","False","Autres installations et agencements en cours"
"syscebnl_241","Industrial and commercial machinery and equipment",241,"asset_fixed","False","Matériel et outillage industriel et commercial"
"syscebnl_242","Agricultural machinery and equipment",242,"asset_fixed","False","Matériel et outillage agricole"
"syscebnl_243","Recyclable and identifiable packaging materials",243,"asset_fixed","False","Matériel d'emballage récupérable et identifiable"
"syscebnl_244","Equipment and furniture",244,"asset_fixed","False","Matériel et mobilier"
"syscebnl_245","Transport equipment",245,"asset_fixed","False","Matériel de transport"
"syscebnl_246","Biological assets",246,"asset_fixed","False","Actifs biologiques"
"syscebnl_247","Fixtures and fittings for equipment and biological assets",247,"asset_fixed","False","Agencements et aménagements du matériel et des actifs biologiques"
"syscebnl_248","Other equipment and furniture",248,"asset_fixed","False","Autres matériels et mobiliers"
"syscebnl_2491","Industrial and commercial machinery and equipment in progress",2491,"asset_fixed","False","Matériel et outillage industriel et commercial en cours"
"syscebnl_2492","Agricultural machinery and equipment in progress",2492,"asset_fixed","False","Matériel et outillage agricole en cours"
"syscebnl_2493","Recyclable and identifiable packaging materials in progress",2493,"asset_fixed","False","Matériel d'emballage récupérable et identifiable en cours"
"syscebnl_2494","Office equipment and furniture in progress",2494,"asset_fixed","False","Matériel et mobilier de bureau en cours"
"syscebnl_2495","Transport equipment in progress",2495,"asset_fixed","False","Matériel de transport en cours"
"syscebnl_2496","Biological assets in progress",2496,"asset_fixed","False","Actifs biologiques en cours"
"syscebnl_2497","Fixtures and fittings for equipment and biological assets in progress",2497,"asset_fixed","False","Agencements et aménagements du matériel et des actifs biologiques en cours"
"syscebnl_2498","Other biological materials and assets in progress",2498,"asset_fixed","False","Autres matériels et actifs biologiques en cours"
"syscebnl_251","Advances and deposits paid on intangible assets",251,"asset_non_current","False","Avances et acomptes versés sur immobilisations incorporelles"
"syscebnl_252","Advances and deposits paid on property, plant and equipment",252,"asset_fixed","False","Avances et acomptes versés sur immobilisations corporelles"
"syscebnl_261","Equity interests",261,"asset_non_current","False","Titres de participation"
"syscebnl_265","Shareholdings in professional bodies",265,"asset_non_current","False","Participations dans des organismes professionnels"
"syscebnl_266","Shares in economic interest groups (E.I.G.)",266,"asset_non_current","False","Parts dans des groupements d'intérêt économique (G.L.E.)"
"syscebnl_268","Other equity interests",268,"asset_non_current","False","Autres titres de participation"
"syscebnl_271","Loans and receivables",271,"asset_non_current","False","Prêts et créances"
"syscebnl_272","Employee loans",272,"asset_non_current","False","Prêts au personnel"
"syscebnl_273","Receivables from the State",273,"asset_non_current","False","Créances sur l'Etat"
"syscebnl_274","Long-term investments",274,"asset_non_current","False","Titres immobilisés"
"syscebnl_275","Deposits and guarantees paid",275,"asset_non_current","False","Dépôts et cautionnements versés"
"syscebnl_276","Accrued interest",276,"asset_non_current","False","Intérêts courus"
"syscebnl_278","Miscellaneous financial assets",278,"asset_non_current","False","Immobilisations financières diverses"
"syscebnl_280","Depreciation of temporary usufruct",280,"asset_non_current","False","Amortissements d'usufruit temporaire"
"syscebnl_2812","Depreciation of patents, licenses, concessions and similar rights",2812,"asset_non_current","False","Amortissements des brevets, licences, concessions et droits similaires"
"syscebnl_2813","Depreciation of software and websites",2813,"asset_non_current","False","Amortissements des logiciels et sites internet"
"syscebnl_2814","Depreciation of brands",2814,"asset_non_current","False","Amortissements des marques"
"syscebnl_2817","Depreciation of player transfer compensation",2817,"asset_non_current","False","Amortissements des Indemnités de transfert aux joueurs"
"syscebnl_2818","Depreciation of other intangible assets and rights",2818,"asset_non_current","False","Amortissements des autres droits et valeurs incorporels"
"syscebnl_282","Depreciation of land",282,"asset_fixed","False","Amortissements des terrains"
"syscebnl_2831","Depreciation of industrial, agricultural, administrative, commercial, religious and other buildings on own land",2831,"asset_fixed","False","Amortissements des bâtiments industriels, agricoles, administratifs, commerciaux, religieux et autres sur sol propre"
"syscebnl_2832","Depreciation of industrial, agricultural, administrative, commercial, religious and other buildings on third-party land",2832,"asset_fixed","False","Amortissements des bâtiments industriels, agricoles, administratifs, commerciaux,religieux et autres sur sol d'autrui"
"syscebnl_2833","Depreciation of infrastructure works",2833,"asset_fixed","False","Amortissements des ouvrages d'infrastructure"
"syscebnl_2834","Depreciation of fixtures, fittings and technical installations",2834,"asset_fixed","False","Amortissements des aménagements, agencements et installations techniques"
"syscebnl_2835","Depreciation of office fittings",2835,"asset_fixed","False","Amortissements des aménagements de bureaux"
"syscebnl_2838","Depreciation of other fixtures and fittings",2838,"asset_fixed","False","Amortissements des autres installations et agencements"
"syscebnl_2841","Depreciation of industrial and commercial machinery and equipment",2841,"asset_fixed","False","Amortissements du matériel et de l'outillage industriel et commercial"
"syscebnl_2842","Depreciation of farm machinery and equipment",2842,"asset_fixed","False","Amortissements du matériel et de l'outillage agricole"
"syscebnl_2843","Depreciation of recoverable and identifiable packaging materials",2843,"asset_fixed","False","Amortissements du matériel d'emballage récupérable et identifiable"
"syscebnl_2844","Depreciation of equipment and furniture",2844,"asset_fixed","False","Amortissements du matériel et du mobilier"
"syscebnl_2845","Depreciation of transport equipment",2845,"asset_fixed","False","Amortissements du matériel de transport"
"syscebnl_2846","Depreciation of biological assets",2846,"asset_fixed","False","Amortissements des actifs biologiques"
"syscebnl_2847","Depreciation of fixtures and fittings, equipment and biological assets",2847,"asset_fixed","False","Amortissements des agencements et aménagements du matériel et des actifs biologiques"
"syscebnl_2848","Depreciation of other equipment",2848,"asset_fixed","False","Amortissements des autres matériels"
"syscebnl_2901","Impairment of temporary usufruct",2901,"asset_non_current","False","Dépréciations d'usufruit temporaire"
"syscebnl_2902","Impairment of assets held for sale arising from gifts and bequests not yet received",2902,"asset_non_current","False","Dépréciations des immobilisations destinées à la vente provenant de dons et legs non encore reçus"
"syscebnl_2912","Impairment of patents, licenses, concessions and similar rights",2912,"asset_non_current","False","Dépréciations des brevets, licences, concessions et droits similaires"
"syscebnl_2913","Impairment of software and websites",2913,"asset_non_current","False","Dépréciations des logiciels et sites internet"
"syscebnl_2914","Impairment of brands",2914,"asset_non_current","False","Dépréciations des marques"
"syscebnl_2918","Impairment of other intangible assets and rights",2918,"asset_non_current","False","Dépréciations des autres droits et valeurs incorporels"
"syscebnl_2919","Impairment of intangible assets in progress",2919,"asset_non_current","False","Dépréciations des immobilisations incorporelles en cours"
"syscebnl_292","Impairment of land",292,"asset_fixed","False","Dépréciations des terrains"
"syscebnl_2931","Depreciation of industrial, agricultural, administrative, commercial, religious and other buildings on own land",2931,"asset_fixed","False","Dépréciations des bâtiments industriels, agricoles, administratifs, commerciaux, religieux et autres sur sol propre"
"syscebnl_2932","Depreciation of industrial, agricultural, administrative, commercial, religious and other buildings on third-party land",2932,"asset_fixed","False","Dépréciations des bâtiments industriels, agricoles, administratifs, commerciaux,religieux et autres sur sol d'autrui"
"syscebnl_2933","Impairment of infrastructure structures",2933,"asset_fixed","False","Dépréciations des ouvrages d'infrastructures"
"syscebnl_2934","Impairment of fixtures, fittings and technical installations",2934,"asset_fixed","False","Dépréciations des aménagements, agencements et installations techniques"
"syscebnl_2935","Impairment of office fixtures and fittings",2935,"asset_fixed","False","Dépréciations des aménagements de bureaux"
"syscebnl_2938","Impairment of other fixtures and fittings",2938,"asset_fixed","False","Dépréciations des autres installations et agencements"
"syscebnl_2939","Impairment of buildings and installations in progress",2939,"asset_fixed","False","Dépréciations des bâtiments et installations en cours"
"syscebnl_2941","Impairment of industrial and commercial machinery and equipment",2941,"asset_fixed","False","Dépréciations du matériel et de l'outillage industriel et commercial"
"syscebnl_2942","Depreciation of farm machinery and equipment",2942,"asset_fixed","False","Dépréciations du matériel et de l'outillage agricole"
"syscebnl_2943","Impairment of agricultural machinery and equipment Impairment of recoverable and identifiable packaging materials",2943,"asset_fixed","False","Dépréciations du matériel et de l'outillage agricole Dépréciations du matériel d'emballage récupérable et identifiable"
"syscebnl_2944","Depreciation of equipment and furniture",2944,"asset_fixed","False","Dépréciations du matériel et du mobilier"
"syscebnl_2945","Impairment of transport equipment",2945,"asset_fixed","False","Dépréciations du matériel de transport"
"syscebnl_2946","Impairment of biological assets",2946,"asset_fixed","False","Dépréciations des actifs biologiques"
"syscebnl_2947","Impairment of fixtures and fittings, equipment and biological assets",2947,"asset_fixed","False","Dépréciations des aménagements et agencements du matériel et des actifs biologiques"
"syscebnl_2948","Impairment of other equipment",2948,"asset_fixed","False","Dépréciations des autres matériels"
"syscebnl_2949","Impairment of equipment in progress",2949,"asset_fixed","False","Dépréciations de matériel en cours"
"syscebnl_2951","Impairment of advance payments on intangible assets",2951,"asset_non_current","False","Dépréciations des avances et acomptes versés sur immobilisations incorporelles"
"syscebnl_2952","Impairment of advance payments on tangible assets",2952,"asset_fixed","False","Dépréciations des avances et acomptes versés sur immobilisations corporelles"
"syscebnl_296","Impairment of equity investments",296,"asset_non_current","False","Dépréciations des titres de participation"
"syscebnl_297","Impairment of other non-current financial assets",297,"asset_non_current","False","Dépréciations des autres immobilisations financières"
"syscebnl_311","Assets related to business A",311,"asset_current","False","Biens liés à l'activité A"
"syscebnl_312","Assets related to business B",312,"asset_current","False","Biens liés à l'activité B"
"syscebnl_321","Goods A",321,"asset_current","False","Marchandises A"
"syscebnl_322","Goods B",322,"asset_current","False","Marchandises B"
"syscebnl_323","Materials A",323,"asset_current","False","Matières A"
"syscebnl_324","Materials B",324,"asset_current","False","Matières B"
"syscebnl_325","Related supplies (A, B)",325,"asset_current","False","Fournitures liées (A, B)"
"syscebnl_331","Consumables",331,"asset_current","False","Matières consommables"
"syscebnl_333","Store supplies",333,"asset_current","False","Fournitures de magasin"
"syscebnl_334","Office supplies",334,"asset_current","False","Fournitures de bureau"
"syscebnl_335","Packaging",335,"asset_current","False","Emballages"
"syscebnl_338","Other materials",338,"asset_current","False","Autres matières"
"syscebnl_341","Unallocated gifts in kind",341,"asset_current","False","Dons en nature non affectés"
"syscebnl_345","Allocated donations in kind",345,"asset_current","False","Dons en nature affectés"
"syscebnl_361","Finished products A",361,"asset_current","False","Produits finis A"
"syscebnl_362","Finished products B",362,"asset_current","False","Produits finis B"
"syscebnl_363","Biologic assets",363,"asset_current","False","Actifs biologiques"
"syscebnl_367","Intermediate and residual products",367,"asset_current","False","Produits intermédiaires et résiduels"
"syscebnl_371","Goods linked to the activity en route",371,"asset_current","False","Biens liés à l'activité en cours de route"
"syscebnl_372","Goods, raw materials and supplies tied up en route",372,"asset_current","False","Marchandises, matières premières et fournitures liés en cours de route"
"syscebnl_373","Other supplies en route",373,"asset_current","False","Autres approvisionnements en cours de route"
"syscebnl_376","Finished products en route",376,"asset_current","False","Produits finis en cours de route"
"syscebnl_377","Stock on consignment or on deposit",377,"asset_current","False","Stock en consignation ou en dépôt"
"syscebnl_378","Stock from retired or scrapped fixed assets",378,"asset_current","False","Stock provenant d'immobilisations mises hors services ou au rebut"
"syscebnl_381","unallocated",381,"asset_current","False","non affectés"
"syscebnl_385","allocated",385,"asset_current","False","affectés"
"syscebnl_391","Impairment of inventories of goods used in operations",391,"asset_current","False","Dépréciations des stocks de biens liés à l'activité"
"syscebnl_392","Impairment of inventories of merchandise, raw materials and related supplies",392,"asset_current","False","Dépréciations des stocks de marchandises, et matières premières et fournitures liées"
"syscebnl_393","Impairment of inventories of other supplies",393,"asset_current","False","Dépréciations des stocks d'autres approvisionnements"
"syscebnl_396","Impairment of inventories of finished goods, intermediate products and residuals",396,"asset_current","False","Dépréciations des stocks de produits finis, produits intermédiaires et résiduels"
"syscebnl_397","Depreciation of inventories in transit, on consignment or on deposit",397,"asset_current","False","Dépréciations des stocks en cours de route, en consignation ou en dépôt"
"syscebnl_401","Trade payables",401,"liability_payable","True","Fournisseurs, dettes en compte"
"syscebnl_402","Suppliers, bills payable",402,"liability_payable","True","Fournisseurs, effets à payer"
"syscebnl_408","Suppliers, invoices not yet received",408,"liability_payable","True","Fournisseurs, factures non parvenues"
"syscebnl_409","Trade accounts receivable",409,"asset_receivable","True","Fournisseurs débiteurs"
"syscebnl_411","Members",411,"asset_receivable","True","Adhérents"
"syscebnl_412","Customers-users",412,"asset_receivable","True","Clients-usagers"
"syscebnl_413","Members, customer-users, unpaid cheques, bills and other valuables",413,"asset_receivable","True","Adhérents, Clients-usagers, chèques, effets et autres valeurs impayés"
"syscebnl_416","Doubtful or disputed receivables, members, customer-users",416,"asset_receivable","True","Créances, adhérents, clients-usagers litigieuses ou douteuses"
"syscebnl_418","Members, customer-users products to receive",418,"asset_receivable","True","Adhérents, clients-usagers produits à recevoir"
"syscebnl_419","Members, Customer-users creditors",419,"liability_payable","True","Adhérents, Clients-usagers créditeurs"
"syscebnl_421","Personnel, advances and deposits",421,"asset_current","False","Personnel, avances et acomptes"
"syscebnl_422","Personnel, remuneration due",422,"asset_current","False","Personnel, rémunérations dues"
"syscebnl_423","Personnel, objections and seizures",423,"asset_current","False","Personnel, oppositions et saisies arrêts"
"syscebnl_424","Personnel, internal social works",424,"asset_current","False","Personnel, œuvres sociales internes"
"syscebnl_425","Personnel representatives",425,"asset_current","False","Représentants du personnel"
"syscebnl_427","Personnel – deposits",427,"asset_current","False","Personnel - dépôts"
"syscebnl_428","Personnel, accrued expenses and receivables",428,"asset_current","False","Personnel, charges à payer et produits à recevoir"
"syscebnl_431","Social security",431,"asset_current","False","Sécurité sociale"
"syscebnl_432","Pension fund",432,"asset_current","False","Caisse de retraite"
"syscebnl_433","Other social organizations",433,"asset_current","False","Autres organismes sociaux"
"syscebnl_438","Social security, accrued expenses and accrued income",438,"asset_current","False","Organismes sociaux, charges à payer et produits à recevoir"
"syscebnl_442","State, other taxes and duties",442,"asset_current","False","État, autres impôts et taxes"
"syscebnl_443","State, VAT invoiced",443,"liability_current","False","État, T.V.A. Facturée"
"syscebnl_444","State, VAT due or VAT credit",444,"liability_current","False","État, T.V.A. due ou crédit de T.V.A."
"syscebnl_445","State, V.A.T. recoverable",445,"asset_current","False","État, T.V.A. Récupérable"
