"id","name","code","account_type","reconcile","name@fr"
"syscebnl_2755","Deposits for telephone, fax",2755,"asset_non_current","False","Dépôts pour le téléphone, la télécopie"
"syscebnl_2758","Other deposits and guarantees",2758,"asset_non_current","False","Autres dépôts et cautionnement"
"syscebnl_2761","Loans and receivables",2761,"asset_non_current","False","Prêts et créances"
"syscebnl_2762","Employee loans",2762,"asset_non_current","False","Prêts au personnel"
"syscebnl_2763","Receivables from the State",2763,"asset_non_current","False","Créances sur l'Etat"
"syscebnl_2764","Long-term investments",2764,"asset_non_current","False","Titres immobilisés"
"syscebnl_2765","Deposits and guarantees paid",2765,"asset_non_current","False","Dépôts et cautionnements versés"
"syscebnl_2768","Miscellaneous financial assets",2768,"asset_non_current","False","Immobilisations financières diverses"
"syscebnl_2781","Miscellaneous receivables",2781,"asset_non_current","False","Créances diverses"
"syscebnl_2784","Term deposits and similar transactions",2784,"asset_non_current","False","Banques dépôts à terme et opérations assimilées"
"syscebnl_2785","Gold and precious metals",2785,"asset_non_current","False","Or et métaux précieux"
"syscebnl_2788","Other long-term investments",2788,"asset_non_current","False","Autres immobilisations financières"
"syscebnl_280","Depreciation of temporary usufruct",280,"asset_non_current","False","Amortissements d'usufruit temporaire"
"syscebnl_2812","Depreciation of patents, licenses, concessions and similar rights",2812,"asset_non_current","False","Amortissements des brevets, licences, concessions et droits similaires"
"syscebnl_2813","Depreciation of software and websites",2813,"asset_non_current","False","Amortissements des logiciels et sites internet"
"syscebnl_2814","Depreciation of brands",2814,"asset_non_current","False","Amortissements des marques"
"syscebnl_2817","Depreciation of player transfer compensation",2817,"asset_non_current","False","Amortissements des Indemnités de transfert aux joueurs"
"syscebnl_2818","Depreciation of other intangible assets and rights",2818,"asset_non_current","False","Amortissements des autres droits et valeurs incorporels"
"syscebnl_282","Depreciation of land",282,"asset_fixed","False","Amortissements des terrains"
"syscebnl_2824","Depreciation of land reclamation work",2824,"asset_fixed","False","Amortissements des travaux de mise en valeur des terrains"
"syscebnl_2831","Depreciation of industrial, agricultural, administrative, commercial, religious and other buildings on own land",2831,"asset_fixed","False","Amortissements des bâtiments industriels, agricoles, administratifs, commerciaux, religieux et autres sur sol propre"
"syscebnl_2832","Depreciation of industrial, agricultural, administrative, commercial, religious and other buildings on third-party land",2832,"asset_fixed","False","Amortissements des bâtiments industriels, agricoles, administratifs, commerciaux,religieux et autres sur sol d'autrui"
"syscebnl_2833","Depreciation of infrastructure works",2833,"asset_fixed","False","Amortissements des ouvrages d'infrastructure"
"syscebnl_2834","Depreciation of fixtures, fittings and technical installations",2834,"asset_fixed","False","Amortissements des aménagements, agencements et installations techniques"
"syscebnl_2835","Depreciation of office fittings",2835,"asset_fixed","False","Amortissements des aménagements de bureaux"
"syscebnl_2838","Depreciation of other fixtures and fittings",2838,"asset_fixed","False","Amortissements des autres installations et agencements"
"syscebnl_2841","Depreciation of industrial and commercial machinery and equipment",2841,"asset_fixed","False","Amortissements du matériel et de l'outillage industriel et commercial"
"syscebnl_2842","Depreciation of farm machinery and equipment",2842,"asset_fixed","False","Amortissements du matériel et de l'outillage agricole"
"syscebnl_2843","Depreciation of recoverable and identifiable packaging materials",2843,"asset_fixed","False","Amortissements du matériel d'emballage récupérable et identifiable"
"syscebnl_2844","Depreciation of equipment and furniture",2844,"asset_fixed","False","Amortissements du matériel et du mobilier"
"syscebnl_2845","Depreciation of transport equipment",2845,"asset_fixed","False","Amortissements du matériel de transport"
"syscebnl_2846","Depreciation of biological assets",2846,"asset_fixed","False","Amortissements des actifs biologiques"
"syscebnl_2847","Depreciation of fixtures and fittings, equipment and biological assets",2847,"asset_fixed","False","Amortissements des agencements et aménagements du matériel et des actifs biologiques"
"syscebnl_2848","Depreciation of other equipment",2848,"asset_fixed","False","Amortissements des autres matériels"
"syscebnl_2901","Impairment of temporary usufruct",2901,"asset_non_current","False","Dépréciations d'usufruit temporaire"
"syscebnl_2902","Impairment of assets held for sale arising from gifts and bequests not yet received",2902,"asset_non_current","False","Dépréciations des immobilisations destinées à la vente provenant de dons et legs non encore reçus"
"syscebnl_2912","Impairment of patents, licenses, concessions and similar rights",2912,"asset_non_current","False","Dépréciations des brevets, licences, concessions et droits similaires"
"syscebnl_2913","Impairment of software and websites",2913,"asset_non_current","False","Dépréciations des logiciels et sites internet"
"syscebnl_2914","Impairment of brands",2914,"asset_non_current","False","Dépréciations des marques"
"syscebnl_2918","Impairment of other intangible assets and rights",2918,"asset_non_current","False","Dépréciations des autres droits et valeurs incorporels"
"syscebnl_2919","Impairment of intangible assets in progress",2919,"asset_non_current","False","Dépréciations des immobilisations incorporelles en cours"
"syscebnl_2921","Depreciation of agricultural and forest land",2921,"asset_fixed","False","Dépréciations des terrains agricoles et forestiers"
"syscebnl_2922","Impairment of bare land",2922,"asset_fixed","False","Dépréciations des terrains nus"
"syscebnl_2923","Impairment of built-up land",2923,"asset_fixed","False","Dépréciations des terrains bâtis"
"syscebnl_2924","Depreciation of land development work",2924,"asset_fixed","False","Dépréciations des travaux de mise en valeur des terrains"
"syscebnl_2926","Impairment of developed land",2926,"asset_fixed","False","Dépréciations des terrains aménagés"
"syscebnl_2928","Impairment of other land",2928,"asset_fixed","False","Dépréciations des autres terrains"
"syscebnl_2929","Impairment of land in progress",2929,"asset_fixed","False","Dépréciations des aménagements de terrains en cours"
"syscebnl_2931","Depreciation of industrial, agricultural, administrative, commercial, religious and other buildings on own land",2931,"asset_fixed","False","Dépréciations des bâtiments industriels, agricoles, administratifs, commerciaux, religieux et autres sur sol propre"
"syscebnl_2932","Depreciation of industrial, agricultural, administrative, commercial, religious and other buildings on third-party land",2932,"asset_fixed","False","Dépréciations des bâtiments industriels, agricoles, administratifs, commerciaux,religieux et autres sur sol d'autrui"
"syscebnl_2933","Impairment of infrastructure structures",2933,"asset_fixed","False","Dépréciations des ouvrages d'infrastructures"
"syscebnl_2934","Impairment of fixtures, fittings and technical installations",2934,"asset_fixed","False","Dépréciations des aménagements, agencements et installations techniques"
"syscebnl_2935","Impairment of office fixtures and fittings",2935,"asset_fixed","False","Dépréciations des aménagements de bureaux"
"syscebnl_2938","Impairment of other fixtures and fittings",2938,"asset_fixed","False","Dépréciations des autres installations et agencements"
"syscebnl_2939","Impairment of buildings and installations in progress",2939,"asset_fixed","False","Dépréciations des bâtiments et installations en cours"
"syscebnl_2941","Impairment of industrial and commercial machinery and equipment",2941,"asset_fixed","False","Dépréciations du matériel et de l'outillage industriel et commercial"
"syscebnl_2942","Depreciation of farm machinery and equipment",2942,"asset_fixed","False","Dépréciations du matériel et de l'outillage agricole"
"syscebnl_2943","Impairment of agricultural machinery and equipment Impairment of recoverable and identifiable packaging materials",2943,"asset_fixed","False","Dépréciations du matériel et de l'outillage agricole Dépréciations du matériel d'emballage récupérable et identifiable"
"syscebnl_2944","Depreciation of equipment and furniture",2944,"asset_fixed","False","Dépréciations du matériel et du mobilier"
"syscebnl_2945","Impairment of transport equipment",2945,"asset_fixed","False","Dépréciations du matériel de transport"
"syscebnl_2946","Impairment of biological assets",2946,"asset_fixed","False","Dépréciations des actifs biologiques"
"syscebnl_2947","Impairment of fixtures and fittings, equipment and biological assets",2947,"asset_fixed","False","Dépréciations des aménagements et agencements du matériel et des actifs biologiques"
"syscebnl_2948","Impairment of other equipment",2948,"asset_fixed","False","Dépréciations des autres matériels"
"syscebnl_2949","Impairment of equipment in progress",2949,"asset_fixed","False","Dépréciations de matériel en cours"
"syscebnl_2951","Impairment of advance payments on intangible assets",2951,"asset_non_current","False","Dépréciations des avances et acomptes versés sur immobilisations incorporelles"
"syscebnl_2952","Impairment of advance payments on property, plant and equipment",2952,"asset_fixed","False","Dépréciations des avances et acomptes versés sur immobilisations corporelles"
"syscebnl_2961","Impairment of equity investments",2961,"asset_non_current","False","Dépréciations des titres de participation"
"syscebnl_2965","Impairment of investments in professional bodies",2965,"asset_non_current","False","Dépréciations des participations dans des organismes professionnels"
"syscebnl_2966","Impairment of shares in EIGs",2966,"asset_non_current","False","Dépréciations des parts dans des GIE"
"syscebnl_2968","Impairment of other investments",2968,"asset_non_current","False","Dépréciations des autres titres de participation"
"syscebnl_2971","Impairment of loans and receivables",2971,"asset_non_current","False","Dépréciations des prèts et créances"
"syscebnl_2972","Impairment of employee loans",2972,"asset_non_current","False","Dépréciations des prêts au personnel"
"syscebnl_2973","Impairment of receivables from the State",2973,"asset_non_current","False","Dépréciations des créances sur l'Etat"
"syscebnl_2974","Impairment of long-term investments",2974,"asset_non_current","False","Dépréciations des titres immobilisés"
"syscebnl_2975","Impairment of deposits and guarantees paid",2975,"asset_non_current","False","Dépréciations des dépôts et cautionnements versés"
"syscebnl_2977","Impairment of receivables from equity interests and advances to economic interest groupings (EIGs)",2977,"asset_non_current","False","Dépréciations des créances rattachées à des participations et avances à des GIE"
"syscebnl_2978","Impairment of other financial receivables",2978,"asset_non_current","False","Dépréciations des créances financières diverses"
"syscebnl_311","Assets related to business A",311,"asset_current","False","Biens liés à l'activité A"
"syscebnl_312","Assets related to business B",312,"asset_current","False","Biens liés à l'activité B"
"syscebnl_321","Goods A",321,"asset_current","False","Marchandises A"
"syscebnl_322","Goods B",322,"asset_current","False","Marchandises B"
"syscebnl_323","Materials A",323,"asset_current","False","Matières A"
"syscebnl_324","Materials B",324,"asset_current","False","Matières B"
"syscebnl_325","Related supplies (A, B)",325,"asset_current","False","Fournitures liées (A, B)"
"syscebnl_331","Consumables",331,"asset_current","False","Matières consommables"
"syscebnl_333","Store supplies",333,"asset_current","False","Fournitures de magasin"
"syscebnl_334","Office supplies",334,"asset_current","False","Fournitures de bureau"
"syscebnl_3351","Lost packaging",3351,"asset_current","False","Emballages perdus"
"syscebnl_3352","Unidentifiable recoverable packaging",3352,"asset_current","False","Emballages récupérables non identifiables"
"syscebnl_3353","Mixed-use packaging",3353,"asset_current","False","Emballages à usage mixte"
"syscebnl_3358","Other packaging",3358,"asset_current","False","Autres emballages"
"syscebnl_338","Other materials",338,"asset_current","False","Autres matières"
"syscebnl_341","Unallocated gifts in kind",341,"asset_current","False","Dons en nature non affectés"
"syscebnl_345","Allocated donations in kind",345,"asset_current","False","Dons en nature affectés"
"syscebnl_361","Finished products A",361,"asset_current","False","Produits finis A"
"syscebnl_362","Finished products B",362,"asset_current","False","Produits finis B"
"syscebnl_3631","Animals",3631,"asset_current","False","Animaux"
"syscebnl_3632","Plants",3632,"asset_current","False","Végétaux"
"syscebnl_3638","Other inventories (ancillary activities)",3638,"asset_current","False","Autres stocks (activités annexes)"
"syscebnl_367","Intermediate and residual products",367,"asset_current","False","Produits intermédiaires et résiduels"
"syscebnl_371","Goods linked to the activity en route",371,"asset_current","False","Biens liés à l'activité en cours de route"
"syscebnl_372","Goods, raw materials and supplies tied up en route",372,"asset_current","False","Marchandises, matières premières et fournitures liés en cours de route"
"syscebnl_373","Other supplies en route",373,"asset_current","False","Autres approvisionnements en cours de route"
"syscebnl_376","Finished products en route",376,"asset_current","False","Produits finis en cours de route"
"syscebnl_3771","Consignment stock",3771,"asset_current","False","Stock en consignation"
"syscebnl_3772","Stock in warehouse",3772,"asset_current","False","Stock en dépôt"
"syscebnl_378","Stock from retired or scrapped fixed assets",378,"asset_current","False","Stock provenant d'immobilisations mises hors services ou au rebut"
"syscebnl_381","unallocated",381,"asset_current","False","non affectés"
"syscebnl_385","allocated",385,"asset_current","False","affectés"
"syscebnl_391","Impairment of inventories of goods used in operations",391,"asset_current","False","Dépréciations des stocks de biens liés à l'activité"
"syscebnl_392","Impairment of inventories of merchandise, raw materials and related supplies",392,"asset_current","False","Dépréciations des stocks de marchandises, et matières premières et fournitures liées"
"syscebnl_393","Impairment of inventories of other supplies",393,"asset_current","False","Dépréciations des stocks d'autres approvisionnements"
"syscebnl_396","Impairment of inventories of finished goods, intermediate products and residuals",396,"asset_current","False","Dépréciations des stocks de produits finis, produits intermédiaires et résiduels"
"syscebnl_397","Depreciation of inventories in transit, on consignment or on deposit",397,"asset_current","False","Dépréciations des stocks en cours de route, en consignation ou en dépôt"
"syscebnl_401","Trade payables",401,"liability_payable","True","Fournisseurs, dettes en compte"
"syscebnl_4011","Suppliers, payable",4011,"liability_payable","True","Fournisseurs, dettes en compte"
"syscebnl_4013","Subcontractor suppliers, payable",4013,"liability_payable","True","Fournisseurs sous-traitants, dettes en compte"
"syscebnl_4016","Suppliers, retention of title",4016,"liability_payable","True","Fournisseurs, réserve de propriété"
"syscebnl_4017","Suppliers, holdbacks",4017,"liability_payable","True","Fournisseurs, retenues de garantie"
"syscebnl_4021","Suppliers, bills payable",4021,"liability_payable","True","Fournisseurs, effets à payer"
"syscebnl_4023","Subcontractors, bills payable",4023,"liability_payable","True","Fournisseurs sous-traitants, effets à payer"
"syscebnl_4081","Suppliers",4081,"liability_payable","True","Fournisseurs, factures non parvenues"
"syscebnl_4083","Subcontractor suppliers",4083,"liability_payable","True","Fournisseurs sous-traitants, factures non parvenues"
"syscebnl_4086","Trade payables, accrued interest",4086,"liability_payable","True","Fournisseurs, intérêts courus"
"syscebnl_409","Trade accounts receivable",409,"asset_receivable","True","Fournisseurs débiteurs"
"syscebnl_4091","Advances and deposits paid to suppliers",4091,"asset_receivable","True","Fournisseurs avances et acomptes versés"
"syscebnl_4093","Advances and deposits paid to suppliers and subcontractors",4093,"asset_receivable","True","Fournisseurs sous-traitants avances et acomptes versés"
"syscebnl_4094","Trade accounts receivable for packaging and materials to be returned",4094,"asset_receivable","True","Fournisseurs créances pour emballages et matériels à rendre"
"syscebnl_4098","Suppliers, discounts, rebates and other credit notes to be obtained",4098,"asset_receivable","True","Fournisseurs, rabais, remises, ristournes et autres avoirs à obtenir"
"syscebnl_411","Members",411,"asset_receivable","True","Adhérents"
"syscebnl_412","Customers-users",412,"asset_receivable","True","Clients-usagers"
"syscebnl_4131","Members, unpaid cheques",4131,"asset_receivable","True","Adhérents, chèques impayés"
"syscebnl_4132","Customer-users, unpaid cheques",4132,"asset_receivable","True","Clients-usagers, chèques impayés"
"syscebnl_4133","Members, other unpaid values",4133,"asset_receivable","True","Adhérents, autres valeurs impayées"
"syscebnl_4138","Customers, other unpaid items",4138,"asset_receivable","True","Clients-usagers, autres valeurs impayées"
"syscebnl_4161","Members with disputed or questionable dues",4161,"asset_receivable","True","Adhérents cotisations litigieuses ou douteuses"
"syscebnl_4162","Doubtful or disputed receivables",4162,"asset_receivable","True","Créances litigieuses ou douteuses"
"syscebnl_4181","Members, call for funds",4181,"asset_receivable","True","Adhérents, appels de fonds à établir"
"syscebnl_4182","Customer-users, invoicing",4182,"asset_receivable","True","Clients-usagers, factures à établir"
"syscebnl_4186","Members, customer-users, accrued interest",4186,"asset_receivable","True","Adhérents, Clients-usagers, intérêts courus"
"syscebnl_419","Members, Customer-users creditors",419,"liability_payable","True","Adhérents, Clients-usagers créditeurs"
"syscebnl_4191","Members, advances received",4191,"liability_payable","True","Adhérents, avances reçues"
"syscebnl_4192","Customer advances and deposits received",4192,"liability_payable","True","Clients-usagers, avances et acomptes reçus"
"syscebnl_4194","Customer payables for returnable packaging and materials",4194,"liability_payable","True","Clients-usagers, dettes pour emballages et matériels consignés"
"syscebnl_4198","Customer rebates, discounts, refunds and other credit notes to be granted",4198,"liability_payable","True","Clients-usagers, rabais, remises, ristournes et autres avoirs à accorder"
"syscebnl_4211","Personnel, advances",4211,"asset_current","False","Personnel, avances"
"syscebnl_4212","Personnel, advance payments",4212,"asset_current","False","Personnel, acomptes"
"syscebnl_4213","Advanced expenses and staff supplies",4213,"asset_current","False","Frais avancés et fournitures au personnel"
"syscebnl_422","Personnel, remuneration due",422,"asset_current","False","Personnel, rémunérations dues"
"syscebnl_4231","Personnel, objections",4231,"asset_current","False","Personnel, oppositions"
"syscebnl_4232","Personnel, arrest seizures",4232,"asset_current","False","Personnel, saisies arrêts"
"syscebnl_4233","Personnel, third-party notices",4233,"asset_current","False","Personnel, avis à tiers détenteur"
"syscebnl_4241","Medical assistance",4241,"asset_current","False","Assistance médicale"
"syscebnl_4242","Family allowances",4242,"asset_current","False","Allocations familiales"
"syscebnl_4245","Social organizations attached to entity",4245,"asset_current","False","Organismes sociaux rattachés à entité"
"syscebnl_4248","Other internal social works",4248,"asset_current","False","Autres œuvres sociales internes"
"syscebnl_4251","Employee delegates",4251,"asset_current","False","Délégués du personnel"
"syscebnl_4252","Trade unions and similar bodies",4252,"asset_current","False","Syndicats et assimilés"
"syscebnl_4258","Other personnel representatives",4258,"asset_current","False","Autres représentants du personnel"
"syscebnl_427","Personnel – deposits",427,"asset_current","False","Personnel - dépôts"
"syscebnl_4281","Personnel, vacation pay",4281,"asset_current","False","Personnel, congés à payer"
"syscebnl_4286","Personnel, other accrued expenses",4286,"asset_current","False","Personnel, autres charges à payer"
"syscebnl_4287","Personnel, receivables",4287,"asset_current","False","Personnel, produits à recevoir"
"syscebnl_4311","Family benefits",4311,"asset_current","False","Prestations familiales"
"syscebnl_4312","Work accidents",4312,"asset_current","False","Accidents de travail"
"syscebnl_4318","Other social security contributions",4318,"asset_current","False","Autres cotisations sociales"
"syscebnl_4321","Mandatory pension fund",4321,"asset_current","False","Caisse de retraite obligatoire"
"syscebnl_4322","Supplementary pension fund",4322,"asset_current","False","Caisse de retraite complémentaire"
"syscebnl_4328","Other pension funds",4328,"asset_current","False","Autres caisses de retraites"
"syscebnl_4331","Health insurance",4331,"asset_current","False","Mutuelle de santé"
"syscebnl_4332","Pension insurance",4332,"asset_current","False","Assurances retraite"
"syscebnl_4333","Insurance and health organizations",4333,"asset_current","False","Assurances et organismes de santé"
"syscebnl_4381","Social security contributions on gratuities payable",4381,"asset_current","False","Charges sociales sur gratifications à payer"
"syscebnl_4382","Social security contributions on vacation pay",4382,"asset_current","False","Charges sociales sur congés à payer"
"syscebnl_4386","Social security, other accrued expenses",4386,"asset_current","False","Organismes sociaux, autres charges à payer"
"syscebnl_4387","Receivables",4387,"asset_current","False","Produits à recevoir"
"syscebnl_4421","State taxes and duties",4421,"asset_current","False","Impôts et taxes d'État"
"syscebnl_4422","Taxes and levies for public authorities",4422,"asset_current","False","Impôts et taxes pour les collectivités publiques"
"syscebnl_4423","Taxes and duties recoverable from bondholders",4423,"asset_current","False","Impôts et taxes recouvrables sur des obligataires"
"syscebnl_4424","Taxes and duties recoverable from members and others",4424,"asset_current","False","Impôts et taxes recouvrables sur des adhérents et autres"
"syscebnl_4426","Customs duties",4426,"asset_current","False","Droits de douane"
"syscebnl_4428","Other taxes and duties",4428,"asset_current","False","Autres impôts et taxes"
"syscebnl_443","State, VAT invoiced",443,"liability_current","False","État, T.V.A. Facturée"
"syscebnl_444","State, VAT due or VAT credit",444,"liability_current","False","État, T.V.A. due ou crédit de T.V.A."
"syscebnl_445","State, V.A.T. recoverable",445,"asset_current","False","État, T.V.A. Récupérable"
"syscebnl_446","State, other sales taxes",446,"liability_current","False","État, autres taxes sur le chiffre d'affaires"
"syscebnl_4471","General income tax",4471,"asset_current","False","Impôt général sur le revenu"
"syscebnl_4472","Payroll taxes",4472,"asset_current","False","Impôts sur salaires"
"syscebnl_4473","National contribution",4473,"asset_current","False","Contribution nationale"
"syscebnl_4474","National solidarity contribution",4474,"asset_current","False","Contribution nationale de solidarité"
"syscebnl_4478","Other taxes and contributions",4478,"asset_current","False","Autres impôts et contributions"
"syscebnl_4486","State, accrued expenses",4486,"asset_current","False","État,charges à payer"
"syscebnl_4487","State, receivables",4487,"asset_current","False","État, produits à recevoir"
"syscebnl_449","Government, sundry receivables and payables",449,"asset_current","False","État, créances et dettes diverses"
"syscebnl_4491","Government, subsidy receivable",4491,"asset_current","False","État, Subvention à recevoir"
"syscebnl_4511","Associations and similar - Contributors in kind",4511,"asset_current","False","Associations et assimilées - Apporteurs en nature"
"syscebnl_4512","Associations and similar - Cash contributors",4512,"asset_current","False","Associations et assimilées - Apporteurs en numéraire"
"syscebnl_4515","Associations and similar - Members, managers, current accounts",4515,"asset_current","False","Associations et assimilées - Adhérents, dirigeants, comptes courants"
"syscebnl_4521","Foundations and similar - Contributors in kind",4521,"asset_current","False","Fondations et assimilées - Apporteurs en nature"
"syscebnl_4522","Foundations and similar - Contributors in cash",4522,"asset_current","False","Fondations et assimilées - Apporteurs en numéraire"
"syscebnl_4555","Founders, executives, current accounts",4555,"asset_current","False","Fondateurs, dirigeants, comptes courants"
"syscebnl_4531","Professional orders - Contributors in kind",4531,"asset_current","False","Ordres professionnels - Apporteurs en nature"
"syscebnl_4532","Professional orders - Contributors in cash",4532,"asset_current","False","Ordres professionnels - Apporteurs en numéraire"
