"id","name","code","account_type","reconcile","name@fr"
"syscebnl_4535","Professional orders - Members, officers, current accounts",4535,"asset_current","False","Ordres professionnels - Membres, dirigeants, comptes courants"
"syscebnl_4541","Political organizations - Contributors in kind",4541,"asset_current","False","Organisations politiques - Apporteurs en nature"
"syscebnl_4542","Political organizations - Contributors in cash",4542,"asset_current","False","Organisations politiques - Apporteurs en numéraire"
"syscebnl_4545","Political organizations - Members, officers, current accounts",4545,"asset_current","False","Organisations politiques - Adhérents, dirigeants, comptes courants"
"syscebnl_4551","Trade unions - Contributors in kind",4551,"asset_current","False","Organisations syndicales - Apporteurs en nature"
"syscebnl_4552","Trade unions - Contributors in cash",4552,"asset_current","False","Organisations syndicales - Apporteurs en numéraire"
"syscebnl_4555","Trade unions - Members, officers, current accounts",4555,"asset_current","False","Organisations syndicales - Adhérents, dirigeants, comptes courants"
"syscebnl_4561","Religious congregations and similar bodies",4561,"asset_current","False","Congrégations religieuses et assimilées et assimilés"
"syscebnl_4562","Waqf and similar",4562,"asset_current","False","Waqf et assimilés"
"syscebnl_4571","Patrons and similar",4571,"asset_current","False","Mécènes et assimilés"
"syscebnl_4572","Volunteers and similar",4572,"asset_current","False","Bénévoles et assimilés"
"syscebnl_458","Other founders and contributors",458,"asset_current","False","Autres fondateurs et apporteurs"
"syscebnl_462","Donors-development projects, administration funds",462,"asset_current","False","Bailleurs-projet de développement, Fonds d'administration"
"syscebnl_463","State development project, administration fund",463,"asset_current","False","État-projet de développement, Fonds d'administration"
"syscebnl_464","Other third parties or similar funding bodies-development projects, administration funds",464,"asset_current","False","Autres tiers ou organismes de financement assimilés-projet de développement, Fonds d'administration"
"syscebnl_4692","Lessors-Administration funds receivable",4692,"asset_current","False","Bailleurs-Fonds d'administration à recevoir"
"syscebnl_4693","State-administration funds receivable",4693,"asset_current","False","État-Fonds d'administration à recevoir"
"syscebnl_4694","Other third parties or similar financing administrative bodies-funds receivable",4694,"asset_current","False","Autres tiers ou organismes de financement assimilés-Fonds d'administration à recevoir"
"syscebnl_4711","Sundry debtors",4711,"asset_current","False","Débiteurs divers"
"syscebnl_4712","Sundry creditors",4712,"asset_current","False","Créditeurs divers"
"syscebnl_4713","Accounts payable, current unused donations in kind",4713,"asset_current","False","Créditeurs, dons en nature courants non consommés"
"syscebnl_4717","Sundry debtors-guarantee retentions",4717,"asset_current","False","Débiteurs divers-retenues de garantie"
"syscebnl_4719","Stock and bond warrants",4719,"asset_current","False","Bons de souscription d'actions et d'obligations"
"syscebnl_4721","Receivables on disposals of marketable securities",4721,"asset_current","False","Créances sur cessions de titres de placement"
"syscebnl_4726","Payments outstanding on unpaid investment securities",4726,"asset_current","False","Versements restant à effectuer sur titres de placement non libérés"
"syscebnl_4731","Investment grants receivable",4731,"asset_current","False","Subventions d'investissement à recevoir"
"syscebnl_4732","Operating subsidies receivable",4732,"asset_current","False","Subventions d'exploitation à recevoir"
"syscebnl_4733","Balancing subsidies receivable",4733,"asset_current","False","Subventions d'équilibre à recevoir"
"syscebnl_4738","Other grants receivable",4738,"asset_current","False","Autres subventions à recevoir"
"syscebnl_4739","Grants repayable",4739,"asset_current","False","Subventions à reverser"
"syscebnl_4746","Periodic expense allocation account",4746,"asset_current","False","Compte de répartition périodique des charges"
"syscebnl_4747","Periodic income allocation account",4747,"asset_current","False","Compte de répartition périodique des produits"
"syscebnl_475","Financial generosity receivable",475,"asset_current","False","Générosités financières à recevoir"
"syscebnl_476","Prepaid expenses",476,"asset_current","False","Charges constatés d'avance"
"syscebnl_477","Deferred income",477,"asset_current","False","Produits constatés d'avance"
"syscebnl_47811","Decrease in operating receivables",47811,"asset_current","False","Diminution des créances d'exploitation"
"syscebnl_47818","Decrease in H.A.O. receivables",47818,"asset_current","False","Diminution des créances H.A.O."
"syscebnl_4782","Decrease in financial receivables",4782,"asset_current","False","Diminution des créances financières"
"syscebnl_47831","Increase in operating liabilities",47831,"asset_current","False","Augmentation des dettes d'exploitation"
"syscebnl_47838","Increase in H.A.O. liabilities",47838,"asset_current","False","Augmentation des dettes H.A.O."
"syscebnl_4784","Increase in financial liabilities",4784,"asset_current","False","Augmentation des dettes financières"
"syscebnl_4786","Valuation differences on cash instruments",4786,"asset_current","False","Différences d'évaluation sur instruments de trésorerie"
"syscebnl_4788","Differences offset by currency hedges",4788,"asset_current","False","Différences compensées par couverture de change"
"syscebnl_47911","Increase in operating receivables",47911,"liability_current","False","Augmentation des créances d'exploitation"
"syscebnl_47918","Increase in H.A.O. receivables",47918,"liability_current","False","Augmentation des créances H.A.O."
"syscebnl_4792","Increase in financial receivables",4792,"liability_current","False","Augmentation des créances financières"
"syscebnl_47931","Decrease in trade payables",47931,"liability_current","False","Diminution des dettes d'exploitation"
"syscebnl_47938","Decrease in trade payables",47938,"liability_current","False","Diminution des dettes H.A.O."
"syscebnl_4794","Decrease in financial liabilities",4794,"liability_current","False","Diminution des dettes financières"
"syscebnl_4797","Valuation differences on cash instruments",4797,"liability_current","False","Différences d'évaluation sur instruments de trésorerie"
"syscebnl_4798","Differences offset by currency hedges",4798,"liability_current","False","Différences compensées par couverture de change"
"syscebnl_4811","Suppliers of intangible assets",4811,"liability_current","False","Fournisseurs, immobilisations incorporelles"
"syscebnl_4812","Suppliers of property, plant and equipment",4812,"liability_current","False","Fournisseurs, immobilisations corporelles"
"syscebnl_4813","Outstanding payments on investments in subsidiaries and affiliates and non-voting shares",4813,"liability_current","False","Versements restant à effectuer sur titres de participation et titres immobilisé non libérés"
"syscebnl_48161","Suppliers, retention of title - intangible assets",48161,"liability_current","False","Fournisseurs, réserve de propriété immobilisations incorporelles"
"syscebnl_48162","Suppliers, retention of title - property, plant and equipment",48162,"liability_current","False","Fournisseurs, réserve de propriété-immobilisations corporelles"
"syscebnl_48171","Suppliers, retention of title - intangible assets",48171,"liability_current","False","Fournisseurs, retenues de garantie-immobilisations incorporelles"
"syscebnl_48172","Suppliers, retention of title - property, plant and equipment",48172,"liability_current","False","Fournisseurs, retenues de garantie-immobilisations corporelles"
"syscebnl_48181","Suppliers, unpaid invoices - intangible assets",48181,"liability_current","False","Fournisseurs, factures non venues-immobilisations incorporelles"
"syscebnl_48182","Trade payables, invoices not received - fixed assets",48182,"liability_current","False","Fournisseurs, factures non, arvenues-immobilisations"
"syscebnl_484","Other liabilities outside ordinary activities (H.A.O.)",484,"liability_current","False","Autres dettes hors activités ordinaires (H.A.O.)"
"syscebnl_4851","Receivables, on account, intangible assets",4851,"asset_receivable","True","Créances, en compte, immobilisations incorporelles"
"syscebnl_4852","Receivables, tangible fixed assets",4852,"asset_receivable","True","Créances, en compte, immobilisations corporelles"
"syscebnl_4856","Receivables, financial fixed assets",4856,"asset_receivable","True","Créances, immobilisations financières"
"syscebnl_4857","Receivables, holdbacks on fixed asset disposals",4857,"asset_receivable","True","Créances, Retenues de garantie sur cession immobilisations"
"syscebnl_4858","Receivables on fixed asset disposals, invoices to be issued",4858,"asset_receivable","True","Créances sur cession d'immobilisations, factures à établir"
"syscebnl_4861","Debts on fixed asset donations and bequests",4861,"liability_current","False","Dettes des dons et legs d'immobilisations"
"syscebnl_4865","Receivables from fixed asset donations and bequests",4865,"asset_current","False","Créances reçues sur dons et legs d'immobilisations"
"syscebnl_488","Other debts outside ordinary activities (H.A.O.)",488,"liability_current","False","Autres créances hors activités ordinaires (H.A.O.)"
"syscebnl_4881","Accounts payable, gifts in kind H.A.O. not consumed",4881,"liability_current","False","Créditeurs, dons en nature H.A.O. non consommés"
"syscebnl_490","Impairment of trade payables",490,"asset_current","False","Dépréciations des comptes fournisseurs"
"syscebnl_491","Impairment of member and customer accounts",491,"asset_current","False","Dépréciations des comptes adhérents et clients-usagers"
"syscebnl_4911","Impairment of disputed receivables",4911,"asset_current","False","Dépréciations des créances litigieuses"
"syscebnl_4912","Impairment of doubtful receivables",4912,"asset_current","False","Dépréciations des créances douteuses"
"syscebnl_492","Impairment of personnel accounts",492,"asset_current","False","Dépréciations des comptes personnel"
"syscebnl_493","Impairment of social security accounts",493,"asset_current","False","Dépréciations des comptes organismes sociaux"
"syscebnl_494","Impairment of government and public authority accounts",494,"asset_current","False","Dépréciations des comptes État et Collectivités publiques"
"syscebnl_497","Impairment of sundry debtors",497,"asset_current","False","Dépréciations des comptes débiteurs divers"
"syscebnl_4985","Impairment of receivables on fixed asset disposals",4985,"asset_current","False","Dépréciations des créances sur cessions d’immobilisations"
"syscebnl_4988","Impairment of other H.A.O. receivables",4988,"asset_current","False","Dépréciations des autres créances H.A.O."
"syscebnl_4991","Provisions for risks on operating transactions",4991,"liability_current","False","Provisions pour risques sur opérations d'exploitation"
"syscebnl_4998","Provisions for risks on H.A.O. operations",4998,"liability_current","False","Provisions pour risques sur operations H.A.O"
"syscebnl_5011","Short-term Treasury securities",5011,"asset_current","False","Titres du Trésor à court terme"
"syscebnl_5012","Financial institution securities",5012,"asset_current","False","Titres d'organismes financiers"
"syscebnl_5013","Short-term savings bonds",5013,"asset_current","False","Bons de caisse à court terme"
"syscebnl_5016","Acquisition costs for treasury securities and savings bonds",5016,"asset_current","False","Frais d'acquisition des titres de trésor et bons de caisse"
"syscebnl_5022","Listed shares",5022,"asset_current","False","Actions cotées"
"syscebnl_5023","Unlisted shares",5023,"asset_current","False","Actions non cotées"
"syscebnl_5025","Other shares",5025,"asset_current","False","Autres actions"
"syscebnl_5026","Share acquisition costs",5026,"asset_current","False","Frais d'acquisition des actions"
"syscebnl_5032","Listed bonds",5032,"asset_current","False","Obligations cotées"
"syscebnl_5033","Unlisted bonds",5033,"asset_current","False","Obligations non cotées"
"syscebnl_5035","Other bonds",5035,"asset_current","False","Autres obligations"
"syscebnl_5036","Bond acquisition costs",5036,"asset_current","False","Frais d'acquisition des obligations"
"syscebnl_5042","Share warrants",5042,"asset_current","False","Bons de souscription d'actions"
"syscebnl_5043","Bond warrants",5043,"asset_current","False","Bons de souscription d'obligations"
"syscebnl_505","Marketable securities outside the Region",505,"asset_current","False","Titres négociables hors Région"
"syscebnl_5061","Accrued interest - Treasury securities and short-term bills",5061,"asset_current","False","TIntérêts courus - itres du Trésor et bons de caisse à court terme"
"syscebnl_5062","Accrued interest - Shares",5062,"asset_current","False","Intérêts courus - Actions"
"syscebnl_5063","Accrued interest - Bonds",5063,"asset_current","False","Intérêts courus - Obligations"
"syscebnl_508","Other investment securities and similar receivables",508,"asset_current","False","Autres titres de placement et créances assimilées"
"syscebnl_513","Cheques to be cashed",513,"asset_current","False","Chèques à encaisser"
"syscebnl_514","Cheques for collection",514,"asset_current","False","Chèques à l'encaissement"
"syscebnl_515","Credit cards for collection",515,"asset_current","False","Cartes de crédit à encaisser"
"syscebnl_5185","Travelers' checks",5185,"asset_current","False","Chèques de voyage"
"syscebnl_5186","Coupons due",5186,"asset_current","False","Coupons échus"
"syscebnl_5187","Interest due on bonds",5187,"asset_current","False","Intérêts échus des obligations"
"syscebnl_5211","Local banks in local currency",5211,"asset_cash","False","Banques en monnaie nationale locales"
"syscebnl_5215","Local banks in foreign currencies",5215,"asset_cash","False","Banques en devises locales"
"syscebnl_522","Banks in other countries, Region",522,"asset_cash","False","Banques autres États Région"
"syscebnl_523","Banks in other States, Monetary zone",523,"asset_cash","False","Banques autres États zone monétaire"
"syscebnl_524","Banks outside the monetary zone",524,"asset_cash","False","Banques hors zone monétaire"
"syscebnl_525","Banks term deposits and similar transactions",525,"asset_cash","False","Banques dépôt à terme et opérations assimilées"
"syscebnl_5261","Bank, accrued interest accrued expenses",5261,"asset_cash","False","Banque, intérêts courus charges à payer"
"syscebnl_5267","Bank, accrued interest accrued income",5267,"asset_cash","False","Banque, intérêts courus produits à recevoir"
"syscebnl_531","Postal banks",531,"asset_cash","False","Banques postales"
"syscebnl_532","Treasury",532,"asset_cash","False","Trésor"
"syscebnl_533","Management and intermediation companies (S.G.L.)",533,"asset_cash","False","Sociétés de gestion et d'intermédiation (S.G.L.)"
"syscebnl_5361","Financial institutions, accrued interest accrued expenses",5361,"asset_cash","False","Établissements financiers, intérêts courus charges à payer"
"syscebnl_5367","Financial institutions, accrued interest accrued income",5367,"asset_cash","False","Établissements financiers, intérêts courus produits à recevoir"
"syscebnl_538","Other financial institutions",538,"asset_cash","False","Autres organismes financiers"
"syscebnl_551","Electronic money - fuel card",551,"asset_cash","False","Monnaie électronique-carte carburant"
"syscebnl_552","Electronic money - cell phone",552,"asset_cash","False","Monnaie électronique- téléphone portable"
"syscebnl_553","Electronic money - toll card",553,"asset_cash","False","Monnaie électronique - carte péage"
"syscebnl_554","Electronic purse",554,"asset_cash","False","Porte-monnaie électronique"
"syscebnl_558","Other electronic money instruments",558,"asset_cash","False","Autres instruments de monnaie électronique"
"syscebnl_561","Cash credits",561,"liability_current","False","Crédits de trésorerie"
"syscebnl_565","Discounting of ordinary loans",565,"liability_current","False","Escompte de crédits ordinaires"
"syscebnl_566","Bank overdrafts, accrued interest",566,"liability_current","False","Banques, crédits de trésorerie, intérêts courus"
"syscebnl_571","Cash in local currency",571,"asset_cash","False","Caisse en monnaie nationale"
"syscebnl_572","Cash in foreign currencies",572,"asset_cash","False","Caisse en devises"
"syscebnl_585","Transfers of funds",585,"asset_cash","False","Virements de fonds"
"syscebnl_588","Other internal transfers",588,"asset_cash","False","Autres virements internes"
"syscebnl_590","Impairment of marketable securities",590,"asset_cash","False","Dépréciations des titres de placement"
"syscebnl_591","Impairment of securities and receivables",591,"asset_cash","False","Dépréciations des titres et valeurs à encaisser"
"syscebnl_592","Impairment of bank accounts",592,"asset_cash","False","Dépréciations des comptes banques"
"syscebnl_593","Impairment of financial institution and similar accounts",593,"asset_cash","False","Dépréciations des comptes établissements financiers et assimilés"
"syscebnl_595","Impairment of electronic money accounts",595,"asset_cash","False","Dépréciations des comptes d'instruments de monnaie électronique"
"syscebnl_599","Provisions for short-term financial risks and charges",599,"liability_current","False","Provisions pour risque et charges à court terme à caractère financier"
"syscebnl_6011","Purchases of goods and services related to the activity in the State",6011,"expense_direct_cost","False","Achats de biens et services liés à l'activité dans l’État partie"
"syscebnl_6012","Purchases of goods and services related to operations in the Region",6012,"expense_direct_cost","False","Achats de biens et services liés à l'activité dans la Région"
"syscebnl_6013","Purchases of goods and services related to activities outside the Region",6013,"expense_direct_cost","False","Achats de biens et services liés à l'activité hors Région"
"syscebnl_6015","Expenses on purchases of goods and services related to the activity",6015,"expense_direct_cost","False","Frais sur achats de biens et services liés à l'activité"
"syscebnl_6019","Discounts and rebates obtained (not broken down)",6019,"expense_direct_cost","False","Rabais, Remises et Ristournes obtenus (non ventilés)"
"syscebnl_6021","Purchases of goods and raw materials in the State",6021,"expense_direct_cost","False","Achats de marchandises et matières premières dans l'État partie"
"syscebnl_6022","Purchases of goods and raw materials in the Region",6022,"expense_direct_cost","False","Achats de marchandises et matières premières dans la Région"
"syscebnl_6023","Purchases of goods and raw materials outside the Region",6023,"expense_direct_cost","False","Achats de marchandises et matières premières hors Région"
"syscebnl_6025","Expenses on purchases of goods and materials",6025,"expense_direct_cost","False","Frais sur achats de marchandises et matières"
"syscebnl_6029","Discounts and rebates obtained (not broken down)",6029,"expense_direct_cost","False","Rabais, Remises et Ristournes obtenus (non ventile)"
"syscebnl_6031","Changes in inventories of goods and services related to operations",6031,"expense","False","Variations des stocks de biens et services liés à l'activité"
"syscebnl_6032","Changes in inventories of goods",6032,"expense","False","Variations des stocks de marchandises"
"syscebnl_6033","Changes in inventories of raw materials and related supplies",6033,"expense","False","Variations des stocks de matières premières et fournitures liées"
"syscebnl_6034","Changes in inventories of other supplies",6034,"expense","False","Variations des stocks d'autres approvisionnements"
"syscebnl_6035","Changes in inventories of gifts in kind to be distributed",6035,"expense","False","Variations de stocks de dons en nature à distribuer"
"syscebnl_6041","Stocked purchases of onsumables",6041,"expense_direct_cost","False","Achats stockés de atières consommables"
"syscebnl_6042","Stocked purchases of combustible materials",6042,"expense_direct_cost","False","Achats stockés de atières combustibles"
"syscebnl_6043","Stocked purchases of maintenance products",6043,"expense_direct_cost","False","Achats stockés de produits d'entretien"
"syscebnl_6045","Cost of consumables and supplies",6045,"expense_direct_cost","False","Frais sur achats matières et fournitures consommables"
"syscebnl_6046","Stocked purchases of shop supplies",6046,"expense_direct_cost","False","Achats stockés de fournitures de magasin"
"syscebnl_6047","Stocked purchases of office supplies",6047,"expense_direct_cost","False","Achats stockés de fournitures de bureau"
"syscebnl_6049","Discounts and rebates obtained (not broken down)",6049,"expense_direct_cost","False","Rabais, Remises et Ristoumes obtenus (non ventilés)"
"syscebnl_6051","Non-stockable supplies - Water",6051,"expense","False","Fournitures non stockables -Eau"
"syscebnl_6052","Non-stockable supplies-Electricity",6052,"expense","False","Fournitures non stockables-Électricité"
"syscebnl_6053","Non-stockable supplies-Other energy",6053,"expense","False","Fournitures non stockables-Autres énergies"
"syscebnl_6054","Non-stockable maintenance supplies",6054,"expense","False","Fournitures d'entretien non stockables"
"syscebnl_6055","Non-stockable office supplies",6055,"expense","False","Fournitures de bureau non stockables"
"syscebnl_6056","Purchases of small equipment and tools",6056,"expense","False","Achats de petit matériel et outillage"
"syscebnl_6057","Purchases of studies and services",6057,"expense","False","Achats d'études et prestations de services"
"syscebnl_6058","Purchases of works, materials and equipment",6058,"expense","False","Achats de travaux, matériels et équipements"
"syscebnl_6059","Discounts and rebates obtained (not broken down)",6059,"expense","False","Rabais, Remises et Ristournes obtenus (non ventilés)"
"syscebnl_6061","Purchases for ticket sales",6061,"expense","False","Achats pour billetteries"
"syscebnl_6062","Purchases for tombola and other games",6062,"expense","False","Achats pour tombola et autres jeux"
"syscebnl_6063","Purchases for shopping vouchers",6063,"expense","False","Achats pour bons d'achats"
"syscebnl_6064","Purchases for trips and outings",6064,"expense","False","Achats pour voyages et sorties"
"syscebnl_6068","Purchases for other activities",6068,"expense","False","Achats pour autres activités"
"syscebnl_6081","Lost packaging purchases",6081,"expense","False","Achats d'emballages perdus"
"syscebnl_6082","Unidentifiable recoverable packaging purchases",6082,"expense","False","Achats d'emballages récupérables non identifiables"
"syscebnl_6083","Mixed-use packaging purchases",6083,"expense","False","Achats d'emballages à usage mixte"
"syscebnl_6085","Expenses on packaging purchases",6085,"expense","False","Frais sur achats d'emballages"
"syscebnl_6089","Discounts and rebates obtained (not broken down)",6089,"expense","False","Rabais, Remises et Ristournes obtenus (non ventilés)"
"syscebnl_612","Transport on sales",612,"expense","False","Transports sur ventes"
"syscebnl_613","Transport on behalf of third parties",613,"expense","False","Transports pour le compte de tiers"
"syscebnl_614","Staff transport",614,"expense","False","Transports du personnel"
"syscebnl_616","Transport of mail",616,"expense","False","Transports de plis"
"syscebnl_6181","Travel and journeys costs",6181,"expense","False","Frais de voyages et déplacements"
"syscebnl_6183","Administrative transport costs",6183,"expense","False","Frais de transports administratifs"
"syscebnl_619","Discounts and rebates obtained (not broken down)",619,"expense","False","Rabais, Remises et Ristournes Obtenus (non ventilés)"
"syscebnl_621","General sub-contracting",621,"expense","False","Sous-traitance générale"
"syscebnl_6221","Rental of land, expenses",6221,"expense","False","Locations de terrains, charges locatives"
"syscebnl_6222","Rental of buildings, expenses",6222,"expense","False","Locations de bâtiments, charges locatives"
"syscebnl_6223","Rental of equipment and tools, expenses",6223,"expense","False","Locations de matériels et outillages, charges locatives"
"syscebnl_6224","Packaging waste, expenses",6224,"expense","False","Malis sur emballages, charges locatives"
"syscebnl_6225","Packaging rental, expenses",6225,"expense","False","Locations d'emballages, charges locatives"
"syscebnl_6226","Lease and rental of land, expenses",6226,"expense","False","Fermages et loyers du foncier, charges locatives"
"syscebnl_6228","Miscellaneous rental expenses",6228,"expense","False","Locations et charges locatives diverses"
"syscebnl_6232","Property leasing",6232,"expense","False","Crédit-bail immobilier"
"syscebnl_6233","Equipment leasing",6233,"expense","False","Crédit-bail mobilier"
"syscebnl_6234","Hire purchase",6234,"expense","False","Location-vente"
"syscebnl_6238","Other capital leases",6238,"expense","False","Autres contrats de location-acquisition"
"syscebnl_6241","Maintenance and repair of property",6241,"expense","False","Entretien et réparation des biens immobiliers"
"syscebnl_6242","Maintenance and repair of movable property",6242,"expense","False","Entretien et réparation des biens mobiliers"
"syscebnl_6243","Maintenance",6243,"expense","False","Maintenance"
"syscebnl_6244","Dismantling and restoration costs",6244,"expense","False","Charges de démantèlement et remise en état"
"syscebnl_6248","Other maintenance and repairs",6248,"expense","False","Autres entretiens et réparation"
