"id","name","code","account_type","reconcile","name@fr"
"syscebnl_446","State, other sales taxes",446,"liability_current","False","État, autres taxes sur le chiffre d'affaires"
"syscebnl_447","State, withholding taxes",447,"asset_current","False","État, impôts retenus à la source"
"syscebnl_448","State, accrued expenses and receivables",448,"asset_current","False","État, charges à payer et produits à recevoir"
"syscebnl_449","Government, sundry receivables and payables",449,"asset_current","False","État, créances et dettes diverses"
"syscebnl_451","Associations and similar",451,"asset_current","False","Associations et assimilées"
"syscebnl_452","Foundations and similar",452,"asset_current","False","Fondations et assimilées"
"syscebnl_453","Professional orders",453,"asset_current","False","Ordres professionnels"
"syscebnl_454","Political organizations",454,"asset_current","False","Organisations politiques"
"syscebnl_455","Trade unions",455,"asset_current","False","Organisations syndicales"
"syscebnl_456","Religious organizations, contributors",456,"asset_current","False","Organisations religieuses, apporteurs"
"syscebnl_457","Patrons and volunteers",457,"asset_current","False","Mécènes, bénévoles et assimilés"
"syscebnl_458","Other founders and contributors",458,"asset_current","False","Autres fondateurs et apporteurs"
"syscebnl_462","Donors-development projects, administration funds",462,"asset_current","False","Bailleurs-projet de développement, Fonds d'administration"
"syscebnl_463","State development project, administration fund",463,"asset_current","False","État-projet de développement, Fonds d'administration"
"syscebnl_464","Other third parties or similar funding bodies-development projects, administration funds",464,"asset_current","False","Autres tiers ou organismes de financement assimilés-projet de développement, Fonds d'administration"
"syscebnl_469","Administration funds receivable",469,"asset_current","False","Fonds d'administration à recevoir"
"syscebnl_4711","Sundry debtors",4711,"asset_current","False","Débiteurs divers"
"syscebnl_4712","Sundry creditors",4712,"liability_current","False","Créditeurs divers"
"syscebnl_4713","Accounts payable, current unused donations in kind",4713,"liability_current","False","Créditeurs, dons en nature courants non consommés"
"syscebnl_4717","Sundry debtors-guarantee retentions",4717,"asset_current","False","Débiteurs divers-retenues de garantie"
"syscebnl_4719","Stock and bond warrants",4719,"asset_current","False","Bons de souscription d'actions et d'obligations"
"syscebnl_4721","Receivables on disposals of marketable securities",4721,"asset_current","False","Créances sur cessions de titres de placement"
"syscebnl_4726","Payments outstanding on unpaid investment securities",4726,"asset_current","False","Versements restant à effectuer sur titres de placement non libérés"
"syscebnl_4731","Investment grants receivable",4731,"asset_current","False","Subventions d'investissement à recevoir"
"syscebnl_4732","Operating subsidies receivable",4732,"asset_current","False","Subventions d'exploitation à recevoir"
"syscebnl_4733","Balancing subsidies receivable",4733,"asset_current","False","Subventions d'équilibre à recevoir"
"syscebnl_4738","Other grants receivable",4738,"asset_current","False","Autres subventions à recevoir"
"syscebnl_4739","Grants repayable",4739,"liability_current","False","Subventions à reverser"
"syscebnl_4746","Periodic expense allocation account",4746,"liability_current","False","Compte de répartition périodique des charges"
"syscebnl_4747","Periodic income allocation account",4747,"asset_current","False","Compte de répartition périodique des produits"
"syscebnl_475","Financial generosity receivable",475,"asset_current","False","Générosités financières à recevoir"
"syscebnl_476","Prepaid expenses",476,"asset_current","False","Charges constatés d'avance"
"syscebnl_477","Deferred income",477,"liability_current","False","Produits constatés d'avance"
"syscebnl_478","Exchange differences - active",478,"asset_current","False","Écarts de conversion - actif"
"syscebnl_479","Exchange differences - passive",479,"liability_current","False","Écarts de conversion - passif"
"syscebnl_481","Suppliers of assets",4811,"liability_current","False","Fournisseurs d'immobilisations"
"syscebnl_484","Other liabilities outside ordinary activities (H.A.O.)",484,"liability_current","False","Autres dettes hors activités ordinaires (H.A.O.)"
"syscebnl_485","Receivables on fixed asset disposals,",485,"asset_receivable","True","Créances sur cession d'immobilisations"
"syscebnl_4861","Debts on fixed asset donations and bequests",4861,"liability_current","False","Dettes des dons et legs d'immobilisations"
"syscebnl_4865","Receivables from fixed asset donations and bequests",4865,"asset_current","False","Créances reçues sur dons et legs d'immobilisations"
"syscebnl_488","Other debts outside ordinary activities (H.A.O.)",488,"liability_current","False","Autres créances hors activités ordinaires (H.A.O.)"
"syscebnl_490","Impairment of trade payables",490,"asset_current","False","Dépréciations des comptes fournisseurs"
"syscebnl_491","Impairment of member and customer accounts",491,"asset_current","False","Dépréciations des comptes adhérents et clients-usagers"
"syscebnl_492","Impairment of personnel accounts",492,"asset_current","False","Dépréciations des comptes personnel"
"syscebnl_493","Impairment of social security accounts",493,"asset_current","False","Dépréciations des comptes organismes sociaux"
"syscebnl_494","Impairment of government and public authority accounts",494,"asset_current","False","Dépréciations des comptes État et Collectivités publiques"
"syscebnl_497","Impairment of sundry debtors",497,"asset_current","False","Dépréciations des comptes débiteurs divers"
"syscebnl_498","Impairment of receivables accounts",498,"asset_current","False","Dépréciations des comptes de créances H.A.O."
"syscebnl_4991","Provisions for risks on operating transactions",4991,"liability_current","False","Provisions pour risques sur opérations d'exploitation"
"syscebnl_4998","Provisions for risks on H.A.O. operations",4998,"liability_current","False","Provisions pour risques sur operations H.A.O"
"syscebnl_501","Short-term treasury securities and saving bonds",501,"asset_current","False","Titres du trésor et bons de caisse à court terme"
"syscebnl_502","Shares",502,"asset_current","False","Actions"
"syscebnl_503","Bonds",503,"asset_current","False","Obligations"
"syscebnl_504","Warrants",504,"asset_current","False","Bons de souscription"
"syscebnl_505","Marketable securities outside the Region",505,"asset_current","False","Titres négociables hors Région"
"syscebnl_506","Accrued interest",506,"asset_current","False","Intérêts courus"
"syscebnl_508","Other investment securities and similar receivables",508,"asset_current","False","Autres titres de placement et créances assimilées"
"syscebnl_513","Cheques to be cashed",513,"asset_current","False","Chèques à encaisser"
"syscebnl_514","Cheques for collection",514,"asset_current","False","Chèques à l'encaissement"
"syscebnl_515","Credit cards for collection",515,"asset_current","False","Cartes de crédit à encaisser"
"syscebnl_518","Other receivables",518,"asset_current","False","Autres valeurs à l'encaissement"
"syscebnl_521","Local banks",521,"asset_cash","False","Banques locales"
"syscebnl_522","Banks in other countries, Region",522,"asset_cash","False","Banques autres États Région"
"syscebnl_523","Banks in other States, Monetary zone",523,"asset_cash","False","Banques autres États zone monétaire"
"syscebnl_524","Banks outside the monetary zone",524,"asset_cash","False","Banques hors zone monétaire"
"syscebnl_525","Banks term deposits and similar transactions",525,"asset_cash","False","Banques dépôt à terme et opérations assimilées"
"syscebnl_526","Bank, accrued interest",526,"asset_cash","False","Banque, intérêts courus"
"syscebnl_531","Postal banks",531,"asset_cash","False","Banques postales"
"syscebnl_532","Treasury",532,"asset_cash","False","Trésor"
"syscebnl_533","Management and intermediation companies (S.G.L.)",533,"asset_cash","False","Sociétés de gestion et d'intermédiation (S.G.L.)"
"syscebnl_536","Financial institutions, accrued interest",536,"asset_cash","False","Établissements financiers, intérêts courus"
"syscebnl_538","Other financial institutions",538,"asset_cash","False","Autres organismes financiers"
"syscebnl_551","Electronic money - fuel card",551,"asset_cash","False","Monnaie électronique-carte carburant"
"syscebnl_552","Electronic money - cell phone",552,"asset_cash","False","Monnaie électronique- téléphone portable"
"syscebnl_553","Electronic money - toll card",553,"asset_cash","False","Monnaie électronique - carte péage"
"syscebnl_554","Electronic purse",554,"asset_cash","False","Porte-monnaie électronique"
"syscebnl_558","Other electronic money instruments",558,"asset_cash","False","Autres instruments de monnaie électronique"
"syscebnl_561","Cash credits",561,"liability_current","False","Crédits de trésorerie"
"syscebnl_565","Discounting of ordinary loans",565,"liability_current","False","Escompte de crédits ordinaires"
"syscebnl_566","Bank overdrafts, accrued interest",566,"liability_current","False","Banques, crédits de trésorerie, intérêts courus"
"syscebnl_571","Cash in local currency",571,"asset_cash","False","Caisse en monnaie nationale"
"syscebnl_572","Cash in foreign currencies",572,"asset_cash","False","Caisse en devises"
"syscebnl_585","Transfers of funds",585,"asset_cash","False","Virements de fonds"
"syscebnl_588","Other internal transfers",588,"asset_cash","False","Autres virements internes"
"syscebnl_590","Impairment of marketable securities",590,"asset_cash","False","Dépréciations des titres de placement"
"syscebnl_591","Impairment of securities and receivables",591,"asset_cash","False","Dépréciations des titres et valeurs à encaisser"
"syscebnl_592","Impairment of bank accounts",592,"asset_cash","False","Dépréciations des comptes banques"
"syscebnl_593","Impairment of financial institution and similar accounts",593,"asset_cash","False","Dépréciations des comptes établissements financiers et assimilés"
"syscebnl_595","Impairment of electronic money accounts",595,"asset_cash","False","Dépréciations des comptes d'instruments de monnaie électronique"
"syscebnl_599","Provisions for short-term financial risks and charges",599,"liability_current","False","Provisions pour risque et charges à court terme à caractère financier"
"syscebnl_601","Purchases of goods and services related to the activity",601,"expense_direct_cost","False","Achats de biens et services liés à l'activité"
"syscebnl_602","Purchases of goods, raw materials and related supplies",602,"expense_direct_cost","False","Achats de marchandises, matières premières et fournitures liées"
"syscebnl_6031","Changes in inventories of goods and services related to operations",6031,"expense","False","Variations des stocks de biens et services liés à l'activité"
"syscebnl_6032","Changes in inventories of goods",6032,"expense","False","Variations des stocks de marchandises"
"syscebnl_6033","Changes in inventories of raw materials and related supplies",6033,"expense","False","Variations des stocks de matières premières et fournitures liées"
"syscebnl_6034","Changes in inventories of other supplies",6034,"expense","False","Variations des stocks d'autres approvisionnements"
"syscebnl_6035","Changes in inventories of gifts in kind to be distributed",6035,"expense","False","Variations de stocks de dons en nature à distribuer"
"syscebnl_604","Purchases of consumable materials and supplies",604,"expense_direct_cost","False","Achats stockés de matières et fournitures consommables"
"syscebnl_605","Other purchases",605,"expense","False","Autres achats"
"syscebnl_606","Purchases for other activities",606,"expense","False","Achats autres activités"
"syscebnl_608","Purchases of packaging",608,"expense","False","Achats d'emballages"
"syscebnl_612","Transport on sales",612,"expense","False","Transports sur ventes"
"syscebnl_613","Transport on behalf of third parties",613,"expense","False","Transports pour le compte de tiers"
"syscebnl_614","Staff transport",614,"expense","False","Transports du personnel"
"syscebnl_616","Transport of mail",616,"expense","False","Transports de plis"
"syscebnl_618","Other transport costs",618,"expense","False","Autres frais de transport"
"syscebnl_619","Discounts and rebates obtained (not broken down)",619,"expense","False","Rabais, Remises et Ristournes Obtenus (non ventilés)"
"syscebnl_621","General sub-contracting",621,"expense","False","Sous-traitance générale"
"syscebnl_622","Rentals and service charges",622,"expense","False","Locations, charges locatives"
"syscebnl_623","Capital lease payments",6232,"expense","False","Redevances de location-acquisition"
"syscebnl_624","Servicing, repair, overhaul and maintenance",624,"expense","False","Entretien, réparation, remise en état et maintenance"
"syscebnl_625","Insurance premiums",625,"expense","False","Primes d'assurances"
"syscebnl_626","Studies, research and documentation",626,"expense","False","Études, recherches et documentation"
"syscebnl_627","Advertising, publications, public relations",627,"expense","False","Publicité, publications, relations publiques"
"syscebnl_628","Telecommunications costs",628,"expense","False","Frais de télécommunications"
"syscebnl_631","Bank charges",631,"expense","False","Frais bancaires"
"syscebnl_632","Remuneration of intermediaries and consultants",632,"expense","False","Rémunérations d'intermédiaires et de conseils"
"syscebnl_633","Training costs",633,"expense","False","Frais de formation"
"syscebnl_634","Royalties for patents, licences, software, websites, concessions, rights and similar entitlements",634,"expense","False","Redevances pour brevets, licences, logiciels, sites internet, concessions et droits et valeurs similaires"
"syscebnl_635","Contributions",635,"expense","False","Cotisations"
"syscebnl_636","Fundraising expenses",636,"expense","False","Frais de recherche de fonds"
"syscebnl_637","Remuneration of external staff",637,"expense","False","Rémunérations de personnel extérieur à l'entité"
"syscebnl_638","Other external charges",638,"expense","False","Autres charges externes"
"syscebnl_641","Direct taxes and duties",641,"expense","False","Impôts et taxes directs"
"syscebnl_645","Indirect taxes and duties",645,"expense","False","Impôts et taxes indirects"
"syscebnl_646","Registration duties",646,"expense","False","Droits d'enregistrement"
"syscebnl_647","Penalties and tax fines",647,"expense","False","Pénalités et amendes fiscales"
"syscebnl_648","Other taxes",648,"expense","False","Autres impôts et taxes"
"syscebnl_649","Tax relief and cancellations",649,"expense","False","Dégrèvements et annulations des impôts et taxes"
"syscebnl_651","Losses on trade and other receivables",651,"expense","False","Pertes sur créances adhérents clients, et autres débiteurs"
"syscebnl_652","Subsidies granted by the entity",652,"expense","False","Subventions accordées par l'entité"
"syscebnl_654","Current donations in kind for distribution",654,"expense","False","Dons en nature courants à distribuer"
"syscebnl_657","Penalties and fines",657,"expense","False","Pénalités et amendes pénales"
"syscebnl_658","Sundry expenses",658,"expense","False","Charges diverses"
"syscebnl_659","Impairment charges and provisions for short-term operating risks",659,"expense","False","Charges pour dépréciations et provisions pour risques à court terme d'exploitation"
"syscebnl_661","Direct remuneration paid to national staff",661,"expense","False","Rémunérations directes versées au personnel national"
"syscebnl_662","Direct remuneration paid to non-national staff",662,"expense","False","Rémunérations directes versées au personnel non national"
"syscebnl_663","Flat-rate allowances paid to staff",663,"expense","False","Indemnités forfaitaires versées au personnel"
"syscebnl_664","Social security contributions",664,"expense","False","Charges sociales"
"syscebnl_665","Staff clothing and equipment",665,"expense","False","Habillement et équipement du personnel"
"syscebnl_667","Remuneration transferred from outside personnel",667,"expense","False","Rémunération transférée de personnel extérieur"
"syscebnl_668","Other social security charges",668,"expense","False","Autres charges sociales"
"syscebnl_669","Waivers and cancellations of social security contributions",669,"expense","False","Dégrèvements et annulations des charges sociales"
"syscebnl_671","Interest on borrowings",671,"expense","False","Intérêts des emprunts"
"syscebnl_672","Interest in capital leases",672,"expense","False","Intérêts dans loyers de location-acquisition"
"syscebnl_673","Discounts granted",673,"expense","False","Escomptes accordés"
"syscebnl_674","Other interests",674,"expense","False","Autres intérêts"
"syscebnl_676","Financial exchange losses",676,"expense","False","Pertes de change financières"
"syscebnl_677","Losses on marketable securities",677,"expense","False","Pertes sur titres de placement"
"syscebnl_678","Losses and expenses on financial risks",678,"expense","False","Pertes et charges sur risques financiers"
"syscebnl_679","Charges for impairment and provisions for short-term financial risks",679,"expense","False","Charges pour dépréciations et provisions pour risques à court terme financières"
"syscebnl_680","Allocations to depreciation of temporary usufruct",680,"expense","False","Dotations aux amortissements d'usufruit temporaire"
"syscebnl_681","Allocations to operating depreciation",681,"expense","False","Dotations aux amortissements d'exploitation"
"syscebnl_691","Allocations to provisions and operating depreciation",691,"expense","False","Dotations aux provisions et aux dépréciations d'exploitation"$
"syscebnl_695","Allocations for impairment in value of fixed assets held for sale arising from gifts and bequests not yet received and from temporary usufruct",695,"expense","False","Dotations aux dépréciations d'immobilisations destinées à la vente provenant des dons et legs non encore reçus et d'usufruit temporaire"
"syscebnl_697","Allocations to provisions and impairment losses",697,"expense","False","Dotations aux provisions et aux dépréciations financières"
"syscebnl_701","Membership fees",701,"income_other","False","Cotisations des adhérents"
"syscebnl_702","Share of administrative funds transferred",702,"income_other","False","Quote-part de fonds d'administration transférés"
"syscebnl_703","Share of consumable endowment transferred",703,"income_other","False","Quote-part de dotation consomptible transférée"
"syscebnl_704","Income from generosity",704,"income_other","False","Revenus liés à la générosité"
"syscebnl_7051","Sales of goods",7051,"income","False","Ventes marchandises"
"syscebnl_7052","Services sold",7052,"income","False","Services vendus"
"syscebnl_7053","Sales of finished goods",7053,"income","False","Ventes de produits finis"
"syscebnl_7054","Sales of intermediate products",7054,"income","False","Ventes de produits intermédiaires"
"syscebnl_7055","Sales of residual products",7055,"income","False","Ventes de produits résiduels"
"syscebnl_706","Income from events",706,"income_other","False","Revenus des manifestations"
"syscebnl_707","Ancillary revenue",707,"income_other","False","Produits accessoires"
"syscebnl_708","Other income",708,"income_other","False","Autres revenus"
"syscebnl_711","Operating grants from the State and local authorities",711,"income_other","False","Subventions d'exploitation versées par l'État et les Collectivités publiques"
"syscebnl_713","Operating grants from national and international bodies",713,"income_other","False","Subventions d'exploitation versées par les organismes nationaux et internationaux"
"syscebnl_718","Other operating grants",718,"income_other","False","Autres subventions d'exploitation"
"syscebnl_721","Capitalised production, intangible fixed assets",721,"income_other","False","Production immobilisée, immobilisations incorporelles"
"syscebnl_722","Capitalised production, tangible fixed assets",722,"income_other","False","Production immobilisée, immobilisations corporelles"
"syscebnl_724","Own consumption",724,"income_other","False","Production auto-consommée"
"syscebnl_726","Capitalised production, financial fixed assets",726,"income_other","False","Production immobilisée, immobilisations financières"
"syscebnl_735","Changes in inventories of finished goods and services in progress",735,"income_other","False","Variations des stocks de produits finis et services en cours"
"syscebnl_736","Changes in inventories of finished goods, intermediate products and residuals",736,"income_other","False","Variations des stocks de produits finis,produit intermédiaires et résiduels"
"syscebnl_751","Gains on receivables Members, customer-users and other debtors",751,"income_other","False","Profits sur créances Adhérents, clients-usagers, et autres débiteurs"
"syscebnl_752","Founder's contribution",752,"income_other","False","Contribution du fondateur"
"syscebnl_754","Current donations in kind",754,"income_other","False","Dons en nature courants"
"syscebnl_758","Miscellaneous income",758,"income_other","False","Produits divers"
"syscebnl_759","Reversals of charges for impairment and provisions for short-term operating risks",759,"income_other","False","Reprises de charges pour dépréciations et provisions pour risques à court terme d'exploitation"
"syscebnl_771","Interest on loans and other receivables",771,"income_other","False","Intérêts de prêts et créances diverses"
"syscebnl_772","Income from equity interests and other long-term investments",772,"income_other","False","Revenus des titres de participation et autres titres immobilisés"
"syscebnl_773","Discounts received",773,"income_other","False","Escomptes obtenus"
"syscebnl_774","Investment income",774,"income_other","False","Revenus de placement"
"syscebnl_776","Financial exchange gains",776,"income_other","False","Gains de change financiers"
"syscebnl_777","Gains on disposals of marketable securities",777,"income_other","False","Gains sur cessions de titres de placement"
"syscebnl_778","Gains on financial risks",778,"income_other","False","Gains sur risques financiers"
"syscebnl_779","Reversals of charges for impairment and provisions for short-term financial risks",779,"income_other","False","Reprises de charges pour dépréciations et provisions pour risques à court terme financières"
"syscebnl_781","Transfers of operating expenses",781,"income_other","False","Transferts de charges d'exploitation"
"syscebnl_787","Transfers of financial expenses",787,"income_other","False","Transferts de charges financières"
"syscebnl_791","Reversals of operating provisions and impairment losses",791,"income_other","False","Reprises de provisions et dépréciations d'exploitation"
"syscebnl_792","Reversals of restricted funds and gifts and bequests of fixed assets",792,"income_other","False","Reprises de fonds affectés et provenant de dons et legs d'immobilisations"
"syscebnl_795","Reversals of impairment losses on fixed assets received for sale from gifts and bequests and for temporary usufruct",795,"income_other","False","Reprises des dépréciations d'immobilisations reçues destinées à la vente provenant des dons et legs et d'usufruit temporaire"
"syscebnl_796","Reversals of deferred funds",796,"income_other","False","Reprises de fonds reportés"
"syscebnl_797","Reversals of provisions and impairment losses",797,"income_other","False","Reprises de provisions et dépréciations financières"
"syscebnl_798","Write-backs of depreciation",798,"income_other","False","Reprises d'amortissements"
"syscebnl_799","Reversals of investment grants",799,"income_other","False","Reprises de subventions d'investissement"
"syscebnl_811","Book value of disposals of intangible assets",811,"expense","False","Valeurs comptables des cessions d'immobilisations incorporelles"
"syscebnl_812","Book value of disposals of tangible fixed assets",812,"expense","False","Valeurs comptables des cessions d'immobilisations corporelles"
"syscebnl_816","Book value of disposals of financial assets",816,"expense","False","Valeurs comptables des cessions d'immobilisations financières"
"syscebnl_818","Book value of disposals of fixed assets received for sale as gifts and bequests",818,"expense","False","Valeurs comptables des cessions d'immobilisations reçues destinées à la vente provenant de dons et legs"
"syscebnl_821","Proceeds from disposals of intangible assets",821,"income_other","False","Produits des cessions d'immobilisations incorporelles"
"syscebnl_822","Proceeds from disposals of tangible assets",822,"income_other","False","Produits des cessions d'immobilisations corporelles"
"syscebnl_826","Proceeds from disposals of financial assets",826,"income_other","False","Produits des cessions d'immobilisations financières"
"syscebnl_828","Proceeds from disposals of fixed assets received for sale from gifts and bequests",828,"income_other","False","Produits des cessions d'immobilisations reçues destinées à la vente provenant de dons et legs"
"syscebnl_831","H.A.O. expenses recognised",831,"expense","False","Charges H.A.O. constatées"
"syscebnl_832","Donations in kind H.A.O. to distribute",832,"expense","False","Dons en nature H.A.O. à distribuer"
"syscebnl_834","Losses on receivables H.A.O.",834,"expense","False","Pertes sur créances H.A.O."
"syscebnl_836","Debt waivers granted",836,"expense","False","Abandons de créances consentis"
"syscebnl_838","Expense transfers H.A.O.",838,"expense","False","Transferts de charges H.A.O."
