"id","code","name","account_type","reconcile","non_trade","name@hu"
"l10n_hu_111","111","Activation value of founding reorganization","asset_non_current","False","","Az alapító átszervezés aktiválási értéke"
"l10n_hu_112","112","Activated value for experimental development","asset_non_current","False","","Aktivált érték kísérleti fejlesztéshez"
"l10n_hu_113","113","Property rights","asset_non_current","False","","Tulajdonjogok"
"l10n_hu_114","114","Intellectual products","asset_non_current","False","","Szellemi termékek"
"l10n_hu_115","115","Business or goodwill","asset_non_current","False","","Üzleti vagy jóindulatú"
"l10n_hu_117","117","Value adjustments in respect of intangible assets","asset_non_current","False","","Értékmódosítások az immateriális javak tekintetében"
"l10n_hu_118","118","Unscheduled amortization and reversal of intangible assets","asset_non_current","False","","Nem tervezett amortizáció és immateriális javak visszaírása"
"l10n_hu_119","119","Planned amortization of intangible assets","asset_non_current","False","","Az immateriális javak tervezett amortizációja"
"l10n_hu_121","121","Land","asset_fixed","False","","Föld"
"l10n_hu_122","122","Land, realization","asset_fixed","False","","Föld, megvalósítás"
"l10n_hu_123","123","Buildings, ownership shares","asset_fixed","False","","Épületek, tulajdonrészek"
"l10n_hu_124","124","Other structures","asset_fixed","False","","Egyéb szerkezetek"
"l10n_hu_125","125","Real estate and buildings outside the plant","asset_fixed","False","","Ingatlanok és épületek az üzemen kívül"
"l10n_hu_126","126","Link to real estate for property rights","asset_fixed","False","","Link az ingatlanhoz a tulajdonjogokhoz"
"l10n_hu_127","127","Real estate value adjustment","asset_fixed","False","","Ingatlan értékhelyesbítés"
"l10n_hu_128","128","Unplanned depreciation of real estate and its reversal","asset_non_current","False","","Az ingatlanok nem tervezett értékcsökkenése és annak visszaírása"
"l10n_hu_129","129","Planned depreciation of real estate","asset_non_current","False","","Az ingatlanok tervezett értékcsökkenése"
"l10n_hu_131","131","Production machines, equipment, tools, production tools","asset_fixed","False","","Gyártógépek, berendezések, szerszámok, gyártóeszközök"
"l10n_hu_132","132","Vehicles directly involved in production","asset_fixed","False","","A gyártásban közvetlenül részt vevő járművek"
"l10n_hu_137","137","Value adjustment of technical equipment, machines, vehicles","asset_fixed","False","","Műszaki berendezések, gépek, járművek értékhelyesbítése"
"l10n_hu_138","138","Unscheduled depreciation and reversal of technical equipment, machinery and vehicles","asset_non_current","False","","Műszaki berendezések, gépek és járművek előre nem tervezett értékcsökkenése, visszaírás"
"l10n_hu_139","139","Depreciation of technical equipment, machinery and vehicles according to plan","asset_non_current","False","","Műszaki berendezések, gépek, járművek terv szerinti értékcsökkenése"
"l10n_hu_141","141","Operating (business) machines, equipment, facilities","asset_fixed","False","","Üzemeltető (üzleti) gépek, berendezések, létesítmények"
"l10n_hu_142","142","Other vehicles","asset_fixed","False","","Egyéb járművek"
"l10n_hu_143","143","Office, administrative and plant equipment","asset_fixed","False","","Irodai, adminisztratív és üzemi berendezések"
"l10n_hu_144","144","Off-site equipment, facilities, vehicles","asset_fixed","False","","Telephelyen kívüli berendezések, létesítmények, járművek"
"l10n_hu_145","145","Welfare equipment, fittings and works of art","asset_fixed","False","","Jóléti berendezések, felszerelések és műalkotások"
"l10n_hu_147","147","Value adjustments of other plant, equipment and vehicles","asset_fixed","False","","Egyéb üzemek, berendezések és járművek értékhelyesbítései"
"l10n_hu_148","148","Unscheduled depreciation and reversal of other plant, equipment and vehicles","asset_non_current","False","","Egyéb berendezések, berendezések és járművek előre nem tervezett értékcsökkenése és visszaírás"
"l10n_hu_149","149","Depreciation of other plant, equipment and vehicles as planned","asset_non_current","False","","Egyéb üzemek, berendezések és járművek terv szerinti értékcsökkenése"
"l10n_hu_151","151","Breeding animals","asset_non_current","False","","Tenyészállatok"
"l10n_hu_152","152","Work animals","asset_non_current","False","","Munkaállatok"
"l10n_hu_153","153","Other animals","asset_non_current","False","","Más állatok"
"l10n_hu_157","157","Value adjustment of breeding animals","asset_non_current","False","","Tenyészállatok értékhelyesbítése"
"l10n_hu_158","158","Unscheduled depreciation and reversal of breeding animals","asset_non_current","False","","A tenyészállatok nem tervezett értékcsökkenése és visszaírása"
"l10n_hu_159","159","Depreciation of breeding animals as planned","asset_non_current","False","","Tenyészállatok terv szerinti értékcsökkenése"
"l10n_hu_161","161","Work in progress","asset_non_current","False","","Munka folyamatban"
"l10n_hu_162","162","Renovations","asset_non_current","False","","Felújítások"
"l10n_hu_168","168","Investments are unplanned depreciated","asset_non_current","False","","A beruházások nem tervezett értékcsökkenést mutatnak"
"l10n_hu_171","171","Long-term interest in an associate","asset_non_current","False","","Hosszú távú érdeklődés egy munkatárs iránt"
"l10n_hu_172","172","Permanent significant ownership interest","asset_non_current","False","","Tartós jelentős tulajdoni részesedé"
"l10n_hu_173","173","Other permanent holdings","asset_non_current","False","","Egyéb állandó üzemek"
"l10n_hu_177","177","Value adjustments in respect of shares","asset_non_current","False","","A részvények értékhelyesbítése"
"l10n_hu_178","178","Valuation difference on non-current holdings","asset_non_current","False","","Befektetett állományok értékelési különbözete"
"l10n_hu_179","179","Impairment and reversal of shares","asset_non_current","False","","Részvények értékvesztése és visszaírás"
"l10n_hu_181","181","Government bonds","asset_non_current","False","","Államkötvények"
"l10n_hu_182","182","Securities of affiliated enterprises","asset_non_current","False","","Kapcsolt vállalkozások értékpapírjai"
"l10n_hu_183","183","Securities of enterprises with a significant shareholding","asset_non_current","False","","Jelentős részesedéssel rendelkező vállalkozások értékpapírjai"
"l10n_hu_184","184","Securities of other enterprises","asset_non_current","False","","Egyéb vállalkozások értékpapírjai"
"l10n_hu_185","185","Long-term discount securities","asset_non_current","False","","Hosszú lejáratú diszkont értékpapírok"
"l10n_hu_188","188","Valuation difference on debt securities","asset_non_current","False","","Hitelviszonyt megtestesítő értékpapírok értékelési különbözete"
"l10n_hu_189","189","Impairment and reversal of securities","asset_non_current","False","","Értékpapírok értékvesztése és visszaírása"
"l10n_hu_191","191","Resistant loans to affiliates","asset_non_current","False","","Ellenálló kölcsönök leányvállalatoknak"
"l10n_hu_192","192","Long-term loans granted to other participating enterprises","asset_non_current","False","","Más részt vevő vállalkozásoknak nyújtott hosszú lejáratú hitelek"
"l10n_hu_193","193","Other long-term loans","asset_non_current","False","","Egyéb hosszú lejáratú hitelek"
"l10n_hu_194","194","Long-term bank deposits in affiliated enterprises","asset_non_current","False","","Hosszú lejáratú bankbetétek kapcsolt vállalkozásokban"
"l10n_hu_195","195","Long-term bank deposits in other participating enterprises","asset_non_current","False","","Hosszú lejáratú bankbetétek más részt vevő vállalkozásoknál"
"l10n_hu_196","196","Other long-term bank deposits","asset_non_current","False","","Egyéb hosszú lejáratú bankbetétek"
"l10n_hu_197","197","Long-term receivables from finance leases","asset_non_current","False","","Hosszú lejáratú követelések pénzügyi lízingből"
"l10n_hu_199","199","Impairment and reversal of long-term loans (and bank deposits)","asset_non_current","False","","Hosszú lejáratú hitelek (és bankbetétek) értékvesztése és visszaírása"
"l10n_hu_211","211","Raw materials","asset_current","False","","Nyersanyagok"
"l10n_hu_221","221","Excipients","asset_current","False","","Segédanyagok"
"l10n_hu_222","222","Fuels and fuels","asset_current","False","","Üzemanyagok és üzemanyagok"
"l10n_hu_223","223","Maintenance materials","asset_current","False","","Karbantartási anyagok"
"l10n_hu_224","224","Building materials","asset_current","False","","Építőanyagok"
"l10n_hu_225","225","Depreciable assets within one year","asset_current","False","","Egy éven belül amortizálható eszközök"
"l10n_hu_226","226","Materials reclassified from property, plant and equipment","asset_current","False","","Az ingatlanok, gépek és berendezések közül átsorolt anyagok"
"l10n_hu_227","227","Other materials","asset_current","False","","Más anyagok"
"l10n_hu_228","228","Price difference of materials","asset_current","False","","Anyagok árkülönbsége"
"l10n_hu_229","229","Impairment and reversal of materials","asset_non_current","False","","Anyagok értékvesztése és visszaírása"
"l10n_hu_231","231","Work in progress","asset_current","False","","Munka folyamatban"
"l10n_hu_235","235","Half-done products","asset_current","False","","Félkész termékek"
"l10n_hu_238","238","Difference in inventories of semi-finished products","asset_current","False","","Különbség a félkész termékek készleteiben"
"l10n_hu_239","239","Work in progress and impairment of semi-finished products","asset_non_current","False","","Folyamatban lévő termelés és félkész termékek értékvesztése"
"l10n_hu_241","241","Adult animals","asset_current","False","","Felnőtt állatok"
"l10n_hu_242","242","Fattening animals","asset_current","False","","Hízó állatok"
"l10n_hu_243","243","Other animals","asset_current","False","","Más állatok"
"l10n_hu_246","246","Hired animals","asset_current","False","","Bérelt állatok"
"l10n_hu_248","248","Animal inventory value difference","asset_current","False","","Állatkészlet értékkülönbség"
"l10n_hu_249","249","Impairment and reversal of animals","asset_non_current","False","","Az állatok károsodása és visszafordítása"
"l10n_hu_251","251","Finished products","asset_current","False","","Elkészült termékek"
"l10n_hu_258","258","Difference in inventories of finished goods","asset_current","False","","Különbség a késztermékek készleteiben"
"l10n_hu_259","259","Impairment and reversal of finished products","asset_non_current","False","","Késztermékek értékvesztése és visszaírása"
"l10n_hu_261","261","Goods at purchase price","asset_current","False","","Áruk vételáron"
"l10n_hu_262","262","Goods at settlement prices","asset_current","False","","Áruk elszámoló áron"
"l10n_hu_263","263","Price difference of goods","asset_current","False","","Az áruk árkülönbsége"
"l10n_hu_264","264","Goods at selling price","asset_current","False","","Áruk eladási áron"
"l10n_hu_265","265","Goods margin","asset_current","False","","Áruk árrés"
"l10n_hu_266","266","Goods stored abroad and handed over to a commission","asset_current","False","","Külföldön tárolt és bizományosnak átadott áru"
"l10n_hu_267","267","Goods reclassified from property, plant and equipment","asset_current","False","","Az ingatlanok, gépek és berendezések közül átsorolt áruk"
"l10n_hu_269","269","Impairment and reversal of commercial goods","asset_non_current","False","","Kereskedelmi áruk értékvesztése és visszaírása"
"l10n_hu_271","271","Intermediate services","asset_current","False","","Köztes szolgáltatások"
"l10n_hu_279","279","Impairment and reversal of intermediary services","asset_non_current","False","","A közvetítő szolgáltatások értékvesztése és visszaírása"
"l10n_hu_281","281","Own containers","asset_current","False","","Saját konténere"
"l10n_hu_282","282","Foreign packaging","asset_current","False","","Külföldi csomagolás"
"l10n_hu_288","288","Price difference for deposit packages","asset_current","False","","Betéti csomagok árkülönbözete"
"l10n_hu_289","289","Impairment and reversal of deposit-bearing packages","asset_non_current","False","","Betétdíjas csomagok értékvesztése, visszaírása"
"l10n_hu_311","311","Domestic receivables (in huf)","asset_receivable","True","","Belföldi követelések (forintban)"
"l10n_hu_312","312","Domestic receivables (in foreign currency)","asset_receivable","True","","Belföldi követelések (devizában)"
"l10n_hu_315","315","Impairment and reversal of domestic receivables","asset_non_current","False","","Belföldi követelések értékvesztése, visszaírása"
"l10n_hu_316","316","Foreign receivables (in huf)","asset_receivable","True","","Külföldi követelések (forintban)"
"l10n_hu_317","317","Foreign claims (in foreign currency)","asset_receivable","True","","Külföldi követelések (devizában)"
"l10n_hu_318","318","Valuation difference of receivables","asset_cash","False","","A követelések értékelési különbözete"
"l10n_hu_319","319","Impairment and reversal of foreign receivables","asset_non_current","False","","Külföldi követelések értékvesztése és visszaírása"
"l10n_hu_321","321","Receivables from associates","asset_current","False","","Követelések munkatársakkal szemben"
"l10n_hu_322","322","Receivables from enterprises with significant ownership interest","asset_current","False","","Követelések jelentős tulajdoni hányaddal rendelkező vállalkozásokkal szemben"
"l10n_hu_323","323","Subscribed but not yet paid-up capital relationship from business","asset_current","False","","Vállalkozásból jegyzett, de még be nem fizetett tőkeviszony"
"l10n_hu_324","324","Subscribed but not yet paid-up capital from a company with a significant shareholding","asset_current","False","","Jegyzett, de még be nem fizetett tőke jelentős részesedéssel rendelkező társaságtól"
"l10n_hu_325","325","Impairment and reversal of receivables from associates","asset_non_current","False","","Társult vállalkozásokkal szembeni követelések értékvesztése és visszaírása"
"l10n_hu_326","326","Impairment and reversal of receivables from a significant ownership interest","asset_non_current","False","","Jelentős tulajdonosi részesedésből származó követelések értékvesztése és visszaírása"
"l10n_hu_331","331","Receivables from other participating interests","asset_current","False","","Követelések egyéb érdekeltséggel szemben"
"l10n_hu_332","332","Subscribed but not yet paid-up capital from other participating undertakings","asset_current","False","","Más részt vevő vállalkozásoktól jegyzett, de még be nem fizetett tőke"
"l10n_hu_333","333","Subscribed but not yet paid-up capital from a non-participating company","asset_current","False","","Jegyzett, de még be nem fizetett tőke egy nem részt vevő társaságtól"
"l10n_hu_339","339","Impairment and reversal of receivables from other participating interests","asset_non_current","False","","Egyéb részesedéssel szembeni követelések értékvesztése és visszaírása"
"l10n_hu_341","341","Domestic bills","asset_current","False","","Belföldi számlák"
"l10n_hu_345","345","Impairment and reversal of domestic accounts receivable","asset_non_current","False","","Belföldi követelések értékvesztése és visszaírása"
"l10n_hu_346","346","Foreign exchange receivables","asset_current","False","","Devizakövetelések"
"l10n_hu_349","349","Impairment and reversal of foreign exchange receivables","asset_non_current","False","","Devizakövetelések értékvesztése és visszaírása"
"l10n_hu_351","351","Advances on intangible assets","asset_current","False","","Előlegek immateriális javakra"
"l10n_hu_352","352","Advances on investments","asset_current","False","","Beruházási előlegek"
"l10n_hu_353","353","Advances on stocks","asset_current","False","","Előlegek a részvényeken"
"l10n_hu_354","354","Advances on services","asset_current","False","","Előrelépések a szolgáltatások terén"
"l10n_hu_355","355","Other advances given","asset_current","False","","Egyéb előlegek adottak"
"l10n_hu_359","359","Impairment and reversal of specific advances","asset_non_current","False","","Egyedi előlegek értékvesztése és visszaírása"
"l10n_hu_361","361","Claims on employees","asset_current","False","","Az alkalmazottakkal szembeni követelések"
"l10n_hu_3611","3611","Advances paid to employees","asset_current","False","","Az alkalmazottaknak fizetett előlegek"
"l10n_hu_3612","3612","Prescribed debts","asset_current","False","","Előírt tartozások"
"l10n_hu_3613","3613","Other accounts with employees","asset_current","False","","Egyéb számlák alkalmazottakkal"
"l10n_hu_362","362","Budget allocation requirements","asset_current","False","","Költségvetési elosztási követelmények"
"l10n_hu_363","363","Fulfillment of budget allocation needs","asset_current","False","","Költségvetési előirányzati igények teljesítése"
"l10n_hu_364","364","Short-term borrowed funds","asset_current","False","","Rövid lejáratú kölcsönzött pénzeszközök"
"l10n_hu_365","365","Receivables purchased and received","asset_current","False","","Vásárolt és átvett követelések"
"l10n_hu_366","366","Receivables related to shares and securities","asset_current","False","","Részvényekkel és értékpapírokkal kapcsolatos követelések"
"l10n_hu_367","367","Receivables related to futures, options and swaps","asset_current","False","","Határidős, opciós és swap ügyletekkel kapcsolatos követelések"
"l10n_hu_368","368","Miscellaneous other receivables","asset_current","False","","Egyéb egyéb követelések"
"l10n_hu_3681","3681","Commission settlements","asset_current","False","","Bizományos elszámolások"
"l10n_hu_3683","3683","Vat on export purchases","asset_current","False","","Export vásárlások áfája"
"l10n_hu_3684","3684","Debtors","asset_current","False","","Adósok"
"l10n_hu_3685","3685","Claims on insurance undertakings","asset_current","False","","Biztosítókkal szembeni követelések"
"l10n_hu_3686","3686","Barter transaction settlement account","asset_current","False","","Barter tranzakciós elszámolási számla"
"l10n_hu_3687","3687","Exchange differences settlement account","asset_current","False","","Árfolyam-különbözet elszámolási számla"
"l10n_hu_3688","3688","Intangible assets and tangible assets settlement account","asset_current","False","","Immateriális javak és tárgyi eszközök elszámolási száml"
"l10n_hu_3689","3689","Other claims not raised","asset_current","False","","Egyéb követelések nem merültek fel"
"l10n_hu_369","369","Impairment and reversal of other receivables","asset_non_current","False","","Egyéb követelések értékvesztése és visszaírása"
"l10n_hu_371","371","Participation in an associate","asset_current","False","","Részvétel egy munkatársban"
"l10n_hu_3711","3711","Interests in associates purchased for sale","asset_current","False","","Érdeklődés eladásra vásárolt munkatársak iránt"
"l10n_hu_3719","3719","Impairment and reversal of interests in associates","asset_non_current","False","","A társult vállalkozásokban lévő érdekeltségek értékvesztése és visszavonás"
"l10n_hu_372","372","Significant ownership","asset_current","False","","Jelentős tulajdonjog"
"l10n_hu_3721","3721","Significant ownership interests purchased for sale","asset_current","False","","Eladásra vásárolt jelentős tulajdoni részesedés"
"l10n_hu_3729","3729","Impairment and reversal of significant ownership interests","asset_non_current","False","","Jelentős tulajdonosi érdekeltségek értékvesztése és visszaírása"
"l10n_hu_373","373","Other shares","asset_current","False","","Egyéb részvények"
"l10n_hu_3731","3731","Other shares purchased for sale","asset_current","False","","Egyéb eladásra vásárolt részvények"
"l10n_hu_3739","3739","Impairment and reversal of other interests","asset_non_current","False","","Egyéb érdekeltségek értékvesztése és visszavonása"
"l10n_hu_374","374","Own shares, own shares","asset_current","False","","Saját részvények, saját részvények"
"l10n_hu_3741","3741","Repurchased own shares, business shares","asset_current","False","","Visszavásárolt saját részvények, üzletrészek"
"l10n_hu_3749","3749","Impairment of own shares, own shares","asset_non_current","False","","Saját részvények, saját részvények értékvesztése"
"l10n_hu_375","375","Debt securities held for trading","asset_current","False","","Kereskedési céllal tartott hitelviszonyt megtestesítő értékpapírok"
"l10n_hu_3751","3751","Debt securities purchased for sale","asset_current","False","","Eladásra vásárolt hitelviszonyt megtestesítő értékpapírok"
"l10n_hu_3759","3759","Impairment and reversal of negotiable debt securities","asset_non_current","False","","Forgatóképes hitelviszonyt megtestesítő értékpapírok értékvesztése és visszaírása"
"l10n_hu_378","378","Valuation difference on securities","asset_current","False","","Értékpapírok értékelési különbözete"
"l10n_hu_379","379","Securities settlement account","asset_current","False","","Értékpapír elszámolási számla"
"l10n_hu_381","381","Checkout","asset_current","False","","Pénztár"
"l10n_hu_382","382","Currency office","asset_current","False","","Valutahivatal"
"l10n_hu_383","383","Checks","asset_current","False","","Ellenőrzések"
"l10n_hu_384","384","Settlement deposit account","asset_current","False","","Elszámolási betétszámla"
"l10n_hu_385","385","Separate deposit accounts","asset_current","False","","Külön betétszámlák"
"l10n_hu_386","386","Foreign currency deposit account","asset_current","False","","Devizabetétszámla"
"l10n_hu_389","389","Internal relocation","asset_current","False","","Belső költöztetés"
"l10n_hu_391","391","Accruals and deferrals","asset_current","False","","Passzív időbeli elhatárolások"
"l10n_hu_392","392","Accruals and deferrals of costs and expenses","asset_current","False","","Költségek és ráfordítások passzív időbeli elhatárolásai"
"l10n_hu_393","393","Deferred expenses","asset_current","False","","Levont szakszervezeti díj"
"l10n_hu_411","411","Registered capital","equity","False","","Jegyzett tőke"
"l10n_hu_412","412","Capital reserve","equity","False","","Tőketartalék"
"l10n_hu_413","413","Profit reserve","equity","False","","Profittartalék"
"l10n_hu_414","414","Reserved reserve","equity","False","","Fenntartott tartalék"
"l10n_hu_417","417","Valuation reserve","equity","False","","Értékelési tartalék"
"l10n_hu_4171","4171","Valuation reserve for value adjustments","equity","False","","Értékelési tartalék értékhelyesbítéshez"
"l10n_hu_4172","4172","Fair value measurement reserve","equity","False","","Valós érték mérési tartalék"
"l10n_hu_421","421","Provision for contingent liabilities","liability_non_current","False","","Céltartalék függő kötelezettségekre"
"l10n_hu_422","422","Provision for future expenses","liability_non_current","False","","Céltartalék a jövőbeni kiadásokra"
"l10n_hu_429","429","Other provisions","liability_non_current","False","","Egyéb rendelkezések"
"l10n_hu_431","431","Subordinated liabilities to an associate","liability_non_current","False","","Alárendelt kötelezettségek társult vállalkozással szemben"
"l10n_hu_432","432","Subordinated liabilities to an enterprise that has a significant ownership interest","liability_non_current","False","","Hátrasorolt kötelezettségek jelentős tulajdonosi részesedéssel rendelkező vállalkozással szemben"
"l10n_hu_433","433","Subordinated liabilities to other participating interests","liability_non_current","False","","Alárendelt kötelezettségek egyéb részesedéssel szemben"
"l10n_hu_434","434","Subordinated liabilities to other enterprise","liability_non_current","False","","Hátrasorolt kötelezettségek más vállalkozással szemben"
"l10n_hu_441","441","Long-term loans","liability_non_current","False","","Hosszú lejáratú hitelek"
"l10n_hu_442","442","Convertible bonds","liability_non_current","False","","Átváltható kötvények"
"l10n_hu_443","443","Debt from bond issue","liability_non_current","False","","Kötvénykibocsátásból származó adósság"
"l10n_hu_444","444","Investment and development loans","liability_non_current","False","","Beruházási és fejlesztési hitelek"
"l10n_hu_445","445","Other long-term loans","liability_non_current","False","","Egyéb hosszú lejáratú hitelek"
"l10n_hu_446","446","Long-term liabilities to an associate","liability_non_current","False","","Hosszú lejáratú kötelezettségek társult vállalkozással szemben"
"l10n_hu_447","447","Long-term liabilities to a significant shareholder","liability_non_current","False","","Hosszú lejáratú kötelezettségek jelentős részvényessel szemben"
"l10n_hu_448","448","Non-current liabilities to participating interests","liability_non_current","False","","Hosszú lejáratú kötelezettségek részesedéssel szemben"
"l10n_hu_449","449","Other long-term liabilities","liability_non_current","False","","Egyéb hosszú lejáratú kötelezettségek"
"l10n_hu_4491","4491","Leases due to finance leases","liability_non_current","False","","Lízingek pénzügyi lízing miatt"
"l10n_hu_451","451","Short-term loans","liability_current","False","","Rövid lejáratú hitelek"
