"id","code","name","account_type","reconcile","non_trade","name@hu"
"l10n_hu_9691","9691","Amount of compensation confirmed by the insurer","income","False","","A biztosító által visszaigazolt kártérítés összege"
"l10n_hu_971","971","Dividends and shares received (due)","income_other","False","","Kapott osztalék és részvény (esedékes)"
"l10n_hu_9711","9711","Dividends and interests received from associates","income_other","False","","Partnerektől kapott osztalékok és kamatok"
"l10n_hu_972","972","Foreign exchange gains on the sale of shares","income_other","False","","Részvények eladásából származó árfolyamnyereség"
"l10n_hu_9721","9721","Foreign exchange gains on interests sold to associates","income_other","False","","A társult vállalkozásoknak eladott részesedések árfolyamnyeresége"
"l10n_hu_973","973","Interest and foreign exchange gains on financial assets","income_other","False","","Pénzügyi eszközök kamat- és árfolyamnyeresége"
"l10n_hu_9731","9731","Interest on fixed financial assets, foreign exchange gains from associates","income_other","False","","Befektetett pénzügyi eszközök kamatai, társult vállalkozásoktól származó árfolyamnyereség"
"l10n_hu_974","974","Other interest receivable and similar income","income_other","False","","Egyéb kamatkövetelések és hasonló bevételek"
"l10n_hu_9741","9741","Other interest receivable and similar income from an associate","income_other","False","","Egyéb kamatkövetelések és hasonló bevételek társult vállalkozástól"
"l10n_hu_975","975","Foreign exchange gain on investment, sale and redemption of securities","income_other","False","","Devizaárfolyam-nyereség befektetésen, értékpapírok eladásán és visszaváltásán"
"l10n_hu_976","976","Exchange rate gains on exchange and valuation","income_other","False","","Átváltási és értékelési árfolyamnyereség"
"l10n_hu_9761","9761","Foreign exchange gains on the translation of foreign exchange and currency inventories into huf","income_other","False","","Deviza- és devizakészletek forintra történő átváltásából származó árfolyamnyereség"
"l10n_hu_9762","9762","Foreign exchange gains and losses on assets and liabilities denominated in foreign currencies","income_other","False","","Devizában denominált eszközök és kötelezettségek árfolyamnyeresége és -vesztesége"
"l10n_hu_9763","9763","Aggregate foreign exchange gains on the measurement of assets and liabilities denominated in foreign currencies at the balance sheet date","income_other","False","","A devizában denominált eszközök és kötelezettségek mérlegfordulónapi értékeléséből származó összesített árfolyamnyereség"
"l10n_hu_977","977","Other foreign exchange gains, option fee income","income_other","False","","Egyéb árfolyamnyereség, opciós díjbevétel"
"l10n_hu_978","978","Revenue from purchased receivables","income_other","False","","Vásárolt követelésekből származó bevétel"
"l10n_hu_979","979","Other financial income","income_other","False","","Egyéb pénzügyi bevételek"
"l10n_hu_9791","9791","Valuation difference on other financial income","income_other","False","","Egyéb pénzügyi bevételek értékelési különbözete"
