"id","code","account_type","reconcile","name"
"kp_rrif4653","4653","expense","","Troškovi provizija izdavatelja kreditnih kartica"
"kp_rrif4654","4654","expense","","Troškovi obrade kredita"
"kp_rrif4655","4655","expense","","Troškovi akreditiva"
"kp_rrif4656","4656","expense","","Troškovi bankovne garancije"
"kp_rrif4657","4657","expense","","Ostali bankovni troškovi"
"kp_rrif4660","4660","expense","","Članarine komori (HGK ili HOK) i dopr. za javne ovlasti"
"kp_rrif4661","4661","expense","","Članarine udrugama i strukovnim komorama"
"kp_rrif4662","4662","expense","","Nadoknada za općekorisnu funkciju šuma (0,0525%)"
"kp_rrif4663","4663","expense","","Članarina turističkoj zajednici"
"kp_rrif4664","4664","expense","","Nadoknada za korištenje mineralnih sirovina"
"kp_rrif4665","4665","expense","","Pričuva za održavanje zgrade (Zakon o vlasništvu - Nar. nov., br. 91/96. do 38/09.)"
"kp_rrif4666","4666","expense","","Dozvole za korištenje autocesta, atesta, certifikata i sl."
"kp_rrif4667","4667","expense","","Članarina za kreditne i potrošačke kartice"
"kp_rrif4668","4668","expense","","Spomenička renta"
"kp_rrif4669","4669","expense","","Ostala davanja"
"kp_rrif4670","4670","expense","","Porez na tvrtku odnosno naziv"
"kp_rrif4671","4671","expense","","Porez (imovinski) na cestovna vozila, plovne objekte i zrakoplove"
"kp_rrif4672","4672","expense","","Porez na reklame koje se ističu na javnim mjestima"
"kp_rrif4673","4673","expense","","Naknade Fondu za ambalažu (prema materijalu, po jed. proizv., povratna i poticajna ambalaža)"
"kp_rrif4674","4674","expense","","Porez na kuće za odmor"
"kp_rrif4675","4675","expense","","Trošak poreza koji je ugovorno preuzet pri prodaji (npr. 5% p.p.n.)"
"kp_rrif46760","46760","expense","","Trošak PDV-a iz vlastite potrošnje (ako već nije sadržan u trošku)"
"kp_rrif46761","46761","expense","","Trošak PDV-a za koji je prestalo pravo na pretporez"
"kp_rrif46762","46762","expense","","30% PDV-a na osobne automobile i dr. sredstva osobnog prijevoza"
"kp_rrif46763","46763","expense","","PDV na osobne automobile i dr. sred. prijevoza na dio n. v. iznad 400.000,00 kn"
"kp_rrif4677","4677","expense","","Porez po odbitku"
"kp_rrif4678","4678","expense","","Troškovi naknadno utvrđenih poreza (npr. PDV, posebni i dr. porezi, osim poreza na dobitak)"
"kp_rrif46790","46790","expense","","Porez i carina pri izvozu"
"kp_rrif4680","4680","expense","","Troškovi koncesije"
"kp_rrif4681","4681","expense","","Troškovi franšiza, know howa, patenata, uporabe imena, znaka i dr."
"kp_rrif4682","4682","expense","","Troškovi prava na proizvodni i sl. postupak"
"kp_rrif4683","4683","expense","","Trošak prava na model, nacrt, formulu, plan, iskustvo i sl."
"kp_rrif4684","4684","expense","","Trošak HRT pretplate"
"kp_rrif4685","4685","expense","","Troškovi licenciranih prava"
"kp_rrif4686","4686","expense","","Troškovi prava uporabe računalnih programa"
"kp_rrif4689","4689","expense","","Ostali troškovi prava korištenja"
"kp_rrif46900","46900","expense","","Opće obrazovanje"
"kp_rrif46901","46901","expense","","Posebno obrazovanje"
"kp_rrif4691","4691","expense","","Troškovi za priručnike, časopise i stručnu literaturu"
"kp_rrif4692","4692","expense","","Troškovi službenih glasila"
"kp_rrif4693","4693","expense","","Sudski troškovi i pristojbe"
"kp_rrif4694","4694","expense","","Troškovi zdravstvenog nadzora i kontrola proizvoda, robe, usluge i sl."
"kp_rrif4695","4695","expense","","Troškovi obveznih liječničkih pregleda"
"kp_rrif4696","4696","expense","","Troškovi sistematskih kontrolnih liječničkih pregleda zaposlenika"
"kp_rrif4697","4697","expense","","Troškovi osnivanja (bilježnik, sud, oglasi, odvjetnik)"
"kp_rrif4698","4698","expense","","Troškovi licenciranja, certifikata i sl."
"kp_rrif4699","4699","expense","","Ostali nespomenuti nematerijalni troškovi (ulaznice za sajmove i dr.)"
"kp_rrif4700","4700","expense","","Ugovorene kamate"
"kp_rrif4701","4701","expense","","Zatezne kamate (čl. 7., st. 1., t. 9. ZoPD)"
"kp_rrif4702","4702","expense","","Kamate - porezno nepriznate"
"kp_rrif4703","4703","expense","","Kamate koje se uračunavaju u zalihe (MRS 23. t.11. i HSFI t. 10.22.)"
"kp_rrif4710","4710","expense","","Tečajne razlike iz odnosa s povezanim društvima-a1"
"kp_rrif4720","4720","expense","","Rashodi financiranja, troškovi popusta i naknadnih odobrenja s povezanim poduzetnicima"
"kp_rrif4721","4721","expense","","Troškovi usluga uprave koncerna i sl."
"kp_rrif4730","4730","expense","","Kamate na kredite banaka"
"kp_rrif4731","4731","expense","","Kamate iz lizing poslova"
"kp_rrif4732","4732","expense","","Kamate na zajmove pravnih osoba"
"kp_rrif4733","4733","expense","","Kamata na pozajmice članova društva i dioničara"
"kp_rrif4734","4734","expense","","Kamate na zajmove od fizičkih osoba"
"kp_rrif4735","4735","expense","","Diskontne kamate po mjenicama i dr. vrijednosnim papirima"
"kp_rrif4740","4740","expense","","Zatezne kamate iz trgovačkih ugovora"
"kp_rrif4741","4741","expense","","Zatezne kamate na poreze, doprinose i dr. davanja"
"kp_rrif4742","4742","expense","","Zatezne kamate između povezanih osoba (por. neprizn.)"
"kp_rrif4743","4743","expense","","Zatezne kamate po sudskim presudama"
"kp_rrif4744","4744","expense","","Ostale zatezne kamate"
"kp_rrif4750","4750","expense","","Negativne tečajne razlike iz obveza za nabave u inozemstvu"
"kp_rrif4751","4751","expense","","Negativne tečajne razlike iz kreditnih obveza"
"kp_rrif4752","4752","expense","","Negativne tečajne razlike iz potraživanja u inozemstvu"
"kp_rrif4753","4753","expense","","Negativne teč. razlike za ostalo (npr. iz blagajničkog, razlika kupovnog i srednjeg tečaja banke i dr.)"
"kp_rrif4754","4754","expense","","Negativne tečajne razlike nastale na stanjima deviznog računa i devizne blagajne"
"kp_rrif4760","4760","expense","","Gubitci iz ulaganja u dionice, udjele i dr. vrij. papire (prodane ispod troška nabave - čl. 10. ZoPD-a1"
"kp_rrif4770","4770","expense","","Troškovi diskonta pri prodaji potraživanja (faktoring)"
"kp_rrif4771","4771","expense","","Troškovi iz financijskih nagodbi"
"kp_rrif4772","4772","expense","","Ostali troškovi"
"kp_rrif4780","4780","expense","","Gubitci od smanjenja – vrijed. usklađenja fin. imovine za trgovanje (MRS 39. t. 55a. i HSFI t. 9.22b)"
"kp_rrif4781","4781","expense","","Troškovi smanjenja fin. imovine zbog ugovora o poteškoćama (HSFI t. 9.22a i MRS 39. t. 55b.)"
"kp_rrif4782","4782","expense","","Gubitci od smanjenja vrijednosti ostale financ. imov."
"kp_rrif4790","4790","expense","","Rashodi s osnove valutne klauzule po obvezama i kreditima"
"kp_rrif4791","4791","expense","","Rashodi s osnove usklađenja obveza zbog valutne i sl. klauzule (dobavljači, za predujmove i sl.)"
"kp_rrif4792","4792","expense","","Troškovi valutne klauzule iz tražbina ili obveza"
"kp_rrif4793","4793","expense","","Troškovi burzovnih usluga, emisije vrijednosnih papira i sl."
"kp_rrif4794","4794","expense","","Troškovi carine inozemnog financijskog i operativnog lizinga"
"kp_rrif4799","4799","expense","","Ostali nespomenuti financijski troškovi"
"kp_rrif4800","4800","expense","","Naknadno odobreni popusti i odobrenja"
"kp_rrif4801","4801","expense","","Troškovi nagodbe (razlike iz sniženja)"
"kp_rrif4802","4802","expense","","Troškovi nenadoknađenih jamstava za prodana dobra"
"kp_rrif4803","4803","expense","","Troškovi naknadnih reklamacija"
"kp_rrif4804","4804","expense","","Troškovi uzoraka zbog kontrole i pregleda, izlaganje radi prodaje i sl."
"kp_rrif4810","4810","expense","","Otpisi nenaplaćenih jamstava i drugih osiguranja"
"kp_rrif4811","4811","expense","","Izravni otpisi nenaplaćenih potraživanja od kupaca i drugih koja nisu vrijednosno usklađena"
"kp_rrif4812","4812","expense","","Troškovi ostalih otpisa"
"kp_rrif4820","4820","expense","","Neamortizirana vrijednost rashodovane, uništene ili otuđene dugotrajne imovine"
"kp_rrif4821","4821","expense","","Otpisi imovine izvan uporabe - rashod"
"kp_rrif4822","4822","expense","","Gubitak od prodane dug. imov. koja se ne amortizira"
"kp_rrif4823","4823","expense","","Gubitak od prodaje ost. dug. mat. i nemat. imovine"
"kp_rrif4824","4824","expense","","Otpisi materijala i robe - rashod"
"kp_rrif4830","4830","expense","","Manjkovi uslijed više sile (provalna krađa, elementarna nepogoda)"
"kp_rrif4831","4831","expense","","Dopušteni manjkovi - kalo, rastep, kvar i lom na zalihama prema odlukama HGK, HOK ili internim aktima"
"kp_rrif4832","4832","expense","","Prekomjerni manjkovi na zalihama (KRL) iznad normativa+PDV, prema HGK,(čl.7.,st.5.ZoPD)"
"kp_rrif4833","4833","expense","","Manjkovi novca i vrijednosnih papira"
"kp_rrif4839","4839","expense","","Ostali manjkovi iz imovine"
"kp_rrif4840","4840","expense","","Troškovi kazni za prijestupe i prekršaje i sl. (čl. 7., st. 1., t. 7. ZoPD)"
"kp_rrif4841","4841","expense","","Troškovi prisilne naplate poreza i dr. davanja (čl. 7., st. 1., t. 6. ZoPD)"
"kp_rrif4842","4842","expense","","Penali, ležarine, dangubnine"
"kp_rrif4843","4843","expense","","Nadoknade šteta iz radnog odnosa (npr. za godišnji odmor, ozljede na radu, odštetne rente i sl.)"
"kp_rrif4844","4844","expense","","Nadoknade štete - troškovi po nagodbama i sudskim presudama - tužbama"
"kp_rrif4845","4845","expense","","Ugovorene kazne i penali zbog neizvršenja, propusta i sl."
"kp_rrif4846","4846","expense","","Troškovi preuzetih obveza iz ugovora"
"kp_rrif4847","4847","expense","","Kazne za parkiranje"
"kp_rrif4849","4849","expense","","Ostali izdatci za štete"
"kp_rrif4850","4850","expense","","Naknadno utvrđeni troškovi - računi iz prethodnih godina"
"kp_rrif4851","4851","expense","","Troškovi naknadnih razlika iz nabava"
"kp_rrif4852","4852","expense","","Ispravak pogrešaka prethodnih razdoblja"
"kp_rrif4860","4860","expense","","Darovanje za općekorisne namjene (u novcu ili naravi do 2% od UP pr.god.  - čl. 7., st. 7. ZoPD)"
"kp_rrif4861","4861","expense","","Darovanje za zdrav.potrebe (vanjskih osoba do 2% UPpr.god. a nije pokriveno osig.-čl.7.,st.8.ZoPD)"
"kp_rrif4870","4870","expense","","Porezno nepriznata darovanja iznad 2% UP (iznad dop. s 486) i ino. udruga i sl. (čl.7.st.1.t.10 ZoPD)"
"kp_rrif4871","4871","expense","","Darovi bez protučinidbe prim. i izdatci nisu u svezi s ostv.dobitka+PDV,osim na novac-čl7,st1.,t13ZoPD"
"kp_rrif4872","4872","expense","","Darovanje političkih stranaka i nezavisnih kandidata"
"kp_rrif4880","4880","expense","","Troškovi iz ortačkog ugovora"
"kp_rrif4881","4881","expense","","Troškovi iz posredovanja"
"kp_rrif4890","4890","expense","","Rashodi utvrđeni u postupku nadzora (čl. 7. st. 1. t. 11. ZoPD) - skrivene isplate dobitka"
"kp_rrif4891","4891","expense","","Troškovi -porezno nepriznati- koji nisu u svezi s ostvarivanjem dobitka(čl7, st1,t13.ZoPD-red.br.24PD)"
"kp_rrif4892","4892","expense","","Troškovi povalstica i dr. oblici imovinskih koristi (čl. 7., st.1. t.10. ZoPD) - porezno nepriznati"
"kp_rrif4899","4899","expense","","Ostali nespomenuti poslovni rashodi"
"kp_rrif4900","4900","expense","","Raspored troškova za obračun proiz. i usluga (HSFI10, MRS2, MRS11)-uskladištivi troškovi (na 60,62i63)-a1"
"kp_rrif4910","4910","expense","","Raspored troškova za pokriće upravnih, administrativnih, prodajnih i drugih troškova (na rn 70 i 71)-a1"
"kp_rrif6000","6000","asset_current","","Proizvodnja u tijeku (po serijama, nositeljima, mjestima, radnim nalozima i sl.)-a1"
"kp_rrif6010","6010","asset_current","","Vrijednost usluga (u tijeku ili nedovršenih na datum bilance - MRS 2, t. 16.)-a1"
"kp_rrif6020","6020","asset_current","","Vanjska proizvodnja (kooperacija i dr.)-a1"
"kp_rrif6050","6050","asset_current","","Proizvodnja u slobodnoj zoni-a1"
"kp_rrif6060","6060","asset_current","","Proizvodnja u doradi i manipulaciji-a1"
"kp_rrif6070","6070","asset_current","","Obustavljena proizvodnja-a1"
"kp_rrif6080","6080","asset_current","","Proizvodnja u tijeku iz ortačkog ugovora-a1"
"kp_rrif6090","6090","asset_current","","Vrijednosno usklađivanje proizvodnje - usluga-a1"
"kp_rrif6100","6100","asset_current","","Zalihe poluproizvoda (analitika prema osnovnim skupinama ili po stupnju dovršenosti)-a1"
"kp_rrif6110","6110","asset_current","","Nedovršeni proizvodi i poluproizvodi (analitika po vrstama proizvoda)-a1"
"kp_rrif6190","6190","asset_current","","Vrijednosno usklađivanje nedovršenih proizvoda i poluproizvoda-a1"
"kp_rrif6200","6200","asset_current","","Zalihe biološke proizvodnje u toku-a1"
"kp_rrif6210","6210","asset_current","","Biloška imovina za prodaju-a1"
"kp_rrif6290","6290","asset_current","","Vrijednosno usklađivanje biloške imovine-a1"
"kp_rrif6300","6300","asset_current","","Gotovi proizvodi na skladištu (razrada za svako skladište, pa po skupinama, tipovima, vrstama i sl.)-a1"
"kp_rrif6310","6310","asset_current","","Gotovi proizvodi u javnom skladištu, silosu, i dr.-a1"
"kp_rrif6320","6320","asset_current","","Gotovi proizvodi dani u komisijsku prodaju-a1"
"kp_rrif6330","6330","asset_current","","Gotovi proizvodi dani u konsignacijsku prodaju-a1"
"kp_rrif6340","6340","asset_current","","Gotovi proizvodi u doradi, obradi i manipulaciji-a1"
"kp_rrif6350","6350","asset_current","","Gotovi proizvodi u slobodnoj zoni-a1"
"kp_rrif6360","6360","asset_current","","Zalihe nekurentnih proizvoda i otpadaka-a1"
"kp_rrif6370","6370","asset_current","","Gotovi proizvodi u izložbenim prostorima-a1"
"kp_rrif6380","6380","asset_current","","Gotovi proizvodi iz ortaštava-a1"
"kp_rrif6390","6390","asset_current","","Vrijednosno usklađivanje zaliha gotovih proizvoda-a1"
"kp_rrif6400","6400","asset_current","","Gotovi proizvodi u prodaji u vlastitim prodavaonicama (analitika po prodavaonicama)-a1"
"kp_rrif6410","6410","asset_current","","Uračunani PDV u vrijednosti proizvoda-a1"
"kp_rrif6420","6420","asset_current","","Uračunani porez na luksuz-a1"
"kp_rrif6480","6480","asset_current","","Uračunana marža u prodajnoj cijeni gotovih proizvoda-a1"
"kp_rrif6490","6490","asset_current","","Vrijednosno usklađivanje gotovih proizvoda u prodavaonicama-a1"
"kp_rrif6500","6500","asset_current","","Kupovna cijena robe od dobavljača-a1"
"kp_rrif6510","6510","asset_current","","Troškovi transporta"
"kp_rrif6511","6511","asset_current","","Troškovi ukrcaja i iskrcaja (fakturirani)"
"kp_rrif6512","6512","asset_current","","Transportno osiguranje"
"kp_rrif6513","6513","asset_current","","Troškovi posebnog pakiranja - ambalaže"
"kp_rrif6514","6514","asset_current","","Troškovi vlastitog transporta (ne više od tarife javnog prijevoza) dovođenja robe na prodajnu lokaciju"
"kp_rrif6515","6515","asset_current","","Troškovi oblikovanja za posebne kupce"
"kp_rrif6516","6516","asset_current","","Troškovi čuvanja i rukovanja (u fazi nabave)"
"kp_rrif6517","6517","asset_current","","Špediterski i bankarski troškovi"
"kp_rrif6518","6518","asset_current","","Nadoknada uvozniku za uslugu uvoza"
"kp_rrif6519","6519","asset_current","","Ostali troškovi kupnje (pregledi, atesti i troškovi u svezi s dovođenjem robe na zalihu -HSFI10 i MRS2)"
"kp_rrif6520","6520","asset_current","","Carina i druge uvozne pristojbe za robu-a1"
"kp_rrif6530","6530","asset_current","","Posebni porezi (trošarine)-a1"
"kp_rrif6590","6590","asset_current","","Obračun nabave - trošak kupnje-a1"
"kp_rrif6600","6600","asset_current","","Roba u vlastitom veleprodajnom skladištu (analitika po skladištima)"
"kp_rrif6601","6601","asset_current","","Zaliha otpadaka od robe"
"kp_rrif6610","6610","asset_current","","Roba u tuđem skladištu"
"kp_rrif6611","6611","asset_current","","Roba u tuđim silosima, hladnjačama i sl."
"kp_rrif6612","6612","asset_current","","Roba u izložbenim prostorima"
"kp_rrif6620","6620","asset_current","","Roba dana u komisijsku ili konsignacijsku prodaju-a1"
"kp_rrif66300","66300","asset_current","","Roba u prodavaonici A s PDV-om 23%"
"kp_rrif66301","66301","asset_current","","Roba u prodavaonici A s PDV-om 10%"
"kp_rrif66302","66302","asset_current","","Roba u prodavaonici A s PDV-om 0%, itd."
"kp_rrif6640","6640","asset_current","","Uračunani PDV (analitika po prodajnim mjestima i poreznim stopama)"
"kp_rrif6641","6641","asset_current","","Uračunani porez na luksuz"
"kp_rrif6650","6650","asset_current","","Vlastita roba u carinskom skladištu tipa ""D"""
"kp_rrif6651","6651","asset_current","","Roba u slobodnoj zoni"
"kp_rrif6660","6660","asset_current","","Vrijednost robe u doradi"
"kp_rrif6661","6661","asset_current","","Troškovi u svezi s doradom"
"kp_rrif6670","6670","asset_current","","Roba na putu-a1"
"kp_rrif6680","6680","asset_current","","Razlika u cijeni robe na skladištu (analitički po skupinama robe s istom maržom)"
"kp_rrif6681","6681","asset_current","","Uračunana marža robe u prodavaonici"
"kp_rrif6690","6690","asset_current","","Vrijednosno usklađenje zbog pada cijena, smanjenja uporabljivosti i sl."
"kp_rrif6691","6691","asset_current","","Prepravljene cijene robe zbog monetarnih oscilacija"
"kp_rrif6700","6700","asset_current","","Dani predujmovi za nabavu robe-a1"
"kp_rrif6710","6710","asset_current","","Dani predujmovi uvozniku za nabavu robe-a1"
"kp_rrif6720","6720","asset_current","","Dani predujmovi za robu povezanom društvu-a1"
"kp_rrif6790","6790","asset_current","","Vrijednosno usklađenje danih predujmova za robu-a1"
"kp_rrif6800","6800","asset_current","","Nabavna vrijednost nekretnina za preprodaju (s porezom na promet)-a1"
"kp_rrif6810","6810","asset_current","","Troškovi dodatnog uređenja - dorade-a1"
"kp_rrif6820","6820","asset_current","","Umjetnine u prodaji-a1"
"kp_rrif6830","6830","asset_current","","Nekretnine za prodaju (uređene)-a1"
"kp_rrif6840","6840","asset_current","","Uračunani PDV u umjetnine-a1"
"kp_rrif6870","6870","asset_current","","Predujmovi za kupnju nekretnina radi daljnje prodaje-a1"
"kp_rrif6880","6880","asset_current","","Uračunana razlika u cijeni nekretnina i umjetnina za daljnju prodaju-a1"
"kp_rrif6890","6890","asset_current","","Vrijednosno usklađivanje nekretnina i umjetnina u prometu i predujmova-a1"
"kp_rrif6900","6900","asset_current","","Nematerijalna imovina namijenjena prodaji-a1"
"kp_rrif6910","6910","asset_current","","Skupina imovine za prodaju (npr. pogon, poslov. jedinica i sl. )"
"kp_rrif6990","6990","asset_current","","Vrijednosno usklađenje dugotrajne imovine namijenjena prodaji-a1"
"kp_rrif7000","7000","expense","","Trošak zaliha prodanih proizvoda (60, 62, 63 i 64)-a1"
"kp_rrif7010","7010","expense","","Troškovi realiziranih usluga (490 i 601)-a1"
"kp_rrif7020","7020","expense","","Troškovi neiskorištenog kapaciteta (HSFI t. 10.18. i MRS 2 t. 13)-a1"
"kp_rrif7030","7030","expense","","Troškovi nabavne vrijednosti materijala, dijelova, inventara i otpadaka"
"kp_rrif7031","7031","expense","","Troškovi manjkova materijala, dijelova i inventara kojom se tereti odgovorna osoba"
"kp_rrif7040","7040","expense","","Dopušteni manjkovi -porezno priznati- tehnološki KRL i škart u proizvodnji (sa skupina 60, 62, 63 i 64)"
"kp_rrif7041","7041","expense","","Prekomjerni manjkovi-porezno priznati teh.KRL i škart u proiz.(60,62,63i64 -HSFI t10.21. i MRS2,t14)"
"kp_rrif7042","7042","expense","","Prekomjerni manjkovi proizvoda (HSFI t. 10.2. i MRS 2, t. 16.) - porezno nepriznati"
"kp_rrif7043","7043","expense","","Razlika višeg troška proizvodnje od neto-vrij. koja se može realizirati (HSFIt.10.35. i MRS2t.28.-33.)"
"kp_rrif7044","7044","expense","","Troškovi isporučenih proizvoda u jamstvenom roku (zamjena)"
"kp_rrif7050","7050","expense","","Greškom neiskazani rashodi proteklih razdoblja-a1"
"kp_rrif7060","7060","expense","","Gubitci iz ugovora o izgradnj (MRS 11, t. 36.)-a1"
"kp_rrif7070","7070","expense","","Troškovi iz ugovora o ortaštvu-a1"
"kp_rrif7080","7080","expense","","Troškovi vrijed. uskl. proizvod. u tijeku(609), poluproizvoda(629) i zaliha got. proizvoda (639 i 649)-a1"
"kp_rrif7100","7100","expense","","Trošak prodane robe u tuzemstvu"
"kp_rrif7101","7101","expense","","Trošak prodane robe u inozemstvu"
"kp_rrif7102","7102","expense","","Troškovi prodane robe u tranzitu"
"kp_rrif7103","7103","expense","","Trošak prodane robe u poslov. jed."
"kp_rrif7110","7110","expense","","Nabavna vrijednost prodanih nekretnina i umjetnina-a1"
"kp_rrif7120","7120","expense","","Troškovi dugotr. imov. namijenjeni prodaji-a1"
"kp_rrif7130","7130","expense","","Kalo, rastep, kvar i lom u dopuštenoj visini prema Pravilniku HGK - porezno priznati"
"kp_rrif7131","7131","expense","","Manjkovi uslijed više sile (provalne krađe, poplava, požar, potres i sl.) - porezno priznati"
"kp_rrif7132","7132","expense","","Manjkovi i otpisi trgovačke robe po očevidu PU i sl. - porezno priznati"
"kp_rrif7133","7133","expense","","Prekomjerni kalo, rastep, kvar i lom + PDV - porezno nepriznati"
"kp_rrif7134","7134","expense","","Manjak robe na teret odgovorne osobe"
"kp_rrif7140","7140","expense","","Troškovi zamjene robe u jamstvenom roku-a1"
"kp_rrif7150","7150","expense","","Greškom neiskazani rashodi prodane robe u proteklim razdobljima u trgovini-a1"
"kp_rrif7180","7180","expense","","Troškovi vrijednosnog usklađenja trgovačke robe i predujmova (669, 679, 689)-a1"
"kp_rrif7190","7190","expense","","Troškovi vrijednosnog usklađenja dugotrajne imovine namijenjene prodaji (699)-a1"
"kp_rrif7200","7200","expense","","Troškovi uprave, prodaje, administracije (491)-a1"
"kp_rrif7210","7210","expense","","Ostali poslovni rashodi - nespomenuti-a1"
"kp_rrif7300","7300","expense","","Izvanredni rashodi od prodaje dugotrajne imovine (HSFI t. 8.35.)-a1"
"kp_rrif7310","7310","expense","","Izvanredni otpisi od otuđenja imovine, nastali neočekivano i u visokoj vrijednosti (HSFt4.7. i MRS10t9)-a1"
"kp_rrif7320","7320","expense","","Gubitci zbog izvlaštenja ili zbog prirodnih katastrofa na važnom dijelu imovine-a1"
"kp_rrif7330","7330","expense","","Izvanredni rashodi iz ostalih rijetkih i neobičnih događaja ili transakcija-a1"
"kp_rrif7340","7340","expense","","Izvanredne kazne, penali, odštete, naknadno utvrđ. obveze i sl.-a1"
"kp_rrif7350","7350","expense","","Nerealizirani gubitci-a1"
"kp_rrif7370","7370","expense","","Gubitci od procjene biološke imovine-a1"
"kp_rrif7400","7400","expense","","Udio u gubitku povezanih društava"
"kp_rrif7401","7401","expense","","Udio u gubitku ortaka"
"kp_rrif7450","7450","income","","Udio u dobitku povezanih društava"
"kp_rrif7451","7451","income","","Udio u dobitku ortaštva"
"kp_rrif7500","7500","income","","Prihodi od prodaje proizvoda od redovne prodaje"
"kp_rrif7501","7501","income","","Prihodi od prodaje proizvoda na kredit ili otplatu"
"kp_rrif7502","7502","income","","Prihodi ostvareni u slobodnoj zoni"
"kp_rrif7503","7503","income","","Prodaja u vlastitim prodavaonicama"
"kp_rrif7504","7504","income","","Prihodi od prodaje stanova i dr. građevina"
"kp_rrif7505","7505","income","","Prihodi od prodaje poluproizvoda i nedovršenih proizvoda"
"kp_rrif7506","7506","income","","Prihodi ostvareni u posl. jed. na području posebne držav. skrbi i u Vukovaru"
"kp_rrif7507","7507","income","","Prihod od povratne naknade za ambalažu (bez PDV-a)"
"kp_rrif7508","7508","income","","Prihod od prodaje otpadaka iz proizvodnje"
"kp_rrif7509","7509","income","","Prihodi od prodaje poluproizvoda i nedovršenih proizvoda"
"kp_rrif7510","7510","income","","Prihodi od servisnih usluga, usluga popravaka i sl. usluga"
"kp_rrif7511","7511","income","","Prihodi od restorana i gostionica"
"kp_rrif7512","7512","income","","Prihodi od hotela i noćenja"
"kp_rrif7513","7513","income","","Prihodi od knjigovodstvenih, usluga poreznog savjetovanja, revizorskih, konzultantskih i dr. usluga"
"kp_rrif7514","7514","income","","Prihodi od usluga prijevoza"
"kp_rrif7515","7515","income","","Prihodi od komunalnih usluga"
"kp_rrif7516","7516","income","","Prihodi od promidžbenih usluga"
"kp_rrif7517","7517","income","","Prihodi od usluga zaštite i istraživanja"
"kp_rrif7518","7518","income","","Prihodi od programskih usluga"
"kp_rrif7519","7519","income","","Prihodi od prodaje ostalih usluga"
"kp_rrif7520","7520","income","","Prihodi od graditeljskih usluga - iz ugovora o izgradnji (građevina, postrojenja, brodova i sl.)-a1"
"kp_rrif7530","7530","income","","Prihodi od prodaje dobara u inozemstvo (moguća analitika po vrstama proizvoda i zemljama)-a1"
"kp_rrif7540","7540","income","","Prihodi iz međunarodne plovidbe brodovima (čl. 26., st. 10. ZoPD)"
"kp_rrif7541","7541","income","","Prihodi od internetskih usluga za inozemstvo"
"kp_rrif7542","7542","income","","Prihodi od poslovnih jedinica u inozemstvu"
"kp_rrif7543","7543","income","","Prihodi od prodaje turističkih usluga u inozem."
"kp_rrif7550","7550","income","","Prihodi od prodaje proizvoda i usluga poduzet. u kojima postoje sudjelujući interesi (do 20% udjela)-a1"
"kp_rrif7560","7560","income","","Prihodi od prodaje proizvoda i usluga ovisnim društvima (analitika po društvima)-a1"
"kp_rrif7570","7570","income","","Prihodi od najmova i zakupa-a1"
"kp_rrif7580","7580","income","","Prihodi iz ortaštva-a1"
"kp_rrif7590","7590","income","","Ostali prihodi od prodaje učinaka-a1"
"kp_rrif7600","7600","income","","Prihodi od prodaje robe na veliko (analitika po prodajnim mjestima)"
"kp_rrif7601","7601","income","","Prihodi od prodaje uvezene robe na veliko"
"kp_rrif7602","7602","income","","Prihodi od prodaje robe u tranzitu"
"kp_rrif7603","7603","income","","Prihodi od prodaje robe na malo (analitika po prodav.)"
"kp_rrif7604","7604","income","","Prihodi od prodaje robe u povezanim društvima"
"kp_rrif7605","7605","income","","Prihodi od prodaje robe dane u komisiju ili konsignaciju"
"kp_rrif7606","7606","income","","Prihodi od prodaje u poslov. jed. na području posebne držav. skrbi i Vukovaru"
