"id","name","code","user_type_id/id","chart_template_id/id","reconcile","group_id/id"
"pcg_5322","Bilete de tratament şi odihnă","5322","account.data_account_type_liquidity","l10n_ro.ro_chart_template","False","l10n_ro.account_group_532"
"pcg_5323","Tichete şi bilete de călătorie","5323","account.data_account_type_liquidity","l10n_ro.ro_chart_template","False","l10n_ro.account_group_532"
"pcg_5328","Alte valori","5328","account.data_account_type_liquidity","l10n_ro.ro_chart_template","False","l10n_ro.account_group_532"
"pcg_5411","Acreditive în lei","5411","account.data_account_type_liquidity","l10n_ro.ro_chart_template","False","l10n_ro.account_group_541"
"pcg_5414","Acreditive în valută","5414","account.data_account_type_liquidity","l10n_ro.ro_chart_template","False","l10n_ro.account_group_541"
"pcg_542","Avansuri de trezorerie","542","account.data_account_type_liquidity","l10n_ro.ro_chart_template","False","l10n_ro.account_group_54"
"pcg_581","Viramente interne","581","account.data_account_type_liquidity","l10n_ro.ro_chart_template","True","l10n_ro.account_group_58"
"pcg_591","Ajustări pentru pierderea de valoare a acţiunilor deţinute la entităţile afiliate","591","account.data_account_type_liquidity","l10n_ro.ro_chart_template","False","l10n_ro.account_group_59"
"pcg_595","Ajustări pentru pierderea de valoare a obligaţiunilor emise şi răscumpărate","595","account.data_account_type_liquidity","l10n_ro.ro_chart_template","False","l10n_ro.account_group_59"
"pcg_596","Ajustări pentru pierderea de valoare a obligaţiunilor","596","account.data_account_type_liquidity","l10n_ro.ro_chart_template","False","l10n_ro.account_group_59"
"pcg_598","Ajustări pentru pierderea de valoare a altor investiţii pe termen scurt şi creanţe asimilate","598","account.data_account_type_liquidity","l10n_ro.ro_chart_template","False","l10n_ro.account_group_59"
"pcg_601","Cheltuieli cu materiile prime","601","account.data_account_type_expenses","l10n_ro.ro_chart_template","False","l10n_ro.account_group_60"
"pcg_6021","Cheltuieli cu materiale auxiliare","6021","account.data_account_type_expenses","l10n_ro.ro_chart_template","False","l10n_ro.account_group_602"
"pcg_6022","Cheltuieli privind combustibilul","6022","account.data_account_type_expenses","l10n_ro.ro_chart_template","False","l10n_ro.account_group_602"
"pcg_6023","Cheltuieli privind materialele pentru ambalat","6023","account.data_account_type_expenses","l10n_ro.ro_chart_template","False","l10n_ro.account_group_602"
"pcg_6024","Cheltuieli privind piesele de schimb","6024","account.data_account_type_expenses","l10n_ro.ro_chart_template","False","l10n_ro.account_group_602"
"pcg_6025","Cheltuieli privind seminţele şi materialele de plantat","6025","account.data_account_type_expenses","l10n_ro.ro_chart_template","False","l10n_ro.account_group_602"
"pcg_6026","Cheltuieli privind furajele","6026","account.data_account_type_expenses","l10n_ro.ro_chart_template","False","l10n_ro.account_group_602"
"pcg_6028","Cheltuieli privind alte materiale consumabile","6028","account.data_account_type_expenses","l10n_ro.ro_chart_template","False","l10n_ro.account_group_602"
"pcg_603","Cheltuieli privind materialele de natura obiectelor de inventar","603","account.data_account_type_expenses","l10n_ro.ro_chart_template","False","l10n_ro.account_group_60"
"pcg_604","Cheltuieli privind materialele nestocate","604","account.data_account_type_expenses","l10n_ro.ro_chart_template","False","l10n_ro.account_group_60"
"pcg_605","Cheltuieli privind energia şi apa","605","account.data_account_type_expenses","l10n_ro.ro_chart_template","False","l10n_ro.account_group_60"
"pcg_606","Cheltuieli privind activele biologice de natura stocurilor","606","account.data_account_type_expenses","l10n_ro.ro_chart_template","False","l10n_ro.account_group_60"
"ro_pcg_expense","Cheltuieli privind mărfurile","607","account.data_account_type_expenses","l10n_ro.ro_chart_template","False","l10n_ro.account_group_60"
"pcg_608","Cheltuieli privind ambalajele","608","account.data_account_type_expenses","l10n_ro.ro_chart_template","False","l10n_ro.account_group_60"
"pcg_609","Reduceri comerciale primite","609","account.data_account_type_expenses","l10n_ro.ro_chart_template","False","l10n_ro.account_group_60"
"pcg_611","Cheltuieli cu întreţinerea şi reparaţiile","611","account.data_account_type_expenses","l10n_ro.ro_chart_template","False","l10n_ro.account_group_61"
"pcg_612","Cheltuieli cu redevenţele, locaţiile de gestiune şi chiriile","612","account.data_account_type_expenses","l10n_ro.ro_chart_template","False","l10n_ro.account_group_61"
"pcg_613","Cheltuieli cu primele de asigurare","613","account.data_account_type_expenses","l10n_ro.ro_chart_template","False","l10n_ro.account_group_61"
"pcg_614","Cheltuieli cu studiile şi cercetările","614","account.data_account_type_expenses","l10n_ro.ro_chart_template","False","l10n_ro.account_group_61"
"pcg_615","Cheltuieli cu pregătirea personalului","615","account.data_account_type_expenses","l10n_ro.ro_chart_template","False","l10n_ro.account_group_61"
"pcg_621","Cheltuieli cu colaboratorii","621","account.data_account_type_expenses","l10n_ro.ro_chart_template","False","l10n_ro.account_group_62"
"pcg_622","Cheltuieli privind comisioanele şi onorariile","622","account.data_account_type_expenses","l10n_ro.ro_chart_template","False","l10n_ro.account_group_62"
"pcg_6231","Cheltuieli de protocol","6231","account.data_account_type_expenses","l10n_ro.ro_chart_template","False","l10n_ro.account_group_623"
"pcg_6232","Cheltuieli de reclamă şi publicitate","6232","account.data_account_type_expenses","l10n_ro.ro_chart_template","False","l10n_ro.account_group_623"
"pcg_624","Cheltuieli cu transportul de bunuri şi personal","624","account.data_account_type_expenses","l10n_ro.ro_chart_template","False","l10n_ro.account_group_62"
"pcg_625","Cheltuieli cu deplasări, detaşări şi transferări","625","account.data_account_type_expenses","l10n_ro.ro_chart_template","False","l10n_ro.account_group_62"
"pcg_626","Cheltuieli poştale şi taxe de telecomunicaţii","626","account.data_account_type_expenses","l10n_ro.ro_chart_template","False","l10n_ro.account_group_62"
"pcg_627","Cheltuieli cu serviciile bancare şi asimilate","627","account.data_account_type_expenses","l10n_ro.ro_chart_template","False","l10n_ro.account_group_62"
"pcg_628","Alte cheltuieli cu serviciile executate de terţi","628","account.data_account_type_expenses","l10n_ro.ro_chart_template","False","l10n_ro.account_group_62"
"pcg_6351","Cheltuieli cu alte impozite, taxe şi vărsăminte asimilate","6351","account.data_account_type_expenses","l10n_ro.ro_chart_template","False","l10n_ro.account_group_635"
"pcg_6352","Cheltuieli cu alte impozite, taxe şi vărsăminte asimilate nedeductibile","6352","account.data_account_type_expenses","l10n_ro.ro_chart_template","False","l10n_ro.account_group_635"
"pcg_641","Cheltuieli cu salariile personalului","641","account.data_account_type_expenses","l10n_ro.ro_chart_template","False","l10n_ro.account_group_64"
"pcg_6421","Cheltuieli cu avantajele în natură acordate salariaţilor","6421","account.data_account_type_expenses","l10n_ro.ro_chart_template","False","l10n_ro.account_group_642"
"pcg_6422","Cheltuieli cu tichetele acordate salariaţilor","6422","account.data_account_type_expenses","l10n_ro.ro_chart_template","False","l10n_ro.account_group_642"
"pcg_643","Cheltuieli cu remunerarea în instrumente de capitaluri proprii","643","account.data_account_type_expenses","l10n_ro.ro_chart_template","False","l10n_ro.account_group_64"
"pcg_644","Cheltuieli cu primele reprezentând participarea personalului la profit","644","account.data_account_type_expenses","l10n_ro.ro_chart_template","False","l10n_ro.account_group_64"
"pcg_6451","Cheltuieli privind contribuţia unităţii la asigurările sociale","6451","account.data_account_type_expenses","l10n_ro.ro_chart_template","False","l10n_ro.account_group_645"
"pcg_6452","Cheltuieli privind contribuţia unităţii pentru ajutorul de şomaj","6452","account.data_account_type_expenses","l10n_ro.ro_chart_template","False","l10n_ro.account_group_645"
"pcg_6453","Cheltuieli privind contribuţia angajatorului pentru asigurările sociale de sănătate","6453","account.data_account_type_expenses","l10n_ro.ro_chart_template","False","l10n_ro.account_group_645"
"pcg_6455","Cheltuieli privind contribuţia unităţii la asigurările de viaţă","6455","account.data_account_type_expenses","l10n_ro.ro_chart_template","False","l10n_ro.account_group_645"
"pcg_6456","Cheltuieli privind contribuţia unităţii la fondurile de pensii facultative","6456","account.data_account_type_expenses","l10n_ro.ro_chart_template","False","l10n_ro.account_group_645"
"pcg_6457","Cheltuieli privind contribuţia unităţii la primele de asigurare voluntară de sănătate","6457","account.data_account_type_expenses","l10n_ro.ro_chart_template","False","l10n_ro.account_group_645"
"pcg_6458","Alte cheltuieli privind asigurările şi protecţia socială","6458","account.data_account_type_expenses","l10n_ro.ro_chart_template","False","l10n_ro.account_group_645"
"pcg_646","Cheltuieli privind contribuția asiguratorie pentru muncă","646","account.data_account_type_expenses","l10n_ro.ro_chart_template","False","l10n_ro.account_group_64"
"pcg_6511","Cheltuieli ocazionate de constituirea fiduciei","6511","account.data_account_type_expenses","l10n_ro.ro_chart_template","False","l10n_ro.account_group_651"
"pcg_6512","Cheltuieli din derularea operaţiunilor de fiducie","6512","account.data_account_type_expenses","l10n_ro.ro_chart_template","False","l10n_ro.account_group_651"
"pcg_6513","Cheltuieli din lichidarea operaţiunilor de fiducie","6513","account.data_account_type_expenses","l10n_ro.ro_chart_template","False","l10n_ro.account_group_651"
"pcg_652","Cheltuieli cu protecţia mediului înconjurător","652","account.data_account_type_expenses","l10n_ro.ro_chart_template","False","l10n_ro.account_group_65"
"pcg_654","Pierderi din creanţe şi debitori diverşi","654","account.data_account_type_expenses","l10n_ro.ro_chart_template","False","l10n_ro.account_group_65"
"pcg_655","Cheltuieli din reevaluarea imobilizărilor corporale","655","account.data_account_type_expenses","l10n_ro.ro_chart_template","False","l10n_ro.account_group_65"
"pcg_6581","Despăgubiri, amenzi şi penalităţi","6581","account.data_account_type_expenses","l10n_ro.ro_chart_template","False","l10n_ro.account_group_658"
"pcg_6582","Donaţii acordate","6582","account.data_account_type_expenses","l10n_ro.ro_chart_template","False","l10n_ro.account_group_658"
"pcg_6583","Cheltuieli privind activele cedate şi alte operaţiuni de capital","6583","account.data_account_type_expenses","l10n_ro.ro_chart_template","False","l10n_ro.account_group_658"
"pcg_6584","Cheltuieli cu sumele sau bunurile acordate ca sponsorizări","6584","account.data_account_type_expenses","l10n_ro.ro_chart_template","False","l10n_ro.account_group_658"
"pcg_6586","Cheltuieli reprezentând transferuri şi contribuţii datorate în baza unor acte normative speciale","6586","account.data_account_type_expenses","l10n_ro.ro_chart_template","False","l10n_ro.account_group_658"
"pcg_6587","Cheltuieli privind calamităţile şi alte evenimente similare","6587","account.data_account_type_expenses","l10n_ro.ro_chart_template","False","l10n_ro.account_group_658"
"pcg_65881","Alte cheltuieli de exploatare","65881","account.data_account_type_expenses","l10n_ro.ro_chart_template","False","l10n_ro.account_group_6588"
"pcg_65882","Alte cheltuieli de exploatare nedeductibile","65882","account.data_account_type_expenses","l10n_ro.ro_chart_template","False","l10n_ro.account_group_6588"
"pcg_663","Pierderi din creanţe legate de participaţii","663","account.data_account_type_expenses","l10n_ro.ro_chart_template","False","l10n_ro.account_group_66"
"pcg_6641","Cheltuieli privind imobilizările financiare cedate","6641","account.data_account_type_expenses","l10n_ro.ro_chart_template","False","l10n_ro.account_group_664"
"pcg_6642","Pierderi din investiţiile pe termen scurt cedate","6642","account.data_account_type_expenses","l10n_ro.ro_chart_template","False","l10n_ro.account_group_664"
"pcg_6651","Diferenţe nefavorabile de curs valutar legate de elementele monetare exprimate în valută","6651","account.data_account_type_expenses","l10n_ro.ro_chart_template","False","l10n_ro.account_group_665"
"pcg_6652","Diferenţe nefavorabile de curs valutar din evaluarea elementelor monetare care fac parte din investiţia netă într-o entitate străină","6652","account.data_account_type_expenses","l10n_ro.ro_chart_template","False","l10n_ro.account_group_665"
"pcg_666","Cheltuieli privind dobânzile","666","account.data_account_type_expenses","l10n_ro.ro_chart_template","False","l10n_ro.account_group_66"
"pcg_667","Cheltuieli privind sconturile acordate","667","account.data_account_type_expenses","l10n_ro.ro_chart_template","False","l10n_ro.account_group_66"
"pcg_668","Alte cheltuieli financiare","668","account.data_account_type_expenses","l10n_ro.ro_chart_template","False","l10n_ro.account_group_66"
"pcg_6811","Cheltuieli de exploatare privind amortizarea imobilizărilor","6811","account.data_account_type_expenses","l10n_ro.ro_chart_template","False","l10n_ro.account_group_681"
"pcg_6812","Cheltuieli de exploatare privind provizioanele","6812","account.data_account_type_expenses","l10n_ro.ro_chart_template","False","l10n_ro.account_group_681"
"pcg_6813","Cheltuieli de exploatare privind ajustările pentru deprecierea imobilizărilor","6813","account.data_account_type_expenses","l10n_ro.ro_chart_template","False","l10n_ro.account_group_681"
"pcg_6814","Cheltuieli de exploatare privind ajustările pentru deprecierea activelor circulante","6814","account.data_account_type_expenses","l10n_ro.ro_chart_template","False","l10n_ro.account_group_681"
"pcg_6817","Cheltuieli de exploatare privind ajustările pentru deprecierea fondului comercial","6817","account.data_account_type_expenses","l10n_ro.ro_chart_template","False","l10n_ro.account_group_681"
"pcg_6861","Cheltuieli privind actualizarea provizioanelor","6861","account.data_account_type_expenses","l10n_ro.ro_chart_template","False","l10n_ro.account_group_686"
"pcg_6863","Cheltuieli financiare privind ajustările pentru pierderea de valoare a imobilizărilor financiare","6863","account.data_account_type_expenses","l10n_ro.ro_chart_template","False","l10n_ro.account_group_686"
"pcg_6864","Cheltuieli financiare privind ajustările pentru pierderea de valoare a activelor circulante","6864","account.data_account_type_expenses","l10n_ro.ro_chart_template","False","l10n_ro.account_group_686"
"pcg_6865","Cheltuieli financiare privind amortizarea diferențelor aferente titlurilor de stat","6865","account.data_account_type_expenses","l10n_ro.ro_chart_template","False","l10n_ro.account_group_686"
"pcg_6868","Cheltuieli financiare privind amortizarea primelor de rambursare a obligaţiunilor şi a altor datorii","6868","account.data_account_type_expenses","l10n_ro.ro_chart_template","False","l10n_ro.account_group_686"
"pcg_691","Cheltuieli cu impozitul pe profit","691","account.data_account_type_expenses","l10n_ro.ro_chart_template","False","l10n_ro.account_group_69"
"pcg_695","Cheltuieli cu impozitul specific unor activitati","695","account.data_account_type_expenses","l10n_ro.ro_chart_template","False","l10n_ro.account_group_69"
"pcg_698","Cheltuieli cu impozitul pe venit şi cu alte impozite care nu apar in elementele de mai sus","698","account.data_account_type_expenses","l10n_ro.ro_chart_template","False","l10n_ro.account_group_69"
"pcg_7015","Venituri din vânzarea produselor finite","7015","account.data_account_type_revenue","l10n_ro.ro_chart_template","False","l10n_ro.account_group_701"
"pcg_7017","Venituri din vânzarea produselor agricole","7017","account.data_account_type_revenue","l10n_ro.ro_chart_template","False","l10n_ro.account_group_701"
"pcg_7018","Venituri din vânzarea activelor biologice de natura stocurilor","7018","account.data_account_type_revenue","l10n_ro.ro_chart_template","False","l10n_ro.account_group_701"
"pcg_702","Venituri din vânzarea semifabricatelor","702","account.data_account_type_revenue","l10n_ro.ro_chart_template","False","l10n_ro.account_group_70"
"pcg_703","Venituri din vânzarea produselor reziduale","703","account.data_account_type_revenue","l10n_ro.ro_chart_template","False","l10n_ro.account_group_70"
"pcg_704","Venituri din servicii prestate","704","account.data_account_type_revenue","l10n_ro.ro_chart_template","False","l10n_ro.account_group_70"
"pcg_705","Venituri din studii şi cercetări","705","account.data_account_type_revenue","l10n_ro.ro_chart_template","False","l10n_ro.account_group_70"
"pcg_706","Venituri din redevenţe, locaţii de gestiune şi chirii","706","account.data_account_type_revenue","l10n_ro.ro_chart_template","False","l10n_ro.account_group_70"
"ro_pcg_sale","Venituri din vânzarea mărfurilor","707","account.data_account_type_revenue","l10n_ro.ro_chart_template","False","l10n_ro.account_group_70"
"pcg_708","Venituri din activităţi diverse","708","account.data_account_type_revenue","l10n_ro.ro_chart_template","False","l10n_ro.account_group_70"
"pcg_709","Reduceri comerciale acordate","709","account.data_account_type_revenue","l10n_ro.ro_chart_template","False","l10n_ro.account_group_70"
"pcg_711","Venituri aferente costurilor stocurilor de produse","711","account.data_account_type_revenue","l10n_ro.ro_chart_template","False","l10n_ro.account_group_71"
"pcg_712","Venituri aferente costurilor serviciilor în curs de execuţie","712","account.data_account_type_revenue","l10n_ro.ro_chart_template","False","l10n_ro.account_group_71"
"pcg_721","Venituri din producţia de imobilizări necorporale","721","account.data_account_type_revenue","l10n_ro.ro_chart_template","False","l10n_ro.account_group_72"
"pcg_722","Venituri din producţia de imobilizări corporale","722","account.data_account_type_revenue","l10n_ro.ro_chart_template","False","l10n_ro.account_group_72"
"pcg_725","Venituri din producţia de investiţii imobiliare","725","account.data_account_type_revenue","l10n_ro.ro_chart_template","False","l10n_ro.account_group_72"
"pcg_7411","Venituri din subvenţii de exploatare aferente cifrei de afaceri","7411","account.data_account_type_revenue","l10n_ro.ro_chart_template","False","l10n_ro.account_group_741"
"pcg_7412","Venituri din subvenţii de exploatare pentru materii prime şi materiale","7412","account.data_account_type_revenue","l10n_ro.ro_chart_template","False","l10n_ro.account_group_741"
"pcg_7413","Venituri din subvenţii de exploatare pentru alte cheltuieli externe","7413","account.data_account_type_revenue","l10n_ro.ro_chart_template","False","l10n_ro.account_group_741"
"pcg_7414","Venituri din subvenţii de exploatare pentru plata personalului","7414","account.data_account_type_revenue","l10n_ro.ro_chart_template","False","l10n_ro.account_group_741"
"pcg_7415","Venituri din subvenţii de exploatare pentru asigurări şi protecţie socială","7415","account.data_account_type_revenue","l10n_ro.ro_chart_template","False","l10n_ro.account_group_741"
"pcg_7416","Venituri din subvenţii de exploatare pentru alte cheltuieli de exploatare","7416","account.data_account_type_revenue","l10n_ro.ro_chart_template","False","l10n_ro.account_group_741"
"pcg_7417","Venituri din subvenţii de exploatare în caz de calamităţi şi alte evenimente similare","7417","account.data_account_type_revenue","l10n_ro.ro_chart_template","False","l10n_ro.account_group_741"
"pcg_7418","Venituri din subvenţii de exploatare pentru dobânda datorată","7418","account.data_account_type_revenue","l10n_ro.ro_chart_template","False","l10n_ro.account_group_741"
"pcg_7419","Venituri din subvenţii de exploatare aferente altor venituri","7419","account.data_account_type_revenue","l10n_ro.ro_chart_template","False","l10n_ro.account_group_741"
"pcg_7511","Venituri ocazionate de constituirea fiduciei","7511","account.data_account_type_revenue","l10n_ro.ro_chart_template","False","l10n_ro.account_group_751"
"pcg_7512","Venituri din derularea operaţiunilor de fiducie","7512","account.data_account_type_revenue","l10n_ro.ro_chart_template","False","l10n_ro.account_group_751"
"pcg_7513","Venituri din lichidarea operaţiunilor de fiducie","7513","account.data_account_type_revenue","l10n_ro.ro_chart_template","False","l10n_ro.account_group_751"
"pcg_754","Venituri din creanţe reactivate şi debitori diverşi","754","account.data_account_type_revenue","l10n_ro.ro_chart_template","False","l10n_ro.account_group_75"
"pcg_755","Venituri din reevaluarea imobilizărilor corporale","755","account.data_account_type_revenue","l10n_ro.ro_chart_template","False","l10n_ro.account_group_758"
"pcg_7581","Venituri din despăgubiri, amenzi şi penalităţi","7581","account.data_account_type_revenue","l10n_ro.ro_chart_template","False","l10n_ro.account_group_758"
"pcg_7582","Venituri din donaţii primite","7582","account.data_account_type_revenue","l10n_ro.ro_chart_template","False","l10n_ro.account_group_758"
"pcg_7583","Venituri din vânzarea activelor şi alte operaţiuni de capital","7583","account.data_account_type_revenue","l10n_ro.ro_chart_template","False","l10n_ro.account_group_758"
"pcg_7584","Venituri din subvenţii pentru investiţii","7584","account.data_account_type_revenue","l10n_ro.ro_chart_template","False","l10n_ro.account_group_758"
"pcg_7586","Venituri reprezentând transferuri cuvenite în baza unor acte normative speciale","7586","account.data_account_type_revenue","l10n_ro.ro_chart_template","False","l10n_ro.account_group_758"
"pcg_7588","Alte venituri din exploatare","7588","account.data_account_type_revenue","l10n_ro.ro_chart_template","False","l10n_ro.account_group_758"
"pcg_7611","Venituri din acţiuni deţinute la entităţile afiliate","7611","account.data_account_type_revenue","l10n_ro.ro_chart_template","False","l10n_ro.account_group_761"
"pcg_7612","Venituri din acţiuni deţinute la entităţi asociate","7612","account.data_account_type_revenue","l10n_ro.ro_chart_template","False","l10n_ro.account_group_761"
"pcg_7613","Venituri din acţiuni deţinute la entităţi controlate în comun","7613","account.data_account_type_revenue","l10n_ro.ro_chart_template","False","l10n_ro.account_group_761"
"pcg_7615","Venituri din alte imobilizări financiare","7615","account.data_account_type_revenue","l10n_ro.ro_chart_template","False","l10n_ro.account_group_761"
"pcg_762","Venituri din investiţii financiare pe termen scurt","762","account.data_account_type_revenue","l10n_ro.ro_chart_template","False","l10n_ro.account_group_76"
"pcg_7641","Venituri din imobilizări financiare cedate","7641","account.data_account_type_revenue","l10n_ro.ro_chart_template","False","l10n_ro.account_group_764"
"pcg_7642","Câştiguri din investiţii pe termen scurt cedate","7642","account.data_account_type_revenue","l10n_ro.ro_chart_template","False","l10n_ro.account_group_764"
"pcg_7651","Diferenţe favorabile de curs valutar legate de elementele monetare exprimate în valută","7651","account.data_account_type_revenue","l10n_ro.ro_chart_template","False","l10n_ro.account_group_765"
"pcg_7652","Diferenţe favorabile de curs valutar din evaluarea elementelor monetare care fac parte din investiţia netă într-o entitate străină","7652","account.data_account_type_revenue","l10n_ro.ro_chart_template","False","l10n_ro.account_group_765"
"pcg_766","Venituri din dobânzi","766","account.data_account_type_revenue","l10n_ro.ro_chart_template","False","l10n_ro.account_group_76"
"pcg_767","Venituri din sconturi obţinute","767","account.data_account_type_revenue","l10n_ro.ro_chart_template","False","l10n_ro.account_group_76"
"pcg_768","Alte venituri financiare","768","account.data_account_type_revenue","l10n_ro.ro_chart_template","False","l10n_ro.account_group_76"
"pcg_7812","Venituri din provizioane","7812","account.data_account_type_revenue","l10n_ro.ro_chart_template","False","l10n_ro.account_group_781"
"pcg_7813","Venituri din ajustări pentru deprecierea imobilizărilor","7813","account.data_account_type_revenue","l10n_ro.ro_chart_template","False","l10n_ro.account_group_781"
"pcg_7814","Venituri din ajustări pentru deprecierea activelor circulante","7814","account.data_account_type_revenue","l10n_ro.ro_chart_template","False","l10n_ro.account_group_781"
"pcg_7815","Venituri din fondul comercial negativ","7815","account.data_account_type_revenue","l10n_ro.ro_chart_template","False","l10n_ro.account_group_781"
"pcg_7863","Venituri financiare din ajustări pentru pierderea de valoare a imobilizărilor financiare","7863","account.data_account_type_revenue","l10n_ro.ro_chart_template","False","l10n_ro.account_group_786"
"pcg_7864","Venituri financiare din ajustări pentru pierderea de valoare a activelor circulante","7864","account.data_account_type_revenue","l10n_ro.ro_chart_template","False","l10n_ro.account_group_786"
"pcg_7865","Venituri financiare din amortizarea diferențelor aferente titlurilor de stat","7865","account.data_account_type_revenue","l10n_ro.ro_chart_template","False","l10n_ro.account_group_786"
"pcg_8011","Giruri şi garanţii acordate","8011","account.data_account_off_sheet","l10n_ro.ro_chart_template","False",""
"pcg_8018","Alte angajamente acordate","8018","account.data_account_off_sheet","l10n_ro.ro_chart_template","False",""
"pcg_8021","Giruri şi garanţii primite","8021","account.data_account_off_sheet","l10n_ro.ro_chart_template","False",""
"pcg_8028","Alte angajamente primite","8028","account.data_account_off_sheet","l10n_ro.ro_chart_template","False",""
"pcg_8031","Imobilizări corporale luate cu chirie","8031","account.data_account_off_sheet","l10n_ro.ro_chart_template","False",""
