"id","name","code","account_type","chart_template_id/id","reconcile"
"pcg_3921","Adjustments for the depreciation of consumables","3921","asset_current","l10n_ro.ro_chart_template","False"
"pcg_3922","Adjustments for the depreciation of materials in the nature of inventory items","3922","asset_current","l10n_ro.ro_chart_template","False"
"pcg_393","Adjustments for impairment of work in progress","393","asset_current","l10n_ro.ro_chart_template","False"
"pcg_3941","Adjustments for depreciation of semi-finished products","3941","asset_current","l10n_ro.ro_chart_template","False"
"pcg_3945","Adjustments for the depreciation of finished goods","3945","asset_current","l10n_ro.ro_chart_template","False"
"pcg_3946","Adjustments for the depreciation of residual products","3946","asset_current","l10n_ro.ro_chart_template","False"
"pcg_3947","Adjustments for the depreciation of agricultural products","3947","asset_current","l10n_ro.ro_chart_template","False"
"pcg_3951","Adjustments for the impairment of materials and materials held by third parties","3951","asset_current","l10n_ro.ro_chart_template","False"
"pcg_3952","Adjustments for the depreciation of semi-finished products held by third parties","3952","asset_current","l10n_ro.ro_chart_template","False"
"pcg_3953","Adjustments for impairment of finished goods held by third parties","3953","asset_current","l10n_ro.ro_chart_template","False"
"pcg_3954","Adjustments for impairment of residual products held by third parties","3954","asset_current","l10n_ro.ro_chart_template","False"
"pcg_3955","Adjustments for the depreciation of agricultural products held by third parties","3955","asset_current","l10n_ro.ro_chart_template","False"
"pcg_3956","Adjustments for the impairment of biological assets held by third parties","3956","asset_current","l10n_ro.ro_chart_template","False"
"pcg_3957","Adjustments for impairment of goods held by third parties","3957","asset_current","l10n_ro.ro_chart_template","False"
"pcg_3958","Adjustments for impairment of third-party packaging","3958","asset_current","l10n_ro.ro_chart_template","False"
"pcg_396","Adjustments for the impairment of biological assets","396","asset_current","l10n_ro.ro_chart_template","False"
"pcg_397","Adjustments for depreciation of goods","397","asset_current","l10n_ro.ro_chart_template","False"
"pcg_398","Adjustments for depreciation of packaging","398","asset_current","l10n_ro.ro_chart_template","False"
"pcg_4011","Providers - resumed in a period of up to one year","4011","liability_payable","l10n_ro.ro_chart_template","True"
"pcg_4012","Providers - resumed in a period of at least one year","4012","liability_payable","l10n_ro.ro_chart_template","True"
"pcg_4031","Notes to be paid - resumed in a period of up to one year","4031","liability_payable","l10n_ro.ro_chart_template","True"
"pcg_4032","Notes to be paid - resumed in a period of at least one year","4032","liability_payable","l10n_ro.ro_chart_template","True"
"pcg_4041","Fixed asset providers - resumed in a period of up to one year","4041","liability_payable","l10n_ro.ro_chart_template","True"
"pcg_4042","Fixed asset providers - resumed in a period of at least one year","4042","liability_payable","l10n_ro.ro_chart_template","True"
"pcg_4051","Notes payable for fixed assets - resumed in a period of up to one year","4051","liability_current","l10n_ro.ro_chart_template","True"
"pcg_4052","Notes payable for fixed assets - resumed in a period of at least one year","4052","liability_current","l10n_ro.ro_chart_template","True"
"pcg_4081","Providers - unpaid invoices - resumed in a period of up to one year","4081","liability_current","l10n_ro.ro_chart_template","True"
"pcg_4082","Providers - unpaid invoices - resumed in a period of at least one year","4082","liability_current","l10n_ro.ro_chart_template","True"
"pcg_4091","Providers - debtors for purchases of goods of the nature of stocks","4091","liability_current","l10n_ro.ro_chart_template","True"
"pcg_4092","Providers - debtors for services","4092","liability_current","l10n_ro.ro_chart_template","True"
"pcg_4093","Advances granted for tangible assets","4093","liability_current","l10n_ro.ro_chart_template","True"
"pcg_4094","Advance payments for intangible assets","4094","liability_current","l10n_ro.ro_chart_template","True"
"ro_pcg_recv","Customers","4111","asset_receivable","l10n_ro.ro_chart_template","True"
"pcg_4118","Uncertain or litigious customers","4118","asset_current","l10n_ro.ro_chart_template","True"
"pcg_413","Notes to be received from customers","413","asset_current","l10n_ro.ro_chart_template","True"
"pcg_418","Customers - invoices to be issued","418","asset_current","l10n_ro.ro_chart_template","True"
"pcg_419","Customers","419","asset_current","l10n_ro.ro_chart_template","True"
"pcg_4191","Customers - creditor - resumed in a period of up to one year","4191","asset_current","l10n_ro.ro_chart_template","True"
"pcg_4192","Customers - creditor - resumed in a period of at least one year","4192","asset_current","l10n_ro.ro_chart_template","True"
"pcg_421","Staff - wages due","421","liability_payable","l10n_ro.ro_chart_template","True"
"pcg_4211","Staff - wages due - resumed in a period of up to one year","4211","liability_payable","l10n_ro.ro_chart_template","True"
"pcg_4212","Staff - wages due - resumed in a period of at least one year","4212","liability_payable","l10n_ro.ro_chart_template","True"
"pcg_4231","Staff - material aid owed - resumed in a period of up to one year","4231","liability_current","l10n_ro.ro_chart_template","False"
"pcg_4232","Staff - material aid owed - resumed in a period of at least one year","4232","liability_current","l10n_ro.ro_chart_template","False"
"pcg_4241","Premiums representing staff profit sharing - resumed in a period of up to one year","4241","liability_current","l10n_ro.ro_chart_template","False"
"pcg_4242","Premiums representing staff profit sharing - resumed in a period of at least one year","4242","liability_current","l10n_ro.ro_chart_template","False"
"pcg_425","Advances granted to staff","425","asset_receivable","l10n_ro.ro_chart_template","True"
"pcg_4261","Personnel rights not raised - resumed in a period of up to one year","4261","liability_current","l10n_ro.ro_chart_template","False"
"pcg_4262","Personnel rights not raised - resumed in a period of at least one year","4262","liability_current","l10n_ro.ro_chart_template","False"
"pcg_4271","Withholdings from wages owed to third parties - resumed in a period of up to one year","4271","liability_current","l10n_ro.ro_chart_template","True"
"pcg_4272","Withholdings from wages owed to third parties - resumed in a period of at least one year","4272","liability_current","l10n_ro.ro_chart_template","True"
"pcg_42811","Other liabilities related to personnel - resumed in a period of up to one year","42811","liability_current","l10n_ro.ro_chart_template","False"
"pcg_42812","Other liabilities related to personnel - resumed in a period of at least one year","42812","liability_current","l10n_ro.ro_chart_template","False"
"pcg_4282","Other receivables related to personnel","4282","asset_current","l10n_ro.ro_chart_template","False"
"pcg_43111","Unit contribution to social security - resumed in a period of up to one year","43111","liability_current","l10n_ro.ro_chart_template","False"
"pcg_43112","Unit contribution to social security - resumed in a period of at least one year","43112","liability_current","l10n_ro.ro_chart_template","False"
"pcg_43121","Staff contribution to social security - resumed in a period of up to one year","43121","liability_current","l10n_ro.ro_chart_template","False"
"pcg_43122","Staff contribution to social security - resumed in a period of at least one year","43122","liability_current","l10n_ro.ro_chart_template","False"
"pcg_43131","Employer contribution for social health insurance - resumed in a period of up to one year","43131","liability_current","l10n_ro.ro_chart_template","False"
"pcg_43132","Employer contribution for social health insurance - resumed in a period of at least one year","43132","liability_current","l10n_ro.ro_chart_template","False"
"pcg_43141","Employee contribution for social health insurance - resumed in a period of up to one year","43141","liability_current","l10n_ro.ro_chart_template","False"
"pcg_43142","Employee contribution for social health insurance - resumed in a period of at least one year","43142","liability_current","l10n_ro.ro_chart_template","False"
"pcg_43151","Social security contribution - resumed in a period of up to one year","43151","liability_current","l10n_ro.ro_chart_template","False"
"pcg_43152","Social security contribution - resumed in a period of at least one year","43152","liability_current","l10n_ro.ro_chart_template","False"
"pcg_43161","Social insurance health contribution - resumed in a period of up to one year","43161","liability_current","l10n_ro.ro_chart_template","False"
"pcg_43162","Social insurance health contribution - resumed in a period of at least one year","43162","liability_current","l10n_ro.ro_chart_template","False"
"pcg_43181","Other social health insurance contributions - resumed in a period of up to one year","43181","liability_current","l10n_ro.ro_chart_template","False"
"pcg_43182","Other social health insurance contributions - resumed in a period of at least one year","43182","liability_current","l10n_ro.ro_chart_template","False"
"pcg_4361","Insurance contribution for work - resumed in a period of up to one year","4361","liability_current","l10n_ro.ro_chart_template","False"
"pcg_4362","Insurance contribution for work - resumed in a period of at least one year","4362","liability_current","l10n_ro.ro_chart_template","False"
"pcg_4371","The unit's contribution to the unemployment fund","4371","liability_current","l10n_ro.ro_chart_template","False"
"pcg_4372","Staff contribution to the unemployment fund","4372","liability_current","l10n_ro.ro_chart_template","False"
"pcg_43811","Other social liabilities - resumed in a period of up to one year","43811","liability_current","l10n_ro.ro_chart_template","False"
"pcg_43812","Other social liabilities - resumed in a period of at least one year","43812","liability_current","l10n_ro.ro_chart_template","False"
"pcg_4382","Other social receivables","4382","asset_current","l10n_ro.ro_chart_template","False"
"pcg_44111","Profit tax - resumed in a period of up to one year","44111","liability_current","l10n_ro.ro_chart_template","False"
"pcg_44112","Profit tax - resumed in a period of at least one year","44112","liability_current","l10n_ro.ro_chart_template","False"
"pcg_44151","Tax specific to activities - resumed in a period of up to one year","44151","liability_current","l10n_ro.ro_chart_template","False"
"pcg_44152","Tax specific to activities - resumed in a period of at least one year","44152","liability_current","l10n_ro.ro_chart_template","False"
"pcg_44181","Income tax - resumed in a period of up to one year","44118","liability_current","l10n_ro.ro_chart_template","False"
"pcg_44182","Income tax - resumed in a period of at least one year","44182","liability_current","l10n_ro.ro_chart_template","False"
"pcg_44231","Payment VAT - resumed in a period of up to one year","44231","liability_current","l10n_ro.ro_chart_template","False"
"pcg_44232","Payment VAT - resumed in a period of at least one year","44232","liability_current","l10n_ro.ro_chart_template","False"
"pcg_4424","VAT to be recovered","4424","asset_current","l10n_ro.ro_chart_template","False"
"pcg_4426","VAT deductible","4426","liability_non_current","l10n_ro.ro_chart_template","False"
"pcg_4427","VAT collected","4427","asset_non_current","l10n_ro.ro_chart_template","False"
"pcg_44281","Non-chargeable VAT - Collected","44281","liability_non_current","l10n_ro.ro_chart_template","False"
"pcg_442811","Non-chargeable VAT - Collected - resumed in a period of up to one year","442811","liability_non_current","l10n_ro.ro_chart_template","False"
"pcg_442812","Non-chargeable VAT - Collected - resumed in a period of at least one year","442812","liability_non_current","l10n_ro.ro_chart_template","False"
"pcg_44282","Non-chargeable VAT - Deducted","44282","asset_current","l10n_ro.ro_chart_template","False"
"pcg_442821","Non-chargeable VAT - Deducted - resumed in a period of up to one year","442821","asset_current","l10n_ro.ro_chart_template","False"
"pcg_442822","Non-chargeable VAT - Deducted - resumed in a period of at least one year","442822","asset_current","l10n_ro.ro_chart_template","False"
"pcg_4441","Income tax on wages - resumed in a period of up to one year","4441","liability_current","l10n_ro.ro_chart_template","True"
"pcg_4442","Income tax on wages - resumed in a period of at least one year","4442","liability_current","l10n_ro.ro_chart_template","True"
"pcg_4451","Government subsidies","4451","asset_non_current","l10n_ro.ro_chart_template","False"
"pcg_4452","Grant-in-kind loans","4452","asset_current","l10n_ro.ro_chart_template","False"
"pcg_4458","Other amounts received as subsidies","4458","asset_current","l10n_ro.ro_chart_template","False"
"pcg_4461","Other taxes, fees and similar payments - resumed in a period of at least one year","4461","liability_current","l10n_ro.ro_chart_template","True"
"pcg_4462","Other taxes, fees and similar payments - resumed in a period of up to one year","4462","liability_current","l10n_ro.ro_chart_template","True"
"pcg_4471","Special funds - taxes and similar payments - resumed in a period of up to one year","4471","liability_current","l10n_ro.ro_chart_template","False"
"pcg_4472","Special funds - taxes and similar payments - resumed in a period of at least one year","4472","liability_current","l10n_ro.ro_chart_template","False"
"pcg_44811","Other liabilities to the state budget - resumed in a period of up to one year","44811","liability_current","l10n_ro.ro_chart_template","False"
"pcg_44812","Other liabilities to the state budget - resumed in a period of at least one year","44812","liability_current","l10n_ro.ro_chart_template","False"
"pcg_4482","Other receivables regarding the state budget","4482","asset_current","l10n_ro.ro_chart_template","False"
"pcg_45111","Settlements between related entities - resumed in a period of up to one year","45111","liability_current","l10n_ro.ro_chart_template","False"
"pcg_45112","Settlements between related entities - resumed in a period of at least one year","45112","liability_current","l10n_ro.ro_chart_template","False"
"pcg_45181","Interest related to settlements between related entities - resumed in a period of up to one year","45181","liability_current","l10n_ro.ro_chart_template","False"
"pcg_45182","Interest related to settlements between related entities - resumed in a period of at least one year","45182","liability_current","l10n_ro.ro_chart_template","False"
"pcg_45311","Settlements with associates and jointly controlled entities - resumed in a period of up to one year","45311","liability_current","l10n_ro.ro_chart_template","False"
"pcg_45312","Settlements with associates and jointly controlled entities - resumed in a period of at least one year","45312","liability_current","l10n_ro.ro_chart_template","False"
"pcg_45381","Interest related to settlements with associated entities and jointly controlled entities - resumed in a period of up to one year","45381","liability_current","l10n_ro.ro_chart_template","False"
"pcg_45382","Interest related to settlements with associated entities and jointly controlled entities - resumed in a period of at least one year","45382","liability_current","l10n_ro.ro_chart_template","False"
"pcg_45511","Associated shareholders - current  - resumed within a period of up to one year","45511","liability_payable","l10n_ro.ro_chart_template","True"
"pcg_45512","Associated shareholders - current  - resumed within a period of at least one year","45512","liability_payable","l10n_ro.ro_chart_template","True"
"pcg_45581","Associate shareholders - interest on current  - resumed in a period of up to one year","45581","liability_current","l10n_ro.ro_chart_template","True"
"pcg_45582","Associate shareholders - interests on current  - resumed in a period of at least one year","45582","liability_current","l10n_ro.ro_chart_template","True"
"pcg_4561","Settlements with shareholders regarding the capital - resumed in a period of up to one year","4561","liability_current","l10n_ro.ro_chart_template","False"
"pcg_4562","Settlements with shareholders regarding the capital - resumed in a period of at least one year","4562","liability_current","l10n_ro.ro_chart_template","False"
"pcg_4571","Dividend payment - resumed in a period of up to one year","4571","liability_current","l10n_ro.ro_chart_template","False"
"pcg_4572","Dividend payment - resumed in a period of at least one year","4572","liability_current","l10n_ro.ro_chart_template","False"
"pcg_45811","Settlements from joint ventures - asset - resumed in a period of up to one year","45811","asset_current","l10n_ro.ro_chart_template","False"
"pcg_45812","Settlements from joint ventures - asset - resumed in a period of at least one year","45812","asset_current","l10n_ro.ro_chart_template","False"
"pcg_4582","Settlements from joint ventures - liability","4582","asset_current","l10n_ro.ro_chart_template","False"
"pcg_461","Various debtors","461","asset_receivable","l10n_ro.ro_chart_template","True"
"pcg_4621","Various creditors - resumed in a period of up to one year","4621","liability_payable","l10n_ro.ro_chart_template","True"
"pcg_4622","Various creditors - resumed in a period of at least one year","4622","liability_payable","l10n_ro.ro_chart_template","True"
"pcg_463","Receivables representing dividends distributed during the financial year","463","liability_payable","l10n_ro.ro_chart_template","True"
"pcg_46611","Liabilities from trust operations - resumed in a period of up to one year","46611","liability_current","l10n_ro.ro_chart_template","False"
"pcg_46612","Liabilities from trust operations - resumed in a period of at least one year","46612","liability_current","l10n_ro.ro_chart_template","False"
"pcg_4662","Claims from trust operations","4662","asset_current","l10n_ro.ro_chart_template","False"
"pcg_4711","Expenses registered in advance - resumed in a period of up to one year","4711","asset_prepayments","l10n_ro.ro_chart_template","False"
"pcg_4712","Expenses registered in advance - resumed in a period of at least one year","4712","asset_prepayments","l10n_ro.ro_chart_template","False"
"pcg_4721","Deferred income - resumed in a period of up to one year","4721","liability_non_current","l10n_ro.ro_chart_template","False"
"pcg_4722","Deferred income - resumed in a period of at least one year","4722","liability_non_current","l10n_ro.ro_chart_template","False"
"pcg_473","Settlements from operations being clarified","473","liability_current","l10n_ro.ro_chart_template","False"
"pcg_4731","Settlements from operations being clarified - resumed in a period of up to one year","4731","liability_current","l10n_ro.ro_chart_template","False"
"pcg_4732","Settlements from operations being clarified - resumed in a period of at least one year","4732","liability_current","l10n_ro.ro_chart_template","False"
"pcg_47511","Government subsidies for investment - resumed in a period of up to one year","47511","income_other","l10n_ro.ro_chart_template","False"
"pcg_47512","Government subsidies for investment - resumed in a period of at least one year","47512","income_other","l10n_ro.ro_chart_template","False"
"pcg_47521","Non-reimbursable loans in the nature of investment subsidies - resumed in a period of up to one year","47521","income_other","l10n_ro.ro_chart_template","False"
"pcg_47522","Non-reimbursable loans in the nature of investment subsidies - resumed in a period of at least one year","47522","income_other","l10n_ro.ro_chart_template","False"
"pcg_47531","Investment donations - resumed in a period of up to one year","47531","income_other","l10n_ro.ro_chart_template","False"
"pcg_47532","Investment donations - resumed in a period of at least one year","47532","income_other","l10n_ro.ro_chart_template","False"
"pcg_47541","Inventory pluses of the nature of fixed assets - resumed in a period of up to one year","47541","income_other","l10n_ro.ro_chart_template","False"
"pcg_47542","Inventory pluses of the nature of fixed assets - resumed in a period of at least one year","47542","income_other","l10n_ro.ro_chart_template","False"
"pcg_47581","Other amounts received as investment subsidies - resumed in a period of up to one year","47581","income_other","l10n_ro.ro_chart_template","False"
"pcg_47582","Other amounts received as investment subsidies - resumed in a period of at least one year","47582","income_other","l10n_ro.ro_chart_template","False"
"pcg_4781","Advance income related to assets received by transfer from customers - resumed in a period of up to one year","4781","income_other","l10n_ro.ro_chart_template","False"
"pcg_4782","Advance income related to assets received by transfer from customers - resumed in a period of at least one year","4782","income_other","l10n_ro.ro_chart_template","False"
"pcg_481","Settlements between unit and subunits","481","liability_current","l10n_ro.ro_chart_template","False"
"pcg_482","Settlements between subunits","482","liability_current","l10n_ro.ro_chart_template","False"
"pcg_491","Adjustments for impairment of receivables - customers","491","liability_current","l10n_ro.ro_chart_template","False"
"pcg_495","Adjustments for impairment of receivables - settlements within the group and with the associated shareholders","495","liability_current","l10n_ro.ro_chart_template","False"
"pcg_4951","Adjustments for impairment of receivables - settlements within the group","4951","liability_current","l10n_ro.ro_chart_template","False"
"pcg_4952","Adjustments for impairment of receivables - settlements with the associated shareholders","4952","liability_current","l10n_ro.ro_chart_template","False"
"pcg_496","Adjustments for impairment of receivables - other debtors","496","liability_current","l10n_ro.ro_chart_template","False"
"pcg_501","Shares held in affiliated entities","501","asset_cash","l10n_ro.ro_chart_template","False"
"pcg_505","Bonds issued and redeemed","505","asset_cash","l10n_ro.ro_chart_template","False"
"pcg_506","Bonds","506","asset_cash","l10n_ro.ro_chart_template","False"
"pcg_507","Green certificates received","507","asset_cash","l10n_ro.ro_chart_template","False"
"pcg_5081","Other securities","5081","asset_cash","l10n_ro.ro_chart_template","False"
"pcg_5088","Interest on bonds and securities","5088","asset_cash","l10n_ro.ro_chart_template","False"
"pcg_50911","Payments to be made for shares held in affiliated entities - resumed in a period of up to one year","50911","asset_cash","l10n_ro.ro_chart_template","False"
"pcg_50912","Payments to be made for shares held in affiliated entities - resumed in a period of at least one year","50912","asset_cash","l10n_ro.ro_chart_template","False"
"pcg_50921","Payments to be made for other short-term investments - resumed in a period of up to one year","50921","asset_cash","l10n_ro.ro_chart_template","False"
"pcg_50922","Payments to be made for other short-term investments - resumed in a period of at least one year","50922","asset_cash","l10n_ro.ro_chart_template","False"
"pcg_5112","Checks to be cashed","5112","asset_cash","l10n_ro.ro_chart_template","False"
"pcg_5113","Notes to be collected","5113","asset_cash","l10n_ro.ro_chart_template","False"
"pcg_5114","Discounted notes","5114","asset_cash","l10n_ro.ro_chart_template","False"
"pcg_5121","Bank  in lei","5121","asset_cash","l10n_ro.ro_chart_template","False"
"pcg_5124","Bank  in foreign currency","5124","asset_cash","l10n_ro.ro_chart_template","False"
"pcg_5125","Amounts being settled","5125","asset_current","l10n_ro.ro_chart_template","False"
"pcg_51861","Payable interest - resumed in a period of up to one year","51861","asset_cash","l10n_ro.ro_chart_template","False"
"pcg_51862","Payable interest - resumed in a period of at least one year","51862","asset_cash","l10n_ro.ro_chart_template","False"
"pcg_5187","Interest receivable","5187","asset_cash","l10n_ro.ro_chart_template","False"
"pcg_51911","Short-term bank loans - resumed in a period of up to one year","51911","asset_cash","l10n_ro.ro_chart_template","False"
"pcg_51912","Short-term bank loans - resumed in a period of at least one year","51912","asset_cash","l10n_ro.ro_chart_template","False"
"pcg_51921","Short-term bank loans not repaid at maturity - resumed in a period of up to one year","51921","asset_cash","l10n_ro.ro_chart_template","False"
"pcg_51922","Short-term bank loans not repaid at maturity - resumed in a period of at least one year","51922","asset_cash","l10n_ro.ro_chart_template","False"
"pcg_51931","Foreign government loans - resumed in a period of up to one year","51931","asset_cash","l10n_ro.ro_chart_template","False"
"pcg_51932","Foreign government loans - resumed in a period of at least one year","51932","asset_cash","l10n_ro.ro_chart_template","False"
"pcg_51941","Foreign loans guaranteed by the state - resumed in a period of up to one year","51941","asset_cash","l10n_ro.ro_chart_template","False"
"pcg_51942","Foreign loans guaranteed by the state - resumed in a period of at least one year","51942","asset_cash","l10n_ro.ro_chart_template","False"
"pcg_51951","External loans guaranteed by banks - resumed in a period of up to one year","51951","asset_cash","l10n_ro.ro_chart_template","False"
"pcg_51952","External loans guaranteed by banks - resumed in a period of at least one year","51952","asset_cash","l10n_ro.ro_chart_template","False"
"pcg_51961","Loans from the state treasury - resumed in a period of up to one year","51961","asset_cash","l10n_ro.ro_chart_template","False"
"pcg_51962","Loans from the state treasury - resumed in a period of at least one year","51962","asset_cash","l10n_ro.ro_chart_template","False"
