"id","name","code","account_type","chart_template_id/id","reconcile"
"pcg_51971","Domestic loans guaranteed by the state - resumed in a period of up to one year","51971","asset_cash","l10n_ro.ro_chart_template","False"
"pcg_51972","Domestic loans guaranteed by the state - resumed in a period of at least one year","51972","asset_cash","l10n_ro.ro_chart_template","False"
"pcg_51981","Interest related to short-term bank loans - resumed in a period of up to one year","51981","asset_cash","l10n_ro.ro_chart_template","False"
"pcg_51982","Interest related to short-term bank loans - resumed in a period of at least one year","51982","asset_cash","l10n_ro.ro_chart_template","False"
"pcg_5311","Cash in lei","5311","asset_cash","l10n_ro.ro_chart_template","False"
"pcg_5314","Cash in foreign currency","5314","asset_cash","l10n_ro.ro_chart_template","False"
"pcg_5321","Tax and postage stamps","5321","asset_cash","l10n_ro.ro_chart_template","False"
"pcg_5322","Treatment and rest tickets","5322","asset_cash","l10n_ro.ro_chart_template","False"
"pcg_5323","Tickets and travel tickets","5323","asset_cash","l10n_ro.ro_chart_template","False"
"pcg_5328","Other valuables","5328","asset_cash","l10n_ro.ro_chart_template","False"
"pcg_5411","Letters of credit in lei","5411","asset_cash","l10n_ro.ro_chart_template","False"
"pcg_5414","Letters of credit in foreign currency","5414","asset_cash","l10n_ro.ro_chart_template","False"
"pcg_542","Cash advances","542","asset_cash","l10n_ro.ro_chart_template","False"
"pcg_581","Internal transfers","581","asset_cash","l10n_ro.ro_chart_template","True"
"pcg_591","Adjustments for impairment of shares held in affiliated entities","591","asset_cash","l10n_ro.ro_chart_template","False"
"pcg_595","Adjustments for impairment of bonds issued and redeemed","595","asset_cash","l10n_ro.ro_chart_template","False"
"pcg_596","Adjustments for bond impairment","596","asset_cash","l10n_ro.ro_chart_template","False"
"pcg_598","Adjustments for impairment of other short-term investments and assimilated receivables","598","asset_cash","l10n_ro.ro_chart_template","False"
"pcg_601","Raw material expenses","601","expense","l10n_ro.ro_chart_template","False"
"pcg_6021","Expenses with auxiliary materials","6021","expense","l10n_ro.ro_chart_template","False"
"pcg_6022","Fuel expenses","6022","expense","l10n_ro.ro_chart_template","False"
"pcg_6023","Expenses regarding packaging materials","6023","expense","l10n_ro.ro_chart_template","False"
"pcg_6024","Spare parts costs","6024","expense","l10n_ro.ro_chart_template","False"
"pcg_6025","Costs of seeds and planting materials","6025","expense","l10n_ro.ro_chart_template","False"
"pcg_6026","Feed expenses","6026","expense","l10n_ro.ro_chart_template","False"
"pcg_6028","Expenses regarding other consumables","6028","expense","l10n_ro.ro_chart_template","False"
"pcg_603","Expenses regarding materials of the nature of inventory items","603","expense","l10n_ro.ro_chart_template","False"
"pcg_604","Expenditure on non-stocked materials","604","expense","l10n_ro.ro_chart_template","False"
"pcg_605","Energy and water expenses","605","expense","l10n_ro.ro_chart_template","False"
"pcg_606","Expenditures on biological assets","606","expense","l10n_ro.ro_chart_template","False"
"ro_pcg_expense","Expenditure on goods","607","expense","l10n_ro.ro_chart_template","False"
"pcg_608","Packaging charges","608","expense","l10n_ro.ro_chart_template","False"
"pcg_6091","Trade discounts received - raw materials and consumables","6091","expense","l10n_ro.ro_chart_template","False"
"pcg_6092","Trade discounts received - other expenses","6092","expense","l10n_ro.ro_chart_template","False"
"pcg_611","Maintenance and repair costs","611","expense","l10n_ro.ro_chart_template","False"
"pcg_612","Expenses for royalties, management premises and rents","612","expense","l10n_ro.ro_chart_template","False"
"pcg_613","Insurance premium expenses","613","expense","l10n_ro.ro_chart_template","False"
"pcg_614","Study and research expenses","614","expense","l10n_ro.ro_chart_template","False"
"pcg_615","Staff training expenses","615","expense","l10n_ro.ro_chart_template","False"
"pcg_621","Expenses regarding collaborators","621","expense","l10n_ro.ro_chart_template","False"
"pcg_622","Expenses relating to commissions and fees","622","expense","l10n_ro.ro_chart_template","False"
"pcg_6231","Protocol expenses","6231","expense","l10n_ro.ro_chart_template","False"
"pcg_6232","Advertising and publicity expenses","6232","expense","l10n_ro.ro_chart_template","False"
"pcg_624","Expenses for transportation of goods and personnel","624","expense","l10n_ro.ro_chart_template","False"
"pcg_625","Travel, secondment and transfer expenses","625","expense","l10n_ro.ro_chart_template","False"
"pcg_626","Postage and telecommunications charges","626","expense","l10n_ro.ro_chart_template","False"
"pcg_627","Expenses with banking and similar services","627","expense","l10n_ro.ro_chart_template","False"
"pcg_628","Other expenses with services performed by third parties","628","expense","l10n_ro.ro_chart_template","False"
"pcg_6351","Expenses with other taxes, fees and similar payments","6351","expense","l10n_ro.ro_chart_template","False"
"pcg_6352","Expenses with other non-deductible taxes, duties and similar payments","6352","expense","l10n_ro.ro_chart_template","False"
"pcg_641","Staff salary expenses","641","expense","l10n_ro.ro_chart_template","False"
"pcg_6421","Expenses with benefits in kind granted to employees","6421","expense","l10n_ro.ro_chart_template","False"
"pcg_6422","Expenditure on vouchers granted to employees","6422","expense","l10n_ro.ro_chart_template","False"
"pcg_643","Remuneration expenses in equity instruments","643","expense","l10n_ro.ro_chart_template","False"
"pcg_644","Premium expenses representing staff profit sharing","644","expense","l10n_ro.ro_chart_template","False"
"pcg_6451","Expenses regarding the unit's contribution to social security","6451","expense","l10n_ro.ro_chart_template","False"
"pcg_6452","Expenses regarding the unit's contribution to unemployment benefit","6452","expense","l10n_ro.ro_chart_template","False"
"pcg_6453","Expenses regarding the employer's contribution for social health insurance","6453","expense","l10n_ro.ro_chart_template","False"
"pcg_6455","Expenses relating to the unit's contribution to life insurance","6455","expense","l10n_ro.ro_chart_template","False"
"pcg_6456","Expenses regarding the unit's contribution to voluntary pension funds","6456","expense","l10n_ro.ro_chart_template","False"
"pcg_6457","Expenses regarding the unit's contribution to voluntary health insurance premiums","6457","expense","l10n_ro.ro_chart_template","False"
"pcg_6458","Other insurance and social protection expenses","6458","expense","l10n_ro.ro_chart_template","False"
"pcg_646","Labor insurance contribution expenses","646","expense","l10n_ro.ro_chart_template","False"
"pcg_6511","Expenses occasioned by the establishment of the trust","6511","expense","l10n_ro.ro_chart_template","False"
"pcg_6512","Expenses from running trust operations","6512","expense","l10n_ro.ro_chart_template","False"
"pcg_6513","Expenses from the liquidation of trust operations","6513","expense","l10n_ro.ro_chart_template","False"
"pcg_652","Environmental protection expenses","652","expense","l10n_ro.ro_chart_template","False"
"pcg_654","Losses from sundry receivables and debtors","654","expense","l10n_ro.ro_chart_template","False"
"pcg_655","Expenses from revaluation of tangible assets","655","expense","l10n_ro.ro_chart_template","False"
"pcg_6581","Compensation, fines and penalties","6581","expense","l10n_ro.ro_chart_template","False"
"pcg_6582","Donations granted","6582","expense","l10n_ro.ro_chart_template","False"
"pcg_6583","Expenditure on divested assets and other capital operations","6583","expense","l10n_ro.ro_chart_template","False"
"pcg_6584","Expenditure on amounts or goods awarded as sponsorships","6584","expense","l10n_ro.ro_chart_template","False"
"pcg_6586","Expenses representing transfers and contributions due on the basis of special normative acts","6586","expense","l10n_ro.ro_chart_template","False"
"pcg_6587","Expenses related to calamities and other similar events","6587","expense","l10n_ro.ro_chart_template","False"
"pcg_65881","Other operating expenses","65881","expense","l10n_ro.ro_chart_template","False"
"pcg_65882","Other non-deductible operating expenses","65882","expense","l10n_ro.ro_chart_template","False"
"pcg_663","Losses on receivables related to holdings","663","expense","l10n_ro.ro_chart_template","False"
"pcg_6641","Expenses related to the financial fixed assets sold","6641","expense","l10n_ro.ro_chart_template","False"
"pcg_6642","Losses on short-term investments divested","6642","expense","l10n_ro.ro_chart_template","False"
"pcg_6651","Unfavorable exchange rate differences related to monetary items denominated in foreign currency","6651","expense","l10n_ro.ro_chart_template","False"
"pcg_6652","Unfavorable exchange rate differences from the measurement of monetary items that are part of the net investment in a foreign entity","6652","expense","l10n_ro.ro_chart_template","False"
"pcg_666","Interest charges","666","expense","l10n_ro.ro_chart_template","False"
"pcg_667","Expenses related to the discounts granted","667","expense","l10n_ro.ro_chart_template","False"
"pcg_668","Other financial expenses","668","expense","l10n_ro.ro_chart_template","False"
"pcg_6811","Operating expenses regarding depreciation of fixed assets","6811","expense","l10n_ro.ro_chart_template","False"
"pcg_6812","Operating expenses on provisions","6812","expense","l10n_ro.ro_chart_template","False"
"pcg_6813","Operating expenses related to adjustments for depreciation of fixed assets","6813","expense","l10n_ro.ro_chart_template","False"
"pcg_6814","Operating expenses regarding adjustments for impairment of current assets","6814","expense","l10n_ro.ro_chart_template","False"
"pcg_68151","Expenditures on production sold","68151","expense","l10n_ro.ro_chart_template","False"
"pcg_68152","Expenditure on the sale of goods","68152","expense","l10n_ro.ro_chart_template","False"
"pcg_6817","Operating expenses related to goodwill impairment adjustments","6817","expense","l10n_ro.ro_chart_template","False"
"pcg_6861","Expenditure on update of provisions","6861","expense","l10n_ro.ro_chart_template","False"
"pcg_6863","Financial expenses regarding adjustments for the loss of value of financial assets","6863","expense","l10n_ro.ro_chart_template","False"
"pcg_6864","Financial expenses regarding adjustments for the loss of value of current assets","6864","expense","l10n_ro.ro_chart_template","False"
"pcg_6865","Financial expenses regarding the amortization of differences related to government securities","6865","expense","l10n_ro.ro_chart_template","False"
"pcg_6868","Finance expenses related to the amortization of bond repayment premiums and other liabilities","6868","expense","l10n_ro.ro_chart_template","False"
"pcg_691","Income tax expenses","691","expense","l10n_ro.ro_chart_template","False"
"pcg_695","Expenses with the tax specific to some activities","695","expense","l10n_ro.ro_chart_template","False"
"pcg_698","Expenses with income tax and other taxes that do not appear in the items above","698","expense","l10n_ro.ro_chart_template","False"
"pcg_7015","Revenue from the sale of finished products","7015","income","l10n_ro.ro_chart_template","False"
"pcg_7017","Income from the sale of agricultural products","7017","income","l10n_ro.ro_chart_template","False"
"pcg_7018","Income from the sale of biological assets in the nature of stocks","7018","income","l10n_ro.ro_chart_template","False"
"pcg_702","Income from the sale of semi-finished products","702","income","l10n_ro.ro_chart_template","False"
"pcg_703","Income from the sale of residual products","703","income","l10n_ro.ro_chart_template","False"
"pcg_704","Revenue from services provided","704","income","l10n_ro.ro_chart_template","False"
"pcg_705","Income from studies and research","705","income","l10n_ro.ro_chart_template","False"
"pcg_706","Income from royalties, management premises and rents","706","income","l10n_ro.ro_chart_template","False"
"ro_pcg_sale","Income from sale of goods","707","income","l10n_ro.ro_chart_template","False"
"pcg_708","Income from miscellaneous activities","708","income","l10n_ro.ro_chart_template","False"
"pcg_709","Commercial discounts granted","709","income","l10n_ro.ro_chart_template","False"
"pcg_711","Revenues related to product inventory costs","711","income","l10n_ro.ro_chart_template","False"
"pcg_712","Revenues related to the costs of services in progress","712","income","l10n_ro.ro_chart_template","False"
"pcg_721","Income from the production of intangible assets","721","income","l10n_ro.ro_chart_template","False"
"pcg_722","Income from the production of tangible assets","722","income","l10n_ro.ro_chart_template","False"
"pcg_725","Income from the production of real estate investments","725","income","l10n_ro.ro_chart_template","False"
"pcg_7411","Income from operating subsidies related to turnover","7411","income","l10n_ro.ro_chart_template","False"
"pcg_7412","Income from operating subsidies for raw materials and materials","7412","income","l10n_ro.ro_chart_template","False"
"pcg_7413","Income from operating subsidies for other external expenditure","7413","income","l10n_ro.ro_chart_template","False"
"pcg_7414","Income from operating subsidies to pay staff","7414","income","l10n_ro.ro_chart_template","False"
"pcg_7415","Income from operating subsidies for insurance and social protection","7415","income","l10n_ro.ro_chart_template","False"
"pcg_7416","Income from operating subsidies for other operating expenses","7416","income","l10n_ro.ro_chart_template","False"
"pcg_7417","Income from operating subsidies in case of calamities and other similar events","7417","income","l10n_ro.ro_chart_template","False"
"pcg_7418","Income from operating subsidies for interest due","7418","income","l10n_ro.ro_chart_template","False"
"pcg_7419","Income from operating subsidies related to other income","7419","income","l10n_ro.ro_chart_template","False"
"pcg_7511","Income occasioned by the establishment of the trust","7511","income","l10n_ro.ro_chart_template","False"
"pcg_7512","Income from trust operations","7512","income","l10n_ro.ro_chart_template","False"
"pcg_7513","Proceeds from liquidation of trust operations","7513","income","l10n_ro.ro_chart_template","False"
"pcg_754","Income from reactivated receivables and sundry debtors","754","income","l10n_ro.ro_chart_template","False"
"pcg_755","Income from revaluation of tangible assets","755","income","l10n_ro.ro_chart_template","False"
"pcg_7581","Income from compensation, fines and penalties","7581","income","l10n_ro.ro_chart_template","False"
"pcg_7582","Income from donations received","7582","income","l10n_ro.ro_chart_template","False"
"pcg_7583","Proceeds from the sale of assets and other capital operations","7583","income","l10n_ro.ro_chart_template","False"
"pcg_7584","Income from investment subsidies","7584","income","l10n_ro.ro_chart_template","False"
"pcg_7586","Income representing due transfers based on special normative acts","7586","income","l10n_ro.ro_chart_template","False"
"pcg_7588","Other operating revenues","7588","income","l10n_ro.ro_chart_template","False"
"pcg_7611","Income from shares held in affiliated entities","7611","income","l10n_ro.ro_chart_template","False"
"pcg_7612","Income from shares held in associated entities","7612","income","l10n_ro.ro_chart_template","False"
"pcg_7613","Income from shares held in jointly controlled entities","7613","income","l10n_ro.ro_chart_template","False"
"pcg_7615","Income from other financial assets","7615","income","l10n_ro.ro_chart_template","False"
"pcg_762","Income from short-term financial investments","762","income","l10n_ro.ro_chart_template","False"
"pcg_7641","Income from financial fixed assets sold","7641","income","l10n_ro.ro_chart_template","False"
"pcg_7642","Gains on short-term investments ceded","7642","income","l10n_ro.ro_chart_template","False"
"pcg_7651","Favorable exchange rate differences related to monetary items denominated in foreign currency","7651","income","l10n_ro.ro_chart_template","False"
"pcg_7652","Favorable exchange rate differences from the valuation of monetary items that are part of the net investment in a foreign entity","7652","income","l10n_ro.ro_chart_template","False"
"pcg_766","Interest income","766","income","l10n_ro.ro_chart_template","False"
"pcg_767","Revenue from discounts obtained","767","income","l10n_ro.ro_chart_template","False"
"pcg_768","Other incomes","768","income","l10n_ro.ro_chart_template","False"
"pcg_7812","Income from provisions","7812","income","l10n_ro.ro_chart_template","False"
"pcg_7813","Income from adjustments for depreciation of fixed assets","7813","income","l10n_ro.ro_chart_template","False"
"pcg_7814","Income from adjustments for impairment of current assets","7814","income","l10n_ro.ro_chart_template","False"
"pcg_7815","Negative goodwill income","7815","income","l10n_ro.ro_chart_template","False"
"pcg_7863","Financial income from adjustments for the loss of value of financial assets","7863","income","l10n_ro.ro_chart_template","False"
"pcg_7864","Financial income from adjustments for the loss of value of current assets","7864","income","l10n_ro.ro_chart_template","False"
"pcg_7865","Financial income from the amortization of differences related to government securities","7865","income","l10n_ro.ro_chart_template","False"
"pcg_8011","Warranties and guarantees granted","8011","off_balance","l10n_ro.ro_chart_template","False"
"pcg_8018","Other commitments granted","8018","off_balance","l10n_ro.ro_chart_template","False"
"pcg_8021","Warranties and guarantees received","8021","off_balance","l10n_ro.ro_chart_template","False"
"pcg_8028","Other commitments received","8028","off_balance","l10n_ro.ro_chart_template","False"
"pcg_8031","Leased tangible assets","8031","off_balance","l10n_ro.ro_chart_template","False"
"pcg_8032","Material values received for processing or repair","8032","off_balance","l10n_ro.ro_chart_template","False"
"pcg_8033","Material values received in safekeeping or custody","8033","off_balance","l10n_ro.ro_chart_template","False"
"pcg_8034","Discharged debtors, follow up","8034","off_balance","l10n_ro.ro_chart_template","False"
"pcg_8035","Stocks in the nature of inventory items put into use","8035","off_balance","l10n_ro.ro_chart_template","False"
"pcg_8036","Royalties, management premises, rents and other similar liabilities","8036","off_balance","l10n_ro.ro_chart_template","False"
"pcg_8037","Expected notes not due","8037","off_balance","l10n_ro.ro_chart_template","False"
"pcg_8038","Assets received in administration, concession and rent","8038","off_balance","l10n_ro.ro_chart_template","False"
"pcg_8039","Other off-balance sheet values","8039","off_balance","l10n_ro.ro_chart_template","False"
"pcg_804","Green certificates","804","off_balance","l10n_ro.ro_chart_template","False"
"pcg_8051","Payable interest","8051","off_balance","l10n_ro.ro_chart_template","False"
"pcg_8052","Interest receivable","8052","off_balance","l10n_ro.ro_chart_template","False"
"pcg_806","Greenhouse gas emission certificates","806","off_balance","l10n_ro.ro_chart_template","False"
"pcg_807","Active contingent","807","off_balance","l10n_ro.ro_chart_template","False"
"pcg_808","Contingent liabilities","808","off_balance","l10n_ro.ro_chart_template","False"
"pcg_809","Receivables taken over by assignment","809","off_balance","l10n_ro.ro_chart_template","False"
"pcg_891","Opening balance sheet","891","off_balance","l10n_ro.ro_chart_template","False"
"pcg_892","Closing balance sheet","892","off_balance","l10n_ro.ro_chart_template","False"
"pcg_901","Internal expense settlements","901","off_balance","l10n_ro.ro_chart_template","False"
"pcg_902","Internal settlements on production obtained","902","off_balance","l10n_ro.ro_chart_template","False"
"pcg_903","Internal settlements of price differences","903","off_balance","l10n_ro.ro_chart_template","False"
"pcg_921","Core business expenses","921","off_balance","l10n_ro.ro_chart_template","False"
"pcg_922","Expenses of auxiliary activities","922","off_balance","l10n_ro.ro_chart_template","False"
"pcg_923","Indirect production costs","923","off_balance","l10n_ro.ro_chart_template","False"
"pcg_924","General administrative expenses","924","off_balance","l10n_ro.ro_chart_template","False"
"pcg_925","Selling expenses","925","off_balance","l10n_ro.ro_chart_template","False"
"pcg_931","Cost of production obtained","931","off_balance","l10n_ro.ro_chart_template","False"
"pcg_933","Cost of production in progress","933","off_balance","l10n_ro.ro_chart_template","False"
