"id","name","code","account_type","tag_ids","reconcile","non_trade","name@pl"
"chart75000300","Interest received","75.000.300","income_other","account.account_tag_financing","False","","Otrzymane odsetki"
"chart75000400","Income from disposal of investments","75.000.400","income","account.account_tag_investing,l10n_pl.K_3","False","","Przychody ze zbycia inwestycji"
"chart75000500","Revaluation income of investments","75.000.500","income_other","account.account_tag_investing","False","","Aktualizacja wartości inwestycji-przychody"
"chart75000600","Positive exchange rate differences","75.000.600","income_other","account.account_tag_financing","False","","Dodatnie różnice kursu walut"
"chart75000700","Extraordinary profits","75.000.700","income","","False","","Zyski nadzwyczajne"
"chart75000900","Other financial income","75.000.900","income_other","account.account_tag_financing","False","","Pozostałe przychody finansowe"
"chart75010100","Value of investments sold","75.010.100","expense","account.account_tag_investing,l10n_pl.K_7","False","","Wartość sprzedanych inwestycji"
"chart75010200","Impairment losses on investments costs","75.010.200","expense","account.account_tag_investing","False","","Odpisy z tytułu utraty wartości inwestycjikoszty"
"chart75010300","Interest paid","75.010.300","expense","account.account_tag_financing","False","","Odsetki zapłacone"
"chart75010400","Negative exchange rate differences","75.010.400","expense","account.account_tag_financing,l10n_pl.K_7","False","","Ujemne różnice kursu walut"
"chart75010500","Extraordinary losses","75.010.500","expense","","False","","Straty nadzwyczajne"
"chart75010900","Other financial costs","75.010.900","expense","account.account_tag_financing,l10n_pl.K_7","False","","Pozostałe koszty finansowe"
"chart76000100","Income from disposal of non-financial fixed assets","76.000.100","income","account.account_tag_investing,l10n_pl.K_2","False","","Przychody ze zbycia niefinansowych aktywów trwałych"
"chart76000200","Grants received","76.000.200","income","account.account_tag_financing,l10n_pl.K_2","False","","Otrzymane dotacje"
"chart76000300","Income from social services","76.000.300","income","account.account_tag_financing","False","","Przychody z usług socjalnych"
"chart76000400","Income from increase in value of non-financial fixed assets","76.000.400","income","account.account_tag_investing","False","","Przychody ze wzrostu wartości niefinansowych aktywów trwałych"
"chart76000900","Other remaining operating income","76.000.900","income","account.account_tag_operating,l10n_pl.K_2","False","","Inne pozostałe przychody operacyjne"
"chart76010100","Value of sold non-financial fixed assets","76.010.100","expense","account.account_tag_investing,l10n_pl.K_6","False","","Wartość sprzedanych niefinansowych aktywów trwałych"
"chart76010200","Grants provided","76.010.200","expense","account.account_tag_financing","False","","Dotacje przekazane"
"chart76010300","Impairment losses on non-financial assets","76.010.300","expense","account.account_tag_investing","False","","Odpisy z tytułu utraty wartości aktywów niefinansowych"
"chart76010900","Other remaining operating expenses","76.010.900","expense","account.account_tag_operating,l10n_pl.K_6","False","","Inne pozostałe koszty operacyjne"
"chart79000100","Cost of finished goods issued to own stores","79.000.100","expense","account.account_tag_operating","False","","Koszt wyrobów własnej produkcji wydanych do własnych sklepów"
"chart79000200","Cost of benefits for fixed assets under construction","79.000.200","expense","account.account_tag_investing","False","","Koszt wytworzenia świadczeń na rzecz środków trwałych w budowie"
"chart79000300","Cost of completed development work","79.000.300","expense","account.account_tag_operating","False","","Koszt wytworzenia zakończonych prac rozwojowych"
"chart79000400","Cost of products deemed to be shortages","79.000.400","expense","account.account_tag_operating","False","","Koszt wytworzenia produktów uznanych za niedobory"
"chart79000500","Cost of discontinuing a type of activity","79.000.500","expense","account.account_tag_operating","False","","Koszt zaniechania określonego rodzaju działalności"
"chart80000100","Share capital","80.000.100","equity","","False","","Kapitał podstawowy"
"chart80000200","Payments due to share capital (negative amount)","80.000.200","asset_current","","False","","Należne wpłaty na kapitał podstawowy (wielkość ujemna)"
"chart80000300","Own shares (negative amount)","80.000.300","asset_current","","False","","Udziały (akcje) własne (wielkość ujemna)"
"chart80000400","Write-downs of net profit during the fiscal year (negative amount)","80.000.400","equity","","False","","Odpisy z zysku netto w ciągu roku obrotowego (wielkość ujemna)"
"chart81010100","Spare capital","81.010.100","equity","","False","","Kapitał zapasowy"
"chart81020100","Reserve capital","81.020.100","equity","","False","","Kapitał rezerwowy"
"chart81030100","Revaluation capital","81.030.100","equity","","False","","Kapitał z aktualizacji wyceny"
"chart81040100","Separate capitals (funds) in the statutory unit and establishments (branches) independently preparing the balance sheet","81.040.100","equity","","False","","Kapitały wydzielone w jednostce statutowej i zakładach (oddziałach) samodzielnie sporządzających bilans"
"chart82000100","Financial result settlements","82.000.100","equity","","False","","Rozliczenia wyniku finansowego"
"chart83000100","Long-term provision for pensions and similar benefits","83.000.100","liability_non_current","","False","","Rezerwa długoterminowa na świadczenia emerytalne i podobne"
"chart83000200","Short-term provision for pensions and similar benefits","83.000.200","liability_current","","False","","Rezerwa krótkoterminowa na świadczenia emerytalne i podobne"
"chart83010000","Provision for deferred income tax","83.010.000","liability_current","","False","","Rezerwa z tytułu odroczonego podatku dochodowego"
"chart83010100","Other long-term provisions","83.010.100","liability_non_current","","False","","Pozostałe rezerwy długoterminowe"
"chart83010200","Other short-term provisions","83.010.200","liability_current","","False","","Pozostałe rezerwy krótkoterminowe"
"chart84010000","Negative goodwill","84.010.000","liability_non_current","","False","","Ujemna wartość firmy"
"chart84020100","Other long-term prepayments","84.020.100","liability_non_current","","False","","Inne rozliczenia międzyokresowe długoterminowe"
"chart84020200","Other short-term prepayments","84.020.200","liability_current","","False","","Inne rozliczenia międzyokresowe krótkoterminowe"
"chart85010100","Company social benefits fund","85.010.100","liability_current","","False","","Zakładowy fundusz świadczeń socjalnych"
"chart85020100","Company fund for rehabilitation of disabled persons","85.020.100","liability_current","","False","","Zakładowy fundusz rehabilitacji osób niepełnosprawnych"
"chart85020200","Reward fund","85.020.200","liability_current","","False","","Fundusz nagród"
"chart85020300","Fund for renovation of housing resources","85.020.300","liability_current","","False","","Fundusz na remont zasobów mieszkaniowych"
"chart86000100","Financial result","86.000.100","equity_unaffected","","False","","Wynik finansowy"
"chart87000100","Corporate income tax","87.000.100","expense","account.account_tag_financing","False","","Podatek dochodowy od osób prawnych"
"chart87000900","Other mandatory charges to the financial result","87.000.900","expense","account.account_tag_financing","False","","Inne obowiązkowe obciążenia wyniku finansowego"
