id,code,name,tax_category
eco_new_acti_463013,463013,"VENTA AL POR MAYOR DE PRODUCTOS DEL MAR (PESCADOS, MARISCOS Y ALGAS)",1
eco_new_acti_463014,463014,VENTA AL POR MAYOR DE PRODUCTOS DE CONFITERÍA,1
eco_new_acti_463019,463019,"VENTA AL POR MAYOR DE HUEVOS, LÁCTEOS, ABARROTES Y DE OTROS ALIMENTOS N.C.P.",1
eco_new_acti_463020,463020,VENTA AL POR MAYOR DE BEBIDAS ALCOHÓLICAS Y NO ALCOHÓLICAS,1
eco_new_acti_463030,463030,VENTA AL POR MAYOR DE TABACO,1
eco_new_acti_464100,464100,"VENTA AL POR MAYOR DE PRODUCTOS TEXTILES, PRENDAS DE VESTIR Y CALZADO",1
eco_new_acti_464901,464901,"VENTA AL POR MAYOR DE MUEBLES, EXCEPTO MUEBLES DE OFICINA",1
eco_new_acti_464902,464902,VENTA AL POR MAYOR DE ARTÍCULOS ELÉCTRICOS Y ELECTRÓNICOS PARA EL HOGAR,1
eco_new_acti_464903,464903,"VENTA AL POR MAYOR DE ARTÍCULOS DE PERFUMERÍA, DE TOCADOR Y COSMÉTICOS",1
eco_new_acti_464904,464904,VENTA AL POR MAYOR DE ARTÍCULOS DE PAPELERÍA Y ESCRITORIO,1
eco_new_acti_464905,464905,VENTA AL POR MAYOR DE LIBROS,1
eco_new_acti_464906,464906,VENTA AL POR MAYOR DE DIARIOS Y REVISTAS,1
eco_new_acti_464907,464907,VENTA AL POR MAYOR DE PRODUCTOS FARMACÉUTICOS Y MEDICINALES,1
eco_new_acti_464908,464908,VENTA AL POR MAYOR DE INSTRUMENTOS CIENTÍFICOS Y QUIRÚRGICOS,1
eco_new_acti_464909,464909,VENTA AL POR MAYOR DE OTROS ENSERES DOMÉSTICOS N.C.P.,1
eco_new_acti_465100,465100,"VENTA AL POR MAYOR DE COMPUTADORES, EQUIPO PERIFÉRICO Y PROGRAMAS INFORMÁTICOS",1
eco_new_acti_465200,465200,"VENTA AL POR MAYOR DE EQUIPO, PARTES Y PIEZAS ELECTRÓNICOS Y DE TELECOMUNICACIONES",1
eco_new_acti_465300,465300,"VENTA AL POR MAYOR DE MAQUINARIA, EQUIPO Y MATERIALES AGROPECUARIOS",1
eco_new_acti_465901,465901,"VENTA AL POR MAYOR DE MAQUINARIA METALÚRGICA, PARA LA MINERÍA, EXTRACCIÓN DE PETRÓLEO Y CONSTRUCCIÓN",1
eco_new_acti_465902,465902,"VENTA AL POR MAYOR DE MAQUINARIA PARA LA ELABORACIÓN DE ALIMENTOS, BEBIDAS Y TABACO",1
eco_new_acti_465903,465903,"VENTA AL POR MAYOR DE MAQUINARIA PARA LA INDUSTRIA TEXTIL, DEL CUERO Y DEL CALZADO",1
eco_new_acti_465904,465904,VENTA AL POR MAYOR DE MAQUINARIA Y EQUIPO DE OFICINA; VENTA AL POR MAYOR DE MUEBLES DE OFICINA,1
eco_new_acti_465905,465905,"VENTA AL POR MAYOR DE EQUIPO DE TRANSPORTE(EXCEPTO VEHÍCULOS AUTOMOTORES, MOTOCICLETAS Y BICICLETAS)",1
eco_new_acti_465909,465909,VENTA AL POR MAYOR DE OTROS TIPOS DE MAQUINARIA Y EQUIPO N.C.P.,1
eco_new_acti_466100,466100,"VENTA AL POR MAYOR DE COMBUSTIBLES SÓLIDOS, LÍQUIDOS Y GASEOSOS Y PRODUCTOS CONEXOS",1
eco_new_acti_466200,466200,VENTA AL POR MAYOR DE METALES Y MINERALES METALÍFEROS,1
eco_new_acti_466301,466301,VENTA AL POR MAYOR DE MADERA EN BRUTO Y PRODUCTOS PRIMARIOS DE LA ELABORACIÓN DE MADERA,1
eco_new_acti_466302,466302,"VENTA AL POR MAYOR DE MATERIALES DE CONSTRUCCIÓN, ARTÍCULOS DE FERRETERÍA, GASFITERÍA Y CALEFACCIÓN",1
eco_new_acti_466901,466901,VENTA AL POR MAYOR DE PRODUCTOS QUÍMICOS,1
eco_new_acti_466902,466902,VENTA AL POR MAYOR DE DESECHOS METÁLICOS (CHATARRA),1
eco_new_acti_466909,466909,"VENTA AL POR MAYOR DE DESPERDICIOS, DESECHOS Y OTROS PRODUCTOS N.C.P.",1
eco_new_acti_469000,469000,VENTA AL POR MAYOR NO ESPECIALIZADA,1
eco_new_acti_471100,471100,"VENTA AL POR MENOR EN COMERCIOS DE ALIMENTOS, BEBIDAS O TABACO (SUPERMERCADOS E HIPERMERCADOS)",1
eco_new_acti_471910,471910,VENTA AL POR MENOR EN COMERCIOS DE VESTUARIO Y PRODUCTOS PARA EL HOGAR (GRANDES TIENDAS),1
eco_new_acti_471990,471990,OTRAS ACTIVIDADES DE VENTA AL POR MENOR EN COMERCIOS NO ESPECIALIZADOS N.C.P.,1
eco_new_acti_472101,472101,VENTA AL POR MENOR DE ALIMENTOS EN COMERCIOS ESPECIALIZADOS (ALMACENES PEQUEÑOS Y MINIMARKET),1
eco_new_acti_472102,472102,VENTA AL POR MENOR EN COMERCIOS ESPECIALIZADOS DE CARNE Y PRODUCTOS CÁRNICOS,1
eco_new_acti_472103,472103,VENTA AL POR MENOR EN COMERCIOS ESPECIALIZADOS DE FRUTAS Y VERDURAS (VERDULERÍAS),1
eco_new_acti_472104,472104,"VENTA AL POR MENOR EN COMERCIOS ESPECIALIZADOS DE PESCADO, MARISCOS Y PRODUCTOS CONEXOS",1
eco_new_acti_472105,472105,VENTA AL POR MENOR EN COMERCIOS ESPECIALIZADOS DE PRODUCTOS DE PANADERÍA Y PASTELERÍA,1
eco_new_acti_472109,472109,"VENTA AL POR MENOR EN COMERCIOS ESPECIALIZADOS DE HUEVOS, CONFITES Y PRODUCTOS ALIMENTICIOS N.C.P.",1
eco_new_acti_472200,472200,VENTA AL POR MENOR DE BEBIDAS ALCOHÓLICAS Y NO ALCOHÓLICAS EN COMERCIOS ESPECIALIZADOS (BOTILLERÍAS),1
eco_new_acti_472300,472300,VENTA AL POR MENOR DE TABACO Y PRODUCTOS DE TABACO EN COMERCIOS ESPECIALIZADOS,1
eco_new_acti_473000,473000,VENTA AL POR MENOR DE COMBUSTIBLES PARA VEHÍCULOS AUTOMOTORES EN COMERCIOS ESPECIALIZADOS,1
eco_new_acti_474100,474100,"VENTA AL POR MENOR DE COMPUTADORES, EQUIPO PERIFÉRICO, PROGRAMAS INFORMÁTICOS Y EQUIPO DE TELECOM.",1
eco_new_acti_474200,474200,VENTA AL POR MENOR DE EQUIPO DE SONIDO Y DE VIDEO EN COMERCIOS ESPECIALIZADOS,1
eco_new_acti_475100,475100,"VENTA AL POR MENOR DE TELAS, LANAS, HILOS Y SIMILARES EN COMERCIOS ESPECIALIZADOS",1
eco_new_acti_475201,475201,VENTA AL POR MENOR DE ARTÍCULOS DE FERRETERÍA Y MATERIALES DE CONSTRUCCIÓN,1
eco_new_acti_475202,475202,"VENTA AL POR MENOR DE PINTURAS, BARNICES Y LACAS EN COMERCIOS ESPECIALIZADOS",1
eco_new_acti_475203,475203,VENTA AL POR MENOR DE PRODUCTOS DE VIDRIO EN COMERCIOS ESPECIALIZADOS,1
eco_new_acti_475300,475300,"VENTA AL POR MENOR DE TAPICES, ALFOMBRAS Y CUBRIMIENTOS PARA PAREDES Y PISOS",1
eco_new_acti_475901,475901,VENTA AL POR MENOR DE MUEBLES Y COLCHONES EN COMERCIOS ESPECIALIZADOS,1
eco_new_acti_475902,475902,VENTA AL POR MENOR DE INSTRUMENTOS MUSICALES EN COMERCIOS ESPECIALIZADOS,1
eco_new_acti_475909,475909,"VENTA AL POR MENOR DE APARATOS ELÉCTRICOS, TEXTILES PARA EL HOGAR Y OTROS ENSERES DOMÉSTICOS N.C.P.",1
eco_new_acti_476101,476101,VENTA AL POR MENOR DE LIBROS EN COMERCIOS ESPECIALIZADOS,1
eco_new_acti_476102,476102,VENTA AL POR MENOR DE DIARIOS Y REVISTAS EN COMERCIOS ESPECIALIZADOS,1
eco_new_acti_476103,476103,VENTA AL POR MENOR DE ARTÍCULOS DE PAPELERÍA Y ESCRITORIO EN COMERCIOS ESPECIALIZADOS,1
eco_new_acti_476200,476200,VENTA AL POR MENOR DE GRABACIONES DE MÚSICA Y DE VIDEO EN COMERCIOS ESPECIALIZADOS,1
eco_new_acti_476301,476301,VENTA AL POR MENOR DE ARTÍCULOS DE CAZA Y PESCA EN COMERCIOS ESPECIALIZADOS,1
eco_new_acti_476302,476302,VENTA AL POR MENOR DE BICICLETAS Y SUS REPUESTOS EN COMERCIOS ESPECIALIZADOS,1
eco_new_acti_476309,476309,VENTA AL POR MENOR DE OTROS ARTÍCULOS Y EQUIPOS DE DEPORTE N.C.P.,1
eco_new_acti_476400,476400,VENTA AL POR MENOR DE JUEGOS Y JUGUETES EN COMERCIOS ESPECIALIZADOS,1
eco_new_acti_477101,477101,VENTA AL POR MENOR DE CALZADO EN COMERCIOS ESPECIALIZADOS,1
eco_new_acti_477102,477102,VENTA AL POR MENOR DE PRENDAS Y ACCESORIOS DE VESTIR EN COMERCIOS ESPECIALIZADOS,1
eco_new_acti_477103,477103,"VENTA AL POR MENOR DE CARTERAS, MALETAS Y OTROS ACCESORIOS DE VIAJE EN COMERCIOS ESPECIALIZADOS",1
eco_new_acti_477201,477201,VENTA AL POR MENOR DE PRODUCTOS FARMACÉUTICOS Y MEDICINALES EN COMERCIOS ESPECIALIZADOS,1
eco_new_acti_477202,477202,VENTA AL POR MENOR DE ARTÍCULOS ORTOPÉDICOS EN COMERCIOS ESPECIALIZADOS,1
eco_new_acti_477203,477203,"VENTA AL POR MENOR DE ARTÍCULOS DE PERFUMERÍA, DE TOCADOR Y COSMÉTICOS EN COMERCIOS ESPECIALIZADOS",1
eco_new_acti_477310,477310,VENTA AL POR MENOR DE GAS LICUADO EN BOMBONAS (CILINDROS) EN COMERCIOS ESPECIALIZADOS,1
eco_new_acti_477391,477391,VENTA AL POR MENOR DE ALIMENTO Y ACCESORIOS PARA MASCOTAS EN COMERCIOS ESPECIALIZADOS,1
eco_new_acti_477392,477392,VENTA AL POR MENOR DE ARMAS Y MUNICIONES EN COMERCIOS ESPECIALIZADOS,1
eco_new_acti_477393,477393,VENTA AL POR MENOR DE ARTÍCULOS ÓPTICOS EN COMERCIOS ESPECIALIZADOS,1
eco_new_acti_477394,477394,"VENTA AL POR MENOR DE ARTÍCULOS DE JOYERÍA, BISUTERÍA Y RELOJERÍA EN COMERCIOS ESPECIALIZADOS",1
eco_new_acti_477395,477395,"VENTA AL POR MENOR DE CARBÓN, LEÑA Y OTROS COMBUSTIBLES DE USO DOMÉSTICO EN COMERCIOS ESPECIALIZADOS",1
eco_new_acti_477396,477396,"VENTA AL POR MENOR DE RECUERDOS, ARTESANÍAS Y ARTÍCULOS RELIGIOSOS EN COMERCIOS ESPECIALIZADOS",1
eco_new_acti_477397,477397,"VENTA AL POR MENOR DE FLORES, PLANTAS, ARBOLES, SEMILLAS Y ABONOS EN COMERCIOS ESPECIALIZADOS",1
eco_new_acti_477398,477398,VENTA AL POR MENOR DE MASCOTAS EN COMERCIOS ESPECIALIZADOS,1
eco_new_acti_477399,477399,VENTA AL POR MENOR DE OTROS PRODUCTOS EN COMERCIOS ESPECIALIZADOS N.C.P.,1
eco_new_acti_477401,477401,VENTA AL POR MENOR DE ANTIGÜEDADES EN COMERCIOS,1
eco_new_acti_477402,477402,VENTA AL POR MENOR DE ROPA USADA EN COMERCIOS,1
eco_new_acti_477409,477409,VENTA AL POR MENOR DE OTROS ARTÍCULOS DE SEGUNDA MANO EN COMERCIOS N.C.P.,1
eco_new_acti_478100,478100,"VENTA AL POR MENOR DE ALIMENTOS, BEBIDAS Y TABACO EN PUESTOS DE VENTA Y MERCADOS (INCLUYE FERIAS)",1
eco_new_acti_478200,478200,"VENTA AL POR MENOR DE PRODUCTOS TEXTILES, PRENDAS DE VESTIR Y CALZADO EN PUESTOS DE VENTA Y MERCADOS",1
eco_new_acti_478900,478900,VENTA AL POR MENOR DE OTROS PRODUCTOS EN PUESTOS DE VENTA Y MERCADOS (INCLUYE FERIAS),1
eco_new_acti_479100,479100,"VENTA AL POR MENOR POR CORREO, POR INTERNET Y VÍA TELEFÓNICA",1
eco_new_acti_479901,479901,VENTA AL POR MENOR REALIZADA POR INDEPENDIENTES EN LA LOCOMOCIÓN COLECTIVA (LEY 20.388),1
eco_new_acti_479902,479902,VENTA AL POR MENOR MEDIANTE MAQUINAS EXPENDEDORAS,1
eco_new_acti_479903,479903,VENTA AL POR MENOR POR COMISIONISTAS (NO DEPENDIENTES DE COMERCIOS),1
eco_new_acti_479909,479909,"OTRAS ACTIVIDADES DE VENTA POR MENOR NO REALIZADAS EN COMERCIOS, PUESTOS DE VENTA O MERCADOS N.C.P.",1
eco_new_acti_491100,491100,TRANSPORTE INTERURBANO DE PASAJEROS POR FERROCARRIL,1
eco_new_acti_491200,491200,TRANSPORTE DE CARGA POR FERROCARRIL,1
eco_new_acti_492110,492110,TRANSPORTE URBANO Y SUBURBANO DE PASAJEROS VÍA METRO Y METROTREN,1
eco_new_acti_492120,492120,TRANSPORTE URBANO Y SUBURBANO DE PASAJEROS VÍA LOCOMOCIÓN COLECTIVA,1
eco_new_acti_492130,492130,TRANSPORTE DE PASAJEROS VÍA TAXI COLECTIVO,1
eco_new_acti_492190,492190,OTRAS ACTIVIDADES DE TRANSPORTE URBANO Y SUBURBANO DE PASAJEROS POR VÍA TERRESTRE N.C.P.,1
eco_new_acti_492210,492210,SERVICIOS DE TRANSPORTE DE ESCOLARES,1
eco_new_acti_492220,492220,SERVICIOS DE TRANSPORTE DE TRABAJADORES,1
eco_new_acti_492230,492230,SERVICIOS DE TRANSPORTE DE PASAJEROS EN TAXIS LIBRES Y RADIOTAXIS,1
eco_new_acti_492240,492240,SERVICIOS DE TRANSPORTE A TURISTAS,1
eco_new_acti_492250,492250,TRANSPORTE DE PASAJEROS EN BUSES INTERURBANOS,1
eco_new_acti_492290,492290,OTRAS ACTIVIDADES DE TRANSPORTE DE PASAJEROS POR VÍA TERRESTRE N.C.P.,1
eco_new_acti_492300,492300,TRANSPORTE DE CARGA POR CARRETERA,1
eco_new_acti_493010,493010,TRANSPORTE POR OLEODUCTOS,1
eco_new_acti_493020,493020,TRANSPORTE POR GASODUCTOS,1
eco_new_acti_493090,493090,OTRAS ACTIVIDADES DE TRANSPORTE POR TUBERÍAS N.C.P.,1
eco_new_acti_501100,501100,TRANSPORTE DE PASAJEROS MARÍTIMO Y DE CABOTAJE,1
eco_new_acti_501200,501200,TRANSPORTE DE CARGA MARÍTIMO Y DE CABOTAJE,1
eco_new_acti_502100,502100,TRANSPORTE DE PASAJEROS POR VÍAS DE NAVEGACIÓN INTERIORES,1
eco_new_acti_502200,502200,TRANSPORTE DE CARGA POR VÍAS DE NAVEGACIÓN INTERIORES,1
eco_new_acti_511000,511000,TRANSPORTE DE PASAJEROS POR VÍA AÉREA,1
eco_new_acti_512000,512000,TRANSPORTE DE CARGA POR VÍA AÉREA,1
eco_new_acti_521001,521001,EXPLOTACIÓN DE FRIGORÍFICOS PARA ALMACENAMIENTO Y DEPÓSITO,1
eco_new_acti_521009,521009,OTROS SERVICIOS DE ALMACENAMIENTO Y DEPÓSITO N.C.P.,1
eco_new_acti_522110,522110,EXPLOTACIÓN DE TERMINALES TERRESTRES DE PASAJEROS,1
eco_new_acti_522120,522120,EXPLOTACIÓN DE ESTACIONAMIENTOS DE VEHÍCULOS AUTOMOTORES Y PARQUÍMETROS,1
eco_new_acti_522130,522130,SERVICIOS PRESTADOS POR CONCESIONARIOS DE CARRETERAS,1
eco_new_acti_522190,522190,ACTIVIDADES DE SERVICIOS VINCULADAS AL TRANSPORTE TERRESTRE N.C.P.,1
eco_new_acti_522200,522200,ACTIVIDADES DE SERVICIOS VINCULADAS AL TRANSPORTE ACUÁTICO,1
eco_new_acti_522300,522300,ACTIVIDADES DE SERVICIOS VINCULADAS AL TRANSPORTE AÉREO,1
eco_new_acti_522400,522400,MANIPULACIÓN DE LA CARGA,1
eco_new_acti_522910,522910,AGENCIAS DE ADUANAS,1
eco_new_acti_522920,522920,AGENCIAS DE NAVES,1
eco_new_acti_522990,522990,OTRAS ACTIVIDADES DE APOYO AL TRANSPORTE N.C.P.,1
eco_new_acti_531000,531000,ACTIVIDADES POSTALES,1
eco_new_acti_532000,532000,ACTIVIDADES DE MENSAJERÍA,1
eco_new_acti_551001,551001,ACTIVIDADES DE HOTELES,1
eco_new_acti_551002,551002,ACTIVIDADES DE MOTELES,1
eco_new_acti_551003,551003,ACTIVIDADES DE RESIDENCIALES PARA TURISTAS,1
eco_new_acti_551009,551009,OTRAS ACTIVIDADES DE ALOJAMIENTO PARA TURISTAS N.C.P.,1
eco_new_acti_552000,552000,ACTIVIDADES DE CAMPING Y DE PARQUES PARA CASAS RODANTES,1
eco_new_acti_559001,559001,ACTIVIDADES DE RESIDENCIALES PARA ESTUDIANTES Y TRABAJADORES,1
eco_new_acti_559009,559009,OTRAS ACTIVIDADES DE ALOJAMIENTO N.C.P.,1
eco_new_acti_561000,561000,ACTIVIDADES DE RESTAURANTES Y DE SERVICIO MÓVIL DE COMIDAS,1
eco_new_acti_562100,562100,SUMINISTRO DE COMIDAS POR ENCARGO (SERVICIOS DE BANQUETERÍA),1
eco_new_acti_562900,562900,SUMINISTRO INDUSTRIAL DE COMIDAS POR ENCARGO; CONCESIÓN DE SERVICIOS DE ALIMENTACIÓN,1
eco_new_acti_563001,563001,"ACTIVIDADES DE DISCOTECAS Y CABARET (NIGHT CLUB), CON PREDOMINIO DEL SERVICIO DE BEBIDAS",1
eco_new_acti_563009,563009,OTRAS ACTIVIDADES DE SERVICIO DE BEBIDAS N.C.P.,1
eco_new_acti_581100,581100,EDICIÓN DE LIBROS,1
eco_new_acti_581200,581200,EDICIÓN DE DIRECTORIOS Y LISTAS DE CORREO,1
eco_new_acti_581300,581300,"EDICIÓN DE DIARIOS, REVISTAS Y OTRAS PUBLICACIONES PERIÓDICAS",1
eco_new_acti_581900,581900,OTRAS ACTIVIDADES DE EDICIÓN,1
eco_new_acti_582000,582000,EDICIÓN DE PROGRAMAS INFORMÁTICOS,1
eco_new_acti_591100,591100,"ACTIVIDADES DE PRODUCCIÓN DE PELÍCULAS CINEMATOGRÁFICAS, VIDEOS Y PROGRAMAS DE TELEVISIÓN",1
eco_new_acti_591200,591200,"ACTIVIDADES DE POSTPRODUCCIÓN DE PELÍCULAS CINEMATOGRÁFICAS, VIDEOS Y PROGRAMAS DE TELEVISIÓN",1
eco_new_acti_591300,591300,"ACTIVIDADES DE DISTRIBUCIÓN DE PELÍCULAS CINEMATOGRÁFICAS, VIDEOS Y PROGRAMAS DE TELEVISIÓN",1
eco_new_acti_591400,591400,ACTIVIDADES DE EXHIBICIÓN DE PELÍCULAS CINEMATOGRÁFICAS Y CINTAS DE VIDEO,1
eco_new_acti_592000,592000,ACTIVIDADES DE GRABACIÓN DE SONIDO Y EDICIÓN DE MÚSICA,1
eco_new_acti_601000,601000,TRANSMISIONES DE RADIO,1
eco_new_acti_602000,602000,PROGRAMACIÓN Y TRANSMISIONES DE TELEVISIÓN,1
eco_new_acti_611010,611010,TELEFONÍA FIJA,1
eco_new_acti_611020,611020,TELEFONÍA LARGA DISTANCIA,1
eco_new_acti_611030,611030,TELEVISIÓN DE PAGO POR CABLE,1
eco_new_acti_611090,611090,OTROS SERVICIOS DE TELECOMUNICACIONES ALÁMBRICAS N.C.P.,1
eco_new_acti_612010,612010,TELEFONÍA MÓVIL CELULAR,1
eco_new_acti_612020,612020,RADIOCOMUNICACIONES MÓVILES,1
eco_new_acti_612030,612030,TELEVISIÓN DE PAGO INALÁMBRICA,1
eco_new_acti_612090,612090,OTROS SERVICIOS DE TELECOMUNICACIONES INALÁMBRICAS N.C.P.,1
eco_new_acti_613010,613010,TELEFONÍA MÓVIL SATELITAL,1
eco_new_acti_613020,613020,TELEVISIÓN DE PAGO SATELITAL,1
eco_new_acti_613090,613090,OTROS SERVICIOS DE TELECOMUNICACIONES POR SATÉLITE N.C.P.,1
eco_new_acti_619010,619010,CENTROS DE LLAMADOS Y CENTROS DE ACCESO A INTERNET,1
eco_new_acti_619090,619090,OTRAS ACTIVIDADES DE TELECOMUNICACIONES N.C.P.,1
eco_new_acti_620100,620100,ACTIVIDADES DE PROGRAMACIÓN INFORMÁTICA,2
eco_new_acti_620200,620200,ACTIVIDADES DE CONSULTORÍA DE INFORMÁTICA Y DE GESTIÓN DE INSTALACIONES INFORMÁTICAS,1
eco_new_acti_620900,620900,OTRAS ACTIVIDADES DE TECNOLOGÍA DE LA INFORMACIÓN Y DE SERVICIOS INFORMÁTICOS,1
eco_new_acti_631100,631100,"PROCESAMIENTO DE DATOS, HOSPEDAJE Y ACTIVIDADES CONEXAS",1
eco_new_acti_631200,631200,PORTALES WEB,1
eco_new_acti_639100,639100,ACTIVIDADES DE AGENCIAS DE NOTICIAS,1
eco_new_acti_639900,639900,OTRAS ACTIVIDADES DE SERVICIOS DE INFORMACIÓN N.C.P.,1
eco_new_acti_641100,641100,BANCA CENTRAL,1
eco_new_acti_641910,641910,ACTIVIDADES BANCARIAS,1
eco_new_acti_641990,641990,OTROS TIPOS DE INTERMEDIACIÓN MONETARIA N.C.P.,1
eco_new_acti_642000,642000,ACTIVIDADES DE SOCIEDADES DE CARTERA,1
eco_new_acti_643000,643000,FONDOS Y SOCIEDADES DE INVERSIÓN Y ENTIDADES FINANCIERAS SIMILARES,1
eco_new_acti_649100,649100,LEASING FINANCIERO,1
eco_new_acti_649201,649201,FINANCIERAS,1
eco_new_acti_649202,649202,ACTIVIDADES DE CRÉDITO PRENDARIO,1
eco_new_acti_649203,649203,CAJAS DE COMPENSACIÓN,1
eco_new_acti_649209,649209,OTRAS ACTIVIDADES DE CONCESIÓN DE CRÉDITO N.C.P.,1
eco_new_acti_649900,649900,"OTRAS ACTIVIDADES DE SERVICIOS FINANCIEROS, EXCEPTO LAS DE SEGUROS Y FONDOS DE PENSIONES N.C.P.",1
eco_new_acti_651100,651100,SEGUROS DE VIDA,1
eco_new_acti_651210,651210,"SEGUROS GENERALES, EXCEPTO ACTIVIDADES DE ISAPRES",1
eco_new_acti_651220,651220,ACTIVIDADES DE ISAPRES,1
eco_new_acti_652000,652000,REASEGUROS,1
eco_new_acti_653000,653000,FONDOS DE PENSIONES,1
eco_new_acti_661100,661100,ADMINISTRACIÓN DE MERCADOS FINANCIEROS,1
eco_new_acti_661201,661201,ACTIVIDADES DE SECURITIZADORAS,1
eco_new_acti_661202,661202,CORREDORES DE BOLSA,1
eco_new_acti_661203,661203,AGENTES DE VALORES,1
eco_new_acti_661204,661204,ACTIVIDADES DE CASAS DE CAMBIO Y OPERADORES DE DIVISA,1
eco_new_acti_661209,661209,OTROS SERVICIOS DE CORRETAJE DE VALORES Y COMMODITIES N.C.P.,1
eco_new_acti_661901,661901,ACTIVIDADES DE CÁMARAS DE COMPENSACIÓN,1
eco_new_acti_661902,661902,ADMINISTRACIÓN DE TARJETAS DE CRÉDITO,1
eco_new_acti_661903,661903,EMPRESAS DE ASESORÍA Y CONSULTORÍA EN INVERSIÓN FINANCIERA; SOCIEDADES DE APOYO AL GIRO,1
eco_new_acti_661904,661904,ACTIVIDADES DE CLASIFICADORAS DE RIESGO,1
eco_new_acti_661909,661909,OTRAS ACTIVIDADES AUXILIARES DE LAS ACTIVIDADES DE SERVICIOS FINANCIEROS N.C.P.,1
eco_new_acti_662100,662100,EVALUACIÓN DE RIESGOS Y DAÑOS (INCLUYE ACTIVIDADES DE LIQUIDADORES DE SEGUROS),2
eco_new_acti_662200,662200,ACTIVIDADES DE AGENTES Y CORREDORES DE SEGUROS,1
eco_new_acti_662900,662900,OTRAS ACTIVIDADES AUXILIARES DE LAS ACTIVIDADES DE SEGUROS Y FONDOS DE PENSIONES,nd
eco_new_acti_663010,663010,ADMINISTRADORAS DE FONDOS DE PENSIONES (AFP),1
eco_new_acti_663091,663091,ADMINISTRADORAS DE FONDOS DE INVERSIÓN,1
eco_new_acti_663092,663092,ADMINISTRADORAS DE FONDOS MUTUOS,1
eco_new_acti_663093,663093,ADMINISTRADORAS DE FICES (FONDOS DE INVERSIÓN DE CAPITAL EXTRANJERO),1
eco_new_acti_663094,663094,ADMINISTRADORAS DE FONDOS PARA LA VIVIENDA,1
eco_new_acti_663099,663099,ADMINISTRADORAS DE FONDOS PARA OTROS FINES N.C.P.,1
eco_new_acti_681011,681011,ALQUILER DE BIENES INMUEBLES AMOBLADOS O CON EQUIPOS Y MAQUINARIAS,1
eco_new_acti_681012,681012,"COMPRA, VENTA Y ALQUILER (EXCEPTO AMOBLADOS) DE INMUEBLES",1
eco_new_acti_681020,681020,SERVICIOS IMPUTADOS DE ALQUILER DE VIVIENDAS,1
eco_new_acti_682000,682000,ACTIVIDADES INMOBILIARIAS REALIZADAS A CAMBIO DE UNA RETRIBUCIÓN O POR CONTRATA,nd
eco_new_acti_691001,691001,SERVICIOS DE ASESORAMIENTO Y REPRESENTACIÓN JURÍDICA,2
eco_new_acti_691002,691002,SERVICIO NOTARIAL,2
eco_new_acti_691003,691003,CONSERVADOR DE BIENES RAÍCES,2
eco_new_acti_691004,691004,RECEPTORES JUDICIALES,2
eco_new_acti_691009,691009,SERVICIOS DE ARBITRAJE; SÍNDICOS DE QUIEBRA Y PERITOS JUDICIALES; OTRAS ACTIVIDADES JURÍDICAS N.C.P.,2
eco_new_acti_692000,692000,"ACTIVIDADES DE CONTABILIDAD, TENEDURÍA DE LIBROS Y AUDITORÍA; CONSULTORÍA FISCAL",2
eco_new_acti_701000,701000,ACTIVIDADES DE OFICINAS PRINCIPALES,nd
eco_new_acti_702000,702000,ACTIVIDADES DE CONSULTORÍA DE GESTIÓN,nd
eco_new_acti_711001,711001,"SERVICIOS DE ARQUITECTURA (DISEÑO DE EDIFICIOS, DIBUJO DE PLANOS DE CONSTRUCCIÓN, ENTRE OTROS)",2
eco_new_acti_711002,711002,EMPRESAS DE SERVICIOS DE INGENIERÍA Y ACTIVIDADES CONEXAS DE CONSULTORÍA TÉCNICA,1
eco_new_acti_711003,711003,SERVICIOS PROFESIONALES DE INGENIERÍA Y ACTIVIDADES CONEXAS DE CONSULTORÍA TÉCNICA,2
eco_new_acti_712001,712001,ACTIVIDADES DE PLANTAS DE REVISIÓN TÉCNICA PARA VEHÍCULOS AUTOMOTORES,1
eco_new_acti_712009,712009,OTROS SERVICIOS DE ENSAYOS Y ANÁLISIS TÉCNICOS (EXCEPTO ACTIVIDADES DE PLANTAS DE REVISIÓN TÉCNICA),1
eco_new_acti_721000,721000,INVESTIGACIONES Y DESARROLLO EXPERIMENTAL EN EL CAMPO DE LAS CIENCIAS NATURALES Y LA INGENIERÍA,1
eco_new_acti_722000,722000,INVESTIGACIONES Y DESARROLLO EXPERIMENTAL EN EL CAMPO DE LAS CIENCIAS SOCIALES Y LAS HUMANIDADES,1
eco_new_acti_731001,731001,SERVICIOS DE PUBLICIDAD PRESTADOS POR EMPRESAS,1
eco_new_acti_731002,731002,SERVICIOS DE PUBLICIDAD PRESTADOS POR PROFESIONALES,2
eco_new_acti_732000,732000,ESTUDIOS DE MERCADO Y ENCUESTAS DE OPINIÓN PÚBLICA,nd
eco_new_acti_741001,741001,ACTIVIDADES DE DISEÑO DE VESTUARIO,nd
eco_new_acti_741002,741002,ACTIVIDADES DE DISEÑO Y DECORACIÓN DE INTERIORES,nd
eco_new_acti_741009,741009,OTRAS ACTIVIDADES ESPECIALIZADAS DE DISEÑO N.C.P.,nd
eco_new_acti_742001,742001,"SERVICIOS DE REVELADO, IMPRESIÓN Y AMPLIACIÓN DE FOTOGRAFÍAS",1
eco_new_acti_742002,742002,SERVICIOS Y ACTIVIDADES DE FOTOGRAFÍA,nd
eco_new_acti_742003,742003,SERVICIOS PERSONALES DE FOTOGRAFÍA,2
eco_new_acti_749001,749001,ASESORÍA Y GESTIÓN EN LA COMPRA O VENTA DE PEQUEÑAS Y MEDIANAS EMPRESAS,1
eco_new_acti_749002,749002,SERVICIOS DE TRADUCCIÓN E INTERPRETACIÓN PRESTADOS POR EMPRESAS,1
eco_new_acti_749003,749003,SERVICIOS PERSONALES DE TRADUCCIÓN E INTERPRETACIÓN,2
eco_new_acti_749004,749004,"ACTIVIDADES DE AGENCIAS Y AGENTES DE REPRESENTACIÓN DE ACTORES, DEPORTISTAS Y OTRAS FIGURAS PÚBLICAS",1
eco_new_acti_749009,749009,"OTRAS ACTIVIDADES PROFESIONALES, CIENTÍFICAS Y TÉCNICAS N.C.P.",2
eco_new_acti_750001,750001,ACTIVIDADES DE CLÍNICAS VETERINARIAS,1
eco_new_acti_750002,750002,"ACTIVIDADES DE VETERINARIOS, TÉCNICOS Y OTRO PERSONAL AUXILIAR, PRESTADOS DE FORMA INDEPENDIENTE",2
eco_new_acti_771000,771000,ALQUILER DE VEHÍCULOS AUTOMOTORES SIN CHOFER,1
eco_new_acti_772100,772100,ALQUILER Y ARRENDAMIENTO DE EQUIPO RECREATIVO Y DEPORTIVO,1
eco_new_acti_772200,772200,ALQUILER DE CINTAS DE VIDEO Y DISCOS,1
eco_new_acti_772900,772900,ALQUILER DE OTROS EFECTOS PERSONALES Y ENSERES DOMÉSTICOS (INCLUYE MOBILIARIO PARA EVENTOS),1
eco_new_acti_773001,773001,"ALQUILER DE EQUIPOS DE TRANSPORTE SIN OPERARIO, EXCEPTO VEHÍCULOS AUTOMOTORES",1
eco_new_acti_773002,773002,"ALQUILER DE MAQUINARIA Y EQUIPO AGROPECUARIO, FORESTAL, DE CONSTRUCCIÓN E ING. CIVIL, SIN OPERARIOS",1
eco_new_acti_773003,773003,"ALQUILER DE MAQUINARIA Y EQUIPO DE OFICINA, SIN OPERARIOS (SIN SERVICIO ADMINISTRATIVO)",1
eco_new_acti_773009,773009,ALQUILER DE OTROS TIPOS DE MAQUINARIAS Y EQUIPOS SIN OPERARIO N.C.P.,1
eco_new_acti_774000,774000,"ARRENDAMIENTO DE PROPIEDAD INTELECTUAL Y SIMILARES, EXCEPTO OBRAS PROTEGIDAS POR DERECHOS DE AUTOR",1
eco_new_acti_781000,781000,ACTIVIDADES DE AGENCIAS DE EMPLEO,1
eco_new_acti_782000,782000,ACTIVIDADES DE AGENCIAS DE EMPLEO TEMPORAL (INCLUYE EMPRESAS DE SERVICIOS TRANSITORIOS),1
eco_new_acti_783000,783000,OTRAS ACTIVIDADES DE DOTACIÓN DE RECURSOS HUMANOS,1
eco_new_acti_791100,791100,ACTIVIDADES DE AGENCIAS DE VIAJES,1
eco_new_acti_791200,791200,ACTIVIDADES DE OPERADORES TURÍSTICOS,1
eco_new_acti_799000,799000,"OTROS SERVICIOS DE RESERVAS Y ACTIVIDADES CONEXAS (INCLUYE VENTA DE ENTRADAS PARA TEATRO, Y OTROS)",1
eco_new_acti_801001,801001,SERVICIOS DE SEGURIDAD PRIVADA PRESTADOS POR EMPRESAS,1
eco_new_acti_801002,801002,SERVICIO DE TRANSPORTE DE VALORES EN VEHÍCULOS BLINDADOS,1
eco_new_acti_801003,801003,SERVICIOS DE SEGURIDAD PRIVADA PRESTADOS POR INDEPENDIENTES,2
eco_new_acti_802000,802000,ACTIVIDADES DE SERVICIOS DE SISTEMAS DE SEGURIDAD (INCLUYE SERVICIOS DE CERRAJERÍA),1
eco_new_acti_803000,803000,ACTIVIDADES DE INVESTIGACIÓN (INCLUYE ACTIVIDADES DE INVESTIGADORES Y DETECTIVES PRIVADOS),nd
eco_new_acti_811000,811000,ACTIVIDADES COMBINADAS DE APOYO A INSTALACIONES,nd
eco_new_acti_812100,812100,LIMPIEZA GENERAL DE EDIFICIOS,1
eco_new_acti_812901,812901,"DESRATIZACIÓN, DESINFECCIÓN Y EXTERMINIO DE PLAGAS NO AGRÍCOLAS",1
eco_new_acti_812909,812909,OTRAS ACTIVIDADES DE LIMPIEZA DE EDIFICIOS E INSTALACIONES INDUSTRIALES N.C.P.,1
eco_new_acti_813000,813000,"ACTIVIDADES DE PAISAJISMO, SERVICIOS DE JARDINERÍA Y SERVICIOS CONEXOS",1
eco_new_acti_821100,821100,ACTIVIDADES COMBINADAS DE SERVICIOS ADMINISTRATIVOS DE OFICINA,1
eco_new_acti_821900,821900,"FOTOCOPIADO, PREPARACIÓN DE DOCUMENTOS Y OTRAS ACTIVIDADES ESPECIALIZADAS DE APOYO DE OFICINA",1
eco_new_acti_822000,822000,ACTIVIDADES DE CALL-CENTER,1
eco_new_acti_823000,823000,ORGANIZACIÓN DE CONVENCIONES Y EXPOSICIONES COMERCIALES,1
eco_new_acti_829110,829110,ACTIVIDADES DE AGENCIAS DE COBRO,1
eco_new_acti_829120,829120,ACTIVIDADES DE AGENCIAS DE CALIFICACIÓN CREDITICIA,1
eco_new_acti_829200,829200,ACTIVIDADES DE ENVASADO Y EMPAQUETADO,1
eco_new_acti_829900,829900,OTRAS ACTIVIDADES DE SERVICIOS DE APOYO A LAS EMPRESAS N.C.P.,1
eco_new_acti_841100,841100,ACTIVIDADES DE LA ADMINISTRACIÓN PÚBLICA EN GENERAL,1
eco_new_acti_841200,841200,"REGULACIÓN DE LAS ACTIVIDADES DE ORGANISMOS QUE PRESTAN SERVICIOS SANITARIOS, EDUCATIVOS, CULTURALES",1
eco_new_acti_841300,841300,REGULACIÓN Y FACILITACIÓN DE LA ACTIVIDAD ECONÓMICA,1
eco_new_acti_842100,842100,RELACIONES EXTERIORES,1
eco_new_acti_842200,842200,ACTIVIDADES DE DEFENSA,1
eco_new_acti_842300,842300,ACTIVIDADES DE MANTENIMIENTO DEL ORDEN PÚBLICO Y DE SEGURIDAD,1
eco_new_acti_843010,843010,FONDO NACIONAL DE SALUD (FONASA),1
eco_new_acti_843020,843020,INSTITUTO DE PREVISIÓN SOCIAL (IPS),1
eco_new_acti_843090,843090,OTROS PLANES DE SEGURIDAD SOCIAL DE AFILIACIÓN OBLIGATORIA N.C.P.,1
eco_new_acti_850011,850011,ENSEÑANZA PREESCOLAR PÚBLICA,1
eco_new_acti_850012,850012,"ENSEÑANZA PRIMARIA, SECUNDARIA CIENTÍFICO HUMANISTA Y TÉCNICO PROFESIONAL PÚBLICA",1
eco_new_acti_850021,850021,ENSEÑANZA PREESCOLAR PRIVADA,1
eco_new_acti_850022,850022,"ENSEÑANZA PRIMARIA, SECUNDARIA CIENTÍFICO HUMANISTA Y TÉCNICO PROFESIONAL PRIVADA",1
eco_new_acti_853110,853110,ENSEÑANZA SUPERIOR EN UNIVERSIDADES PÚBLICAS,1
eco_new_acti_853120,853120,ENSEÑANZA SUPERIOR EN UNIVERSIDADES PRIVADAS,1
eco_new_acti_853201,853201,ENSEÑANZA SUPERIOR EN INSTITUTOS PROFESIONALES,1
eco_new_acti_853202,853202,ENSEÑANZA SUPERIOR EN CENTROS DE FORMACIÓN TÉCNICA,1
