id,code,name,tax_category
eco_new_acti_854100,854100,ENSEÑANZA DEPORTIVA Y RECREATIVA,1
eco_new_acti_854200,854200,ENSEÑANZA CULTURAL,2
eco_new_acti_854901,854901,ENSEÑANZA PREUNIVERSITARIA,1
eco_new_acti_854902,854902,SERVICIOS PERSONALES DE EDUCACIÓN,2
eco_new_acti_854909,854909,OTROS TIPOS DE ENSEÑANZA N.C.P.,1
eco_new_acti_855000,855000,ACTIVIDADES DE APOYO A LA ENSEÑANZA,nd
eco_new_acti_861010,861010,ACTIVIDADES DE HOSPITALES Y CLÍNICAS PÚBLICAS,1
eco_new_acti_861020,861020,ACTIVIDADES DE HOSPITALES Y CLÍNICAS PRIVADAS,1
eco_new_acti_862010,862010,ACTIVIDADES DE CENTROS DE SALUD MUNICIPALIZADOS (SERVICIOS DE SALUD PÚBLICA),1
eco_new_acti_862021,862021,CENTROS MÉDICOS PRIVADOS (ESTABLECIMIENTOS DE ATENCIÓN AMBULATORIA),1
eco_new_acti_862022,862022,CENTROS DE ATENCIÓN ODONTOLÓGICA PRIVADOS (ESTABLECIMIENTOS DE ATENCIÓN AMBULATORIA),1
eco_new_acti_862031,862031,SERVICIOS DE MÉDICOS PRESTADOS DE FORMA INDEPENDIENTE,2
eco_new_acti_862032,862032,SERVICIOS DE ODONTÓLOGOS PRESTADOS DE FORMA INDEPENDIENTE,2
eco_new_acti_869010,869010,ACTIVIDADES DE LABORATORIOS CLÍNICOS Y BANCOS DE SANGRE,1
eco_new_acti_869091,869091,OTROS SERVICIOS DE ATENCIÓN DE LA SALUD HUMANA PRESTADOS POR EMPRESAS,1
eco_new_acti_869092,869092,SERVICIOS PRESTADOS DE FORMA INDEPENDIENTE POR OTROS PROFESIONALES DE LA SALUD,2
eco_new_acti_871000,871000,ACTIVIDADES DE ATENCIÓN DE ENFERMERÍA EN INSTITUCIONES,1
eco_new_acti_872000,872000,ACTIVIDADES DE ATENCIÓN EN INSTITUCIONES PARA PERSONAS CON DISCAPACIDAD MENTAL Y TOXICÓMANOS,1
eco_new_acti_873000,873000,ACTIVIDADES DE ATENCIÓN EN INSTITUCIONES PARA PERSONAS DE EDAD Y PERSONAS CON DISCAPACIDAD FÍSICA,1
eco_new_acti_879000,879000,OTRAS ACTIVIDADES DE ATENCIÓN EN INSTITUCIONES,1
eco_new_acti_881000,881000,ACTIVIDADES DE ASISTENCIA SOCIAL SIN ALOJAMIENTO PARA PERSONAS DE EDAD Y PERSONAS CON DISCAPACIDAD,1
eco_new_acti_889000,889000,OTRAS ACTIVIDADES DE ASISTENCIA SOCIAL SIN ALOJAMIENTO,1
eco_new_acti_900001,900001,"SERVICIOS DE PRODUCCIÓN DE OBRAS DE TEATRO, CONCIERTOS, ESPECTÁCULOS DE DANZA, OTRAS PROD. ESCÉNICAS",1
eco_new_acti_900002,900002,"ACTIVIDADES ARTÍSTICAS REALIZADAS POR BANDAS DE MÚSICA, COMPAÑÍAS DE TEATRO, CIRCENSES Y SIMILARES",1
eco_new_acti_900003,900003,"ACTIVIDADES DE ARTISTAS REALIZADAS DE FORMA INDEPENDIENTE: ACTORES, MÚSICOS, ESCRITORES, ENTRE OTROS",2
eco_new_acti_900004,900004,SERVICIOS PRESTADOS POR PERIODISTAS INDEPENDIENTES,2
eco_new_acti_900009,900009,"OTRAS ACTIVIDADES CREATIVAS, ARTÍSTICAS Y DE ENTRETENIMIENTO N.C.P.",nd
eco_new_acti_910100,910100,ACTIVIDADES DE BIBLIOTECAS Y ARCHIVOS,1
eco_new_acti_910200,910200,"ACTIVIDADES DE MUSEOS, GESTIÓN DE LUGARES Y EDIFICIOS HISTÓRICOS",1
eco_new_acti_910300,910300,"ACTIVIDADES DE JARDINES BOTÁNICOS, ZOOLÓGICOS Y RESERVAS NATURALES",1
eco_new_acti_920010,920010,ACTIVIDADES DE CASINOS DE JUEGOS,1
eco_new_acti_920090,920090,OTRAS ACTIVIDADES DE JUEGOS DE AZAR Y APUESTAS N.C.P.,1
eco_new_acti_931101,931101,HIPÓDROMOS,1
eco_new_acti_931102,931102,GESTIÓN DE SALAS DE BILLAR; GESTIÓN DE SALAS DE BOLOS (BOWLING),1
eco_new_acti_931109,931109,GESTIÓN DE OTRAS INSTALACIONES DEPORTIVAS N.C.P.,1
eco_new_acti_931201,931201,ACTIVIDADES DE CLUBES DE FÚTBOL AMATEUR Y PROFESIONAL,1
eco_new_acti_931209,931209,ACTIVIDADES DE OTROS CLUBES DEPORTIVOS N.C.P.,1
eco_new_acti_931901,931901,PROMOCIÓN Y ORGANIZACIÓN DE COMPETENCIAS DEPORTIVAS,1
eco_new_acti_931909,931909,OTRAS ACTIVIDADES DEPORTIVAS N.C.P.,1
eco_new_acti_932100,932100,ACTIVIDADES DE PARQUES DE ATRACCIONES Y PARQUES TEMÁTICOS,1
eco_new_acti_932901,932901,GESTIÓN DE SALAS DE POOL; GESTIÓN (EXPLOTACIÓN) DE JUEGOS ELECTRÓNICOS,1
eco_new_acti_932909,932909,OTRAS ACTIVIDADES DE ESPARCIMIENTO Y RECREATIVAS N.C.P.,nd
eco_new_acti_941100,941100,ACTIVIDADES DE ASOCIACIONES EMPRESARIALES Y DE EMPLEADORES,1
eco_new_acti_941200,941200,ACTIVIDADES DE ASOCIACIONES PROFESIONALES,1
eco_new_acti_942000,942000,ACTIVIDADES DE SINDICATOS,1
eco_new_acti_949100,949100,ACTIVIDADES DE ORGANIZACIONES RELIGIOSAS,1
eco_new_acti_949200,949200,ACTIVIDADES DE ORGANIZACIONES POLÍTICAS,1
eco_new_acti_949901,949901,ACTIVIDADES DE CENTROS DE MADRES,1
eco_new_acti_949902,949902,ACTIVIDADES DE CLUBES SOCIALES,1
eco_new_acti_949903,949903,FUNDACIONES Y CORPORACIONES; ASOCIACIONES QUE PROMUEVEN ACTIVIDADES CULTURALES O RECREATIVAS,1
eco_new_acti_949904,949904,CONSEJO DE ADMINISTRACIÓN DE EDIFICIOS Y CONDOMINIOS,1
eco_new_acti_949909,949909,ACTIVIDADES DE OTRAS ASOCIACIONES N.C.P.,1
eco_new_acti_951100,951100,REPARACIÓN DE COMPUTADORES Y EQUIPO PERIFÉRICO,1
eco_new_acti_951200,951200,REPARACIÓN DE EQUIPO DE COMUNICACIONES (INCLUYE LA REPARACIÓN TELÉFONOS CELULARES),1
eco_new_acti_952100,952100,REPARACIÓN DE APARATOS ELECTRÓNICOS DE CONSUMO (INCLUYE APARATOS DE TELEVISIÓN Y RADIO),1
eco_new_acti_952200,952200,"REPARACIÓN DE APARATOS DE USO DOMÉSTICO, EQUIPO DOMÉSTICO Y DE JARDINERÍA",1
eco_new_acti_952300,952300,REPARACIÓN DE CALZADO Y DE ARTÍCULOS DE CUERO,1
eco_new_acti_952400,952400,REPARACIÓN DE MUEBLES Y ACCESORIOS DOMÉSTICOS,1
eco_new_acti_952900,952900,REPARACIÓN DE OTROS EFECTOS PERSONALES Y ENSERES DOMÉSTICOS,1
eco_new_acti_960100,960100,"LAVADO Y LIMPIEZA, INCLUIDA LA LIMPIEZA EN SECO, DE PRODUCTOS TEXTILES Y DE PIEL",1
eco_new_acti_960200,960200,PELUQUERÍA Y OTROS TRATAMIENTOS DE BELLEZA,nd
eco_new_acti_960310,960310,SERVICIOS FUNERARIOS,1
eco_new_acti_960320,960320,SERVICIOS DE CEMENTERIOS,1
eco_new_acti_960901,960901,"SERVICIOS DE ADIESTRAMIENTO, GUARDERÍA, PELUQUERÍA, PASEO DE MASCOTAS (EXCEPTO ACT. VETERINARIAS)",1
eco_new_acti_960902,960902,"ACTIVIDADES DE SALONES DE MASAJES, BAÑOS TURCOS, SAUNAS, SERVICIO DE BAÑOS PÚBLICOS",1
eco_new_acti_960909,960909,OTRAS ACTIVIDADES DE SERVICIOS PERSONALES N.C.P.,2
eco_new_acti_970000,970000,ACTIVIDADES DE LOS HOGARES COMO EMPLEADORES DE PERSONAL DOMÉSTICO,nd
eco_new_acti_990000,990000,ACTIVIDADES DE ORGANIZACIONES Y ÓRGANOS EXTRATERRITORIALES,1
